target_idx,target_sent,sents_intrp_all_bins,sim_intrp_all_bins,base_PPL,local_unintrp_PPL,local_intrp_PPL_all_bins,global_unintrp_PPL,global_intrp_PPL_all_bins,base_entropy,local_unintrp_entropy,local_intrp_entropy_all_bins,global_unintrp_entropy,global_intrp_entropy_all_bins
12,"Several demographic factors predict how well a marriage might fare, according to NCHS data.","[['he was to try to make no converts ; ;', ""This was Boniface's monumental tactlessness ."", 'The performances were assured , communicative and pleasingly informal .', 'There was nothing he could do but walk .'], ['That tap had a slight bangish quality .', 'For the old preacher who had been there twenty-five years was dead , and the city mourned him .', 'Except for that one morning .', 'The system tended to break down during the war , but was reactivated ; ;'], ['He said tensely , `` All right .', 'Use this section to plan now to make the most of your vacation in photogenic America .', 'Nevertheless , Montgomery has stated courageously and wisely the crisis of the Western world .', 'The old man gave the room a stare in leaving ; ;'], ['This does not mean , though , that a red wine improves with prolonged aeration : there is a reasonable limit -- and wines kept over to the next meal or the next day , after they have once been opened , are never as good .', ""As the South begins another school year , national and even world attention is directed at the region's slow progress toward racial equality in the public schools ."", 'But do the plays deal with the same facets of experience religion must also deal with ? ?', 'I think you fell short of the real truth in the matter : That the move is working out through the fine cooperation of the staff and all the people .'], ['When served in a psychological atmosphere that allows young bodies to assimilate the greatest good from what they eat because they are free from tension , a foundation is laid for a high level of health that releases the children from physical handicaps to participate with enjoyment in the work assignments , the athletic programs and the most important phase , the educational opportunities .', ""In this model , we abstract from all non-wage sources of cost changes , so that the `` public-limit price '' only rises as the wage rate rises ."", 'It was on the tenth day after the wedding ( how could it have been so soon ? ?', ""What is wrong with advertising is not only that it is an `` outrage , an assault on people's mental privacy '' or that it is a major cause for a wasteful economy of abundance or that it contains a coercive tendency ( which is closer to the point ) .""], ['Are you following competition willy-nilly -- trying to match dollar for dollar -- or are you experimenting with new means for reaching and influencing consumers ? ?', 'The Ifni crisis in the fall of 1957 postponed further consideration of elections , but French consultants were called in and notices of further investigation appeared from time to time .', 'There are several causes for this , one being rapid economic development with increasing numbers of of middle-class positions requiring engineering or scientific training .', ""Affirmatively Baker worked on the premise that `` young men spontaneously prefer to be decent , and that opportunities for wholesome recreation are the best possible cure for irregularities in conduct which arise from idleness and the baser temptations '' .""]]","[[-0.16987383365631104, -0.16966299712657928, -0.1693354696035385, -0.1686445027589798], [-0.10210372507572174, -0.10203897953033447, -0.10193433612585068, -0.10192881524562836], [-0.0007076337933540344, -0.000631328672170639, -0.0005505885928869247, -0.0005306880921125412], [0.0991184413433075, 0.09917910397052765, 0.09921394288539886, 0.0992150604724884], [0.19435030221939087, 0.19446000456809998, 0.1944921612739563, 0.19455930590629578], [0.27166590094566345, 0.2716975808143616, 0.27325963973999023, 0.2742612659931183]]",224.36534118652344,183.23153686523438,"[189.6687774658203, 183.3442840576172, 193.2674102783203, 172.76177978515625, 170.85198974609375, 175.9164276123047]",162.0922088623047,"[170.7171173095703, 171.2840576171875, 176.33030700683594, 168.25572204589844, 162.18289184570312, 169.0951690673828]",3.660825729370117,3.682405710220337,"[3.668158769607544, 3.6865692138671875, 3.652128219604492, 3.6564462184906006, 3.6909446716308594, 3.6888132095336914]",3.643792152404785,"[3.6509757041931152, 3.653137683868408, 3.649657964706421, 3.627267837524414, 3.685244560241699, 3.6834001541137695]"
52,What does work?,"[['This is nothing more than a dash .', 'This dirty coward just admitted killing Arbuckle .', 'Traces of oil on green tissue ? ?', ""I know the killer , have the only road off the peninsula covered '' .""], ['Mercer never noticed the needle touch his arm .', 'Actual mileage allowances are well-administered and not unduly expensive for the state .', 'The policeman walked on , but he looked back once .', 'The farmer must get up early , and , at times , work late at night .'], [""In his Message of December 2 , 1862 , he put his purpose and his policy in these words -- which I would call the Lincoln Law of Liberty-and-Union : `` In giving freedom to the slave , we assure freedom to the free '' ."", 'This is the feed state of the subsequent Af stages which , according to the principle of optimality , must use an optimal Af-stage policy with respect to this state .', 'She looked out at the corn field , the great green deep acres of it rolled out like the sea in the field beyond the whitewashed fence bordering the grounds .', 'Early in August we broke ground for a new $3,500,000 plant in Warwick , Rhode Island , which will house our textile and coil winding machinery operations .'], [""Only the memory of previous hurt , bewilderment and perplexity made him sure that if he did not ask B'dikkat when he , Mercer , was happy , the answer would no longer be available when he needed it ."", 'She would try to see over the bulge of her cheeks and somewhat under her teeth to the place where she was biting .', 'Their great error is to mingle the responses typical of each of the three types of change .', 'The consummation should come at the next stopping place when they have a long private time ( day or night ) for that purpose .'], ['All she did was write me a pleasant little note about how it was beautiful while it lasted but that now life had parted our ways and it was goodbye forever .', ""During the decade that followed , the common man , as that piece put it , grew uncomfortable as the Voice of God and fled from behind Saint Woodrow ( Wilson ) only to learn from Science , to his shocked relief that after all there was no God he had to speak for and that he was just an animal anyhow -- that there was a chemical formula for him , and that too much couldn't be expected of him ."", ""Over a relatively short period of time , usually about four to twelve weeks , the worker must be able to shift the focus , back and forth , between immediate external stressful exigencies ( `` precipitating stress '' ) and the key , emotionally relevant issues ( `` underlying problem '' ) which are , often in a dramatic preconscious breakthrough , reactivated by the crisis situation , and hence once again amenable to resolution ."", 'On this issue , then , as on so many in these months , Steele and Swift took rigidly opposed points of view .'], [""To be Katharine Ross , and work in a nicer shop somewhere , at a little more money so she could have prettier clothes , and learn ladies' manners and all like that , and get to know different people than up to now , not just the ones like her here , with foreign-sounding names , the ones went to the same church and -- Different place , different job , different people , she'd be all different too ."", 'Within themselves , just as people , my friends were often tortured and unappeasably bitter about being the offspring of this unhappily unique-ingrown-screwedup breed ; ;', 'The children looked at each other and sagged their bottoms down even more comfortably than ever .', 'At the same time that religion exercises a conserving influence , it also energizes and motivates both individuals and groups .']]","[[-0.1805783361196518, -0.179317906498909, -0.1771688163280487, -0.17567753791809082], [-0.10193502902984619, -0.10188708454370499, -0.10185889899730682, -0.10185670107603073], [-0.0005862945690751076, -0.0005798395723104477, -0.0005445722490549088, -0.0005213096737861633], [0.09908820688724518, 0.09919291734695435, 0.09926071763038635, 0.09927700459957123], [0.19394220411777496, 0.19406144320964813, 0.19414938986301422, 0.1948450654745102], [0.2848201394081116, 0.28486859798431396, 0.28637877106666565, 0.2902092933654785]]",585.595703125,114.21508026123047,"[104.83584594726562, 114.41060638427734, 92.6253662109375, 114.67610931396484, 113.0625228881836, 135.0227508544922]",124.12676239013672,"[112.79915618896484, 125.99908447265625, 93.13525390625, 127.66566467285156, 115.16682434082031, 127.3109359741211]",4.040797710418701,4.383244037628174,"[4.405996322631836, 4.392146110534668, 4.303784370422363, 4.364886283874512, 4.357556343078613, 4.334438800811768]",4.5748138427734375,"[4.544694900512695, 4.575427532196045, 4.369044303894043, 4.496103763580322, 4.49022102355957, 4.491791725158691]"
72,"Couples' communication patterns proved to be more predictive of divorce than their reported levels of commitment, personality assessments and stress (, 2012).","[['The description of the Siddo syntax was very restricted .', 'The Peace Corps offers an opportunity to bring home to the United States the problems of the world as well as an opportunity to meet urgent host country needs for trained manpower .', 'Is the land suited to the crops you intend to raise ? ?', 'Riverside residents would go to the Seekonk assembly point .'], ['Hydrogen is just as plentiful as uranium is scarce .', 'For thirty minutes , Stanley Gilborn stood there .', 'For his workmanship we are , created in Christ Jesus .', 'It is the wages of sin , and its sting is the law .'], ['I could see the blood running down his chest .', ""You know , Bang-Jensen characterized your Committee as having prejudged his case '' ."", '-- The New York University Board of Trustees has elected the youngest president in the 130-year history of NYU , it was announced yesterday .', 'Probably his horse would be close to where he was hiding .'], ['He had always known how to find a bed , and on his own terms .', 'Almost every film bearing the imprimatur of Hollywood is physically authentic -- in fact , impeccably so .', 'No doubt the underlying idea was to show that for all the elegance and artistry that have distinguished its presentations thus far , it too could give a circus if it pleased .', 'Suddenly the lash stopped fighting the air and she heard Pile of Clouds say in his high , quavering voice :'], [""More than once I was confronted by professional gamblers , `` bookies '' , loan `` sharks '' , gangsters , `` thugs '' and `` finger men '' -- people of a class I did not even know existed -- to repay my husband's staggering losses , `` or else '' I shuddered to think that someone so dear to me could even associate with such a sinister milieu ."", 'On the other side of the ledger is the fact that he did see his niece and the woman with whom she was staying .', ""Pip's abject leave-taking of Miss Havisham , during which he kneels to kiss her hand , signalizes his homage to a supposed patroness who seems to be opening up for him a new world of glamour ; ;"", 'almost everyone , on first hearing one of his own sessions on tape , expressed some desire to take the whole thing over again .'], ['Sometimes a burst of aggressiveness will sweep over a man -- or his wife -- because he or she feels age creeping up .', 'If women replaced people , it would normally have dominant stress .', 'The battle of the Naktong River is just one example of how the battle cry and the spirit of The Fighting Seventh have paid off .', 'Mary was free to marry again , not knowing that the Sturch had secretly given her a divorce , thinking that death had dissolved her marriage .']]","[[-0.15987810492515564, -0.15981929004192352, -0.15903963148593903, -0.15893566608428955], [-0.10404375195503235, -0.1039634719491005, -0.10391726344823837, -0.10380761325359344], [-0.0007334933616220951, -0.000687778927385807, -0.0005944147706031799, -0.0005412176251411438], [0.09944581985473633, 0.09945929795503616, 0.09950457513332367, 0.09952510893344879], [0.19488190114498138, 0.1951795071363449, 0.19536086916923523, 0.19537605345249176], [0.2791181206703186, 0.2817211449146271, 0.2817487120628357, 0.281900554895401]]",211.8409881591797,163.84445190429688,"[159.92739868164062, 163.70802307128906, 160.62545776367188, 181.74658203125, 171.11851501464844, 177.74758911132812]",139.5577392578125,"[142.38922119140625, 142.49830627441406, 146.05824279785156, 146.48712158203125, 159.22096252441406, 148.1968994140625]",4.0327324867248535,3.8178951740264893,"[3.8297441005706787, 3.8261170387268066, 3.865817070007324, 3.854400634765625, 3.8057799339294434, 3.79091215133667]",3.8796885013580322,"[3.844442844390869, 3.8695414066314697, 3.8734240531921387, 3.8732736110687256, 3.8195347785949707, 3.818983793258667]"
108,"""That, to me, is just very backwards.""","[['inculcated with the primacy of group acceptance and group standards ; ;', 'The two women babbled and crooned at him .', 'Customary Senate rules were ignored in order to speed approval of the Negro leader as administrator of the housing and home finance agency .', 'The dromozoa fed him in their mysterious way ; ;'], ['The anode plug ( Figure 2 ) was inserted into a carbon anode holder .', 'An eyewitness recalled how awkward the red-turbaned colored women appeared as they curtseyed in the church doorway , and the diffidence the former slaves displayed while they listened to the few words that declared them free .', 'The illustration ( fig. 11 ) shows this shelter with the roof at ground level and mounded over .', 'In Greek tragedy as in Shakespeare , mortal actions are encompassed by forces which transcend man .'], ['Not to repel injury and uphold and improve pax-ordo means not simply to accept the misshapen order and injustice that challenges it at the moment , but also to start down the steep slope along which justice can find no place whereon to stand .', 'Emerson the previous day .', 'The bank which held the mortgage on the old church declared that the interest was considerably in arrears , and the real estate people said flatly that the land across the river was being held for an eventual development for white working people who were coming in , and that none would be sold to colored folk .', ""The Banks for Cooperatives were established to provide a permanent source of credit on a sound basis for farmers' cooperatives .""], ["") He smiled , and said a word or two to the interpreter , who turned to me , `` The President wonders where you are going after you leave Taipei '' ? ?"", 'To figure the value of the farm in terms of investment income , divide the estimated annual net farm income by the percentage that you could expect to get in interest if the money were invested in some other way .', 'Utopian communism applies to all Utopians .', 'However , in recent decades , for what doubtless are multiple reasons , an unannounced but nonetheless readily observable shift has occurred in both facets of national activity .'], [""The CTCA program of activities was profuse : William Farnum and Mary Pickford on the screen , Elsie Janis and Harry Lauder on the stage , books provided by the American Library Association , full equipment for games and sports -- except that no `` bones '' were furnished for the all-time favorite pastime played on any floor and known as `` African golf '' ."", 'We have 2,500 such projects , and they add up to a lot more than just roads and wells and schools .', ""They were constantly assuring you that you were one of the world's great guys ."", 'In the midst of a great busy city , people take time to enjoy the beauty of natural reflection of artificial light .'], ['Some churches have six or more training sessions of two hours each , generally held on Sunday night or during the week .', ""Regulars drive out their own cars '' ."", 'Rates for American cars are somewhat higher , ranging from about $8.00 a day up to $14.00 a day for a Chevrolet Convertible , but the rate per kilometer driven is roughly the same as for the larger European models .', 'Everyone knows that private detectives in real life are not like Sam Spade and Pat Novak , but the real and the imaginary musician are closely linked .']]","[[-0.1666017472743988, -0.16566386818885803, -0.16542977094650269, -0.1652209460735321], [-0.10249543935060501, -0.10240501910448074, -0.10230642557144165, -0.10219522565603256], [-0.0006330385804176331, -0.0006210524588823318, -0.0006185993552207947, -0.0006095878779888153], [0.0990431010723114, 0.0991637334227562, 0.09925093501806259, 0.09926117956638336], [0.19544607400894165, 0.19554026424884796, 0.19565199315547943, 0.19596223533153534], [0.2726302742958069, 0.2730465233325958, 0.27372244000434875, 0.2739502489566803]]",217.0387420654297,189.35926818847656,"[211.95797729492188, 174.59756469726562, 223.55352783203125, 181.64695739746094, 185.79115295410156, 206.39158630371094]",222.7166748046875,"[209.46632385253906, 206.9718780517578, 212.19989013671875, 189.9730987548828, 190.2311553955078, 210.41775512695312]",3.893815040588379,3.758248805999756,"[3.8040695190429688, 3.7926878929138184, 3.7990128993988037, 3.739527463912964, 3.7397124767303467, 3.7948355674743652]",3.8363685607910156,"[3.767346143722534, 3.865619659423828, 3.8413054943084717, 3.8094425201416016, 3.7547097206115723, 3.844550848007202]"
110,"""What makes love last is cherishing your partner and feeling lucky that you have this person in your life,"" he says.","[['Virginia treated him with attention and tried to tempt his appetite with special food : biscuits , cookies , candies -- the result of devoted hours in the tiled kitchen .', 'By 1898 , rustling losses had been driven down to the lowest level ever seen in Wyoming .', 'We have Alfredo Antonini to thank for this healthy change of diet as well as the lively performances of the Stadium Symphony .', 'What is interesting is that his positive qualifications for the post were revealed only as a kind of tail to his candidacy .'], ['Casey heard the click of the distant receiver before he could open his mouth , and it took him no more than three seconds to make his decision .', 'The sharp wind slapped at him and his feet felt like ice as the snow penetrated the holes of his shoes , his only ones , now patched with folded parchment .', ""During the Brown trial , however , the state's most powerful Democratic newspaper , the Providence Daily Post , stated that Brown was a murderer , a man of blood , and that he and his associates , with the assistance of Republicans and Abolitionists , had plotted not only the liberation of the slaves but also the overthrow of state and federal governments ."", ""As it was , while Central wrangled among itself , Robert Tanner sneaked out of the pilots' barracks , out to the field and over to Helva's slim metal hull .""], [""`` No '' , Susan said , grappling with her outsized armload of dolls with a Scrooge-like effect ."", 'Since emotional reactions in the higher vertebrates depend on individual experience and are aroused in man , in addition , by complex symbols , one would expect that the hypothalamus could be excited from the cortex .', 'It was nevertheless almost incredible that four years after Yalta there should be a complete split over Germany , with hot heads on both sides planning to use the Germans against their former allies , and with Nazi-minded Germans expecting to recover their power by fighting on one side or the other .', 'Estimate the value of the produce at normal prices .'], ['He was very rude .', ""Obviously Sloan's early years were influenced by his close friend Robert Henri ."", 'Study surface of clay for defects or desired corrections .', 'Membership is open to any woman student in the College .'], ['The flowers will be huge .', ""But you aren't exactly the model of a surveyor , you know ."", 'The men of your company would not allow your name dishonored .', 'It had gone big with the Hollywood girls when he told them his sister was an editor of Art And Apparel .'], ['You look like a tweedy Englishman .', ""If you're a good ballplayer , you've got to get mad ."", 'This time as a musician .', ""You can catch up with him -- if you haven't already -- on RCA-Victor's album .""]]","[[-0.17428937554359436, -0.17280547320842743, -0.17239773273468018, -0.17218336462974548], [-0.1021239161491394, -0.10198282450437546, -0.10178714245557785, -0.10171759128570557], [-0.0006435401737689972, -0.0004961867816746235, -0.0004568062722682953, -0.00045565515756607056], [0.09792613983154297, 0.09793805330991745, 0.09794627875089645, 0.09795522689819336], [0.18236079812049866, 0.18277786672115326, 0.18303558230400085, 0.18340647220611572], [0.23539993166923523, 0.23603001236915588, 0.2367377132177353, 0.2372034639120102]]",187.33343505859375,133.2586669921875,"[135.9851531982422, 134.5397491455078, 127.65798950195312, 122.55207824707031, 130.1018524169922, 120.71855163574219]",129.3271484375,"[121.44237518310547, 130.942626953125, 124.39838409423828, 122.70024871826172, 123.14177703857422, 119.5456771850586]",4.365312576293945,4.253951549530029,"[4.242134094238281, 4.266787528991699, 4.339926719665527, 4.25386905670166, 4.26322603225708, 4.163565635681152]",4.317509174346924,"[4.202287673950195, 4.237807273864746, 4.344247341156006, 4.253757476806641, 4.287137985229492, 4.196652889251709]"
