target_idx,target_sent,sents_intrp_all_bins,sim_intrp_all_bins,base_PPL,local_unintrp_PPL,local_intrp_PPL_all_bins,global_unintrp_PPL,global_intrp_PPL_all_bins,base_entropy,local_unintrp_entropy,local_intrp_entropy_all_bins,global_unintrp_entropy,global_intrp_entropy_all_bins
5,"Although the rate of divorce has declined slowly and steadily since the early 1980s, the rate of marriage has diminished rapidly, with more people choosing to marry later in life (see ).","[['Regretfully Sam explained that he had no experience with boxcars .', 'The instrument used for this work was a slight modification of that previously described .', 'He began the diplomatic discussions that resulted in the establishment of Aj .', ""We set up the Lloyd's Neck school , worked out its curriculum , and taught there .""], ['He splashed on , mud sucking at his feet with each step , until he reached the end of the drainage ditch and the beginning of the fence that enclosed the farm .', 'The policeman walked on , but he looked back once .', 'He went on to use objects -- hoops , poles , capes -- which he employed as extensions of the body of the dancer , who moved with them .', 'Companies of all types have made great advances in production capabilities and efficiencies -- in modern equipment and new processes , enlarged R & D facilities , faster new product development .'], ['The calibration of piezoelectric sensors in terms of the particle parameters is very uncertain .', 'There were a few reasons for that , too : Garibaldi had been taken up and exploited by the Communists nowadays .', ""He contends this idea doesn't conflict with experiments on which the principle of conservation of matter and energy is based because some slight error must be assumed in such experiments ."", 'Thus , moral issues concerning the nature of the legal and political processes take on theological dimensions .'], ['On Christmas night , they had had a disagreement about it .', 'Mrs. Freight ( Knight Dream-Miss Reed ) shows promise and does it in good form , and her best time is about 2:35 .', ""The Franck symphonic poem , `` Psyche '' , is a lush , sweet-sounding affair that was pleasant to encounter once again ."", ""Samples zoomed into closeup range in regular succession , like telephone poles passing on the highway , while representative music reinforced the mood of the late teens and 1920's .""], [""It has a great many assets to recommend it and if you haven't made avocado a part of your diet yet , you really should ."", 'The threshold mass is derived from the momentum threshold with the assumption of a mean impact velocity of Af in the U.S. work and Af in the U.S.S.R. work .', ""the administration's official budget review , which estimates a 6.9 billion dollar deficit for the current fiscal year , isn't making anyone happy ."", 'The Charles Men has a tremendous range of characters , of common folk even more than of major figures .'], [""Each enjoys seeing the other hit home runs ( `` I hope Roger hits 80 '' , Mantle says ) , and each enjoys even more seeing himself hit home runs ( `` and I hope I hit 81 '' ) ."", 'Each year , reports the American Medical Association , ten million Americans spend $900 million on vitamins , tonics and other food supplements .', 'I therefore believe it is realistic to assume a modest drop in the total value of home entertainment electronics to about $1.8 million , slightly below 1960 , but above 1959 .', ""`` My doctors assure me that this increased percentage of risk is not great '' .""]]","[[-0.17764778435230255, -0.17342284321784973, -0.1711409091949463, -0.17066922783851624], [-0.10342870652675629, -0.10331906378269196, -0.10330170392990112, -0.10329531878232956], [-0.0006454773247241974, -0.0006414437666535378, -0.0006333552300930023, -0.000593812670558691], [0.09843114018440247, 0.09846079349517822, 0.09849155694246292, 0.0985141396522522], [0.19151395559310913, 0.1916022002696991, 0.19163616001605988, 0.19184450805187225], [0.2534869313240051, 0.2538595199584961, 0.2561335861682892, 0.2570071816444397]]",49.00690841674805,37.13661193847656,"[40.39449691772461, 38.017452239990234, 37.63229751586914, 37.75071334838867, 36.82041549682617, 37.445682525634766]",35.19775390625,"[40.01704788208008, 36.96184539794922, 35.783775329589844, 37.63471984863281, 36.05992889404297, 36.523101806640625]",3.5543124675750732,3.497086524963379,"[3.4555270671844482, 3.533904552459717, 3.4850282669067383, 3.5169951915740967, 3.538054943084717, 3.515333414077759]",3.4523348808288574,"[3.4152097702026367, 3.5119757652282715, 3.4752914905548096, 3.490859031677246, 3.5343000888824463, 3.5005171298980713]"
10,"Some of those factors, including ethnic background and socioeconomic status, are beyond a couple's control.","[['He threw his head back , closed his eyes , and belched ferociously .', 'Like Pilate , they had washed their hands .', 'The vote still gives citizens a voice in the operation of their government and their party .', 'This machine was demonstrated in two textile machinery exhibitions last year and was well received by the industry .'], ['They are not susceptible to wholesale destruction by ballistic missile .', 'But from the start they had two important ingredients : sincerity and realism .', 'Sizzling temperatures and hot summer pavements are anything but kind to the feet .', 'He sized up the situation and shook his head .'], ['During the next weeks he looked over the situation .', 'In good time I shall get to the distressing actuality , to Red McIver and Handley Walker , to murder and sudden death .', ""`` The scriptures , both Old and New Testament , are verbally inspired of God and are the revelation of God to man , the infallible , authoritative rule of faith and conduct '' ."", 'Among the boys , there is very little bravado about drinking .'], ['He had to fight the bliss of super-condamine to do it .', 'She remarked that she found the night wind a little chilly , and Mr. Podger took her inside the fringe .', ""It is `` Defeat Into Victory '' , by Field Marshal Viscount Slim ."", 'West Virginia toll bonds have defaulted in interest for months , and , despite recent improvement in revenues , holders of the bonds are faced with more of the same .'], [""If the President of the United States really feels he won himself a `` lousy job '' , then heaven help us all ."", 'This brief resume hardly does the book justice , but I heartily recommend it to all those who are engages with the major problems of our time .', ""In his political testament , `` Advice To My Country '' , penned just before his death , Madison expressed the wish `` that the Union of the States be cherished and perpetuated ."", ""Although progress has been made in America's system of libraries it still falls short of what is required if we are to maintain the standards that are needed for an informed America .""], ['Burt was at Hackettstown and Will at Albany Law School , where they surely could not hear it .', ""For it seems that Barco , fancying himself a ladies' man ( and why not , after seven marriages ? ?"", 'There can be no doubt that the American Catholic accomplishment in the field of higher education is most impressive : our European brethren never cease to marvel at the number and the size of our colleges and universities .', 'Dr. George W. Crane , a medical columnist , thinks it would .']]","[[-0.17467001080513, -0.17410625517368317, -0.17177113890647888, -0.17101188004016876], [-0.10431937128305435, -0.1040482297539711, -0.1038726419210434, -0.10384966433048248], [-0.0009742826223373413, -0.0009483043104410172, -0.0009201420471072197, -0.0009010061621665955], [0.0986013114452362, 0.09860369563102722, 0.09863103926181793, 0.09870783984661102], [0.19454754889011383, 0.19456428289413452, 0.19458475708961487, 0.19472992420196533], [0.27614158391952515, 0.27678024768829346, 0.27792540192604065, 0.2786913514137268]]",65.64418029785156,62.970829010009766,"[78.4527359008789, 66.294189453125, 64.51737213134766, 67.26679992675781, 62.83689880371094, 76.08368682861328]",56.45120620727539,"[69.38225555419922, 57.087642669677734, 63.60274124145508, 60.070228576660156, 57.326515197753906, 74.15497589111328]",4.031998634338379,4.051759243011475,"[4.032526969909668, 4.035820960998535, 4.021932601928711, 4.027268886566162, 4.0676469802856445, 4.152144432067871]",4.031766414642334,"[4.03221321105957, 4.099756240844727, 3.9717962741851807, 4.043426513671875, 4.0708770751953125, 4.259552001953125]"
17,Age at marriage is also a predictor of marital success: Couples who wed in their teens are more likely to divorce than those who wait to marry.,"[['Thus , there has come into being a situation in which the state must raise all of its own revenues and , in addition , must give assistance to its local governments .', 'Finally Luis Hernandez said , `` What must be , must be .', 'We will then occupy the new plant under lease , with an option to purchase .', 'Other good miles have been by Debonnie ( Dale Frost-Debby Hanover ) and Prompt Time ( Adios-On Time ) in 2:28-:36 ; ;'], [""and concentrate its constructive efforts on eliminating in other parts of Latin America the social conditions on which totalitarian nationalism feeds '' ."", 'After that he was never known to run or even walk fast .', 'A month later the General Court served notice to the town of Newbury that the bridge was to be built .', 'Insect bites were cured in many ways .'], ['Powerful hands had killed her .', 'Her own sound production equipment was essentially more instrumental than vocal .', 'God withheld His wrath .', 'It was going to stay forever .'], ['Everyone knows that private detectives in real life are not like Sam Spade and Pat Novak , but the real and the imaginary musician are closely linked .', 'Even the first wave of homesickness had passed , although there were moments when Captain Heard pointed out on his compass the direction of Bradford that she felt a little twinge at her heart .', ""Then there are a pair of old biddies played by Grace Carney and Sibly Bowan who may be right off the shelf of stock Irish characters , but they put such a combination of good will and malevolence into their parts that they're quite entertaining ."", 'To both persons and ideas he brought the same delighted interest , the same open-minded relish for what was unique in each , the same discriminating sensibility and quicksilver intelligence , the same gallantry of judgment .'], [""`` What is the point '' , Charles Adams reports the Pakistanis as asking , `` in demanding an Islamic state and society if no one , not even the doctors of the sacred law themselves , can say clearly and succinctly what the nature of such a state and society is '' ? ?"", 'if so , he would not be the first or last commanding officer who has succumbed to bad information and dubious estimates of the future .', 'For each State ( except the Virgin Islands , Guam , Puerto Rico , and , prior to 1962 , Alaska and Hawaii ) , determine the average per capita income for the last three years .', 'They have insisted , rather , on living fully and completely within modern culture and , so far from considering this treason to God , have looked upon it as the only way they could be faithful to him .'], ['That mother hen of the weight-height tables , the Metropolitan Life Insurance Co. , clucks that 48 million Americans are overweight .', ""Apparently , Jouvet and Ledoux attempted just these dissimilar approaches in the role of Arnolphe in `` The School For Wives '' ."", 'Each year a few more institutions are deciding such questions as : Shall we require a liberal education built around a humanities core for all undergraduates ? ?', 'Anthony Steel , as the husband , is a jealous type who argues against her course and sues for divorce , labeling her action adulterous .']]","[[-0.159886434674263, -0.15926343202590942, -0.1590019166469574, -0.15576916933059692], [-0.10457764565944672, -0.10451485216617584, -0.10448724776506424, -0.10439328849315643], [-0.0006194692105054855, -0.000581003725528717, -0.0005695037543773651, -0.0005367547273635864], [0.09911169111728668, 0.09913572669029236, 0.0991538017988205, 0.09916404634714127], [0.1930883228778839, 0.19353927671909332, 0.19378018379211426, 0.19379204511642456], [0.25033533573150635, 0.25153684616088867, 0.25264179706573486, 0.25324392318725586]]",92.9924545288086,65.67138671875,"[68.31234741210938, 67.93553924560547, 61.2755126953125, 60.906227111816406, 61.10715103149414, 59.56976318359375]",57.26564407348633,"[61.39460372924805, 69.15531158447266, 59.78335952758789, 63.03226089477539, 58.4822998046875, 56.12491226196289]",3.7032196521759033,3.550255537033081,"[3.587542772293091, 3.57357120513916, 3.5729494094848633, 3.6158084869384766, 3.6109066009521484, 3.595646858215332]",3.486060380935669,"[3.5672528743743896, 3.5070960521698, 3.5457210540771484, 3.5700504779815674, 3.56762957572937, 3.591445207595825]"
33,"Analysis of the same data set found that all respondents — regardless of income level — reported similar problems within their relationships, such as wanting more affection and struggling to communicate effectively with their partners.","[[""The plank floor was slimed beneath Watson's boots ."", 'He stumbled to the middle of the road and simply stood there , waiting for them , a perfect target .', 'The tapping defined the rhythm and kept the boys awake .', 'roads and river barges to be built .'], ['It was the marine : head lifted , he strained and called .', 'His voice had sharp edges , as though he knew very well Lucy and he were not friends at the moment .', ""They wanted to see what his back felt like -- the General's ."", 'The Abernathy furnace consumed fuel like a giant ravenous maw that had to be appeased by hurling tons of coal into its evil red depths , and no matter how much coal they put in the house remained cold .'], ['Each dictionary form is looked up in the text-form list by the same method used to look up a new text occurrence in the form list during text reading .', 'Most others have been content to give only the most general attention to the broadest and most obvious features of the phonology when designing orthographies .', 'When they stood about his tent , chaffing each other , exchanging their obscenities , cursing command or weather , he had studied their faces .', 'And women were not expected to know that the pitcher was trying not to let the batter hit the ball .'], [""Other tax-exempt bonds of State and local governments hit a price peak on February 21 , according to Standard & Poor's average ."", 'Stowey Rummel was internationally famous , a crafter of a genuine Americana in foreign eyes , an original designer whose inventive childishness with steel and concrete was made even more believably sincere by his personality .', 'For new galaxies to be created , Professor Bondi declares , it would only be necessary for a single hydrogen atom to be created in an area the size of your living room once every few million years .', ""As a rule , the autistic child doesn't enjoy physical contact with others .""], [""Son and Daughter of Local Couple Married '' ."", ""An amazing article in the Manchester Guardian of last November , entitled `` Fate Of Redundant Churches '' , states than an Archbishops' Commission `` reported last month that in the Church of England alone there are 790 churches which are redundant now , or will be in 20 years' time ."", ""But the greater part of semester time was actually centered around the attitudes : `` So we are married -- now how do we make the best of it '' ? ?"", ""( `` One of the reasons they get along fine '' , says a sportswriter who is friendly with the two men , `` is that both realize Mantle is head-and-shoulders above Maris '' .""], [""In the interim between now and next year , we trust the House and Senate will put their minds to studying Georgia's very real economic , fiscal and social problems and come up with answers without all the political heroics ."", 'A significant effect discovered during the study is the existence of Prandtl numbers reaching values of more than unity in the nitrogen dissociation region .', 'A Sterling Township family of six surviving children , whose mother died yesterday as the aftermath to a fire that also killed one of the children , found today they had the help of hundreds of neighbors and school friends .', 'Attorney Dwight L. Schwab , in behalf of defendant Philip Weinstein , argued there is no evidence linking Weinstein to the conspiracy , but Judge Powell declared this is a matter for the jury to decide .']]","[[-0.1733584702014923, -0.17226189374923706, -0.17215734720230103, -0.17027945816516876], [-0.10291929543018341, -0.10289350152015686, -0.10282781720161438, -0.10273317992687225], [-0.0007118210196495056, -0.0007028244435787201, -0.0006966888904571533, -0.0006684456020593643], [0.09862653911113739, 0.09872787445783615, 0.09873474389314651, 0.09878383576869965], [0.19186140596866608, 0.19196456670761108, 0.19208839535713196, 0.19212529063224792], [0.27054041624069214, 0.2725397050380707, 0.27324429154396057, 0.2749400734901428]]",161.65115356445312,110.27436065673828,"[113.51170349121094, 120.92849731445312, 104.51240539550781, 116.13742065429688, 110.09834289550781, 116.24806213378906]",99.08312225341797,"[100.80435180664062, 106.76192474365234, 97.60523986816406, 105.40692138671875, 98.84284210205078, 106.93092346191406]",3.5881240367889404,3.5350341796875,"[3.5332679748535156, 3.503105878829956, 3.569409132003784, 3.553307294845581, 3.4758009910583496, 3.4329440593719482]",3.606886148452759,"[3.5613961219787598, 3.5545172691345215, 3.543626308441162, 3.5607969760894775, 3.503178358078003, 3.4821951389312744]"
77,It also matters what you talk about.,"[['Recent interferometer measurements ( Radhakrishnan and Roberts , 1960 ) have shown the 960-mc emission of Jupiter to be partially polarized and to originate in a region of larger diameter than the visible disk .', 'To determine engine speed for a given combination of the other three factors the formula is : Af .', 'On the basis of the findings which led to this conclusion , the Court remanded the case to the District Court to determine the appropriate relief .', 'The first step in using a formula is to insert the numerical values of the factors involved in their correct positions in the formula .'], ['Marty Land stood alone on a red-clay road as storm clouds gathered ominously in the sky again .', 'It seems to us that choices exercised by realtors in moral situations center in at least three areas : ( 1 ) the various ways in which they interpret a particular social issue ; ;', 'The first of these involved the replacement of the Tsar by a liberal Provisional Government in March , 1917 ; ;', ""Our last joint venture , Sainted Lady , a deeply religious film based on the life of Mother Cabrini , and timed so that its release date would coincide with the beatification of America's first saint in November , 1938 , was a fiasco from start to finish .""], ['Other expeditious methods are designed to prevent prolixity , limit delays , and reduce the expense of infringement suits .', 'CTA regulars already subsidize transportation for school children , policemen , and firemen .', 'He waited in his squat , gripping the hair .', ""Create a free market here , give us a sound , debt-free money system , and we'll compete with anyone , Europe and Asia combined .""], ['But the warm joy of her brown eyes was open to the general public .', 'So she brought the fish in whole , and she carried a lemon in her mouth .', 'This is done for simplicity of commands and to bring the hidden redundancy up to where misunderstanding has almost zero possibility .', ""The same thing is also evidenced by the extreme `` culture-Protestantism '' so often observed to characterize the preaching and teaching of the American churches .""], ['The expedient thing -- yes , very true , one must make do as one could , in some situations .', ""However one looks at it , therefore , I'd say that your horoscope for this autumn is the reverse of rosy ."", '`` I tell people what I think .', ""He'd tell Sabella about the nightmare .""], ['but they can hardly deny that , exaggerated or not , the old panorama is dead .', 'The way Hoag was , no telling what he might say or do .', 'Here was a powerful , ready-made medium , but it could speak only if I told it to .', ""But you don't have to worship in the traditional way .""]]","[[-0.1756751537322998, -0.17525628209114075, -0.17504142224788666, -0.1730954349040985], [-0.10267040878534317, -0.10266461968421936, -0.10256986320018768, -0.10254040360450745], [-0.0009358804672956467, -0.0009110569953918457, -0.0008293129503726959, -0.0007837479934096336], [0.09841121733188629, 0.09843803942203522, 0.09845992922782898, 0.098477803170681], [0.19535666704177856, 0.19545339047908783, 0.1954789161682129, 0.19613629579544067], [0.31778424978256226, 0.31795793771743774, 0.3194422721862793, 0.31945866346359253]]",140.61489868164062,76.44763946533203,"[164.99026489257812, 97.3282470703125, 58.81800842285156, 61.05647277832031, 48.470584869384766, 40.328826904296875]",118.63544464111328,"[150.96900939941406, 83.58473205566406, 50.69399642944336, 73.58319854736328, 43.516902923583984, 38.703407287597656]",3.9498260021209717,3.976796865463257,"[3.9858503341674805, 3.9372403621673584, 3.987476348876953, 4.007223129272461, 3.667384624481201, 3.7823355197906494]",4.023501873016357,"[3.958284378051758, 3.944352626800537, 3.951430559158325, 3.9810237884521484, 3.6041061878204346, 3.7636547088623047]"
