target_idx,target_sent,sents_intrp_all_bins,sim_intrp_all_bins,base_PPL,local_unintrp_PPL,local_intrp_PPL_all_bins,global_unintrp_PPL,global_intrp_PPL_all_bins,base_entropy,local_unintrp_entropy,local_intrp_entropy_all_bins,global_unintrp_entropy,global_intrp_entropy_all_bins
7,"For decades, psychologists have been trying to answer the key question: What's going on when two people who once said ""I do"" to a lifetime together decide they're better off apart?","[['Cf. 1 St. John 2 : 1 ) .', ""Except that Kitti wasn't there ."", 'I must say , however , that I preferred the acting that had something of a biting edge to it .', 'Where Cuddleback Brook purled into the Neversink was a magnificent swimming hole .'], [""The deep concave gradient employed ( fig. 2 ) was obtained with a nine-chambered gradient elution device ( `` Varigrad '' , reference ( 8 ) ) and has been described elsewhere ."", 'Wilson stared at her .', 'This function is staffed by engineers chosen for their technical competence and who have the title , member of the technical staff .', 'These oils develop hard , smooth films when they dry and form resinlike substances .'], [""Carmer's ingenious cache for his loot had been found ."", 'they expired amid indescribable fantods , imploring the Blessed One to forgive their desecration .', 'Back in Bavaria he had seen that gesture , and at that sight his heart had always died within him .', ""`` I'll shove along home '' .""], [""Soon as the Burnsides moved on , he'd lead Rex down by the river ; ;"", 'He took several large swallows , recollected that Docherty had gone up another flight , and decided he would be wise to cover himself by finding him .', ""`` Much Ado '' ends happily ."", 'We produce peanut oil , but to a much greater extent we eat the entire seed .'], [""`` My doctors assure me that this increased percentage of risk is not great '' ."", 'Such conversation quickly reveals an ethically significant ambivalence in the self-images held by most realtors .', 'My husband is in great pain .', 'Yet we continue to be afflicted by nagging disorders .'], ['It would hardly be an exaggeration to say that ninety per cent of the energy of most churches -- whether in terms of finance or spiritual concern -- is poured into the private and domestic interests of the members .', ""While details are still to be worked out , Ratcliff said he expects to tell home folks in Dallas why he thinks Berry's proposed constitutional amendment should be rejected ."", 'Ruthlessness at this time can be a very severe shock to the bride , both physically and psychologically .', 'Sometimes a burst of aggressiveness will sweep over a man -- or his wife -- because he or she feels age creeping up .']]","[[-0.18621781468391418, -0.18559731543064117, -0.1846436858177185, -0.1835092157125473], [-0.10274334251880646, -0.1027306318283081, -0.10253487527370453, -0.10252489149570465], [-0.0007305257022380829, -0.0006956551223993301, -0.0006925156340003014, -0.0006908364593982697], [0.098020538687706, 0.09806086122989655, 0.09808313846588135, 0.0981036126613617], [0.18914800882339478, 0.19005800783634186, 0.19009163975715637, 0.19010180234909058], [0.25045046210289, 0.25110360980033875, 0.25141409039497375, 0.25462955236434937]]",96.2269515991211,94.56855010986328,"[91.52778625488281, 108.78292846679688, 91.17821502685547, 98.85372924804688, 83.82697296142578, 89.02326965332031]",108.0985107421875,"[96.98245239257812, 110.10433197021484, 90.73738098144531, 99.38957214355469, 87.35416412353516, 92.62682342529297]",4.012792587280273,3.912198543548584,"[3.8981661796569824, 3.9706339836120605, 3.9302070140838623, 4.04662561416626, 3.939802885055542, 3.870755672454834]",3.9095892906188965,"[3.8903777599334717, 3.961550712585449, 3.9148998260498047, 3.986666202545166, 3.9459621906280518, 3.903475046157837]"
8,"Now, thanks to longitudinal studies of thousands of couples and emerging research on previously understudied partnerships, one answer is becoming more apparent: Why some couples stick together isn't so much a coin toss as a science.","[['The funds would be used for equipment , not for land , buildings , or operation .', 'The skiff was not heading for the nursery , however .', 'Purchase authorizations will include provisions relating to the sale and delivery of commodities , including the classes , types and/or varieties of food grain , the time and circumstances of deposit of the rupees accruing from such sale , and other relevant matters .', 'Traces of oil on green tissue ? ?'], ['Well led , properly organized cavalry , in its complementary role to infantry , had four functions .', 'Mass rapes , troop mutinies , uncontrolled looting and pillage and reckless military adventures , given no sanction by any political authority , have become almost daily occurrences .', 'Clams , crabs , and other marine life may add interest at coastal areas .', 'He put it in his own pocket for safekeeping .'], ['His red face , his coarse gestures , and his lustful stares bespeak his sensuality .', ""`` Shootin' 'em out '' was gettin' cattle out of a corral onto the range ."", 'These letters became the center of my existence .', 'Blue Throat winked at his six cronies .'], [""How lightly her `` eventshah-leh '' passed into the crannies where I was storing dialect material for some vaguely dreamed opus , and how the word would echo ."", ""-- I concur most heartily with today's letter on the futility of writing to Sen. Dirksen and Sen. Douglas ."", 'Elisabeth Schwarzkopf sang so magnificently Saturday night at Hunter College that it seems a pity to have to register any complaints .', ""`` What do you want to do '' ? ?""], ['I will mention two volumes of specific comment on this malaise that appeared last year .', 'Both of them did communicate one central theme : Against the ruin of the world , there is only one defense -- the creative act .', 'I prefer to speak , however , of Sam Rayburn , the person , rather than Sam Rayburn , the American institution .', 'No , I forget Mrs. Mathias , who had been away visiting a married daughter when it happened .'], ['If we were asked why we thought so , we should say that these things involve great evil and are wrong , and that to take delight in what is evil or wrong is plainly unfitting .', ""Their two boys were `` well adjusted '' and , like their parents , always did the right thing at the right time and damn the consequences ."", 'If one follows the reports of the Congress , one finds that there still seems considerable uncertainty in the minds of the leaders themselves about what exactly to do in this matter .', ""Seven years they'd been married .""]]","[[-0.17348569631576538, -0.17324040830135345, -0.17292118072509766, -0.17210997641086578], [-0.1042240634560585, -0.10404744744300842, -0.1039363443851471, -0.1039111316204071], [-0.0009095892310142517, -0.0008818171918392181, -0.0008481116965413094, -0.000816740095615387], [0.09894546121358871, 0.09897004812955856, 0.098982073366642, 0.09898370504379272], [0.19476063549518585, 0.19485414028167725, 0.19503483176231384, 0.19517087936401367], [0.2891002297401428, 0.28997665643692017, 0.2945106029510498, 0.2968878149986267]]",501.81768798828125,397.21380615234375,"[412.96746826171875, 402.4984436035156, 461.75946044921875, 422.6813049316406, 432.0259704589844, 409.3469543457031]",380.55377197265625,"[392.8183288574219, 390.85125732421875, 433.0599365234375, 405.1199951171875, 417.032470703125, 404.4654541015625]",4.161623954772949,4.186293601989746,"[4.281955242156982, 4.25441837310791, 4.229066848754883, 4.213096618652344, 4.180394649505615, 4.1651434898376465]",4.11768102645874,"[4.194934368133545, 4.1917829513549805, 4.174448013305664, 4.214486598968506, 4.161370754241943, 4.120273113250732]"
11,"But, say psychologists, there are many behaviors, such as how a couple talks and fights and even the type of dates they go on, that can be learned and practiced — and can give a pair a fighting chance at 'til death do they part.","[['Rod gave her a warm pat on the shoulder before he replied .', ""`` We can get it if we dig '' , he said patiently ."", 'Queried about the impasse , Allied Arts said : `` Better cancel the Kirov for the time being .', ""Concord learned to set its clocks by the rackety bark of the Whirlwind's exhaust overhead .""], [""Police said the children's mother , Mrs. Eleanor Somerville , was visiting next door when the fire occurred ."", 'Day and night Martin could not drag his mind from the dilemma he had made for himself .', ""Now would you care to have us say that you were misquoted in regard to it '' ? ?"", ""Also , reserve the right to demand proof of death despite the fact that you'll probably never use it .""], ['She looked mighty interested , though .', 'He would cross to Manhattan , to Harlem Heights , before morning .', 'The space between them is filled with pit-run gravel or earth .', 'To avoid this contradiction it is necessary that C be composite , with the secant of **zg and a curve of order Af as components .'], [""Nevertheless , he made a mental note to look into Garth's financial background ."", 'He was sure that he could do better if he went to Atlanta to get the deal financed .', 'One thing you can say about Mr. Lyford is that he does not suffer from any insecurity as an American .', 'and the dances and songs from the Tatras contain a magnificent dance for the men .'], [""Their locations in all parts of the United States , and their locations in the several kinds of educational and research institutions that are the principal homes of our intellectual and artistic strengths also are factors in the Trustees' minds ."", ""A modern cotton gin plant costs in the neighborhood of $250,000 , and it's a safe assumption that a large percentage of new gins in the U.S. and foreign countries contain machinery made in this area ."", 'Although it had seemed a good reason , to begin with : no couple could afford to have children .', 'From a few students this group gradually increased to include over three-fourths of those officially enrolled in the class , and many outsiders as well .'], ['Roles of various types , within the larger system and within the subgroups 3 .', 'To what extent did it mould the morals and the social , economic , and political life and institutions of the country ? ?', 'It is the consequence of the system of ideas that constitutes the frame of our international -- and in some degree our domestic -- policy .', 'One effect of the proposal , which puts a premium on population instead of economic strength , as in the past , would be to take jobs from European nations and give more to such countries as India .']]","[[-0.19808879494667053, -0.1956903636455536, -0.19473928213119507, -0.1929251104593277], [-0.10226096212863922, -0.10224802047014236, -0.10224591195583344, -0.1021825522184372], [-0.0006742198020219803, -0.0006709545850753784, -0.000604615081101656, -0.0005849786102771759], [0.09849074482917786, 0.09851773828268051, 0.09852706640958786, 0.09857848286628723], [0.18656623363494873, 0.18677465617656708, 0.1871938705444336, 0.1873893439769745], [0.2293185442686081, 0.22961026430130005, 0.23131154477596283, 0.23146003484725952]]",170.0977783203125,171.27688598632812,"[166.05465698242188, 163.17237854003906, 165.89353942871094, 150.11441040039062, 162.85702514648438, 169.6603546142578]",148.60606384277344,"[152.29666137695312, 152.90475463867188, 146.69781494140625, 142.66207885742188, 163.41453552246094, 165.02590942382812]",4.3311285972595215,4.317529678344727,"[4.326014518737793, 4.341617107391357, 4.343560218811035, 4.350718021392822, 4.295443058013916, 4.3027801513671875]",4.264558792114258,"[4.310699939727783, 4.246459484100342, 4.3163886070251465, 4.286618709564209, 4.285682201385498, 4.302199363708496]"
32,"In one study using data from about 4,500 respondents to the Florida Family Formation Survey, social psychologist Benjamin Karney, PhD, of the University of California, Los Angeles, and colleagues found that the marriages of lower-income couples were more likely to be hurt by stressful life events and mental health problems than the marriages of the more affluent couples.","[['The Earthmen made camp outside the spaceship .', 'Let T be a linear operator on the finite-dimensional vector space V over the field F .', 'but when the bird is found at last , it turns out to be a fake .', 'I did not rest until I had tracked the mystery down .'], [""The key to effective marketing is wrapped up in defining your company's marketing problems realistically ."", 'That was another one of those traps .', 'This result is preliminary , and work is continuing .', 'I have been trying to make this clear to my own class in chemistry .'], ['Five held for trial', 'It was not even certain the shot had been fired from either hotel .', 'He is a fine-looking colt with a good body , good set of legs and nice way of going .', 'The two fluids which gave the small negative pressures were polybutenes with molecular weights which were stated to be 520 and 300 .'], [""Pitcher Steve Barber joined the club one week ago after completing his hitch under the Army's accelerated wintertime military course , also at Fort Knox , Ky. ."", 'in half an hour the reception would be over .', ""`` Ring Of Bright Water '' by Gavin Maxwell is just that -- a haunting , warmly personal chronicle of a man , an otter , and a remote cottage in the Scottish West Highlands ."", 'The female parasite spends much time in her efforts to find a nest of her host .'], ['It was on the tenth day after the wedding ( how could it have been so soon ? ?', 'It is difficult to tabulate exactly what was meant in each individual situation , but the conclusion may be drawn that 21 towns do not assess movable personal property , and of the remainder only certain types are valued for tax purposes .', ""When they say that under no circumstances would it ever be right to `` permit '' the termination of the human race by human action , because there could not possibly be any proportionate grave reason to justify such a thing , they know exactly what they mean ."", '-- Consumer spending edged down in April after rising for two consecutive months , the Government reported .'], ['The two in the bed knew each other as old people know the partners with whom they have shared the same bed for many years , and they needed to say no more .', 'Anthony Steel , as the husband , is a jealous type who argues against her course and sues for divorce , labeling her action adulterous .', 'Ruthlessness at this time can be a very severe shock to the bride , both physically and psychologically .', ""and frightening , as when a wife tells the police that it is funny , but her husband hasn't been home for two days and nights '' .""]]","[[-0.1897502839565277, -0.1886015087366104, -0.18743671476840973, -0.18576665222644806], [-0.10265602171421051, -0.10264809429645538, -0.1025158166885376, -0.10247083753347397], [-0.0006477730348706245, -0.0005927830934524536, -0.0005729631520807743, -0.0005466369912028313], [0.0988193154335022, 0.09882587194442749, 0.09883859753608704, 0.0988672599196434], [0.1941971480846405, 0.19423967599868774, 0.19424059987068176, 0.19466568529605865], [0.2919866144657135, 0.29360681772232056, 0.29387474060058594, 0.2974843978881836]]",62.98764419555664,55.58836364746094,"[63.00494384765625, 60.99205017089844, 58.78436279296875, 55.61270523071289, 60.79990768432617, 57.460506439208984]",47.908695220947266,"[52.918861389160156, 51.05234909057617, 49.30703353881836, 50.05841064453125, 50.73810577392578, 50.337364196777344]",3.2999215126037598,3.2454535961151123,"[3.254535436630249, 3.284982204437256, 3.223548412322998, 3.318422317504883, 3.2685530185699463, 3.2504489421844482]",3.203202724456787,"[3.1883349418640137, 3.218942403793335, 3.1919214725494385, 3.260934591293335, 3.258077383041382, 3.1655585765838623]"
80,"""They're spending time getting to know one another,"" Orbuch says.","[['But what the elements could not do was seriously threatened when Brigadier General William E. ( Grumble ) Jones reached Philippi while on the famous Jones-Imboden raid in May , 1863 .', 'But Hoag had not stayed on the front steps when Griffith disappeared into the building .', 'There was someone in front with the sheriff .', 'I stopped by the counter .'], [""Why should I go over at midnight to check on Francie , when her parents didn't care enough to leave a party ? ?"", 'Since the Connally amendment has the effect of giving the same right to the other party to a dispute with the United States , it also prevents us from using the court effectively .', 'He listed what he had spent for `` My own diet in London eighteen weeks , in which I was sick a month ; ;', 'There was no time to pick out a penny ; ;'], ['Or should we argue that if we want adjustment of children to children of different races and that that is impossible in an all-something-or-the-other school , we must at least provide him some opportunity to adjust to people of another race within the school -- namely , to a teacher of another race .', 'As she matured , more and more neural synapses would be adjusted to operate other mechanisms that went into the maintenance and running of a space ship .', 'But that scarcely means that he was the aloof , forbidding type of student who shared few if any activities with his fellows , the banter of the surviving prolusions providing enough evidence to deny this .', ""He has said , `` Behold , I stand at the door , and knock : if any man hear my voice , and open the door , I will come in to him , and will sup with him , and he with me '' ( Revelation 3:20 : :""], [""Their childhood would have been quite circumspect without Hetty's flair for drama , especially through the long summers ."", ""he generally heard Freddy's suggestions without interest , being absorbed by his own prospering concerns ."", 'Many belly dancers are married , but Serene is one of the few who will admit it .', ""The study of the St. Louis area's economic prospects prepared for the Construction Industry Joint Conference confirms and reinforces both the findings of the Metropolitan St. Louis Survey of 1957 and the easily observed picture of the Missouri-Illinois countryside .""], [""Seven years they'd been married ."", 'And then Castro himself did come , bearded , smiling ; ;', 'This was more than joy .', 'This is the key to the conquest of fear .'], [""Too many husbands , Dr. Schillinger continues , worry about `` how well they're doing '' , and fear that their success depends on some trick or technique of sexual play ."", 'The two women babbled and crooned at him .', ""Check with one of them , go ahead -- there's no professional jealousy here '' ."", 'The ballads are sweet and sad , and the music generally competent .']]","[[-0.21107608079910278, -0.20934921503067017, -0.2092394232749939, -0.20844465494155884], [-0.10261385887861252, -0.102418914437294, -0.10241110622882843, -0.10239185392856598], [-0.0006601139903068542, -0.0006571998819708824, -0.0006473427638411522, -0.000634513795375824], [0.09861446917057037, 0.09861554950475693, 0.09863226115703583, 0.09863707423210144], [0.1887437254190445, 0.1887488067150116, 0.18885231018066406, 0.18901744484901428], [0.24640128016471863, 0.2469831109046936, 0.24712815880775452, 0.2490103542804718]]",58.930389404296875,59.892555236816406,"[54.870155334472656, 57.27979278564453, 35.28146743774414, 70.05411529541016, 54.43889236450195, 45.89374542236328]",53.91336441040039,"[48.49018859863281, 53.793758392333984, 32.86129379272461, 74.76505279541016, 49.721797943115234, 50.38994598388672]",3.9922361373901367,4.017007827758789,"[3.9069674015045166, 3.921255588531494, 4.000213623046875, 3.9783058166503906, 3.9355621337890625, 3.9501326084136963]",4.10513162612915,"[3.8478426933288574, 3.873481512069702, 3.908721446990967, 4.096654891967773, 3.9376022815704346, 3.9989898204803467]"
