target_idx,target_sent,sents_intrp_all_bins,sim_intrp_all_bins,base_PPL,local_unintrp_PPL,local_intrp_PPL_all_bins,global_unintrp_PPL,global_intrp_PPL_all_bins,base_entropy,local_unintrp_entropy,local_intrp_entropy_all_bins,global_unintrp_entropy,global_intrp_entropy_all_bins
30,"The psychologists posit that the energy dedicated toward handling stressful events detracts from the energy needed to maintain a good relationship (, 2012).","[['Is the land suited to the crops you intend to raise ? ?', 'As can be seen from Figure 2 , an extensive area was covered by this aerosol .', 'she fits into the general scheme well enough .', ""We'll still have the rifle , and I might be able to round up some more .""], ['I pointed to the splintered , upright stake .', ""Mr. Hawksley , the state's general treasurer , has been a part-time CD director in the city for the last nine years ."", ""Bruckner's Eighth he refers to as `` my travel symphony '' ."", 'The Bible is as obviously and truly food for the spirit as bread is food for the body .'], [""And this is my own home '' ."", ""Curt reached out and dropped Jess's pistol back into the holster ."", ""`` Hesperus , don't use this t-tau vector trick of yours , please ."", 'He waited in his squat , gripping the hair .'], [""They have not been friendly for years '' ."", 'In all , the Senate signed a check for $46.7 billion , which not only included the extra $3.5 billion requested the week before by President Kennedy , but tacked on $754 million more than the President had asked for .', 'Individuals possessing unusual gifts and great personal power were transmuted at death into awesome spirits ; ;', ""`` Tough '' , Buzz said , `` Listen , we're having a stag dinner over at the Pagan Room on Friday .""], ['Ruthlessness at this time can be a very severe shock to the bride , both physically and psychologically .', 'Men seem almost universally to want a sense of function , that is , a feeling that their existence makes a difference to someone , living or unborn , close and immediate or generalized .', 'Important as these differences are , they should not obscure the basic fact that by shifting the hypothalamic balance sufficiently to the parasympathetic side , we produce depressions , whereas a shift in the opposite direction causes excitatory effects and , eventually , maniclike changes .', 'No sooner had Betsey come out of the ring than Mrs. Long walked into the Working Competition with Ch. Cadet or Noranda , another home-bred product , and won ! !'], ['The good ones are not motivated to seek vainly , nor are they disposed to covet comfort , or they would have been led to fields that offer comfort and feed vanity .', 'It recognizes the fact that what helps one county helps its neighbors and that by banding together in an area-wide effort better results can be accomplished than through the go-it-alone approach .', 'Mary was free to marry again , not knowing that the Sturch had secretly given her a divorce , thinking that death had dissolved her marriage .', ""`` Most often '' , she says , `` it's the monogamous relationship that is dishonest '' .""]]","[[-0.18653330206871033, -0.1857011318206787, -0.18568047881126404, -0.18339017033576965], [-0.10401659458875656, -0.10379786789417267, -0.10341016203165054, -0.10334066301584244], [-0.0008300896733999252, -0.0008170939981937408, -0.0008035078644752502, -0.000708884559571743], [0.09882314503192902, 0.09884047508239746, 0.09884704649448395, 0.09886983036994934], [0.19389823079109192, 0.19390100240707397, 0.1942143589258194, 0.1946295201778412], [0.2859635055065155, 0.2875615656375885, 0.28880226612091064, 0.2901240885257721]]",191.97390747070312,171.2087860107422,"[163.5943145751953, 212.10226440429688, 194.8686981201172, 170.4365997314453, 163.9193878173828, 209.54713439941406]",186.85321044921875,"[165.48634338378906, 189.3095245361328, 167.28811645507812, 169.08299255371094, 171.17637634277344, 208.15203857421875]",4.370586395263672,4.445878505706787,"[4.344395637512207, 4.3585309982299805, 4.459356784820557, 4.4467291831970215, 4.305349349975586, 4.2140350341796875]",4.397242069244385,"[4.367958068847656, 4.403151035308838, 4.409145355224609, 4.385076999664307, 4.320186614990234, 4.251928329467773]"
68,"More recently, UCLA's Lavner led another study reevaluating how a couple's fighting style affected their marriages.","[['Then pour water or light oil from a graduated beaker into the chamber to fill the chamber to its gasket surface .', 'The books and records with respect to each project shall be maintained for the duration of the project , or until the expiration of three years after final disbursement for the project has been made by the United States , whichever is later .', 'I knew in that moment that I did not have any choice .', 'Even in the very area where the shooting had been done , cattle were still disappearing .'], ['Everybody returned after intermission for the miscellaneous sweepings of the Fantasy For Piano , Chorus , And Orchestra In C Minor , made up by its composer to fill out one of his programs .', 'The specific staining by both direct and indirect methods showed that WTV antigen was concentrated in the pseudophloem tissue and in a few thick-walled cells in the xylem region , but was not detectable in any other tissues of the root and stem tumors .', 'He piled everything neatly in a corner of the cellar and turned to stare at the blank stone wall .', 'Several other examples : central and satellite'], ['It could , by avoiding direct intervention , provide a short-of-war strategy to meet short-of-war infiltration .', ""Alex explained that they had been out for a stroll before breakfast while the doctor edged around behind him , attempting to hide the protuberance at his left side behind Alex's arm and back ."", 'It was at the end of the sidewalk in front of the Dellwood Cemetery cottage .', 'There shall be deducted from the amount of each payment made pursuant to subsection ( C ) of Section 8 , as reimbursement for the expenses incurred by the United States , an amount equal to 5 per centum of such payment .'], [""Especially touching is the chapter , `` The Little Sister '' , about a king's daughter who became a nun in the convent of St. Birgitta ."", 'The ideals of the country were deeply indebted to the Protestantism of the older stock .', 'The latter is not reduced to the former .', ""These critters went real sudden '' .""], ['But questions with which committee members taunted bankers appearing as witnesses left little doubt that they will recommend passage of it .', ""He said : `` You'll feel a lot better after you have a bath ."", 'Other expeditious methods are designed to prevent prolixity , limit delays , and reduce the expense of infringement suits .', ""They could hear the pony's feet on the dry leaves for a while , then the sound faded out .""], ['There was an air of revolt about the children -- even irreverence for their own principles .', 'They crept down the muddy slope toward the waiting boats .', 'These needs usually concern the reduction of guilt and some relief of tension .', 'They were engulfed by the weird silence , broken only by the low , angry murmur of the river .']]","[[-0.16819727420806885, -0.16710075736045837, -0.16614040732383728, -0.16207236051559448], [-0.1052711233496666, -0.10521845519542694, -0.1052158772945404, -0.1051676794886589], [-0.0008113952353596687, -0.000809570774435997, -0.0007631368935108185, -0.0007180580869317055], [0.09860838204622269, 0.0986817255616188, 0.09869332611560822, 0.09869995713233948], [0.19371739029884338, 0.19387853145599365, 0.19400978088378906, 0.19423002004623413], [0.25793516635894775, 0.2599572539329529, 0.2600144147872925, 0.2600571811199188]]",148.7038116455078,131.7089080810547,"[169.08250427246094, 168.03817749023438, 150.24267578125, 116.03545379638672, 148.29135131835938, 134.14373779296875]",98.41229248046875,"[119.90791320800781, 140.51971435546875, 115.39462280273438, 97.32555389404297, 112.51996612548828, 103.22335815429688]",4.521467208862305,4.4388933181762695,"[4.378100395202637, 4.183856964111328, 4.412660121917725, 4.3861846923828125, 4.521055698394775, 4.475737571716309]",4.349396705627441,"[4.405430793762207, 4.159350872039795, 4.410652160644531, 4.354769229888916, 4.562167644500732, 4.418428421020508]"
85,"In a 2012 paper in the , Shelly Gable, PhD, of the University of California, Santa Barbara, and colleagues found that participants who felt supported by a partner during a positive event, such as receiving a high rating at work, felt better about themselves and about their relationships.","[['I turned on the electric bug , and the signal came in loud and clear .', 'As can be seen from Figure 2 , an extensive area was covered by this aerosol .', 'Detailed information on record lengths of the giants is given in the section that follows .', 'But none of these has been implemented .'], ['Shell people did not , strictly speaking , breathe .', 'I spun about and clattered through the front room to the door .', '`` Okay , take the tray .', 'During the year 1960 , this office supplied 954 visitors with information related to foreign and domestic commerce , and made 73 field visits .'], ['There can be no doubt that the American Catholic accomplishment in the field of higher education is most impressive : our European brethren never cease to marvel at the number and the size of our colleges and universities .', 'In covert socialism -- toward which America is moving -- private enterprise retains the ownership title to industries but government thru direct intervention and excessive regulations actually controls them .', 'During the year 1959 , we granted 354 Fellowships ; ;', ""`` That's right '' , I told him .""], ['In the silence that followed , Miriam walked close to Mrs. Cupply , who drew back a step on her side of the gate .', 'After the war began , he long refused to permit emancipation of the slaves by Union action even in the Border States that stayed with the Union .', 'Yet with all their skills , the appeal of Mantle and Maris in 1961 comes down to one basic : The home run .', 'It was her work to go among her neighbors and collect their checks .'], ['The public should understand that whether they support a state hospital or a VA hospital , the tax dollar has to be paid one way or the other .', ""( `` One of the reasons they get along fine '' , says a sportswriter who is friendly with the two men , `` is that both realize Mantle is head-and-shoulders above Maris '' ."", 'I use the phrase advisedly because there was something positively indecent about our relationship .', 'Contemplating these posthumous punishments , Stalin should not lose all hope .'], [""Thus , the writer decided to hold one experimental section of the functional preparation for marriage course in the spring semester of 1960 exclusively for persons already married -- that is , prerequisite : `` marriage '' ."", 'In the care-free indolence of the East he sees the last reflection of the old happy existence , and for that reason he loves it .', 'it is when I meet someone who was a close friend of the family , and therefore of mine , and they nod to me so coolly and walk away , that it hurts .', ""U Thant of course , will hold office until the spring of 1963 , when Mr. Hammarskjold's term would have come to an end .""]]","[[-0.196998730301857, -0.19693297147750854, -0.19498850405216217, -0.19403144717216492], [-0.10324320942163467, -0.10312265902757645, -0.10288970172405243, -0.10283225029706955], [-0.0008335951715707779, -0.0008166544139385223, -0.0007801633328199387, -0.000778756570070982], [0.09865964949131012, 0.09866651892662048, 0.09866760671138763, 0.09868384897708893], [0.1954406499862671, 0.19563047587871552, 0.19602267444133759, 0.1960269808769226], [0.2780763804912567, 0.27878594398498535, 0.27948901057243347, 0.27997130155563354]]",58.69154357910156,47.763427734375,"[46.224464416503906, 49.44782257080078, 55.06059265136719, 55.920555114746094, 45.82910919189453, 48.17970275878906]",39.114383697509766,"[40.459442138671875, 39.581302642822266, 43.55082702636719, 43.192771911621094, 41.0958366394043, 40.619041442871094]",3.5772581100463867,3.530007839202881,"[3.5643346309661865, 3.4979519844055176, 3.5505263805389404, 3.4640185832977295, 3.530600070953369, 3.54026198387146]",3.5271637439727783,"[3.517486572265625, 3.530762195587158, 3.550290107727051, 3.4748003482818604, 3.5078043937683105, 3.494199275970459]"
86,But feeling supported during negative events was inconsistently — and sometimes even negatively — linked to similar good feelings.,"[[""`` I'll pick murder ."", 'Anyhow , it was high time the boy was salted .', 'there was no point in locking it up in the armoire now , it was like locking the barn after the horse was stolen .', 'The conscience is non-existent in the 2-year-old .'], ['It took some time to locate Horn .', 'It is , in effect , an oversize room conditioner equipped with prefab glass-fiber ducts to distribute the cooled , cleaned , dehumidified air where it is wanted .', 'In such conditions all freedoms are lost .', 'But you realize , I am sure , how much old deeds incite to new ones , and you must forgive me if I tell you first of the old ones .'], ['Dirt , which is here defined as particulate material which is usually inorganic and is very often extremely finely divided so as to exhibit colloidal properties .', ""`` Oh '' , said Mr. Partlow , `` that's fine , Tom ."", 'They would feel what Mary was undergoing .', 'Assistant Prosecutor Fred Lewis , who tried both the Hengesbach and Pohl cases , said he did not know what would be done about two arson charges pending against Pohl .'], ['When he had closed the suitcase he found a rag and moved about the room , wiping carefully everything he might have touched .', ""`` The pair whom Petey is officially commending for slapping me around and pulling me in '' ."", ""The audience wouldn't let her leave until it had heard `` Over The Rainbow '' -- although the fellow that kept crying for `` Get Happy '' had to go home unhappy , about that item anyway ."", 'But Mr. Kennedy had become convinced that a personal confrontation with Mr. Khrushchev might be the only way to prevent catastrophe .'], ['In the following year , 1803 , Oersted , simultaneously with Davy , discovered that acids increased the strength of a voltaic battery more than did salts .', ""Last week Chicago happily found its top scholar in Caltech's acting dean of the faculty : dynamic Geneticist George Wells Beadle , 57 , who shared the 1958 Nobel Prize in medicine and physiology for discovering how genes affect heredity by controlling cell chemistry ( Time , Cover , July 14 , 1958 ) ."", 'If so , it might be worth while to assign a future jazz show to a different department -- one with enough confidence in the musical material to cut down on the number of performers and give them a little room to display their talents .', 'I felt more cheerful , as if I had had a part in bringing her through to a greater tolerance of herself .'], [""Following Mr. Brown's death , there came forward in the Brown & Sharpe organization many other men who contributed greatly to the development of the company ."", ""She had talked her `` boy friend '' into sending her to New York to take a screen test ."", 'I waited until the parking attendant was busy with a customer , then slipped around the back of the car with license number JYM 114 , attached the electronic bug to the rear bumper and walked out .', ""Dr. R. A. Lyttleton , a lecturer at St. John's College , Cambridge , and a reader in theoretical astronomy at the University of Cambridge ; ;""]]","[[-0.2099367380142212, -0.20638501644134521, -0.20622757077217102, -0.20592068135738373], [-0.10225754976272583, -0.10222454369068146, -0.10213403403759003, -0.10212644934654236], [-0.0008229203522205353, -0.0007473006844520569, -0.0007299799472093582, -0.00069475919008255], [0.09874249249696732, 0.09879155457019806, 0.09883154183626175, 0.09884777665138245], [0.19242747128009796, 0.1924380362033844, 0.19286522269248962, 0.19287225604057312], [0.2464921474456787, 0.24651843309402466, 0.24847739934921265, 0.24992145597934723]]",501.0337219238281,493.1214904785156,"[441.1338195800781, 455.8628234863281, 502.741455078125, 497.46160888671875, 473.9576721191406, 524.4614868164062]",363.9578552246094,"[348.7521667480469, 332.4398498535156, 404.4542541503906, 362.91473388671875, 413.0263671875, 417.6573181152344]",4.157018661499023,4.1325578689575195,"[4.140199184417725, 4.168186187744141, 3.9963600635528564, 4.072384357452393, 4.1217522621154785, 4.151538848876953]",4.412327289581299,"[4.313046455383301, 4.376916408538818, 4.152987957000732, 4.223679065704346, 4.155513286590576, 4.247241973876953]"
96,"How do you reduce it?""","[[""El Benefactor's vanity grew with his personal wealth ."", 'Virgilia Peterson , a critic by trade , has turned her critical eye pitilessly and honestly on herself in an autobiography more of the mind and heart than of specific events .', 'a holier-than-thou sermon was not .', 'In our own time we have seen the most fantastic imagery of a Jules Verne come into actuality .'], ['Louise climbed onto a stool and clutched the hand with which I was trying to hold the phone , claiming my immediate attention on grounds of extreme emergency .', ""Word of Dag Hammarskjold's death in an African plane crash has sent a shockwave around the globe ."", ""`` A person with a master's degree in physics , chemistry , math or English , yet who has not taken Education courses , is not permitted to teach in the public schools '' , said Grover ."", 'The Rachmaninoff Prelude No. 12 , Op. 32 , for instance , gave her an opportunity to exploit one of her special facilities -- the ability to produce fine deep-sounding bass tones while contrasting them simultaneously with fine silver filagree in the treble .'], [""I fought like a tigress but by the time I appealed my case to the Supreme Court ( 1937 ) , Mr. Roosevelt and his `` henchmen '' had done their `` dirty work '' all too well , even going so far as to attempt to `` pack '' the highest tribunal in the land in order to defeat little me ."", 'Twice previously the Senate has approved measures backing ETV and the House has let them die .', 'between the cities and towns of the state ; ;', 'Plus the fact that Siddo not only had the normal ( to Earthmen ) three genders of masculine , feminine , and neuter , but the two extra of inanimate and spiritual .'], [""`` They'll tell you what's cooking '' ."", ""I mean , surely we've '' --"", 'the killing was already forgotten in that clear mind of his .', 'He stood watching the girl , wondering what was coming next .'], ['This has got to be some kind of local phenomenon .', 'And nobody knows what comes next .', ""After that day , Blanche still didn't know exactly what had happened ."", 'After all , where else can the public see a wagon these days ? ?'], [""The short answer to those questions is `` yes '' ."", ""But you don't have to worship in the traditional way ."", 'What should I do ? ?', 'Then he was asking himself the usual early morning questions : What the Hell am I doin here ? ?']]","[[-0.18782737851142883, -0.18691042065620422, -0.1845262050628662, -0.18332049250602722], [-0.10228944569826126, -0.10225946456193924, -0.10221393406391144, -0.10217054188251495], [-0.00089672626927495, -0.0008901357650756836, -0.0008690506219863892, -0.0008329711854457855], [0.0974847823381424, 0.09757144749164581, 0.09757271409034729, 0.09759601950645447], [0.18735265731811523, 0.18738190829753876, 0.18761718273162842, 0.18776145577430725], [0.2515859007835388, 0.25160670280456543, 0.2529374361038208, 0.2531588673591614]]",613.2830810546875,98.20096588134766,"[104.19688415527344, 91.28148651123047, 115.24087524414062, 79.59043884277344, 77.68169403076172, 79.87109375]",94.25621032714844,"[98.68384552001953, 85.35269927978516, 108.78546905517578, 77.49700164794922, 80.91716003417969, 78.36461639404297]",3.1858413219451904,3.0365288257598877,"[3.1868624687194824, 2.9562270641326904, 3.183044672012329, 2.8600263595581055, 2.861752510070801, 2.7582197189331055]",2.967393398284912,"[3.145906925201416, 2.89530348777771, 3.0525426864624023, 2.8048739433288574, 2.811846971511841, 2.6835262775421143]"
