target_idx,target_sent,sents_intrp_all_bins,sim_intrp_all_bins,base_PPL,local_unintrp_PPL,local_intrp_PPL_all_bins,global_unintrp_PPL,global_intrp_PPL_all_bins,base_entropy,local_unintrp_entropy,local_intrp_entropy_all_bins,global_unintrp_entropy,global_intrp_entropy_all_bins
38,"His team's study found that military personnel are much more likely than civilians to be married and not as likely to be divorced compared with civilians of similar ages, races, employment statuses and education levels (, 2012).","[['Facilitatory processes take place between neocortex and hypothalamus via ascending and descending pathways .', 'On an impulse , she turned back and said good morning .', 'Then there was North America , where American was the native speech of all except the twenty descendants of French-Canadians living on the Hudson Bay Preserve .', 'Complete the construction and reconstruction of about 79,400 miles of multiple-purpose roads and 8,000 miles of trails .'], ['At the meeting , attended by Freddy , Richert , Herberet and the A-Z executive staff , with Mr. Willis presiding , William and Hamrick did indeed run the gantlet .', ""The Warren Telegraph stated that many of Rev. Trafton's remarks were inappropriate and savored strongly of radicalism and fanaticism ."", ""I'm not pleading for the heart that leaps up when it beholds a rainbow in the sky , or for the heart that with rapture fills and dances with the daffodils ."", ""`` Not the least bit '' , Arlene snapped .""], [""The vivacity of the masquers' party at Leonato's palace , with the Spanish motif in the music and dancing in honor of the visiting Prince of Arragon , cast a spell of delight ."", 'They felt rough and kind and warm .', 'However , even if the latent demand for demythologization is not nearly as widespread as we are claiming , at least among the cultured elements of the population there tends to be an almost complete indifference to the church and its traditional message of sin and grace .', 'The result was a landslide for the Republican candidates .'], ['administrative organization and delicate diplomatic relations with Top Brass -- British , American and Chinese ; ;', 'In recent years , this burden ( which includes allowances for revenue deficiencies in the passenger business and in less-than-carload freight traffic ! !', 'the drug canceled out his needs for cycles of the body .', 'Some time ago , however , Mr. Khrushchev decided that when bigger bombs were made , the Soviet Union would make them .'], ['She smiled at him with benign , remote happiness ; ;', ""He served `` with '' him ."", 'McClellan , who had once lost his medical license temporarily on a charge of drug addiction , was with her when she died .', 'In spite of the shading of one type of course into another , I believe it is useful to talk about vocational courses as apart from academic courses .'], ['More time was spent in trying to marry these incompatibles than over any subject discussed at Yalta .', 'More typical is the case of a suburban Long Island housewife described by a marriage counselor .', ""A world in which wives have taken a more active role is likely to produce sexual relationships in which wives are more self-assertive , too '' ."", 'He hovered over her to shield her , for spent bullets were thudding against the rear walls .']]","[[-0.1707601249217987, -0.1695510894060135, -0.16893723607063293, -0.1661483198404312], [-0.10141052305698395, -0.10140915215015411, -0.10124564915895462, -0.10123062133789062], [-0.00034148991107940674, -0.00033755041658878326, -0.00029379595071077347, -0.00025943294167518616], [0.09897778928279877, 0.09900598973035812, 0.09900803864002228, 0.09907127916812897], [0.19572502374649048, 0.195746511220932, 0.19588002562522888, 0.1959993541240692], [0.28457868099212646, 0.28543567657470703, 0.28726518154144287, 0.29172760248184204]]",85.84326934814453,70.83556365966797,"[76.80853271484375, 78.9828109741211, 84.01460266113281, 72.02644348144531, 76.29344940185547, 78.28569793701172]",80.50574493408203,"[79.9572525024414, 75.16024780273438, 73.7502212524414, 82.54853057861328, 79.54722595214844, 77.01872253417969]",3.7235093116760254,3.7140698432922363,"[3.710080623626709, 3.7207860946655273, 3.7122061252593994, 3.9603095054626465, 3.7227466106414795, 3.724449634552002]",3.78224778175354,"[3.7956957817077637, 3.742306709289551, 3.7349002361297607, 3.920647144317627, 3.7772603034973145, 3.7664644718170166]"
40,"That includes providing health care, child care and allowances for housing and children.","[['Christiana and Delaware would , in turn , be required to pass on the voting rights to the General Motors shares allocable to them to their own stockholders .', 'it was framed in maroon drapes , and no faces were visible .', 'The 1960 tax book for East Greenwich indicates a valuation for this property in excess of two million dollars .', 'But the warm joy of her brown eyes was open to the general public .'], ['Her answer was not in words .', 'He had not felt that during the afternoon .', ""Shippin' cattle by train was called a `` stock run '' ."", 'The luminous flux gain of a single stage is given by : Af .'], ['It was night on this hemisphere , but the light blazed from the megalopolises of Australia , Japan , China , Southeast Asia , India , Siberia .', 'The background , which is available in various widths and continuous lengths , is extruded with parallel undercut grooves which grip the flexible letters securely .', 'By distinguishing superlunary ( celestial ) and sublunary ( terrestrial ) existence , and reinforcing this with the four-element physics of Empedocles , Aristotle came to speak of the stars as perfect bodies , which moved in only a perfect way , viz. in a perfect circle .', 'It is not enough in accounting for this feeling to analyze it into the wickedness of individual people added together to produce a cumulative effect .'], ['White House legislative aides were still confident the bill would pass intact .', ""and , most pervasively , ( 3 ) their interpretation of who is a `` real pro '' , of what it means to be a professional man in a technical , fragmented society ."", 'Both units of government contribute increasingly large sums of money to the several local governments in this state as indicated below :', 'A contractor probably would be required to help build it .'], ['Look at the things we do to escape our fears and to forget our worries .', ""Doc Doolittle's scheduled appearance at captain's mast was a very unusual thing , because the discipline dispensed there is ordinarily for the young and immature , and a chief is naturally expected to stay off the report ."", 'One consequence is the occurrence of occasional conflicts because private owners of some inholdings object to public programs of use on neighboring National Forest or other Federal land , or because such ownerships are developed for uses that are not compatible with use for the public of neighboring National Forest land .', ""What concerns him much more is the relationship of diet to the nation's No. 1 killer : coronary artery disease , which accounts for more than half of all heart fatalities and kills 500,000 Americans a year -- twice the toll from all varieties of cancer , five times the deaths from automobile accidents .""], ['National defense considerations have been the major reason behind most Federal training expenditures in recent decades .', ""In I'll go with George dominant stress is probably on George ; ;"", 'If women replaced people , it would normally have dominant stress .', 'Remember what you used to say in the Army ? ?']]","[[-0.14021040499210358, -0.140065997838974, -0.1400032937526703, -0.13931730389595032], [-0.10256816446781158, -0.10243935137987137, -0.10229805111885071, -0.10223222523927689], [-0.00030910782516002655, -0.0003018416464328766, -0.00029845908284187317, -0.0002799183130264282], [0.09952044486999512, 0.09955137968063354, 0.09955282509326935, 0.09963011741638184], [0.1968282014131546, 0.19692885875701904, 0.19713468849658966, 0.19747290015220642], [0.3031786382198334, 0.3046114444732666, 0.30518412590026855, 0.3126561641693115]]",125.48344421386719,94.6233139038086,"[88.96199035644531, 100.70951843261719, 121.25142669677734, 84.26006317138672, 84.2200927734375, 97.61622619628906]",75.91387176513672,"[77.40556335449219, 83.06272888183594, 107.92334747314453, 78.86095428466797, 83.24056243896484, 80.1048583984375]",3.784634828567505,3.8238918781280518,"[3.877685070037842, 3.9179959297180176, 3.989119052886963, 3.9358670711517334, 3.9322197437286377, 3.871659994125366]",3.988410711288452,"[3.9841599464416504, 3.9764397144317627, 4.009835720062256, 4.010952949523926, 3.926377534866333, 3.954066276550293]"
73,"In the Early Years of Marriage Project, Orbuch also found that good communication set the happiest of couples apart from the less blissful.","[['In the second half of the Sixteenth Century , Sinan , the great architect who is the Michelangelo of the East , designed the massive buttresses that now help support the dome .', ""Although it was only three o'clock , he stopped in at the Golden Calf ."", ""But he is a West Point graduate and therefore must be born to command '' ."", 'Beneath the dome I saw the spot where the Byzantine Emperors were crowned , a bit of floor protected now by a wooden fence .'], [""`` I heard a story once about a rookie who got excited when the captain stepped outside and he couldn't get an encephalographic reading on him ."", 'Anywhere would be better than the land of her ancestors .', '`` Warm enough to swim -- real Indian summer .', 'Lewis was a man who had made a full-time job of cow stealing .'], ['Cf. 1 St. John 2 : 1 ) .', ""`` My beloved ward , my perennial gadfly '' , said the whining voice ."", 'Something I had simply never thought of .', ""`` Ekstrohm , Nogol , you guys okay '' ? ?""], [""As Charles Evans Hughes said , `` Miss Poitrine's limitations as an actress are exceeded only by her logic as a litigant '' ."", 'Mike remained in trance ; ;', 'The League of Women Voters , 40 now and admitting it proudly , is inviting financial contributions in the windup of its fund drive .', 'In addition to the regular schedule , advertisements were run for maximum impact in special editions of the New York Times , Boston Herald , American Banker , Electronic News and , for local promotion , the Providence Sunday Journal .'], ['( 2 ) Realtors realize , of course , that they are involved in an increasingly complex legal and political system that is opening up opportunities for leverage on their relation to clients as well as opportunities for evasion of their responsibility for racial discrimination in housing .', 'Such conversation quickly reveals an ethically significant ambivalence in the self-images held by most realtors .', ""'' My impassioned plea for civil rights created a landslide of correspondence and one sponsor even asked me to consider replacing the Eddie Cantor comedy hour on a permanent basis ."", ""`` The pair whom Petey is officially commending for slapping me around and pulling me in '' .""], ['In their views on dating , courtship , sex , and family life , our students prefer what they are expected to prefer .', 'More time was spent in trying to marry these incompatibles than over any subject discussed at Yalta .', ""Seven years they'd been married ."", ""Thus , the writer decided to hold one experimental section of the functional preparation for marriage course in the spring semester of 1960 exclusively for persons already married -- that is , prerequisite : `` marriage '' .""]]","[[-0.1653866320848465, -0.1650828719139099, -0.16379857063293457, -0.16368205845355988], [-0.10085558891296387, -0.10084034502506256, -0.10083991289138794, -0.10080716013908386], [-0.00039729848504066467, -0.0003794711083173752, -0.0003321189433336258, -0.0003305133432149887], [0.09940969944000244, 0.09941026568412781, 0.09947174042463303, 0.09947531670331955], [0.19235484302043915, 0.1924789845943451, 0.19279199838638306, 0.1930910348892212], [0.2743937075138092, 0.27476269006729126, 0.2773488461971283, 0.2774991989135742]]",127.29163360595703,97.83332824707031,"[97.65062713623047, 91.79646301269531, 100.58828735351562, 110.92340850830078, 101.11453247070312, 88.90499877929688]",103.32057189941406,"[91.54179382324219, 85.55003356933594, 94.86753845214844, 98.34253692626953, 97.20954895019531, 94.10917663574219]",3.7193498611450195,3.81331467628479,"[3.8006772994995117, 3.728818655014038, 3.85520076751709, 3.7727127075195312, 3.8451037406921387, 3.9564409255981445]",3.9923903942108154,"[3.982149600982666, 3.831000328063965, 4.053155899047852, 3.953266143798828, 3.9555907249450684, 4.026480197906494]"
74,"Partners who reported patterns of destructive behavior when dealing with conflict in the first year of marriage, for example, were more likely to divorce years later (, 2010).","[['All tourists come to Florida .', 'When sufficiently accurate and complete measurements are available , it will be possible to set limits on the thermal and electrical characteristics of the surface and subsurface materials of the moon .', ""The charge , I tell you '' ! !"", 'Does it attack other traditional American institutions with unsupportable and wild charges ? ?'], [""`` This is where I get my information from '' , he confided ."", 'The other occupants were James Willard Olvey , 18 , of 963 Ponce De Leon Ave. , NE , and Larry Coleman Barnett , 19 , of 704 Hill St. , SE , both of whom were treated at Grady Hospital for severe lacerations and bruises .', 'Would the man make it or not ? ?', 'Upon all of them played the intellectual , social , political , and economic attitudes , institutions , and customs of the nation .'], ['The plane was sent back to the United States , for a change , but Castro kept the crazy gunman , who will prove a suitable recruit to the revolution .', 'when the insoluble fraction was suspended in a volume of saline equal to that of the original serum sample , no complete antibody activity could be detected .', 'The Secretary was uneasy about the visit .', 'On July 14 the Security Council -- with France and Great Britain abstaining -- voted the resolution which drew the U.N. into the Congo .'], [""In 1825 , the Boston house carpenters' strike for a ten-hour day was denounced by the organized employers , who declared : `` It is considered that all combinations by any classes of citizens intended to effect the value of labor tend to convert all its branches into monopolies '' ."", 'Sometimes , you have a choice of exposure for sites where the topography or trees of the area will provide afternoon shade , morning sun , or whatever may be most desirable for the use intended .', ""It doesn't really matter which month of the year you sow them , but they germinate best when they have a wide variation of temperature , very warm followed by cool in the same 24 hours ."", ""And this was Gladdy's mother ! !""], ['Our pin-curl clips and self-locking nuts achieved dominance in just a few years time , despite substantial , well established competition .', ""Her `` Rockabye Your Baby '' was as good as it can be done , and her really personal songs , like `` The Man That Got Away '' were deeply moving ."", 'after all , he had had the same set of facts as Jack had had to work from , and he was an almost frighteningly observant man .', 'The children looked at each other and sagged their bottoms down even more comfortably than ever .'], ['Mary was free to marry again , not knowing that the Sturch had secretly given her a divorce , thinking that death had dissolved her marriage .', 'While high anxiety children achieve significantly less well ( Af ) in the unstructured school than do low anxiety children , they appear to do at least as well as the average in the structured classroom .', 'At the time Alex arrived he was engaged in some sort of intimate communication with the hen , who had settled herself on the nest most peacefully after the occurrences of the morning .', 'Since she also has considerable technical virtuosity and a feeling for music in the romantic tradition , Miss Xydis gave her listeners a good deal of pleasure .']]","[[-0.1563594937324524, -0.15602099895477295, -0.15564988553524017, -0.15544742345809937], [-0.10148672759532928, -0.101475790143013, -0.10129407048225403, -0.1012783944606781], [-0.000397583469748497, -0.00038856640458106995, -0.0003675241023302078, -0.00035753101110458374], [0.09958375245332718, 0.09966535866260529, 0.0996670126914978, 0.09968562424182892], [0.1973506361246109, 0.19744142889976501, 0.19744744896888733, 0.1979566216468811], [0.32596996426582336, 0.3269251585006714, 0.3342879116535187, 0.33876174688339233]]",85.91535186767578,77.15424346923828,"[88.03790283203125, 83.40513610839844, 86.076416015625, 81.46963500976562, 76.34869384765625, 87.47500610351562]",69.38239288330078,"[70.99811553955078, 75.78453826904297, 66.66133117675781, 73.02445220947266, 75.92342376708984, 82.44401550292969]",3.9354729652404785,3.9536795616149902,"[4.072364807128906, 3.833601713180542, 3.835845470428467, 4.081287860870361, 3.9293954372406006, 3.787358045578003]",3.741241455078125,"[3.867743492126465, 3.8216147422790527, 3.7511894702911377, 3.8985064029693604, 3.762112855911255, 3.757429838180542]"
90,"Few factors undermine a relationship more than boredom, says Orbuch.","[['The instrument used for this work was a slight modification of that previously described .', 'It had been a very long time that had no form and no end .', 'It was day , but in the thin atmosphere contrasts were sharp between light and shadow .', 'Within the units in the National Forest System the pattern of land ownership is quite irregular .'], ['Dr. Hilprecht was uncertain as to the language used by the ancient priest in his dream .', 'The robe , however , was missing , for by that time Barco had disposed of it at a pawnshop in Glendale .', 'Both units of government contribute increasingly large sums of money to the several local governments in this state as indicated below :', 'With quibs and gibes , the policemen again started digging .'], ['The current regime of President Mohammad Ayub Khan is determinedly secular .', 'and Arlene began tapping the kitchen door open .', 'I never met John Dewey , whose style was a sort of verbal fog and who had written asking me to go to Mexico with him when he was investigating the cause of Trotsky ; ;', ""The previous night's horror -- the absolute failure , overcast with the intrusions of the press , had left them all with a wan sense of uselessness , of play-acting .""], ['And in a way the promise works out true , for whether he wants you or not , you go with him in your heart .', 'If Mr. Kennan is sometimes a little somber in his appraisals , if his analysis of how Western diplomacy met the challenge of an era of great wars and social revolutions is often critical and pessimistic -- well , the record itself is not too encouraging .', 'Nevertheless I consider it reasonable , because of my commitment as an artist , to assume that the rights and responsibilities of creative individuals are related to humanity as a whole rather than to specific geo-political interests .', ""`` Ah , you're too old '' , was invariably his ungallant and untrue retort whenever I suggested `` starting a family '' .""], ['She decided to risk it .', ""And it leaves very soon '' ."", 'The suggestion is naive .', ""`` Have him come in '' .""], [""Any harm in that '' ? ?"", '-- Make him lie down ! !', ""`` You're in for trouble '' ."", ""I tell you when it's necessary to hurt in order to win -- you won't do it .""]]","[[-0.1641876995563507, -0.1639820784330368, -0.1636386215686798, -0.1631622016429901], [-0.10086484253406525, -0.10081156343221664, -0.10048198699951172, -0.10042597353458405], [-0.00037245266139507294, -0.0003292188048362732, -0.00032561924308538437, -0.0003108195960521698], [0.09911533445119858, 0.09913747757673264, 0.09915338456630707, 0.09915890544652939], [0.18894821405410767, 0.18900765478610992, 0.18962712585926056, 0.1906309425830841], [0.2457580864429474, 0.24809497594833374, 0.25666505098342896, 0.256833553314209]]",512.7525024414062,468.75897216796875,"[527.3662109375, 557.52099609375, 445.7703552246094, 359.398681640625, 361.6160583496094, 399.0282897949219]",329.304931640625,"[356.83026123046875, 403.62255859375, 390.1306457519531, 292.1860046386719, 291.61395263671875, 355.235107421875]",3.720689296722412,3.7432618141174316,"[4.0228271484375, 3.7846884727478027, 3.7831430435180664, 3.959238052368164, 3.8402585983276367, 3.8769564628601074]",3.8518457412719727,"[3.8795862197875977, 3.921379566192627, 3.8085780143737793, 3.8477416038513184, 3.8890881538391113, 3.7649829387664795]"
