target_idx,target_sent,sents_intrp_all_bins,sim_intrp_all_bins,base_PPL,local_unintrp_PPL,local_intrp_PPL_all_bins,global_unintrp_PPL,global_intrp_PPL_all_bins
177,"She’d told Luigi that she would catch the bus, but knowing that Myra and the kids were away, it was not unusual for Luigi to come by for coffee or to spend the night.","[['In this system , no man is exempt from obligations .', 'the balanced use of recreation , hunting , and fishing areas ; ;', 'Not all of it .', ""But even he will not last indefinitely and the above-noted new arrangements are , quite simply , made to assure qualitative continuity in the Foundation's policies and practices .""], ['The vast Central Valley of California is one of the most productive agricultural areas in the world .', 'There were bilateral pterygia and arcus senilis , and the mouth was edentulous .', 'and God allowed it .', 'No longer is the United States the only major industrial country capable of providing substantial amounts of the resources so urgently needed in the newly developed countries .'], ['One kind of proprietorship', 'Matsuo repeatedly choked down his own nausea .', 'The Faget case was the kind of salvage job the Administration should not have to repeat .', 'Oddly enough , this is an amulet against housebreakers , presented to the mem and me by a local rajah in 1949 .'], ['If deja vue is an illusion , then peculiarly , it is a most prevalent mental disturbance affecting even the most level-headed people .', 'There were several on the Council who tried to live like Christians .', 'There were several on the Council who tried to live like Christians .', 'The moon had sunk below the black crest of the mountains and the land , seen through eyes that had grown accustomed to the absence of light , looked primeval , as if no man had ever trespassed before .'], ['Someone said that while we were standing here and arguing about it , the British would be gone ; ;', 'In the garage he checked the Jeep for signs of the use he had made of it .', 'How soon you may go outdoors ; ;', '`` In 1951 she was a prostitute in New York County .'], ['A sudden thought wiped the smirk from his face .', 'This was something on which K. himself seemed to have some doubts ; ;', 'The spectacle progressed towards a denouement which was obviously still remote ; ;', ""Hardly glancing at her , I smiled a bleak one which said , Thanks , baby , but I'd rather be alone .""]]","[[-0.18858620524406433, -0.1879386305809021, -0.18772277235984802, -0.1837906837463379], [-0.10598598420619965, -0.10560043156147003, -0.10554058104753494, -0.105476975440979], [-0.0013450272381305695, -0.0013435594737529755, -0.001269567757844925, -0.0012442916631698608], [0.0988406091928482, 0.09889772534370422, 0.09889772534370422, 0.09891831874847412], [0.1951628029346466, 0.1951768398284912, 0.19533725082874298, 0.19554802775382996], [0.3617036044597626, 0.36440959572792053, 0.36570560932159424, 0.3669355511665344]]",52.89902877807617,43.94918441772461,"[43.51374053955078, 42.84254455566406, 42.751834869384766, 45.28874969482422, 40.490562438964844, 43.70148468017578]",36.59911346435547,"[39.48040008544922, 39.961299896240234, 37.96080017089844, 40.83340835571289, 36.62386703491211, 38.94218444824219]"
198,Tess stood there at the point of screaming.,"[['No comments by U.S.', 'I am a carpet salesman .', ""-- `` Consumer uncertain about economic conditions '' ."", 'corporations , being more amorphous , cannot .'], ['The matter of sympathy of the academic professors for art objectives also must be taken into account .', 'Here , on a desk , is a stack of pamphlets representing the efforts of some of the best men of the day to penetrate these questions .', 'the duplication of testimony and exhibits ; ;', 'Forty-six states , including Rhode Island , end their fiscal year on June 30 .'], ['The announcement that the city would sue for recovery on the performance bond was made by City Solicitor David Berger at a press conference following a meeting in the morning with Wagner and other officials of the city and the PTC as well as representatives of an engineering firm that was pulled off the El project before its completion in 1959 .', 'The announcement that the city would sue for recovery on the performance bond was made by City Solicitor David Berger at a press conference following a meeting in the morning with Wagner and other officials of the city and the PTC as well as representatives of an engineering firm that was pulled off the El project before its completion in 1959 .', 'So rules we made , in unabashed collusion .', 'It should not be postponed later than the next day .'], ['That is an evening of music-making that would faze many a younger man ; ;', ""He is throttling the liberty my father gave his life to win '' ! !"", ""Ekstrohm picked up a lightweight no-back from the ship's library , a book by Bloch , the famous twentieth century expert on sex ."", 'The basic mapping phase of the program has been completed and the inventory phase is scheduled for completion July 1 , 1961 .'], ['one had always felt the need to make a safe world around her .', ""`` The pair whom Petey is officially commending for slapping me around and pulling me in '' ."", ""It was the first time we've been ahead this season ( when John Richey kicked what proved to be the winning field goal ) '' ."", 'He had lived all his life waiting for her .'], [""The first time the nurse took him out of the lung , she said if he got frightened , she'd put him back for a second ."", 'When she loved , it was with a passion that drove her along and carried along with her those things she loved .', 'Ramey heard a cry from the girl and felt a slight pain somewhere in his hand .', 'Half slyly he enjoyed seeing her stoop to lift the things .']]","[[-0.17091524600982666, -0.17083311080932617, -0.17004337906837463, -0.16979935765266418], [-0.10489214956760406, -0.10478946566581726, -0.10439587384462357, -0.10421406477689743], [-0.0009286068379878998, -0.0009286068379878998, -0.0009015239775180817, -0.0008991658687591553], [0.0987059623003006, 0.0987086296081543, 0.09871257841587067, 0.09872472286224365], [0.1956961452960968, 0.19584764540195465, 0.19589725136756897, 0.19601088762283325], [0.3217673897743225, 0.32296475768089294, 0.32354089617729187, 0.3243134319782257]]",89.2491683959961,63.30367660522461,"[62.35976028442383, 69.01237487792969, 63.19519805908203, 71.49967193603516, 46.971641540527344, 38.30706024169922]",40.90498733520508,"[53.044315338134766, 60.532962799072266, 63.56441879272461, 59.411277770996094, 47.32467269897461, 38.24242401123047]"
27,"Stepping into the hallway, Tess returned her greeting with a smile.","[['He is the conveyor of a sacred reality by which he has been grasped .', 'A rule on the Federal deductibility of state taxes is contested .', 'She finds married life stifling and every prolonged sex relationship unbearably monotonous .', 'Elizabeth Way was the first operator ; ;'], ['-- I bought 50 shares of Diversified Growth Stock Fund on Oct. 23 , 1959 , and 50 more shares of the same mutual fund on Feb. 8 , 1960 .', 'Mr. Nixon , he believes , has no particular political philosophy and mismanaged his own campaign .', ""in particular against a Madonna portrayed in a voluptuous style and modeled , according to gossip , upon the painter's mistress ."", 'Humor found many modes of expression .'], ['The clock on the mantel piece was scandalized and ticked so loudly that he glanced at it over his shoulder and then quickly left the room .', 'By now Harmony could see that most of the adults in the train were winded and resting , or else siphoned off from the games by the challenging lure of the great cliff towering above them .', 'Developments in Cuba and Laos also suggested the advisability of an early summit meeting .', 'In a low voice , almost whispering , the man had asked Phil if he was happy with the way the landlord had been taken off his back .'], ['I quickly turned around and began to drink .', ""Do you have anything to read while you're shut up ? ?"", ""Do you have anything to read while you're shut up ? ?"", 'It is obvious that this is a potential and lucrative source of revenue for the assessors of those towns where a substantial amount of such property would be subject to taxation .'], ['Is it reaching these goals ? ?', 'He would have to be given the opportunity .', ""`` Soon '' , said the half-man ."", ""`` Soon '' , said the half-man .""], ['I will deal with these later on .', 'I will deal with these later on .', '`` Okay , take the tray .', '`` Okay , take the tray .']]","[[-0.18112003803253174, -0.1800869256258011, -0.1797480583190918, -0.17901909351348877], [-0.10206310451030731, -0.10206256061792374, -0.10193556547164917, -0.10190140455961227], [-0.0006678979843854904, -0.0006498768925666809, -0.0006088805384933949, -0.0005778949707746506], [0.09793926775455475, 0.09796108305454254, 0.09796108305454254, 0.09796666353940964], [0.18200775980949402, 0.18271151185035706, 0.18302172422409058, 0.18302172422409058], [0.3006359934806824, 0.3006359934806824, 0.30202752351760864, 0.30202752351760864]]",127.84744262695312,141.60899353027344,"[157.75486755371094, 170.0865936279297, 99.55192565917969, 191.0802764892578, 126.62415313720703, 112.54700469970703]",87.54435729980469,"[115.20137786865234, 154.27685546875, 93.24568939208984, 133.9358367919922, 109.33592987060547, 90.7034683227539]"
69,David was speechless.,"[['The bronchial artery , except for a small number of short branches in the hilum , contributes none of the pleural blood supply .', ""Ordinarily , the human liver synthesizes only enough cholesterol to satisfy the body's needs -- for transportation of fats and for production of bile ."", 'In addition , little work has been done on a comparative basis in regard to the normal existence of bronchial artery-pulmonary artery anastomoses .', 'His hubris , deficiency of taste , and sadism carried him straightaway to the top .'], ['No house was ever built that could not have been built better for less if the work had been better planned and the work better scheduled .', 'Two entries in The Early Life support the assumption that during this period Hardy had virtually suspended the writing of poetry .', 'He felt no anger towards Kitti , no sense that she had betrayed him .', 'The central city areas , in other words , exhibit the two characteristics which violate the life principle of congregations of the major denominations : they have too few middle-class people ; ;'], ['If one follows the reports of the Congress , one finds that there still seems considerable uncertainty in the minds of the leaders themselves about what exactly to do in this matter .', 'If one follows the reports of the Congress , one finds that there still seems considerable uncertainty in the minds of the leaders themselves about what exactly to do in this matter .', 'We should stand firmly and courageously for our right to free access into Berlin .', 'The measure was instantly taken , as always in such cases , of public men at many levels .'], ['Charlie said , `` Good boy .', 'The rides were tame enough -- mostly we talked .', '`` Shann was responsible for the report .', 'In West Virginia the number of white and Negro children attending the same school has increased almost twofold .'], [""I gave you a drink and then you went to sleep '' ."", 'I stood up and began pacing .', 'I stood up and began pacing .', ""The daughter replied , `` Oh , I had dinner with -- well , you don't know him but he's awfully nice -- and we went to a couple of places -- I don't suppose you've heard of them -- and we finished up at a cute little night club -- I forget the name of it .""], ['The Sons were out tonight .', ""She it was who had looked to see if I was wearing shoes upon learning that I couldn't drive ."", ""She it was who had looked to see if I was wearing shoes upon learning that I couldn't drive ."", 'We opened on Friday and closed the following Monday .']]","[[-0.21412518620491028, -0.2126876562833786, -0.20918121933937073, -0.20411086082458496], [-0.10220757126808167, -0.10212935507297516, -0.10205328464508057, -0.10204195976257324], [-0.0011506825685501099, -0.0011506825685501099, -0.001117052510380745, -0.0011018025688827038], [0.09825652837753296, 0.09829212725162506, 0.09841029345989227, 0.09849736094474792], [0.1918787956237793, 0.19191375374794006, 0.19191375374794006, 0.19195520877838135], [0.2418191134929657, 0.24190863966941833, 0.24190863966941833, 0.24207401275634766]]",14.071248054504395,23.32184600830078,"[19.84291648864746, 19.165647506713867, 23.240184783935547, 27.128511428833008, 16.003232955932617, 16.91002082824707]",19.423154830932617,"[17.300731658935547, 18.990901947021484, 20.962833404541016, 23.43138885498047, 16.606630325317383, 19.76889419555664]"
213,Do you know Myra?”,"[['It was equally clear that as of this moment , the treaty was off .', 'These are as follows : ( 1 ) field work procedures .', 'The Service has not said what its next step will be .', ""This was Boniface's monumental tactlessness .""], ['He suspected something underhanded and furtive about him .', 'The buckskin bolted out of the stall .', 'They crept down the muddy slope toward the waiting boats .', 'They came unexpectedly upon the sea .'], ['They both tried to keep smiling and winking for a long time , but it made their lips and eyelids tremble .', 'My definition of this much abused adjective is that a reconstructed rebel is one who is glad that the North won the War .', 'For any pencil in a plane containing a Af-fold secant of **zg has an image regulus which meets the plane of the pencil in Af lines , namely the images of the lines of the pencil which pass through the intersection of **zg and the multiple secant , plus an additional component to account for the intersections of the images of the general lines of the pencil .', 'His point is not that mythology may not be used , but that it may no longer be regarded as the only or even the most appropriate conceptuality for expressing the Christian kerygma .'], ['The inflow of foreign capital would help the U.S. balance of payments .', 'In general , such apartments afford more protection than smaller buildings because their walls are thick and there is more space .', 'After all , he had less reason to desire it than the marine .', 'When Stravinsky shaped his purpose to the shifting scenes of many cultures , many salons , many dialectics , many personalities , he tried to refashion himself into a stylist of many styles , determined by many disparate cultures .'], [""The mother inquired , `` Where's Johnny , and why did you leave him '' ? ?"", 'Now for the good points .', ""When they say that under no circumstances would it ever be right to `` permit '' the termination of the human race by human action , because there could not possibly be any proportionate grave reason to justify such a thing , they know exactly what they mean ."", 'If you are unable to sign the request , because of illness or other good cause , another person who stands in close personal or business relationship to you may sign the request on your behalf , stating the reason why you are unable to sign .'], ['Well , it has to happen .', 'Well , it has to happen .', 'She had her reasons for this .', 'Could it do otherwise ? ?']]","[[-0.17718151211738586, -0.17467555403709412, -0.16970613598823547, -0.16942936182022095], [-0.10390692204236984, -0.10383041203022003, -0.10378001630306244, -0.1037212461233139], [-0.0004929155111312866, -0.0004897043108940125, -0.00048724934458732605, -0.0004577822983264923], [0.09766877442598343, 0.09770074486732483, 0.09773475676774979, 0.09776157885789871], [0.16829624772071838, 0.16954255104064941, 0.17163965106010437, 0.17209893465042114], [0.26311618089675903, 0.26311618089675903, 0.2658173441886902, 0.2681159973144531]]",553.278076171875,54.225791931152344,"[83.97735595703125, 51.56378173828125, 83.86550903320312, 72.98501586914062, 66.02204132080078, 66.37545013427734]",51.44919967651367,"[63.98178482055664, 46.225711822509766, 74.16207885742188, 74.12750244140625, 61.21996307373047, 52.13908767700195]"
