target_idx,target_sent,sents_intrp_all_bins,sim_intrp_all_bins,base_PPL,local_unintrp_PPL,local_intrp_PPL_all_bins,global_unintrp_PPL,global_intrp_PPL_all_bins
77,"Although the rate of divorce has declined slowly and steadily since the early 1980s, the rate of marriage has diminished rapidly, with more people choosing to marry later in life (see ).","[['Orders were given to dig .', 'He darted inside the stockade and freed the horses there .', 'Refrigeration , automated processing and packaging conspire to defy season and banish spoilage .', 'At first Barco was evasive and shifty .'], ['for example , the Crusades , mission efforts , just wars .', ""That po'k , it was so full of skippers it would jump and run and not come when you say , hoo-pig ."", 'Tommy had been assigned to the psychopathic ward .', 'Tommy had been assigned to the psychopathic ward .'], [""Ernie was screaming inside himself : No , damn you , you ain't gonna take my meal ticket away from me ! !"", ""In fact , it is in just such a situation that the profundity of Bultmann's argument is disclosed ."", ""Those names mean anything to you '' ? ?"", ""Respondents' opinions regarding negotiated bidding ( Part F of the questionnaire ) 7 .""], ['We should recall the number of movements for the service of mankind which arose from the kindred Evangelicalism of the British Isles and the Pietism of the Continent of Europe -- among them prison reform , anti-slavery measures , legislation for the alleviation of conditions of labour , the Inner Mission , and the Red Cross .', ""On the second landing he paused to look for Docherty , didn't see him , and accepted a glass of champagne ."", 'They would have to bide their official time and see , trusting that the massive doses of shell-psychology would suffice her , too , as the necessary bulwark against her unusual confinement and the pressures of her profession .', 'Dallas may get to hear a debate on horse race parimutuels soon between Reps. V. E. ( Red ) Berry and Joe Ratcliff .'], [""It is Field Marshal Montgomery's belief that in most Western countries about 60 per cent of the people do not really care about democracy or Christianity ; ;"", 'All the officials on the case seem to have been afflicted with a similar myopia as far as Bridget was concerned , although records in police files contain many reports of servants who have murdered their employers .', 'These registries are sponsored by 18 national medical , dental , and veterinary societies and have as their mission the assembling of selected cases of interest to military medicine and of establishing through the mechanism of follow-up of living patients the natural history of various diseases of military-medical importance .', 'what mattered was that a new concept of Americans was being born .'], [""A Republican survey says Kennedy won the '60 election on the religious issue ."", 'In repetitions of the experiment from couple to couple , the votes of the two persons in a couple probably agree more often than independence would imply , because couples who visit the museum together are more likely to have similar tastes than are a random pair of people drawn from the entire population of visitors .', 'Liberals and conservatives in both parties -- Democratic and Republican -- should divorce themselves and form two independent parties , George H. Reama , nationally known labor-management expert , said here yesterday .', 'That mother hen of the weight-height tables , the Metropolitan Life Insurance Co. , clucks that 48 million Americans are overweight .']]","[[-0.15198764204978943, -0.1516946703195572, -0.15158715844154358, -0.15100792050361633], [-0.10046517848968506, -0.10043442249298096, -0.1003541648387909, -0.1003541648387909], [-0.0001460844650864601, -0.0001200363039970398, -8.140318095684052e-05, -7.326249033212662e-05], [0.09984523802995682, 0.09987763315439224, 0.09988035261631012, 0.0999336838722229], [0.19757762551307678, 0.19800451397895813, 0.19859370589256287, 0.1987924426794052], [0.33779048919677734, 0.3385528326034546, 0.33947324752807617, 0.34477001428604126]]",49.00690841674805,37.13661193847656,"[37.791568756103516, 40.97459411621094, 39.09413528442383, 39.2948112487793, 38.4273681640625, 36.003196716308594]",35.19775390625,"[35.54365539550781, 41.222328186035156, 38.861236572265625, 37.8807487487793, 37.95956039428711, 35.806766510009766]"
32,"In one study using data from about 4,500 respondents to the Florida Family Formation Survey, social psychologist Benjamin Karney, PhD, of the University of California, Los Angeles, and colleagues found that the marriages of lower-income couples were more likely to be hurt by stressful life events and mental health problems than the marriages of the more affluent couples.","[[""The Ford and the pickup truck sped west toward Sanford's Run ."", 'The surface , however , was perfectly white .', 'The surface , however , was perfectly white .', 'The surface , however , was perfectly white .'], ['Of current interest is Abilene , Kansas , the birthplace of ex-President Eisenhower .', 'and that which is born of the Spirit is spirit .', 'Jones had been about a hundred and fifty feet from her when he first broke through to the top of the Reef .', 'After Mr. Jack drove away , Winston went on looking out the window .'], ['On that first day , Blanche literally thought she was going to die , or , at the very least , go out of her mind .', 'The lower portion necessitates only films of Hand .', 'He would not look up .', 'He would not look up .'], ['Perhaps he had better have someone help him put up the pegboard and build the workbench -- someone who knew what he was about .', 'Bill Jr. , 20 , Kathy , 15 , and Patricia , 9 , round out the Shea family .', 'Similarly the optimism of age protests too much .', 'Similarly the optimism of age protests too much .'], ['Those who walk on it may encounter at any turn ministers of grace or damnation .', 'Those who walk on it may encounter at any turn ministers of grace or damnation .', ""I'm honey only to my husband , understand '' ? ?"", ""I'm honey only to my husband , understand '' ? ?""], [""It's inevitable in this case , for the couple will be separated for , at the least , forty years ."", ""It's inevitable in this case , for the couple will be separated for , at the least , forty years ."", ""While it is easy enough to ridicule Hawkins' pronouncement in Pleas Of The Crown from a metaphysical point of view , the concept of the `` oneness '' of a married couple may reflect an abiding belief that the communion between husband and wife is such that their actions are not always to be regarded by the criminal law as if there were no marriage ."", 'One such wife , Dr. Linden says , became disgusted with her weak husband and flurried through a series of extramarital affairs in the hope of finding a stronger man .']]","[[-0.16633731126785278, -0.16455398499965668, -0.16455398499965668, -0.16455398499965668], [-0.10035660862922668, -0.1002880111336708, -0.1001364141702652, -0.10013500601053238], [-1.7861835658550262e-05, -1.092720776796341e-05, -4.734843969345093e-06, -4.734843969345093e-06], [0.09988010674715042, 0.09988187253475189, 0.09988920390605927, 0.09988920390605927], [0.19920440018177032, 0.19920440018177032, 0.19930905103683472, 0.19930905103683472], [0.35835665464401245, 0.35835665464401245, 0.35949668288230896, 0.37724369764328003]]",62.98764419555664,55.58836364746094,"[62.629451751708984, 61.33628463745117, 57.44549560546875, 56.28839874267578, 61.06873321533203, 60.66423034667969]",47.908695220947266,"[47.60866165161133, 51.3766975402832, 48.49824523925781, 47.874759674072266, 50.911556243896484, 52.01140213012695]"
5,"Lower-income groups, however, experienced more problems related to economic and social issues such as drinking or drug abuse (, 2012).","[[') if we are born of god we practice righteousness .', ') if we are born of god we practice righteousness .', ""It is almost time for and calinda to begin '' ."", 'We will then occupy the new plant under lease , with an option to purchase .'], [""We set up the Lloyd's Neck school , worked out its curriculum , and taught there ."", 'Only when that term is ended and he is a private citizen again can he be permitted the freedom and the courage to discount the dangers of his death .', 'Livingston Birdwood , producer of Uprising .', 'Livingston Birdwood , producer of Uprising .'], ['Basic pottery studio equipment .', 'Basic pottery studio equipment .', 'In the f-plane the coordinates of the corresponding point are Af .', 'In the f-plane the coordinates of the corresponding point are Af .'], ['There are about 200 different kinds of Andrena in Europe alone .', 'Approximately 100 representatives of business attended this conclave and the R. I. Export Conference Committee later voted to continue the activity as an annual event .', 'And now , for Communist listeners and readers :', 'As only a member of the family can share in the innermost joys of the family , likewise one must belong to the family of God in order to receive the benefits that are promised to those who are His own .'], ['Locker-room talk often stresses the idea that a man is doing the girl a favor if he is forceful and ruthless during the first penetration .', 'Locker-room talk often stresses the idea that a man is doing the girl a favor if he is forceful and ruthless during the first penetration .', 'Locker-room talk often stresses the idea that a man is doing the girl a favor if he is forceful and ruthless during the first penetration .', 'Realtors , both generally and in this group , have invariably equated residential integration with a decline in property values , a circumstance viewed with considerable apprehension .'], ['It is not enough in accounting for this feeling to analyze it into the wickedness of individual people added together to produce a cumulative effect .', 'In repetitions of the experiment from couple to couple , the votes of the two persons in a couple probably agree more often than independence would imply , because couples who visit the museum together are more likely to have similar tastes than are a random pair of people drawn from the entire population of visitors .', 'His bold eyes raked the woman , and a perceptive spectator might sense that there was more to their relationship than that of slave to owner .', 'She finds married life stifling and every prolonged sex relationship unbearably monotonous .']]","[[-0.17080119252204895, -0.17080119252204895, -0.1706213504076004, -0.16968023777008057], [-0.1001051589846611, -0.10009904205799103, -0.10008256137371063, -0.10008256137371063], [-3.055855631828308e-05, -3.055855631828308e-05, -2.6829540729522705e-05, -2.6829540729522705e-05], [0.09969612956047058, 0.09973813593387604, 0.09978516399860382, 0.09979759901762009], [0.199053555727005, 0.199053555727005, 0.199053555727005, 0.1996934562921524], [0.33609044551849365, 0.3461063802242279, 0.35453855991363525, 0.358031690120697]]",58.90164566040039,45.96361541748047,"[48.933250427246094, 45.00572204589844, 52.93203353881836, 41.70229721069336, 44.16498947143555, 45.37318801879883]",42.122005462646484,"[45.64019012451172, 39.41102981567383, 46.06399917602539, 40.26939392089844, 42.099708557128906, 43.859161376953125]"
34,It also matters what you talk about.,"[['Altogether fifteen virtually unknown Rodgers and Hart songs are sung by a quintet of able vocalists .', 'Since the Protestant clergy for the most part wear gray or some variant from the wholly black suit , my Roman collar and black garb usually identify me in England as a Roman Catholic cleric .', 'Since the Protestant clergy for the most part wear gray or some variant from the wholly black suit , my Roman collar and black garb usually identify me in England as a Roman Catholic cleric .', 'Victor had been stirred by my account of him in Makers And Finders , for Stephens was one of the lost writers whom Melville had seen in his childhood and whom I was bent on resurrecting .'], [""Samples zoomed into closeup range in regular succession , like telephone poles passing on the highway , while representative music reinforced the mood of the late teens and 1920's ."", 'As long ago as 1851 it was pointed out by Niepce ( 1851 ) that there is a connection between the pituitary and the thyroid .', ""They were always leaping to light cigarettes , open car doors , fill plates or glasses , and I mistrusted the whole lot of them to the same degree that I mistrusted bake shops that called themselves `` Sanitary Bake Shops '' ."", 'In our own time we have seen the most fantastic imagery of a Jules Verne come into actuality .'], ['On the other hand , you may seek His favor , humble yourself before Him and beg His mercy , implore His forgiveness , forsake your sins , and abandon your whole life to Him .', 'the marking nut , used for ink and varnish ; ;', ""`` Confrontation '' should fortify us all , whether in Southeast Asia or the U.S. ."", 'A contractor probably would be required to help build it .'], ['Signora Ferraro , bobbing her head encouragingly , asked Sam about Canada , having a special interest .', 'but he never slept .', 'but he never slept .', ') She might now have taken it away again .'], ['And the league takes a stand , with great regularity , on the side of right .', 'Boyer is suffering from a stiff neck .', 'Boyer is suffering from a stiff neck .', 'And nobody knows what comes next .'], ['But he was too busy to hear what she was saying .', ""But that wasn't very funny , either ."", 'It is awfully talky , for instance , and not all of the talk is terribly impressive .', ""There's better things to do than listen to something like that .""]]","[[-0.1623346507549286, -0.16176575422286987, -0.16176575422286987, -0.16155847907066345], [-0.10055028647184372, -0.10043138265609741, -0.1004272922873497, -0.100359708070755], [-0.00021586567163467407, -0.00020452775061130524, -0.00018527917563915253, -0.0001703016459941864], [0.0995602160692215, 0.09969193488359451, 0.09969193488359451, 0.09970687329769135], [0.19969521462917328, 0.19987356662750244, 0.19987356662750244, 0.1998853236436844], [0.3945491313934326, 0.4028525948524475, 0.4161798059940338, 0.41924184560775757]]",140.61489868164062,76.44763946533203,"[64.90520477294922, 49.73098373413086, 67.66522979736328, 68.70389556884766, 61.049747467041016, 45.58434295654297]",118.63544464111328,"[69.57696533203125, 42.621219635009766, 71.861572265625, 69.6881332397461, 52.2172966003418, 44.61748123168945]"
97,"Psychologists say the answer can be summed up in three words: novelty, variety and surprise.","[['One day Maeterlinck , coming with a friend upon an event which he recognized as the exact pattern of a previous dream , detailed the ensuing occurrences in advance so accurately that his companion was completely mystified .', 'A second later she came behind the wheel and backed off the anchor line until it was set in the ocean floor .', 'Developments in Cuba and Laos also suggested the advisability of an early summit meeting .', ""They recommended , also , that `` at a fixed hour , let the entire family be assembled for night prayers , followed by a short reading of the Holy Scriptures '' .""], ['He ran on his plump sticks of legs , freezing now and again into the sudden startled attitudes which the camera had caught and held on the paling photographs , all carefully placed and glued and labeled , resting in the fat plush album in the bottom drawer of the escritoire .', 'A month later the General Court served notice to the town of Newbury that the bridge was to be built .', 'However , the East Providence Rescue Squad made its way through to my home in time of desperation .', 'I was ready , like Portia , to present my own brief .'], [""`` He's there '' , he got out tersely , curbing his rising excitement ."", 'It was recognized years ago that the transition from daytime to nighttime propagation conditions , and vice versa , is not an instantaneous process , but takes place over periods of time from roughly 2 hours before sunset until about 2 hours after sunset , and again from roughly 2 hours before sunrise until some 2 hours after sunrise .', ""In such a case , however , we would encourage the recipient country to get on with its programing task , supply it with substantial technical assistance in performing that task , and make it plain that an expansion or even a continuation of our assistance to the country's development was conditional upon programing progress being made ."", 'Even in the very area where the shooting had been done , cattle were still disappearing .'], ['Similar measurements are being initiated to resolve a large discrepancy in the heat of formation of another important combustion product , beryllium fluoride .', 'Similar measurements are being initiated to resolve a large discrepancy in the heat of formation of another important combustion product , beryllium fluoride .', 'By 1907 the number of undergraduates had risen to 1,107 .', 'By 1907 the number of undergraduates had risen to 1,107 .'], ['Improves utilization of low-moisture corn ( less than 14% ) .', 'Improves utilization of low-moisture corn ( less than 14% ) .', 'What is the real cause of them ? ?', 'What is the real cause of them ? ?'], [""If you've got any ideas '' ."", ""What did you do with them '' ? ?"", '`` How would I know ? ?', ""`` What do you want to do '' ? ?""]]","[[-0.1468702256679535, -0.14661461114883423, -0.14629411697387695, -0.1458534598350525], [-0.10053355246782303, -0.100521519780159, -0.10049346089363098, -0.10048360377550125], [-9.523099288344383e-05, -8.445698767900467e-05, -6.668642163276672e-05, -6.511062383651733e-05], [0.09990622103214264, 0.09990622103214264, 0.09992791712284088, 0.09992791712284088], [0.1987670511007309, 0.1987670511007309, 0.19928202033042908, 0.19928202033042908], [0.3184039294719696, 0.32094457745552063, 0.32238340377807617, 0.35356757044792175]]",125.38194274902344,95.7083511352539,"[114.05692291259766, 107.9834213256836, 94.34208679199219, 140.76712036132812, 82.68948364257812, 90.2789535522461]",66.63842010498047,"[86.63375091552734, 97.0071029663086, 83.99198150634766, 95.73714447021484, 66.17272186279297, 68.5919189453125]"
