target_idx,target_sent,sents_intrp_all_bins,sim_intrp_all_bins,base_PPL,local_unintrp_PPL,local_intrp_PPL_all_bins,global_unintrp_PPL,global_intrp_PPL_all_bins
113,"She’s the same woman that Myra has been trying to get you to meet, but you’ve never taken the time,” Luigi said in defense of using her first name.","[['( 3 ) Over the years , individuals engaged in the sale of real estate have developed remarkable unity in the methods and practices employed .', 'Mr. Sansom can be eloquent in a spectacular way which recalls ( to those who recall easily ) the statues of Bernini and the gigantic paintings of Tintoretto .', 'In the Analytical phase of their Cubism , Braque and Picasso had not only had to minimize three-dimensionality simply in order to preserve it ; ;', 'It is the strategy of blockade , therefore , that is suddenly at the center of attention of administration officials , Members of Congress , officers in the Pentagon .'], [""The result was an agreement that the Lublin Government should be `` reorganized on a broader democratic basis with the inclusion of democratic leaders from Poland itself and from the Poles abroad '' , and pledged to hold `` free and unfettered elections as soon as possible on the basis of universal suffrage and secret ballot '' ."", 'Why , then , with these voluntary barricades and some state laws barring liquor ads , is it necessary to seek congressional action ? ?', ""But like all despots , as he builds his following from among the gullible , he grows more threatening toward those who won't follow -- such solid citizens as Doc Raccoon ; ;"", 'Then he spread out the last list on the counter .'], ['It was curious how the different visitors took this .', 'But this argument cannot be pushed very far because the Communist system makes up for any shortcomings of its leaders in respect to corrosion .', 'I stood up and began pacing .', 'I stood up and began pacing .'], [""Mercer , despite his happiness , wept a little at the strange fate of B'dikkat ."", ""It's our pleasure ! !"", 'It was just quarter of nine .', ""`` Hold his head up '' .""], [""`` My mother read a book right after I was born and there was a Lilian in the book she loved and I became Lilian -- and eventually I became Paula '' ."", 'But then , redheads are often pale .', 'But then , redheads are often pale .', ""`` Well , at least you won't have to do that '' , she was saying .""], ['Jennie and Miranda twined themselves around me , murmuring endearments .', 'Jennie and Miranda twined themselves around me , murmuring endearments .', ""`` She expecting me to '' ? ?"", ""`` She's probably getting old -- crotchety , I mean -- and we figured uh-uh , better not .""]]","[[-0.18057653307914734, -0.17949490249156952, -0.1792760044336319, -0.17834988236427307], [-0.10282643139362335, -0.10278952121734619, -0.10271911323070526, -0.1027127057313919], [-0.0004768380895256996, -0.00044501200318336487, -0.00044172629714012146, -0.00044172629714012146], [0.09915154427289963, 0.09917927533388138, 0.09921267628669739, 0.09922622889280319], [0.1959347277879715, 0.19597113132476807, 0.19597113132476807, 0.1960144340991974], [0.3079604506492615, 0.3079604506492615, 0.31006062030792236, 0.31177791953086853]]",41.04179763793945,29.485889434814453,"[29.836149215698242, 30.609149932861328, 29.65003204345703, 29.147581100463867, 26.566661834716797, 26.67847442626953]",26.210660934448242,"[27.345808029174805, 27.008081436157227, 26.06140899658203, 26.888538360595703, 26.144128799438477, 26.087522506713867]"
243,“Are you sure that the man is having an affair with the woman?” Ted asked.,"[['Beyond it I noted a small green column , about twelve feet below the present ground level -- the Serpentine Column , three entwined serpents , which once stood at the Temple of Apollo at Delphi , Greece .', 'Beyond it I noted a small green column , about twelve feet below the present ground level -- the Serpentine Column , three entwined serpents , which once stood at the Temple of Apollo at Delphi , Greece .', 'Proceeds realized from these pageants are used by the Jaycees to help support their various youth , health , welfare and community betterment activities throughout the state .', 'Its initial expenses will be paid from appropriations currently available for our foreign aid program .'], [""For it is their catastrophic concept of the Anglo-Saxon invasions rather than Kemble's gradualist approach which dominates the field ."", 'There is a complete synonymy at the beginning of each species description .', 'This features the marching songs of several nations , recorded as though the various national bands were marching by your reviewing stand .', 'This is the key to the conquest of fear .'], ['Once he disposed of these items which screamed so harshly for attention , he could undertake the things which really counted .', 'The acceptance of collective bargaining as a national policy in 1934 , implicit in the writing of Section 7A of the National Industrial Recovery Act , has made it impolitic to oppose collective bargaining in principle .', 'In Greek tragedy as in Shakespeare , mortal actions are encompassed by forces which transcend man .', 'Sections of sweet clover stem and root tumors were treated with 1 : 10 solution of Af for 30 minutes , washed in buffered saline for 15 minutes , stained with Af for 30 minutes , and washed for 15 minutes in Aj .'], ['Whether the pair of Sudanese ivory carvings you lifted really possess the juju to turn your livers to lead , as a dealer in Khartoum assured me , I am not competent to say .', ""Rep. Henry C. Grover , who teaches history in the Houston public schools , would reduce from 24 to 12 semester hours the so-called `` teaching methods '' courses required to obtain a junior or senior high school teaching certificate ."", ""Mrs. Williams had a list which she said contained about nine or ten discrepancies between her memory of Dr. Jenkins's conversation and how they were written up for the board's approval ."", 'He held a cigarette in his right hand .'], [""Next , Steele turns his attention to the `` Courtier '' he is addressing ."", ""Clerfayt of `` Heaven Has No Favorites '' resembles Portago only in that he is male and a race-driver -- quite a bad race-driver , whereas Portago was a good one ."", ""He told me he vowed right then that if he ever got to be a star , this never would be said of him '' ."", ""He told me he vowed right then that if he ever got to be a star , this never would be said of him '' .""], ['It was blackmail and the clerk knew it .', 'She finds married life stifling and every prolonged sex relationship unbearably monotonous .', 'He was so long thinking that my mother had time to inspect her sherry for dregs .', 'Neither was his wife .']]","[[-0.16190434992313385, -0.16190434992313385, -0.1600627303123474, -0.16002264618873596], [-0.10322761535644531, -0.1031668558716774, -0.10311540961265564, -0.1030641719698906], [-0.0007459968328475952, -0.0007423413917422295, -0.0007313992828130722, -0.000631263479590416], [0.09925511479377747, 0.09925730526447296, 0.09926067292690277, 0.09927164018154144], [0.19787822663784027, 0.19791969656944275, 0.19793593883514404, 0.19793593883514404], [0.3227066993713379, 0.3243539035320282, 0.32445183396339417, 0.3263648748397827]]",114.43215942382812,121.97467803955078,"[112.65922546386719, 137.16485595703125, 107.55674743652344, 105.54649353027344, 124.2009506225586, 117.02105712890625]",92.9517593383789,"[89.5669174194336, 90.35704040527344, 80.997802734375, 83.8387222290039, 92.94905090332031, 94.93709564208984]"
145,Right now I need some down time to relax alone.”,"[['The relative geographical isolation of the Brandywine population makes for a limited choice in mating .', 'Use of nomenclature , symbols , units , physical constants :', 'We define these values as Af , and define g{t} in the same way for each T .', 'These local variations were to become ever sharper in the next century and a half .'], ['Yet the press was powerless to put these charges in perspective in its news columns .', 'Yet the press was powerless to put these charges in perspective in its news columns .', 'Facilitatory processes take place between neocortex and hypothalamus via ascending and descending pathways .', 'And now , for Communist listeners and readers :'], ['12% of them worried about their health , although their ailments were imaginary ; ;', 'The argon flow from commercial bottles was regulated by a pressure regulator and measured with a gas flow rator .', ""consequently an experienced children's librarian at headquarters conducts a guidance program designed to promote well-planned library activities , cooperating with the children's librarians in member libraries by means of individual conferences , workshops , and frequent visits ."", 'that is , he was unaware what kind of objects they were or what their use was .'], ['He thought once that he identified the somewhat hysterical voice of Fleischman claiming a kill .', ""`` Have you spoken to a doctor about it '' ? ?"", ""The issue which may make it necessary to have a session is the highly sensitive problem of cutting the state's congressional districts from six to five to eliminate one congressional seat ."", 'Everybody knew that John Cooper had married Edythe on the rebound .'], ['Cady walked the block to the mailbox , almost ashamed of himself for arguing with Anne .', 'If to be a Christian means to say yes where I otherwise say no , or where I do not have the right to say anything at all , then my only choice is to refuse to be a Christian .', 'To confess with a canvas chair as a prie-dieu , gouging at his heart until a rough and stupid hand bade him rise and go ? ?', 'To confess with a canvas chair as a prie-dieu , gouging at his heart until a rough and stupid hand bade him rise and go ? ?'], [""It would be fine publicity for the man who was willing to walk to the mayor's throne over the broken reputation of a helpless girl ! !"", '`` Oh , I forgot to say that if one is taken to the funny house in the funny wagon , he is removed to a mental institution in an ambulance .', 'Louise climbed onto a stool and clutched the hand with which I was trying to hold the phone , claiming my immediate attention on grounds of extreme emergency .', 'Esther , mistaking my hesitation , assured me that the hospital expense would be taken care of by a leading merchant in Strasbourg whom she had already approached .']]","[[-0.1639372706413269, -0.16340216994285583, -0.16327734291553497, -0.1613987684249878], [-0.10344036668539047, -0.10344036668539047, -0.1034032553434372, -0.10331442207098007], [-0.0007472625002264977, -0.0007442906498908997, -0.0007226709276437759, -0.0007083169184625149], [0.09911670535802841, 0.09911714494228363, 0.09913206845521927, 0.09916450083255768], [0.1965334564447403, 0.1965455263853073, 0.19655516743659973, 0.19655516743659973], [0.3146520256996155, 0.3149136006832123, 0.31528568267822266, 0.31535232067108154]]",935.8792114257812,363.2467956542969,"[399.5648193359375, 430.0995788574219, 415.70263671875, 406.3541564941406, 378.7889709472656, 454.2878112792969]",406.6540222167969,"[386.3993835449219, 401.56024169921875, 395.8576965332031, 388.58892822265625, 344.8484191894531, 404.53759765625]"
392,We’re getting married soon.,"[['Blue Throat , who had ruled the town with his six-shooter for the last six months , certainly had no intention of relinquishing his profitable dictatorship .', ""He then got a job with the Chicago Herald-Examiner as a circulation slugger , a rough fighter employed to see that his paper's news pitches were not trespassed upon by rival vendors ."", ""He then got a job with the Chicago Herald-Examiner as a circulation slugger , a rough fighter employed to see that his paper's news pitches were not trespassed upon by rival vendors ."", ""Those which tell a story of the earth's formation in each area can add geological interest to the recreation sites .""], ['Sherman proved that a railway base could be movable and the most brilliant feature of the Atlanta campaign was the rapid repair of the tracks .', ""Mr. Skolovsky's approach to the concerto was bold , sweeping and tonally percussive ."", ""Mr. Skolovsky's approach to the concerto was bold , sweeping and tonally percussive ."", 'And , as we know , the Virgin Lands are not producing as much as Khrushchev had hoped .'], ['His speed was dropping rapidly .', 'His speed was dropping rapidly .', 'A second scene flashed before his mind , the interior of the garage at the new house and the young Bartlett girl turning startled to meet him , the dim dark and the sudden confusion and fear and then the brightness as Mae had clicked on the light .', 'Living in San Francisco I saw them seldom enough to see them with a perspective which was not distorted by exasperation or fatigue .'], [""Another woman , addressing Christmas cards , said to her husband : `` We sent them one last year but they didn't send us one , so they probably won't send us one this year because they'll think we won't send them one because they didn't last year , don't you think , or shall we '' ? ?"", 'He paused , then added , `` Everything on a ship is a weapon .', 'In addition , the polyphosphates are also used , probably acting more as peptizing agents than anything else .', '`` Help me up , Clay .'], [""Honest , kitten , that's all it is -- I don't even like Lucille much '' ."", ""`` Well , all right then '' ."", ""Police said the children's mother , Mrs. Eleanor Somerville , was visiting next door when the fire occurred ."", '`` I am very pleased to have the doubt of suspicion removed .'], ['Jennie and Miranda twined themselves around me , murmuring endearments .', ""Oh , Katharine's awfully nice , and pretty too , I like Katharine -- Let's ask Katharine to go with us , she's always lots of fun -- Katharine --"", 'Montgomery believes that she started well .', 'Arthur Williams had to be located , they agreed .']]","[[-0.18511110544204712, -0.18284371495246887, -0.18284371495246887, -0.18015128374099731], [-0.1027304083108902, -0.10229294747114182, -0.10229294747114182, -0.10217869281768799], [-0.0008544893935322762, -0.0008544893935322762, -0.0008355299942195415, -0.0008244849741458893], [0.09890788793563843, 0.09893816709518433, 0.09894905984401703, 0.0989636480808258], [0.19552220404148102, 0.19560915231704712, 0.19567158818244934, 0.1956733763217926], [0.2581295073032379, 0.25910404324531555, 0.2603074312210083, 0.26033836603164673]]",88.96504211425781,122.0909423828125,"[122.93327331542969, 115.64018249511719, 76.53951263427734, 38.82078552246094, 57.090335845947266, 31.15647315979004]",20.555944442749023,"[37.08512496948242, 38.57133865356445, 28.117534637451172, 23.742786407470703, 23.778594970703125, 18.264694213867188]"
408,"“Are you sure you want to have Myra at our wedding?” David asked, as he tenderly caressed her shoulders.","[['In the electronics industry , this tendency is well illustrated by inventories of TV sets .', 'In the electronics industry , this tendency is well illustrated by inventories of TV sets .', 'The Secretary of the Treasury is authorized and directed to cover into -- ( 1 )', 'Makes drawings and plans of rooms showing placement of furniture , floor coverings , wall decorations , and determines color schemes .'], ['Some 30,000 completed schedules with 20 items ( collected by sub-chiefs in 1,100 circumscriptions ) have been tabulated .', ""`` You live in the present '' ? ?"", 'As only a member of the family can share in the innermost joys of the family , likewise one must belong to the family of God in order to receive the benefits that are promised to those who are His own .', 'Therefore , detergents are used .'], ['Take your time with your drink .', ""Let evildoers contemplate their ways , and let every man beware '' ! !"", ""`` But that was war '' , I said ."", ""you can't very well sidle up to people on the street and ask if they want to buy a hot Bodhisattva .""], ['Cut a strip of clay for sides long enough and wide enough for three impressions of mold design .', 'Cut a strip of clay for sides long enough and wide enough for three impressions of mold design .', 'Mr. Trimble has been in the hospital but is expected back Tuesday .', 'A terrible chill swept through the grove .'], ['Lizzie stated during the inquest that while her father and uncle were in the sitting room the afternoon before the murders , she had been disturbed by their voices and had closed her door , even though it was a very hot day .', 'Jonathan wrote grimly of the destruction of Harpers Ferry before they abandoned it ; ;', 'He spent long hours before the TV spitting out promises of revenge .', 'He spent long hours before the TV spitting out promises of revenge .'], ['She retreated before the naked shame in the old man and the fury beyond it and sank into the darkness of her lodge where Walitzee stirred , mumbling , sitting up in a half stupor to say :', 'His face was still creased in pain as he studied the underside of his arm .', 'He was shaking with tension and it took him a couple of minutes to get his breath and settle down .', 'He glanced up in time to see Roberts hurtling down on him from above , literally flying through the air , his bloody face twisted .']]","[[-0.18176741898059845, -0.18176741898059845, -0.18094410002231598, -0.18043121695518494], [-0.10373812168836594, -0.10372044891119003, -0.10370824486017227, -0.10284343361854553], [-0.0006231050938367844, -0.000620473176240921, -0.0005967393517494202, -0.0005612727254629135], [0.09912681579589844, 0.09912681579589844, 0.09912896901369095, 0.0991528108716011], [0.19712848961353302, 0.19718603789806366, 0.19726167619228363, 0.19726167619228363], [0.3506585955619812, 0.3530639410018921, 0.35678577423095703, 0.36029520630836487]]",197.5273895263672,212.9545440673828,"[239.98617553710938, 263.141357421875, 196.05572509765625, 226.27833557128906, 197.45062255859375, 190.12152099609375]",146.6968231201172,"[173.1280059814453, 173.74710083007812, 140.88771057128906, 152.3495330810547, 155.68382263183594, 142.70828247070312]"
