target_idx,target_sent,sents_intrp_all_bins,sim_intrp_all_bins,base_PPL,unintrp_PPL,intrp_PPL_all_bins
271,"Hearing a loud bang in the hallway outside her apartment, she quietly hoped the new people wouldn’t be as loud when they started living in the apartment.","[['As Littlepage noted : `` A complete picture of Prince Potemkin may be had in his 1788 operations .', 'This is a normal governmental procedure which reflects more accurately cost-accounting principles .'], [""If the content of faith is to be presented today in a form that can be `` understanded of the people '' -- and this , it must not be forgotten , is one of the goals of the perennial theological task -- there is no other choice but to abandon completely a mythological manner of representation ."", 'I would like to quote from the Charter of the United Nations :'], ['He knew the whyfores and the wherefores but he was weak , very weak , on the therefores .', '361 U. S. 899 .'], [""He would sit , slim-waisted and spare , on the edge of Scotty's bed , his legs crossed so elaborately that the crossed foot could tap the floor ."", 'Martin gave her a teasing pat .'], ['Actually , there was a lot of force in him , which is why I kept on in that class instead of quitting after a week .', 'A sudden thought wiped the smirk from his face .'], [""A couple of years back , I occupied a Village apartment whose outer staircase contained the type of niche called a `` coffin turn '' ."", 'At the time Alex arrived he was engaged in some sort of intimate communication with the hen , who had settled herself on the nest most peacefully after the occurrences of the morning .']]","[[-0.17749537527561188, -0.17747078835964203], [-0.10415878891944885, -0.10408693552017212], [-0.0009300513193011284, -0.00090017169713974], [0.09873876720666885, 0.09875006228685379], [0.19582980871200562, 0.1958915889263153], [0.3271694779396057, 0.3280184864997864]]",255.07005310058594,175.89202880859375,"[208.0125274658203, 232.8740234375, 177.10081481933594, 170.1980743408203, 167.048828125, 171.25450134277344]"
131,"Besides Myra and the kids, she was the other pearl in his life, and he loved her dearly.","[['One of the uniformed officers stepped in my way , demanding to know whether I had permission to enter Germany .', 'I forced confidence into myself .'], [""Progress is being made , too , in improving motorists' access to many turnpikes ."", 'This creates an amusing effect because its position in a sentence seems to make it apply to the wrong word .'], ['When sufficiently accurate and complete measurements are available , it will be possible to set limits on the thermal and electrical characteristics of the surface and subsurface materials of the moon .', 'When sufficiently accurate and complete measurements are available , it will be possible to set limits on the thermal and electrical characteristics of the surface and subsurface materials of the moon .'], ['The suggestion is naive .', 'The common belief was that there existed one moral order , which included everything .'], ['Mr. White admires him profoundly and leaves no doubt that he is a Democrat himself who expects Mr. Kennedy to be a fine President .', 'for Mother to be able to call , Susan must be napping now , surrounded by her multitude of dolls .'], ['He could think of nothing else save his mental image of her nude figure and what Charles had said that morning about Margaret Rider .', 'Besides , Miss Henrietta -- as she was generally known since she had put up her hair with a chignon in the back -- had little time to spare them from her teaching and writing ; ;']]","[[-0.19401271641254425, -0.18965968489646912], [-0.10391983389854431, -0.10374648869037628], [-0.0007402608171105385, -0.0007402608171105385], [0.09885342419147491, 0.09893624484539032], [0.19407156109809875, 0.19414588809013367], [0.3040715157985687, 0.30468952655792236]]",118.90093994140625,83.38894653320312,"[82.94451141357422, 98.80085754394531, 146.08749389648438, 84.154541015625, 80.3336410522461, 83.2677230834961]"
21,I believe the big boss wants to see me.”,"[['Miss Upton spoke gratefully of the response of Spelman graduates and Negro friends in helping to raise the Fund , and their continuing efforts to raise money for greatly needed current expenses .', 'It is known that at least five towns ( Barrington , Bristol , Narragansett , Newport and Westerly ) place some value on some boats for tax purposes .'], ['The Creston is purely a potboiler , with Spanish , English , French and American dances mixed into the stew .', 'Few of the native Jews who had lived in Lublin were still in the ghetto .'], ['So she brought the fish in whole , and she carried a lemon in her mouth .', 'Other steps would be developed after information drifts down to the local level from the federal government .'], ['The name encouraged him , because he always felt that he could handle the Irish .', ""Curt reached out and dropped Jess's pistol back into the holster .""], [""It was pleasant last night , therefore , to hear him do something else : a concerto he has recently recorded , `` The Emperor '' ."", ""`` I would like to enact a little tableau this afternoon '' , Rector said , He explained about the visit and the effect he wished to create , the picture of a very busy mission .""], ['`` Listen to me , Leigh .', ""This snake could not harm anything '' .""]]","[[-0.19043384492397308, -0.18643246591091156], [-0.10376589000225067, -0.10375005006790161], [-0.0009185969829559326, -0.0008259676396846771], [0.09836859256029129, 0.0983688235282898], [0.19492170214653015, 0.19509857892990112], [0.26497918367385864, 0.2661585509777069]]",246.97152709960938,91.98688507080078,"[144.8551483154297, 117.34358215332031, 106.35452270507812, 116.32008361816406, 99.00865173339844, 88.44276428222656]"
326,I’ll give you time to get to know me after we have gotten married.”,"[[""In a set of case studies of teachers with various social-class backgrounds , Wattenberg illustrates a variety of approaches to students and to teaching which depend upon the teacher's personality as well as on his social-class background ."", ""In a set of case studies of teachers with various social-class backgrounds , Wattenberg illustrates a variety of approaches to students and to teaching which depend upon the teacher's personality as well as on his social-class background .""], ['A squadron of Navy jets and another of long-range patrol planes would add support to the carrier task forces .', 'The tiny hamlet of Chesterton to the north , with the fens and marshes lying on down the Ouse River , may have attracted him often , as it did many other youths of the time .'], ['and it must be enforced without discrimination .', 'and it must be enforced without discrimination .'], [""There had been some coconut in it , for I remember my mother's taking a quick glance at a stringy bit of this nut on the cheek of one of them and then putting down her radish with a shiver ."", ""There had been some coconut in it , for I remember my mother's taking a quick glance at a stringy bit of this nut on the cheek of one of them and then putting down her radish with a shiver .""], [""`` Name one , I been there '' ."", ""I couldn't make out what his racket was .""], [""`` It's only that I like to know where you go '' ."", ""`` You go to bed '' , I said curtly .""]]","[[-0.19443379342556, -0.19443379342556], [-0.1026955097913742, -0.10246642678976059], [-0.0005951113998889923, -0.0005951113998889923], [0.09766237437725067, 0.09766237437725067], [0.1898011863231659, 0.1898142695426941], [0.2706524729728699, 0.2735693156719208]]",189.178955078125,98.43486022949219,"[193.61192321777344, 119.53826904296875, 104.05422973632812, 103.90093231201172, 100.45235443115234, 99.01251983642578]"
375,Both he and Kohana were holding their breath.,"[['But this will not happen merely through the natural process of social life .', ""I'm always trying to find a breaking table in blackjack .""], ['The original machine , bearing its famous serial number , is still on exhibition at the Brown & Sharpe Precision Center in Providence .', 'In southern Europe , between the Israeli Republics and the Icelandic-speaking peoples of northern Europe , was a thin but long stretch of territory called March .'], ['The Twenty-second Soviet Communist Party Congress opens in Moscow today in a situation contrasting sharply with the script prepared many months ago when this meeting was first announced .', 'Government research will look into new products and methods .'], ['Even as she called to the children , Conchita let her gaze seek Tom Brannon .', 'But he weighted the Eighth Symphony , at times , with a shuddering subjectivity which seemed considerably at odds with the music .'], [""You don't head back down again ."", 'In general , Mr. Loesser has done a more consistent job as lyricist than he has as composer .'], ['He finished with the team and filled his pipe and stood looking about him .', 'He would wake up in the middle of the night and fret about it .']]","[[-0.18576112389564514, -0.18487918376922607], [-0.10438510775566101, -0.10436459630727768], [-0.0008487743325531483, -0.0008169189095497131], [0.09840051829814911, 0.09843447804450989], [0.19429618120193481, 0.19441533088684082], [0.33110952377319336, 0.33152177929878235]]",95.78349304199219,99.5299072265625,"[83.15408325195312, 101.50495910644531, 101.0601577758789, 97.90692138671875, 97.2106704711914, 100.0663070678711]"
