target_idx,target_sent,sents_intrp_all_bins,sim_intrp_all_bins,base_PPL,local_unintrp_PPL,local_intrp_PPL_all_bins,global_unintrp_PPL,global_intrp_PPL_all_bins
85,Another factor is finances.,"[['The funds would be used for equipment , not for land , buildings , or operation .', 'Riverside residents would go to the Seekonk assembly point .', 'that was a nightmarish situation and Low was in his element .', 'that was a nightmarish situation and Low was in his element .'], ['This , again , applies to Katanga .', 'From the outside it was an ordinary enough house of the gentry .', 'In exactly three minutes , go in that phone booth behind you and call Police Headquarters .', 'She served one four-year term on the national committee .'], [""Faber's Choice ( Faber Hanover-Sally Joe Whippet ) 2:36 ; ;"", 'Three requirements go with a blockade : It must be proclaimed ; ;', ""I've tried to teach some of the other boys to kick and some of them can't seem to get the feel ."", ""I've tried to teach some of the other boys to kick and some of them can't seem to get the feel .""], ['Patchen does read some of his earlier works to music , but he has written an entire book of short poems which seem to be especially suited for reading with jazz .', ""You could set up tables in the front room and serve salads and your baked beans and brown bread and Grandma could dress like a gypsy and tell fortunes '' ."", ""In an age of oratory , he was the king of orators , and both he himself and Chief Justice Marshall were bathed in manly tears , as Uncle Dan'l reached his thundering climax :"", 'The silicate fractions of stony meteorites show gallium / germanium ratios similar to those of tektites because they too have undergone melting at some point in their histories .'], [""The bond issue will go to the state courts for a friendly test suit to test the validity of the act , and then the sales will begin and contracts let for repair work on some of Georgia's most heavily traveled highways ."", 'While high anxiety children achieve significantly less well ( Af ) in the unstructured school than do low anxiety children , they appear to do at least as well as the average in the structured classroom .', 'Nonetheless , although few in number they are a stubborn crew , as tenacious of life as the Hardshell Baptists , which suggests that there is some kind of vital principle embodied in their faith .', 'I use the phrase advisedly because there was something positively indecent about our relationship .'], [""`` You are bound to get involved with people when you have children '' , Fran had told me at our first meeting , `` so it is good to know that those with whom you get involved are not just dreary little housewives and dull husbands , but People Who Do Things '' ."", ""`` You are bound to get involved with people when you have children '' , Fran had told me at our first meeting , `` so it is good to know that those with whom you get involved are not just dreary little housewives and dull husbands , but People Who Do Things '' ."", 'core - marginal marriages still belong in the category of permissive unions ; ;', 'The two in the bed knew each other as old people know the partners with whom they have shared the same bed for many years , and they needed to say no more .']]","[[-0.15201511979103088, -0.15185728669166565, -0.15142378211021423, -0.15142378211021423], [-0.10186559706926346, -0.1018512099981308, -0.1016024500131607, -0.10155650973320007], [-0.0003759581595659256, -0.00035096425563097, -0.0003448519855737686, -0.0003448519855737686], [0.09944692254066467, 0.0995217114686966, 0.09955814480781555, 0.09956350922584534], [0.19301457703113556, 0.1933707892894745, 0.19342494010925293, 0.19352148473262787], [0.3219691514968872, 0.3219691514968872, 0.322862446308136, 0.32770949602127075]]",616.8350219726562,456.8775634765625,"[446.6105651855469, 525.8505249023438, 452.4118957519531, 488.23333740234375, 475.4273376464844, 513.104736328125]",450.73834228515625,"[504.93902587890625, 590.3157958984375, 501.78564453125, 519.3102416992188, 520.8589477539062, 565.41162109375]"
90,"Stress, for example, can cause even the strongest relationships to crumble, psychologists' research finds.","[['The fossilized remains of many of these trees are found embedded in the clay .', 'Just short of forty lashes we finally managed to coerce our children to this view .', 'Then we have informed a large number of our crew that when they reach the United States , they will be punished but that in the meanwhile , they may run loose and are expected to perform their jobs in good order .', "") And without high density in the core , rapid-transit systems cannot be maintained economically , let alone built from scratch at today's prices .""], [""Sometimes , on a return trip , the aviator would `` go upstairs '' high over the clouds ."", 'But the information on the dynamics of population was often quite misleading .', 'The bill is designed to provide special schooling for more deaf students in the scholastic age at a reduced cost to the state .', 'Speaking of his work with Johnny Mercer , Arlen says , `` Our working habits were strange .'], [""The result was the `` Gross Report '' , prepared by Gross , as chairman , with the assistance of two U.N. Under Secretaries , Constantin Stavropoulos and Philippe De Seynes ."", 'Now the Stone Harbor bird sanctuary , 31 acres of magic attraction for exotic herons , is threatened , but the battlefront extends far beyond our state .', ""Such proposals look to an apocalyptic act , a kind of Lockian `` social contract '' on a world-wide scale ."", 'Almost surely he did ; ;'], ['Drunk or sober she was the most attractive woman in the world for me .', 'Drunk or sober she was the most attractive woman in the world for me .', ""`` We'll stampede the rest ."", 'My husband is in great pain .'], ['Anyway , Julia asks me to .', '`` If Philip Toynbee is claiming that the choice lies between capitulation and the risk of nuclear war , I think he is right .', 'If women replaced people , it would normally have dominant stress .', ""He must become more expressive of his own desires , more demanding and less ' understanding ' '' .""], [""Why she doesn't charge him , I don't know ."", ""Why she doesn't charge him , I don't know ."", ""`` I don't know whether that threatening letter of hers has anything to do with this situation or not , but I want to see who takes the call '' ."", 'In the darkness , she saw him stirring .']]","[[-0.17635664343833923, -0.17620912194252014, -0.17507202923297882, -0.17342552542686462], [-0.10093219578266144, -0.10074812173843384, -0.10071784257888794, -0.10070076584815979], [-0.00029999949038028717, -0.000290068332105875, -0.0002780649811029434, -0.00027284398674964905], [0.09916950762271881, 0.09916950762271881, 0.0992196649312973, 0.09923028200864792], [0.1914583444595337, 0.191829115152359, 0.1925976574420929, 0.19270861148834229], [0.24999113380908966, 0.24999113380908966, 0.25192177295684814, 0.2530233561992645]]",446.5456237792969,243.6743927001953,"[208.30921936035156, 203.14306640625, 307.22344970703125, 282.21392822265625, 233.23695373535156, 267.3169860839844]",220.72674560546875,"[211.95042419433594, 200.60009765625, 271.1523132324219, 261.0348205566406, 213.43478393554688, 251.9624786376953]"
19,"In a 2012 paper in the , Shelly Gable, PhD, of the University of California, Santa Barbara, and colleagues found that participants who felt supported by a partner during a positive event, such as receiving a high rating at work, felt better about themselves and about their relationships.","[['Moreover , it should not be so fastidious in its growth requirements as to make production on a militarily significant scale improbable .', ""It has a hull patterned on that of the United States navy's Nautilus , the world's first atomic submarine ."", 'The disagreement was over what Dr. Jenkins had said at a previous session and how his remarks appeared in the minutes presented at the following meeting .', ""the Commission on Race and Housing concluded that `` there is no reason to believe that real estate men are either more or less racially prejudiced , on the whole , than any other segment of the American population '' .""], [""She said , `` Well , those are the really interesting things , but if you don't like any of those I can turn over some of my extra typing jobs to you , if you think you can type well enough '' ."", ""He contends this idea doesn't conflict with experiments on which the principle of conservation of matter and energy is based because some slight error must be assumed in such experiments ."", ""He contends this idea doesn't conflict with experiments on which the principle of conservation of matter and energy is based because some slight error must be assumed in such experiments ."", ""It sure as hell doesn't look like any dominant intelligent species to me .""], ['He was wearing sneakers and shorts and an open-collared shirt , and in his hand he carried a little black bag .', 'and an Air Force of 91 combat wings and 825,000 men .', 'They have fine FN actions and a better-than-average finish on both the metal and the stock wood .', 'It is not making them sensitive to the sub-Christian level of much of our economic and industrial life .'], ['Special districts in Rhode island .', 'Registrations of new cars in Dallas County cracked the 3,000 mark in March for the first time this year .', 'In such conditions all freedoms are lost .', 'In such conditions all freedoms are lost .'], [""`` If you're goin' to kill 'em -- ! !"", '`` A stake-out , I suppose .', '`` A stake-out , I suppose .', ""I'll bribe you with a nice '' -- He was about to say `` double martini '' but thought better of it .""], [""21 swingin' a wide loop"", 'The story opens on the eve of his fifty-third birthday , as he prepares for the two weeks of festivities that are to follow .', 'The story opens on the eve of his fifty-third birthday , as he prepares for the two weeks of festivities that are to follow .', ""Aren't you happy '' ? ?""]]","[[-0.16599823534488678, -0.16500230133533478, -0.16439484059810638, -0.16353589296340942], [-0.1013108640909195, -0.10117722302675247, -0.10117722302675247, -0.10107333958148956], [-0.0005180221050977707, -0.0004770010709762573, -0.0004674280062317848, -0.0004598470404744148], [0.09905314445495605, 0.09907421469688416, 0.09917975217103958, 0.09917975217103958], [0.1960635781288147, 0.1962640881538391, 0.1962640881538391, 0.19644567370414734], [0.2729829251766205, 0.27427518367767334, 0.27427518367767334, 0.27572840452194214]]",58.69154357910156,46.15205001831055,"[47.30181121826172, 44.01667404174805, 51.658203125, 47.43706130981445, 48.82262420654297, 53.07650375366211]",39.11440658569336,"[41.5364875793457, 40.09214782714844, 41.74972152709961, 40.21928787231445, 39.277645111083984, 42.20106506347656]"
101,"Few factors undermine a relationship more than boredom, says Orbuch.","[['Let us focus on an atom of calcium from the tip of the bone of my finger and let us suppose that I swallow a magic Alice In Wonderland growing pill .', 'Let us focus on an atom of calcium from the tip of the bone of my finger and let us suppose that I swallow a magic Alice In Wonderland growing pill .', 'The daughter , Lilly , was a very good friend of mine and I always had hopes that someday she and Meltzer would find each other .', 'So , for all practical purposes , it was an independent nation and by now had its own organized government ( unrecognized outside its own borders ) .'], [""That's why I -- why I do a free job now and then ."", ""John's reply was like a declaration of war ."", ""Still , it would be surprising if what one reads did not contribute to one's ideas of right and wrong ; ;"", 'When it is done between races or nations , it is called making a treaty .'], [""After I would finish playing the songs , he'd just go away without a comment ."", 'Well , a man had tried , at the King Arthur , to register with an ocelot .', 'I believe it is an area in which professional planners have failed to set adequate guide posts ; ;', ""`` Doctor '' Lee asked her to lie down on a bed and remove her shoes .""], ['Ekstrohm cleared his throat .', 'Ekstrohm cleared his throat .', 'Ekstrohm cleared his throat .', 'They played crack the whip a few minutes without mishap .'], ['The figure was close enough now for him to see the nose twitching to dislodge the drop clinging there .', 'The figure was close enough now for him to see the nose twitching to dislodge the drop clinging there .', ""Police said the children's mother , Mrs. Eleanor Somerville , was visiting next door when the fire occurred ."", 'She set the dipper on the edge of the deck , leaving it for him to stretch after it while she looked on scornfully .'], ['One shawl was so tremendous that she could not wear it , so she draped it over the banister on the second floor , and it hung over the stairway .', 'Coming home from work , he was startled to see a police car parked in front of the apartment building .', ""We discussed the candle and decided the hypothetical other bum would have left it burning to light his way to the window and because he'd have no reason to blow it out ."", ""The odds thus appear favorable that the secretary's neck may be spared .""]]","[[-0.16846194863319397, -0.16846194863319397, -0.16820143163204193, -0.16743655502796173], [-0.10106991976499557, -0.10105634480714798, -0.10100091248750687, -0.10090964287519455], [-0.0005471501499414444, -0.000542759895324707, -0.0005267411470413208, -0.0005051838234066963], [0.09947991371154785, 0.09947991371154785, 0.09947991371154785, 0.09949861466884613], [0.19698631763458252, 0.19698631763458252, 0.19740423560142517, 0.19777920842170715], [0.2773943543434143, 0.2797934412956238, 0.2833363115787506, 0.2846984565258026]]",512.7525024414062,501.4768371582031,"[504.2335510253906, 443.53643798828125, 501.52178955078125, 556.033203125, 553.7022094726562, 571.5020141601562]",329.304931640625,"[423.56561279296875, 385.3752136230469, 413.9761657714844, 370.0406494140625, 477.04193115234375, 424.0738525390625]"
26,"""If you open yourself up to new opportunities and potential surprises with your partner, then that can slow down adaptation,"" says Lyubomirsky.","[['Few rural areas are protected by zoning .', ""We'll take them in the general order of their popularity ."", 'All too often our language is unduly harsh .', 'A brief for the negative'], ['He had a short , heavy , powerful body .', ""Accident , murder , suicide -- take your pick '' ."", 'she fits into the general scheme well enough .', 'It took some time to locate Horn .'], ['I drew back , drawing back my foot for a kick .', 'But this is fully answered by United States v. Nugent , supra .', 'The impending death of Pope', 'Rudy Vallee , who shares star billing with Mr. Morse , makes only two appearances .'], [""`` Of course ( George's letter continued ) , there are practical problems to be considered ."", 'There can be no doubt that the American Catholic accomplishment in the field of higher education is most impressive : our European brethren never cease to marvel at the number and the size of our colleges and universities .', 'I stopped the tractor and I shouted down to the boy , and I knew he could hear me , for the morning was clear and still , but he did not even hesitate in that brutal , murdering dance .', 'Finally , at Ye Olde Gasse Filling Station on Avocado Avenue , they learned that their man , having paused to get oil for his car , had asked about the route to San Diego .'], ['They were married at a lavish ceremony which was duly recorded in Parvenu and all other magazines and newspapers , and then they honeymooned in Bermuda .', 'The physical education program for men recognizes the value of participation in competitive sports in the development of the individual student and aims to give every man an opportunity to enter some form of athletic competition , either intercollegiate or intramural .', 'The physical education program for men recognizes the value of participation in competitive sports in the development of the individual student and aims to give every man an opportunity to enter some form of athletic competition , either intercollegiate or intramural .', 'We do not favor one field over another : we think that all inquiry , all scholarly and artistic creation , is good -- provided only that it contributes to a sense and understanding of the true ends of life , as all first-rate scholarship and artistic creation does .'], [""The sections were mounted on cold slides smeared with Haupts' adhesive ( Johansen , 1940 ) in earlier experiments , and in later experiments with a different mixture of the same components reported by Schramm and Rottger ( 1959 ) ."", '`` We have tried to make both paths attractive , so that good men could find opportunity and satisfaction in either .', 'He had picked out this pathless trail , instead of the common one , in a moment of romantic fancy , to give them privacy on their honeymoon .', 'so that the rest of the house stayed open , though there was a question as to whether it was hotter or cooler that way .']]","[[-0.15800052881240845, -0.15652599930763245, -0.15519174933433533, -0.1541585624217987], [-0.10198875516653061, -0.10194067656993866, -0.10194028913974762, -0.101445272564888], [-0.0005445722490549088, -0.000544525682926178, -0.00048553571105003357, -0.0004470907151699066], [0.09962433576583862, 0.09963397681713104, 0.09966209530830383, 0.09971879422664642], [0.19790019094944, 0.19795705378055573, 0.19795705378055573, 0.19799306988716125], [0.31636226177215576, 0.3174351453781128, 0.31991636753082275, 0.3237401843070984]]",218.8904266357422,214.5740966796875,"[220.20068359375, 237.59605407714844, 209.44004821777344, 233.9011993408203, 219.2079620361328, 222.22552490234375]",204.49124145507812,"[209.64329528808594, 214.94593811035156, 206.62112426757812, 208.6961669921875, 209.26416015625, 215.30836486816406]"
