target_idx,target_sent,sents_intrp_all_bins,sim_intrp_all_bins,base_PPL,local_unintrp_PPL,local_intrp_PPL_all_bins,global_unintrp_PPL,global_intrp_PPL_all_bins
402,Tess was getting up to put on a change of clothes when her doorbell rang.,"[['But it may be , also , that he is merely more mindful of athletics than of esthetics at the present time .', 'But it may be , also , that he is merely more mindful of athletics than of esthetics at the present time .', 'But it may be , also , that he is merely more mindful of athletics than of esthetics at the present time .', 'Instead of that he was engulfed by bedlam .'], ['Thus , stealthily they advanced upstream ; ;', ""Against such a termination of human life on earth by human action , he then proposes as an alternative that we `` negotiate at once with the Russians and get the best terms which are available '' , that we deliberately `` negotiate from comparative weakness '' ."", ""Against such a termination of human life on earth by human action , he then proposes as an alternative that we `` negotiate at once with the Russians and get the best terms which are available '' , that we deliberately `` negotiate from comparative weakness '' ."", ""Now would you care to have us say that you were misquoted in regard to it '' ? ?""], [""In B. M. Spinley's portrayal of the underprivileged and undereducated youth of London , a salient finding was the inability to postpone gratification , a need to satisfy impulses immediately without the pleasure of anticipation or of savoring the experience ."", 'The actual impelling force which severed me from evangelical effort was of another sort .', 'he could feel more than hear the staccato beat of hoofs that fanned out across the prairie to the north .', 'she was terribly alone .'], ['But they wish they could bring it back .', 'The next time it was two legs growing from his chest .', ""The Thrift Shop , with Mrs. Bernhard S. Blumenthal as president , is one of the city's most successful fund-raisers for the Federation of Jewish Agencies ."", ""The Thrift Shop , with Mrs. Bernhard S. Blumenthal as president , is one of the city's most successful fund-raisers for the Federation of Jewish Agencies .""], [""`` I was lonely always '' ."", ""What have you to say to that , Sergeant '' ? ?"", ""`` I want you to have the speakers taken out '' ."", 'These letters became the center of my existence .'], [""`` She really is a dear little thing '' , my mother agreed ."", ""`` Oh , that is demonstrable '' , I told him ."", ""`` I goddamn well understand '' ."", ""`` Cool '' , I told him .""]]","[[-0.1334291696548462, -0.1334291696548462, -0.1334291696548462, -0.13317714631557465], [-0.10059290379285812, -0.10057881474494934, -0.10057881474494934, -0.10039795935153961], [-0.00015386007726192474, -0.00015048589557409286, -0.00015002861618995667, -0.00012445636093616486], [0.09942329674959183, 0.09945521503686905, 0.0995698869228363, 0.0995698869228363], [0.19780761003494263, 0.19787010550498962, 0.19822187721729279, 0.19831378757953644], [0.35482117533683777, 0.3565249741077423, 0.363165944814682, 0.36583203077316284]]",69.38705444335938,73.11573791503906,"[119.4309310913086, 96.71553039550781, 64.15589141845703, 81.3193588256836, 83.42780303955078, 69.21924591064453]",54.9141845703125,"[94.7264633178711, 91.15665435791016, 60.71809005737305, 68.44449615478516, 62.63470458984375, 62.67829895019531]"
366,"Carla, upset with the men, and thinking it unfair that they were not revealing who they were to Tess Jordan, was about to open her mouth when the doorbell rang, and Lynn, Johnetta, and Lisa entered the room.","[['Prokofieff was guided in a consistent direction by the life of his own people -- by the compass of their national ideas .', 'To have Christ dwelling through faith in your hearts .', 'The manner in which this is shared among firms is taken as given .', 'Approximately 40 percent of the value of the work on roads for access to timber which are planned for this period will be constructed by purchasers of National Forest timber , but paid for by the Government through adjustment of stumpage prices .'], ['Construction follows a thorough study of the drawings .', ""But even he will not last indefinitely and the above-noted new arrangements are , quite simply , made to assure qualitative continuity in the Foundation's policies and practices ."", ""But even he will not last indefinitely and the above-noted new arrangements are , quite simply , made to assure qualitative continuity in the Foundation's policies and practices ."", 'These data are not of the precision obtainable by the methods previously mentioned , but the vast number of approximate values available will be useful in many areas .'], ['The Ainus were a primitive people , already living on the island before the principal ancestors of the Japanese came from Southern Asia .', 'We have two media for publicizing individual technical activity , a magazine widely distributed both within and without the company , and an information bulletin for engineering personnel distributed to the homes of all engineers .', ""You don't head back down again ."", 'You know how the ranchers in the valley are .'], ['Scientists say it is the last spewings of a great glacier , but one rather feels that only a malevolent giant could have piled up those crouching monsters of granite which still seem to preserve a sort of suspended , ominous life in them .', 'Scientists say it is the last spewings of a great glacier , but one rather feels that only a malevolent giant could have piled up those crouching monsters of granite which still seem to preserve a sort of suspended , ominous life in them .', 'But it is to say that this need is far more important for such infatuation than most of the pundits seem to have suspected .', 'Here is the promise of a vacation trip they can afford .'], ['almost everyone , on first hearing one of his own sessions on tape , expressed some desire to take the whole thing over again .', 'He was laughed off the screen .', 'He was laughed off the screen .', ""`` We go to the park with this nice lady '' , one of them said .""], [""First I've got to intercept my brothers before they get any deeper into trouble ."", '`` I reached into that funny little pocket that is high up on my dress .', 'I suppose I should have paid attention to that half-murmured remark , but it seemed one of those extreme statements women under stress indulge in .', 'Louise climbed onto a stool and clutched the hand with which I was trying to hold the phone , claiming my immediate attention on grounds of extreme emergency .']]","[[-0.1568916141986847, -0.15496379137039185, -0.15367574989795685, -0.1531258374452591], [-0.10167361795902252, -0.10165031254291534, -0.10165031254291534, -0.10142873227596283], [-0.0003021685406565666, -0.0002456093207001686, -0.0002153143286705017, -0.0002003982663154602], [0.09950624406337738, 0.09950624406337738, 0.09954849630594254, 0.09955591708421707], [0.19900041818618774, 0.19913113117218018, 0.19913113117218018, 0.19917097687721252], [0.34983694553375244, 0.3544059991836548, 0.3574550747871399, 0.35921698808670044]]",36.21413803100586,30.682615280151367,"[35.205440521240234, 32.82111740112305, 32.98674774169922, 31.729921340942383, 29.785892486572266, 29.940677642822266]",32.67106246948242,"[36.56243896484375, 33.51390075683594, 33.94234085083008, 32.69517135620117, 32.468257904052734, 31.755794525146484]"
335,She doesn’t deserve it.”,"[['Are you following competition willy-nilly -- trying to match dollar for dollar -- or are you experimenting with new means for reaching and influencing consumers ? ?', 'It places the various factors involved in the problem in their correct order in relation to each other so that the influence of factors on each other can be computed .', 'They specialize in out-of-the-way items and old French music naturally occupies a good deal of their attention .', 'the purchase of equipment , facilities , machinery , supplies , or materials ; ;'], [""If you want to raise feed or carry out some enterprise on a larger scale , you'll need more land ."", 'In addition , the polyphosphates are also used , probably acting more as peptizing agents than anything else .', 'To hold them was an essential part of French policy , for they controlled the upper termini of the routes from the north to Mobile .', 'The interest rate will be similar to those prevailing in India on comparable loans and the maturities will be consistent with the purposes of the financing .'], ['As a naturalist living for two years at the headwaters of the Amazon , he had collected specimens for Mexican museums , and he had taken to the London zoo a live quetzal , the sacred bird of the old Mayans .', ""When Mickey Charles Mantle , the New York Yankees' man of muscle , drives a home run 450 feet into the bleachers , his feat touches upon the sublime ."", 'There remain many political and administrative problems to be solved .', 'In any case but the last , such a course is sure to avenge itself upon the individual ; ;'], ['Later accounts blamed defective wiring for starting the fire ; ;', 'The new members justifiably expect some things from their church family :', 'The first of these involved the replacement of the Tsar by a liberal Provisional Government in March , 1917 ; ;', 'Welch wanted to know why .'], ['Do you insist that unneeded salary employees take their vacations during plant shutdowns ? ?', ""`` He's there '' , he got out tersely , curbing his rising excitement ."", 'Hours after a parade of his new Soviet tanks and artillery , Dictator Fidel Castro suddenly confronted the U.S. with a blunt and drastic demand : within 48 hours , the U.S. had to reduce its embassy and consulate staffs in Cuba to a total of eleven persons ( the embassy staff alone totaled 87 U.S. citizens , plus 120 Cuban employees ) .', 'Contemplating these posthumous punishments , Stalin should not lose all hope .'], [""`` There's some mistake '' , he said finally ."", ""`` That's right '' , I told him ."", ""`` He says I'm to take the message '' ."", ""`` C'mon '' , he whispered ; ;""]]","[[-0.15387707948684692, -0.15353921055793762, -0.15209876000881195, -0.15195348858833313], [-0.10124900937080383, -0.10124750435352325, -0.10121329873800278, -0.10117468237876892], [-0.00027914345264434814, -0.0002477802336215973, -0.00021880120038986206, -0.00017103925347328186], [0.09958431124687195, 0.09965473413467407, 0.09971675276756287, 0.09974803775548935], [0.19773972034454346, 0.1977468580007553, 0.19775983691215515, 0.19776907563209534], [0.3833935260772705, 0.3837507367134094, 0.38565367460250854, 0.3894318640232086]]",138.65750122070312,37.74947738647461,"[52.216251373291016, 66.75997161865234, 40.85308837890625, 50.8182487487793, 46.25975799560547, 36.48337173461914]",27.582292556762695,"[33.351985931396484, 36.04209899902344, 33.234222412109375, 33.6932258605957, 40.17218780517578, 29.011449813842773]"
254,* * * * *,"[['For his workmanship we are , created in Christ Jesus .', 'The introduction of the United States Pharmacopoeia reference standard in 1952 and the redefinition and equating of the USP and international units of thyroid-stimulating activity have made it possible to compare results published by different investigators since that time .', 'The introduction of the United States Pharmacopoeia reference standard in 1952 and the redefinition and equating of the USP and international units of thyroid-stimulating activity have made it possible to compare results published by different investigators since that time .', 'More and more boats move overland on wheels ( 1.8 million trailers are now in use ) and Midwesterners taking long weekends can travel south with their craft .'], ['He tells of three men who started out on a trip across a single paddock , a ten-by-ten-mile square owned by a sheep grazer .', 'A number of C clamps hold the pieces together on the jig until the glue sets .', 'Practically all the people of Laos , he explained -- about two million of them -- are rice farmers , and the means and motives of modern war are as strange to them as clocks and steel plows .', 'Throughout the nineteenth century Christianity exerted its influence on American society as a whole primarily through the Protestantism of the older stock .'], ['roads and river barges to be built .', ""Middletown bases its claim on the general provision of the law that `` all rateable property , both tangible and intangible , shall be taxed to the owner thereof in the town in which such owner shall have had his actual place of abode for the larger portion of the twelve ( 12 ) months next preceding the first day of April in each year '' ."", 'New simplified packaged units , recently devised prefabricated glass-fiber ducts , and improved add-on techniques make it possible to acquire a system for an 1800-square-foot house for as little as $600 to $900 .', 'All pricks like Coughlin run it anyway , one way or another .'], ['Study the topography of the suite .', 'The tasks are briefly indicated by these questions : What are my goals in Gentile-Jewish relations ? ?', ""Felix is all there is '' ."", 'the particle would then move toward the nose , where it could be wiped out with a wisp of cotton .'], [""`` But she promised -- This will be different '' , he said at last ."", ""`` Tell Mr. Gorboduc what you're doing these days '' , my mother advised the children , ceremonially ."", 'She had black eyes , long and intriguingly tilted , and the way she walked was melody .', 'He had hobbled downstairs into the parlor , in his agony , and was sitting , wrapped in his bathrobe , on a footstool .'], ['He muttered , and took off , obviously feeling like a fool .', 'So would she mind speaking a little louder ? ?', ""She raised her face and nodded , `` It's sweet , and very sad '' ."", ""He thought a moment , then inquired , `` You mean petted '' ? ?""]]","[[-0.1499902456998825, -0.14908768236637115, -0.14908768236637115, -0.1488061547279358], [-0.10111561417579651, -0.10104706883430481, -0.10099683701992035, -0.10078586637973785], [-0.00020786374807357788, -0.00017397664487361908, -0.00015586009249091148, -0.00013329088687896729], [0.09952571988105774, 0.09953829646110535, 0.09960169345140457, 0.09963377565145493], [0.1977040022611618, 0.19818638265132904, 0.19822698831558228, 0.19836723804473877], [0.3562079071998596, 0.3576708734035492, 0.3598548173904419, 0.36331602931022644]]",40.09796142578125,11.581562995910645,"[8.268708229064941, 18.6323184967041, 27.6314640045166, 13.35539436340332, 11.50734806060791, 10.509234428405762]",12.053851127624512,"[7.93458890914917, 14.51134967803955, 15.023483276367188, 11.187427520751953, 10.200736045837402, 11.276190757751465]"
25,“Are you sure?” Tess asked softly.,"[['He is a dreamer of the good society with a plan to put into effect , and he is an individual craftsman with something to make for himself and the people of his time .', 'But it is the wooden sculpture from Bali , the one representing two men with their heads bent backward and their bodies interlaced by a fish , that I particularly call to your attention .', 'But it is the wooden sculpture from Bali , the one representing two men with their heads bent backward and their bodies interlaced by a fish , that I particularly call to your attention .', 'What does it all add up to ? ?'], ['But these Western countries do care about themselves .', 'But these Western countries do care about themselves .', 'But these Western countries do care about themselves .', ""An architect's sketch of the new plant is shown on the front cover .""], [""`` I Saw Stars '' , `` Lover Man '' , `` Menilmontant '' and `` Swing 42 '' ."", 'In fact , he did not think about Jerry Burton at all until he entered his living room and closed the door behind him .', 'He watched his own body with remote , casual interest .', ""Sing Sing's prisoner strike was motivated by a reasonable purpose , a fair break from parole boards .""], ['This was the first word from Jensen on his sudden walkout .', 'This was the first word from Jensen on his sudden walkout .', 'The girl was in critical condition with burns over 90 per cent of her body .', 'He could have left for Weybosset Street after her murder and made it in plenty of time by using the streetcar .'], [""`` That's swell '' , I said sweetly ."", 'Her hand tightened on the receiver .', ""`` Mike , there's Mars ."", ""`` Mike , there's Mars .""], ['She thought she was going to die .', 'Ann was plainly disappointed in his appearance .', 'Martin gave her a teasing pat .', ""Quint closed the screen door quietly so Maggie wouldn't be scared .""]]","[[-0.15846814215183258, -0.15789103507995605, -0.15789103507995605, -0.15769004821777344], [-0.10079886019229889, -0.10079886019229889, -0.10079886019229889, -0.10077688097953796], [-0.00026142969727516174, -0.0002468060702085495, -0.00023338571190834045, -0.00023150630295276642], [0.0996367558836937, 0.0996367558836937, 0.09969017654657364, 0.09971365332603455], [0.19745802879333496, 0.19785523414611816, 0.19806993007659912, 0.19806993007659912], [0.35948270559310913, 0.36378228664398193, 0.36609455943107605, 0.36711251735687256]]",1484.405517578125,1453.8271484375,"[1088.400634765625, 1307.052001953125, 1071.0101318359375, 1008.3532104492188, 1240.75634765625, 1207.1923828125]",486.8308410644531,"[602.3084716796875, 669.4068603515625, 538.9602661132812, 568.1414794921875, 525.2939453125, 591.02587890625]"
