target_idx,target_sent,sents_intrp_all_bins,sim_intrp_all_bins,base_PPL,local_unintrp_PPL,local_intrp_PPL_all_bins,global_unintrp_PPL,global_intrp_PPL_all_bins
218,"“Don’t you have a cellphone, or are you one of those cheapskates who decide to poach off others?” Tess asked, unimpressed and angry with the gentleman standing before her.","[[""Despite the successful rehabilitation of over a half million disabled persons in the first eleven years after 1943 , the existing program was still seen to be inadequate to cope with the nation's backlog of an estimated two million disabled ."", ""Despite the successful rehabilitation of over a half million disabled persons in the first eleven years after 1943 , the existing program was still seen to be inadequate to cope with the nation's backlog of an estimated two million disabled ."", 'The inclination here is to accept a de facto cease-fire in Laos , rather than continue to insist on a verification of the cease-fire by the international control commission before participating in the Geneva conference .', ""Twenty-one-year-old Milt Pappas and Jerry Walker , 22 , are scheduled to share the Oriole mound chores against the Bombers' Art Ditmar in Sunday's 2 P.M. encounter .""], [""You don't head back down again ."", 'When the Brown & Sharpe Manufacturing Company reached its 125th year as a going industrial concern during 1958 , it became an almost unique institution in the mechanical world .', 'Instead of relatively small sales to many accounts , there are now larger sales to or through fewer accounts .', 'Instead of relatively small sales to many accounts , there are now larger sales to or through fewer accounts .'], [""Later in the century the dream again found expression in the lines of Katherine Lee Bates ( 1859-1929 ) , daughter and granddaughter of New England Congregational ministers , in her widely sung hymn , written in 1893 , `` America The Beautiful '' , with the words `` O beautiful for pilgrim feet whose stern impassioned stress a thoroughfare for freedom beat across the wilderness ."", ""Later in the century the dream again found expression in the lines of Katherine Lee Bates ( 1859-1929 ) , daughter and granddaughter of New England Congregational ministers , in her widely sung hymn , written in 1893 , `` America The Beautiful '' , with the words `` O beautiful for pilgrim feet whose stern impassioned stress a thoroughfare for freedom beat across the wilderness ."", 'Angelina placed the tray on the table and with a flick of dark wrist drew off the cloth .', 'I believe it is an area in which professional planners have failed to set adequate guide posts ; ;'], ['Proponents of single elements tend to ensure predominance of that element without determining if it is justified , and the element with the most enthusiastic and vociferous proponents has assumed the greatest importance .', 'Foster had brought extra clothing also .', 'Is the land suited to the crops you intend to raise ? ?', 'I had no doubt that it was .'], ['it has sought new sympathy for the human aspirations of racial minority groups in this country .', 'it has sought new sympathy for the human aspirations of racial minority groups in this country .', 'The girl kneeled by her husband with one arm at his back .', 'The girl kneeled by her husband with one arm at his back .'], ['His heart , he discovered , was pounding .', 'It was the only thing in his life for which he felt guilt .', 'It took him about fifteen minutes to calm himself ; ;', 'He helped her meet people so she could go out and do the work she wanted .']]","[[-0.1584031581878662, -0.1584031581878662, -0.15823686122894287, -0.1576118767261505], [-0.10145173966884613, -0.10142514109611511, -0.10139821469783783, -0.10139821469783783], [-0.0005197012796998024, -0.0005197012796998024, -0.0005187876522541046, -0.0005035512149333954], [0.09948733448982239, 0.09949900209903717, 0.0995001494884491, 0.09957708418369293], [0.1973332315683365, 0.1973332315683365, 0.19734930992126465, 0.19734930992126465], [0.3629814386367798, 0.3672560453414917, 0.3681768774986267, 0.3822178244590759]]",183.78350830078125,138.62042236328125,"[144.1404266357422, 144.27940368652344, 136.34628295898438, 137.95704650878906, 131.05767822265625, 136.00428771972656]",131.39419555664062,"[140.25836181640625, 135.5236053466797, 139.3743896484375, 132.66339111328125, 127.75018310546875, 131.66131591796875]"
46,"“Oh, really now?” Kohana asked curiously, as he let out a chuckle.","[['There are a lot of Scandinavians in this neck of the woods , and many still make painted furniture and take steam-baths .', 'Higher proportions were sampled in urban and mixed communities than in rural areas .', 'Roles of various types , within the larger system and within the subgroups 3 .', 'It went to church on Sunday and one Saturday a month went to confession .'], ['But since railroading and mining are not the highest paid arts , Mantle and Maris concentrate on baseball .', ""Now lay 12 pieces of Af cut 5-3/4'' '' long side by side but separated by 12 pieces of the same material 1/2'' '' sq. ."", 'There were several people on the porch of the farmhouse .', 'we are stronger and more self-confident -- and Low cannot so easily put us to rights .'], [""The President of the United States proclaimed the first Sunday in November as `` National Grandmothers' Day '' and urged America to say it with flowers ."", 'And very , very few were lost when the final connection was made to the control panels of ship or industrial combine .', ""Woodruff's strategy had been immensely successful ."", 'Operating as a one man police force in fact if not in name , he is at once more independent and more dedicated than the police themselves .'], ['Then they were tumbling again , and the big man reached into the same pocket he had gone for earlier , and came up with a vicious switchblade .', 'It is equipped with an automatic threading device to reduce waste and handling time .', ""in particular against a Madonna portrayed in a voluptuous style and modeled , according to gossip , upon the painter's mistress ."", ""`` I ought to '' -- he said .""], ['Her words remained with him , worrying him for hours .', 'He was thinking his way into a new novel , a big one , one that people had been waiting for .', 'Robby could be better', 'For a moment his hatred toward drunken or careless drivers softened .'], ['`` Favor him and save something in case you hit trouble .', ""`` I don't know what you're getting into , Mike '' , he said unhappily ."", ""Next , Steele turns his attention to the `` Courtier '' he is addressing ."", 'A man with insomnia had better avoid bad dreams of that kind if he knew what was good for him .']]","[[-0.1778116673231125, -0.17655211687088013, -0.17625781893730164, -0.17482756078243256], [-0.10175739228725433, -0.101613849401474, -0.10143211483955383, -0.10139532387256622], [-0.00019165687263011932, -0.0001895017921924591, -0.00018437393009662628, -0.00017014704644680023], [0.09972500801086426, 0.09973019361495972, 0.09976092725992203, 0.09981662034988403], [0.19810816645622253, 0.19816863536834717, 0.19857758283615112, 0.19858527183532715], [0.3041684329509735, 0.3078547716140747, 0.31058573722839355, 0.31696656346321106]]",654.3732299804688,380.39630126953125,"[378.4091796875, 332.8778076171875, 394.3555908203125, 359.4223327636719, 352.5306396484375, 345.3300476074219]",315.150634765625,"[335.8296813964844, 313.724609375, 357.0045166015625, 334.83831787109375, 325.0567932128906, 314.0965881347656]"
392,"“I’m sorry,” she said.","[['There is much truth in both these charges , and not many Bourbons deny them .', 'The obscurity of politicians may not always be as innocent as it looks .', 'But this argument cannot be pushed very far because the Communist system makes up for any shortcomings of its leaders in respect to corrosion .', 'corporations , being more amorphous , cannot .'], ['Amen , amen , I say to thee , unless a man be born again of water ( symbol of the Word of God , see Ephesians 26 ) and the Spirit , he cannot enter into the kingdom of God .', '( Leave off the ham and you call it Chicken Pontiac , says Ramsey .', '( Leave off the ham and you call it Chicken Pontiac , says Ramsey .', '( Leave off the ham and you call it Chicken Pontiac , says Ramsey .'], [""Obviously Sloan's early years were influenced by his close friend Robert Henri ."", 'We are left to choose between the two Lindemanns .', 'So , if anybody solicits by phone , make sure you mail the dough to the above .', 'You definitely hear some of the instruments close up and others farther back , with the difference in placement apparently more distinct than would result from the nearer instruments merely being louder than the ones farther back .'], ['All this is standard equipment for a man of your day ; ;', 'This torque causes the entire system to rotate about the **yf axis , since the response to Af .', 'Horse races took place here in the Middle Ages .', ""Last week Chicago happily found its top scholar in Caltech's acting dean of the faculty : dynamic Geneticist George Wells Beadle , 57 , who shared the 1958 Nobel Prize in medicine and physiology for discovering how genes affect heredity by controlling cell chemistry ( Time , Cover , July 14 , 1958 ) .""], ['A second later she came behind the wheel and backed off the anchor line until it was set in the ocean floor .', ""`` I'll get an elegant pair of thin-soled Italian shoes tomorrow , Carla '' ."", ""The idea had come from Herold , who had once been a chemist's clerk ."", 'She turned on her side , finding the idea oppressive .'], [""She was at the moment just a small , walking package , being delivered to her aunt's and uncle's house ."", 'He was enormously happy with her gift and smiled , then went to his room to read .', 'When the meal was ready , he told Jones to wash up , and going into the front room , woke the girl .', ""We didn't even know them till about a month after we moved -- at that time , they had called on us , after I met Fran at a PTA meeting , and had taken us in hand socially .""]]","[[-0.17151367664337158, -0.17116042971611023, -0.1702130138874054, -0.1692444533109665], [-0.10150770097970963, -0.10142794996500015, -0.10142794996500015, -0.10142794996500015], [-0.0004094243049621582, -0.00035907328128814697, -0.0003547864034771919, -0.000351613387465477], [0.09941478073596954, 0.09943312406539917, 0.09944766759872437, 0.09951340407133102], [0.19775985181331635, 0.19778427481651306, 0.1977950781583786, 0.1979438066482544], [0.34380364418029785, 0.3460158705711365, 0.34721624851226807, 0.350311815738678]]",26.88589096069336,12.870677947998047,"[14.363606452941895, 17.899721145629883, 11.82369327545166, 15.54984188079834, 13.07111644744873, 12.52092170715332]",6.539543151855469,"[8.429853439331055, 8.865317344665527, 6.669165134429932, 9.404690742492676, 7.11323881149292, 7.728578567504883]"
313,“Tuesday.”,"[[""It was the Ford that had been outside Burch's farm ."", ""It was the Ford that had been outside Burch's farm ."", 'It was a lead pipe cinch .', 'In contrast are the vast open stretches of ranch country and oil wells .'], ['Wilkes was quite right about one thing .', 'And many advertisers have been happy with the results of letting a Negro disc jockey phrase the commercial in his own words , working only from a fact sheet .', 'And many advertisers have been happy with the results of letting a Negro disc jockey phrase the commercial in his own words , working only from a fact sheet .', 'This is a $14 million operation involving 3,500 employees who work on commuter traffic exclusively .'], ['The way is to rent a chauffeur-driven car .', 'On the morning of November 17th , Cornwallis and 2,000 men had left Philadelphia with the object of capturing Fort Mercer at Red Bank , New Jersey .', 'Thus , stealthily they advanced upstream ; ;', 'Forty-six of the 53 Juniors who mailed in entries were present .'], ['Three groups to meet', 'Let us , like the French , have outdoor cafes where we may relax , converse at leisure and enjoy the passing crowd .', 'Secretary of State Seward was a sick man .', 'The cycle of disaster starts the moment they touch any belonging of ours , and dogs them unto the forty-fifth generation .'], ['The story opens on the eve of his fifty-third birthday , as he prepares for the two weeks of festivities that are to follow .', 'The story opens on the eve of his fifty-third birthday , as he prepares for the two weeks of festivities that are to follow .', 'Their mother is Mrs. Camilla Alsop Wendell .', 'Mary Jane got up , quietly , and walked away .'], ['The children looked at each other and sagged their bottoms down even more comfortably than ever .', 'Arlene was boosting them up when the policeman came by .', 'Salvador saw the youth hold his against the head of stewardess Lois Carnegey ; ;', 'If Mahzeer was planning to set up the prime minister for Muller he would have to do it in the next few minutes .']]","[[-0.174728661775589, -0.174728661775589, -0.17299415171146393, -0.17235660552978516], [-0.10062908381223679, -0.10058541595935822, -0.10058541595935822, -0.10047827661037445], [-0.00021767616271972656, -0.0001997295767068863, -0.00016506947576999664, -0.00014129281044006348], [0.09936964511871338, 0.09937311708927155, 0.09944971650838852, 0.09951496124267578], [0.19617228209972382, 0.19617228209972382, 0.1962626427412033, 0.1966712474822998], [0.23884029686450958, 0.23886322975158691, 0.23900216817855835, 0.23949697613716125]]",284.02386474609375,102.43266296386719,"[150.92164611816406, 102.69539642333984, 106.7706298828125, 111.20307922363281, 185.2977294921875, 140.0473175048828]",49.71794128417969,"[65.62308502197266, 57.39133834838867, 58.220947265625, 61.18126678466797, 98.13768005371094, 59.35051727294922]"
383,We’re getting married soon.,"[['Dominated by the vicious circle of the university promotion system , the analyst looks down on and gets along poorly with the other three groups , although he cannot deny his debt to the collector .', ""Frederick Seward said his father was sleeping , and then went through a pantomime at his father's door , to prove the statement ."", ""Frederick Seward said his father was sleeping , and then went through a pantomime at his father's door , to prove the statement ."", 'Anti-recession programs -- aid for the unemployed , their children and for depressed areas -- account for only 900 million of the 6.9 billion dollar deficit .'], ['Others who wrote of low characters and low life included Thomas Bangs Thorpe , creator of the Big Bear Of Arkansas and Tom Owen , the Bee-Hunter ; ;', 'This result is plotted along with the 8.6-mm observations of Gibson ( 1958 ) in figure 1 , A .', 'When he had the mishap of breaking his spectacles , his ecumenical colleagues insisted on providing him with new ones .', 'the hotel-motel demarcation is becoming harder to find every year .'], [""Pat O'Dwyer looked like a heavier Jim ."", ""Keats's words -- in the days of the Spanish Armada's threats ; ;"", ""Everybody but Tommy seemed to think it was charming when they called , `` Bifutek-san '' ! !"", ""`` A marriage can survive almost any kind of stress except an open and direct challenge to the husband's maleness '' , declares Dr. Calderone .""], ['Suppose it is something right on the planet , native to it .', 'Suppose it is something right on the planet , native to it .', 'She had retreated to this world .', 'But one afternoon Mrs. Mercer met her ; ;'], [""`` You're going to be a regular ."", 'not acquiesce to an international planning board .', 'However , there is a minimum of legislative restriction on boating .', 'Sushi was Out because it was pretentious .'], ['she had made no friends .', ""She's not chubby ."", 'Diario De La Marina was the oldest and most influential paper in Cuba , with a reputation for speaking out against tyranny .', ""`` Oh -- I'm sorry ! !""]]","[[-0.16306117177009583, -0.16272856295108795, -0.16272856295108795, -0.16267457604408264], [-0.10121551901102066, -0.10121339559555054, -0.10108233988285065, -0.1010734811425209], [-0.0002824431285262108, -0.00028232764452695847, -0.00020150095224380493, -0.0001844405196607113], [0.09908291697502136, 0.09908291697502136, 0.0991716980934143, 0.09928399324417114], [0.19494301080703735, 0.19501860439777374, 0.19516800343990326, 0.19540336728096008], [0.2658017575740814, 0.2682753801345825, 0.26944753527641296, 0.27079546451568604]]",88.96504211425781,24.961599349975586,"[21.156841278076172, 26.164281845092773, 22.073925018310547, 20.134220123291016, 24.210054397583008, 24.44781494140625]",20.555944442749023,"[19.72817039489746, 24.504518508911133, 19.33355140686035, 20.641252517700195, 23.838970184326172, 21.587732315063477]"
