target_idx,target_sent,sents_intrp_all_bins,sim_intrp_all_bins,base_PPL,local_unintrp_PPL,local_intrp_PPL_all_bins,global_unintrp_PPL,global_intrp_PPL_all_bins
85,Another factor is finances.,"[[""The airman's stock answer to `` Weren't you cold '' ? ?"", 'The instrument used for this work was a slight modification of that previously described .', 'Ekstrohm shouldered his way outside and scanned the veldt .', 'There being no bridge , the master had to stop at the shore ; ;'], [""By the time I'd made it he was gone ."", 'There was one object which sickened yet fascinated me .', 'One by one he tossed the objects aside .', 'Improve food and cover on 1.5 million acres of key wildlife areas .'], ['Having outlined an approach to the theory and practice of preventive casework , we now address ourselves to our final question : What place should brief , crisis-oriented preventive casework occupy in our total spectrum of services ? ?', 'The Lady Da forced the foremost of her bodies in an upright position .', 'If she were not at home , Mama would see to it that a fresh white rose was there .', 'Two sharply contrasting places designed for public enjoyment are now on display .'], ['However , such a hotbed of gossip had grown up during the trial , that every precaution had to be taken to keep my visit from being whispered to the world , Society , and even , alas , to my own mother .', 'Sydney Wragge , creator of sophisticated casuals for women and Roger Vivier , designer of Christian Dior shoes Paris , France , whose squared toes and lowered heels have revolutionized the shoe industry .', 'They would be coming for him next , bearing down on him from both directions .', ""`` Is it true that you believe the other animals are saner than the human species '' ? ?""], ['The article also said that a person had to be 18 years old or over , and must not be going to high school to attend these classes .', 'No , I forget Mrs. Mathias , who had been away visiting a married daughter when it happened .', ""An amazing article in the Manchester Guardian of last November , entitled `` Fate Of Redundant Churches '' , states than an Archbishops' Commission `` reported last month that in the Church of England alone there are 790 churches which are redundant now , or will be in 20 years' time ."", ""`` My doctors assure me that this increased percentage of risk is not great '' .""], [""I don't ask you who 'tis you're being unfaithful to , husband or lover ."", 'She finds married life stifling and every prolonged sex relationship unbearably monotonous .', 'Many people seem hopeful , yet it is difficult to predict whether or not there will be any more real attainment of Christian unity in 1961 than there was in 1861 .', 'Having ( through my unflagging effort and devotion ) achieved stardom , a fortune and a world-renowned wife at an age when most young men are casting their first vote , Letch proceeded to neglect them all .']]","[[-0.17405705153942108, -0.17360222339630127, -0.17352169752120972, -0.17228980362415314], [-0.10393691807985306, -0.10381172597408295, -0.10380563139915466, -0.10368327796459198], [-0.0007376037538051605, -0.0007127244025468826, -0.0006913607940077782, -0.0006876960396766663], [0.09870356321334839, 0.09870576858520508, 0.09871415793895721, 0.09871700406074524], [0.1873418390750885, 0.18805326521396637, 0.1881258338689804, 0.1883639395236969], [0.28667980432510376, 0.2894294857978821, 0.29244086146354675, 0.2933066487312317]]",616.8350219726562,456.8775634765625,"[484.99298095703125, 451.2144775390625, 518.6351318359375, 444.3048400878906, 510.9970703125, 432.220703125]",450.73834228515625,"[533.586181640625, 471.62701416015625, 609.1778564453125, 493.4366760253906, 544.7925415039062, 488.5566101074219]"
51,"""You don't have to buy that $10,000 trip"" to keep your partner satisfied, says Orbuch.","[['In this one sentence , he unwittingly revealed the basic philosophy of the nutrition and psychological programs in operation at the school .', ""Taxation of tangible movable property in Rhode Island has been generally of a `` hands off '' nature due possibly to several reasons : ( 1 ) local assessors , in the main , are not well paid and have inadequate office staffs , ( 2 ) the numerous categories of this component of personal property make locating extremely difficult , and ( 3 ) the inexperience of the majority of assessors in evaluating this type of property ."", '-- If there are outside windows in the basement corner where you build a shelter , they should be shielded as shown in the Appendix , page 29 .', 'In Wisconsin , take route 55 north of Shawano or routes 78 and 60 from Portage to Prairie Du Chien .'], ['They wanted to touch the mystery .', 'A ship run by a human brain could not run rogue or insane with the power and resources Central had to build into their scout ships .', 'They were staring at him in the same blank and menacing way that the men outside the gate had stared .', ""Here's how the scheme works : Suppose the operator pulls the lever to clear a particular signal .""], ['U.S. Attorney Macon Weaver said the federal complaint , charged that the juror gave false information when asked about Ku Klux Klan membership during selection of jury .', 'I gauged that blow to be borderline .', ""How's it strike you , foul or fair '' ? ?"", ""How's it strike you , foul or fair '' ? ?""], ['The net result is that under American leadership the general world situation has become bad .', ""`` You look like you just heard a real gasser , Mr. Partlow '' ."", 'That got everybody up .', ""Also , it's just possible she might know something about Mrs. Gilborn '' .""], ['At last he noticed a return of the inwardness of pain .', 'At last he noticed a return of the inwardness of pain .', 'In the court once more , I went right toward the Reception House , a long one-story building with a deep portico .', ""`` My , you're peaked .""], [""Thus , the writer decided to hold one experimental section of the functional preparation for marriage course in the spring semester of 1960 exclusively for persons already married -- that is , prerequisite : `` marriage '' ."", ""I'd been seeing Johnnie almost a year now , but I still didn't want to leave him for five whole days ."", ""`` Now he's bought it '' , said my wife contentedly ."", 'Somehow we old-timers never figured we would ever retire .']]","[[-0.1645411252975464, -0.16449064016342163, -0.16414228081703186, -0.1631680279970169], [-0.10518698394298553, -0.10505321621894836, -0.10502900183200836, -0.10467322915792465], [-0.0007467828691005707, -0.0007265033200383186, -0.0007136035710573196, -0.0007136035710573196], [0.0990610122680664, 0.09906930476427078, 0.09912809729576111, 0.09922390431165695], [0.19455227255821228, 0.19455227255821228, 0.1945740282535553, 0.19471007585525513], [0.30566588044166565, 0.30799591541290283, 0.30860310792922974, 0.3109075725078583]]",996.6668090820312,1018.8756103515625,"[949.6484985351562, 974.6093139648438, 948.5343627929688, 909.9327392578125, 1172.763427734375, 1042.2540283203125]",1506.125244140625,"[1125.289306640625, 1180.23876953125, 1066.704345703125, 1152.10009765625, 1227.35302734375, 1118.0015869140625]"
77,It also matters what you talk about.,"[['An internal police operation managed by Scott McLeod , a former F.B.I. man installed as security officer upon congressional insistence , was part of the vengeance .', 'An internal police operation managed by Scott McLeod , a former F.B.I. man installed as security officer upon congressional insistence , was part of the vengeance .', 'With curiosity and elan , he explored every inch of glen , beach and burn , once stranding himself for hours on a ledge high up a sheer seventy-foot cliff and waiting with calm faith to be rescued by Maxwell , who nearly lost his life in doing so .', 'But the warm joy of her brown eyes was open to the general public .'], ['His addle-brained knight-errant , self-appointed to the ridiculous position in an age when armor had already been relegated to museums and the chivalrous code of knight-errantry had become a joke , is , as Cervantes no doubt intended , a gaunt but gracious symbol of good , moving soberly and sincerely in a world of cynics , hypocrites and rogues .', 'This document began : `` No. 1 Newbury Port , may 30th , 1791', 'The straight line would symbolize its uniqueness , the circle its universality .', 'The straight line would symbolize its uniqueness , the circle its universality .'], ['Reduced to beggary , he at last got a job as office boy to a television producer .', '`` In 1951 she was a prostitute in New York County .', 'Some of this trend toward area vocational schools has been related to the problems of persistent labor surplus areas and their desire to attract new industry .', 'The State Department tacitly rejected the neutral Laos idea after the Geneva conference of 1954 , and last year Washington backed the rightist coup that ousted neutral Premier Souvanna Phouma .'], ['Nothing is more revealing of the way of life and literary aspirations of this group than their attitude toward sex .', 'An eyewitness recalled how awkward the red-turbaned colored women appeared as they curtseyed in the church doorway , and the diffidence the former slaves displayed while they listened to the few words that declared them free .', 'Idje still stared over our shoulders at the horizon .', 'That was all he said , Lewis reports .'], [""`` I'll get more snow '' , I said ."", 'or who ingested strange objects , like live fish ; ;', 'Like strawberries in December , pansies are far more exciting in February than in May .', 'Shell people did not , strictly speaking , breathe .'], ['Let the best sex win .', 'Nor is she a wet boat .', ""If the soup tastes like dishwater , your employees won't blame the concessionaire ."", ""`` The hand is out '' .""]]","[[-0.1876416653394699, -0.1876416653394699, -0.18357700109481812, -0.1832197904586792], [-0.10213645547628403, -0.102094367146492, -0.10205753892660141, -0.10205753892660141], [-0.0006452854722738266, -0.0006045927293598652, -0.0005962569266557693, -0.0005881888791918755], [0.09846483916044235, 0.098566435277462, 0.09864968061447144, 0.09872549027204514], [0.19195780158042908, 0.19201558828353882, 0.192399263381958, 0.1926473081111908], [0.24825572967529297, 0.25029414892196655, 0.2515812814235687, 0.2521458864212036]]",140.61489868164062,75.29681396484375,"[63.95204544067383, 58.197383880615234, 144.8181915283203, 56.99442672729492, 56.50938034057617, 68.46098327636719]",118.63544464111328,"[60.97980499267578, 48.175724029541016, 124.74588012695312, 47.248348236083984, 51.83844757080078, 63.87868881225586]"
19,"In a 2012 paper in the , Shelly Gable, PhD, of the University of California, Santa Barbara, and colleagues found that participants who felt supported by a partner during a positive event, such as receiving a high rating at work, felt better about themselves and about their relationships.","[['A reporter restricted to the competing propaganda statements of both sides in a major labor dispute , for instance , is unable to tell his readers half of what he knows about the causes of the dispute .', 'Mold was used as pattern and clay cut by holding knife at about 45-degree angle , to form an undercut , making base smaller than the pattern top .', 'Product research and development', 'She looked out at the corn field , the great green deep acres of it rolled out like the sea in the field beyond the whitewashed fence bordering the grounds .'], ['He doubted whether she heard him , over the running water .', 'I found a parking place half a block away , sat in the car and waited .', 'I found a parking place half a block away , sat in the car and waited .', 'The questionnaire also stated that , in any event , all replies would be treated confidentially .'], ['Dirt , which is here defined as particulate material which is usually inorganic and is very often extremely finely divided so as to exhibit colloidal properties .', 'It now serves the President in his oval office .', 'Chairman Khrushchev and John McCloy had a terrible row at Sochi .', 'The Fairmount Park Commission will no doubt approve my two proposals , because it is responsible for the change of ideological atmosphere in the Square .'], ['He took it without flinching .', 'And it turned out to be more of a family affair than expected .', 'Now , if I were you I would just plan to repair the old church so it would last for five or ten years .', ""A dark bathroom can be pretty scary , and he'd creep back to bed , proud of himself , thinking : Tomorrow , for sure , I'll go down to the rock and keep my promise to Dad .""], ['A dinner and celebration in honor of this piece of engineering took place July 4 , 1793 , in a tavern erected by the corporation on the island .', '`` They were all faded .', 'Robbie was a war veteran with battle-shattered knees .', ""`` Have him come in '' .""], ['-- Make him lie down ! !', 'Give um the works .', ""I couldn't help laughing with him ."", 'She was rollickingly happy .']]","[[-0.1836196929216385, -0.1808595508337021, -0.17970150709152222, -0.17935284972190857], [-0.1026398092508316, -0.10261267423629761, -0.10261267423629761, -0.1025126576423645], [-0.0008462201803922653, -0.000838886946439743, -0.0007882658392190933, -0.0007775668054819107], [0.0984201580286026, 0.09842424839735031, 0.09842893481254578, 0.09845173358917236], [0.19234567880630493, 0.19247877597808838, 0.19250619411468506, 0.1926792711019516], [0.24962148070335388, 0.25044506788253784, 0.251824289560318, 0.25212812423706055]]",58.69154357910156,46.15205001831055,"[50.844913482666016, 46.866310119628906, 51.46550369262695, 50.17966079711914, 50.50162124633789, 49.24947738647461]",39.11440658569336,"[39.676761627197266, 39.01052474975586, 41.44004821777344, 41.281883239746094, 41.82334518432617, 39.86671829223633]"
105,"If you're a lawyer, you take continuing education.","[['pitchers of water merely appear on the tables .', 'The funds would be used for equipment , not for land , buildings , or operation .', 'Like Pilate , they had washed their hands .', 'Pre-shaped corrugated metal sections or pre-cast concrete can be used for shelters either above or below ground .'], ['everything was glamorous to my dazzled eyes .', 'everything was glamorous to my dazzled eyes .', 'between the north shore of Deer Island and the Salisbury side there was an arch of 113 feet and a series of piers with a draw forty feet long .', 'between the north shore of Deer Island and the Salisbury side there was an arch of 113 feet and a series of piers with a draw forty feet long .'], ['Is the land suited to the crops you intend to raise ? ?', 'I never heard of a poll being taken on the question .', 'The Latin , for example , was not only clear ; ;', 'The crowd consequently breaks up into temporary groups ranging in size from two to six , with a half-life for the cluster ranging from three to twenty minutes .'], [""Immediately , the religious groups of the city were embroiled in an angry dispute over the alleged invasion of a man's right to freedom of religious belief and conscience ."", 'She smiled at him with benign , remote happiness ; ;', 'Within themselves , just as people , my friends were often tortured and unappeasably bitter about being the offspring of this unhappily unique-ingrown-screwedup breed ; ;', 'Taken as a whole , though , it was a strong performance from both pianist and orchestra .'], ['Mr. Nixon is `` a broody , moody man , given to long stretches of introspection ; ;', 'Since two of these could be trustees of the college , actually it would be necessary to have the consent of only one elected official to impose a levy of millions of dollars of tax revenue .', 'A study of major denominational membership statistics over a twenty-year period revealed the appalling fact that nearly 40 per cent of those who joined the Church were lost to the Church within seven years .', 'And in a way the promise works out true , for whether he wants you or not , you go with him in your heart .'], [""`` It's ' See Joe , see Jim ' '' , he says ."", 'The two in the bed knew each other as old people know the partners with whom they have shared the same bed for many years , and they needed to say no more .', 'core - marginal marriages still belong in the category of permissive unions ; ;', 'You might try looking into his wife too .']]","[[-0.16800376772880554, -0.16606836020946503, -0.16495484113693237, -0.16454197466373444], [-0.10436409711837769, -0.10436409711837769, -0.1042097806930542, -0.1042097806930542], [-0.0006704665720462799, -0.0006616543978452682, -0.0006570741534233093, -0.0006549656391143799], [0.09928150475025177, 0.09928854554891586, 0.09936071187257767, 0.09936121106147766], [0.19510355591773987, 0.19533976912498474, 0.19573864340782166, 0.19575244188308716], [0.2913320064544678, 0.29403385519981384, 0.29438045620918274, 0.2946692109107971]]",115.65164947509766,46.623687744140625,"[46.93280792236328, 51.313968658447266, 48.84185791015625, 48.37966537475586, 49.900455474853516, 49.271461486816406]",49.11779022216797,"[49.96458435058594, 48.190269470214844, 49.0400390625, 48.78441619873047, 51.03611373901367, 51.72203826904297]"
