target_idx,target_sent,sents_intrp_all_bins,sim_intrp_all_bins,base_PPL,unintrp_PPL,intrp_PPL_all_bins
49,"Stress, for example, can cause even the strongest relationships to crumble, psychologists' research finds.","[['Abel Poupin , a tall man with sunken cheeks and deep-set eyes , got to his feet .', 'Abel Poupin , a tall man with sunken cheeks and deep-set eyes , got to his feet .', 'Eugene offered Harold his car , to use at any time he cared to , and when this offer was not accepted , the armchair creaked .', 'That was the day that he had practically mopped up the main street of Big Sands with Aaron McBride , field boss for the Highlands Oil & Gas Company .'], ['But there he was at the train with an Oregon State pennant in his hand .', 'Django Reinhardt , the ill-fated gypsy , was a true artist , one who demonstrated conclusively the power of art to renew itself and flow into many channels .', 'These contrasting trends in procurement reflect the anticipated changes in the composition and missions of our Armed Forces in the years ahead .', 'For her first three vegetable months she waved her crabbed claws , kicked weakly with her clubbed feet and enjoyed the usual routine of the infant .'], ['If the coating becomes still thicker , a peeling type failure finally can occur .', 'Two late Sonatas , Op. 110 and 111 , were played with similar insight , the disarming simplicities of the Op. 111 Adagio made plain without ever becoming obvious .', 'Third , there were those ( notably Patrice Lumumba ) who favored a unified Congo with a very strong central government .', 'With one down in the eighth , Marv Throneberry drew a walk and stole second as Hyde fanned Tuttle .'], ['the other is how to finance the adjustments when necessary .', 'it was framed in maroon drapes , and no faces were visible .', 'West Virginia toll bonds have defaulted in interest for months , and , despite recent improvement in revenues , holders of the bonds are faced with more of the same .', 'He seemed to be fighting not one man but a dozen .'], ['Yet , paradoxically , according to Dr. Maurice Linden , many wives despise their husbands for not standing up to them .', 'A recent editorial discussing a labor-management agreement reached between the Southern Pacific Co. and the Order of Railroad Telegraphers has been criticized on the grounds that it was not based on complete information .', 'A recent editorial discussing a labor-management agreement reached between the Southern Pacific Co. and the Order of Railroad Telegraphers has been criticized on the grounds that it was not based on complete information .', 'Northerners never think about them whereas Southerners are never really thinking of anything else .'], [""By saying `` another emotional death '' , she reveals that there has been a previous one , although she has not described it in words ."", 'The new members justifiably expect some things from their church family :', 'She finds married life stifling and every prolonged sex relationship unbearably monotonous .', 'His bold eyes raked the woman , and a perceptive spectator might sense that there was more to their relationship than that of slave to owner .']]","[[-0.19092586636543274, -0.19092586636543274, -0.1885528266429901, -0.1880934238433838], [-0.10192010551691055, -0.10175497829914093, -0.10171012580394745, -0.10167720913887024], [-0.0006750486791133881, -0.0006380211561918259, -0.0006084330379962921, -0.0005275607109069824], [0.09835591912269592, 0.09836889803409576, 0.09837710112333298, 0.09848398715257645], [0.19201597571372986, 0.1920456886291504, 0.1920456886291504, 0.19258448481559753], [0.2602062523365021, 0.26060178875923157, 0.26100727915763855, 0.26434820890426636]]",446.5456237792969,220.72674560546875,"[345.452392578125, 304.41778564453125, 220.1859893798828, 256.1943054199219, 246.8729705810547, 237.24441528320312]"
26,"Still, many happy honeymooners go on to divorce years later.","[[""Negro radio is vitally necessary during the process of assimilation '' ."", 'This assembly also supplies a 20-cps switching gate for the electronics circuitry .', 'Assign a series of catechism questions to be memorized .', ""He : `` Come with me to the Casbah '' .""], ['Mercer never noticed the needle touch his arm .', 'Actual mileage allowances are well-administered and not unduly expensive for the state .', 'The policeman walked on , but he looked back once .', 'The policeman walked on , but he looked back once .'], ['She looked out at the corn field , the great green deep acres of it rolled out like the sea in the field beyond the whitewashed fence bordering the grounds .', 'She looked out at the corn field , the great green deep acres of it rolled out like the sea in the field beyond the whitewashed fence bordering the grounds .', 'Early in August we broke ground for a new $3,500,000 plant in Warwick , Rhode Island , which will house our textile and coil winding machinery operations .', 'He started to return it .'], ['Gradually others will move up to the same level', 'Since C is rational , this correspondence has K coincidences , each of which implies a line of the pencil which meets its image .', ""Only the memory of previous hurt , bewilderment and perplexity made him sure that if he did not ask B'dikkat when he , Mercer , was happy , the answer would no longer be available when he needed it ."", 'She would try to see over the bulge of her cheeks and somewhat under her teeth to the place where she was biting .'], [""He spoke through the public address box built into the cabin , and his gigantic voice roared out over the empty plain , so that the pink herd of talking people stirred gently in their happiness and wondered what their friend B'dikkat might be wanting to tell them ."", 'Never until in this work of S-D organization have I realized and felt the attitude and experience of a Teacher .', 'Instead , the audience can sit back at ease and , from the perspective of an enlightened time which no longer believes in such things , enjoy the dead seriousness with which the characters in the play take the witches and devils which are under discussion .', 'All she did was write me a pleasant little note about how it was beautiful while it lasted but that now life had parted our ways and it was goodbye forever .'], ['The children looked at each other and sagged their bottoms down even more comfortably than ever .', 'At the same time that religion exercises a conserving influence , it also energizes and motivates both individuals and groups .', 'They were married at a lavish ceremony which was duly recorded in Parvenu and all other magazines and newspapers , and then they honeymooned in Bermuda .', 'the attitude adopted by realtors and their associations , either negative or positive , plays a large part in the public acceptance of such measures and the degree to which they may be effectively enforced .']]","[[-0.1891603171825409, -0.18884220719337463, -0.18564105033874512, -0.18534044921398163], [-0.10193502902984619, -0.10188708454370499, -0.10185889899730682, -0.10185889899730682], [-0.0005445722490549088, -0.0005445722490549088, -0.0005213096737861633, -0.0004010014235973358], [0.09903133660554886, 0.09905210137367249, 0.09908820688724518, 0.09919291734695435], [0.1937563270330429, 0.19378304481506348, 0.19387343525886536, 0.19394220411777496], [0.28637877106666565, 0.2902092933654785, 0.2910943031311035, 0.29118621349334717]]",107.7564926147461,135.37698364257812,"[174.88502502441406, 151.89356994628906, 129.35897827148438, 160.4479522705078, 102.50694274902344, 101.1016616821289]"
76,"""Doing or saying small things frequently to make your partner feel special, cared for and loved … is very predictive of staying together, being happy and [preventing] divorce,"" she says.","[['The attendant waved me on .', '`` Warm enough to swim -- real Indian summer .', '`` Warm enough to swim -- real Indian summer .', 'During the period , the laboratory rendered centralized macropathological service to qualified requesters .'], ['So the results are subject to considerable confusion .', 'The rest of us can fort up in the house and hang on until you get back .', 'Again , a force too strong for unfrozen bodies to endure would be applied .', 'A meteor could fall on San Francisco .'], [""The film consists of a series of still , transparent photographs , or `` frames '' , 35-mm.-wide ."", 'Or long fat suitcase , for that matter ? ?', ""`` One thing we haven't discussed , expense money ."", ""He intimated that they weren't doing the country much good in the Cold War .""], ['It is evident that Lizzie did not tell everything she overheard between her father and her Uncle Morse .', 'A biting , pithy parable of the all-pervading hollowness of modern life , the piece has been set by Mlle Lagoon to a sumptuous score ( a single motif played over and over by four thousand French horns ) by existentialist hot-shot Jean-Paul Sartre .', ') Well , anyhow , Dogtown Common is so much off the beaten track nowadays that only Sunday picnickers still stray up there , from time to time .', '( 3 ) Over the years , individuals engaged in the sale of real estate have developed remarkable unity in the methods and practices employed .'], ['Retired pay costs are increased by $94 million in 1961 over 1960 , partly because of a substantial increase in the number of retired personnel .', ""In one cartoon a family is shown outside a theater with the head of the family addressing the doorman : `` Excuse me , but when we came out we found that we had left my daughter's handbag and my wife's behind '' ."", ""She was a living doll and no mistake -- the blue-black bang , the wide cheekbones , olive-flushed , that betrayed the Cherokee strain in her Midwestern lineage , and the mouth whose only fault , in the novelist's carping phrase , was that the lower lip was a trifle too voluptuous ."", ""But then , Mario Lanza was no common singer , and his whole career , public and non-public , was studded with the kind of unconventional happenings that terminate with the appearance of his first `` recital '' only when he has ceased to be a living voice .""], ['Because neither of them really wanted their marriage to break up , Mr. and Mrs. Black agreed to a series of interviews at Family Service of Northern Virginia , the agency nearest them .', ""By saying `` another emotional death '' , she reveals that there has been a previous one , although she has not described it in words ."", 'Ann Catt was a lonely , devoted soul , never married , conducting a spotless home and devoted to her church , but a perpetual dissenter and born critic .', 'Ann Catt was a lonely , devoted soul , never married , conducting a spotless home and devoted to her church , but a perpetual dissenter and born critic .']]","[[-0.17439943552017212, -0.17436186969280243, -0.17436186969280243, -0.17311958968639374], [-0.10425238311290741, -0.10421513766050339, -0.1040511280298233, -0.10397089272737503], [-0.0005211643874645233, -0.00045543815940618515, -0.00045502185821533203, -0.0004536053165793419], [0.0989263728260994, 0.0989319235086441, 0.09904229640960693, 0.09907526522874832], [0.1968705952167511, 0.19710132479667664, 0.19714140892028809, 0.19721293449401855], [0.33262723684310913, 0.33585312962532043, 0.3364238440990448, 0.3364238440990448]]",403.3009033203125,339.8995056152344,"[327.13092041015625, 300.4905090332031, 280.2667236328125, 297.0904235839844, 333.4734191894531, 368.2554626464844]"
69,He looked at data from 136 couples over the 10 years since their weddings.,"[['Provision for emergency toilet facilities and disposal of human wastes will be an unfamiliar problem .', 'Provision for emergency toilet facilities and disposal of human wastes will be an unfamiliar problem .', 'So , I say , Mr. Speaker , God bless you and keep you for many years not only for this body but for the United States of America and the free world .', 'Incorporated in commercially prepared feed at proper levels .'], ['Traces of oil on green tissue ? ?', 'Hydrogen is just as plentiful as uranium is scarce .', 'Hydrogen is just as plentiful as uranium is scarce .', 'Hydrogen is just as plentiful as uranium is scarce .'], ['yet her inflection seemed forced or rehearsed .', 'I could see the blood running down his chest .', ""You know , Bang-Jensen characterized your Committee as having prejudged his case '' ."", '-- The New York University Board of Trustees has elected the youngest president in the 130-year history of NYU , it was announced yesterday .'], ['Some of them ignored the texts and had apparently memorized the words long ago .', 'Some of them ignored the texts and had apparently memorized the words long ago .', 'He had always known how to find a bed , and on his own terms .', 'Almost every film bearing the imprimatur of Hollywood is physically authentic -- in fact , impeccably so .'], ['On the other side of the ledger is the fact that he did see his niece and the woman with whom she was staying .', ""Pip's abject leave-taking of Miss Havisham , during which he kneels to kiss her hand , signalizes his homage to a supposed patroness who seems to be opening up for him a new world of glamour ; ;"", 'almost everyone , on first hearing one of his own sessions on tape , expressed some desire to take the whole thing over again .', 'Always she had had the company of other shells and more recently , technicians by the score .'], ['Sometimes a burst of aggressiveness will sweep over a man -- or his wife -- because he or she feels age creeping up .', 'If women replaced people , it would normally have dominant stress .', 'The battle of the Naktong River is just one example of how the battle cry and the spirit of The Fighting Seventh have paid off .', 'The battle of the Naktong River is just one example of how the battle cry and the spirit of The Fighting Seventh have paid off .']]","[[-0.1688767671585083, -0.1688767671585083, -0.1675940752029419, -0.16572465002536774], [-0.10416338592767715, -0.10404375195503235, -0.10404375195503235, -0.10404375195503235], [-0.0007430166006088257, -0.0007334933616220951, -0.000687778927385807, -0.0005944147706031799], [0.09940938651561737, 0.09940938651561737, 0.09944581985473633, 0.09945929795503616], [0.1951795071363449, 0.19536086916923523, 0.19537605345249176, 0.19551753997802734], [0.2791181206703186, 0.2817211449146271, 0.2817487120628357, 0.2817487120628357]]",98.6041259765625,87.86754608154297,"[112.39544677734375, 211.9398956298828, 87.15432739257812, 92.44709777832031, 91.21504211425781, 153.52552795410156]"
56,"But nice talk isn't enough, says Orbuch.","[['But the warm joy of her brown eyes was open to the general public .', ""tulips with `` petals wide and shaggy as a spaniel's ears '' ; ;"", ""Palfrey returned to Massachusetts greatly relieved to have made an arrangement `` so satisfactory to my judgment & my conscience '' ."", 'Repnin , who had a rather narrow face , longish nose , high forehead , and arching brows , looked like a quizzical Mephistopheles .'], ['Dr. Hilprecht was uncertain as to the language used by the ancient priest in his dream .', 'R. B. Gregg has written that `` non-violence and good will of the victim act like the lack of physical opposition by the user of physical jiu-jitsu , to cause the attacker to lose his moral balance .', 'At 4 p.m. the President left the White House to welcome the young musicians , students from the ages of 12 to 18 who spend six weeks at the Brevard Music Center summer camp , and to greet the 325 crippled , cardiac and blind children from the District area who were special guests at the concert .', 'Although the wood has been changed to coal , much of it still retains its original cell structure .'], [""`` Ladies and gentlemen , in place of my regular closing number tonight , I'd like to sing something of a different nature for you ."", 'sometimes he would be up before dawn , clad as a garbage collector and hurling pails into areaways to exasperate us , and thereafter would hurry to the Bronx Zoo to grimace at the lions and press cigar butts against their paws .', 'And Anthony was busy most of the time courting this girl and that .', ""This is an issue which boils down to a matter of opinion , depending on whether you're an American or National fan and anti or pro-Yankee .""], ['Such needs may rise to pathological proportions .', 'State keeps the junketeering list a secret .', ""Starr Jones gets up every morning at five o'clock , milks his family cow , attends to farm chores , and then takes a two-hour train trip to New York ."", ""You may not be responsible '' .""], [""Ernie was screaming inside himself : No , damn you , you ain't gonna take my meal ticket away from me ! !"", ""He said : `` You'll feel a lot better after you have a bath ."", ""He said : `` You'll feel a lot better after you have a bath ."", ""`` A pack of dogs makes less noise '' ! !""], [""Said you wore yourself out , cleaning all these empty rooms '' ."", ""The instruments don't show them '' ."", ""The instruments don't show them '' ."", 'Glendora put down a dish of lukewarm rice .']]","[[-0.1832197904586792, -0.1802997887134552, -0.1797390580177307, -0.17844456434249878], [-0.10204146802425385, -0.10195302218198776, -0.10192215442657471, -0.1018354594707489], [-0.000550808385014534, -0.0005497150123119354, -0.0005464926362037659, -0.0005438048392534256], [0.09875266999006271, 0.09876151382923126, 0.0987844169139862, 0.09880457818508148], [0.1927248239517212, 0.19279953837394714, 0.19279953837394714, 0.19285660982131958], [0.2580692172050476, 0.25871801376342773, 0.25871801376342773, 0.2617776393890381]]",882.2310791015625,864.5370483398438,"[687.649658203125, 1400.0526123046875, 484.42999267578125, 470.5568542480469, 397.03125, 499.552001953125]"
