target_idx,target_sent,sents_intrp_all_bins,sim_intrp_all_bins,base_PPL,local_unintrp_PPL,local_intrp_PPL_all_bins,global_unintrp_PPL,global_intrp_PPL_all_bins
133,"Calming him down, he started crying in her arms as he told her what had happened.","[['This is a normal governmental procedure which reflects more accurately cost-accounting principles .'], ['American technology in engine and hull design is largely responsible for the plentiful interest in American boating .'], [""( I didn't have on a hat .""], ['In describing the initial Allied occupation of a middle-sized German city , the picture has color , pictorial pull and genuinely moving moments .'], [""Then , they said General Burnside was going to jump over his horse's head ; ;""], [""She raised her face and nodded , `` It's sweet , and very sad '' .""]]","[[-0.16047780215740204], [-0.10180798172950745], [-0.0007530609145760536], [0.0989103764295578], [0.19833673536777496], [0.38469064235687256]]",54.22716522216797,54.22716522216797,"[81.40789031982422, 88.60079956054688, 58.75034713745117, 73.27653503417969, 43.88544845581055, 47.53727340698242]",39.113128662109375,"[51.39558792114258, 54.40385055541992, 44.97910690307617, 52.66241455078125, 35.79729461669922, 41.28498458862305]"
144,She was having an affair with Luigi and he was not going to tolerate it.,"[['Some of the classic indicators , as described by Drs. Pittenger , Hockett , and Danehy in The First Five Minutes , are these : ambiguity of pronouns :'], ['That mention of this should bring smiles to our lips today is as clear an indication as we could wish of the extent to which attitudes have changed .'], ['Anti-recession programs -- aid for the unemployed , their children and for depressed areas -- account for only 900 million of the 6.9 billion dollar deficit .'], ['Instead it means that the thinking in which decision issues has the power to determine the morality of the decision , as in this instance the pressure for renewed practical or legislative attention to the constitutional problems the decision had uncovered might have done .'], ['And then he saw something that he had not seen before , and panic gripped him again .'], ['Anthony Steel , as the husband , is a jealous type who argues against her course and sues for divorce , labeling her action adulterous .']]","[[-0.1535557508468628], [-0.10232290625572205], [-0.0004253815859556198], [0.09949499368667603], [0.19824007153511047], [0.33632516860961914]]",21.893342971801758,21.893342971801758,"[38.46324920654297, 20.920150756835938, 27.654409408569336, 27.42949867248535, 20.44474220275879, 20.987503051757812]",15.136480331420898,"[21.16253089904785, 14.70283031463623, 19.1324462890625, 17.46198844909668, 14.787434577941895, 15.668222427368164]"
318,"“Well, what do you want?","[['Here again we run into the roadblock that Negroes do not like to be designated as Negroes in the press .'], ['He feels , suddenly , the weight of the fat that is on him .'], [""If one of Mr. Rodgers' melodies seemed to deserve a better fate than interment in Boston or the obscurity of a Broadway failure , Mr. Hart was likely to deck it out with new lyrics to give it a second chance in another show .""], [""`` I haven't had any luck since I was a baby '' .""], ['But they wish they could bring it back .'], ['You see what I mean ? ?']]","[[-0.1577799916267395], [-0.10105501115322113], [-0.0002682618796825409], [0.09853115677833557], [0.19003096222877502], [0.3531886637210846]]",56.159149169921875,56.159149169921875,"[42.187435150146484, 37.59807586669922, 39.69657516479492, 41.99336624145508, 39.40153503417969, 27.73542594909668]",14.236982345581055,"[20.813703536987305, 18.742944717407227, 23.552379608154297, 20.843311309814453, 21.495479583740234, 12.45518684387207]"
319,I don’t have sex without a marriage license either.”,"[['The firm does a large amount of research and its forecasts have meaning .'], [""This would , naturally , lengthen their courses far beyond the largely esthetic demands of interior designer's training .""], ['The battle of the Naktong River is just one example of how the battle cry and the spirit of The Fighting Seventh have paid off .'], ['Eternity is no time for recriminations .'], [""`` You are bound to get involved with people when you have children '' , Fran had told me at our first meeting , `` so it is good to know that those with whom you get involved are not just dreary little housewives and dull husbands , but People Who Do Things '' .""], ['Ran away on a black night with a lawful wedded man .']]","[[-0.1761254221200943], [-0.10173114389181137], [-0.00043243542313575745], [0.09921963512897491], [0.19150091707706451], [0.2935529351234436]]",223.35948181152344,223.35948181152344,"[343.0956726074219, 314.75146484375, 319.48590087890625, 254.58909606933594, 145.70111083984375, 305.4189453125]",96.3193588256836,"[119.41514587402344, 108.81939697265625, 104.5859375, 87.07951354980469, 96.89726257324219, 108.48372650146484]"
375,Both he and Kohana were holding their breath.,"[['New simplified packaged units , recently devised prefabricated glass-fiber ducts , and improved add-on techniques make it possible to acquire a system for an 1800-square-foot house for as little as $600 to $900 .'], ['Mr. Brown made important additions to the arts in screw machine design by drastically improving the means for revolving the turret , by introducing automatic feeding devices for the stock , and reversible tap and die holders .'], ['At least , we were together and we had Mrs. Hodges , bless her , to look after us -- no mother could be fonder of Gladdy than Mrs. Hodges was .'], ['All they could think of was to run around in circles , kicking their legs out .'], ['Anta , his wife , never seemed to mind .'], ['His bridgework or his plates feel loose and monstrous .']]","[[-0.16633102297782898], [-0.10259386152029037], [-0.0005340040661394596], [0.09890906512737274], [0.1961553394794464], [0.35391080379486084]]",60.52918243408203,60.52918243408203,"[131.3506622314453, 71.45403289794922, 49.61398696899414, 50.43087387084961, 60.17426300048828, 45.37717056274414]",49.26511764526367,"[100.63093566894531, 68.6715087890625, 45.77108383178711, 45.16583251953125, 41.26108932495117, 40.567604064941406]"
