target_idx,target_sent,sents_intrp_all_bins,sim_intrp_all_bins,base_PPL,local_unintrp_PPL,local_intrp_PPL_all_bins,global_unintrp_PPL,global_intrp_PPL_all_bins
339,"Whether David knew or cared that Tess did not work on Saturdays, today would be an exception to policy.","[['The next level attempts to weigh varied evidence and come to a balanced , sensible conclusion ; ;'], [""`` Yes , he's just there .""], ['Three inches of porous material will do a good job of keeping weeds down and the soil moist and cool .'], [""Capt. Michael A. Musmanno , Military governor of the Sorrentine Peninsula , had also seen and felt the `` rain '' .""], [""The trouble was at least partly Juet's doing .""], [""He'd mentioned it , himself , at church and everybody seemed to have the idea that Tolley had left because Jenny had jilted him for Roy Robards .""]]","[[-0.17963308095932007], [-0.10310517996549606], [-0.001058945432305336], [0.09915415197610855], [0.1969948709011078], [0.2889402508735657]]",87.35636901855469,87.35636901855469,"[73.32254028320312, 81.3128433227539, 81.1913070678711, 92.53023529052734, 83.61614227294922, 80.33154296875]",94.31483459472656,"[71.9671859741211, 77.1010971069336, 83.39916229248047, 86.12605285644531, 88.98316192626953, 83.68383026123047]"
177,I hope she is much nicer than he is.,"[['Four men were knocked down , but did not attempt to rise .'], ['In accord with its penurious policy , the company failed to furnish presents to hold the loyalty of the principal Indians .'], ['And she withdrew then to Cromwell Hall , in Cromwell , Connecticut .'], ['That society responds by condemning the private eye as a threat to the status quo , a potential criminal .'], [""`` My dress needs some work on it '' .""], ['This was not a particularly shocking or unexpected thing -- it was previously known to her that it might happen .']]","[[-0.18425393104553223], [-0.10355554521083832], [-0.0008053164929151535], [0.09884344041347504], [0.19719555974006653], [0.3341580629348755]]",53.64052200317383,53.64052200317383,"[78.79844665527344, 91.61651611328125, 52.61236572265625, 76.6619873046875, 43.78898239135742, 51.3426399230957]",43.058563232421875,"[58.16925048828125, 72.80471801757812, 49.99745178222656, 60.2541389465332, 30.663888931274414, 38.07518005371094]"
75,"Stepping into the hallway, Tess returned her greeting with a smile.","[['With all these agencies , the congressman must constantly check the political wind and trim his sails accordingly .'], ['Despite all this , the idea apparently has captured the imagination of countless youths whose parents are probably more surprised by the response than anybody else .'], [') But the inner , formal logic of Cubism , as it worked itself out through the collage , had just as much to do with shaping their decision .'], ['Better stay in the hotel lobby , where the walls looked good and thick .'], [""A seeping coldness entered Holden's being ; ;""], [""Richardson had returned their departing grins with the noncommittal nod that is the security officer's stock in trade .""]]","[[-0.19148841500282288], [-0.10255664587020874], [-0.0006094202399253845], [0.09906946122646332], [0.1958606243133545], [0.3353548049926758]]",127.84744262695312,127.84744262695312,"[135.93077087402344, 156.2732696533203, 137.12478637695312, 97.1007308959961, 121.1885986328125, 139.8677978515625]",87.54435729980469,"[88.4184799194336, 110.82353973388672, 90.42552947998047, 67.6546401977539, 88.36498260498047, 103.68505096435547]"
17,"David, standing in the background with Carla in his arms, observed the woman he had fallen in love with, and regretted not having paid more attention to Myra’s invitations.","[['How long you may stay outside .'], ['In the f-plane the coordinates of the corresponding point are Af .'], ['They reside at 4911 Miles Dr. .'], ['Was she just naturally sloppy about everything but her physical appearance ? ?'], [""`` Then she went to Deauville where she met a member of a powerful Greek syndicate of gamblers '' .""], ['Her presence only made Letch more distant and irritable and , in the hurry of buying Chateau Belletch , I had neglected to consider a room for Baby-dear , so there was no place to put her , anyhow .']]","[[-0.17366158962249756], [-0.10390354692935944], [-0.0009694788604974747], [0.09866968542337418], [0.19678983092308044], [0.32848042249679565]]",30.06485939025879,30.06485939025879,"[30.188676834106445, 30.50731086730957, 30.879161834716797, 28.73423957824707, 27.224912643432617, 27.843488693237305]",26.89081573486328,"[29.210657119750977, 25.705360412597656, 27.214963912963867, 29.271547317504883, 25.24750518798828, 26.519338607788086]"
231,I just asked her to marry me.,"[['not like the cracker-box construction of so many of the motel units that have stucco all over the outside but walls that are thin enough so you can hear every movement of the people in the adjoining apartment .'], ['But even if that other plant employs the same number of workers and makes the same product , there are other facts to consider .'], ['Bernard Parrillo , 20 , of 19 Fletcher Ave. , Cranston , was admitted to Roger Williams Hospital shortly before 11:30 a.m. yesterday after a hunting accident in which a shotgun he was carrying discharged against his heel .'], ['Soon he was in trouble there , for defending a woman who was accused of smiling in church .'], [""`` Maybe I could '' , he said , surprised that she could turn from herself and notice anything about him .""], [""`` Oh , that is demonstrable '' , I told him .""]]","[[-0.17442061007022858], [-0.10195490717887878], [-0.0005676383152604103], [0.09763230383396149], [0.19334150850772858], [0.29261425137519836]]",51.972618103027344,51.972618103027344,"[61.438270568847656, 104.47613525390625, 71.64202117919922, 44.56211471557617, 18.87874984741211, 25.87458038330078]",20.497154235839844,"[52.38034439086914, 41.5600700378418, 25.499969482421875, 21.23789405822754, 17.505176544189453, 21.689544677734375]"
