target_idx,target_sent,sents_intrp_all_bins,sim_intrp_all_bins,base_PPL,local_unintrp_PPL,local_intrp_PPL_all_bins,global_unintrp_PPL,global_intrp_PPL_all_bins
6,"As a result, experts routinely estimate that between 40 percent and 50 percent of marriages today will end in divorce.","[['The policeman walked on , but he looked back once .'], ['She said to him , her father , `` How was I begotten , in pain or joy ? ?'], ['He splashed on , mud sucking at his feet with each step , until he reached the end of the drainage ditch and the beginning of the fence that enclosed the farm .'], ['This article assumes that the rations you are feeding your beef , dairy cattle , and sheep are adequately balanced with protein , vitamins , and minerals .'], ['The American public must be presented with the facts concerning VA hospitalization .'], ['The couple will honeymoon in Sequoia National Park , Calif. .']]","[[-0.16812041401863098], [-0.10075490176677704], [-0.00020943209528923035], [0.09913849830627441], [0.1955568939447403], [0.3106347322463989]]",38.10108947753906,38.10108947753906,"[46.075355529785156, 48.593318939208984, 40.81025314331055, 31.52532196044922, 35.99464797973633, 32.5637321472168]",20.923343658447266,"[24.315631866455078, 35.0678596496582, 27.15090560913086, 25.885644912719727, 24.341711044311523, 23.287240982055664]"
99,"Couples who rarely get a chance to restore their ""reserves,"" such as those from low-income communities, can be particularly prone to marital dissatisfaction and divorce.","[['Mr. Blatz was already taking measurements for a shelf above the kitchen sink .'], ['But for the start of the Santa Cruz run , the whip fell .'], [""Miami Beach and surroundings feature fabulous `` hotel row '' , palm-studded beaches plus the Miami Seaquarium and Parrot Jungle .""], [""`` Oh , you can count on that '' .""], [""I asked a silly question : `` You've no idea where your husband could be , now '' ? ?""], ['Perhaps his most important private activity was the combination of reading , discussion with a few -- if we can trust his writings to Diodati and the younger Gill , very few -- congenial companions .']]","[[-0.1740264594554901], [-0.10076390206813812], [-0.00025302544236183167], [0.09959873557090759], [0.19757360219955444], [0.33169054985046387]]",233.86842346191406,233.86842346191406,"[268.7356262207031, 269.0249938964844, 261.11962890625, 217.15573120117188, 289.25103759765625, 222.71084594726562]",165.47930908203125,"[197.90911865234375, 164.07571411132812, 160.0902099609375, 171.29452514648438, 216.40599060058594, 165.13768005371094]"
31,"Lower-income groups, however, experienced more problems related to economic and social issues such as drinking or drug abuse (, 2012).","[[""He waited awhile before he said , `` Roy , you know your decompression table , don't you '' ? ?""], [""`` Ryan , look over there '' , Nogol said .""], [""Gaylor's obsession and Cunningham's chimera-chasing reminiscences had mesmerized him into thinking of Lila and Lilac , separately or together , as a legend .""], ['The net result is that under American leadership the general world situation has become bad .'], ['The placement of your pool , however , will not of itself solve the two major problems of pool owning -- those that involve your social life and those pertaining to safety .'], ['One effect of the proposal , which puts a premium on population instead of economic strength , as in the past , would be to take jobs from European nations and give more to such countries as India .']]","[[-0.18091996014118195], [-0.10054000467061996], [-0.0003028600476682186], [0.09940091520547867], [0.19254109263420105], [0.24694694578647614]]",58.90164566040039,58.90164566040039,"[84.79147338867188, 60.865230560302734, 57.79338073730469, 49.7204704284668, 54.9383544921875, 48.05000686645508]",42.122005462646484,"[65.74530029296875, 42.89509201049805, 45.107032775878906, 43.27842330932617, 43.77094650268555, 40.40250015258789]"
41,"""It appears that those things are paying off.""","[['We cannot conceive of Oedipus without a Sphinx , nor of Hamlet without a Ghost .'], [""Black said COAHR `` hoped to be able to integrate the theaters without taking direct action , but we are pledged to using every legal and nonviolent means at our disposal ''""], ['All Dallas members voted with Roberts , except Rep. Bill Jones , who was absent .'], ['She smiled in a sickly-tolerant fashion .'], ['Suddenly he thought he might weep .'], [""`` Yes , he's just there .""]]","[[-0.16294702887535095], [-0.10118386149406433], [-0.00035735219717025757], [0.09953288733959198], [0.1975688636302948], [0.33388495445251465]]",259.2994079589844,259.2994079589844,"[250.5203094482422, 187.5553741455078, 423.20220947265625, 317.2963562011719, 287.2749938964844, 200.47071838378906]",306.36865234375,"[315.8858947753906, 239.95321655273438, 383.9835510253906, 271.03466796875, 320.6750183105469, 223.32476806640625]"
34,"The technique supports what Aron showed in a 1993 study: that spouses were more satisfied with their relationships when they were told to go on more exciting dates, such as hiking or going to parties.","[['He sized up the situation and shook his head .'], ['The nation would be utterly devastated .'], ['Phil took off one shoe and stared at it .'], ['If the lever is pulled to clear a signal or move a switch , the tappet moves a short distance lengthwise at the same time .'], ['Albert B. Lord suggests that the Homeric poems were dictated to a scribe by a minstrel who held in his mind the poems fully matured but did not himself possess the knowledge of writing since it would be useless to his guild , and Magoun argues that the Beowulf poet and Cynewulf may have dictated their verse in the same fashion .'], [""Affirmatively Baker worked on the premise that `` young men spontaneously prefer to be decent , and that opportunities for wholesome recreation are the best possible cure for irregularities in conduct which arise from idleness and the baser temptations '' .""]]","[[-0.1537623405456543], [-0.10140395164489746], [-0.00035080686211586], [0.09975085407495499], [0.19807857275009155], [0.33059144020080566]]",112.03609466552734,112.03609466552734,"[116.75886535644531, 114.84321594238281, 119.25298309326172, 111.53009796142578, 108.01246643066406, 95.76554107666016]",87.65416717529297,"[96.32432556152344, 90.97132110595703, 90.74706268310547, 98.52155303955078, 95.18023681640625, 80.71080017089844]"
