target_idx,target_sent,sents_intrp_all_bins,sim_intrp_all_bins,base_PPL,local_unintrp_PPL,local_intrp_PPL_all_bins,global_unintrp_PPL,global_intrp_PPL_all_bins
103,Education also plays a role.,"[[""Following Day was Woodbury who spoke of his disapproval of Brown's attempt at servile insurrection , his admiration of Brown's character , and his opposition to slavery .""], ['-- Your July 26 editorial regarding the position of Attorney General Robert F. Kennedy on prospective tax relief for DuPont stockholders is based on an erroneous statement of fact .'], [""`` I'll talk to him , all right '' .""], [""As I was playing Mother Cabrini , the picture was actually `` all mine '' , with nearly every scene built around me .""], ['Fourth , in the segregated school system , during the period before desegregation , how can we assure equal opportunity ? ?'], ['In fact , in the desegregated school system which may have a good many schools with all-Negro population , how can we assure equal opportunity ? ?']]","[[-0.1890905797481537], [-0.1002587080001831], [-0.00014411471784114838], [0.09935988485813141], [0.19480293989181519], [0.26771417260169983]]",101.02503204345703,101.02503204345703,"[259.5229187011719, 136.07701110839844, 83.63444519042969, 101.34381866455078, 59.843109130859375, 45.34315490722656]",54.328529357910156,"[198.70399475097656, 59.657630920410156, 56.249656677246094, 60.61753463745117, 50.74419021606445, 38.22823715209961]"
52,What does work?,"[['So whenever the Romans finally withdrew from the island , the Saxon Shore disappeared in the first decade of the fifth century .'], [""As it was , while Central wrangled among itself , Robert Tanner sneaked out of the pilots' barracks , out to the field and over to Helva's slim metal hull .""], ['Confronted with this situation , most libraries either endure the severe limitations of their budgets and do what they can with what they have , or else depend on the bounty of patrons and local governments to supplement their annual funds .'], ['And did he appreciate my efforts on his behalf ? ?'], ['Like most major works of synthesis , The History Of England is informed by the positive views of a first-class mind , and this is surely a major work .'], [""`` What's that you say '' ? ?""]]","[[-0.14871294796466827], [-0.10076736658811569], [-0.0001025456003844738], [0.09980842471122742], [0.19494609534740448], [0.33386102318763733]]",585.595703125,585.595703125,"[1039.9918212890625, 1545.8695068359375, 401.6419982910156, 125.98375701904297, 254.07369995117188, 103.94142150878906]",124.12676239013672,"[259.49755859375, 457.4532470703125, 279.8287353515625, 53.22657775878906, 130.48617553710938, 40.768104553222656]"
93,"Her theory of hedonic adaptation holds that people are wired to become accustomed to positive changes in their lives, whether that change is a fresh outfit, a new job or a wedding band.","[[""And Bernie Kriss calls the bayonet clashes at Berlin's Brandenburg Gate , `` The Battle of the Sentry '' ! !""], ['Ekstrohm cleared his throat .'], ['Dirty Reactionary bastards comin down here in the night and bumpin off ol Slater and those other poor bastards .'], ['Toys he has can be made to act as substitutes for family temptations such as refrigerator and gas stove .'], [""A century ago , Newman saw that liberalism ( what we now might call secularism ) would gradually but definitely make its mark on English Protestantism , and that even high Anglicanism would someday no longer be a `` serviceable breakwater against doctrinal errors more fundamental than its own '' .""], ['The changes , unanimously adopted , were felt necessary in the face of modern trends away from the Bible .']]","[[-0.16286200284957886], [-0.10038741677999496], [-0.0002230219542980194], [0.0997762382030487], [0.19725117087364197], [0.3124541938304901]]",142.4644012451172,142.4644012451172,"[164.1487274169922, 143.15516662597656, 137.1748046875, 134.7725830078125, 139.82225036621094, 146.1368865966797]",131.0388641357422,"[126.84647369384766, 125.1994857788086, 124.19562530517578, 124.72042083740234, 115.06011199951172, 130.2251739501953]"
15,"Perhaps the most important lesson relationship research has taught us is that marriage, like any other commitment, takes conscious effort to preserve, says Nicholas Kirsch, PhD, a couples therapist in Bethesda, Md.","[['It turned out that the waves were not so high as in 1946 .'], ['And the 100,000 subscribers became a reality .'], ['One reel -- from eight to twelve minutes -- became the standard length from the year of Robbery , 1903 , until Griffith shattered that limit forever with Birth Of A Nation in 1915 .'], ['You should see to it that the trap , the dirt-catcher in front of the filter , is always clean .'], ['his wife taught the two boys to read and write Danish .'], ['Because neither of them really wanted their marriage to break up , Mr. and Mrs. Black agreed to a series of interviews at Family Service of Northern Virginia , the agency nearest them .']]","[[-0.14909890294075012], [-0.10084770619869232], [-0.0001613069325685501], [0.09991566836833954], [0.19930870831012726], [0.3603948652744293]]",145.5843048095703,145.5843048095703,"[130.2119598388672, 120.37555694580078, 134.19351196289062, 119.21897888183594, 116.06139373779297, 118.7487564086914]",109.71582794189453,"[106.52658081054688, 104.59087371826172, 112.65751647949219, 109.44342803955078, 102.23811340332031, 102.60577392578125]"
107,"And somehow, there's this belief that we don't have to work at learning how to be a couple, it should just come naturally,"" he says.","[['Pueri aquam de silvas ad agricolas portant , a delightful vignette set in the unforgettable epoch of pre-Punic War Rome .'], ['A glance revealed that the main topgallant mast had been carried away .'], [""The fundamental difficulty of which the Selden case was `` a striking ( though not singular ) example '' , concluded Hough , `` will remain as long as testimony is taken without any authoritative judicial officer present , and responsible for the maintenance of discipline , and the reception or exclusion of testimony '' .""], ['The completeness of the connections provide that , for N people , there are Af lines of communication between the pairs , which can become a large number ( 1,225 ) for a party of fifty guests .'], [""`` I've been waiting to get these things done for months '' , she said .""], ['Aside from the comico-romantico content here , a good linguist-anthropologist could readily pick up a few other facts , especially if he had a little more of the conversation to go on .']]","[[-0.16082444787025452], [-0.10066817700862885], [-8.838064968585968e-05], [0.09988503158092499], [0.19946591556072235], [0.3492826819419861]]",177.20286560058594,177.20286560058594,"[175.11199951171875, 199.85043334960938, 180.7913818359375, 189.95570373535156, 123.08330535888672, 155.87503051757812]",110.71989440917969,"[123.30065155029297, 125.1734619140625, 141.9794464111328, 129.20639038085938, 112.18512725830078, 118.27835083007812]"
