target_idx,target_sent,sents_intrp_all_bins,sim_intrp_all_bins,base_PPL,local_unintrp_PPL,local_intrp_PPL_all_bins,global_unintrp_PPL,global_intrp_PPL_all_bins
38,"Some of those factors, including ethnic background and socioeconomic status, are beyond a couple's control.","[[""-- In reply to a letter in Today's `` Voice '' urging the sale of meat after 6 p.m. , I wish to state the other side of the story .""], ['I now ever look for Christ according to His promises and those of the Old Testament as well , to appear again in glory to put away all sin and to reign in righteousness over the whole earth .'], ['He smiled to himself , and decided not to mention them till Dolores did .'], ['and a host of others .'], ['The answers the girls give struck me as reasonably varied and healthily individual .'], [""The jury said it did find that many of Georgia's registration and election laws `` are outmoded or inadequate and often ambiguous '' .""]]","[[-0.2925836145877838], [-0.10283936560153961], [-0.0007390780374407768], [0.09785299748182297], [0.18584442138671875], [0.21870726346969604]]",65.64418029785156,65.64418029785156,"[64.88214874267578, 72.23966217041016, 75.65192413330078, 64.9356689453125, 51.42147445678711, 61.19842529296875]",56.45120620727539,"[48.16940689086914, 54.933902740478516, 49.67488098144531, 47.5337028503418, 47.11454391479492, 46.054813385009766]"
108,"One is ethnicity: Asian women and foreign-born Hispanic men, for example, have the highest chance of the demographic groups studied that their marriages will last 20 years (70 percent), while black women have the lowest rate of reaching the two-decade mark (37 percent).","[[""The airman's stock answer to `` Weren't you cold '' ? ?""], ['This could also be used for any other skin irritation .'], [""It won't cost you a cent , Phil .""], ['The measurement must be in inches .'], [""Men of Krim's age , aspirations , and level of sophistication were typically involved in politics before the war .""], ['Whereas the primary meanings of the Lo Shu diagram seemed to have been based on its inner mathematical properties -- and we shall see that even its secondary meanings rested on some mathematical bases -- the urgent desire to place everything into categories of fives led to other groupings based on other numbers , until an exaggerated emphasis on mere numerology pervaded Chinese thought .']]","[[-0.2238527238368988], [-0.10165952146053314], [-0.000738147646188736], [0.09762686491012573], [0.18477511405944824], [0.21899376809597015]]",67.20175170898438,67.20175170898438,"[69.32006072998047, 71.46428680419922, 65.3314437866211, 65.68196868896484, 66.18064880371094, 70.50273132324219]",58.832481384277344,"[61.992488861083984, 62.24045944213867, 61.13250732421875, 60.06512451171875, 57.70256423950195, 64.74199676513672]"
13,"His team's study found that military personnel are much more likely than civilians to be married and not as likely to be divorced compared with civilians of similar ages, races, employment statuses and education levels (, 2012).","[['That was the day that Pierre had told Warren about the Abbey of Solesmes .'], [""It latches when you close it , so stay as long as you like '' .""], ['Often , I heard my uncles and cousins speak of it when I was a small boy growing up in Rabaul .'], ['A special grandstand , protected by awnings from the midsummer sun of Illinois , should be erected for occupancy by honored guests , who should include the ambassadors of all those new African nations as yet not quite convinced that the United States is thoroughly civilized .'], ['In the South , after the first year of the war , paper and ink were very poor .'], ['-- Expenditures for operating and maintaining the stations and equipment of the Armed Forces are estimated to be $10.3 billion in 1961 , which is $184 million more than in 1960 .']]","[[-0.2292192578315735], [-0.10350559651851654], [-0.0009708590805530548], [0.09840062260627747], [0.19085587561130524], [0.24588501453399658]]",85.84326934814453,85.84326934814453,"[100.50849914550781, 87.97227478027344, 102.24275207519531, 92.69371795654297, 85.57268524169922, 70.96017456054688]",80.50574493408203,"[82.06273651123047, 88.20560455322266, 91.64644622802734, 73.83892822265625, 80.12610626220703, 72.41690063476562]"
73,"In the Early Years of Marriage Project, Orbuch also found that good communication set the happiest of couples apart from the less blissful.","[['Traces of oil on green tissue ? ?'], ['Stoneware clay for tiles .'], ['Dramatic activity at the College is organized and carried on by The Carleton Players , which is to say by all students who are so inclined to advance these aims .'], ['If one follows the reports of the Congress , one finds that there still seems considerable uncertainty in the minds of the leaders themselves about what exactly to do in this matter .'], [""The already faded pastel charms of the naive music itself vanish entirely in Fistoulari's melodramatic contrasts between ultravehement brute power and chilly , if suave , sentimentality .""], [""The secret little corner of his mind , which stayed sane through happiness and pain , made him wonder about B'dikkat .""]]","[[-0.24445094168186188], [-0.10401995480060577], [-0.0009887106716632843], [0.09868626296520233], [0.1924084722995758], [0.27138298749923706]]",127.29163360595703,127.29163360595703,"[147.20274353027344, 131.2459716796875, 140.6847686767578, 124.37346649169922, 132.36898803710938, 119.56705474853516]",103.32057189941406,"[108.14604949951172, 99.54248046875, 120.37384033203125, 105.44327545166016, 99.39250946044922, 98.71467590332031]"
10,"""That, to me, is just very backwards.""","[['And while every writer must be dealt with as a special case , the interested student will want to ask himself a number of questions about each .'], ['The initial suppression activities would cover about twice the acreage currently being treated .'], ['The intranasal instillation of a fluid suspension of infectious agent in an anesthetized animal is far different from exposure , through natural respiration , to aerosolized organisms .'], [""As for myself , I had on an enormous black `` muff '' .""], [""The odds thus appear favorable that the secretary's neck may be spared .""], [""It is but so-so '' .""]]","[[-0.2387835681438446], [-0.10527891665697098], [-0.000899425707757473], [0.09848066419363022], [0.1910024732351303], [0.29230600595474243]]",217.0387420654297,217.0387420654297,"[297.99432373046875, 363.1236877441406, 350.3735046386719, 214.54721069335938, 342.2491149902344, 255.46649169921875]",222.71678161621094,"[294.6759948730469, 287.7665100097656, 266.22314453125, 215.41896057128906, 263.30328369140625, 196.19676208496094]"
