target_idx,target_sent,sents_intrp_all_bins,sim_intrp_all_bins,base_PPL,local_unintrp_PPL,local_intrp_PPL_all_bins,global_unintrp_PPL,global_intrp_PPL_all_bins
6,"As a result, experts routinely estimate that between 40 percent and 50 percent of marriages today will end in divorce.","[['The policeman walked on , but he looked back once .'], ['At the same time he started walking the streets , peering at the people passing or shopping at the stalls , storing up fresh impressions of what they looked like , how they moved .'], ['This is a fine trip , too , on a good day .'], [""Occasional features were published on historical medicine , special reports , bibliography , and `` Collector's Items '' .""], [""and my husband hasn't had a vacation in 14 years .""], ['that aside from due notification of certain major events in their lives ( two marriages , two births , one divorce ) , Christmas and Easter cards of the traditional sort had been the only thin link she had with them through the widowed years .']]","[[-0.16812041401863098], [-0.10070163011550903], [-0.00018834881484508514], [0.09918389469385147], [0.1961580067873001], [0.3172524571418762]]",38.10108947753906,38.10108947753906,"[46.075355529785156, 41.34021759033203, 35.535064697265625, 35.75117492675781, 34.176841735839844, 28.048770904541016]",20.923343658447266,"[24.315631866455078, 27.766952514648438, 21.783138275146484, 23.008481979370117, 24.616003036499023, 23.46918487548828]"
31,"Couples who rarely get a chance to restore their ""reserves,"" such as those from low-income communities, can be particularly prone to marital dissatisfaction and divorce.","[['Harry followed the car until it reached the main road and turned towards Kingston .'], ['the purpose was less immediate .'], [""`` It's so quiet '' , he said , `` so slow , serene -- and so challenging '' .""], ['Provided , That nothing in this provision shall be construed to limit the life of the Commission , or its authority to act on future agreements which may be effected under the provisions of this legislation .'], ['A reporter restricted to the competing propaganda statements of both sides in a major labor dispute , for instance , is unable to tell his readers half of what he knows about the causes of the dispute .'], [""and whether these would qualify them for `` congenial '' , `` happy '' relations to other people in certain community areas .""]]","[[-0.1735248565673828], [-0.10064040124416351], [-0.00023049116134643555], [0.09961409866809845], [0.19772973656654358], [0.33422714471817017]]",233.86842346191406,233.86842346191406,"[293.616455078125, 236.53672790527344, 261.0135498046875, 197.7290496826172, 203.43968200683594, 205.48239135742188]",165.47930908203125,"[205.91856384277344, 175.4143524169922, 167.46273803710938, 157.64190673828125, 163.6217041015625, 156.13592529296875]"
34,"Lower-income groups, however, experienced more problems related to economic and social issues such as drinking or drug abuse (, 2012).","[['These will be available at cost from our Plans Department .'], [""`` The hero of his next poem is Napoleon Bonaparte '' , said Claire , with slightly overdone carelessness .""], ['Veronica from the herb garden was also used to stop bleeding , and rue was an antiseptic .'], [""Thornburg added in a lower voice but Andy overheard , `` They act more like a jury than an audience '' .""], ['It is our hypothesis that Kohnstamm-positive subjects are less hesitant about relinquishing control than are Kohnstamm-negative subjects ; ;'], ['the attitudes of a U.N. delegate who experiences difficulty in finding adequate housing in New York City , or of a foreign diplomat in similar circumstances in our Capital , can easily be directed against the United States and all that it stands for .']]","[[-0.1795540750026703], [-0.1004871279001236], [-0.00025158748030662537], [0.0995250791311264], [0.19286422431468964], [0.2540854811668396]]",58.90164566040039,58.90164566040039,"[56.24785614013672, 67.23905944824219, 73.54997253417969, 60.73447799682617, 53.32317352294922, 56.27785110473633]",42.122005462646484,"[43.667823791503906, 49.77936935424805, 43.469234466552734, 47.592071533203125, 41.844051361083984, 44.84739685058594]"
41,"""It appears that those things are paying off.""","[[""The wartime protocol of September 12 , 1944 , designated a special `` Greater Berlin '' area , comprising the entire city , to be under joint occupation .""], ['A clot forms at the site , seals off the flow of blood to the heart and provokes a heart attack .'], ['Special districts in Rhode island .'], [""`` Can't understand why the hell anyone wants to go inside that son-of-a-bitch place '' .""], ['No matter how many registry rocks they came to on this journey , each one exerted its own appeal .'], ['It was all too wearying .']]","[[-0.16247738897800446], [-0.10100498050451279], [-0.0002883393317461014], [0.09959287941455841], [0.1975923627614975], [0.34026286005973816]]",259.2994079589844,259.2994079589844,"[528.6174926757812, 326.14935302734375, 357.0058898925781, 210.97021484375, 366.94024658203125, 308.44866943359375]",306.36865234375,"[399.6667785644531, 364.3201904296875, 269.4955749511719, 269.6028747558594, 320.03570556640625, 301.965087890625]"
99,"The technique supports what Aron showed in a 1993 study: that spouses were more satisfied with their relationships when they were told to go on more exciting dates, such as hiking or going to parties.","[['A marked impulse came to the anti-slavery movement through the Finney revivals .'], ['`` Your name will never appear .'], [""Did he trouble to memorize the very small part which I had `` tailor-made '' to his specifications , a role eventually cut down to three short speeches ? ?""], ['Although the resolution might have been far more specific , it was considerably tougher than the earlier one .'], [""`` When that woman found me and told me that you needed me I was never so happy since before the war '' .""], [""It doesn't really matter which month of the year you sow them , but they germinate best when they have a wide variation of temperature , very warm followed by cool in the same 24 hours .""]]","[[-0.15148934721946716], [-0.10132500529289246], [-0.00027077365666627884], [0.09978574514389038], [0.19818145036697388], [0.3369170129299164]]",112.03609466552734,112.03609466552734,"[109.28739929199219, 111.76929473876953, 117.0213394165039, 110.18742370605469, 111.89946746826172, 104.16940307617188]",87.65416717529297,"[91.12374877929688, 91.31200408935547, 98.13516235351562, 86.70111083984375, 101.01626586914062, 86.77195739746094]"
