target_idx,target_sent,sents_intrp_all_bins,sim_intrp_all_bins,base_PPL,local_unintrp_PPL,local_intrp_PPL_all_bins,global_unintrp_PPL,global_intrp_PPL_all_bins
410,They probably are afraid to even think!,"[['Django Reinhardt , the ill-fated gypsy , was a true artist , one who demonstrated conclusively the power of art to renew itself and flow into many channels .'], ['In the early months of 1714 , the battle between Swift and Steele over the issue of the Succession entered its major phase .'], ['Yet the press was powerless to put these charges in perspective in its news columns .'], ['I see no real prospects for an all-Negro school population .'], ['There was no dream of escape for these people .'], ['They were already swollen to bursting .']]","[[-0.19233685731887817], [-0.10243427753448486], [-0.0005446001887321472], [0.09813058376312256], [0.1948169618844986], [0.3442286252975464]]",381.8840637207031,381.8840637207031,"[431.76873779296875, 585.7830810546875, 465.74114990234375, 224.388671875, 342.2517395019531, 305.9661560058594]",135.17953491210938,"[213.1915740966797, 600.668701171875, 189.97689819335938, 159.98214721679688, 149.3080291748047, 139.6525421142578]"
192,"“Then, I will hurt, Man, but I will deal with that also.”","[[""The power of every ecclesiastical organization has always rested on the miracle , and the clergy have always proved their divine commission as did Elijah '' .""], ['And the Prokofieff Seventh Sonata had the combination of romanticism and modern bravura that Prokofieff needs .'], ['Once many years ago I sat at dinner next to Arthur Train , and the subject of The Nation came up .'], [""The clerk impressed this upon me : that I should not arrive in the hall before ten o'clock .""], [""`` If you are trying to get us out of the brothel , the dustbin , the kitchen sink , and the tawdry living-room , you are probably wasting your time '' , Moreland told me .""], [""Don't like to bother no one unless we have to , which I figger we do , in your case .""]]","[[-0.18676577508449554], [-0.10191197693347931], [-0.0006912238895893097], [0.0979473739862442], [0.19335736334323883], [0.3223358690738678]]",150.8544464111328,150.8544464111328,"[130.77957153320312, 178.29061889648438, 132.54476928710938, 125.10459899902344, 120.81817626953125, 117.04627990722656]",86.8306884765625,"[88.64765930175781, 94.20066833496094, 100.42366027832031, 91.98970031738281, 88.1496810913086, 90.29570007324219]"
81,I hope I didn’t offend her.,"[['The villains of the piece are those who deny job opportunities to these youngsters , and Dr. Conant accuses employers and labor unions alike .'], ['So they go looking for mergers with other firms that have publicly quoted stock , and almost daily they pound on the doors of firms like Frito .'], ['He watched his own body with remote , casual interest .'], ['He already had that slow pace that comes over the elderly , while she herself had all the signs of one who appreciates the joys of living .'], ['I looked with revulsion at the legs .'], ['So would she mind speaking a little louder ? ?']]","[[-0.19188064336776733], [-0.10286103188991547], [-0.0008429791778326035], [0.09855995327234268], [0.19575446844100952], [0.33042824268341064]]",75.26716613769531,75.26716613769531,"[135.23904418945312, 118.7801284790039, 101.97840881347656, 60.12112045288086, 44.01533889770508, 55.66838836669922]",33.226707458496094,"[30.70400619506836, 34.54468536376953, 34.13279724121094, 29.07200050354004, 28.04195785522461, 31.006938934326172]"
92,I’m not chewing Tess out.,"[['Independent art schools granting degrees must , naturally , follow this with academic accreditation by the appropriate regional group .'], [""You will need a stereo music system , with speakers preferably placed at least seven or eight feet apart , and one or more of the new London `` Phase 4 '' records .""], [""`` Where'd you say you was born '' ? ?""], [""And if it was not an individual who was in the dock , why was the Trial , as we shall observe later , all but scuttled in the attempt to prove Eichmann a `` fiend '' ? ?""], ['From where I sit it looks more like a nightmare .'], [""Oh he'd not care about the Pedersen kid .""]]","[[-0.18538427352905273], [-0.10375721007585526], [-0.0006979629397392273], [0.09874141216278076], [0.1953408122062683], [0.27091678977012634]]",81.12810516357422,81.12810516357422,"[109.2543716430664, 104.26497650146484, 65.37347412109375, 75.5363540649414, 48.42304229736328, 66.44790649414062]",31.83561897277832,"[40.50053787231445, 37.0639533996582, 31.867403030395508, 42.125892639160156, 28.1707706451416, 24.664281845092773]"
338,"“Good, then we’ll get married Wednesday at noon, no matter what, agreed?”","[['Recently added is the Brown & Sharpe turret drilling machine which introduces the company to an entirely new field of tool development .'], ['When the Brown & Sharpe Manufacturing Company reached its 125th year as a going industrial concern during 1958 , it became an almost unique institution in the mechanical world .'], ['Mahayana Buddhism was no exception to these prevailing magical concepts .'], ['Others admitted he was absolutely correct -- he never slept .'], [""`` Sigmen love you , too , my guardian '' , said Hal , choking .""], [""`` We'll work for our keep '' , the boy said eagerly .""]]","[[-0.19526362419128418], [-0.10358734428882599], [-0.0008159680292010307], [0.09854724258184433], [0.19309520721435547], [0.2657719552516937]]",210.0591583251953,210.0591583251953,"[205.44573974609375, 194.4517364501953, 176.27976989746094, 161.88226318359375, 148.0017852783203, 150.43946838378906]",109.59190368652344,"[129.42616271972656, 128.13441467285156, 113.77767181396484, 106.63218688964844, 112.900634765625, 107.63153839111328]"
