target_idx,target_sent,sents_intrp_all_bins,sim_intrp_all_bins,base_PPL,local_unintrp_PPL,local_intrp_PPL_all_bins,global_unintrp_PPL,global_intrp_PPL_all_bins
47,"The participants who didn't, Arnett presumes, don't plan to marry at all.","[['This may be helpful in improving the competitive position of established firms through diversification and expansion or through more economical utilization of plant capacity .'], ['In other words , atrocities by savages wearing the uniform of the central government might be condoned , had the victims been serving the cause of dissident Katanga .'], ['the hotel-motel demarcation is becoming harder to find every year .'], [""a figment of Carl Anderson's imagination .""], ['He who had tried so hard , who had yearned so passionately to be a great officer .'], ['No matter how many registry rocks they came to on this journey , each one exerted its own appeal .']]","[[-0.19117525219917297], [-0.10673285275697708], [-0.0009964029304683208], [0.09914368391036987], [0.19475668668746948], [0.28311091661453247]]",845.3960571289062,845.3960571289062,"[884.0987548828125, 821.2134399414062, 791.098388671875, 713.3179321289062, 679.4949951171875, 726.9513549804688]",776.76953125,"[851.1024169921875, 792.4031982421875, 895.3831176757812, 767.9209594726562, 642.7047119140625, 715.2406005859375]"
56,Orbuch's analysis suggests the trajectory from bad to worse is likely to continue throughout the marriage and eventually to lead to divorce.,"[['This function is staffed by engineers chosen for their technical competence and who have the title , member of the technical staff .'], ['This assembly also supplies a 20-cps switching gate for the electronics circuitry .'], ['A good initial impression would be important now .'], [""`` I'm not unhappy '' , I lied , staring at the snow .""], [""But alas George , when he had written , had only just returned from going to Tuxapoka to Cousin Elec's funeral .""], [""Thus , the writer decided to hold one experimental section of the functional preparation for marriage course in the spring semester of 1960 exclusively for persons already married -- that is , prerequisite : `` marriage '' .""]]","[[-0.19293634593486786], [-0.1071569100022316], [-0.0012828223407268524], [0.098917156457901], [0.19554418325424194], [0.2934849262237549]]",128.5489044189453,128.5489044189453,"[151.4882049560547, 169.39028930664062, 126.0207748413086, 150.97354125976562, 138.97767639160156, 103.58497619628906]",91.526123046875,"[104.49486541748047, 88.06813049316406, 92.9308853149414, 102.29380798339844, 89.31230163574219, 96.52718353271484]"
70,"""Doing or saying small things frequently to make your partner feel special, cared for and loved … is very predictive of staying together, being happy and [preventing] divorce,"" she says.","[['Far up the valley I could see the Rees circling and reorganizing .'], ['They were a little late in getting home .'], ['1 St. John 3 : 9 .'], ['And why was it causing so much agitation among the Angels , and being followed by so many of them ? ?'], [""The Angels in turn would exercise similar restraints in respect for the natural preferences and natures of the Earthmen -- but they had no faintest notion of man's perverse habit of passing and enforcing laws which were contrary to his own preferences and violations of his nature .""], [""A world in which wives have taken a more active role is likely to produce sexual relationships in which wives are more self-assertive , too '' .""]]","[[-0.19514307379722595], [-0.10522473603487015], [-0.000911075621843338], [0.09901291131973267], [0.19391196966171265], [0.2922384440898895]]",403.3009033203125,403.3009033203125,"[404.5265808105469, 385.08624267578125, 370.9021911621094, 365.9835510253906, 441.377685546875, 339.8887939453125]",339.8995056152344,"[273.1192626953125, 307.04315185546875, 275.03662109375, 280.2919616699219, 390.71075439453125, 362.4813232421875]"
2,"After a decade, the most striking difference between the couples who had divorced and the ones who stayed together was how they had handled conflict during their first year of marriage.","[['He did not dare climb back up to the road .'], ['The fish took the bait .'], [""'' At Veterans Memorial Auditorium .""], [""You should have told me about her before '' .""], [""Years later , franks-in-buns were accepted as the `` first to go '' at the New York Polo Grounds .""], ['No sooner had Betsey come out of the ring than Mrs. Long walked into the Working Competition with Ch. Cadet or Noranda , another home-bred product , and won ! !']]","[[-0.19095906615257263], [-0.10558349639177322], [-0.0009589893743395805], [0.09873321652412415], [0.19225594401359558], [0.29668647050857544]]",63.39647674560547,63.39647674560547,"[67.82545471191406, 80.82634735107422, 63.72389221191406, 58.36295700073242, 70.25154876708984, 64.24580383300781]",66.15398406982422,"[73.64578247070312, 70.77111053466797, 68.8910903930664, 61.8734130859375, 65.57603454589844, 75.60586547851562]"
105,"If you're a lawyer, you take continuing education.","[['This function is staffed by engineers chosen for their technical competence and who have the title , member of the technical staff .'], ['There was no weapon Early could not take apart and reassemble blind-folded .'], ['A little parable illustrative of this truth is afforded by an incident related by Professor Bela Vasady at the end of the Second World War .'], ['Suppose , says Dr. Lyttleton , the proton has a slightly greater charge than the electron ( so slight it is presently immeasurable ) .'], ['writes : Does numbness in the left hand at night , which awakens the person , indicate brain tumor ? ?'], ['Five of the papers deal with grammatical problems .']]","[[-0.21484234929084778], [-0.10280188918113708], [-0.0009300243109464645], [0.09874089062213898], [0.18665125966072083], [0.22918252646923065]]",115.65164947509766,115.65164947509766,"[119.78950500488281, 128.06710815429688, 132.86875915527344, 123.50554656982422, 106.70512390136719, 129.00343322753906]",49.11779022216797,"[80.17849731445312, 48.311798095703125, 86.06221771240234, 79.32681274414062, 81.0947265625, 72.63227844238281]"
