target_idx,target_sent,sents_intrp_all_bins,sim_intrp_all_bins,base_PPL,local_unintrp_PPL,local_intrp_PPL_all_bins,global_unintrp_PPL,global_intrp_PPL_all_bins
76,"According to the latest national data from the National Center for Health Statistics (NCHS), the likelihood that a couple will celebrate their 20th wedding anniversary today isn't much greater than a coin toss: 52 percent for women and 56 percent for men.","[['Orders were given to dig .'], ['for example , the Crusades , mission efforts , just wars .'], [""Ernie was screaming inside himself : No , damn you , you ain't gonna take my meal ticket away from me ! !""], ['We should recall the number of movements for the service of mankind which arose from the kindred Evangelicalism of the British Isles and the Pietism of the Continent of Europe -- among them prison reform , anti-slavery measures , legislation for the alleviation of conditions of labour , the Inner Mission , and the Red Cross .'], [""It is Field Marshal Montgomery's belief that in most Western countries about 60 per cent of the people do not really care about democracy or Christianity ; ;""], [""A Republican survey says Kennedy won the '60 election on the religious issue .""]]","[[-0.15198764204978943], [-0.10046517848968506], [-0.0001460844650864601], [0.09984523802995682], [0.19757762551307678], [0.33779048919677734]]",53.13038635253906,53.13038635253906,"[53.33118438720703, 54.927093505859375, 64.8348617553711, 60.08334732055664, 58.104488372802734, 52.09497833251953]",47.830322265625,"[48.440765380859375, 47.525474548339844, 61.80367660522461, 53.955528259277344, 52.995445251464844, 46.375308990478516]"
31,"Couples who rarely get a chance to restore their ""reserves,"" such as those from low-income communities, can be particularly prone to marital dissatisfaction and divorce.","[[""The Ford and the pickup truck sped west toward Sanford's Run .""], ['Of current interest is Abilene , Kansas , the birthplace of ex-President Eisenhower .'], ['On that first day , Blanche literally thought she was going to die , or , at the very least , go out of her mind .'], ['Perhaps he had better have someone help him put up the pegboard and build the workbench -- someone who knew what he was about .'], ['Those who walk on it may encounter at any turn ministers of grace or damnation .'], [""It's inevitable in this case , for the couple will be separated for , at the least , forty years .""]]","[[-0.16633731126785278], [-0.10035660862922668], [-1.7861835658550262e-05], [0.09988010674715042], [0.19920440018177032], [0.35835665464401245]]",233.86842346191406,233.86842346191406,"[321.8861999511719, 209.18743896484375, 259.0115966796875, 252.34158325195312, 182.298095703125, 209.25018310546875]",165.47930908203125,"[181.6033935546875, 164.9428253173828, 210.99395751953125, 186.62925720214844, 159.3161163330078, 163.91282653808594]"
4,"Analysis of the same data set found that all respondents — regardless of income level — reported similar problems within their relationships, such as wanting more affection and struggling to communicate effectively with their partners.","[[') if we are born of god we practice righteousness .'], [""We set up the Lloyd's Neck school , worked out its curriculum , and taught there .""], ['Basic pottery studio equipment .'], ['There are about 200 different kinds of Andrena in Europe alone .'], ['Locker-room talk often stresses the idea that a man is doing the girl a favor if he is forceful and ruthless during the first penetration .'], ['It is not enough in accounting for this feeling to analyze it into the wickedness of individual people added together to produce a cumulative effect .']]","[[-0.17080119252204895], [-0.1001051589846611], [-3.055855631828308e-05], [0.09969612956047058], [0.199053555727005], [0.33609044551849365]]",161.65115356445312,161.65115356445312,"[158.16180419921875, 168.31814575195312, 159.05615234375, 143.20071411132812, 135.11607360839844, 136.55409240722656]",99.08312225341797,"[115.33955383300781, 106.30908966064453, 99.55007934570312, 105.98697662353516, 108.83973693847656, 104.32539367675781]"
33,"But nice talk isn't enough, says Orbuch.","[['Altogether fifteen virtually unknown Rodgers and Hart songs are sung by a quintet of able vocalists .'], [""Samples zoomed into closeup range in regular succession , like telephone poles passing on the highway , while representative music reinforced the mood of the late teens and 1920's .""], ['On the other hand , you may seek His favor , humble yourself before Him and beg His mercy , implore His forgiveness , forsake your sins , and abandon your whole life to Him .'], ['Signora Ferraro , bobbing her head encouragingly , asked Sam about Canada , having a special interest .'], ['And the league takes a stand , with great regularity , on the side of right .'], ['But he was too busy to hear what she was saying .']]","[[-0.1623346507549286], [-0.10055028647184372], [-0.00021586567163467407], [0.0995602160692215], [0.19969521462917328], [0.3945491313934326]]",882.2310791015625,882.2310791015625,"[1033.5491943359375, 766.2990112304688, 584.63037109375, 778.998046875, 657.7079467773438, 862.8171997070312]",864.5370483398438,"[758.9320678710938, 1146.57470703125, 483.5207214355469, 723.0390625, 742.800048828125, 938.6993408203125]"
96,"How do you reduce it?""","[['One day Maeterlinck , coming with a friend upon an event which he recognized as the exact pattern of a previous dream , detailed the ensuing occurrences in advance so accurately that his companion was completely mystified .'], ['He ran on his plump sticks of legs , freezing now and again into the sudden startled attitudes which the camera had caught and held on the paling photographs , all carefully placed and glued and labeled , resting in the fat plush album in the bottom drawer of the escritoire .'], [""`` He's there '' , he got out tersely , curbing his rising excitement .""], ['Similar measurements are being initiated to resolve a large discrepancy in the heat of formation of another important combustion product , beryllium fluoride .'], ['Improves utilization of low-moisture corn ( less than 14% ) .'], [""If you've got any ideas '' .""]]","[[-0.1468702256679535], [-0.10053355246782303], [-9.523099288344383e-05], [0.09990622103214264], [0.1987670511007309], [0.3184039294719696]]",613.2830810546875,613.2830810546875,"[516.6154174804688, 446.11865234375, 212.35789489746094, 485.0987243652344, 588.3287963867188, 137.9111328125]",94.25621032714844,"[324.5840759277344, 205.87713623046875, 138.5211639404297, 188.7253875732422, 227.6423797607422, 125.08336639404297]"
