target_idx,target_sent,sents_intrp_all_bins,sim_intrp_all_bins,base_PPL,local_unintrp_PPL,local_intrp_PPL_all_bins,global_unintrp_PPL,global_intrp_PPL_all_bins
83,Age at marriage is also a predictor of marital success: Couples who wed in their teens are more likely to divorce than those who wait to marry.,"[['The funds would be used for equipment , not for land , buildings , or operation .', 'Riverside residents would go to the Seekonk assembly point .'], ['This , again , applies to Katanga .', 'From the outside it was an ordinary enough house of the gentry .'], [""Faber's Choice ( Faber Hanover-Sally Joe Whippet ) 2:36 ; ;"", 'Three requirements go with a blockade : It must be proclaimed ; ;'], ['Patchen does read some of his earlier works to music , but he has written an entire book of short poems which seem to be especially suited for reading with jazz .', ""You could set up tables in the front room and serve salads and your baked beans and brown bread and Grandma could dress like a gypsy and tell fortunes '' .""], [""The bond issue will go to the state courts for a friendly test suit to test the validity of the act , and then the sales will begin and contracts let for repair work on some of Georgia's most heavily traveled highways ."", 'While high anxiety children achieve significantly less well ( Af ) in the unstructured school than do low anxiety children , they appear to do at least as well as the average in the structured classroom .'], [""`` You are bound to get involved with people when you have children '' , Fran had told me at our first meeting , `` so it is good to know that those with whom you get involved are not just dreary little housewives and dull husbands , but People Who Do Things '' ."", ""`` You are bound to get involved with people when you have children '' , Fran had told me at our first meeting , `` so it is good to know that those with whom you get involved are not just dreary little housewives and dull husbands , but People Who Do Things '' .""]]","[[-0.15201511979103088, -0.15185728669166565], [-0.10186559706926346, -0.1018512099981308], [-0.0003759581595659256, -0.00035096425563097], [0.09944692254066467, 0.0995217114686966], [0.19301457703113556, 0.1933707892894745], [0.3219691514968872, 0.3219691514968872]]",92.9924545288086,92.9924545288086,"[92.76264953613281, 71.42900085449219, 87.13475799560547, 80.76866912841797, 71.63177490234375, 75.97174072265625]",57.26564407348633,"[64.2558822631836, 61.5727653503418, 61.43208694458008, 70.02235412597656, 58.78486633300781, 68.7529296875]"
88,"1 source of conflict or tension,"" she says.","[['The fossilized remains of many of these trees are found embedded in the clay .', 'Just short of forty lashes we finally managed to coerce our children to this view .'], [""Sometimes , on a return trip , the aviator would `` go upstairs '' high over the clouds ."", 'But the information on the dynamics of population was often quite misleading .'], [""The result was the `` Gross Report '' , prepared by Gross , as chairman , with the assistance of two U.N. Under Secretaries , Constantin Stavropoulos and Philippe De Seynes ."", 'Now the Stone Harbor bird sanctuary , 31 acres of magic attraction for exotic herons , is threatened , but the battlefront extends far beyond our state .'], ['Drunk or sober she was the most attractive woman in the world for me .', 'Drunk or sober she was the most attractive woman in the world for me .'], ['Anyway , Julia asks me to .', '`` If Philip Toynbee is claiming that the choice lies between capitulation and the risk of nuclear war , I think he is right .'], [""Why she doesn't charge him , I don't know ."", ""Why she doesn't charge him , I don't know .""]]","[[-0.17635664343833923, -0.17620912194252014], [-0.10093219578266144, -0.10074812173843384], [-0.00029999949038028717, -0.000290068332105875], [0.09916950762271881, 0.09916950762271881], [0.1914583444595337, 0.191829115152359], [0.24999113380908966, 0.24999113380908966]]",153.14773559570312,153.14773559570312,"[370.1490173339844, 345.6280517578125, 347.2066955566406, 227.61578369140625, 190.3472137451172, 145.1766815185547]",104.72777557373047,"[228.26846313476562, 258.9166259765625, 210.47666931152344, 208.23681640625, 143.54513549804688, 149.87188720703125]"
17,Celebrate good times.,"[['Moreover , it should not be so fastidious in its growth requirements as to make production on a militarily significant scale improbable .', ""It has a hull patterned on that of the United States navy's Nautilus , the world's first atomic submarine .""], [""She said , `` Well , those are the really interesting things , but if you don't like any of those I can turn over some of my extra typing jobs to you , if you think you can type well enough '' ."", ""He contends this idea doesn't conflict with experiments on which the principle of conservation of matter and energy is based because some slight error must be assumed in such experiments .""], ['He was wearing sneakers and shorts and an open-collared shirt , and in his hand he carried a little black bag .', 'and an Air Force of 91 combat wings and 825,000 men .'], ['Special districts in Rhode island .', 'Registrations of new cars in Dallas County cracked the 3,000 mark in March for the first time this year .'], [""`` If you're goin' to kill 'em -- ! !"", '`` A stake-out , I suppose .'], [""21 swingin' a wide loop"", 'The story opens on the eve of his fifty-third birthday , as he prepares for the two weeks of festivities that are to follow .']]","[[-0.16599823534488678, -0.16500230133533478], [-0.1013108640909195, -0.10117722302675247], [-0.0005180221050977707, -0.0004770010709762573], [0.09905314445495605, 0.09907421469688416], [0.1960635781288147, 0.1962640881538391], [0.2729829251766205, 0.27427518367767334]]",1326.7529296875,1326.7529296875,"[7703.48828125, 3113.63671875, 2299.97509765625, 3502.371826171875, 957.6651000976562, 3370.4443359375]",1190.04345703125,"[3975.389404296875, 3453.2822265625, 1247.223876953125, 1467.1298828125, 1438.5601806640625, 1079.7652587890625]"
99,"At that point, the distress of the fire distracts from the appreciation of the alarm.","[['Let us focus on an atom of calcium from the tip of the bone of my finger and let us suppose that I swallow a magic Alice In Wonderland growing pill .', 'Let us focus on an atom of calcium from the tip of the bone of my finger and let us suppose that I swallow a magic Alice In Wonderland growing pill .'], [""That's why I -- why I do a free job now and then ."", ""John's reply was like a declaration of war .""], [""After I would finish playing the songs , he'd just go away without a comment ."", 'Well , a man had tried , at the King Arthur , to register with an ocelot .'], ['Ekstrohm cleared his throat .', 'Ekstrohm cleared his throat .'], ['The figure was close enough now for him to see the nose twitching to dislodge the drop clinging there .', 'The figure was close enough now for him to see the nose twitching to dislodge the drop clinging there .'], ['One shawl was so tremendous that she could not wear it , so she draped it over the banister on the second floor , and it hung over the stairway .', 'Coming home from work , he was startled to see a police car parked in front of the apartment building .']]","[[-0.16846194863319397, -0.16846194863319397], [-0.10106991976499557, -0.10105634480714798], [-0.0005471501499414444, -0.000542759895324707], [0.09947991371154785, 0.09947991371154785], [0.19698631763458252, 0.19698631763458252], [0.2773943543434143, 0.2797934412956238]]",61.05356216430664,61.05356216430664,"[60.34226989746094, 66.10722351074219, 68.62263488769531, 60.3688850402832, 62.52999496459961, 65.02877807617188]",43.346038818359375,"[52.69171142578125, 46.05369567871094, 57.90377426147461, 48.89540481567383, 48.474849700927734, 60.16387939453125]"
24,"The technique supports what Aron showed in a 1993 study: that spouses were more satisfied with their relationships when they were told to go on more exciting dates, such as hiking or going to parties.","[['Few rural areas are protected by zoning .', ""We'll take them in the general order of their popularity .""], ['He had a short , heavy , powerful body .', ""Accident , murder , suicide -- take your pick '' .""], ['I drew back , drawing back my foot for a kick .', 'But this is fully answered by United States v. Nugent , supra .'], [""`` Of course ( George's letter continued ) , there are practical problems to be considered ."", 'There can be no doubt that the American Catholic accomplishment in the field of higher education is most impressive : our European brethren never cease to marvel at the number and the size of our colleges and universities .'], ['They were married at a lavish ceremony which was duly recorded in Parvenu and all other magazines and newspapers , and then they honeymooned in Bermuda .', 'The physical education program for men recognizes the value of participation in competitive sports in the development of the individual student and aims to give every man an opportunity to enter some form of athletic competition , either intercollegiate or intramural .'], [""The sections were mounted on cold slides smeared with Haupts' adhesive ( Johansen , 1940 ) in earlier experiments , and in later experiments with a different mixture of the same components reported by Schramm and Rottger ( 1959 ) ."", '`` We have tried to make both paths attractive , so that good men could find opportunity and satisfaction in either .']]","[[-0.15800052881240845, -0.15652599930763245], [-0.10198875516653061, -0.10194067656993866], [-0.0005445722490549088, -0.000544525682926178], [0.09962433576583862, 0.09963397681713104], [0.19790019094944, 0.19795705378055573], [0.31636226177215576, 0.3174351453781128]]",112.03609466552734,112.03609466552734,"[119.91368865966797, 125.7714614868164, 111.11280822753906, 110.06653594970703, 111.12638092041016, 107.01687622070312]",87.65416717529297,"[94.48070526123047, 105.00505065917969, 94.58379364013672, 86.10543823242188, 104.29047393798828, 89.10072326660156]"
