target_idx,target_sent,sents_intrp_all_bins,sim_intrp_all_bins,base_PPL,local_unintrp_PPL,local_intrp_PPL_all_bins,global_unintrp_PPL,global_intrp_PPL_all_bins
133,"Calming him down, he started crying in her arms as he told her what had happened.","[[""Although progress has been made in America's system of libraries it still falls short of what is required if we are to maintain the standards that are needed for an informed America ."", ""We have concluded that petitioner's claims are controlled by the rationale of Gonzales v. United States , 348 U.S. 407 ( 1955 ) , and United States v. Nugent , 346 U.S. 1 ( 1953 ) , and therefore affirm the judgment .""], ['The appeal is going to be to the pocketbook and may be very convincing to those who do not see its relation to political and legal , as well as economic , self-rule .', 'These data are not of the precision obtainable by the methods previously mentioned , but the vast number of approximate values available will be useful in many areas .'], ['But I am here concerned more with policy than with men .', ""Says Keys : `` Maybe if the idea got around again that obesity is immoral , the fat man would start to think '' .""], [""`` Why the hell didn't you come out when you saw them gang up on me '' ? ?"", ""`` One thing , Summers '' , Brenner said .""], ['Rimanelli is tough and square-built and adventurous , says what he thinks .', 'His wife had said to him : `` Nellie is in love with Clayton Roy .'], ['but the letter went on : she had cried , she had implored , she had been miserable at his refusal , and finally he had relented -- and now how happy she was , how expectant ! !', 'It made him a little sick , and he let go of her .']]","[[-0.15184061229228973, -0.14931154251098633], [-0.10037671029567719, -0.10036738961935043], [-8.351542055606842e-05, -2.6348978281021118e-05], [0.09974513947963715, 0.09977824985980988], [0.19932079315185547, 0.19933244585990906], [0.44192051887512207, 0.4700852036476135]]",54.22716522216797,54.22716522216797,"[147.26487731933594, 113.49443817138672, 57.31591033935547, 48.769100189208984, 41.37442398071289, 37.77264404296875]",39.113128662109375,"[103.06134796142578, 74.03075408935547, 49.098602294921875, 38.056793212890625, 38.68378448486328, 37.13388442993164]"
301,"Tess, taken totally off guard by the passion that was enveloping her, moaned, and when David captured her tongue, she trembled at the desire that rose up from deep within her, and she struggled to get out of his embrace.","[['Thus , the need for the B-70 as a strategic weapon system is doubtful .', 'As you can count on me to do the same .'], ['The early works were conceived for a sophisticated , international audience ; ;', 'Generally , states reserve for communities the right to have local ordinances regulating speed and other activities .'], ['Our pin-curl clips and self-locking nuts achieved dominance in just a few years time , despite substantial , well established competition .', 'In recent years gagwriters have discovered this brand of blunder and thus the misplaced modifier has acquired a new habitat in the gagline .'], ['Fortunately the number of pathological bigots appears to be quite small , but it would be a mistake to think that more than a matter of degree separates them from the rest of us .', ""Speaking recently in Miami , Governor Rockefeller said that `` to assure the sufficiency of our own weapons in the face of the recent Soviet tests , we are now clearly compelled to conduct our own nuclear tests '' .""], ['it is when I meet someone who was a close friend of the family , and therefore of mine , and they nod to me so coolly and walk away , that it hurts .', 'In February the murder of Patrice Lumumba , who had been kidnaped into Katanga and executed on order of Tshombe , again stirred the U.N. to action .'], [""With a swift swoop of his big arms , he grabbed Sally out of the circle surrounding him , and then kissed her soundly before setting her down so she could stand by his side while they jointly chose the rest of their `` outfit '' ."", 'Delphine stood like stone , her eyes alive with hate as she looked down at the sheeted corpse .']]","[[-0.14723923802375793, -0.14633680880069733], [-0.10074274241924286, -0.10045475512742996], [-8.627865463495255e-05, -5.923956632614136e-05], [0.09982213377952576, 0.0998268872499466], [0.19971510767936707, 0.1997189074754715], [0.453008770942688, 0.4557819366455078]]",113.89827728271484,113.89827728271484,"[120.92791748046875, 151.88015747070312, 144.08346557617188, 142.3397979736328, 130.2359161376953, 109.75469970703125]",124.14564514160156,"[113.2973403930664, 118.49213409423828, 120.01952362060547, 120.55052947998047, 128.73851013183594, 111.9485092163086]"
357,"We would love to get to know you, and for you to get to know us.”","[['But , at the beginning , this stayed just in the air .', 'But , at the beginning , this stayed just in the air .'], ['Business leaders are aware now that they suffer greatly from any outbreak of violence .', 'Racial discrimination is wrong , then , not because it goes against the grain of a faculty member trying to converse with a few realtors but because it goes against the grain of creation and against the will of the Creator .'], ['Providing these means are about ninety companies which manufactured the estimated 1,800,000 boat trailers now in use .', ""it is manic as a man '' .""], ['The men of your company would not allow your name dishonored .', 'This torque causes the entire system to rotate about the **yf axis , since the response to Af .'], [""`` So you know something of the classics , do you '' ? ?"", 'In spite of the relatively short period of time that we have experienced among you , we have already seen many indications of your character and spirit .'], [""`` I don't know what you heard that would make you think so , but I assure you I don't even know myself , so how can you be so sure ? ?"", ""`` We'd like you to have a dilatation and curettage .""]]","[[-0.16896690428256989, -0.16896690428256989], [-0.10018020868301392, -0.10016711056232452], [-0.00011582300066947937, -0.00011069327592849731], [0.09976315498352051, 0.09980161488056183], [0.1978999525308609, 0.19810718297958374], [0.3507097661495209, 0.3589438498020172]]",45.576576232910156,45.576576232910156,"[44.9885368347168, 44.68701934814453, 42.93609619140625, 42.117305755615234, 29.65671157836914, 29.53428840637207]",25.98339080810547,"[26.828075408935547, 24.59035301208496, 25.274824142456055, 24.795480728149414, 21.385311126708984, 21.150047302246094]"
359,May I inform my wife that her plan finally worked?“,"[['The collective by which I address you in the title above is neither patronizing nor jocose but an exact industrial term in use among professional thieves .', 'He was not stone .'], ['It was at the end of the sidewalk in front of the Dellwood Cemetery cottage .', 'They seemed then to have had a single mind and body , a mutuality which had been accepted with the fact of their youth , casually .'], ['In addition , little work has been done on a comparative basis in regard to the normal existence of bronchial artery-pulmonary artery anastomoses .', 'An optimal policy is one which in some sense gets the best out of the process as a whole by maximizing the value of the product .'], ['Greg wished the Air Corps had continued to camouflage planes .', 'Deliberately , she ignored the yelp .'], ['I got in the car , drove down to the drive-in and ordered a couple of hamburgers with everything included , a cup of coffee and the fastest service possible .', ""For it seems that Barco , fancying himself a ladies' man ( and why not , after seven marriages ? ?""], [""`` I would like to enact a little tableau this afternoon '' , Rector said , He explained about the visit and the effect he wished to create , the picture of a very busy mission ."", 'You might try looking into his wife too .']]","[[-0.16392700374126434, -0.16378852725028992], [-0.10016819834709167, -0.10015697777271271], [-5.391240119934082e-05, -3.124028444290161e-05], [0.09987573325634003, 0.09992427378892899], [0.19933193922042847, 0.19957849383354187], [0.3343665599822998, 0.3383199870586395]]",1231.31396484375,1231.31396484375,"[854.0281982421875, 1046.56494140625, 1312.3721923828125, 1249.123046875, 899.8726196289062, 523.385986328125]",459.53240966796875,"[478.70355224609375, 487.5716857910156, 574.359130859375, 385.7230529785156, 516.4740600585938, 363.392822265625]"
374,"Looking at her, he asked, “Tess, you do plan on saying yes, don’t you?”","[[""Once again B'dikkat moved among them like a father ; ;"", 'It is not enough in accounting for this feeling to analyze it into the wickedness of individual people added together to produce a cumulative effect .'], ['Piloting a Curtiss Navy MF flying boat off Lake Winnipesaukee in 1925 , he had inaugurated the original Rural Delivery air service in America .', 'Board Chairman Howard Simpson of the Baltimore & Ohio Railroad Co. , testified the B & O was in its worst financial condition since the depression years and badly needed the economic lift it would get from consolidation with the Chesapeake & Ohio Railroad .'], ['As Littlepage noted : `` A complete picture of Prince Potemkin may be had in his 1788 operations .', 'Most of the Junkers were above the blinding light of the flares , and the radar-controlled shore gun had been knocked out by one of the first sticks of bombs .'], [""`` Now don't shut this door ."", 'Surprisingly , he had told the others what he had done .'], [""Well , whatever you have , that's it ! !"", ""`` I might point out that your inability to report to my office this morning when you were instructed to do so has not ah limited my knowledge of your activities as you may have hoped '' .""], [""`` Yes , sir '' , she said , `` is that definite '' ? ?"", ""`` I don't mind at all '' , he said , delighted with her attention .""]]","[[-0.15037865936756134, -0.150040864944458], [-0.10058306157588959, -0.10052874684333801], [-0.00012132152915000916, -9.510572999715805e-05], [0.09987115859985352, 0.09996526688337326], [0.19957385957241058, 0.19969072937965393], [0.43327629566192627, 0.4562249481678009]]",78.14013671875,78.14013671875,"[80.76447296142578, 80.46833038330078, 80.9679183959961, 54.68019104003906, 69.23558807373047, 51.57426071166992]",35.1492805480957,"[50.09252166748047, 58.42145538330078, 50.836185455322266, 35.82130813598633, 46.39407730102539, 37.47466278076172]"
