target_idx,target_sent,sents_intrp_all_bins,sim_intrp_all_bins,base_PPL,local_unintrp_PPL,local_intrp_PPL_all_bins,global_unintrp_PPL,global_intrp_PPL_all_bins
74,"Women with at least a bachelor's degree have a 78 percent shot that their marriages will last 20 years, compared with a 41 percent chance among women with only a high school diploma, according to the NCHS data.","[['Other recommendations made by the committee are :', 'trade was just beginning to expand ; ;'], ['Powers was covering the remaining guard .', 'It is here that the local and ecumenical must meet .'], ['Pat pushed through first .', 'Pat pushed through first .'], [""Or ( more commonly , thinks Keys ) the deposits themselves get so big that they choke off the artery's flow to the point that an infarct occurs : the heart muscle is suffocated , cells supplied by the artery die , and the heart is permanently , perhaps fatally injured ."", ""Or ( more commonly , thinks Keys ) the deposits themselves get so big that they choke off the artery's flow to the point that an infarct occurs : the heart muscle is suffocated , cells supplied by the artery die , and the heart is permanently , perhaps fatally injured .""], ['There is much to be said for a college that , while happily attuned to the sophisticated Ivies , still gives its students a chance to get up early in the morning and drive along back roads where a glimpse of small game , deer , or even bear is not uncommon .', 'A further possibility is suggested by the example of the G. I. bills and also by some recent trends in attitudes toward improving college education : that is to provide financial assistance to individuals for vocational training when local facilities are inadequate .'], [""Seven years they'd been married ."", 'Mary was free to marry again , not knowing that the Sturch had secretly given her a divorce , thinking that death had dissolved her marriage .']]","[[-0.1456252932548523, -0.145524799823761], [-0.10171903669834137, -0.1016533374786377], [-0.00022505037486553192, -0.00022505037486553192], [0.09964635968208313, 0.09964635968208313], [0.19730418920516968, 0.19772908091545105], [0.2841586470603943, 0.2894435524940491]]",35.723636627197266,35.723636627197266,"[34.43516159057617, 31.13991355895996, 33.25772476196289, 43.98387908935547, 32.1627197265625, 35.01608657836914]",28.430681228637695,"[28.895437240600586, 28.101276397705078, 28.74734115600586, 33.66354751586914, 32.169071197509766, 28.509288787841797]"
16,"Lower-income groups, however, experienced more problems related to economic and social issues such as drinking or drug abuse (, 2012).","[['Casey heard the click of the distant receiver before he could open his mouth , and it took him no more than three seconds to make his decision .', ""He waited awhile before he said , `` Roy , you know your decompression table , don't you '' ? ?""], [""Some time later the missing part of the relic was found and the complete inscription , together with other new evidence , fully corroborated the ancient priest's information ."", ""`` Ryan , look over there '' , Nogol said .""], ['Related to written literature , and often remaining temporarily frozen in written form , it loses its vitality when transcribed or removed from its oral existence .', ""Gaylor's obsession and Cunningham's chimera-chasing reminiscences had mesmerized him into thinking of Lila and Lilac , separately or together , as a legend .""], ['The net result is that under American leadership the general world situation has become bad .', 'The net result is that under American leadership the general world situation has become bad .'], [""`` Both because of our culture's stress on beauty and our improved economic conditions , some parents demand that the dentist try to correct a problem before it is wise to do so ."", 'The placement of your pool , however , will not of itself solve the two major problems of pool owning -- those that involve your social life and those pertaining to safety .'], ['When some question arises in the medical field concerning cancer , for instance , we do not turn to free and open discussion as in a political campaign .', 'One effect of the proposal , which puts a premium on population instead of economic strength , as in the past , would be to take jobs from European nations and give more to such countries as India .']]","[[-0.18147897720336914, -0.18091996014118195], [-0.10060940682888031, -0.10054000467061996], [-0.00032731518149375916, -0.0003028600476682186], [0.09940091520547867, 0.09940091520547867], [0.1917276680469513, 0.19254109263420105], [0.24487607181072235, 0.24694694578647614]]",58.90164566040039,58.90164566040039,"[101.26951599121094, 74.30547332763672, 58.69518280029297, 48.497230529785156, 53.439910888671875, 48.63386154174805]",42.122005462646484,"[78.20317077636719, 49.23198699951172, 46.54513168334961, 42.524192810058594, 45.83602523803711, 41.99351501464844]"
109,"""Doing or saying small things frequently to make your partner feel special, cared for and loved … is very predictive of staying together, being happy and [preventing] divorce,"" she says.","[['The Kirov Ballet is firmly booked into the Shrine Auditorium , Los Angeles , Nov. 21 thru Dec. 4 .', 'The Kirov Ballet is firmly booked into the Shrine Auditorium , Los Angeles , Nov. 21 thru Dec. 4 .'], ['`` Warm enough to swim -- real Indian summer .', '`` Warm enough to swim -- real Indian summer .'], [""After figuring out how to regulate the barrels so that they shot to the same point of impact , we fired this little 20-inch-barrel job on my home range and in Marlin's underground test gallery ."", ""The process of social control is operative insofar as sanctions play a part in the individual's behavior , as well as the group's behavior .""], [""you can't very well sidle up to people on the street and ask if they want to buy a hot Bodhisattva ."", '`` U.S. pressure on Britain to foster war hysteria over the status of West Berlin has reached its apogee .'], ['This is well evidenced by the Quietist doctrines carried over in Zen : the idea of the inward turning of thought , the enjoinder to put aside desires and perturbations so that a return to purity , peace , and stillness -- a union with the Infinite , with the Tao -- could be effected .', ""Besides , 'tain't no more'n right for me to follow with my black oxen , so's I can unhook and pull up fast if either of you get in a pinch '' .""], ['The two in the bed knew each other as old people know the partners with whom they have shared the same bed for many years , and they needed to say no more .', ""but the nicest thing about their relationship was her whisper to him , repeated some thousands of time , repeated with smiles and hope , `` People never live forever '' .""]]","[[-0.14986735582351685, -0.14986735582351685], [-0.10199962556362152, -0.10199962556362152], [-0.00040067732334136963, -0.0003794301301240921], [0.09963750839233398, 0.09964224696159363], [0.19700276851654053, 0.19771018624305725], [0.3389509618282318, 0.3398631811141968]]",403.3009033203125,403.3009033203125,"[602.6649780273438, 382.7091064453125, 352.92083740234375, 401.8008117675781, 337.329345703125, 367.3054504394531]",339.8995056152344,"[399.9309997558594, 283.8840026855469, 340.98846435546875, 328.09417724609375, 252.251220703125, 291.7973937988281]"
56,"Partners who reported patterns of destructive behavior when dealing with conflict in the first year of marriage, for example, were more likely to divorce years later (, 2010).","[['He looked at the luminous dial of his wrist watch .', 'He stumbled to the middle of the road and simply stood there , waiting for them , a perfect target .'], ['That tap had a slight bangish quality .', 'That tap had a slight bangish quality .'], ['A splendid vote of confidence in Thayer , Madden reflected .', 'The President asks the support and cooperation of Congress in his efforts through the enactment of legislation to provide federal grants to states for specified efforts in combating this disturbing crime trend .'], ['Actually , Zen owes more to Chinese Quietism than it does to Mahayana Buddhism .', 'Early in August we broke ground for a new $3,500,000 plant in Warwick , Rhode Island , which will house our textile and coil winding machinery operations .'], ['William Coddington , who was running the colony , felt constrained to move seven miles south where , with others -- as mentioned above -- he founded Newport .', 'Conventional images of Jews have this in common with all perceptions of a configuration in which one feature is held constant : images can be both true and false .'], [""But the greater part of semester time was actually centered around the attitudes : `` So we are married -- now how do we make the best of it '' ? ?"", 'Then Miriam varied the senseless psychological warfare by suddenly withdrawing a suit for separate maintenance that had been pending , and asking for divorce on the grounds of cruelty , with the understanding that Wright would not contest it .']]","[[-0.16443921625614166, -0.16437843441963196], [-0.10124650597572327, -0.10124650597572327], [-0.00031480006873607635, -0.0002954769879579544], [0.09946946054697037, 0.09949879348278046], [0.19717273116111755, 0.19734779000282288], [0.34903377294540405, 0.3524854779243469]]",85.91535186767578,85.91535186767578,"[114.3571548461914, 90.9214096069336, 92.49846649169922, 120.97330474853516, 98.78535461425781, 81.26051330566406]",69.38239288330078,"[70.3246078491211, 65.88153076171875, 64.11478424072266, 75.71363067626953, 83.2610092163086, 63.21590042114258]"
34,"And the earlier you acquire the tools to maintain a relationship, the better, adds Gottman, who estimates that newlyweds who engage in his programs are three times more likely to succeed than those who wait until they need an intervention.","[[""Vladilen Semenov , a fine `` danseur noble '' ; ;"", 'I could see the blood running down his chest .'], ['Maybe I will grow another head .', 'Maybe I will grow another head .'], ['-- New York Central Railroad president Alfred E. Perlman said Tuesday his line would face the threat of bankruptcy if the Chesapeake & Ohio and Baltimore & Ohio Railroads merge .', 'But , admit or not , Bonner was helpless .'], [""`` Imagine being able to laugh and wink when you're like the top part of that picture frame at home '' , one of them said ."", ""And he wouldn't leave her either -- he'd told me that .""], ['To the extent that the problem is merely parking , an aggressive downtown management , like that of Lazarus Brothers in Columbus , Ohio , can fight back successfully by building a garage on the lot next door .', ""`` To get a marriage back where it belongs '' , comments Dr. Schillinger of the Lincoln Institute , `` the husband must take some very basic steps .""], ['So all-important are ideas , we are told , that persons successful in business and happy in social life usually fall into two classes : those who invent new ideas of their own , and those who borrow , beg , or steal from others .', 'Most important of all , the less developed countries must be persuaded to take the necessary steps to allocate and commit their own resources .']]","[[-0.1939302533864975, -0.1927880346775055], [-0.1007055789232254, -0.1007055789232254], [-0.00021580886095762253, -0.0001986473798751831], [0.09957818686962128, 0.09961321204900742], [0.19751296937465668, 0.1975213587284088], [0.3123384118080139, 0.3140007555484772]]",102.76642608642578,102.76642608642578,"[123.7855453491211, 108.47834777832031, 131.28097534179688, 119.03266906738281, 106.46599578857422, 100.7761459350586]",96.6466064453125,"[104.72856903076172, 104.47753143310547, 104.16250610351562, 109.61625671386719, 93.55941009521484, 95.05351257324219]"
