target_idx,target_sent,sents_intrp_all_bins,sim_intrp_all_bins,base_PPL,local_unintrp_PPL,local_intrp_PPL_all_bins,global_unintrp_PPL,global_intrp_PPL_all_bins
69,"In her work with the Early Years of Marriage Project, a longitudinal study of 373 couples who married in 1986 (funded by the National Institutes of Health), Orbuch has found that seven out of 10 pairs name finances a cause of relationship trouble.","[[""The troops must have more than the common quantity of liquor , and perhaps there will be some little drunkenness among them '' ."", ""That pale kind's the worst '' .""], ['Finally , in desperation , he opened the refrigerator , filched her hand lotion , and left a note .', 'The structures housing the apartments are of masonry and frame construction .'], ['And the 100,000 subscribers became a reality .', '-- Encouraging by every means , all existing Assemblies of God churches to start new churches .'], ['Scores are stated in grade-equivalents on a national norm .', 'Information on pages 8 to 14 may help you in deciding on the kind and scale of your farming venture .'], [""Forty years ago an English writer , W. L. George , dealt with this subject in Eddies of the Day , and said , as an example , that ' Saint George for Merry England ' would not start a spirit half so quickly as ' Strike frog-eating Frenchmen dead ' '' ! !"", ""Forty years ago an English writer , W. L. George , dealt with this subject in Eddies of the Day , and said , as an example , that ' Saint George for Merry England ' would not start a spirit half so quickly as ' Strike frog-eating Frenchmen dead ' '' ! !""], [""A weekly newspaper reported a local romance : `` and the couple were married last Saturday , thus ending a friendship which began in their schooldays '' ."", ""A weekly newspaper reported a local romance : `` and the couple were married last Saturday , thus ending a friendship which began in their schooldays '' .""]]","[[-0.1776769757270813, -0.17635215818881989], [-0.10017378628253937, -0.10017326474189758], [-0.00010016653686761856, -8.17989930510521e-05], [0.09968486428260803, 0.0997353196144104], [0.19915810227394104, 0.19915810227394104], [0.36475783586502075, 0.36475783586502075]]",88.19522094726562,88.19522094726562,"[106.04112243652344, 96.0381851196289, 101.34821319580078, 94.41252136230469, 120.41132354736328, 96.37467956542969]",77.33037567138672,"[86.8353271484375, 77.1458511352539, 87.91234588623047, 82.25399780273438, 104.5987548828125, 87.12673950195312]"
65,"Fortunately, psychologists are finding that many ways to strengthen a relationship's odds of survival are surprisingly simple.","[['Prior to 1942 , automobiles were the individual responsibility of the agency to which assigned .', 'His energy was gone .'], ['For thirty minutes , Stanley Gilborn stood there .', 'Having received permission to give a camp reunion-Halloween party , she asked that I come and be her date .'], ['there is a limit to how much the public will pay for shoddy performance .', ""There's no doubt this Tim sneaked back and killed Mrs. Buck .""], [""He then got a job with the Chicago Herald-Examiner as a circulation slugger , a rough fighter employed to see that his paper's news pitches were not trespassed upon by rival vendors ."", 'Shy , slender-waisted girls at the loom in harmony with the frangipani by the wayside .'], ['Undoubtedly far more can be done in the lower grades in this regard in the Negro schools .', 'The English saints are widely venerated , quite naturally , and now there is great hope that the Forty Martyrs and Cardinal Newman will soon be canonized .'], ['Nonetheless , although few in number they are a stubborn crew , as tenacious of life as the Hardshell Baptists , which suggests that there is some kind of vital principle embodied in their faith .', 'There was a fifty-fifty chance , perhaps , that he would be unmarried , and an even more slender chance that his approach would be different .']]","[[-0.15730887651443481, -0.15697169303894043], [-0.10054996609687805, -0.10051393508911133], [-0.00011270120739936829, -8.617155253887177e-05], [0.09956362843513489, 0.0996064618229866], [0.1994374394416809, 0.1994774490594864], [0.3377670645713806, 0.33992934226989746]]",227.98727416992188,227.98727416992188,"[233.0844268798828, 256.7756042480469, 218.79808044433594, 298.6681823730469, 288.7360534667969, 187.2868194580078]",162.06353759765625,"[156.15914916992188, 193.50587463378906, 167.9547119140625, 192.66592407226562, 177.70497131347656, 147.4590301513672]"
50,Men who didn't feel affirmed by their wives were twice as likely to divorce as those did.,"[['She looked out at the corn field , the great green deep acres of it rolled out like the sea in the field beyond the whitewashed fence bordering the grounds .', 'She looked out at the corn field , the great green deep acres of it rolled out like the sea in the field beyond the whitewashed fence bordering the grounds .'], ['I turned on the electric bug , and the signal came in loud and clear .', 'Autocoder declarative statements provide the processor with the necessary information to complete the imperative operations properly .'], [""The Rev. R. L. Brandt , national secretary of the home missions department , stressed the need for the first two years' work ."", 'They had been through trying times , but their faith in the Almighty had given them the courage and the strength to meet and overcome the many problems and difficulties that were the price they had to pay for freedom .'], ['This retelling by Louis Zara of the brief , anguished life of Stephen Crane -- poet and master novelist at 23 , dead at 28 -- is in novelized form but does not abuse its tragic subject .', 'Her initial intelligence tests registered above normal and her adaptation index was unusually high .'], ['No sooner had Betsey come out of the ring than Mrs. Long walked into the Working Competition with Ch. Cadet or Noranda , another home-bred product , and won ! !', ""He recalls with a wry smile the wit who said , on returning from a homecoming reunion , that he would never go again because all his class had changed so much they didn't even recognize him .""], ['The husbands of these women and others I had met in Catatonia were distinguished only in that they were , to me at least , indistinguishable .', ""For it seems that Barco , fancying himself a ladies' man ( and why not , after seven marriages ? ?""]]","[[-0.13938337564468384, -0.13938337564468384], [-0.10120965540409088, -0.10117703676223755], [-0.0001457519829273224, -0.00012244121171534061], [0.09984811395406723, 0.0999133363366127], [0.19910928606987, 0.19920319318771362], [0.38014334440231323, 0.38404762744903564]]",365.1162109375,365.1162109375,"[525.7181396484375, 448.7116394042969, 286.748779296875, 429.7027282714844, 325.73406982421875, 515.1397705078125]",259.17181396484375,"[329.78314208984375, 333.99444580078125, 193.3045654296875, 270.4725341796875, 255.0887908935547, 412.07305908203125]"
22,But research shows it's how couples handle those inevitable sore spots that matters.,"[['She was thirty-one years old then .', 'Armed Forces Day Proclamation by John A. Notte , Jr. , Governor'], ['The Peace Corps offers an opportunity to bring home to the United States the problems of the world as well as an opportunity to meet urgent host country needs for trained manpower .', 'Mr. Notte was responding to a resolution adopted by the Central Falls City Council on July 10 and sent to the state house by Miss Grant .'], ['Also , it requires more time as compared to the automatic approach .', ""`` I seem to remember '' , he said , `` that in an interview ten years ago you gave humor and comedy five years to live .""], ['Time is a queer thing and memory a queerer ; ;', 'Obviously , the slowing for her may have occurred at any point between Onset and Completion .'], [""For it seems that Barco , fancying himself a ladies' man ( and why not , after seven marriages ? ?"", 'Dominant stress on pretty would be almost insulting here .'], ['The two in the bed knew each other as old people know the partners with whom they have shared the same bed for many years , and they needed to say no more .', ""But the greater part of semester time was actually centered around the attitudes : `` So we are married -- now how do we make the best of it '' ? ?""]]","[[-0.16442078351974487, -0.1638980507850647], [-0.1003146767616272, -0.1001264825463295], [-7.639825344085693e-05, -7.027015089988708e-05], [0.09972524642944336, 0.09972956776618958], [0.19914546608924866, 0.19917085766792297], [0.30851250886917114, 0.3292716145515442]]",1311.2950439453125,1311.2950439453125,"[2258.7978515625, 1794.9141845703125, 1060.1331787109375, 914.5214233398438, 1311.1375732421875, 862.8892211914062]",1024.0919189453125,"[1604.30810546875, 1343.9697265625, 800.229736328125, 1097.7972412109375, 989.1997680664062, 762.8585205078125]"
59,He looked at data from 136 couples over the 10 years since their weddings.,"[['New rule no. 5 : :', ""This snake could not harm anything '' .""], [""`` The other fellow had a '' ."", 'Travel allowances are well-regulated and pose little problem in administration and/or audit control .'], ['My car gulped 20 gallons without even wiping its mouth .', ""A century ago , Newman saw that liberalism ( what we now might call secularism ) would gradually but definitely make its mark on English Protestantism , and that even high Anglicanism would someday no longer be a `` serviceable breakwater against doctrinal errors more fundamental than its own '' .""], ['The difference is that the masters took the bare frame of a plot and filled it with their own world ; ;', 'Mr. Herman has managed to mix musical ideas drawn from Israel and the standard American ballad style in a manner that stresses the basic tunefulness of both idioms .'], ['He thought once that he identified the somewhat hysterical voice of Fleischman claiming a kill .', ""While it is easy enough to ridicule Hawkins' pronouncement in Pleas Of The Crown from a metaphysical point of view , the concept of the `` oneness '' of a married couple may reflect an abiding belief that the communion between husband and wife is such that their actions are not always to be regarded by the criminal law as if there were no marriage .""], [""A weekly newspaper reported a local romance : `` and the couple were married last Saturday , thus ending a friendship which began in their schooldays '' ."", ""A weekly newspaper reported a local romance : `` and the couple were married last Saturday , thus ending a friendship which began in their schooldays '' .""]]","[[-0.15920397639274597, -0.15893611311912537], [-0.10051722079515457, -0.10043163597583771], [-0.00020730867981910706, -0.0001983949914574623], [0.09977972507476807, 0.09979905188083649], [0.19795548915863037, 0.19818410277366638], [0.38892248272895813, 0.38892248272895813]]",98.6041259765625,98.6041259765625,"[133.46998596191406, 117.28886413574219, 128.41326904296875, 125.11587524414062, 109.15829467773438, 99.19024658203125]",87.86754608154297,"[94.63211059570312, 122.70387268066406, 103.93730926513672, 108.20063018798828, 101.39297485351562, 75.79226684570312]"
