target_idx,target_sent,sents_intrp_all_bins,sim_intrp_all_bins,base_PPL,local_unintrp_PPL,local_intrp_PPL_all_bins,global_unintrp_PPL,global_intrp_PPL_all_bins
74,"Although the rate of divorce has declined slowly and steadily since the early 1980s, the rate of marriage has diminished rapidly, with more people choosing to marry later in life (see ).","[[""`` We ourselves must stand sentinel '' ."", 'Roles of various types , within the larger system and within the subgroups 3 .'], ['He looked out over the expanse of the compound .', 'Then pour water or light oil from a graduated beaker into the chamber to fill the chamber to its gasket surface .'], ['Samples : He walked in upon her invitation .', ""`` Ain't he going to wake up '' ? ?""], ['The meetings in Zurich , the statement said , would deal only with principles that would guide the three factors in their search for a coalition Government .', 'In the midst of a great busy city , people take time to enjoy the beauty of natural reflection of artificial light .'], [""The failure at that time of the Puerto Rican bishops to control the votes of their people added a ring of good sense to Father Weigel's theological argument ."", 'But he rejects , perhaps a little too sweepingly , the theory that disloyal and pro-Communist influences may have contributed to the policy of appeasing Stalin which persisted until after the end of the war and reached its high point at the Yalta Conference in February , 1945 .'], ['In addition , this country has been settled by many peoples of many heritages and their lore has become acculturated slowly , in an age of print and easy communication , within an ever-expanding and changing society .', 'However , even if the latent demand for demythologization is not nearly as widespread as we are claiming , at least among the cultured elements of the population there tends to be an almost complete indifference to the church and its traditional message of sin and grace .']]","[[-0.16452838480472565, -0.16452598571777344], [-0.10352161526679993, -0.10336693376302719], [-0.0006196489557623863, -0.0006082723848521709], [0.09924551844596863, 0.0992465391755104], [0.1959199458360672, 0.19594258069992065], [0.3115414083003998, 0.31363701820373535]]",49.00690841674805,49.00690841674805,"[48.349510192871094, 56.67061233520508, 60.63898849487305, 47.35792541503906, 44.8108024597168, 36.58108901977539]",35.19775390625,"[39.00448989868164, 41.41960906982422, 48.47720718383789, 38.006080627441406, 35.8350715637207, 31.76938819885254]"
80,"Still, many happy honeymooners go on to divorce years later.","[['I merely draw an etymological distinction , hoping that specialists and busy people like you will welcome such precision in a layman .', 'If the patient can perceive figure kinesthetically when he cannot perceive it visually , then , it would seem , the sense of touch has immediate contact with the spatial aspects of things in independence of visual representations , at least in regard to two dimensions , and , as we shall see , even this much spatial awareness on the part of unaided touch is denied by the authors .'], [""While the `` empirical psychoanalytic '' label which Fromm claims sheds no light on the validity of his underlying philosophy , it does increase the marketability of his product ."", 'Second , we can make assistance for particular projects conditional on the consistency of such projects with the program .'], ['They did not speak much .', '1184 copies of the R. I. Directory Of Manufacturers were distributed : 643 in-state and 541 out-of-state .'], [""`` Who are you and what happened to you '' ? ?"", 'But these Western countries do care about themselves .'], ['Keith was snarling now .', 'If so , are you saying , `` Where did the last few years go ? ?'], ['The bride was given in marriage by her father .', 'Many belly dancers are married , but Serene is one of the few who will admit it .']]","[[-0.16202601790428162, -0.159999817609787], [-0.10419368743896484, -0.10406182706356049], [-0.0006354134529829025, -0.0006074309349060059], [0.09938603639602661, 0.0993940532207489], [0.1950671374797821, 0.19520220160484314], [0.32494688034057617, 0.3251418471336365]]",107.7564926147461,107.7564926147461,"[195.90293884277344, 171.44325256347656, 153.28121948242188, 100.69823455810547, 135.0318145751953, 70.38916015625]",135.37698364257812,"[166.13014221191406, 155.321533203125, 147.77444458007812, 104.22987365722656, 141.75498962402344, 97.14574432373047]"
57,"These ""positive affirmations"" can be as simple as tucking a nice note in a spouse's wallet or giving a shoulder rub after a long day at work, she adds.","[['The worst was yet to come .', 'And all because of Domokous ! !'], ['Our enemy is also threatening to devour us .', 'He gathered one of the biggest collections of Paul Klees in the world .'], ['Somebody was riding the tree .', 'In August while stopping in Greenock , Scotland , three members of the crew on liberty rendered first aid to a girl who fell from a train .'], ['Science is placing in our hands the ultimate power of the universe , the power of the atom .', 'On the other side of the Golden Horn I rode through Eminonu Square , with Yeni Cami , or the New Mosque , which dates from the Seventeenth Century , just across from the entrance to the bridge .'], ['He could think of nothing else save his mental image of her nude figure and what Charles had said that morning about Margaret Rider .', ""Rousseau had to admit that though he couldn't agree to a public performance , he would indeed , just for his own private satisfaction , dearly love to know how his work would sound when done by professional musicians and by trained voices .""], [""For here if anywhere in contemporary literature is a major effort to counterbalance Existentialism and restore some of its former lustre to the tarnished image of the species Man , or , as Malraux himself puts it , `` to make men conscious of the grandeur they ignore in themselves '' ."", '( 3 ) in a state of depression , the positive conditioned stimulus may fail to elicit a conditioned reaction but cause an increased synchrony instead of the excitatory desynchronizing ( alerting ) effect on the Aj .']]","[[-0.1831825226545334, -0.1817854642868042], [-0.10184448957443237, -0.1018221452832222], [-0.0006997426971793175, -0.0006968285888433456], [0.09909039735794067, 0.09909982234239578], [0.19598332047462463, 0.19599846005439758], [0.2916133999824524, 0.2918766438961029]]",201.5097198486328,201.5097198486328,"[218.71575927734375, 211.5791015625, 297.4822082519531, 231.97499084472656, 251.07699584960938, 205.54344177246094]",159.00904846191406,"[150.9774932861328, 156.0650634765625, 194.64674377441406, 166.43199157714844, 168.21022033691406, 169.59007263183594]"
5,"Partners who reported patterns of destructive behavior when dealing with conflict in the first year of marriage, for example, were more likely to divorce years later (, 2010).","[['In North Dakota the strangely beautiful Badlands will challenge you to translate its wonder on to film .', 'Although open to the general public it is not overcrowded ; ;'], ['Carbon resistors and impurity-doped germanium resistors have been investigated for use as precision secondary thermometers in the liquid helium temperature region .', ""From God's Will and Wisdom , and from virgin earth .""], ['A variety of techniques have been directed toward the isolation and study of blood group antibodies .', 'The Mayor is finding it awkward to campaign against his own record .'], ['Within a year or two several thousand might be in service .', 'In my estimation , they were people who read Daphne du Maurier , and discussed Kafka ; ;'], ['Related to written literature , and often remaining temporarily frozen in written form , it loses its vitality when transcribed or removed from its oral existence .', '( 3 ) in a state of depression , the positive conditioned stimulus may fail to elicit a conditioned reaction but cause an increased synchrony instead of the excitatory desynchronizing ( alerting ) effect on the Aj .'], [""`` You are bound to get involved with people when you have children '' , Fran had told me at our first meeting , `` so it is good to know that those with whom you get involved are not just dreary little housewives and dull husbands , but People Who Do Things '' ."", ""`` You are bound to get involved with people when you have children '' , Fran had told me at our first meeting , `` so it is good to know that those with whom you get involved are not just dreary little housewives and dull husbands , but People Who Do Things '' .""]]","[[-0.17813819646835327, -0.177467942237854], [-0.10224676132202148, -0.10222139209508896], [-0.0006542671471834183, -0.0006133690476417542], [0.09911142289638519, 0.09911632537841797], [0.19508501887321472, 0.19548258185386658], [0.30640900135040283, 0.30640900135040283]]",85.91535186767578,85.91535186767578,"[94.18666076660156, 119.4627685546875, 102.56928253173828, 108.08965301513672, 85.8451919555664, 101.51957702636719]",69.38239288330078,"[71.41735076904297, 83.93632507324219, 83.86946868896484, 71.61725616455078, 74.3564453125, 87.6677474975586]"
49,"""They're spending time getting to know one another,"" Orbuch says.","[['`` No one has come .', '`` No one has come .'], ['This system is divided into a forest highway system , administered by the Secretary of Commerce , and a forest development road and trail system , administered by the Secretary of Agriculture .', 'The Commission shall , as soon as possible , and in the order of the making of such awards , certify to the Secretary of the Treasury and to the Secretary of State copies of the awards made in favor of the Government of the United States or of nationals of the United States under this Title .'], ['Is your sporting firearms and ammunition department primed for the expanding horizons ? ?', 'Eleazar , pausing on the Hanover plain , found its great forests and remoteness good and with his own hands built the first College Hall , a log hut dedicated `` for the education & instruction of Youth of the Indian Tribes in this Land in reading , writing & all parts of learning which shall appear necessary and expedient for civilizing & christianizing Children of Pagans as well as in all liberal Arts and Sciences ; ;'], ['Jones was galloping close behind them leaning down , cheering them on .', 'No one could dislike them , I thought .'], ['Her words remained with him , worrying him for hours .', 'Her words remained with him , worrying him for hours .'], [""They wanted to see what his back felt like -- the General's ."", ""They wanted to see what his back felt like -- the General's .""]]","[[-0.17773129045963287, -0.17773129045963287], [-0.10243973135948181, -0.1023232638835907], [-0.0005567260086536407, -0.0005476009100675583], [0.09915079921483994, 0.09919268637895584], [0.19608980417251587, 0.19608980417251587], [0.3360629677772522, 0.3360629677772522]]",58.930389404296875,58.930389404296875,"[49.748924255371094, 143.45632934570312, 62.5257568359375, 51.320735931396484, 67.16840362548828, 61.99287033081055]",53.91336441040039,"[38.6120719909668, 148.29849243164062, 52.31635284423828, 40.40361022949219, 55.213375091552734, 59.462547302246094]"
