target_idx,target_sent,sents_intrp_all_bins,sim_intrp_all_bins,base_PPL,local_unintrp_PPL,local_intrp_PPL_all_bins,global_unintrp_PPL,global_intrp_PPL_all_bins
107,"According to the latest national data from the National Center for Health Statistics (NCHS), the likelihood that a couple will celebrate their 20th wedding anniversary today isn't much greater than a coin toss: 52 percent for women and 56 percent for men.","[[""It was General Burnside's horse running in a circle ."", 'Worst of all , Wally had no training for any kind of work .'], ['Anne was furious , and Bolingbroke advised that the request be refused .', 'In the main , this course took the following directional high roads .'], [""And a pane of glass isn't hard to '' --"", ""You don't know me but I know you .""], [""`` Then see that your youngster has a routine checkup once a year '' ."", 'A dinner and celebration in honor of this piece of engineering took place July 4 , 1793 , in a tavern erected by the corporation on the island .'], [""Instead -- and not just to prove my objectivity -- I hasten to report that it's a highly amusing film which probably does a fairly accurate job of reporting on the Easter vacation shenanigans of collegians down in Fort Lauderdale , and that it seems to come to grips quite honestly with the moral problem that most commonly vexes youngsters in this age group -- that is to say , sex ."", 'If you are a nonresident alien and a resident of Puerto Rico , your return is also due June 15 , 1962 , or the 15th day of the 6th month after the close of your fiscal year .'], [""It's inevitable in this case , for the couple will be separated for , at the least , forty years ."", ""It's inevitable in this case , for the couple will be separated for , at the least , forty years .""]]","[[-0.19999679923057556, -0.19418273866176605], [-0.10381048172712326, -0.10378092527389526], [-0.00079336017370224, -0.000788642093539238], [0.09801582247018814, 0.09808100759983063], [0.18875566124916077, 0.18879809975624084], [0.2504918873310089, 0.2504918873310089]]",53.13038635253906,53.13038635253906,"[56.993690490722656, 58.00004959106445, 59.16047286987305, 55.00456619262695, 57.05160903930664, 53.41583251953125]",47.830322265625,"[54.00823974609375, 53.00032424926758, 58.65578842163086, 51.2099609375, 51.65163803100586, 53.5440559387207]"
25,Other predictors of divorce are more contextual than personal.,"[['When dam construction began in 1933 , fewer than 600 boats used these waters ; ;', 'It was the sound of a siren .'], ['Before midnight he speeded his heart , resumed normal breathing , ran down his check list , uncurled and sat up .', 'Pitchers grumble about lively balls and lively bats , the shrinking strike zone , and the fact that the knock-down pitch is now illegal .'], [""the administration's official budget review , which estimates a 6.9 billion dollar deficit for the current fiscal year , isn't making anyone happy ."", ""the administration's official budget review , which estimates a 6.9 billion dollar deficit for the current fiscal year , isn't making anyone happy .""], ['These totaled 6,768 pieces of correspondence .', 'For example , arrow 17 in Figure 3 portrays the proximal radial epiphysis for boy 34 , whereas the same epiphysis for girl 2 is portrayed by arrow 18 in Figure 4 .'], ['Few things are more perilous for the State Department than a displeased congressman .', ""Its ontological status is itself most tenuous because apart from individual men , who are its `` matter '' , tradition , the `` form '' of society exists only as a shared perception of truth .""], ['Other countries , some of which I visited last month , have similar needs .', 'Anthony Steel , as the husband , is a jealous type who argues against her course and sues for divorce , labeling her action adulterous .']]","[[-0.21087881922721863, -0.20819240808486938], [-0.1025940328836441, -0.102564737200737], [-0.0008960291743278503, -0.0008960291743278503], [0.09784679859876633, 0.0979660153388977], [0.18960586190223694, 0.18975919485092163], [0.24623367190361023, 0.2467111498117447]]",616.6373901367188,616.6373901367188,"[1016.6044311523438, 1115.116943359375, 1057.2818603515625, 825.9393310546875, 400.638916015625, 390.894287109375]",264.20367431640625,"[427.162353515625, 628.1509399414062, 600.9414672851562, 378.5841979980469, 272.9418029785156, 329.9199523925781]"
4,"These ""positive affirmations"" can be as simple as tucking a nice note in a spouse's wallet or giving a shoulder rub after a long day at work, she adds.","[['There was no dream of escape for these people .', ""Felix is all there is '' .""], [""Feeds for livestock took about one-sixth of the world's cereal crop in 1957-1958 ."", 'Betty Lou Ham , age 16 , Holyoke , Mass. , showing an Irish Setter , was chosen as International Champion of the year .'], [""Like hell he'd wait -- and supposing the radar-controlled gun got knocked out ? ?"", 'As we find out at the end , it is not the stool ( symbolizing Doris , therefore the English ) that he is punishing but the piece of Venetian blind .'], ['Although it had seemed a good reason , to begin with : no couple could afford to have children .', ""The sound mockery of sheep is like the salubrious horse laugh '' .""], ['In this role of father confessor , he has always been most characteristic and most helpful .', 'Though this sculpture must take place thirty-three years after her moment of decision , he could not conceive of her as a woman in her mid-fifties , old , wrinkled , broken in body and face by labor or worry .'], ['The consummation should come at the next stopping place when they have a long private time ( day or night ) for that purpose .', ""With a swift swoop of his big arms , he grabbed Sally out of the circle surrounding him , and then kissed her soundly before setting her down so she could stand by his side while they jointly chose the rest of their `` outfit '' .""]]","[[-0.22300295531749725, -0.22181205451488495], [-0.10357986390590668, -0.10353971272706985], [-0.0010701864957809448, -0.0010671056807041168], [0.09866079688072205, 0.09867702424526215], [0.19467279314994812, 0.1949450969696045], [0.2754340171813965, 0.2769947648048401]]",201.5097198486328,201.5097198486328,"[246.08364868164062, 196.90606689453125, 199.94259643554688, 189.31304931640625, 214.10826110839844, 198.08584594726562]",159.00904846191406,"[157.5023956298828, 160.02069091796875, 151.84454345703125, 148.9899139404297, 163.7122344970703, 139.62059020996094]"
57,"In the Early Years of Marriage Project, Orbuch also found that good communication set the happiest of couples apart from the less blissful.","[['Detailed information on record lengths of the giants is given in the section that follows .', 'Will you obstruct this , or will you help ? ?'], ['or who ingested strange objects , like live fish ; ;', ""Why she doesn't charge him , I don't know .""], ['Sam Rayburn is one of the greatest American public figures in the history of our country and I consider that I have been singly honored in the privilege of knowing Sam Rayburn and sharing with him the rights and obligations of a Member of the House of Representatives in the Congress of the United States .', ""`` We know Penny spent some -- and Carmer must have dropped a few dollars getting that load on '' .""], ['The Polish song and dance company called Mazowsze , after the region of Poland , where it has its headquarters , opened a three-week engagement at the City Center last night .', 'Elizabeth Way was the first operator ; ;'], [""Appropriately , the emphasis on the home run , at a peak this year , came into being at baseball's lowest moment ."", 'he studied them , compared them with what he had been taught as a nestling , struggling to bridge between languages , the one he thought with and the one he was learning to think in .'], ['In many cases the revolutionary production has offered no more than sensational effects : the first hearing was fascinating and the second disillusioning as the gap between sound and substance became clearer .', 'The completeness of the connections provide that , for N people , there are Af lines of communication between the pairs , which can become a large number ( 1,225 ) for a party of fifty guests .']]","[[-0.21602743864059448, -0.20906375348567963], [-0.10398419946432114, -0.10388967394828796], [-0.0009207073599100113, -0.0009181611239910126], [0.09868704527616501, 0.0986955538392067], [0.19277669489383698, 0.1928374469280243], [0.27172568440437317, 0.2728881239891052]]",127.29163360595703,127.29163360595703,"[149.08627319335938, 144.43048095703125, 143.6763458251953, 149.04513549804688, 126.41022491455078, 127.7686996459961]",103.32057189941406,"[115.98931121826172, 101.13410186767578, 107.5146484375, 108.72842407226562, 100.60540771484375, 119.47683715820312]"
73,"And somehow, there's this belief that we don't have to work at learning how to be a couple, it should just come naturally,"" he says.","[['Of the 885 specimens newly mounted or refurbished , 254 were prepared for other agencies .', 'In place of the police headquarters was a new square filled with rubble .'], ['the desperate agony of goal-line stands .', 'Since that time the demands of the citizens for new and expanded services have placed financial burdens on the state which could not have been foreseen in earlier years .'], [""He served `` with '' him ."", ""A shrill yelp , kicked legs , and groping hands that circled Matsuo's wrist .""], ['Sigmen himself must have foreseen it .', ""Some clue to the character of London's approach in these discs may be gained immediately from the fact that ten of the 12 titles include the word `` percussion '' or `` percussive '' .""], ['He was the dormitory gapt when I went to college and thought I was getting away from him .', ""`` We have taught him a lesson '' .""], ['I know of no other solution than the one N.C. proposes -- to do what we can for each sufferer as he confronts us , hoping that this will spread beyond him to others at some time and some place .', ""`` But well , it just don't seem sportin' somehow '' ! !""]]","[[-0.2291659563779831, -0.2189711034297943], [-0.10483119636774063, -0.10481467843055725], [-0.0007907338440418243, -0.0007455125451087952], [0.0986555814743042, 0.09870981425046921], [0.1964070349931717, 0.1964726746082306], [0.30915331840515137, 0.3093157708644867]]",177.20286560058594,177.20286560058594,"[269.344970703125, 195.61431884765625, 198.5252685546875, 204.00466918945312, 107.80032348632812, 143.94241333007812]",110.71989440917969,"[138.37579345703125, 130.2130126953125, 128.83401489257812, 167.56809997558594, 104.0206069946289, 127.37519073486328]"
