target_idx,target_sent,sents_intrp_all_bins,sim_intrp_all_bins,base_PPL,local_unintrp_PPL,local_intrp_PPL_all_bins,global_unintrp_PPL,global_intrp_PPL_all_bins
42,"In one study using data from about 4,500 respondents to the Florida Family Formation Survey, social psychologist Benjamin Karney, PhD, of the University of California, Los Angeles, and colleagues found that the marriages of lower-income couples were more likely to be hurt by stressful life events and mental health problems than the marriages of the more affluent couples.","[[""The plank floor was slimed beneath Watson's boots ."", 'He stumbled to the middle of the road and simply stood there , waiting for them , a perfect target .'], ['The Abernathy furnace consumed fuel like a giant ravenous maw that had to be appeased by hurling tons of coal into its evil red depths , and no matter how much coal they put in the house remained cold .', 'Then he put a rag around the dressing to keep it in place .'], ['And women were not expected to know that the pitcher was trying not to let the batter hit the ball .', ""Baltimore's bulky spring-training contingent now gradually will be reduced as Manager Paul Richards and his coaches seek to trim it down to a more streamlined and workable unit .""], [""As a rule , the autistic child doesn't enjoy physical contact with others ."", 'This is our duty -- not as nurses or city employes -- but as citizens of the United States .'], [""( `` One of the reasons they get along fine '' , says a sportswriter who is friendly with the two men , `` is that both realize Mantle is head-and-shoulders above Maris '' ."", 'Practically everybody in Berlin has relatives and friends that live in the opposite part of the city .'], ['One such wife , Dr. Linden says , became disgusted with her weak husband and flurried through a series of extramarital affairs in the hope of finding a stronger man .', 'F. Morris Cochran , university vice president and business manager , said the house has been bought to provide rental housing for faculty families , particularly for those here for a limited time .']]","[[-0.1733584702014923, -0.17226189374923706], [-0.10273317992687225, -0.10248108208179474], [-0.0006684456020593643, -0.0005850009620189667], [0.09878383576869965, 0.09878639131784439], [0.19212529063224792, 0.19267642498016357], [0.28007349371910095, 0.2815189063549042]]",62.98764419555664,62.98764419555664,"[73.12801361083984, 75.02704620361328, 65.27666473388672, 55.52068328857422, 64.6001205444336, 57.177894592285156]",47.908695220947266,"[52.520999908447266, 55.410552978515625, 47.70163345336914, 48.534934997558594, 47.81141662597656, 50.25086212158203]"
70,Another predictor of divorce seems to be how a couple fares — and feels — even before they tie the knot.,"[['Powers was covering the remaining guard .', 'This land is in various stages of development in several locations throughout the town .'], ['With the development of nuclear technology , isotopic materials , and machine radiation sources in recent years , the possibilities of applying ionizing radiation to the preservation of foods attracted the attention of investigators in the United States and throughout the world .', 'Asked the gas station man .'], ['Construction follows a thorough study of the drawings .', ""Peter , you lummox , you've forgot to order the musicians '' .""], ['Finally Luis Hernandez said , `` What must be , must be .', ""( Sometimes I think you need only one rule for cooking : if you can't put garlic in it , put chocolate in it .""], [""`` and the more the action claims to be total , the smaller is the part of man engaged '' ."", 'The discrepancy between what we commonly profess and what we practice or tolerate is great , and it does not escape the notice of others .'], ['Although it had seemed a good reason , to begin with : no couple could afford to have children .', ""The trouble with them was that they almost never worked , and in fact an agreement `` in principle '' historically turned out to be a sure sign that neither party really wanted the quarrel settled .""]]","[[-0.1661570519208908, -0.16615572571754456], [-0.1032574325799942, -0.10305333882570267], [-0.0005555362440645695, -0.0005519147962331772], [0.09927742183208466, 0.09930123388767242], [0.1931862235069275, 0.19331105053424835], [0.27823731303215027, 0.27841830253601074]]",382.84197998046875,382.84197998046875,"[464.7581481933594, 561.3760375976562, 321.5355224609375, 411.3949279785156, 282.1341247558594, 292.7261047363281]",271.87823486328125,"[321.73980712890625, 399.0079345703125, 280.58294677734375, 337.2048645019531, 257.38287353515625, 250.50694274902344]"
66,"""The people who have stable, happy relationships are much gentler with one another than people who have unhappy relationships or break up,"" says Gottman, who's known for his ability to predict which newlyweds will divorce with more than 90 percent accuracy by observing how they communicate (, 1992).","[['Finally come those little flicks of a rigger brush and the job is done .', 'During the period , the laboratory rendered centralized macropathological service to qualified requesters .'], ['A car pulled into the driveway outside the window .', 'A car pulled into the driveway outside the window .'], ['to escape this fate , it must rule some things out .', 'to escape this fate , it must rule some things out .'], [""Old Mr. Pocket's frantic response to life imprisonment with a useless , social-climbing wife is to `` put his two hands into his disturbed hair '' and `` make an extraordinary effort to lift himself up by it '' , whereas Joe Gargery endures the shrewish onslaughts of Mrs. Joe by apologetically drawing `` the back of his hand across and across his nose '' ."", ""`` Uh-huh '' , Ryan admitted .""], [""and for this statement the best evidence comes within the five years following the publication of Utopia , when Martin Luther elaborates a new perception of the nature of the Divine's encounter with man ."", ""Each time Letch `` went up '' in his `` lines '' , I was the one to be patient , helpful and apologetic while he indulged in outbursts of temperament , profanity and abuse , blaming others , going into `` sulks '' and , on more occasions than I care to count , storming off the `` set '' for the rest of the day .""], ['Into the texture of this tapestry of history and human drama Henrietta , as every artist delights to do , wove strands of her own intuitive insights into human nature and -- especially in the remarkable story of the attraction and conflict between two so disparate and fervent characters as this pair -- into the relations of men and women : `` In their relations , she was the giver and he the receiver , nay the demander .', ""`` Most often '' , she says , `` it's the monogamous relationship that is dishonest '' .""]]","[[-0.18904060125350952, -0.1880365014076233], [-0.10372930020093918, -0.10372930020093918], [-0.000473853200674057, -0.000473853200674057], [0.09878463298082352, 0.09878566861152649], [0.19417406618595123, 0.1942349672317505], [0.29854950308799744, 0.2993568778038025]]",166.90223693847656,166.90223693847656,"[200.93527221679688, 243.427734375, 167.49533081054688, 169.9132843017578, 173.91851806640625, 149.0045623779297]",160.63267517089844,"[170.8763427734375, 210.3944854736328, 156.64405822753906, 151.21331787109375, 155.71047973632812, 158.5472869873047]"
69,He looked at data from 136 couples over the 10 years since their weddings.,"[['Except for that one morning .', 'Because the bobbin-to-cone winding process is a relatively high-cost operation for the mill , the almost complete automation provided by the Uniconer can mean important economies in textile production , at the same time upgrading quality .'], ['Highways go to a new Department of Highways , sewers to the Department of Public Works , such street cleaning as Borough Presidents now do ( in Queens and Richmond ) to the Sanitation Department .', ""Sonuvabitch , I can't figure out what in hell for they went and put niggers in my squad for .""], ['It has the power to do so but for the most part has left the matter for solution by judges on a case-by-case basis .', 'It has the power to do so but for the most part has left the matter for solution by judges on a case-by-case basis .'], [""he didn't even look up ."", ""Some clue to the character of London's approach in these discs may be gained immediately from the fact that ten of the 12 titles include the word `` percussion '' or `` percussive '' .""], ['he was considerate of their weakness , once he learned of it .', 'They had honeymooned in Rome ; ;'], ['He thought of the men , the nameless thousands , huddling in them .', 'He thought of the men , the nameless thousands , huddling in them .']]","[[-0.18699511885643005, -0.18208199739456177], [-0.10206371545791626, -0.10202191770076752], [-0.0006605628877878189, -0.0006605628877878189], [0.0988527238368988, 0.09885577112436295], [0.19437608122825623, 0.19496268033981323], [0.29096123576164246, 0.29096123576164246]]",98.6041259765625,98.6041259765625,"[124.3284683227539, 128.05458068847656, 146.2163543701172, 116.77496337890625, 130.23834228515625, 116.29978942871094]",87.86754608154297,"[98.29705810546875, 91.6859130859375, 136.07479858398438, 105.86939239501953, 84.38257598876953, 70.69542694091797]"
32,"After a decade, the most striking difference between the couples who had divorced and the ones who stayed together was how they had handled conflict during their first year of marriage.","[['He might have been anywhere or nowhere .', 'The units can be installed in basement , attic , crawlspace , or in a closet located in the living area .'], [""`` Cool '' , I told him ."", ""`` Stick to the preaching of the Gospel '' ! !""], [""Vermont's main railroad line was prostrate ."", ""He had found Curt's weakness , or what to Jess was a weakness , and was smart enough to take advantage of it .""], ['But she decided to stay at Spelman .', 'Her entrance in Scene 2 , Act 1 , brought some disconcerting applause even before she had sung a note .'], ['The Congolese were clamoring for their independence , even though most were unsure what it meant ; ;', ""I never did miss one in a playoff game -- I kicked about 20 in the five playoff games my last two years '' .""], ['Although it had seemed a good reason , to begin with : no couple could afford to have children .', ""Never in my life have I felt so remorseful about anything I've done as I did about spending that night with my own wife .""]]","[[-0.16812670230865479, -0.16395434737205505], [-0.10360406339168549, -0.10357162356376648], [-0.0006562434136867523, -0.0006365613080561161], [0.09899529069662094, 0.0990300178527832], [0.19425612688064575, 0.19449973106384277], [0.31541287899017334, 0.31564560532569885]]",63.39647674560547,63.39647674560547,"[68.81094360351562, 68.40489196777344, 77.16204071044922, 60.1755256652832, 63.764198303222656, 57.326927185058594]",66.15398406982422,"[74.4045639038086, 74.2259750366211, 66.51092529296875, 57.08494186401367, 48.86924362182617, 58.281166076660156]"
