target_idx,target_sent,sents_intrp_all_bins,sim_intrp_all_bins,base_PPL,local_unintrp_PPL,local_intrp_PPL_all_bins,global_unintrp_PPL,global_intrp_PPL_all_bins
26,"Stress, for example, can cause even the strongest relationships to crumble, psychologists' research finds.","[['He was passing through town and phoned to say hello .', ') that he dropped the shorts on the floor .'], [""B'dikkat grudgingly agreed , but he did not come out of the doorway ."", 'This function is staffed by engineers chosen for their technical competence and who have the title , member of the technical staff .'], ['A year later they were removed to a Stalag in the harbor of Stettin .', 'So rules we made , in unabashed collusion .'], ['The radius is calculated from the mass by assuming spheres of density Af except for the smallest particles , which must have a higher mass density to remain in the solar system in the presence of solar-radiation pressure .', 'for he was created not exactly immortal , nor yet exactly mortal , but capable of immortality as well as of mortality .'], [""Gerry began to aid Freddy with her father , prodded , no doubt , by Joan's open contempt for Freddy and William's irritating competency ."", 'She finds married life stifling and every prolonged sex relationship unbearably monotonous .'], ['Some interfaith tensions are not occasioned by theological differences at all , but by the need of men to have persons they can blame , distrust , denounce , and even hate .', 'A reporter restricted to the competing propaganda statements of both sides in a major labor dispute , for instance , is unable to tell his readers half of what he knows about the causes of the dispute .']]","[[-0.19369658827781677, -0.19049103558063507], [-0.10160856693983078, -0.10156580060720444], [-0.0004477445036172867, -0.0004363059997558594], [0.09870919585227966, 0.09880152344703674], [0.19254371523857117, 0.1925472617149353], [0.26164692640304565, 0.2630375027656555]]",446.5456237792969,446.5456237792969,"[400.35552978515625, 284.3760986328125, 383.4803466796875, 272.20489501953125, 282.17596435546875, 258.3233642578125]",220.72674560546875,"[265.4450988769531, 224.970947265625, 255.8131866455078, 211.825927734375, 233.6669921875, 204.05322265625]"
48,"By looking at how the Early Years of Marriage Project participants rated their marital happiness over time, she and her colleagues found couples tended to fit into two groups: those whose happiness started high and stayed that way, and those whose contentment started medium or low and got worse (Research in Human Development, 2012).","[['Again , a force too strong for unfrozen bodies to endure would be applied .', ""Negro radio is vitally necessary during the process of assimilation '' .""], ['`` All you have to do , Ilka dear , is to phone on your arrival .', 'The only trouble was that he himself was tied up on the school job .'], [""In his Message of December 2 , 1862 , he put his purpose and his policy in these words -- which I would call the Lincoln Law of Liberty-and-Union : `` In giving freedom to the slave , we assure freedom to the free '' ."", 'This is the feed state of the subsequent Af stages which , according to the principle of optimality , must use an optimal Af-stage policy with respect to this state .'], ['Joking and talking may be freer and easier , but the important factual information is still lacking for far too many newly-married men and women .', 'In the calm which follows the reading of a poem , for example , is the effect produced by the enforced quiet , by the musical quality of words and rhythm , by the sentiments or sense of the poem , by the associations with earlier readings , if it is familiar , by the boost to the self-esteem for the semi-literate , by the diversion of attention , by the sense of security in a legitimized withdrawal , by a kind license for some variety of fantasy life regarded as forbidden , or by half-conscious ideas about the magical power of words ? ?'], [""As Letch's antisocial conduct increased , our invitations decreased and my heart was in my mouth whenever I played hostess at a fashionable `` screenland '' gathering ."", ""He spoke through the public address box built into the cabin , and his gigantic voice roared out over the empty plain , so that the pink herd of talking people stirred gently in their happiness and wondered what their friend B'dikkat might be wanting to tell them .""], ['Within themselves , just as people , my friends were often tortured and unappeasably bitter about being the offspring of this unhappily unique-ingrown-screwedup breed ; ;', 'The children looked at each other and sagged their bottoms down even more comfortably than ever .']]","[[-0.1918368935585022, -0.1891603171825409], [-0.10200602561235428, -0.10198666155338287], [-0.0005862945690751076, -0.0005798395723104477], [0.09899809956550598, 0.09900051355361938], [0.1937451958656311, 0.1937563270330429], [0.28486859798431396, 0.28637877106666565]]",190.9461212158203,190.9461212158203,"[197.3262939453125, 190.3167266845703, 182.59423828125, 206.4289093017578, 205.2399139404297, 197.84967041015625]",145.00213623046875,"[160.8164520263672, 153.90029907226562, 152.1591796875, 160.5555419921875, 174.3305206298828, 162.79319763183594]"
68,"More recently, UCLA's Lavner led another study reevaluating how a couple's fighting style affected their marriages.","[[""Our blessed Lord Jesus Christ , the sinless Son of God , who could not lie , said , `` Amen , amen , I say to thee , unless a man be born again , he cannot see the kingdom of God '' ( St. John 3 : 3 ) ."", 'All-weather roads must be provided next to the feeding floor so access will be possible all year .'], ['This is not a social call .', 'Efficiency was enforced and nothing was left to chance .'], [""The association said it would post 24 hour guards at Gladden's home and at those of James Mining and Eugene Shiflett ."", 'yet her inflection seemed forced or rehearsed .'], ['She showed no interest at all in the life he had led back home , and it hurt him a little .', 'Neither of them , I understood , had been present at the filming session earlier .'], ['It had been a big battle , and the Confederate forces had won .', ""More than once I was confronted by professional gamblers , `` bookies '' , loan `` sharks '' , gangsters , `` thugs '' and `` finger men '' -- people of a class I did not even know existed -- to repay my husband's staggering losses , `` or else '' I shuddered to think that someone so dear to me could even associate with such a sinister milieu .""], ['Dangling his gaudy trinkets before them , he told of the Rebel losses in the mountains , at Cheat and Rich mountains both , and the Federal march on Beverly .', ""in particular against a Madonna portrayed in a voluptuous style and modeled , according to gossip , upon the painter's mistress .""]]","[[-0.17492693662643433, -0.1730852723121643], [-0.10423151403665543, -0.10418875515460968], [-0.0007827170193195343, -0.0007430166006088257], [0.09938071668148041, 0.09940586239099503], [0.19458895921707153, 0.19488190114498138], [0.2767292261123657, 0.27789306640625]]",148.7038116455078,148.7038116455078,"[142.22329711914062, 147.83470153808594, 142.91848754882812, 142.91748046875, 157.10440063476562, 141.65025329589844]",98.41229248046875,"[122.94065856933594, 112.0328369140625, 100.59476470947266, 107.84320068359375, 113.05686950683594, 106.5241928100586]"
69,He looked at data from 136 couples over the 10 years since their weddings.,"[['Except for that one morning .', 'Because the bobbin-to-cone winding process is a relatively high-cost operation for the mill , the almost complete automation provided by the Uniconer can mean important economies in textile production , at the same time upgrading quality .'], ['Highways go to a new Department of Highways , sewers to the Department of Public Works , such street cleaning as Borough Presidents now do ( in Queens and Richmond ) to the Sanitation Department .', ""Sonuvabitch , I can't figure out what in hell for they went and put niggers in my squad for .""], ['It has the power to do so but for the most part has left the matter for solution by judges on a case-by-case basis .', 'It has the power to do so but for the most part has left the matter for solution by judges on a case-by-case basis .'], [""he didn't even look up ."", ""Some clue to the character of London's approach in these discs may be gained immediately from the fact that ten of the 12 titles include the word `` percussion '' or `` percussive '' .""], ['he was considerate of their weakness , once he learned of it .', 'They had honeymooned in Rome ; ;'], ['He thought of the men , the nameless thousands , huddling in them .', 'He thought of the men , the nameless thousands , huddling in them .']]","[[-0.18699511885643005, -0.18208199739456177], [-0.10206371545791626, -0.10202191770076752], [-0.0006605628877878189, -0.0006605628877878189], [0.0988527238368988, 0.09885577112436295], [0.19437608122825623, 0.19496268033981323], [0.29096123576164246, 0.29096123576164246]]",98.6041259765625,98.6041259765625,"[124.3284683227539, 128.05458068847656, 146.2163543701172, 116.77496337890625, 130.23834228515625, 116.29978942871094]",87.86754608154297,"[98.29705810546875, 91.6859130859375, 136.07479858398438, 105.86939239501953, 84.38257598876953, 70.69542694091797]"
84,Other research suggests that supporting a spouse when times are good might go further than doing so when life goes sour.,"[['As can be seen from Figure 2 , an extensive area was covered by this aerosol .', 'Detailed information on record lengths of the giants is given in the section that follows .'], ['There shall be deducted from the amount of each payment made pursuant to subsection ( C ) of Section 8 , as reimbursement for the expenses incurred by the United States , an amount equal to 5 per centum of such payment .', ""Each religion has its own tenets '' .""], ['Even the officer in charge , be it a captain ( for small display ) or a general , is restrained by monitoring .', ""Me , I know the mind of an officer works in a strange and unfathomable manner '' .""], ['The atmosphere for this momentous experience can be created most effectively through the worship experience .', ""For subtle swinging rhythms , I could admire intensely Mulligan's version of `` Weep '' , and the fireworks went on display in `` 18 Carrots For Robert '' , a sax tribute to Johnny Hodges .""], [""In the bedroom before the husband and wife find their way to the bed , the lights go on : `` In dull domestic radiance I watch her staring face , still blind , Start wincing in obedience To dirty waters , counters , pots and pans , Waiting below stairs , in her mind '' ."", 'It will be painful , but interesting , to see what kind of a god these people will create or what strong convictions they will develop .'], [""A weekly newspaper reported a local romance : `` and the couple were married last Saturday , thus ending a friendship which began in their schooldays '' ."", 'She said to Maggie that it was one thing to meet an emergency and another to wallow in it , and it was beginning to look at if this one was going to last forever .']]","[[-0.19693297147750854, -0.19498850405216217], [-0.10253769904375076, -0.10235433280467987], [-0.0005555637180805206, -0.0005228649824857712], [0.09883786737918854, 0.09886586666107178], [0.1963760256767273, 0.19640150666236877], [0.28814613819122314, 0.29372677206993103]]",426.052490234375,426.052490234375,"[457.4761657714844, 400.4656982421875, 415.0306396484375, 517.062255859375, 366.77374267578125, 442.62835693359375]",273.59893798828125,"[297.450439453125, 309.5677490234375, 292.25469970703125, 342.43731689453125, 288.8006591796875, 303.1515808105469]"
