target_idx,target_sent,sents_intrp_all_bins,sim_intrp_all_bins,base_PPL,local_unintrp_PPL,local_intrp_PPL_all_bins,global_unintrp_PPL,global_intrp_PPL_all_bins
246,"Besides that, he was also missing Myra and the kids.","[['How long it will take to show substantial success in this effort will vary greatly from country to country .', 'East River , downtown : postscript to a letter from Harlem'], ['The applicant pays the rest of the cost , but his own time spent on the work and charges for the use of equipment which he owns may be applied toward his share of the cost .', 'stereo BGS 5031 ) is a good sample of the special , elegant art of English madrigal singing .'], ['Said the whining voice .', 'Said the whining voice .'], ['This vacuum formed sign is comprised of 27-in. ( or smaller ) panels formed of 0.080-in. clear butyrate sheet stock , masked and sprayed on the rear side .', ""I'm inclined to think that they are about two Earth-weeks each '' .""], ['There was a keening of wind , and a cracking of the frozen ground .', 'There was a keening of wind , and a cracking of the frozen ground .'], ['There were bilateral pterygia and arcus senilis , and the mouth was edentulous .', 'Phil shook his head and Eddie frowned .']]","[[-0.17540760338306427, -0.1744202971458435], [-0.10267363488674164, -0.10244473814964294], [-0.0007916558533906937, -0.0007916558533906937], [0.09919362515211105, 0.0992165356874466], [0.19586437940597534, 0.19586437940597534], [0.30660322308540344, 0.3076050281524658]]",109.71101379394531,109.71101379394531,"[204.40184020996094, 99.8684310913086, 94.5564193725586, 118.6082992553711, 113.52052307128906, 74.5999984741211]",68.81698608398438,"[116.87896728515625, 80.39430236816406, 75.0560302734375, 90.26139831542969, 71.61514282226562, 67.3316879272461]"
397,"I haven’t met the man yet, but after today, I probably don’t have a job.","[['These student-directed organizations include eight to ten members each ; ;', 'By relaxing the throat muscles and expanding the oral cavity well into the frontal sinuses , she could direct the vowel sounds into the most felicitous position for proper reproduction through her throat microphone .'], ['Jazz is the musical language of sex , the vocabulary of the orgasm ; ;', 'With meat , milk , butter and ice cream , the calorie-heavy U.S. diet is 40% fat , and most of that is saturated fat -- the insidious kind , says Dr. Keys , that increases blood cholesterol , damages arteries , and leads to coronary disease .'], [""Half crazed by the weight dragging , the dust , and the heat , the horse leaped our wall , dashing out the rider's brains against it , and leaving him lying there among us -- while the horse crashed away through the brush ."", 'Today the recreational boating scene is awash with heartening statistics which prove the enormous growth of that sport .'], ['To kayo him and maybe or maybe not kill .', ""It's quite a big one '' , he added .""], [""`` We have taught him a lesson '' ."", 'Juet had made plentiful enemies , several men stepped forward .'], [""No , I don't hold with those who live entirely among dead things ."", ""I'd been seeing Johnnie almost a year now , but I still didn't want to leave him for five whole days .""]]","[[-0.16915634274482727, -0.1690879762172699], [-0.10337360948324203, -0.10334402322769165], [-0.0009303390979766846, -0.0008712019771337509], [0.09879503399133682, 0.09882175922393799], [0.19615298509597778, 0.19642764329910278], [0.3086397051811218, 0.30870771408081055]]",46.617637634277344,46.617637634277344,"[65.09988403320312, 56.553375244140625, 39.62453842163086, 32.765926361083984, 49.325927734375, 27.483333587646484]",24.86077880859375,"[34.3873176574707, 29.002851486206055, 25.698999404907227, 24.10962677001953, 28.605318069458008, 22.47867774963379]"
134,"Ko knew a rejection from Tess would mean years of counselling for David, especially since Carla had lost her husband.","[['and launch them on the world when their time comes .', ""Under the general heading `` poetry-and-jazz '' widely divergent experiments have been carried out .""], ['He went down the steps to the galley and sleeping quarters ; ;', 'He went down the steps to the galley and sleeping quarters ; ;'], ['-- The three leaders of Laos agreed today to begin negotiations tomorrow on forming a coalition government that would unite the war-ridden kingdom .', 'A point like p gets information directly from n , but all information beyond n is indirectly relayed through n .'], ['Toward the end of his fourth hairy highball , while he was moodily making wet rings on the table-top with the bottom of the glass , he became aware that he was not alone .', ""I heard a cry from a stoker as a pillar of flame leaped from a hatch and tongued the man's bare back .""], ['So when old Mr. Lovejoy , the company president , talked about putting in a single sales manager for both branches after the head of the regular steels had gone with Carnegie-Illinois , it looked like the perfect chance for Bobbie .', ""For example , when the film is only four minutes old , Neitzbohr refers to a small , Victorian piano stool as `` Wilhelmina '' , and we are thereupon subjected to a flashback that informs us that this very piano stool was once used by an epileptic governess whose name , of course , was Doris ( the English equivalent , when passed through middle-Gaelic derivations , of Wilhelmina ) .""], [""Mrs. Roebuck smilingly declined and began suddenly to go on about her son , who was `` onleh a little younguh than you bawhs '' ."", ""Forty years ago an English writer , W. L. George , dealt with this subject in Eddies of the Day , and said , as an example , that ' Saint George for Merry England ' would not start a spirit half so quickly as ' Strike frog-eating Frenchmen dead ' '' ! !""]]","[[-0.1750657558441162, -0.17285235226154327], [-0.103273905813694, -0.103273905813694], [-0.000752132385969162, -0.0007404251955449581], [0.09881618618965149, 0.09885406494140625], [0.19727712869644165, 0.197284996509552], [0.33532634377479553, 0.3359396457672119]]",85.55611419677734,85.55611419677734,"[96.64605712890625, 99.10897827148438, 97.39408111572266, 98.09431457519531, 90.04443359375, 106.48534393310547]",94.82914733886719,"[87.01737213134766, 112.43104553222656, 94.90074920654297, 97.57461547851562, 85.89203643798828, 107.53443145751953]"
376,I am not going to give you time to find an excuse not to marry me.”,"[['Kennedy administration policies also have been assailed now from another direction by 70 Harvard , Boston University , Brandeis , and Massachusetts Institute of Technology educators .', ""Under the general heading `` poetry-and-jazz '' widely divergent experiments have been carried out .""], ['The child in the primary grades can play harmoniously with one companion , but his desire to be first in everything gets him into trouble when the group gets larger ; ;', 'Subject to the limitations hereinafter provided , the Secretary of the Treasury is authorized and directed to pay , as prescribed by Section 8 of this Title , an amount not exceeding the principal of each award , plus accrued interests on such awards as bear interest , certified pursuant to Section 5 of this Title , in accordance with the award .'], ['Everybody returned after intermission for the miscellaneous sweepings of the Fantasy For Piano , Chorus , And Orchestra In C Minor , made up by its composer to fill out one of his programs .', 'Everybody returned after intermission for the miscellaneous sweepings of the Fantasy For Piano , Chorus , And Orchestra In C Minor , made up by its composer to fill out one of his programs .'], [""As Letch's antisocial conduct increased , our invitations decreased and my heart was in my mouth whenever I played hostess at a fashionable `` screenland '' gathering ."", 'If so , are you saying , `` Where did the last few years go ? ?'], ['What I have to put up with ! !', ""`` Soon '' , said the half-man .""], [""I ain't no baby sitter '' ."", ""I ain't no baby sitter '' .""]]","[[-0.18472149968147278, -0.18386396765708923], [-0.10162860155105591, -0.10161274671554565], [-0.0009550973773002625, -0.0009550973773002625], [0.09896944463253021, 0.09899650514125824], [0.19494062662124634, 0.19501671195030212], [0.27284473180770874, 0.27284473180770874]]",52.170902252197266,52.170902252197266,"[86.63626861572266, 73.42445373535156, 88.60578155517578, 41.47758483886719, 40.17287826538086, 37.95094680786133]",26.878244400024414,"[36.06495666503906, 42.47554397583008, 40.23863220214844, 28.170886993408203, 27.592710494995117, 29.445852279663086]"
385,“The why about what?” David asked curiously.,"[['All-weather roads must be provided next to the feeding floor so access will be possible all year .', 'At each step of the calculation the operating variables of only one stage need be varied .'], ['In some areas , the progress is slower than in others .', 'Toys he has can be made to act as substitutes for family temptations such as refrigerator and gas stove .'], [""The same month that Alastor was published , Murray sold twenty thousand copies of The Siege Of Corinth , a slovenly bit of Byronism that even Shelley's generosity rebelled at ."", ""Student Prince Lounge on Atlantic Blvd. plotting a month-long `` festival '' throughout October , with special features .""], ['Martha Rodney ( Rodney-Miss Martha D. ) 2:35 ; ;', 'Martha Rodney ( Rodney-Miss Martha D. ) 2:35 ; ;'], ['He thought of the men , the nameless thousands , huddling in them .', 'He thought of the men , the nameless thousands , huddling in them .'], [""Henry Ford spoke of me as `` utterly astounding '' ."", ""Henry Ford spoke of me as `` utterly astounding '' .""]]","[[-0.17419829964637756, -0.1707613617181778], [-0.10431480407714844, -0.10386966168880463], [-0.0006151348352432251, -0.0006065201014280319], [0.0989169329404831, 0.0989169329404831], [0.19719934463500977, 0.19719934463500977], [0.3000350594520569, 0.3000350594520569]]",4805.2880859375,4805.2880859375,"[4394.6767578125, 5570.5703125, 5122.03173828125, 6502.94384765625, 4526.78173828125, 4754.62060546875]",2287.9033203125,"[2258.60302734375, 2372.289306640625, 3565.50830078125, 3290.447021484375, 1939.630615234375, 2382.036376953125]"
