target_idx,target_sent,sents_intrp_all_bins,sim_intrp_all_bins,base_PPL,local_unintrp_PPL,local_intrp_PPL_all_bins,global_unintrp_PPL,global_intrp_PPL_all_bins
26,"Stress, for example, can cause even the strongest relationships to crumble, psychologists' research finds.","[['He was elected to the National Academy of Design as an Associate in the oil class in 1931 ( after receiving his first Ranger Fund Purchase Prize at the Academy in 1930 ) , and elevated to Academicianship in 1940 .', 'I crossed the beautifully furnished living room to the pale yellow phone .'], ['On Thursday , the first day of the Masters , the contest between Palmer and Player developed instantly .', 'Elizabeth Way was the first operator ; ;'], ['To determine engine speed for a given combination of the other three factors the formula is : Af .', 'To determine engine speed for a given combination of the other three factors the formula is : Af .'], ['Perhaps the idea of sidewalk cafes could be extended .', 'Perhaps the idea of sidewalk cafes could be extended .'], ['Yes , and as tension mounts in this world , fear is increasing .', 'Conversely , if he gives a heavy rating to his own reading , and finds more accurate facts in it than in the others , a point is chalked up for the intrinsic , objective meaningfulness of this type of mediumistic material .'], ['( 3 ) in a state of depression , the positive conditioned stimulus may fail to elicit a conditioned reaction but cause an increased synchrony instead of the excitatory desynchronizing ( alerting ) effect on the Aj .', 'This the therapist may pursue in later questioning .']]","[[-0.20460762083530426, -0.20365023612976074], [-0.10178475081920624, -0.10175865888595581], [-0.0005214381963014603, -0.0005214381963014603], [0.09865926206111908, 0.09865926206111908], [0.19125011563301086, 0.19160713255405426], [0.24786388874053955, 0.25105714797973633]]",446.5456237792969,446.5456237792969,"[494.3572692871094, 441.87109375, 307.02764892578125, 369.7210388183594, 216.4424285888672, 234.45741271972656]",220.72674560546875,"[348.0606994628906, 324.9743347167969, 200.5927276611328, 238.38043212890625, 191.79092407226562, 199.62005615234375]"
64,"John Gottman, PhD, founder of the Gottman Institute and the University of Washington's Love Lab, says that 69 percent of marital conflict never gets resolved.","[['Anyone for musical Ping-pong ? ?', 'Anyone for musical Ping-pong ? ?'], ['Some have lovely homes -- some live in small apartments .', 'At birth , this species varies considerably in size .'], ['The argon flow from commercial bottles was regulated by a pressure regulator and measured with a gas flow rator .', 'The extent of such interference -- which may be so slight as to be undetectable at any point where either of the stations renders a usable signal , or may be so great as to virtually destroy the service areas of both stations -- depends on many factors , among the principal ones being the distance between the stations , their respective radiated power , and , of particular significance here , the time of day .'], ['The car spun around again , Simms said , before Stickney could turn north in Prairie Avenue , and then violated two stop lights as he traveled north into Wilmette in Prairie .', ""A new work on the program was Nikolai Lopatnikoff's `` Festival Overture '' , receiving its first New York hearing .""], [""`` The established pattern of relative calm in the field of race relations has continued in all areas '' , reported this group headed by Harold Colee of Jacksonville and including two South Floridians , William D. Singer and John B. Turner of Miami ."", 'In recent years , we have come increasingly to recognize that ideas have a history and that not the least important chapters of this history have to do with thematic or conceptual aspects of literature and the arts , although these aspects should be studied in conjunction with the history of philosophy , of religion , and of the sciences .'], [""His lawyer had sent him a statement on his overdue alimony , and there was a letter from the Collector of Internal Revenue asking him to stop in his office and explain last year's exemptions ."", 'Ann Catt was a lonely , devoted soul , never married , conducting a spotless home and devoted to her church , but a perpetual dissenter and born critic .']]","[[-0.20095640420913696, -0.20095640420913696], [-0.10323820263147354, -0.10290724784135818], [-0.0007464103400707245, -0.000743047334253788], [0.09900514781475067, 0.09905876219272614], [0.19298851490020752, 0.19354376196861267], [0.2651899456977844, 0.2653634548187256]]",57.46858596801758,57.46858596801758,"[59.949440002441406, 46.855918884277344, 58.86915969848633, 67.89765167236328, 52.3593635559082, 63.39777755737305]",45.87177658081055,"[51.7744140625, 45.59770202636719, 54.228675842285156, 55.18581771850586, 45.24509048461914, 51.99016571044922]"
81,"Gottman calls this ""the existential area.""","[[""Despite the successful rehabilitation of over a half million disabled persons in the first eleven years after 1943 , the existing program was still seen to be inadequate to cope with the nation's backlog of an estimated two million disabled ."", 'Even though the registers may have an incomplete record of persons present in a particular area or include persons no longer living there , they contain precise information on ages , by date of birth , for some of the persons present ( especially children in relatively stable communities ) and supplementary information ( such as records of marital status ) for many others .'], ['Or should we argue that if we want adjustment of children to children of different races and that that is impossible in an all-something-or-the-other school , we must at least provide him some opportunity to adjust to people of another race within the school -- namely , to a teacher of another race .', ""in conducting the Membership Preparation-Inquirers' Class , the pastor should plan a variety of teaching techniques in order to develop greater interest on the part of the class .""], [""Producer John Holmes has chosen a delightful comedy for his season's opener at Matunuck in Jean Kerr's `` King Of Hearts '' ."", 'Now that Israel enjoys relative prosperity and a reduction of tensions , the secularists are less disposed to compromise .'], ['The sole guidance given the Court for discharging the task committed to it was this : ``', ""in the similitude of God he created him '' .""], ['She wondered , with a baffled feeling of helplessness .', 'Guerrillas were racing toward him .'], ['Said the whining voice .', 'Said the whining voice .']]","[[-0.1999835968017578, -0.19939768314361572], [-0.10170768201351166, -0.10166604071855545], [-0.0007022656500339508, -0.0006784740835428238], [0.09786005318164825, 0.09807023406028748], [0.19371525943279266, 0.19388151168823242], [0.277229905128479, 0.277229905128479]]",592.3400268554688,592.3400268554688,"[849.3375854492188, 590.0909423828125, 433.37554931640625, 326.33819580078125, 517.3709716796875, 413.9555969238281]",401.3582458496094,"[672.9901123046875, 513.927978515625, 389.35882568359375, 324.47515869140625, 457.16650390625, 419.6496276855469]"
92,"Conversing about ""who are we, what's our mission and what's our legacy"" creates shared meaning and purpose in the relationship, he says.","[['Very small concentrations of these hydrides should be detectable ; ;', ""It read : `` Shot in the lumbar region '' .""], ['It is of interest that her menarche was somewhat later than the average for the girls in this group .', 'It snowed continuously , but quietly , evenly .'], ['As the index of refraction of photosensitive surfaces of the SbCs-type lies around 2 , the Fresnel losses at the fiber-photocathode interface are about 0.5 percent and the Af factor for the interstage coupler is 0.95 .', 'Dear God , at what a price .'], [""But with Welch's relentless pursuit of the subject , Barco finally `` broke '' and started confessing to one murder after another ."", 'Texts and translations are provided .'], ['I assumed Alma would get me there , but in the confusion of the meeting breaking up , we were separated .', ""Watson's insight is verified by the mysterious link between Holmes and his arch-opponent , Dr. Moriarty .""], [""so also did Mary , having a man betrothed ( to her ) , and being nevertheless a virgin , by yielding obedience , become the cause of salvation , both to herself and the whole human race '' ."", ""`` My feeling at the moment '' , he said , `` is that we have no alternative , irrespective of some of the arguments about him .""]]","[[-0.1968032419681549, -0.19423383474349976], [-0.10236609727144241, -0.1023474708199501], [-0.000587930902838707, -0.0005636662244796753], [0.09874469041824341, 0.09886082261800766], [0.19272658228874207, 0.1929778903722763], [0.2686142325401306, 0.26869553327560425]]",331.96795654296875,331.96795654296875,"[433.0937805175781, 355.1016540527344, 402.1987609863281, 386.26251220703125, 273.3412780761719, 278.0909729003906]",272.5556945800781,"[420.4207458496094, 348.6043395996094, 383.2978820800781, 331.5944519042969, 280.948974609375, 260.236572265625]"
82,"Growing used to your partner is natural, but it's a process that can be slowed down, says Sonja Lyubomirsky, PhD, a social psychologist at the University of California, Riverside, and author of the 2013 book ""The Myths of Happiness.""","[['Headquarters is in Birmingham , Ala. .', 'He looked over his shoulder at the thin dotting of pursuers .'], ['A more official representative is the Secretary of the Interior .', 'Figures seemed to crouch in the surrounding dark ; ;'], ['Hank had gathered wood for a cookfire , and his wife was busy at it now .', 'You should see to it that the trap , the dirt-catcher in front of the filter , is always clean .'], ['As artists we feel the same obligation , as do other individuals , in considering ourselves responsible citizens of a great nation .', 'Joan Sheldon had earned the larger bequest .'], ['How Maxwell recounts his first coming to Camusfearna , his furnishing the empty house with beach-drift , the subtle changes in season over ten years , is a moving experience .', 'Some of the classic indicators , as described by Drs. Pittenger , Hockett , and Danehy in The First Five Minutes , are these : ambiguity of pronouns :'], [""`` A marriage can survive almost any kind of stress except an open and direct challenge to the husband's maleness '' , declares Dr. Calderone ."", 'Even before he saw the necessity of growing better food and planning good nutrition , Mr. Clark felt the school had a good health program .']]","[[-0.1854674220085144, -0.18202094733715057], [-0.10370160639286041, -0.10354137420654297], [-0.0004694797098636627, -0.0004100073128938675], [0.0987822487950325, 0.09879592061042786], [0.19238460063934326, 0.19249048829078674], [0.2338179349899292, 0.235407292842865]]",85.72366333007812,85.72366333007812,"[85.24882507324219, 85.72894287109375, 80.54387664794922, 83.26338958740234, 87.13346862792969, 77.5537109375]",88.14115142822266,"[80.42528533935547, 82.20545196533203, 74.36279296875, 78.13491821289062, 82.91217041015625, 81.10049438476562]"
