target_idx,target_sent,sents_intrp_all_bins,sim_intrp_all_bins,base_PPL,local_unintrp_PPL,local_intrp_PPL_all_bins,global_unintrp_PPL,global_intrp_PPL_all_bins
202,"Much taller than she, he looked down at her with a frown on his face, and a look of disdain that demanded to know who she thought she was yelling at as he answered her question.","[['yet each historical event remains unique .', 'This assembly also supplies a 20-cps switching gate for the electronics circuitry .'], ['This could also be used for any other skin irritation .', '`` Warm enough to swim -- real Indian summer .'], ['He went straight to the Presidential box .', 'only -- it did not .'], ['A top official of the New Frontier who kept a record of his first weeks on the job here gives this report of his experiences :', 'Mono-unsaturated fats have room for two more hydrogens on each molecule , and the poly-unsaturated fat molecule has room for at least four hydrogens .'], ['Pansies are supposed to like it cool , but those great velvety flowers were healthy and perky in the glaring sun .', ""`` Now he's bought it '' , said my wife contentedly .""], ['Half slyly he enjoyed seeing her stoop to lift the things .', 'He had never heard so many bells , and as he lay there listening , he thought of her scolding him for his remarks when he had looked up at the obelisk and the church at the top of the Spanish Steps .']]","[[-0.14279621839523315, -0.14242595434188843], [-0.10235116630792618, -0.10234247148036957], [-0.0005117561668157578, -0.0004680356942117214], [0.09962175786495209, 0.0996483862400055], [0.19919177889823914, 0.19929008185863495], [0.40215957164764404, 0.4027794599533081]]",70.10550689697266,70.10550689697266,"[92.0494155883789, 66.03375244140625, 57.3314094543457, 68.22804260253906, 58.970947265625, 56.01094436645508]",55.31150436401367,"[61.06346130371094, 55.00517272949219, 54.8090934753418, 61.58445358276367, 55.77467346191406, 52.74586486816406]"
272,And all three laughed at her totally ignoring David as if he were not there.,"[['There is one thing I know ; ;', 'Experiments carried out over long periods of time in order to allow establishment of a steady state have shown that the onset of contraction and its completion are confined to an interval of several degrees Centigrade and to a concentration range of only several per cent .'], ['Its people , including Pierre Bottineau and other American Fur Company employees and the refugees from Fort Garry , were joined by the remaining Scots and Swiss from Fort Snelling when Major Joseph Plympton expelled them from the reservation in May 1840 .', 'Approximately 40 percent of the value of the work on roads for access to timber which are planned for this period will be constructed by purchasers of National Forest timber , but paid for by the Government through adjustment of stumpage prices .'], [""Of course , grave guiltiness may be imputed to the military action of any nation , or to the action of any leader or leaders , which for any supposed good `` permits '' , in this sense , the termination of the human race by human action ."", 'there is a limit to how much the public will pay for shoddy performance .'], ['Sarah had begun to tell Lucien of Emile , she had begun to question and a little draft had crept across the room from the bedroom door , open barely enough to show a rim of blackness in the hall .', 'Negroes represent nothing to him personally , except , perhaps , the dangers of carnality .'], [""`` Evadna Mae Evans said she didn't put a thing on her child but a flannel wrapper until it was nine months old '' ."", ""Barton's voice was rougher than Dill had ever heard it .""], ['He smiled to himself , and decided not to mention them till Dolores did .', ""And she really tried to go a step further and say she hoped they'd be just as right as they now were for her and for Rod .""]]","[[-0.15131673216819763, -0.15105968713760376], [-0.10169635713100433, -0.10156624019145966], [-0.00033069029450416565, -0.00031329039484262466], [0.09963354468345642, 0.09963862597942352], [0.19838841259479523, 0.1984274685382843], [0.3506716787815094, 0.35209211707115173]]",135.41017150878906,135.41017150878906,"[229.01910400390625, 363.0231018066406, 206.2406768798828, 128.49185180664062, 141.49856567382812, 111.8398208618164]",89.76136779785156,"[144.7417755126953, 221.6001434326172, 151.43482971191406, 92.84902954101562, 121.33899688720703, 90.15545654296875]"
34,"Suddenly her shyness appeared, and she wanted to get out of there and quickly.","[['It is the consequence of the system of ideas that constitutes the frame of our international -- and in some degree our domestic -- policy .', ""Like most Democratic spokesmen , Carvey predicts 1962 will be a tremendously `` partisan year '' .""], [""Do you have anything for me '' ? ?"", ""In fact , it is in just such a situation that the profundity of Bultmann's argument is disclosed .""], ['But it is most interesting in its account of the unending problems of high command , of decisions and their reasons , of the myriad matters that demand attention in addition to battle action .', 'In the vulnerable areas of the Pacific there should be restrictions against building homes on exposed coasts , or at least a requirement that they be either raised off the ground or anchored strongly against waves .'], [""In the quantity of 900 calories a day , anyone will lose weight on it -- 20 , 30 or 40 lbs. '' ."", ""`` Now don't shut this door .""], ['Rimanelli is tough and square-built and adventurous , says what he thinks .', 'Rimanelli is tough and square-built and adventurous , says what he thinks .'], [""But Sojourner was not easily excited or upset and said quite calmly : `` Let's go and see what it's like '' ."", 'She had picked up the quirt and was twirling it around her wrist and smiling at him .']]","[[-0.16790559887886047, -0.167815163731575], [-0.1011451780796051, -0.10104365646839142], [-0.00027055852115154266, -0.0002689417451620102], [0.09941969066858292, 0.09950250387191772], [0.19832459092140198, 0.19832459092140198], [0.37185776233673096, 0.3773084580898285]]",130.70501708984375,130.70501708984375,"[187.64454650878906, 108.42741394042969, 171.05152893066406, 150.0472869873047, 116.98880767822266, 69.7124252319336]",75.66627502441406,"[143.91851806640625, 88.17928314208984, 117.72001647949219, 107.44212341308594, 101.46836853027344, 72.4491195678711]"
250,"In order to calm him down, I had to promise that I would do everything the boor asked me to do as long as it wasn’t immoral or unethical.”","[['These have sought more and more of what they have .', 'The endothelial cells lining the sinusoids were prominent , and many contained large quantities of hemosiderin .'], ['The Charles Men has a tremendous range of characters , of common folk even more than of major figures .', 'The index is essentially a new treatment of previously compiled morphological data .'], [""Before hitting the pole , Mr. Stone's car brushed against a car driven by Alva W. Vernava , 21 , of 23 Maple Ave. , North Providence , tearing away the rear bumper and denting the left rear fender of the Vernava car , police said ."", ""Before hitting the pole , Mr. Stone's car brushed against a car driven by Alva W. Vernava , 21 , of 23 Maple Ave. , North Providence , tearing away the rear bumper and denting the left rear fender of the Vernava car , police said .""], ['Hospital outpatient clinic diagnostic service for all costs in excess of $20 a patient .', 'In that beautiful place , among all those companionable and attractive people , he sat and smiled .'], ['Locker-room talk often stresses the idea that a man is doing the girl a favor if he is forceful and ruthless during the first penetration .', 'Locker-room talk often stresses the idea that a man is doing the girl a favor if he is forceful and ruthless during the first penetration .'], ['Several of the replies to Mr. Toynbee , without conscious resort to the traditional terminology with regard to the permission of evil , succeed in restoring the actual context in which present moral and political decisions must be made , by distinguishing between choosing a great evil and choosing in danger of this evil .', ""`` The commercials have just been for money , there hasn't been any real incentive for me to do them , but in Underwater Western Eye I'd have a chance to act .""]]","[[-0.16761745512485504, -0.16748720407485962], [-0.10252989083528519, -0.10250895470380783], [-0.00018778350204229355, -0.00018778350204229355], [0.09951908141374588, 0.09954869002103806], [0.1987156867980957, 0.1987156867980957], [0.3267654478549957, 0.32740485668182373]]",46.4649772644043,46.4649772644043,"[58.40000915527344, 55.83470153808594, 51.996639251708984, 53.37504196166992, 52.95402145385742, 42.679473876953125]",36.073486328125,"[37.93122482299805, 41.02228927612305, 39.55064392089844, 41.41045379638672, 41.08003616333008, 36.63895034790039]"
233,Marina had been expecting her.,"[['Math and the formulas that allow it to be applied to different problems are , therefore , essential to any scientific endeavor .', 'Only two teams in each league ( the Yankees and Detroit , the Dodgers and Cincinnati ) are battling for first place .'], ['On a team a man feels he is a part of it and akin to the men next to him .', 'These proposals would go far toward creating the economic atmosphere favoring growth of the individual , who , in turn , would help us to cope with runaway technology .'], [""He'd shoot at anything if it was the rear end of a horse or his own sentry ."", 'of acquiring evidential knowledge of what happened in Athabascan , in Yokuts , in Uto-Aztecan in the last few thousand years as well as forecasting what more anciently may have happened between them .'], [""He'd told Hank Maguire and Luis Hernandez about his wife's refusal to come with him and about what he now intended to do ."", 'His signal was coming loud and clear and then all of a sudden it turned to a buzz .'], ['Publicly , he denied everything .', 'The only reason for contacting Lissa was to comfort or to be comforted .'], ['That had been how she imagined it .', 'This had worried her .']]","[[-0.16341687738895416, -0.16172575950622559], [-0.10086005926132202, -0.10082845389842987], [-0.00034572556614875793, -0.00034373998641967773], [0.09948927909135818, 0.0995350033044815], [0.19892609119415283, 0.19913455843925476], [0.36407580971717834, 0.36431318521499634]]",464.43646240234375,464.43646240234375,"[1612.177734375, 893.5925903320312, 898.6072998046875, 242.40008544921875, 538.2396240234375, 203.73004150390625]",228.4762420654297,"[478.3268127441406, 392.9959411621094, 338.7749328613281, 181.43788146972656, 233.18348693847656, 123.01390075683594]"
