target_idx,target_sent,sents_intrp_all_bins,sim_intrp_all_bins,base_PPL,unintrp_PPL,intrp_PPL_all_bins,local_PPL_all_bins
299,“So good as sure.,"[['`` Your name will never appear .', '`` Your name will never appear .', 'The New York Central notes : ``', 'There is no dispute involving fieldwork .'], ['There remained only the delicate task of maneuvering the laws through the labyrinth of Palace politics and making a small number of policy decisions .', 'Forty-seven states assign or provide vehicles for employees on state business .', 'Shell people did not , strictly speaking , breathe .', ""-- In reply to a letter in Today's `` Voice '' urging the sale of meat after 6 p.m. , I wish to state the other side of the story .""], ['She had black eyes , long and intriguingly tilted , and the way she walked was melody .', 'Extensions are not granted as a matter of course , and the reasons for your request must be substantial .', 'In its monastic form , Mahayana was merely an organization of magic-practicing monks ( bonzes ) , who catered to the Chinese faith in the supernatural .', 'Since attack serves to stimulate interest in broadcasts , I added to my opening statement a sentence in which I claimed that German youth seemed to lack the enthusiasm which is a necessary ingredient of anger , and might be classified as uninterested and bored rather than angry .'], ['If it was intentional , it was now also unnecessary ; ;', ""Let us therefore put first things first , and make sure of preserving the human race at whatever the temporary price may be '' ."", 'If you are a party thrower , you may need added capacity .', ""But he is a West Point graduate and therefore must be born to command '' .""], ['So , not only had he been here before , but it seemed he might well come again .', 'Madden knew that he could be completely wrong about all this , but also knew that he would go right on disliking Garth .', ""Now look , there's work to be done and lots of it ."", ""Now look , there's work to be done and lots of it .""], [""He's as good as gone '' ."", 'You and I do the same thing .', 'So was the audience .', ""I mean , surely we've '' --""]]","[[-0.17019246518611908, -0.17019246518611908, -0.16868335008621216, -0.16791149973869324], [-0.10118882358074188, -0.1011219471693039, -0.10105475038290024, -0.10103896260261536], [-0.000339629128575325, -0.0003077816218137741, -0.00029019080102443695, -0.00024476833641529083], [0.09903348982334137, 0.09904463589191437, 0.09907896816730499, 0.09913693368434906], [0.19051679968833923, 0.1914367973804474, 0.19185534119606018, 0.19185534119606018], [0.3025003671646118, 0.30647581815719604, 0.308056116104126, 0.3410446047782898]]",620.145751953125,154.95350646972656,"[368.9502258300781, 396.328369140625, 550.1046752929688, 404.1968688964844, 454.87353515625, 303.9175109863281]","[595.3616943359375, 656.7329711914062, 782.86376953125, 673.3981323242188, 733.9229125976562, 458.5705871582031]"
307,"“No, you and I have to talk, and the name is David,” he said, as he reached forth and took her in his arms.","[['To some extent the personal inadequacies that prejudices attempt to compensate for are to be found in all of us .', 'Some of these thoughts -- not all of them -- have taken organized form in later years .', 'Instead the cartoons seem to deal with foibles .', 'Instead the cartoons seem to deal with foibles .'], ['Fifty a throw , that the deal ? ?', 'Accordingly , the 1938-39 rules adopted these hours as limitations upon the operation of daytime stations .', 'Will the house on any part-time farm you are considering make a satisfactory full-time residence ? ?', 'Then I have seen the pride of country well in the eyes of these young people .'], ['A midwestern builder cut his labor costs per thousand bricks from $81 to $43.50 by adopting this same process , cut them another $7.50 to $36 by buying his bricks in convenient , easy-to-spot 100-brick packages .', 'A midwestern builder cut his labor costs per thousand bricks from $81 to $43.50 by adopting this same process , cut them another $7.50 to $36 by buying his bricks in convenient , easy-to-spot 100-brick packages .', 'Christ in you , your hope of glory .', 'Christ in you , your hope of glory .'], ['The sharp wind slapped at him and his feet felt like ice as the snow penetrated the holes of his shoes , his only ones , now patched with folded parchment .', '( On Thursday nobody except Charlie Coe was thinking of Charlie Coe .', 'They closed in fast , kept him from reaching inside his coat for his gun .', ""In I'll go with George dominant stress is probably on George ; ;""], ['I used the alias of Robert C. Richards , gave the first three letters and the first and last figure of the license number on the agency heap , but a couple of phony numbers in between .', ""He kept sayin , not me , not me , I don't wanta wind up like em ."", 'Only when that term is ended and he is a private citizen again can he be permitted the freedom and the courage to discount the dangers of his death .', ""`` I bumped into a door handle '' , George said .""], [""Mrs. Roebuck smilingly declined and began suddenly to go on about her son , who was `` onleh a little younguh than you bawhs '' ."", 'She would look at Jack , with that hidden something in her eyes , and Jack would see the Woman and become breathless and a little sick .', ""And , Here , I'll take this , I was before her , you wait on me now or I don't bother with it , see ! !"", 'I stopped the tractor and I shouted down to the boy , and I knew he could hear me , for the morning was clear and still , but he did not even hesitate in that brutal , murdering dance .']]","[[-0.176681786775589, -0.176674485206604, -0.17579682171344757, -0.17579682171344757], [-0.10205815732479095, -0.10204574465751648, -0.10173246264457703, -0.10173191875219345], [-0.0005656154826283455, -0.0005656154826283455, -0.0005184710025787354, -0.0005184710025787354], [0.09939916431903839, 0.09941530227661133, 0.09942293167114258, 0.09945036470890045], [0.19875720143318176, 0.19886375963687897, 0.19888806343078613, 0.19889776408672333], [0.35023438930511475, 0.3520094156265259, 0.3525199294090271, 0.354587584733963]]",50.8937873840332,35.5037956237793,"[56.06277847290039, 37.76193618774414, 42.17625427246094, 37.991485595703125, 36.605655670166016, 36.1764030456543]","[68.63765716552734, 46.869686126708984, 49.89890670776367, 43.066715240478516, 38.2425422668457, 39.28255081176758]"
146,"“I am not married, and before you say something that you definitely will regret, that woman is my daughter and she is widowed.","[['When the light went their way , they went on across the street .', 'Prokofieff was guided in a consistent direction by the life of his own people -- by the compass of their national ideas .', ""For its part the Hudson's Bay Company was troubled by the approach of American settlement ."", 'As can be seen from Figure 2 , an extensive area was covered by this aerosol .'], ['He stared at the dipper , turning it over and over in his wide , calloused hands .', 'They were already swollen to bursting .', 'And Early Spring seized the whip and said :', 'The early Anchorite masters attracted disciples because of their presumed ability to perform miracles .'], ['Of course he would .', 'The American Automobile Association , computing the cost for two people to vacation by automobile , comes up with an average daily expenditure figure of $29 .', 'Some persons are so sensitive to this truth as to propose that we do away with institutions altogether ; ;', 'Brannon was hunkered down with his broad back to the left rear wheel , with the other two facing him .'], [""The day's sun was gathering its strength in gold , and she wished she had brought her parasol , if only to shade Doaty's flowers ."", ""`` It's kind of like golf -- if you don't swing a club very often , your timing gets off '' ."", 'Are tractors available for him ? ?', 'Mercer smiled at her through his happiness .'], ['`` Blessed Saint Nicholas , I thank thee for getting me out of that mess and sending me up instead of down when I was bewildered .', ""If that picture gets around and I find out you had anything to do with it , I'm going to send a couple of my boys around to see you '' ."", ""And she answered , `` I don't know , but I hope you'll never do such a thing '' ."", ""I won't be guilty of trying to run his life '' .""], [""I don't blame that girl for breaking her engagement with you ."", ""`` Tell Mr. Gorboduc what you're doing these days '' , my mother advised the children , ceremonially ."", 'My message , today , is the same as it was 15 years ago : that there is goodness in people , and strength and love in God .', 'My message , today , is the same as it was 15 years ago : that there is goodness in people , and strength and love in God .']]","[[-0.1592419445514679, -0.15844611823558807, -0.15839481353759766, -0.1583244502544403], [-0.1010507196187973, -0.10104282200336456, -0.10083207488059998, -0.10082599520683289], [-0.0006221476942300797, -0.0005629993975162506, -0.0005594268441200256, -0.0004897378385066986], [0.09922352433204651, 0.09925223886966705, 0.09929046034812927, 0.09930375218391418], [0.19643400609493256, 0.19660113751888275, 0.19677290320396423, 0.19687317311763763], [0.32522186636924744, 0.3375145196914673, 0.3382551372051239, 0.3382551372051239]]",84.55757904052734,62.66828536987305,"[72.85625457763672, 70.19054412841797, 76.998046875, 67.15686798095703, 74.29296875, 66.1124496459961]","[88.1686019897461, 81.95497131347656, 96.71829986572266, 73.79898071289062, 78.33394622802734, 71.27511596679688]"
413,We’re getting married soon.,"[['The 1962 General Assembly has important business to consider .', 'He was the lawman who survived more gunfights than any other famous gun-slinging character in the book .', 'He turned away and returned in a moment with a pint of brandy in a small paper sack which he slid over the counter to Shayne .', 'He does not insist on telling all he knows about any given subject ; ;'], ['But it may be , also , that he is merely more mindful of athletics than of esthetics at the present time .', 'Therefore , his only recourse was to learn the shape all over again for each new visual experience of the same individual object or type of object ; ;', 'It contained a desk , files , a typewriter on a stand , and two big leather armchairs .', 'Alex returned to the hotel , rather weary and with no new prospects of a role , in the late afternoon , but found the doctor in an ebullient mood .'], [""RCA Victor has an ambitious and useful project in a stereo series called `` Adventures In Music '' , which is an instructional record library for elementary schools ."", ""In a sense , the showdown promised by Mr. Hammarskjold's sudden and tragic death has been avoided ; ;"", 'Nothing but wispy grass whipping in the keen breeze .', 'Nothing but wispy grass whipping in the keen breeze .'], ['I sat and watched proceedings .', ""`` I mean , do you feel like seeing Kate '' ? ?"", 'The skiff was not heading for the nursery , however .', 'That spring Welcome To Our City was selected for production by the 47 Workshop and it was staged in the middle of May .'], ['Inevitably this means some compromise .', '`` You mean that rock-and-roll combo ? ?', 'once again they clustered like children .', 'once again they clustered like children .'], ['Billy Tilghman did just that .', 'The Sons were out tonight .', 'Mr. Gorboduc looked down .', ""Sposato couldn't wait to get me hired .""]]","[[-0.15551862120628357, -0.15534824132919312, -0.15524181723594666, -0.1552269607782364], [-0.10153605788946152, -0.10134080052375793, -0.10126282274723053, -0.10117218643426895], [-0.0005275560542941093, -0.00047592539340257645, -0.00044857338070869446, -0.00044857338070869446], [0.09893251955509186, 0.09898070991039276, 0.09900033473968506, 0.09902355074882507], [0.19692304730415344, 0.1971454918384552, 0.19735653698444366, 0.19735653698444366], [0.3103128671646118, 0.31151989102363586, 0.31231626868247986, 0.32132694125175476]]",88.96504211425781,20.555944442749023,"[34.87116622924805, 32.370635986328125, 28.854406356811523, 21.85025978088379, 19.114715576171875, 18.530254364013672]","[76.16194915771484, 133.55783081054688, 64.10525512695312, 85.89322662353516, 42.30272674560547, 46.02467346191406]"
392,"By the time David had accompanied Tess to her office, everyone in the company knew.","[['`` What could I do with your lousy dead bodies ? ?', 'However , the system is designed , ingeniously and hopefully , so that no one man could initiate a thermonuclear war .', 'The basic mapping phase of the program has been completed and the inventory phase is scheduled for completion July 1 , 1961 .', 'The state development budget will reflect the capital needs of all the state agencies and the priority of the projects in the budget will be based on the state plan .'], ['It is difficult to tabulate exactly what was meant in each individual situation , but the conclusion may be drawn that 21 towns do not assess movable personal property , and of the remainder only certain types are valued for tax purposes .', ""The charge , I tell you '' ! !"", ""I know men never kiss les putains '' ."", '`` Oh , come on , snap out of it ! !'], ['In his own state of New York , the two Democratic bellwethers , State Leader Hill and Tammany Boss Murphy , were saying nothing openly against Hearst but industriously boosting their own favorites , Murphy being for Cleveland and Hill for Parker .', ""An amendment , presumably designed to deal with the problems of newly freed slaves , became a `` laissez-faire '' limitation upon state economic policy ."", 'These registries are sponsored by 18 national medical , dental , and veterinary societies and have as their mission the assembling of selected cases of interest to military medicine and of establishing through the mechanism of follow-up of living patients the natural history of various diseases of military-medical importance .', 'The violinist , in particular , is very indulgent with swoops and slides , and his tone is pinched and edgy .'], [""When , as a diplomatic gesture of amity and in payment for the loan of gunmen in the April election , Torrio had given O'Banion a slice of Cicero , the profits from that district had been $20,000 a month ."", 'I waited until my man was coming out of the office with the key to a cabin before I went in to register .', 'Nowhere in the boat do the frames come in contact with the plywood planking .', 'It happened two weeks ago , the night before his father left on a business trip to South America .'], [""For it seems that Barco , fancying himself a ladies' man ( and why not , after seven marriages ? ?"", ""And when questioned by ship's reporters about the separation , she said , `` I adore him , and he adores me '' ."", 'Now she was intensely alive , anguished ; ;', 'Even among the fast set in which she was moving , her method for keeping an escort from departing too early was unique .'], [""Lucy suspected that Myra would never have come home if Gregg , Myra's husband , hadn't gone out to fetch her ."", ""He'd mentioned it , himself , at church and everybody seemed to have the idea that Tolley had left because Jenny had jilted him for Roy Robards ."", ""He'd mentioned it , himself , at church and everybody seemed to have the idea that Tolley had left because Jenny had jilted him for Roy Robards ."", 'As a result , he was persuaded out to dinner .']]","[[-0.17433832585811615, -0.17298436164855957, -0.17287598550319672, -0.17280153930187225], [-0.10122305154800415, -0.10105359554290771, -0.10087072849273682, -0.10073725879192352], [-0.0006489441730082035, -0.0006109699606895447, -0.0005358271300792694, -0.000458521768450737], [0.09929566830396652, 0.09930271655321121, 0.09933937340974808, 0.09939634054899216], [0.19879433512687683, 0.19880153238773346, 0.19883093237876892, 0.19894033670425415], [0.323498010635376, 0.32425838708877563, 0.32425838708877563, 0.3363163471221924]]",55.6065788269043,41.41604232788086,"[73.53219604492188, 60.86737823486328, 69.81818389892578, 46.42706298828125, 58.513511657714844, 42.56111526489258]","[86.53123474121094, 67.1649398803711, 92.59198760986328, 53.633296966552734, 56.60546875, 46.01991271972656]"
