target_idx,target_sent,sents_intrp_all_bins,sim_intrp_all_bins,base_PPL,local_unintrp_PPL,local_intrp_PPL_all_bins,global_unintrp_PPL,global_intrp_PPL_all_bins
38,"One is ethnicity: Asian women and foreign-born Hispanic men, for example, have the highest chance of the demographic groups studied that their marriages will last 20 years (70 percent), while black women have the lowest rate of reaching the two-decade mark (37 percent).","[['He was again reclassified 1-a by the local board .', 'We made a rendezvous tomorrow evening at nine on some street near Lake Ponchartrain .', 'After the recommendation of the Department is forwarded to the appeal board , that is the appropriate place for a registrant to lodge his denial .', 'the balanced use of recreation , hunting , and fishing areas ; ;'], ['Hands on Bible , seaman Lodley and carpenter Staffe swore that Juet had tried to persuade them to keep muskets and swords in their cabins .', 'Mike made a dash to the rear of the frame buildings .', 'Article 2 , uses of rupees', 'another said it should be rubbed with a cut potato three times daily .'], [""Mahzeer and the prime minister are alone right now '' ."", 'Nobody wanted Americans to be hurt or captured , and few soldiers could be spared as escorts .', ""Said you wore yourself out , cleaning all these empty rooms '' ."", 'Until that first dedication service , he and Lois felt their children were too young to take part in any religious life at home .'], [""I don't blame that girl for breaking her engagement with you ."", 'He injected more vitality into the score than it has revealed in many years .', 'Since the homosexuals widely use marijuana , they do not have to be initiated .', ""Moreover , he rejects the contemporary accounts of Englishmen , casually adjudging them to be distorted by prejudice because `` the opinions of Englishmen are of no great value '' .""], ['However , even if the latent demand for demythologization is not nearly as widespread as we are claiming , at least among the cultured elements of the population there tends to be an almost complete indifference to the church and its traditional message of sin and grace .', 'However , even if the latent demand for demythologization is not nearly as widespread as we are claiming , at least among the cultured elements of the population there tends to be an almost complete indifference to the church and its traditional message of sin and grace .', 'In turn , higher fertility rates for this population provide a means of increasing the numerical quantity of the population , allowing for the possibility of greater stability and unity .', 'In turn , higher fertility rates for this population provide a means of increasing the numerical quantity of the population , allowing for the possibility of greater stability and unity .'], [""Seven years they'd been married ."", 'that aside from due notification of certain major events in their lives ( two marriages , two births , one divorce ) , Christmas and Easter cards of the traditional sort had been the only thin link she had with them through the widowed years .', 'The hard core of the pro-Communist rebel force numbers only some 2,000 tough Viet Minh guerrilla fighters .', ""A world in which wives have taken a more active role is likely to produce sexual relationships in which wives are more self-assertive , too '' .""]]","[[-0.1617196649312973, -0.16119757294654846, -0.15985916554927826, -0.15963761508464813], [-0.10088998079299927, -0.10087496787309647, -0.1008722111582756, -0.10086663067340851], [-0.00016609206795692444, -0.0001505720429122448, -0.00014249980449676514, -0.00013780221343040466], [0.09891358017921448, 0.098924919962883, 0.09905441105365753, 0.09906083345413208], [0.19066452980041504, 0.19066452980041504, 0.1907637119293213, 0.1907637119293213], [0.2495604157447815, 0.25019755959510803, 0.2528615891933441, 0.2533065378665924]]",67.20175170898438,67.20175170898438,"[73.88968658447266, 85.98677825927734, 71.36373138427734, 65.62793731689453, 64.5092544555664, 59.913917541503906]",58.832481384277344,"[66.42912292480469, 68.00904846191406, 63.8231201171875, 64.49645233154297, 64.05935668945312, 62.17170333862305]"
38,"His team's study found that military personnel are much more likely than civilians to be married and not as likely to be divorced compared with civilians of similar ages, races, employment statuses and education levels (, 2012).","[[""`` Wait here , Neal '' , said Tilghman ."", 'They wanted to touch the mystery .', 'A handier remedy was to bathe the painful part in strong soapy water ; ;', 'We should stand firmly and courageously for our right to free access into Berlin .'], ['Spread article on flat surface to required width before measuring length at center .', 'Spread article on flat surface to required width before measuring length at center .', 'Frequently , the message must be changed at intervals to feature new products , price changes , etc. .', 'Others huddled under the trees outside the fence .'], [""the Catholic Saint Mary's Church , with an even taller steeple and a cross on top , stood on Ball Street ."", ""How's it strike you , foul or fair '' ? ?"", ""How's it strike you , foul or fair '' ? ?"", 'And Marie Antoinette -- Jacqueline Bouvier .'], ['The UN army is too weak , too demoralized for the task .', ""In 1920 , the Lambeth Conference repeated its 1908 condemnation of contraception and issued `` an emphatic warning against the use of unnatural means for the avoidance of conception , together with the grave dangers -- physical , moral , and religious -- thereby incurred , and against the evils which the extension of such use threaten the race '' ."", 'Funds allotted in addition to their minimum allotment are apportioned to the two agencies as they may determine .', ""he didn't even look up .""], ['Neither was his wife .', 'The introduction of the United States Pharmacopoeia reference standard in 1952 and the redefinition and equating of the USP and international units of thyroid-stimulating activity have made it possible to compare results published by different investigators since that time .', 'The introduction of the United States Pharmacopoeia reference standard in 1952 and the redefinition and equating of the USP and international units of thyroid-stimulating activity have made it possible to compare results published by different investigators since that time .', 'He claimed 4-d classification as a minister of religion , devoting a minimum of 100 hours a month to preaching .'], [""`` I may possibly be a greater risk than is the normal person of my age '' , the President had said on February 29th of the election year , ignoring the fact that no one of his age had ever lived out another term ."", 'Because neither of them really wanted their marriage to break up , Mr. and Mrs. Black agreed to a series of interviews at Family Service of Northern Virginia , the agency nearest them .', 'More time was spent in trying to marry these incompatibles than over any subject discussed at Yalta .', ""for example , if one driver puts on 22,000 miles per year and another driver 8,000 miles per year , their cars will be switched so that both cars will have 30,000 miles after two years , rather than 44,000 miles ( and related higher maintenance costs ) and 16,000 miles respectively '' .""]]","[[-0.16364918649196625, -0.16261431574821472, -0.1623866856098175, -0.16197925806045532], [-0.10160987079143524, -0.10160987079143524, -0.1016090139746666, -0.10159768164157867], [-0.00036200881004333496, -0.00035815872251987457, -0.00035815872251987457, -0.00029547419399023056], [0.09929901361465454, 0.09930286556482315, 0.099311463534832, 0.09936947375535965], [0.1952468752861023, 0.19587837159633636, 0.19587837159633636, 0.19616064429283142], [0.2728451192378998, 0.2843209505081177, 0.28491729497909546, 0.28840792179107666]]",85.84326934814453,85.84326934814453,"[108.62871551513672, 97.87200927734375, 119.46737670898438, 81.64350891113281, 78.2374038696289, 82.0183334350586]",80.50574493408203,"[96.3274917602539, 93.53206634521484, 99.43655395507812, 77.76583099365234, 71.300537109375, 78.19799041748047]"
46,"The researchers found that couples whose relationship satisfaction declined during the first four years of marriage were most often those who had reported less satisfaction to begin with (, 2012).","[['His interpretation was a model of refinement and accuracy .', 'His interpretation was a model of refinement and accuracy .', 'Personally , I think we ought to set up an immediate naval blockade of Cuba .', ""We'll still have the rifle , and I might be able to round up some more .""], ['Later , Shea owned and operated the Long Island Indians , a minor league professional football team .', ""It read : `` Shot in the lumbar region '' ."", ""It read : `` Shot in the lumbar region '' ."", ""It read : `` Shot in the lumbar region '' .""], [""The Smithfield tax assessor , in turn , claims the tax under the provision of law `` and all other tangible personal property situated or being in any town , in or upon any place of storage shall be taxed to such person in the town where said property is situated '' ."", 'His voice had not commanded her to stop .', 'They are putting strong pressure on their police departments to keep order .', 'He did not look back ; ;'], [""He spoke through the public address box built into the cabin , and his gigantic voice roared out over the empty plain , so that the pink herd of talking people stirred gently in their happiness and wondered what their friend B'dikkat might be wanting to tell them ."", ""He spoke through the public address box built into the cabin , and his gigantic voice roared out over the empty plain , so that the pink herd of talking people stirred gently in their happiness and wondered what their friend B'dikkat might be wanting to tell them ."", 'She compared the results with tape recordings of modern singers and was not unpleased although her own tapes had a peculiar quality about them , not at all unharmonious , merely unique .', 'She compared the results with tape recordings of modern singers and was not unpleased although her own tapes had a peculiar quality about them , not at all unharmonious , merely unique .'], ['It told him little more than Mrs. Calhoun had remembered , stating that it had been a small , modest wedding compared to some of the others .', '( Or , perhaps , especially in an Angel , whose assumptions had mostly been fixed millions of years ago .', 'The Skopas people seemed to him of that breed of human beings whose insularity frees them from tragedy .', 'Then Miriam varied the senseless psychological warfare by suddenly withdrawing a suit for separate maintenance that had been pending , and asking for divorce on the grounds of cruelty , with the understanding that Wright would not contest it .'], ['A study of major denominational membership statistics over a twenty-year period revealed the appalling fact that nearly 40 per cent of those who joined the Church were lost to the Church within seven years .', 'This habit had become so fixed over the years that it seemed futile to do anything for which no one was waiting .', ""A world in which wives have taken a more active role is likely to produce sexual relationships in which wives are more self-assertive , too '' ."", 'He had picked out this pathless trail , instead of the common one , in a moment of romantic fancy , to give them privacy on their honeymoon .']]","[[-0.18404021859169006, -0.18404021859169006, -0.1834777146577835, -0.18280622363090515], [-0.10076248645782471, -0.1006794348359108, -0.1006794348359108, -0.1006794348359108], [-0.00046267732977867126, -0.00042806845158338547, -0.0003989292308688164, -0.00033665355294942856], [0.09926578402519226, 0.09926578402519226, 0.09931932389736176, 0.09931932389736176], [0.19639301300048828, 0.1966014802455902, 0.19683238863945007, 0.19691845774650574], [0.327549010515213, 0.32829225063323975, 0.32875731587409973, 0.3299275040626526]]",148.52883911132812,148.52883911132812,"[214.63255310058594, 253.01123046875, 176.24557495117188, 163.62522888183594, 154.20065307617188, 111.72113037109375]",74.47019958496094,"[117.74286651611328, 154.93031311035156, 103.34840393066406, 131.58380126953125, 96.5826187133789, 82.6357650756836]"
46,,,,,,,,
13,,,,,,,,
