target_idx,target_sent,sents_intrp_all_bins,sim_intrp_all_bins,base_PPL,local_unintrp_PPL,local_intrp_PPL_all_bins,global_unintrp_PPL,global_intrp_PPL_all_bins
108,"One is ethnicity: Asian women and foreign-born Hispanic men, for example, have the highest chance of the demographic groups studied that their marriages will last 20 years (70 percent), while black women have the lowest rate of reaching the two-decade mark (37 percent).","[['But the forceful presentation of new issues for the sciences to work on is itself a monumental task .', ""`` We'll go to the storehouse '' ."", 'He instructed Shirl Winter to compose a note of thanks to be posted on the call board .', 'Summertime supper , outside , is a natural .'], ['Greg wished the Air Corps had continued to camouflage planes .', 'He was -- as he told himself in the vernacular of a trade no longer his own -- riding the dark train out .', 'With the source of light behind the copy , there is no loss of lumen output , as with conventional boards illuminated by means of reflected light .', 'With the source of light behind the copy , there is no loss of lumen output , as with conventional boards illuminated by means of reflected light .'], [""The poem consisted of only two words , the word `` Wait '' , repeated over and over at irregular intervals and with different inflections , and then the word `` Now '' ! !"", ""He wasn't troubled with the ordinary , rank-and-file fear that overcomes and paralyzes and sends individual soldiers and whole companies under fire running in panic ."", 'He began to pack the saddlebags .', ""As Dietrich Bonhoffer puts it , `` Our community with one another consists solely in what Christ has done to both of us '' .""], [""Never a `` quick study '' , he now made no attempt to learn his `` lines '' and many a mile of film was wasted , many a scene -- sometimes involving as many as a thousand fellow thespians -- was taken thirty , forty , fifty times because Miss Poitrine's co-star and `` helpmate '' had never learned his part ."", ""Never a `` quick study '' , he now made no attempt to learn his `` lines '' and many a mile of film was wasted , many a scene -- sometimes involving as many as a thousand fellow thespians -- was taken thirty , forty , fifty times because Miss Poitrine's co-star and `` helpmate '' had never learned his part ."", 'Already Trevelyan had begun to parallel his nineteenth-century Italian studies with several works on English figures of the same period .', 'They enjoyed lemonade and cookies served before and during the concert by teenage sons and daughters of members of the White House staff .'], [""It sure as hell doesn't look like any dominant intelligent species to me ."", ""It sure as hell doesn't look like any dominant intelligent species to me ."", ""`` and the more the action claims to be total , the smaller is the part of man engaged '' ."", 'The Airedale Terrier Club of America and the Kerry Blue Terrier Club of America have under consideration donating trophies to the boys or girls who win with their breeds in Junior Showmanship Competition at any Show .'], ['America has divided more than she has united the West .', 'America has divided more than she has united the West .', 'Anthony Steel , as the husband , is a jealous type who argues against her course and sues for divorce , labeling her action adulterous .', ""Here the New York Central Railroad , one of the Nation's most important carriers , has alone lost 47.6 percent of its passengers since 1949 .""]]","[[-0.17533686757087708, -0.17531585693359375, -0.17423303425312042, -0.17120063304901123], [-0.10136086493730545, -0.10132569819688797, -0.10131620615720749, -0.10131620615720749], [-0.0004531200975179672, -0.00043635256588459015, -0.00041834451258182526, -0.00037825852632522583], [0.09799612313508987, 0.09799612313508987, 0.09801926463842392, 0.09814582020044327], [0.18634000420570374, 0.18634000420570374, 0.1870088279247284, 0.18779988586902618], [0.22793477773666382, 0.22793477773666382, 0.2335197627544403, 0.23568567633628845]]",67.20175170898438,67.20175170898438,"[78.80291748046875, 89.10230255126953, 70.362548828125, 78.96853637695312, 71.55686950683594, 65.8677978515625]",58.832481384277344,"[66.11289978027344, 75.0068359375, 62.087242126464844, 69.97135925292969, 59.81954574584961, 59.2386360168457]"
89,"""Money is the No.","[['Suspecting an ambush , the two deputies decided to ride up a side canyon taking a short cut into Catskill .', 'then they turned to the right , climbed the embankment , and walked into the valley again .', 'now he felt light and gay and clear-headed , ready for the many actions he saw spreading out before him .', 'now he felt light and gay and clear-headed , ready for the many actions he saw spreading out before him .'], ['Here the peoples spoke the tongue of Iceland because that island had gotten the jump on the Hawaiian-Americans who were busy resettling North America and the western half of South America after the Apocalyptic War .', 'Isaac Pitt , one of the men from Lincoln , had taken a musket ball in his belly ; ;', ""In his concluding paragraph he writes : `` The devoted writer of humor will continue to try to come as close to truth as he can '' ."", 'Then he attacked the two officers again and was again restrained , Slate related .'], ['I also use a small electric hand-blower to dry large washes in the studio .', ""The curve on the card the computer spat back at him couldn't be argued with , however ."", ""This would be by far the better choice , when `` it is a question of allowing the human race to survive , possibly under the domination of a regime which most of us detest , or of allowing it to destroy itself in appalling and prolonged anguish '' ."", ""This would be by far the better choice , when `` it is a question of allowing the human race to survive , possibly under the domination of a regime which most of us detest , or of allowing it to destroy itself in appalling and prolonged anguish '' .""], [""He told me he vowed right then that if he ever got to be a star , this never would be said of him '' ."", ""`` Don't worry about my being tough , Moore ."", 'Here some innovation is attempted .', ""And I'll take you with me .""], ['so was the playing .', 'and it must be enforced without discrimination .', 'and it must be enforced without discrimination .', 'The reasons are obvious : ( 1 ) the state is buying in quantity , and ( 2 ) it has no federal excise or state sales tax to pay .'], ['There was no chance .', 'You want the kid to die ? ?', ""Well , we can't have everything ."", ""It is Mars , isn't it ? ?""]]","[[-0.18849968910217285, -0.18596863746643066, -0.18467673659324646, -0.18467673659324646], [-0.10242283344268799, -0.1023721992969513, -0.10233612358570099, -0.10232053697109222], [-0.0006486587226390839, -0.0006001945585012436, -0.0005978383123874664, -0.0005978383123874664], [0.09866264462471008, 0.09872246533632278, 0.09875743836164474, 0.09877359867095947], [0.1903916448354721, 0.19043390452861786, 0.19043390452861786, 0.19089046120643616], [0.2510870099067688, 0.25314122438430786, 0.25429970026016235, 0.2543752193450928]]",226.324951171875,226.324951171875,"[533.8641357421875, 355.38946533203125, 298.36029052734375, 203.88494873046875, 146.8262939453125, 220.80789184570312]",214.69375610351562,"[371.8327331542969, 240.31126403808594, 272.9100646972656, 142.912841796875, 155.20899963378906, 155.74234008789062]"
13,"Couples' communication patterns proved to be more predictive of divorce than their reported levels of commitment, personality assessments and stress (, 2012).","[['The Kirov Ballet is firmly booked into the Shrine Auditorium , Los Angeles , Nov. 21 thru Dec. 4 .', 'The Kirov Ballet is firmly booked into the Shrine Auditorium , Los Angeles , Nov. 21 thru Dec. 4 .', ""Incidentally , I'm pretty famous in these parts : I'm called The Wrangler '' ."", 'The Secretary of the Treasury is authorized and directed to cover into -- ( 1 )'], ['But his facility in this genre was not great .', ""No one will even suspect that it is your work '' ."", 'This was accounted for primarily by the presence of a bronchial artery closely following the pulmonary artery .', 'Awkwardly with one hand Matsuo got the cap back on the water bottle .'], ['I discern no limits to a faith vested in God and Christ , who is the sum of all wisdom and knowledge , and daring to trust Him even though called to stand alone before the world .', 'A glance revealed that the main topgallant mast had been carried away .', 'A glance revealed that the main topgallant mast had been carried away .', 'A glance revealed that the main topgallant mast had been carried away .'], ['Such pseudo-questions assume that answers of concrete significance can be supplied to statements involving undefined universals .', '`` Officials Meet on rubbish .', 'This tendency is , perhaps , most clearly revealed in the literature on religious conversions and experiences of adolescents .', 'Significantly , the initiation and leadership of a major proportion of the reform movements , especially those in the first half of the nineteenth century , came from men and women of New England birth or parentage and from either Trinitarian or Unitarian Congregationalism .'], ['The wide divergence of reactions is clearly illustrated in the Kinsey studies in human sexuality .', 'It is our hypothesis that Kohnstamm-positive subjects are less hesitant about relinquishing control than are Kohnstamm-negative subjects ; ;', ""The fundamental difficulty of which the Selden case was `` a striking ( though not singular ) example '' , concluded Hough , `` will remain as long as testimony is taken without any authoritative judicial officer present , and responsible for the maintenance of discipline , and the reception or exclusion of testimony '' ."", 'What Gabriel was being asked to do now , however , was to re-examine all his basic assumptions , make value-judgments on them , and give them new and different powers in his mind to govern his motives .'], [""Throughout `` The Making Of A President '' Mr. White shows wonderfully well how the pressures pile up on candidates , how decisions have constantly to be made , how fatigue and illness and nervous strain wear candidates down , how subordinates play key roles ."", 'The completeness of the connections provide that , for N people , there are Af lines of communication between the pairs , which can become a large number ( 1,225 ) for a party of fifty guests .', 'Anthony Steel , as the husband , is a jealous type who argues against her course and sues for divorce , labeling her action adulterous .', ""His lawyer had sent him a statement on his overdue alimony , and there was a letter from the Collector of Internal Revenue asking him to stop in his office and explain last year's exemptions .""]]","[[-0.1843942254781723, -0.1843942254781723, -0.18408554792404175, -0.18330545723438263], [-0.10182256251573563, -0.1016850471496582, -0.1015833169221878, -0.10156966745853424], [-0.0006720460951328278, -0.0006601288914680481, -0.0006601288914680481, -0.0006601288914680481], [0.0987677276134491, 0.098788321018219, 0.09879731386899948, 0.09884258359670639], [0.1874702274799347, 0.1876634806394577, 0.18787932395935059, 0.18858441710472107], [0.2511453330516815, 0.2513453960418701, 0.25217241048812866, 0.25336164236068726]]",211.8409881591797,211.8409881591797,"[250.83169555664062, 255.00437927246094, 302.53338623046875, 170.88107299804688, 238.10348510742188, 222.13124084472656]",139.5577392578125,"[208.9718017578125, 183.43182373046875, 192.93556213378906, 132.7767333984375, 173.82980346679688, 188.99267578125]"
23,Take risks.,"[['Yes , this is she ? ?', 'We are not given to lamentations , neither personally nor in these Reports .', 'The governor and his retinue thoughtfully brought with them a glorious silver punchbowl which is still one of the cherished possessions of the college .', 'It is a question which New Englanders long ago put out of their minds .'], [""Had it done so , the blot on its escutcheon would have remained indelible , nor could the Harvard Divinity School assemble today to honor Parker's insurgence other than by getting down on its collective knees and crying `` peccavi '' ."", 'This was something on which K. himself seemed to have some doubts ; ;', 'At the same time that religion exercises a conserving influence , it also energizes and motivates both individuals and groups .', 'He had had the need to understand what life lurked behind the mask of flesh , behind the oath , the banter , the sadness .'], ['In Wisconsin , take route 55 north of Shawano or routes 78 and 60 from Portage to Prairie Du Chien .', 'In Wisconsin , take route 55 north of Shawano or routes 78 and 60 from Portage to Prairie Du Chien .', ""An architect's sketch of the new plant is shown on the front cover ."", 'It seemed unlikely that her crew , if either of them were alive , could even see the Ariadne , for they were passing her at a distance of nearly a light-year .'], ['Does anybody think of saving the life of an anti-Communist American pilot ? ?', 'Mr. Kennan , who has recently abandoned authorship for a new round of diplomacy as the recently appointed American ambassador to Yugoslavia , is not the only man who finds it easier to portray the past than to prescribe for the future .', 'corporations , being more amorphous , cannot .', ""The charge , I tell you '' ! !""], [""I'll live to be 105 '' ."", ""`` It's all right to smoke , but make sure your cigarettes are out before you leave ."", ""`` It's all right to smoke , but make sure your cigarettes are out before you leave ."", 'How soon you may go outdoors ; ;'], [""`` I'll shove along home '' ."", 'Take your time with your drink .', 'Use deductable insurance wherever feasible .', ""Don't go overboard on insurance that pays benefits only upon death .""]]","[[-0.18520310521125793, -0.18513938784599304, -0.1839018166065216, -0.18326658010482788], [-0.10187498480081558, -0.10176120698451996, -0.10174005478620529, -0.10172173380851746], [-0.0006280615925788879, -0.0006280615925788879, -0.0006212848238646984, -0.000603686086833477], [0.09805448353290558, 0.09817029535770416, 0.09821140766143799, 0.09823372960090637], [0.17773222923278809, 0.17856328189373016, 0.17856328189373016, 0.1786418855190277], [0.20919010043144226, 0.20942780375480652, 0.21160274744033813, 0.21164393424987793]]",378.93475341796875,378.93475341796875,"[892.7607421875, 1865.44921875, 3551.9091796875, 255.21055603027344, 152.58755493164062, 119.36597442626953]",393.4292297363281,"[501.29083251953125, 1123.2708740234375, 2247.3828125, 211.04507446289062, 107.73542785644531, 103.18925476074219]"
72,"""That, to me, is just very backwards.""","[['A blower is essential for the double-wall shelter and for the underground shelters .', 'For the maintenance of a long-term program , the departments , and particularly their chairmen , are strategic .', 'With these maps completed , the inventory phase of the plan has been started .', 'A top official of the New Frontier who kept a record of his first weeks on the job here gives this report of his experiences :'], ['Rabb , the former Louisiana State field general , came off the bench for his debut with the Bills Sunday and directed his new team to a 22-12 upset victory over the Houston Oilers , defending league champions .', 'When it was over , eight of his company were still alive and all eight were wounded .', 'If they feel that we are taking a long-term view of their problems and are prepared to enter into reasonably long-term association with them in their development activities , they will be much more likely to undertake the difficult tasks required .', 'If they feel that we are taking a long-term view of their problems and are prepared to enter into reasonably long-term association with them in their development activities , they will be much more likely to undertake the difficult tasks required .'], ['High blood pressure can get the best of any of us .', ""`` No '' , said the official ."", ""Yet , even after all these stratagems , the conscience of Christian liberality is still not laid to rest , any more than is the conscience of Harvard University for having done the abject penance for its rejection of Ralph Waldo Emerson's The Divinity School Address of naming its hall of philosophy after him ."", 'If you are a nonresident alien and a resident of Puerto Rico , your return is also due June 15 , 1962 , or the 15th day of the 6th month after the close of your fiscal year .'], ['Like most major works of synthesis , The History Of England is informed by the positive views of a first-class mind , and this is surely a major work .', 'May I add a caution on this particular point ? ?', ""He didn't stir ."", 'Bobbie said something about damned Pittsburghers sticking together , and Linda got angry at him .'], [""It's somewhat off the beaten track , to be sure , but therein lies its variety and charm ."", 'He was beginning to see he was too mad to sleep .', ""She it was who had looked to see if I was wearing shoes upon learning that I couldn't drive ."", ""She it was who had looked to see if I was wearing shoes upon learning that I couldn't drive .""], [""`` Well , at least you won't have to do that '' , she was saying ."", ""`` It can't be wrong , can it ? ?"", ""`` I didn't know it was going to be this late '' ! !"", 'Helion did not realize it at the time , but it was true .']]","[[-0.17992261052131653, -0.17887914180755615, -0.17590366303920746, -0.17348605394363403], [-0.10344631224870682, -0.10344204306602478, -0.10316188633441925, -0.10316188633441925], [-0.0006404146552085876, -0.0006271339952945709, -0.000603741966187954, -0.0005918350070714951], [0.09892981499433517, 0.09894328564405441, 0.0989590510725975, 0.09896127879619598], [0.19279208779335022, 0.19285079836845398, 0.19292041659355164, 0.19292041659355164], [0.3001391887664795, 0.30206751823425293, 0.3033221960067749, 0.3069550395011902]]",217.0387420654297,217.0387420654297,"[305.0223693847656, 296.3988952636719, 264.31719970703125, 200.7953338623047, 248.30123901367188, 243.32142639160156]",222.71678161621094,"[293.8360900878906, 266.4808349609375, 253.728515625, 211.88079833984375, 227.86837768554688, 220.71766662597656]"
