target_idx,target_sent,sents_intrp_all_bins,sim_intrp_all_bins,base_PPL,local_unintrp_PPL,local_intrp_PPL_all_bins,global_unintrp_PPL,global_intrp_PPL_all_bins
26,"Stress, for example, can cause even the strongest relationships to crumble, psychologists' research finds.","[['He was elected to the National Academy of Design as an Associate in the oil class in 1931 ( after receiving his first Ranger Fund Purchase Prize at the Academy in 1930 ) , and elevated to Academicianship in 1940 .', 'I crossed the beautifully furnished living room to the pale yellow phone .', 'He meandered down Pike Street , past the First National Bank with its green window shades .', 'The forced sale of the General Motors stock owned by or allocable to Christiana , Delaware , and the stockholders of Delaware , and deposited with the trustee , would result in a tax to those parties at the capital gains rate .'], ['On Thursday , the first day of the Masters , the contest between Palmer and Player developed instantly .', 'Elizabeth Way was the first operator ; ;', ""`` About five miles north of the line '' ."", 'I had no doubt that it was .'], ['To determine engine speed for a given combination of the other three factors the formula is : Af .', 'To determine engine speed for a given combination of the other three factors the formula is : Af .', ""That's why I -- why I do a free job now and then ."", 'The lower portion necessitates only films of Hand .'], ['Perhaps the idea of sidewalk cafes could be extended .', 'Perhaps the idea of sidewalk cafes could be extended .', 'In any case but the last , such a course is sure to avenge itself upon the individual ; ;', 'Her permanent titanium shell was recessed behind an even more indestructible barrier in the central shaft of the scout ship .'], ['Yes , and as tension mounts in this world , fear is increasing .', 'Conversely , if he gives a heavy rating to his own reading , and finds more accurate facts in it than in the others , a point is chalked up for the intrinsic , objective meaningfulness of this type of mediumistic material .', 'It is true , that nothing has been found comparable with electricity by communication ; ;', 'Not only can man project his imagination out into his environment in concrete forms , but even more importantly , he can turn it inward to help create new and better forms of himself .'], ['( 3 ) in a state of depression , the positive conditioned stimulus may fail to elicit a conditioned reaction but cause an increased synchrony instead of the excitatory desynchronizing ( alerting ) effect on the Aj .', 'This the therapist may pursue in later questioning .', ""A world in which wives have taken a more active role is likely to produce sexual relationships in which wives are more self-assertive , too '' ."", 'It is our hypothesis that Kohnstamm-positive subjects are less hesitant about relinquishing control than are Kohnstamm-negative subjects ; ;']]","[[-0.20460762083530426, -0.20365023612976074, -0.19687360525131226, -0.1956595927476883], [-0.10178475081920624, -0.10175865888595581, -0.10174331068992615, -0.10168594121932983], [-0.0005214381963014603, -0.0005214381963014603, -0.0005081077106297016, -0.000491483137011528], [0.09865926206111908, 0.09865926206111908, 0.09868621826171875, 0.09868977963924408], [0.19125011563301086, 0.19160713255405426, 0.19171062111854553, 0.19203424453735352], [0.24786388874053955, 0.25105714797973633, 0.25147366523742676, 0.2554927170276642]]",446.5456237792969,446.5456237792969,"[541.6419677734375, 523.55126953125, 247.33734130859375, 333.2413330078125, 216.33975219726562, 205.75790405273438]",220.72674560546875,"[470.38299560546875, 312.42449951171875, 194.31326293945312, 249.34332275390625, 191.63677978515625, 196.15615844726562]"
64,"John Gottman, PhD, founder of the Gottman Institute and the University of Washington's Love Lab, says that 69 percent of marital conflict never gets resolved.","[['Anyone for musical Ping-pong ? ?', 'Anyone for musical Ping-pong ? ?', 'Before the accelerometers are mounted on the platform , the direction of their sensitive axis must be accurately determined .', ""We'll take them in the general order of their popularity .""], ['Some have lovely homes -- some live in small apartments .', 'At birth , this species varies considerably in size .', 'He stood up , stretched , looked around for the bubbles , but could see none .', 'Means held steady one jump ahead of her .'], ['The argon flow from commercial bottles was regulated by a pressure regulator and measured with a gas flow rator .', 'The extent of such interference -- which may be so slight as to be undetectable at any point where either of the stations renders a usable signal , or may be so great as to virtually destroy the service areas of both stations -- depends on many factors , among the principal ones being the distance between the stations , their respective radiated power , and , of particular significance here , the time of day .', 'There was about that song something incandescent , for this Brahms was Milstein at white heat .', ""I hope the man who plans to sit on his hands until the emergency comes will have a change of heart , will get busy and be the first member of our `` plus-one '' shelter club .""], ['The car spun around again , Simms said , before Stickney could turn north in Prairie Avenue , and then violated two stop lights as he traveled north into Wilmette in Prairie .', ""A new work on the program was Nikolai Lopatnikoff's `` Festival Overture '' , receiving its first New York hearing ."", 'Hall , for example , was quite explicit on this point when he said states outside European civilization must formally enter into the circle of law-governed countries .', 'He played basketball there while working toward a law degree .'], [""`` The established pattern of relative calm in the field of race relations has continued in all areas '' , reported this group headed by Harold Colee of Jacksonville and including two South Floridians , William D. Singer and John B. Turner of Miami ."", 'In recent years , we have come increasingly to recognize that ideas have a history and that not the least important chapters of this history have to do with thematic or conceptual aspects of literature and the arts , although these aspects should be studied in conjunction with the history of philosophy , of religion , and of the sciences .', 'Moon-faced Ludwig Erhart , the economic expert , probably will ascend to the leadership long denied him .', ""We have heard that after seeing Mr. Quasimodo's work it will be virtually impossible to deny the artistic validity and importance of the whole abstract movement .""], [""His lawyer had sent him a statement on his overdue alimony , and there was a letter from the Collector of Internal Revenue asking him to stop in his office and explain last year's exemptions ."", 'Ann Catt was a lonely , devoted soul , never married , conducting a spotless home and devoted to her church , but a perpetual dissenter and born critic .', 'Ann Catt was a lonely , devoted soul , never married , conducting a spotless home and devoted to her church , but a perpetual dissenter and born critic .', ""In your Sept. 27 editorial appraisal of the work of the First Session of the Eighty-seventh Congress you referred to the lack of `` consciousness of destiny in a time of acute national and world peril '' .""]]","[[-0.20095640420913696, -0.20095640420913696, -0.18923041224479675, -0.18857324123382568], [-0.10323820263147354, -0.10290724784135818, -0.10290142148733139, -0.10277684032917023], [-0.0007464103400707245, -0.000743047334253788, -0.0007170923054218292, -0.0006977352313697338], [0.09900514781475067, 0.09905876219272614, 0.09913124144077301, 0.09913598001003265], [0.19298851490020752, 0.19354376196861267, 0.19355961680412292, 0.19421294331550598], [0.2651899456977844, 0.2653634548187256, 0.2653634548187256, 0.2656998634338379]]",57.46858596801758,57.46858596801758,"[55.62025833129883, 56.194271087646484, 57.79195022583008, 64.42794036865234, 55.537044525146484, 62.14600372314453]",45.87177658081055,"[47.14398193359375, 47.682350158691406, 48.87959289550781, 61.40218734741211, 49.43648147583008, 56.36177444458008]"
81,"Gottman calls this ""the existential area.""","[[""Despite the successful rehabilitation of over a half million disabled persons in the first eleven years after 1943 , the existing program was still seen to be inadequate to cope with the nation's backlog of an estimated two million disabled ."", 'Even though the registers may have an incomplete record of persons present in a particular area or include persons no longer living there , they contain precise information on ages , by date of birth , for some of the persons present ( especially children in relatively stable communities ) and supplementary information ( such as records of marital status ) for many others .', ""And if the foreigners fighting in the Katanga Army are mercenaries then Lafayette and Von Steuben were mercenaries too , as were also the members of the Lafayette Escadrille in the early part of World War 1 , and of Chennault's Flying Tigers in the early days of World War 2 ."", 'One thing should be clear to both husband and wife -- neither pain nor profuse bleeding has to occur when the hymen is ruptured during the first sex act .'], ['Or should we argue that if we want adjustment of children to children of different races and that that is impossible in an all-something-or-the-other school , we must at least provide him some opportunity to adjust to people of another race within the school -- namely , to a teacher of another race .', ""in conducting the Membership Preparation-Inquirers' Class , the pastor should plan a variety of teaching techniques in order to develop greater interest on the part of the class ."", ""in conducting the Membership Preparation-Inquirers' Class , the pastor should plan a variety of teaching techniques in order to develop greater interest on the part of the class ."", 'But the forceful presentation of new issues for the sciences to work on is itself a monumental task .'], [""Producer John Holmes has chosen a delightful comedy for his season's opener at Matunuck in Jean Kerr's `` King Of Hearts '' ."", 'Now that Israel enjoys relative prosperity and a reduction of tensions , the secularists are less disposed to compromise .', 'And then Castro himself did come , bearded , smiling ; ;', 'and it should be far better known than it is .'], ['The sole guidance given the Court for discharging the task committed to it was this : ``', ""in the similitude of God he created him '' ."", ""Those which tell a story of the earth's formation in each area can add geological interest to the recreation sites ."", 'He was -- as he told himself in the vernacular of a trade no longer his own -- riding the dark train out .'], ['She wondered , with a baffled feeling of helplessness .', 'Guerrillas were racing toward him .', ""`` More arrests , I fear '' ."", 'He had had the need to understand what life lurked behind the mask of flesh , behind the oath , the banter , the sadness .'], ['Said the whining voice .', 'Said the whining voice .', 'It is through such reflection that literature approaches philosophy .', 'Such is the field for exercising our reverence .']]","[[-0.1999835968017578, -0.19939768314361572, -0.19852575659751892, -0.19700072705745697], [-0.10170768201351166, -0.10166604071855545, -0.10166604071855545, -0.10166005045175552], [-0.0007022656500339508, -0.0006784740835428238, -0.0006317375227808952, -0.0006062984466552734], [0.09786005318164825, 0.09807023406028748, 0.09808699786663055, 0.09817802906036377], [0.19371525943279266, 0.19388151168823242, 0.19392593204975128, 0.19396647810935974], [0.277229905128479, 0.277229905128479, 0.27733951807022095, 0.2774091958999634]]",592.3400268554688,592.3400268554688,"[644.9599609375, 566.6180419921875, 379.46368408203125, 314.8808898925781, 412.15557861328125, 250.47216796875]",401.3582458496094,"[637.2444458007812, 587.1478271484375, 338.4018249511719, 362.7216491699219, 359.4588623046875, 347.0001220703125]"
92,"Conversing about ""who are we, what's our mission and what's our legacy"" creates shared meaning and purpose in the relationship, he says.","[['Very small concentrations of these hydrides should be detectable ; ;', ""It read : `` Shot in the lumbar region '' ."", ""It read : `` Shot in the lumbar region '' ."", ""It read : `` Shot in the lumbar region '' .""], ['It is of interest that her menarche was somewhat later than the average for the girls in this group .', 'It snowed continuously , but quietly , evenly .', 'The girls , after dressing , were indignant .', 'BAM is the unlikely name of a French recording company whose full label is Editions De La boite A Musique .'], ['As the index of refraction of photosensitive surfaces of the SbCs-type lies around 2 , the Fresnel losses at the fiber-photocathode interface are about 0.5 percent and the Af factor for the interstage coupler is 0.95 .', 'Dear God , at what a price .', ""It was reported to Welch's office that a thief in the city jail had attempted suicide ."", ""It was reported to Welch's office that a thief in the city jail had attempted suicide .""], [""But with Welch's relentless pursuit of the subject , Barco finally `` broke '' and started confessing to one murder after another ."", 'Texts and translations are provided .', 'Texts and translations are provided .', ""Once you learn how to translate Communese , much of each day's deluge of news will become clearer .""], ['I assumed Alma would get me there , but in the confusion of the meeting breaking up , we were separated .', ""Watson's insight is verified by the mysterious link between Holmes and his arch-opponent , Dr. Moriarty ."", 'And knowing its humble place in the scale of things , why did he , at this time of life , seem almost ready to sell his soul for plumpness ? ?', 'This refers to what had happened after the Earl of Warwick died in 1590 , when the town petitioned Burghley for the right to name the vicar and schoolmaster and other privileges but Greville bought the lordship for himself .'], [""so also did Mary , having a man betrothed ( to her ) , and being nevertheless a virgin , by yielding obedience , become the cause of salvation , both to herself and the whole human race '' ."", ""`` My feeling at the moment '' , he said , `` is that we have no alternative , irrespective of some of the arguments about him ."", 'On a team a man feels he is a part of it and akin to the men next to him .', 'The individualism and public service of the private detective both stem from his dedication to a personal code of conduct : he enforces the law without being told to do so .']]","[[-0.1968032419681549, -0.19423383474349976, -0.19423383474349976, -0.19423383474349976], [-0.10236609727144241, -0.1023474708199501, -0.10216568410396576, -0.10212840139865875], [-0.000587930902838707, -0.0005636662244796753, -0.0005453620105981827, -0.0005453620105981827], [0.09874469041824341, 0.09886082261800766, 0.09886082261800766, 0.09888368844985962], [0.19272658228874207, 0.1929778903722763, 0.19307787716388702, 0.19314223527908325], [0.2686142325401306, 0.26869553327560425, 0.2692573368549347, 0.27054962515830994]]",331.96795654296875,331.96795654296875,"[601.0426025390625, 346.244140625, 601.373779296875, 317.72149658203125, 392.76287841796875, 319.7439270019531]",272.5556945800781,"[530.211669921875, 324.2644958496094, 494.6185302734375, 313.624267578125, 336.849365234375, 281.8118591308594]"
82,"Growing used to your partner is natural, but it's a process that can be slowed down, says Sonja Lyubomirsky, PhD, a social psychologist at the University of California, Riverside, and author of the 2013 book ""The Myths of Happiness.""","[['Headquarters is in Birmingham , Ala. .', 'He looked over his shoulder at the thin dotting of pursuers .', 'He turned back to the screens , the crucial , conclusive phrase on his lips .', 'He stumbled to the middle of the road and simply stood there , waiting for them , a perfect target .'], ['A more official representative is the Secretary of the Interior .', 'Figures seemed to crouch in the surrounding dark ; ;', 'Its clarity and good optical properties are other important factors .', 'He wondered what expression , as he made that gesture , was on his face .'], ['Hank had gathered wood for a cookfire , and his wife was busy at it now .', 'You should see to it that the trap , the dirt-catcher in front of the filter , is always clean .', 'Serious , yes , but also much laughter .', 'Serious , yes , but also much laughter .'], ['As artists we feel the same obligation , as do other individuals , in considering ourselves responsible citizens of a great nation .', 'Joan Sheldon had earned the larger bequest .', 'Moreover , progress in a national transformation can be only gradually earned ; ;', 'For this does not account for the integral , elemental power of that which grows with abounding vigor as the play unfolds , nor does it explain the strange numinous sense of presentness which comes over those who watch the play like a spell .'], ['How Maxwell recounts his first coming to Camusfearna , his furnishing the empty house with beach-drift , the subtle changes in season over ten years , is a moving experience .', 'Some of the classic indicators , as described by Drs. Pittenger , Hockett , and Danehy in The First Five Minutes , are these : ambiguity of pronouns :', ""There is reason to suppose that Lucy would have made a record as publicly distinguished as her brother had it not been that her mother's death occurred just as she was about to enter college ."", 'Quite naturally , they make the investigation , first , by prohibiting the patient from making any movements at all and then , later , by repeating it and allowing the patient to move in any way he wanted to .'], [""`` A marriage can survive almost any kind of stress except an open and direct challenge to the husband's maleness '' , declares Dr. Calderone ."", 'Even before he saw the necessity of growing better food and planning good nutrition , Mr. Clark felt the school had a good health program .', ""`` It's Dave who is applying to Hanford College ."", 'The group known as the American Association for Health , , Physical Education , and Recreation ( a division of the National Education Association ) initiated a conference which brought together representatives of the National Rifle Association , SAAMI and the American Fishing Tackle Manufacturers .']]","[[-0.1854674220085144, -0.18202094733715057, -0.18143942952156067, -0.1790655553340912], [-0.10370160639286041, -0.10354137420654297, -0.10351332277059555, -0.10338644683361053], [-0.0004694797098636627, -0.0004100073128938675, -0.00039958953857421875, -0.00039958953857421875], [0.0987822487950325, 0.09879592061042786, 0.09884023666381836, 0.09885618090629578], [0.19238460063934326, 0.19249048829078674, 0.1926351934671402, 0.19282229244709015], [0.2338179349899292, 0.235407292842865, 0.23665761947631836, 0.23882031440734863]]",85.72366333007812,85.72366333007812,"[91.26237487792969, 81.1578598022461, 81.4254379272461, 77.44277954101562, 89.70416259765625, 93.6941909790039]",88.14115142822266,"[80.40082550048828, 77.2832260131836, 75.36064910888672, 78.75111389160156, 80.96084594726562, 87.22595977783203]"
