target_idx,target_sent,sents_intrp_all_bins,sim_intrp_all_bins,base_PPL,local_unintrp_PPL,local_intrp_PPL_all_bins,global_unintrp_PPL,global_intrp_PPL_all_bins
11,"But, say psychologists, there are many behaviors, such as how a couple talks and fights and even the type of dates they go on, that can be learned and practiced — and can give a pair a fighting chance at 'til death do they part.","[['A glance revealed that the main topgallant mast had been carried away .'], ['Mike felt disappointed that Mahmoud had left ; ;'], ['Others admitted he was absolutely correct -- he never slept .'], ['Then , as he doubled , gasping , vomiting the breakfast he had so lately eaten , Lord straightened him with an uppercut .'], [""It's inevitable in this case , for the couple will be separated for , at the least , forty years .""], [""Then there are a pair of old biddies played by Grace Carney and Sibly Bowan who may be right off the shelf of stock Irish characters , but they put such a combination of good will and malevolence into their parts that they're quite entertaining .""]]","[[-0.20446257293224335], [-0.10416372120380402], [-0.0007535852491855621], [0.09862987697124481], [0.19460844993591309], [0.28671085834503174]]",170.0977783203125,170.0977783203125,"[188.0904083251953, 174.82574462890625, 156.77101135253906, 164.14723205566406, 157.37266540527344, 153.9438934326172]",148.60606384277344,"[151.04527282714844, 153.86550903320312, 137.70236206054688, 136.81890869140625, 148.27650451660156, 133.731689453125]"
74,"Partners who reported patterns of destructive behavior when dealing with conflict in the first year of marriage, for example, were more likely to divorce years later (, 2010).","[['So much for the prototype .'], [""' not flash in pan '""], ['Well , it has to happen .'], ['When , in my enthusiasm , I proposed the party , my city editor ( who disliked the club and many of its members ) tried to block my participation in the gala event .'], [""In 1920 , the Lambeth Conference repeated its 1908 condemnation of contraception and issued `` an emphatic warning against the use of unnatural means for the avoidance of conception , together with the grave dangers -- physical , moral , and religious -- thereby incurred , and against the evils which the extension of such use threaten the race '' .""], ['But , from our reading of the Western Talmud , we Urielites believe that the Forerunner , knowing this situation would arise , made reference to and provision for divorce .']]","[[-0.1953134834766388], [-0.10317188501358032], [-0.0009743571281433105], [0.09871470928192139], [0.1922537386417389], [0.27702802419662476]]",85.91535186767578,85.91535186767578,"[87.83328247070312, 116.07174682617188, 90.75321197509766, 113.54634857177734, 96.36029052734375, 82.94918060302734]",69.38239288330078,"[66.62405395507812, 69.1119613647461, 75.13388061523438, 82.17491912841797, 79.15406036376953, 66.18392944335938]"
85,"In a 2012 paper in the , Shelly Gable, PhD, of the University of California, Santa Barbara, and colleagues found that participants who felt supported by a partner during a positive event, such as receiving a high rating at work, felt better about themselves and about their relationships.","[['It had never been stained with blood .'], ['The era , however , is Janus-faced .'], ['Assistant Prosecutor Fred Lewis , who tried both the Hengesbach and Pohl cases , said he did not know what would be done about two arson charges pending against Pohl .'], ['When he had closed the suitcase he found a rag and moved about the room , wiping carefully everything he might have touched .'], ['In the following year , 1803 , Oersted , simultaneously with Davy , discovered that acids increased the strength of a voltaic battery more than did salts .'], [""At one university , the president cites the faculty review committee as `` a valued partner of the administration in guarding and promoting the quality of the faculty '' .""]]","[[-0.2176472395658493], [-0.10232649743556976], [-0.00069475919008255], [0.09874249249696732], [0.19242747128009796], [0.2522469162940979]]",58.69154357910156,58.69154357910156,"[58.545860290527344, 54.630882263183594, 61.43018341064453, 60.960880279541016, 55.67816162109375, 56.74148178100586]",39.114383697509766,"[39.98217010498047, 38.82965087890625, 41.48807907104492, 43.592044830322266, 41.14377975463867, 39.176815032958984]"
100,Those who succumbed to the safer movie-rental routine didn't reap the same benefits.,"[['This is what we mean when we say this demand must be accepted without condition .'], [""Seven hundred miles south of York Factory , at `` the Forks '' of the Red and the Assiniboine , twenty-three men located a settlement in August 1812 .""], ['But what came in was piling up .'], ['To this day the Atomic Energy Commission shies away from discussing the health aspects of fallout .'], ['Eating while angry had given her a slight indigestion .'], ['Somehow we old-timers never figured we would ever retire .']]","[[-0.19326366484165192], [-0.10495610535144806], [-0.0012752041220664978], [0.09911683201789856], [0.19606609642505646], [0.2747783660888672]]",522.6298828125,522.6298828125,"[574.798828125, 505.9433288574219, 504.4125061035156, 491.187744140625, 471.70843505859375, 478.3610534667969]",525.72265625,"[827.7911987304688, 424.1798400878906, 483.7063293457031, 538.841552734375, 545.5294799804688, 534.10498046875]"
107,"And somehow, there's this belief that we don't have to work at learning how to be a couple, it should just come naturally,"" he says.","[['They are not susceptible to wholesale destruction by ballistic missile .'], ['-- About 30% of the expenditures for the Department of Defense in 1961 are for military personnel costs , including pay for active , reserve , and retired military personnel .'], [""The Warren Telegraph stated that many of Rev. Trafton's remarks were inappropriate and savored strongly of radicalism and fanaticism .""], ['While they were away Blanche came into the office every morning , running things as she had always run them for Stanley , going through the week in a dazed stupor , getting things done automatically , out of habit .'], [""I've given willful hurt to no man .""], [""Now look , there's work to be done and lots of it .""]]","[[-0.19003289937973022], [-0.10437467694282532], [-0.000715780071914196], [0.0988076850771904], [0.1966642141342163], [0.31176185607910156]]",177.20286560058594,177.20286560058594,"[193.42930603027344, 197.094970703125, 183.4205322265625, 154.97183227539062, 127.81958770751953, 126.0220947265625]",110.71989440917969,"[110.71082305908203, 136.54185485839844, 154.36758422851562, 126.3302001953125, 108.28738403320312, 109.9310073852539]"
