target_idx,target_sent,sents_intrp_all_bins,sim_intrp_all_bins,base_PPL,local_unintrp_PPL,local_intrp_PPL_all_bins,global_unintrp_PPL,global_intrp_PPL_all_bins
7,"For decades, psychologists have been trying to answer the key question: What's going on when two people who once said ""I do"" to a lifetime together decide they're better off apart?","[['The jetting , frothing surface of the river reached the level of the runoff .'], ['And so off we went to her apartment .'], ['State aid to schools , the continuance of railroad passenger service , the proper uses of surplus funds of the Port of New York Authority , and making New Jersey attractive to new industry .'], ['`` It is , sir , as I have said , a small college , and yet there are those who love it .'], ['It is not much better if he meets with old classmates .'], ['Because neither of them really wanted their marriage to break up , Mr. and Mrs. Black agreed to a series of interviews at Family Service of Northern Virginia , the agency nearest them .']]","[[-0.1711128056049347], [-0.10301409661769867], [-0.0005751661956310272], [0.09923090040683746], [0.19597592949867249], [0.3051941692829132]]",96.2269515991211,96.2269515991211,"[101.4488296508789, 92.72749328613281, 93.16035461425781, 90.85778045654297, 86.06324768066406, 97.52777862548828]",108.0985107421875,"[117.18365478515625, 96.94578552246094, 101.7607421875, 94.96263122558594, 99.63052368164062, 102.13734436035156]"
16,"Women with at least a bachelor's degree have a 78 percent shot that their marriages will last 20 years, compared with a 41 percent chance among women with only a high school diploma, according to the NCHS data.","[['We will then occupy the new plant under lease , with an option to purchase .'], [""that these products constituted a `` line of commerce '' within the meaning of the Clayton Act ; ;""], ['There is therefore nothing about them to which an attitude of approval or condemnation could be fitting .'], ['From the time he had been at college he had achieved a certain tranquility and composure by accepting the fact that there were certain things he could never know .'], ['Those who responded with an arm-elevation in the naive state did not change their reaction when told that there were some normal people who did not react in this fashion .'], ['The white girl with the penetrating green eyes sipped the lemonade handed to her by a handsome man of about 30 , who had coppery skin and beetling eyebrows .']]","[[-0.1590019166469574], [-0.10434232652187347], [-0.00041582994163036346], [0.0992397665977478], [0.19413511455059052], [0.25809258222579956]]",35.723636627197266,35.723636627197266,"[36.091529846191406, 37.808467864990234, 31.40300750732422, 34.99984359741211, 31.422239303588867, 36.630008697509766]",28.430681228637695,"[28.537975311279297, 29.49249267578125, 29.44129753112793, 30.152114868164062, 28.089767456054688, 31.21456527709961]"
23,"""Money is the No.","[['She had activated one of her microscopic tools which she would later use for minute repairs to various parts of her control panel .'], ['The dweller at p is last to hear about a new cure , the slowest to announce to his neighbors his urgent distresses , the one who goes the farthest to trade , and the one with the greatest difficulty of all in putting over an idea or getting people to join him in a cooperative effort .'], ['Some doctors had informed him he was mistaken about this .'], ['The basic mapping phase of the program has been completed and the inventory phase is scheduled for completion July 1 , 1961 .'], [""`` You're in for trouble '' .""], [""It is Mars , isn't it ? ?""]]","[[-0.18300296366214752], [-0.10217661410570145], [-0.0005708783864974976], [0.09884043037891388], [0.19127652049064636], [0.2543752193450928]]",226.324951171875,226.324951171875,"[442.6963195800781, 228.04457092285156, 337.1384582519531, 257.5633544921875, 188.15113830566406, 231.14320373535156]",214.69375610351562,"[213.55816650390625, 180.71018981933594, 162.862060546875, 119.34178161621094, 133.3749237060547, 151.7112274169922]"
46,"The researchers found that couples whose relationship satisfaction declined during the first four years of marriage were most often those who had reported less satisfaction to begin with (, 2012).","[['So far as I can see , there is only one way out for the positivist .'], ['However , there is a minimum of legislative restriction on boating .'], ['Then they returned to their hotel and got ready for bed .'], ['Young Mrs. Arthur had opened the oven and there was a drifting odor of hot biscuits .'], [""and for this statement the best evidence comes within the five years following the publication of Utopia , when Martin Luther elaborates a new perception of the nature of the Divine's encounter with man .""], ['In their views on dating , courtship , sex , and family life , our students prefer what they are expected to prefer .']]","[[-0.19205668568611145], [-0.10148914158344269], [-0.0006130598485469818], [0.09862300008535385], [0.19428640604019165], [0.29438069462776184]]",148.52883911132812,148.52883911132812,"[159.7642059326172, 135.07998657226562, 166.5270233154297, 175.59671020507812, 153.71319580078125, 129.94126892089844]",74.47019958496094,"[87.09317016601562, 73.7176284790039, 74.86241149902344, 82.87327575683594, 76.87272644042969, 79.30884552001953]"
58,"Men seem to need these affirmations most, Orbuch's analysis suggests.","[['Via was in the parking lot when I went outside .'], [""The second stage is to retain the nominal classification of `` neutralist '' , while in fact turning the country into an active advocate and adherent of Soviet policy .""], ['She had lost the extra torsos .'], [""`` I told you , Mike '' , said Rourke in an aggrieved voice .""], ['Three of these men discussed major theories of the universe while the other acted as a moderator .'], ['To generalize for the entire nation would be absurd .']]","[[-0.20139175653457642], [-0.10140402615070343], [-0.0007555289193987846], [0.09875449538230896], [0.19589293003082275], [0.27290984988212585]]",360.791748046875,360.791748046875,"[387.9474182128906, 379.8874816894531, 487.9494323730469, 316.9354248046875, 341.81463623046875, 371.3458251953125]",216.7139129638672,"[278.7603454589844, 223.29249572753906, 241.71331787109375, 232.57162475585938, 232.0666961669922, 216.00144958496094]"
