target_idx,target_sent,sents_intrp_all_bins,sim_intrp_all_bins,base_PPL,local_unintrp_PPL,local_intrp_PPL_all_bins,global_unintrp_PPL,global_intrp_PPL_all_bins,base_entropy,local_unintrp_entropy,local_intrp_entropy_all_bins,global_unintrp_entropy,global_intrp_entropy_all_bins
6,"As a result, experts routinely estimate that between 40 percent and 50 percent of marriages today will end in divorce.","[[""Except that Kitti wasn't there .""], ['Wilson stared at her .'], ['they expired amid indescribable fantods , imploring the Blessed One to forgive their desecration .'], ['He took several large swallows , recollected that Docherty had gone up another flight , and decided he would be wise to cover himself by finding him .'], ['Such conversation quickly reveals an ethically significant ambivalence in the self-images held by most realtors .'], [""While details are still to be worked out , Ratcliff said he expects to tell home folks in Dallas why he thinks Berry's proposed constitutional amendment should be rejected .""]]","[[-0.18559731543064117], [-0.1027306318283081], [-0.0006956551223993301], [0.09806086122989655], [0.19005800783634186], [0.25110360980033875]]",38.10108947753906,38.10108947753906,"[37.705726623535156, 35.71931076049805, 40.26092529296875, 50.208457946777344, 33.46452331542969, 34.89048385620117]",20.923343658447266,"[21.062877655029297, 24.325952529907227, 25.38751983642578, 31.77313995361328, 22.377912521362305, 26.025972366333008]",2.7188358306884766,2.7188358306884766,"[2.5444180965423584, 2.579038143157959, 2.427096366882324, 2.5809860229492188, 2.5209059715270996, 2.451392412185669]",2.4383368492126465,"[2.552069664001465, 2.612635374069214, 2.4300029277801514, 2.6397759914398193, 2.567763328552246, 2.5317795276641846]"
7,"For decades, psychologists have been trying to answer the key question: What's going on when two people who once said ""I do"" to a lifetime together decide they're better off apart?","[['The skiff was not heading for the nursery , however .'], ['Mass rapes , troop mutinies , uncontrolled looting and pillage and reckless military adventures , given no sanction by any political authority , have become almost daily occurrences .'], [""`` Shootin' 'em out '' was gettin' cattle out of a corral onto the range .""], [""-- I concur most heartily with today's letter on the futility of writing to Sen. Dirksen and Sen. Douglas .""], ['Both of them did communicate one central theme : Against the ruin of the world , there is only one defense -- the creative act .'], [""Their two boys were `` well adjusted '' and , like their parents , always did the right thing at the right time and damn the consequences .""]]","[[-0.17324040830135345], [-0.10404744744300842], [-0.0008818171918392181], [0.09897004812955856], [0.19485414028167725], [0.28997665643692017]]",96.2269515991211,96.2269515991211,"[98.7807846069336, 94.78311920166016, 94.07376861572266, 83.75672912597656, 92.38152313232422, 92.14295196533203]",108.0985107421875,"[107.22967529296875, 109.67794799804688, 104.95603942871094, 86.13397979736328, 94.01274108886719, 102.22354125976562]",4.012792587280273,4.012792587280273,"[4.01343297958374, 3.966458797454834, 4.06241512298584, 4.091856479644775, 4.02323055267334, 4.024476528167725]",3.9095892906188965,"[3.917996406555176, 3.9373202323913574, 3.9233109951019287, 4.027702331542969, 3.999413013458252, 3.975977897644043]"
10,"Some of those factors, including ethnic background and socioeconomic status, are beyond a couple's control.","[[""`` We can get it if we dig '' , he said patiently .""], ['Day and night Martin could not drag his mind from the dilemma he had made for himself .'], ['He would cross to Manhattan , to Harlem Heights , before morning .'], ['He was sure that he could do better if he went to Atlanta to get the deal financed .'], [""A modern cotton gin plant costs in the neighborhood of $250,000 , and it's a safe assumption that a large percentage of new gins in the U.S. and foreign countries contain machinery made in this area .""], ['To what extent did it mould the morals and the social , economic , and political life and institutions of the country ? ?']]","[[-0.1956903636455536], [-0.10224802047014236], [-0.0006709545850753784], [0.09851773828268051], [0.18677465617656708], [0.22961026430130005]]",65.64418029785156,65.64418029785156,"[62.20319366455078, 72.56854248046875, 77.63703155517578, 83.29666900634766, 57.36465835571289, 60.70205307006836]",56.45120620727539,"[49.94694519042969, 48.99075698852539, 52.577667236328125, 51.701683044433594, 49.713722229003906, 49.82829284667969]",4.031998634338379,4.031998634338379,"[4.2265753746032715, 4.089186191558838, 4.000003814697266, 4.058228969573975, 4.083395481109619, 4.106073379516602]",4.031766414642334,"[4.297909736633301, 4.206333637237549, 4.285454273223877, 4.0671491622924805, 4.154460906982422, 4.244201183319092]"
31,"Couples who rarely get a chance to restore their ""reserves,"" such as those from low-income communities, can be particularly prone to marital dissatisfaction and divorce.","[['Let T be a linear operator on the finite-dimensional vector space V over the field F .'], ['That was another one of those traps .'], ['It was not even certain the shot had been fired from either hotel .'], ['in half an hour the reception would be over .'], ['It is difficult to tabulate exactly what was meant in each individual situation , but the conclusion may be drawn that 21 towns do not assess movable personal property , and of the remainder only certain types are valued for tax purposes .'], ['Anthony Steel , as the husband , is a jealous type who argues against her course and sues for divorce , labeling her action adulterous .']]","[[-0.1886015087366104], [-0.10264809429645538], [-0.0005927830934524536], [0.09882587194442749], [0.19423967599868774], [0.29360681772232056]]",233.86842346191406,233.86842346191406,"[256.6441345214844, 247.2998504638672, 301.03033447265625, 228.78248596191406, 183.3593292236328, 208.56573486328125]",165.47930908203125,"[191.99688720703125, 180.84243774414062, 186.80001831054688, 169.10130310058594, 160.64224243164062, 179.19491577148438]",4.259987831115723,4.259987831115723,"[4.647256851196289, 4.362456798553467, 4.328427314758301, 4.346937656402588, 4.236093997955322, 4.133034706115723]",4.212554931640625,"[4.295540809631348, 4.305235862731934, 4.326763153076172, 4.281045436859131, 4.203441143035889, 4.243105888366699]"
79,"The happiest couples also share their hopes, dreams and fears.","[['But Hoag had not stayed on the front steps when Griffith disappeared into the building .'], ['Since the Connally amendment has the effect of giving the same right to the other party to a dispute with the United States , it also prevents us from using the court effectively .'], ['As she matured , more and more neural synapses would be adjusted to operate other mechanisms that went into the maintenance and running of a space ship .'], [""he generally heard Freddy's suggestions without interest , being absorbed by his own prospering concerns .""], ['And then Castro himself did come , bearded , smiling ; ;'], ['The two women babbled and crooned at him .']]","[[-0.20934921503067017], [-0.102418914437294], [-0.0006571998819708824], [0.09861554950475693], [0.1887488067150116], [0.2469831109046936]]",446.6719055175781,446.6719055175781,"[638.960205078125, 387.0558776855469, 553.9425048828125, 590.467529296875, 274.861083984375, 453.10015869140625]",276.6875915527344,"[247.17935180664062, 276.6647644042969, 319.87994384765625, 272.6676330566406, 276.4881896972656, 244.7016143798828]",4.128765106201172,4.128765106201172,"[4.0592570304870605, 4.1425299644470215, 4.221750259399414, 4.064958572387695, 4.229421615600586, 4.034689426422119]",4.3621344566345215,"[4.422332286834717, 4.374244689941406, 4.410238265991211, 4.434323787689209, 4.410660743713379, 4.274971008300781]"
