target_idx,target_sent,sents_intrp_all_bins,sim_intrp_all_bins,base_PPL,local_unintrp_PPL,local_intrp_PPL_all_bins,global_unintrp_PPL,global_intrp_PPL_all_bins,base_entropy,local_unintrp_entropy,local_intrp_entropy_all_bins,global_unintrp_entropy,global_intrp_entropy_all_bins
20,"A 2009 report from the University of Virginia's National Marriage Project, for example, showed that couples with no assets are 70 percent more likely to divorce within three years than couples with $10,000 in assets.","[[""a modulation described as `` almost a stroke of genius '' .""], ['The voice came from behind him , and Wilson turned .'], ['He already had that slow pace that comes over the elderly , while she herself had all the signs of one who appreciates the joys of living .'], ['To those of my readers who find many of my opinions morally , or politically , or sociologically antiquated ( and I have reason to know that there are some such ) , I would like to say what I have already hinted , namely , that some of my opinions may indeed be subject to some discount on the simple ground that I am no longer young and therefore incapable of being youthful of mind .'], ['Two members of the Democratic-endorsed majority on the school board said they probably would vote to appeal a ruling by the state Board of Education , which said yesterday that the school committee acted improperly in its appointment of the coordinator , Francis P. Nolan 3rd , the Democratic-endorsed committee chairman , could not be reached for comment .'], ['More typical is the case of a suburban Long Island housewife described by a marriage counselor .']]","[[-0.15969599783420563], [-0.10144864767789841], [-0.00013866322115063667], [0.0992729589343071], [0.1955011487007141], [0.29299142956733704]]",110.26679229736328,110.26679229736328,"[100.61375427246094, 113.57190704345703, 101.01588439941406, 110.64189910888672, 96.9487533569336, 97.17081451416016]",82.0260009765625,"[84.56133270263672, 84.90788269042969, 83.88895416259766, 86.40506744384766, 77.90831756591797, 82.80738830566406]",3.5500829219818115,3.5500829219818115,"[3.465026617050171, 3.5487136840820312, 3.5641350746154785, 3.688138723373413, 3.4884140491485596, 3.4414684772491455]",3.321218252182007,"[3.2943801879882812, 3.3790016174316406, 3.409785032272339, 3.6086597442626953, 3.3444488048553467, 3.309666156768799]"
27,"In one 2012 study, graduate student April Buck, PhD, and social psychologist Lisa Neff, PhD, from the University of Texas at Austin, evaluated diaries of 165 newlywed couples.","[['If we return to them today , we have no difficulty spotting their weaknesses but we find them still pleasing .'], ['Beside his shorts , he would place something of hers .'], ['Now she was intensely alive , anguished ; ;'], [""Lucy suspected that Myra would never have come home if Gregg , Myra's husband , hadn't gone out to fetch her .""], ['A hebephrenic man used to give a repetitious wave of his hand a number of times during his largely-silent hours with his therapist .'], ['He attended New York University before switching to Georgetown University in Washington .']]","[[-0.1569211333990097], [-0.10169830918312073], [-0.00027358904480934143], [0.09959090501070023], [0.19368454813957214], [0.2951650321483612]]",35.537540435791016,35.537540435791016,"[30.904300689697266, 34.39990234375, 33.5533561706543, 33.980934143066406, 31.708782196044922, 27.68103790283203]",28.218067169189453,"[28.24175262451172, 28.980976104736328, 29.83599281311035, 28.44611358642578, 28.62701988220215, 24.76720428466797]",3.302138090133667,3.302138090133667,"[3.234025001525879, 3.1914010047912598, 3.3026986122131348, 3.0552666187286377, 3.2467024326324463, 3.1068341732025146]",3.2042219638824463,"[3.4076013565063477, 3.248450517654419, 3.321460485458374, 3.1649327278137207, 3.2890398502349854, 3.2294232845306396]"
86,But feeling supported during negative events was inconsistently — and sometimes even negatively — linked to similar good feelings.,"[['The Service has not said what its next step will be .'], [""'' , `` Puttin' On The Ritz '' , `` How Long Has This Been Going On ? ?""], ['`` Stevie , wake up now ! !'], ['He thought of Simms Purdew rising up , fearless in glory .'], [""It combines qualities that are seldom found in one work : Scrupulous scholarship , a fund of personal experience , a sense of drama and characterization and a broad grasp of the era's great historical issues .""], ['The objectification of the world of spirit in popular superstition had certainly gone far beyond what the experience of spirit could justify or support .']]","[[-0.16537129878997803], [-0.10117988288402557], [-0.0003459472209215164], [0.09945662319660187], [0.19665566086769104], [0.310890257358551]]",501.0337219238281,501.0337219238281,"[562.8093872070312, 519.9403076171875, 562.417724609375, 540.9479370117188, 644.7973022460938, 470.8758239746094]",363.9578552246094,"[406.6373291015625, 381.1372985839844, 412.524658203125, 346.9296569824219, 418.29571533203125, 334.1937255859375]",4.157018661499023,4.157018661499023,"[4.120761394500732, 4.295730113983154, 4.257633209228516, 4.149199962615967, 4.109969615936279, 4.159787654876709]",4.412327289581299,"[4.431945323944092, 4.584710597991943, 4.5836181640625, 4.469677925109863, 4.627809047698975, 4.433000087738037]"
91,"In the Early Years of Marriage Project, she and her colleagues, including Aron, found that couples reporting boredom in the seventh year of marriage were significantly less likely to be satisfied with the relationship by their 16th anniversary (, 2009).","[['Again , a force too strong for unfrozen bodies to endure would be applied .'], ['His energy was gone .'], ['Never forget that a chain is only as strong as its weakest link .'], [""Eileen got to dancing , just a little tiny dancing step to a hummed tune that you could hardly notice , and trying to pick up strange men , but each time I was ready to say to hell with it and walk out she'd pull herself together and talk so understandingly in that sweet husky voice about the good times and the happiness we'd had together and there I was back on the hook .""], ['A top official of the New Frontier who kept a record of his first weeks on the job here gives this report of his experiences :'], ['He had picked out this pathless trail , instead of the common one , in a moment of romantic fancy , to give them privacy on their honeymoon .']]","[[-0.16807708144187927], [-0.1015133410692215], [-0.0003852918744087219], [0.09945926070213318], [0.19574855268001556], [0.32530415058135986]]",74.61945343017578,74.61945343017578,"[83.01004028320312, 78.99980163574219, 81.53053283691406, 80.57490539550781, 89.80191040039062, 78.68832397460938]",81.12361907958984,"[77.63359832763672, 79.28775024414062, 81.51731872558594, 81.35763549804688, 84.40543365478516, 81.99561309814453]",3.6707041263580322,3.6707041263580322,"[3.604588508605957, 3.6268255710601807, 3.7176127433776855, 3.723212242126465, 3.966221809387207, 3.722799062728882]",3.9765284061431885,"[3.944136619567871, 3.9556639194488525, 3.9937901496887207, 3.823843002319336, 4.050961971282959, 3.9000182151794434]"
102,Know that love's not enough.,"[['This result is plotted along with the 8.6-mm observations of Gibson ( 1958 ) in figure 1 , A .'], ['Yet he remains the fiercest of competitors .'], ['He was my gapt in the creche .'], ['Because neither of them really wanted their marriage to break up , Mr. and Mrs. Black agreed to a series of interviews at Family Service of Northern Virginia , the agency nearest them .'], ['He never knew just what woke him .'], [""After all , a guy's gotta have a little ego ! !""]]","[[-0.19185587763786316], [-0.10120542347431183], [-0.00032982416450977325], [0.09920348227024078], [0.19552326202392578], [0.3279752731323242]]",332.8218078613281,332.8218078613281,"[562.3517456054688, 847.8396606445312, 396.7891845703125, 858.4020385742188, 528.4970092773438, 242.0196533203125]",434.3404541015625,"[691.6923217773438, 676.1446533203125, 333.3591003417969, 416.3667907714844, 381.2601623535156, 266.2539978027344]",4.732029914855957,4.732029914855957,"[4.514480113983154, 4.721220970153809, 4.8575897216796875, 4.506023406982422, 4.821902751922607, 4.819146633148193]",4.840134620666504,"[4.593637943267822, 4.794921398162842, 4.928205490112305, 4.66207218170166, 4.965272426605225, 4.7894134521484375]"
