target_idx,target_sent,sents_intrp_all_bins,sim_intrp_all_bins,base_PPL,local_unintrp_PPL,local_intrp_PPL_all_bins,global_unintrp_PPL,global_intrp_PPL_all_bins,base_entropy,local_unintrp_entropy,local_intrp_entropy_all_bins,global_unintrp_entropy,global_intrp_entropy_all_bins
7,"For decades, psychologists have been trying to answer the key question: What's going on when two people who once said ""I do"" to a lifetime together decide they're better off apart?","[['This document began : `` No. 1 Newbury Port , may 30th , 1791'], ['The bandit laughs in his face .'], ['State aid to schools , the continuance of railroad passenger service , the proper uses of surplus funds of the Port of New York Authority , and making New Jersey attractive to new industry .'], ['We have so many new things to fear in this age of nuclear weapons , dreadful things which are too horrible to contemplate .'], ['It is not much better if he meets with old classmates .'], [""Each of the organization's ninety-nine members would get two professional posts , such as political affairs officer , a department head or an economist , to start .""]]","[[-0.1627037525177002], [-0.10238942503929138], [-0.0005751661956310272], [0.09932039678096771], [0.19597592949867249], [0.307431697845459]]",96.2269515991211,96.2269515991211,"[110.81640625, 91.94540405273438, 93.16035461425781, 91.4156494140625, 86.06324768066406, 97.21817779541016]",108.0985107421875,"[128.36367797851562, 96.27312469482422, 101.7607421875, 96.82276916503906, 99.63052368164062, 113.14962768554688]",4.012792587280273,4.012792587280273,"[3.9670021533966064, 3.996912956237793, 4.023879051208496, 3.972743034362793, 3.933631420135498, 3.9836883544921875]",3.9095892906188965,"[4.004082202911377, 3.962143659591675, 3.983436107635498, 4.021744251251221, 3.8860485553741455, 3.9750816822052]"
21,"That comes as no surprise to Terri Orbuch, PhD, of the University of Michigan and Oakland University, who says arguments over money — how to spend, save and split it — plague even well-off couples.","[['The rides were tame enough -- mostly we talked .'], ['The eyes were clear and black and the slender body was arched slightly .'], ['This is not wholly a reasoning process -- a computer cannot do it all -- and even in an Angel it takes time .'], ['Your feet are in bad shape , Mrs. Jones .'], ['Officials estimated the annual tax boost for the medical plan would amount to 1.5 billion dollars and that medical benefits paid out would run 1 billion or more in the first year , 1963 .'], [""A month later , in The Publick Spirit Of The Whigs , he used Steele's defense of Molesworth as evidence of his disrespect for the clergy , calling Steele's position an affront to the `` whole Convocation of Ireland '' .""]]","[[-0.15738916397094727], [-0.10290644317865372], [-0.0004047080874443054], [0.09942413866519928], [0.19709640741348267], [0.2757522761821747]]",118.03742980957031,118.03742980957031,"[119.58712768554688, 134.43490600585938, 121.77632141113281, 122.63982391357422, 128.92453002929688, 128.56871032714844]",120.97566223144531,"[109.26671600341797, 151.33059692382812, 132.39923095703125, 130.67123413085938, 119.01245880126953, 115.35237121582031]",3.5341477394104004,3.5341477394104004,"[3.762021780014038, 3.724804401397705, 3.7945523262023926, 3.8675925731658936, 3.60139536857605, 3.5016090869903564]",3.820206880569458,"[3.9124855995178223, 3.976275682449341, 3.9015748500823975, 3.989351272583008, 3.862874746322632, 3.7478625774383545]"
38,"His team's study found that military personnel are much more likely than civilians to be married and not as likely to be divorced compared with civilians of similar ages, races, employment statuses and education levels (, 2012).","[[""She began to explain , `` There was this poet , in Italy '' He interrupted , `` Please don't judge all poets '' .""], ['It was simply his necessity to confess which had made him write and keep this thing .'], ['When Joe identified himself , he nodded , unsmiling , and ushered him into a sedate living room .'], ['At Geneva in 1954 , to get the war in Indo-China settled , the British and French gave in to Russian and Communist Chinese demands and agreed to the setting up of a Communist state , North Viet Nam -- which then , predictably , became a base for Communist operations against neighboring South Viet Nam and Laos .'], ['In a sense almost all high school and college courses could be considered as vocational to the extent that later in life the student in his vocation ( which may be a profession ) will be called upon to use some of the skills developed and the competence obtained .'], [""In even greater degree the same rule applied to the remainder of Eastern Europe , where the upper classes had generally collaborated with the Nazis , even to the extent of sending millions of their peasants into Russia as a part of Hitler's armies .""]]","[[-0.16687530279159546], [-0.10211818665266037], [-0.0004589315503835678], [0.09901013970375061], [0.19435012340545654], [0.26368448138237]]",85.84326934814453,85.84326934814453,"[102.31932067871094, 87.06472778320312, 83.75325775146484, 100.88206481933594, 74.22640228271484, 89.18186950683594]",80.50574493408203,"[85.48516082763672, 79.92412567138672, 82.12117767333984, 76.6216812133789, 77.93212890625, 73.79627227783203]",3.7235093116760254,3.7235093116760254,"[3.718696355819702, 3.7009646892547607, 3.6898696422576904, 3.659759044647217, 3.7126169204711914, 3.6811892986297607]",3.78224778175354,"[3.788653612136841, 3.7975995540618896, 3.7800328731536865, 3.817483901977539, 3.794494867324829, 3.7823712825775146]"
68,"More recently, UCLA's Lavner led another study reevaluating how a couple's fighting style affected their marriages.","[['Riverside residents would go to the Seekonk assembly point .'], ['It is the wages of sin , and its sting is the law .'], ['Probably his horse would be close to where he was hiding .'], ['Suddenly the lash stopped fighting the air and she heard Pile of Clouds say in his high , quavering voice :'], ['almost everyone , on first hearing one of his own sessions on tape , expressed some desire to take the whole thing over again .'], ['Mary was free to marry again , not knowing that the Sturch had secretly given her a divorce , thinking that death had dissolved her marriage .']]","[[-0.15893566608428955], [-0.10380761325359344], [-0.0005412176251411438], [0.09952510893344879], [0.19537605345249176], [0.281900554895401]]",148.7038116455078,148.7038116455078,"[133.13201904296875, 144.082763671875, 149.80743408203125, 186.98876953125, 137.16282653808594, 131.99806213378906]",98.41229248046875,"[95.30049133300781, 110.80308532714844, 103.78056335449219, 138.2831268310547, 93.7623062133789, 89.38043212890625]",4.521467208862305,4.521467208862305,"[4.2289652824401855, 4.53646183013916, 4.332524299621582, 4.6226091384887695, 4.294364929199219, 4.094921112060547]",4.349396705627441,"[4.335503101348877, 4.461612224578857, 4.295572757720947, 4.525379657745361, 4.265797138214111, 4.204840183258057]"
91,"In the Early Years of Marriage Project, she and her colleagues, including Aron, found that couples reporting boredom in the seventh year of marriage were significantly less likely to be satisfied with the relationship by their 16th anniversary (, 2009).","[['The dimensions of these waves dwarf all our usual standards of measurement .'], [""He said : `` You'll feel a lot better after you have a bath .""], ['As the press in Cuba was gradually throttled by the Castro regime , more and more Cuban publishers , editors and correspondents were forced into exile .'], ['-- New York Central Railroad president Alfred E. Perlman said Tuesday his line would face the threat of bankruptcy if the Chesapeake & Ohio and Baltimore & Ohio Railroads merge .'], ['Yet , paradoxically , according to Dr. Maurice Linden , many wives despise their husbands for not standing up to them .'], ['Anthony Steel , as the husband , is a jealous type who argues against her course and sues for divorce , labeling her action adulterous .']]","[[-0.17403414845466614], [-0.10181247442960739], [-0.00048089586198329926], [0.09910636395215988], [0.19446250796318054], [0.31542348861694336]]",74.61945343017578,74.61945343017578,"[83.60206604003906, 83.22925567626953, 84.86979675292969, 91.73760223388672, 73.85315704345703, 70.64195251464844]",81.12361907958984,"[76.48439025878906, 86.60235595703125, 89.31878662109375, 79.52352142333984, 74.71990203857422, 69.65789794921875]",3.6707041263580322,3.6707041263580322,"[3.7562856674194336, 3.8502955436706543, 3.6264703273773193, 3.6941628456115723, 3.6273646354675293, 3.6267800331115723]",3.9765284061431885,"[4.046477794647217, 3.9972026348114014, 3.8482697010040283, 3.8618898391723633, 3.8753013610839844, 3.8400418758392334]"
