target_idx,target_sent,sents_intrp_all_bins,sim_intrp_all_bins,base_PPL,local_unintrp_PPL,local_intrp_PPL_all_bins,global_unintrp_PPL,global_intrp_PPL_all_bins
7,"For decades, psychologists have been trying to answer the key question: What's going on when two people who once said ""I do"" to a lifetime together decide they're better off apart?","[['He might have been anywhere or nowhere .'], ['This result is preliminary , and work is continuing .'], ['And not one single dwelling left there , though once , in the early eighteenth century , there were close to a hundred houses .'], ['As might be expected , girls in this situation bleed very little and perhaps not at all in the process of losing their virginity .'], [""It was the first time we've been ahead this season ( when John Richey kicked what proved to be the winning field goal ) '' .""], ['We are tempted to blame others for our problems rather than look them straight in the face and realize they are of our own making and possible of solution only by ourselves with the help of desperately needed , enlightened , competent leaders .']]","[[-0.1502024233341217], [-0.10012015700340271], [-4.99458983540535e-05], [0.09994455426931381], [0.19959993660449982], [0.3648782968521118]]",96.2269515991211,96.2269515991211,"[90.53865814208984, 87.01957702636719, 95.29290008544922, 95.41967010498047, 88.01427459716797, 86.43976593017578]",108.0985107421875,"[103.05594635009766, 108.14718627929688, 108.15027618408203, 106.52281951904297, 91.2461929321289, 92.82516479492188]"
8,"Now, thanks to longitudinal studies of thousands of couples and emerging research on previously understudied partnerships, one answer is becoming more apparent: Why some couples stick together isn't so much a coin toss as a science.","[['He was passing through town and phoned to say hello .'], ['The poem does not distort the syntax of ordinary speech nor draw on exotic sources of diction , yet it is obviously not ordinary speech -- only Hardy would say `` a grin of bitterness swept thereby ; ;'], ['For further information , contact the Bank for Cooperatives serving the region , or the Farm Credit Administration , Research and Information Division , Washington 25 , D.C. .'], ['( Several times recently I have wondered whether shows were being staged for the sake of the script or just to entertain the audience with the spectacle of scenery being shifted right in front of their eyes .'], [""So when textbooks , like that of Baker set out drawings of the ' Ptolemaic System ' , complete with earth in the center and the seven heavenly bodies epicyclically arranged on their several deferents , we have nothing but a misleading 20th-century idea of what never existed historically .""], ['Into the texture of this tapestry of history and human drama Henrietta , as every artist delights to do , wove strands of her own intuitive insights into human nature and -- especially in the remarkable story of the attraction and conflict between two so disparate and fervent characters as this pair -- into the relations of men and women : `` In their relations , she was the giver and he the receiver , nay the demander .']]","[[-0.15886548161506653], [-0.10042119026184082], [-3.4339725971221924e-05], [0.09998225420713425], [0.19976450502872467], [0.38597893714904785]]",501.81768798828125,501.81768798828125,"[549.3681640625, 539.6641235351562, 456.86993408203125, 499.06915283203125, 442.97296142578125, 525.2774047851562]",380.55377197265625,"[395.1823425292969, 468.938720703125, 358.9866027832031, 400.409912109375, 367.09375, 400.3179016113281]"
9,"""Today, we have a pretty good idea of what's likely to make for a good marriage,"" says Stony Brook University researcher Arthur Aron, PhD.","[['I stood up and began pacing .'], [""They have not been friendly for years '' .""], ['his hospital and doctor bills had been large and his income had been cut until he was receiving little except small rentals on some properties he still owned .'], [""The civilizational crisis , the third type of change raises the question `` what are we to do '' ? ?""], ['I saw Sedgwick often before his death at ninety-five , -- he had remarried at the age of ninety , -- and he asked me , when once I returned from Rome , if I knew the Cavallinis in the church of St. Cecilia in Trastevere .'], ['Arthur Hays Sulzberger has been a distinguished publisher of this distinguished newspaper and it is fitting that we take due notice of his major contribution to American journalism on the occasion of his retirement .']]","[[-0.15997469425201416], [-0.10002338886260986], [-1.4044344425201416e-05], [0.09994002431631088], [0.19983920454978943], [0.3628639876842499]]",61.03892135620117,61.03892135620117,"[59.80379867553711, 61.72727966308594, 67.74080657958984, 60.27414321899414, 63.57966232299805, 58.36640548706055]",49.10096740722656,"[47.229034423828125, 47.82551193237305, 53.85892868041992, 49.0637092590332, 50.75225067138672, 48.82181930541992]"
72,"Couples' communication patterns proved to be more predictive of divorce than their reported levels of commitment, personality assessments and stress (, 2012).","[['This work will cover the most serious one-fourth of all land needing such treatment , and will consist of burning 250,000 acres of highly hazardous debris concentration , felling snags on 350,000 acres of high lightning-occurrence areas , prescribed burning on 3.5 million acres , removing roadside fuel on 39,000 acres , and clearing and maintaining 11,000 miles of firebreaks .'], [""Compress the assembly when you make the mark to show the location for `` B '' .""], ['-- Surrounding pioneer pastors with vocational volunteers ( laymen , who will be urged to move into the area of new churches in the interest of lending their support to the new project ) .'], ['The crisis later on when debts seemed about to overwhelm me .'], [""The case histories provide some interesting illustrations of ideological diffusion , embodied in the unwed mother's inability to identify independently a given value system or behavior pattern , , and her subsequent disinclination to assume any individual responsibility for her sexual behavior .""], ['Stars throughout the volume denote dates of marriages during the past year .']]","[[-0.16170841455459595], [-0.10005342960357666], [-3.890693187713623e-05], [0.0999390035867691], [0.19930854439735413], [0.4162563383579254]]",211.8409881591797,211.8409881591797,"[257.94793701171875, 233.4754180908203, 201.24757385253906, 218.950439453125, 196.69837951660156, 212.4563446044922]",139.5577392578125,"[175.61956787109375, 144.06387329101562, 140.79281616210938, 139.520751953125, 148.4667510986328, 136.728515625]"
73,"In the Early Years of Marriage Project, Orbuch also found that good communication set the happiest of couples apart from the less blissful.","[['The funds would be used for equipment , not for land , buildings , or operation .'], ['A meteor could fall on San Francisco .'], [""It's quite a big one '' , he added .""], ['Family loyalties and cooperative work have been unbroken for generations .'], ['The newer party campaigned heavily , while the older , more confident party expected the Moroccan merchants and small businessmen to support them as they had done for many years .'], ['that aside from due notification of certain major events in their lives ( two marriages , two births , one divorce ) , Christmas and Easter cards of the traditional sort had been the only thin link she had with them through the widowed years .']]","[[-0.15208321809768677], [-0.10011829435825348], [-4.863366484642029e-06], [0.09996268153190613], [0.19992874562740326], [0.3960907757282257]]",127.29163360595703,127.29163360595703,"[143.06373596191406, 148.41775512695312, 129.93679809570312, 112.83858489990234, 134.48670959472656, 106.49077606201172]",103.32057189941406,"[109.56995391845703, 105.08142852783203, 99.59784698486328, 104.61317443847656, 107.47666931152344, 99.36066436767578]"
