target_idx,target_sent,sents_intrp_all_bins,sim_intrp_all_bins,base_PPL,local_unintrp_PPL,local_intrp_PPL_all_bins,global_unintrp_PPL,global_intrp_PPL_all_bins,base_entropy,local_unintrp_entropy,local_intrp_entropy_all_bins,global_unintrp_entropy,global_intrp_entropy_all_bins
20,"A 2009 report from the University of Virginia's National Marriage Project, for example, showed that couples with no assets are 70 percent more likely to divorce within three years than couples with $10,000 in assets.","[['The sounds of an animal in rage and despair .'], ['Study surface of clay for defects or desired corrections .'], ['There were no witch burnings here because everyone had a witch in the family .'], ['It is curious that at its best , the work of this school of painting -- Mark Rothko , Jackson Pollock , Clyfford Still , Robert Motherwell , Willem De-Kooning , and the rest -- resembles nothing so much as the passage painting of quite unimpressive painters : the mother-of-pearl shimmer in the background of a Henry McFee , itself a formula derived from Renoir ; ;'], ['The Government of India shall maintain or cause to be maintained books and records adequate to identify the goods and services financed for agreed projects pursuant to paragraphs 1 ( B ) and 1 ( C ) of Article 2 , of the Agreement , to disclose the use thereof in the projects and to record the progress of the projects ( including the cost thereof ) .'], [""`` A marriage can survive almost any kind of stress except an open and direct challenge to the husband's maleness '' , declares Dr. Calderone .""]]","[[-0.15991607308387756], [-0.10148172080516815], [-0.00015992019325494766], [0.09926903247833252], [0.1954648345708847], [0.29133862257003784]]",110.26679229736328,110.26679229736328,"[112.01957702636719, 99.17326354980469, 108.40078735351562, 158.13368225097656, 97.71257781982422, 94.51607513427734]",82.0260009765625,"[85.65399932861328, 82.93885803222656, 86.58423614501953, 107.26367950439453, 85.20574188232422, 87.63289642333984]",3.5500829219818115,3.5500829219818115,"[3.5795352458953857, 3.4413654804229736, 3.465533971786499, 3.5798535346984863, 3.5521023273468018, 3.5812995433807373]",3.321218252182007,"[3.4350693225860596, 3.2887356281280518, 3.306211233139038, 3.5439860820770264, 3.435697317123413, 3.447307586669922]"
27,"In one 2012 study, graduate student April Buck, PhD, and social psychologist Lisa Neff, PhD, from the University of Texas at Austin, evaluated diaries of 165 newlywed couples.","[['The big tanks were at the site but still sunning themselves .'], ['As mentioned , the allocation of AM stations represents a balance between protection against interference and the provision of opportunity for an adequate number of stations .'], [""`` Pulley Bey insisted that she bestow her favors on him '' , the friend continued .""], ['No group can contribute more to the success of the program than the editors and publishers of the Inter-American Press Association .'], ['He took a midnight train out of Cleveland Saturday , without an official word to anybody , and has stayed away from newsmen on his train trip across the nation to Reno , Nev. , where his wife , former Olympic Diving Champion Zoe Ann Olsen , awaited .'], [""Thus , the writer decided to hold one experimental section of the functional preparation for marriage course in the spring semester of 1960 exclusively for persons already married -- that is , prerequisite : `` marriage '' .""]]","[[-0.15755833685398102], [-0.1017477959394455], [-0.00028906576335430145], [0.09953590482473373], [0.1934647560119629], [0.29159942269325256]]",35.537540435791016,35.537540435791016,"[32.136966705322266, 32.18232727050781, 32.981605529785156, 30.659223556518555, 35.70826721191406, 30.09792137145996]",28.218067169189453,"[27.595531463623047, 30.059001922607422, 28.297391891479492, 28.22355079650879, 31.364360809326172, 28.382383346557617]",3.302138090133667,3.302138090133667,"[3.193547248840332, 3.3592255115509033, 3.27341365814209, 3.205726385116577, 3.06546688079834, 3.318734884262085]",3.2042219638824463,"[3.2440011501312256, 3.2862048149108887, 3.2998437881469727, 3.2379066944122314, 3.0199294090270996, 3.2989745140075684]"
86,But feeling supported during negative events was inconsistently — and sometimes even negatively — linked to similar good feelings.,"[[""`` If you can keep her here that long '' , Pete said wryly .""], ['A reporter who consulted a Middle East Information officer for routine vital statistics got nowhere until the State Department man produced from his bottom desk drawer a brochure published by the Arabian-American Oil Company .'], [""`` We misjudged you '' , he said slowly .""], ['sometimes he would be up before dawn , clad as a garbage collector and hurling pails into areaways to exasperate us , and thereafter would hurry to the Bronx Zoo to grimace at the lions and press cigar butts against their paws .'], [""Unconcerned , indifferent , unmotivated , the forest was simply there -- fighting man's depredations with more abundant growth and man's follies with its own musical evening laughter .""], ['He chooses to subordinate one to the other , sometimes reluctantly , accepting criticism for the lesser immoralities facts breed .']]","[[-0.1658918410539627], [-0.10122472047805786], [-0.000421673059463501], [0.09943372756242752], [0.19628199934959412], [0.29885172843933105]]",501.0337219238281,501.0337219238281,"[511.6119689941406, 615.4503173828125, 520.6561279296875, 694.8333740234375, 460.9613037109375, 659.81787109375]",363.9578552246094,"[371.9462585449219, 435.5043029785156, 361.55279541015625, 423.770263671875, 333.8132629394531, 442.44183349609375]",4.157018661499023,4.157018661499023,"[4.2941484451293945, 4.049180507659912, 4.389316558837891, 4.124110221862793, 4.320035457611084, 4.025320053100586]",4.412327289581299,"[4.490128517150879, 4.407413482666016, 4.582309246063232, 4.274938106536865, 4.4533820152282715, 4.385617733001709]"
91,"In the Early Years of Marriage Project, she and her colleagues, including Aron, found that couples reporting boredom in the seventh year of marriage were significantly less likely to be satisfied with the relationship by their 16th anniversary (, 2009).","[['We should stand firmly and courageously for our right to free access into Berlin .'], [""Now you go outside and beckon me when it's safe '' .""], ['I have a hunch Marv Breeding might move up a notch .'], ['The Rev. Richard Freeman of Texas City officiated and Charles Pabor and Mrs. Marvin Hand presented music .'], ['Mrs. Oliver is mother of five children and wife of a machinist .'], ['Of course On Thursday , Haney mailed the monthly check for separate maintenance to his wife Lolly , and wished the stranger could do something about her']]","[[-0.16874507069587708], [-0.10155519843101501], [-0.0003999043256044388], [0.0993000939488411], [0.19574403762817383], [0.3246247470378876]]",74.61945343017578,74.61945343017578,"[85.2010269165039, 81.47496032714844, 90.02597045898438, 81.56778717041016, 73.42760467529297, 80.87627410888672]",81.12361907958984,"[81.59828186035156, 85.81069946289062, 88.17305755615234, 82.0948715209961, 70.94278717041016, 89.04092407226562]",3.6707041263580322,3.6707041263580322,"[3.721651792526245, 3.802644968032837, 3.838815450668335, 3.5794785022735596, 3.5797338485717773, 3.7197957038879395]",3.9765284061431885,"[3.955679178237915, 3.978484630584717, 4.0412726402282715, 3.8463759422302246, 3.901271104812622, 3.90356707572937]"
102,Know that love's not enough.,"[['She arrived late and as she entered the party , noted that gentlemen seemed to be in the majority ; ;'], ['the halls were empty and they passed down the stairs to number nine and listened at the door .'], ['The dust-thick saliva came from his mouth like balled cotton .'], [""Mr. Hawksley , the state's general treasurer , has been a part-time CD director in the city for the last nine years .""], ['Why should I be spinning just because the goddamn log is spinning ? ?'], ['and it should be far better known than it is .']]","[[-0.19226044416427612], [-0.10126268863677979], [-0.000346197746694088], [0.09920065104961395], [0.19551390409469604], [0.3276352882385254]]",332.8218078613281,332.8218078613281,"[264.7103271484375, 1022.3070678710938, 1262.6708984375, 1038.5396728515625, 224.96612548828125, 599.6339111328125]",434.3404541015625,"[276.8031921386719, 608.8799438476562, 555.4027709960938, 470.2367858886719, 203.5552520751953, 502.41888427734375]",4.732029914855957,4.732029914855957,"[4.887575626373291, 4.685760498046875, 4.886351108551025, 4.443840980529785, 5.0084452629089355, 4.754786491394043]",4.840134620666504,"[5.011780738830566, 4.9388604164123535, 5.078778266906738, 4.726757049560547, 4.859010696411133, 4.7462077140808105]"
