target_idx,target_sent,sents_intrp_all_bins,sim_intrp_all_bins,base_PPL,local_unintrp_PPL,local_intrp_PPL_all_bins,global_unintrp_PPL,global_intrp_PPL_all_bins,base_entropy,local_unintrp_entropy,local_intrp_entropy_all_bins,global_unintrp_entropy,global_intrp_entropy_all_bins
44,"Men's feet, on the other hand, did not have such predictive powers — they were more likely to be cold in the first place (Journal of Family Psychology, 2012).","[['The Secretary of the Treasury is authorized and directed to cover into -- ( 1 )'], ['And the pay , of course , will be nil .'], ['For this purpose a degree of intellectual and emotional involvement is necessary ; ;'], ['The child in the primary grades can play harmoniously with one companion , but his desire to be first in everything gets him into trouble when the group gets larger ; ;'], [""But one night Dookiyoon moved in the direction of the women's lodge , where Shades of Night had gone to purify herself .""], ['Not only do these quacks assume impressive titles , but represent themselves as being associated with various scientific or impressive foundations -- foundations which often have little more than a letterhead existence .']]","[[-0.1616583913564682], [-0.1029491126537323], [-0.0007418021559715271], [0.09930577874183655], [0.1968478262424469], [0.2806788980960846]]",61.292842864990234,61.292842864990234,"[74.46792602539062, 57.83528518676758, 57.3126335144043, 53.86678695678711, 57.91139602661133, 52.10240173339844]",40.92763900756836,"[52.140201568603516, 41.14480972290039, 44.68414306640625, 45.61550521850586, 39.25687789916992, 43.37245178222656]",4.008970260620117,4.008970260620117,"[4.081270694732666, 3.8947041034698486, 3.98089861869812, 3.872939348220825, 3.7728631496429443, 3.8253047466278076]",3.495105743408203,"[3.8278541564941406, 3.5226805210113525, 3.5532355308532715, 3.601808786392212, 3.628978729248047, 3.487514019012451]"
58,"Men seem to need these affirmations most, Orbuch's analysis suggests.","[['In the South , after the first year of the war , paper and ink were very poor .'], ['You should be prepared to stay in your shelter full time for at least several days and to make it your home for 14 days or longer .'], ['Albert ( 1949 ) has concluded that the most active preparations of TSH made during this period , from 1931 to 1945 , were probably about 100 to 300 times as potent as the starting material .'], [""The working test of `` the facts '' must always be the best available description obtainable from scholars and scientists who have applied their methods of investigation to relevant situations .""], ['When prepositional complements are divided as in what are you looking for ? ?'], ['To some extent the personal inadequacies that prejudices attempt to compensate for are to be found in all of us .']]","[[-0.18796893954277039], [-0.10121869295835495], [-0.0007079839706420898], [0.09885608404874802], [0.1950121819972992], [0.27142104506492615]]",360.791748046875,360.791748046875,"[467.6986999511719, 336.4716491699219, 371.3044128417969, 345.6875305175781, 278.8677673339844, 324.1119079589844]",216.7139129638672,"[243.85025024414062, 254.56214904785156, 213.5264892578125, 236.18722534179688, 228.1285400390625, 205.7979278564453]",4.385313987731934,4.385313987731934,"[4.408936023712158, 4.581419944763184, 4.1648759841918945, 4.368921756744385, 4.647824764251709, 4.481812477111816]",4.302912712097168,"[4.422370910644531, 4.4141364097595215, 4.090135097503662, 4.106710433959961, 4.408889293670654, 4.313429355621338]"
77,It also matters what you talk about.,"[['In my day the first requirement for a cop was to look like the law , big and tough .'], ['United Nations Day proclamation by John A. Notte , Jr. , governor'], ['Broil or toast as usual .'], ['`` Facing us , two flights up .'], ['De Revolutionibus is not just a collection of facts and techniques .'], ['But do the plays deal with the same facets of experience religion must also deal with ? ?']]","[[-0.19178947806358337], [-0.10106642544269562], [-0.0005185725167393684], [0.09800869226455688], [0.19128763675689697], [0.26964759826660156]]",140.61489868164062,140.61489868164062,"[67.49530792236328, 393.4061584472656, 130.67982482910156, 143.27529907226562, 102.94573974609375, 74.01818084716797]",118.63544464111328,"[60.422080993652344, 275.0493469238281, 145.17828369140625, 148.67459106445312, 112.94560241699219, 94.72199249267578]",3.9498260021209717,3.9498260021209717,"[3.944777727127075, 3.715050220489502, 4.05936336517334, 3.977964401245117, 3.9185094833374023, 4.0532546043396]",4.023501873016357,"[4.025158882141113, 4.032169342041016, 4.033444404602051, 3.9953370094299316, 3.930514335632324, 3.9072580337524414]"
87,The researchers explain that finding by comparing it to a fire alarm: Testing the alarm to find it works makes you happier and more satisfied than discovering it works because there is a fire.,"[['Mr. and Mrs. Phil G. Abell are chairmen for the Saledo trip .'], ['This Europeanization of the law was made explicit by a number of 19th century scholars .'], [""When the hay wagon had gone , and an interval passed , a huckster's cart might turn the corner .""], ['Practically all the people of Laos , he explained -- about two million of them -- are rice farmers , and the means and motives of modern war are as strange to them as clocks and steel plows .'], [""The word `` binomial '' means `` of two names '' or `` of two terms '' , and both usages apply in our work : the first to the names of the two outcomes of a binomial trial , and the second to the terms P and Af that represent the probabilities of `` success '' and `` failure '' .""], ['The benefits electronics can bring to bio-medicine may be greater by far than any previous medical discovery .']]","[[-0.16664864122867584], [-0.10208891332149506], [-0.000670943409204483], [0.09907960891723633], [0.1948690414428711], [0.26753148436546326]]",278.2998962402344,278.2998962402344,"[270.7257080078125, 269.0743713378906, 316.77117919921875, 242.22653198242188, 350.0378723144531, 259.4231872558594]",296.5513000488281,"[274.32293701171875, 286.5068664550781, 260.0970153808594, 239.40907287597656, 350.5777282714844, 270.75579833984375]",4.210339069366455,4.210339069366455,"[4.138198375701904, 4.265806198120117, 4.075562477111816, 4.387266635894775, 4.13920783996582, 4.23452615737915]",4.334873676300049,"[4.274411678314209, 4.301973819732666, 4.233998775482178, 4.410078525543213, 4.151233196258545, 4.265015602111816]"
106,If you're an artist you take workshops.,"[['By 1898 , rustling losses had been driven down to the lowest level ever seen in Wyoming .'], ['The sharp wind slapped at him and his feet felt like ice as the snow penetrated the holes of his shoes , his only ones , now patched with folded parchment .'], ['Since emotional reactions in the higher vertebrates depend on individual experience and are aroused in man , in addition , by complex symbols , one would expect that the hypothalamus could be excited from the cortex .'], [""Obviously Sloan's early years were influenced by his close friend Robert Henri .""], [""But you aren't exactly the model of a surveyor , you know .""], [""If you're a good ballplayer , you've got to get mad .""]]","[[-0.17280547320842743], [-0.10198282450437546], [-0.0004961867816746235], [0.09793805330991745], [0.18277786672115326], [0.23603001236915588]]",197.6966094970703,197.6966094970703,"[428.3958435058594, 371.6758728027344, 242.21266174316406, 273.40447998046875, 92.8759994506836, 72.95164489746094]",69.97632598876953,"[235.94937133789062, 126.10877227783203, 225.9261016845703, 158.24171447753906, 78.2364730834961, 65.72840118408203]",4.201407432556152,4.201407432556152,"[4.101626873016357, 4.236703872680664, 4.166810035705566, 4.101879119873047, 3.9670283794403076, 3.7038414478302]",3.716923952102661,"[4.122150897979736, 4.224256992340088, 4.16538667678833, 4.1572723388671875, 3.7470407485961914, 3.5201661586761475]"
