target_idx,target_sent,sents_intrp_all_bins,sim_intrp_all_bins,base_PPL,unintrp_PPL,intrp_PPL_all_bins
315,"“What do you mean, David?","[['She played with style and a touch of the grand manner , and every piece she performed was especially effective in its closing measures .'], ['Eight or ten years ago , a couple of French hoods stole a priceless Khmer head from the Musee Guimet , in Paris , and a week later crawled into the Salpetriere with unmistakable symptoms of leprosy .'], [""Apparently , Jouvet and Ledoux attempted just these dissimilar approaches in the role of Arnolphe in `` The School For Wives '' .""], ['It is but justice to Mr. Steele for us to add that , in the above remarks , nothing is intended to his disparagement , either as a lawyer or as a printer .'], ['And then Castro himself did come , bearded , smiling ; ;'], [""`` I mean , do you feel like seeing Kate '' ? ?""]]","[[-0.16323615610599518], [-0.10165718197822571], [-0.00042617321014404297], [0.0994730144739151], [0.19487261772155762], [0.24591349065303802]]",198.9566650390625,161.99436950683594,"[186.64706420898438, 193.5628204345703, 200.9962158203125, 182.9236297607422, 163.30836486816406, 122.82352447509766]"
324,“I love working for Luigi.”,"[['It will be painful , but interesting , to see what kind of a god these people will create or what strong convictions they will develop .'], [""Through the efforts of SAAMI's shooting development program these shooting activities , and many others , including assists in the development of public and privately financed shooting parks , trap and skeet leagues , rifle and pistol marksmanship programs have been promoted , to mention only a few .""], ['Almost surely he did ; ;'], ['( But that is another story .'], [""I won't be guilty of trying to run his life '' .""], ['I used a Homemaster Routo-Jig made by Porter Cable for this job .']]","[[-0.18037858605384827], [-0.10133858025074005], [-0.000521097332239151], [0.09925703704357147], [0.19478434324264526], [0.24204489588737488]]",364.7804870605469,382.0740051269531,"[332.16241455078125, 341.94439697265625, 391.7033386230469, 283.29498291015625, 255.4124298095703, 361.1742248535156]"
268,"It had started raining again, which was usually a good omen for her.","[['The visceral brain as well as the neocortex is known to contribute to memory , but this topic is beyond the scope of this paper .'], ['Mr. and Mrs. Phil G. Abell are chairmen for the Saledo trip .'], ['We have considered several of your professionals because they were lamechians and above suspicion .'], ['He considered opening a can of beer but vetoed that idea too .'], [""One woman -- she could have been either English or American -- went up to him and said , ' But you are the foreigners ' '' .""], ['He said , turning on what was meant to be charm .']]","[[-0.1709660440683365], [-0.10260676592588425], [-0.0006414800882339478], [0.09909181296825409], [0.1986166536808014], [0.3476853370666504]]",159.41604614257812,122.96575164794922,"[139.15432739257812, 140.87998962402344, 122.47782135009766, 129.26992797851562, 116.92389678955078, 125.71941375732422]"
108,"If I had known that you were Luigi’s PA and the woman that Myra has been trying to introduce me to for the past three years, our meeting Saturday morning would have ended differently, but you and I were too busy butting heads about the phone call.”","[[""`` But in such a slovenly condition '' .""], ['What they are after is the beatific vision .'], ['Fury has made a few mistakes but looks like a wonderful prospect , with his impressive gait and stride which certainly make him cover the ground .'], ['This habit had become so fixed over the years that it seemed futile to do anything for which no one was waiting .'], ['If we were asked why we thought so , we should say that these things involve great evil and are wrong , and that to take delight in what is evil or wrong is plainly unfitting .'], ['Lizzie stated during the inquest that while her father and uncle were in the sitting room the afternoon before the murders , she had been disturbed by their voices and had closed her door , even though it was a very hot day .']]","[[-0.158792644739151], [-0.10374189913272858], [-0.0004221731796860695], [0.09935157746076584], [0.19827452301979065], [0.3315108120441437]]",125.62635040283203,103.23295593261719,"[104.42493438720703, 103.39922332763672, 103.36368560791016, 101.71320343017578, 104.57701873779297, 110.44354248046875]"
217,"“I’m serious, Tess.","[['She was no schoolgirl , refusing to bear tales .'], ['The years , if they were years , went by .'], [""This is not only a compliment to Mijbil , of whom there are a fine series of photographs and drawings in the book , but to the author who has catalogued the saga of a frightened otter cub's journey by plane from Iraq to London , then by train ( where he lay curled in the wash basin playing with the water tap ) to Camusfearna , with affectionate detail .""], ['Codification was followed in all countries by a growing amount of legislation , some changing and adjusting the older law , much dealing with entirely new situations .'], [""`` But that was war '' , I said .""], ['`` I tell people what I think .']]","[[-0.16138675808906555], [-0.10194309055805206], [-0.00036889128386974335], [0.09898141026496887], [0.191217839717865], [0.33233869075775146]]",229.99102783203125,245.72694396972656,"[266.7812805175781, 274.2379150390625, 326.4118347167969, 257.2307434082031, 158.29151916503906, 152.03805541992188]"
