target_idx,target_sent,sents_intrp_all_bins,sim_intrp_all_bins,base_PPL,unintrp_PPL,intrp_PPL_all_bins
330,Arrogant Boor.,"[['he had been at the Dumont for almost a week .'], [""Determine the particular State's `` Federal Share '' .""], ['In her grim pursuit of tranquillity , Pamela focused her thoughts on her husband .'], ['Far up the valley I could see the Rees circling and reorganizing .'], [""We therefore leave the writer to the enjoyment of the unenvied reputation which the personal abuse he has heaped on us will entitle him to from the low and vulgar herd to which he belongs '' .""], ['To be passive , to be girlishly shy was palpably absurd .']]","[[-0.14352919161319733], [-0.10091301798820496], [-0.000187666155397892], [0.0996987372636795], [0.198866069316864], [0.2781582176685333]]",528.862548828125,1910.2808837890625,"[1650.2425537109375, 930.1787109375, 1850.40625, 1131.1866455078125, 500.8941955566406, 1024.737060546875]"
326,“What’s he like?”,"[['These local variations were to become ever sharper in the next century and a half .'], ['These public efforts were rare because Mr. Rayburn normally did his counseling , persuading and educating long before an issue reached its test on the House floor .'], [""Once again B'dikkat moved among them like a father ; ;""], ['`` Left mine many a time , only she never knew it .'], ['What are the existing recreation features ? ?'], ['What was it to Prokofieff ? ?']]","[[-0.16021016240119934], [-0.10054729133844376], [-0.00017264485359191895], [0.0997006893157959], [0.19921420514583588], [0.4108293652534485]]",275.9225158691406,240.67559814453125,"[316.5176696777344, 299.39324951171875, 232.99264526367188, 321.77203369140625, 240.5055694580078, 238.65374755859375]"
261,We were helping her get moved into her new apartment because she had Saturday classes.”,"[['Otherwise it will be headed for bankruptcy , at worst , and at best towards starvation of other less dramatic but socially and culturally indispensable branches of learning .'], ['For , unlike the Sioux and the Crows , the Aricaras are not great horsemen , nor are they aggressive like the savage Blackfeet .'], ['Alas , so it almost proved for us , too .'], ['Over in Barre the streets had been deep in swirling water , and bridges were crumpled and gone .'], ['This included Mamma , jolly , generous , and pretty , with whom they all fell in love , just as Papa had first fallen in love with her Mamma before he chose her ; ;'], [""Helva's class was doing Fine Arts , a selective subject in her crowded program .""]]","[[-0.163495272397995], [-0.10065481811761856], [-0.0002311086282134056], [0.09968414902687073], [0.19901502132415771], [0.36248779296875]]",249.82650756835938,135.9520263671875,"[146.5620880126953, 173.949462890625, 134.12213134765625, 136.68145751953125, 134.17086791992188, 124.38711547851562]"
311,I’ll give you time to get to know me after we have gotten married.”,"[['Does it attack other traditional American institutions with unsupportable and wild charges ? ?'], ['Often one floodlight high in a tree will provide all the light you need at much less expense .'], [""No doubt , there was still a lot in the Draft Program -- and in Khrushchev's speech -- which left many points obscure .""], ['They poured through the opening in the valley , then spread out in a long line to come at us , brandishing their lances and filling the morning with their spine-chilling scalp cry .'], [""I am with you , of course , Tomas '' .""], ['`` And I am not sure that I have any cash -- any money , that is -- but if you will wait just a minute I will write you out a check if I can find my checkbook .']]","[[-0.1719597578048706], [-0.10045650601387024], [-0.00019375141710042953], [0.09944599866867065], [0.19728872179985046], [0.3598000407218933]]",119.73445129394531,63.720672607421875,"[74.8189468383789, 72.43807220458984, 75.31645965576172, 81.36361694335938, 66.85054016113281, 69.99441528320312]"
283,"I don’t believe in divorces either, so when you marry me, it is forever.”","[['What sets Negro-appeal programing apart from other radio shows ? ?'], ['The new year might see some house-cleaning , either genuine or token , depending upon developments , to give Davis an opportunity to combat some of these criticisms .'], ['This is specified by a distribution function Af such that the probability that Af lies in some region D of the stage space is Af .'], [""As for this rider , I never saw him before or afterwards and never saw him dismounted , so whether he stood tall or short in his shoes , I can't say ; ;""], ['You might try looking into his wife too .'], [""Seven years they'd been married .""]]","[[-0.1496870517730713], [-0.10065095126628876], [-0.00018394365906715393], [0.09983482956886292], [0.19782501459121704], [0.37121647596359253]]",162.49136352539062,87.56008911132812,"[97.01284790039062, 96.16503143310547, 101.792236328125, 97.12708282470703, 85.635009765625, 86.8503646850586]"
