target_idx,target_sent,sents_intrp_all_bins,sim_intrp_all_bins,base_PPL,unintrp_PPL,intrp_PPL_all_bins
13,"Several demographic factors predict how well a marriage might fare, according to NCHS data.","[['Hearst had spent more than $60,000 of his own money in the probe , but still Attorney General Knox was quiescent .'], [""There is no such thing as an `` emergency telephone building fund drive '' .""], [""The board will be able to increase , decrease , add or eliminate budget items , subject to the Mayor's veto ; ;""], [""others suggest its coming loss or describe the poet's feelings when he learns of a final separation .""], ['Historians have had two reasons for persisting so long in their investigations .'], ['It will be painful , but interesting , to see what kind of a god these people will create or what strong convictions they will develop .']]","[[-0.168366938829422], [-0.10037270188331604], [-5.356781184673309e-05], [0.09968096762895584], [0.19834408164024353], [0.33080974221229553]]",250.40518188476562,191.8363800048828,"[189.508056640625, 196.2705078125, 157.5867462158203, 226.4468231201172, 165.4244842529297, 191.88258361816406]"
12,"One is ethnicity: Asian women and foreign-born Hispanic men, for example, have the highest chance of the demographic groups studied that their marriages will last 20 years (70 percent), while black women have the lowest rate of reaching the two-decade mark (37 percent).","[['In privacy he could walk around , leave the light on , read .'], ['As Littlepage noted : `` A complete picture of Prince Potemkin may be had in his 1788 operations .'], ['In some areas , the progress is slower than in others .'], [""Huff's attorney , Antone F. Gregorio , quoted his client as saying that part of the embezzlement represented money paid to Huff , as attorney for the loan association , in satisfaction of mechanic's liens on property on which the association held mortgages .""], ['That mother hen of the weight-height tables , the Metropolitan Life Insurance Co. , clucks that 48 million Americans are overweight .'], ['A study of major denominational membership statistics over a twenty-year period revealed the appalling fact that nearly 40 per cent of those who joined the Church were lost to the Church within seven years .']]","[[-0.15335474908351898], [-0.10024280101060867], [-1.124013215303421e-05], [0.09976479411125183], [0.19783294200897217], [0.3089110255241394]]",87.73579406738281,69.32454681396484,"[62.192222595214844, 67.61717224121094, 70.84022521972656, 64.60535430908203, 66.08950805664062, 65.88162231445312]"
77,"For white men and women as well as black men, the chances are just more than 50 percent, NCHS reports.","[['Meanwhile spring had passed well into summer .'], ['her arms were straining with a burden of dolls .'], ['He could move very quickly , she knew ( although he seldom found occasion to do so ) , but he was more wiry than truly strong .'], ['-- About 30% of the expenditures for the Department of Defense in 1961 are for military personnel costs , including pay for active , reserve , and retired military personnel .'], ['But I am here concerned more with policy than with men .'], ['What happened is that Negroes want to be treated like men .']]","[[-0.16107259690761566], [-0.10012523829936981], [-8.465535938739777e-05], [0.09976984560489655], [0.198515385389328], [0.3086177110671997]]",67.84854888916016,55.10235595703125,"[58.10997772216797, 57.8293571472168, 55.74850845336914, 52.73347854614258, 52.072486877441406, 51.0867805480957]"
14,It also matters what you talk about.,"[['She arrived late and as she entered the party , noted that gentlemen seemed to be in the majority ; ;'], [""Miami Beach and surroundings feature fabulous `` hotel row '' , palm-studded beaches plus the Miami Seaquarium and Parrot Jungle .""], ['In the Maritime provinces farther east , the tones are a little quieter .'], ['For this does not account for the integral , elemental power of that which grows with abounding vigor as the play unfolds , nor does it explain the strange numinous sense of presentness which comes over those who watch the play like a spell .'], ['This is followed by a boom in conferences .'], ['She said , `` There is nothing that concerns you here .']]","[[-0.1835145205259323], [-0.10019385814666748], [-0.00012426823377609253], [0.09935255348682404], [0.1992599070072174], [0.3453046679496765]]",168.26919555664062,106.04374694824219,"[110.36505126953125, 84.09833526611328, 100.30813598632812, 129.6558837890625, 134.31407165527344, 128.86349487304688]"
78,"""Most couples think they're communicating with one another, but what they're really talking about is what I call ‘maintaining the household,'"" she says, or detailing to-do lists and divvying up chores.","[[""This was Boniface's monumental tactlessness .""], [""Now Gavin Maxwell's Ring Of Bright Water has widened to enchant the world .""], ['Government research will look into new products and methods .'], [""Placement of these holes is not critical , but they should be located so that the centers are about 1/8'' '' from any edge .""], ['Not so obvious to her , but of more importance to her teachers , Helva ingested the precepts of her conditioning as easily as she absorbed her nutrient fluid .'], ['More typical is the case of a suburban Long Island housewife described by a marriage counselor .']]","[[-0.15599371492862701], [-0.10028868913650513], [-3.669131547212601e-05], [0.09970599412918091], [0.19984650611877441], [0.37837016582489014]]",185.82339477539062,138.05108642578125,"[157.0281524658203, 144.7147216796875, 141.69964599609375, 143.8020477294922, 162.56211853027344, 154.18734741210938]"
