target_idx,target_sent,sents_intrp_all_bins,sim_intrp_all_bins,base_PPL,unintrp_PPL,intrp_PPL_all_bins
39,"""There's a lot of stress if you're [part of] a military family, but at the same time, there are lots of things that the military is doing to try to protect you from that stress, to try to make it better,"" says Karney.","[['Christiana and Delaware would , in turn , be required to pass on the voting rights to the General Motors shares allocable to them to their own stockholders .'], ['But they do not strip .'], ['They were a little late in getting home .'], ['A contractor probably would be required to help build it .'], ['Mike do you ever get homesick ? ?'], ['-- About 30% of the expenditures for the Department of Defense in 1961 are for military personnel costs , including pay for active , reserve , and retired military personnel .']]","[[-0.14021040499210358], [-0.10187654942274094], [-0.00019403081387281418], [0.09963011741638184], [0.19768264889717102], [0.3173679709434509]]",35.697296142578125,37.73162841796875,"[39.74193572998047, 35.690093994140625, 34.09265899658203, 36.10472869873047, 33.07617950439453, 35.317115783691406]"
81,Men who didn't feel affirmed by their wives were twice as likely to divorce as those did.,"[[""'' At Veterans Memorial Auditorium .""], ['To achieve this destiny , acts as well as words are needed -- not only acts that lead to physical strength but also acts that lead to strength based on right doing and respect .'], ['It has identified itself with the very tension and terror it once did so much to alleviate .'], ['The Hotel King Arthur across the street provided almost twice as many problems .'], ['In between teratologies , she was a pretty and shapely woman ; ;'], ['Both man and wife should be aware of the fact that a lack of climax , and even the absence of the anticipated keen pleasure are not a sign that the wife may be cold or frigid .']]","[[-0.14078930020332336], [-0.10260607302188873], [-0.0002774251624941826], [0.09969256818294525], [0.19844698905944824], [0.3573713004589081]]",365.1149597167969,259.17047119140625,"[220.09361267089844, 288.2581787109375, 282.07708740234375, 220.21685791015625, 232.33364868164062, 265.5305480957031]"
59,"""The people who have stable, happy relationships are much gentler with one another than people who have unhappy relationships or break up,"" says Gottman, who's known for his ability to predict which newlyweds will divorce with more than 90 percent accuracy by observing how they communicate (, 1992).","[[""`` Well , I should find Alma '' -- I began .""], ['Its initial expenses will be paid from appropriations currently available for our foreign aid program .'], ['Whatever the reasons , Willis and Bryan started expanding Zenith .'], ['Humor found many modes of expression .'], ['It helps children grow up with at least a nodding acquaintance with the Bible .'], ['Mary was free to marry again , not knowing that the Sturch had secretly given her a divorce , thinking that death had dissolved her marriage .']]","[[-0.1668792963027954], [-0.10111735761165619], [-0.00020165834575891495], [0.09926258027553558], [0.19722038507461548], [0.3314264118671417]]",166.9019317626953,160.6322021484375,"[148.1564178466797, 165.76931762695312, 167.863037109375, 158.5095672607422, 148.62362670898438, 165.7313690185547]"
89,"Gottman calls this ""the existential area.""","[[""It doesn't really matter which month of the year you sow them , but they germinate best when they have a wide variation of temperature , very warm followed by cool in the same 24 hours .""], ['She came out pink from a hot bath , and I gave her my robe .'], ['Then he suffered him .'], ['He , too , believes in good intentions and is astounded and offended when they are not taken for the deed .'], ['and since the universe is also made of atoms , it is just a supermachine .'], [""`` You need a linguist '' ? ?""]]","[[-0.17964084446430206], [-0.10040521621704102], [-0.00023618154227733612], [0.09911755472421646], [0.19806130230426788], [0.3035520911216736]]",592.3380737304688,401.3578796386719,"[380.4924621582031, 466.9931640625, 433.0673522949219, 347.7652587890625, 373.71978759765625, 363.7641906738281]"
66,Take risks.,"[['They are putting strong pressure on their police departments to keep order .'], ['With quibs and gibes , the policemen again started digging .'], [""The previous night's horror -- the absolute failure , overcast with the intrusions of the press , had left them all with a wan sense of uselessness , of play-acting .""], [""`` Ah , you're too old '' , was invariably his ungallant and untrue retort whenever I suggested `` starting a family '' .""], ['Only when that term is ended and he is a private citizen again can he be permitted the freedom and the courage to discount the dangers of his death .'], ['I am kept from all danger by night and by day ,']]","[[-0.1649242639541626], [-0.10042597353458405], [-0.0003108195960521698], [0.09915890544652939], [0.19241727888584137], [0.26114028692245483]]",378.9347839355469,393.4290466308594,"[426.0205993652344, 754.08056640625, 648.603515625, 319.39404296875, 696.107177734375, 91.29458618164062]"
