target_idx,target_sent,sents_intrp_all_bins,sim_intrp_all_bins,base_PPL,unintrp_PPL,intrp_PPL_all_bins
377,His first thought was Beautiful!,"[['The vote still gives citizens a voice in the operation of their government and their party .'], [""Others carried pemmican from `` the Forks '' to St. Paul and goods from St. Paul to Red River , as in the summer of 1847 when one trader , Wells , transported twenty barrels of whisky to the British settlement .""], ['It was doing very well , too , having reached the center , and was pursuing its way with commendable singleness of purpose when Mr. Podger saw hazard approaching in the shape of a flashy little sports car .'], ['Try to find these Feds .'], ['The little official hung his head in shame .'], [""It's quite a big one '' , he added .""]]","[[-0.16559474170207977], [-0.10247525572776794], [-0.00032570213079452515], [0.09943855553865433], [0.19850225746631622], [0.37783968448638916]]",503.77984619140625,433.9632568359375,"[789.9354858398438, 436.9883117675781, 461.8363037109375, 382.96905517578125, 386.2584533691406, 326.98541259765625]"
242,"I’ve had a bad day starting with my doorbell being rung after I had had only three hours of sleep,” she said looking directly at David, ” then having to wait on my car that was at the repair shop, and next missing a meeting with an arrogant boor who thinks he may be God’s gift to management.","[['We write this Af .'], ['Analysis means the evaluation of subparts , the comparative ratings of parts , the comprehension of the meaning of isolated elements .'], [""In any event , the example of Acheson's trampling by the Senate did not encourage Dulles to provoke it .""], [""They range from the Soviet Embassy on Sixteenth Street , a gray shuttered pile suggesting a funeral-accessories display house , to what Congressman Rooney has called `` that monstrosity on Thirty-fourth Street '' , the modern cement-and-glass chancery of the Belgians .""], ['I saw Sedgwick often before his death at ninety-five , -- he had remarried at the age of ninety , -- and he asked me , when once I returned from Rome , if I knew the Cavallinis in the church of St. Cecilia in Trastevere .'], ['In a low voice , almost whispering , the man had asked Phil if he was happy with the way the landlord had been taken off his back .']]","[[-0.15593241155147552], [-0.10247327387332916], [-0.0005473755300045013], [0.09942896664142609], [0.1973452866077423], [0.33796316385269165]]",154.01100158691406,132.13516235351562,"[133.93072509765625, 141.0637664794922, 140.1009521484375, 143.17408752441406, 134.81776428222656, 134.6822509765625]"
40,"“What is there to talk about?” Tess asked, barely whispering, still struggling to remove herself from his arms that tightened at her every movement.","[['Sample units ( villages in rural areas , houses in cities ) were drawn systematically within these strata .'], [""Note that by Western standards this plan was `` upside down '' , as it put North at the bottom and South at the top , with the other directions correspondingly altered ; ;""], ['I also use a small electric hand-blower to dry large washes in the studio .'], [""`` I've just been talking to Dr. Michelson '' , I said .""], ['Absent-minded , subject to unexplained tears Jubal would have bet his life that if Anne were to witness the Second Coming , she would memorize date , time , personae , events , and barometric pressure without batting her calm blue eyes .'], ['He would no longer have to see that fat face , hear that whining voice']]","[[-0.15430332720279694], [-0.10217611491680145], [-0.0006295144557952881], [0.09935406595468521], [0.19801822304725647], [0.32625359296798706]]",558.676513671875,501.4194641113281,"[527.533203125, 481.5697326660156, 489.69573974609375, 550.7188720703125, 533.5963745117188, 469.5701904296875]"
302,“Thanks.,"[['If they do as well as they did in 1960 there can be no complaint .'], ['So far as I can see , there is only one way out for the positivist .'], ['The jokes and arguments grow louder until the police return ; ;'], [""Mills secured Barco's photograph from the gentleman in charge , rushed to the Hollywood police station to report the theft , and less than five minutes later , detectives with his picture in hand were on the trail of Cal Barco .""], ['All these -- potboilers or no -- provided a welcome breath of fresh air in the form of lively , colorful , unstuffy works well suited for the great out-of-doors .'], ['`` But I already have ! !']]","[[-0.14830642938613892], [-0.10326244682073593], [-0.0003071846440434456], [0.09813953191041946], [0.16541023552417755], [0.22497454285621643]]",2375.58349609375,3011.454833984375,"[3974.53662109375, 6133.00634765625, 2427.6435546875, 6533.97607421875, 5490.23486328125, 1872.001220703125]"
358,“Can we wait until Myra and the kids get back before we have the ceremony?”,"[[""The Keystone Broadcasting System's Negro network includes 360 affiliated stations , whose signals reach more than half the total U.S. Negro population .""], ['Anyway , Julia asks me to .'], ['He was pressed far back into the corner of the car on his hay sacks , the rattling and tinning of the wheels on the rails almost covering the sound of his ocarina .'], ['Several of the replies to Mr. Toynbee , without conscious resort to the traditional terminology with regard to the permission of evil , succeed in restoring the actual context in which present moral and political decisions must be made , by distinguishing between choosing a great evil and choosing in danger of this evil .'], [""Because I'm looking for the son of a bitch that killed that old man , and I'm going to get him .""], ['Although it had seemed a good reason , to begin with : no couple could afford to have children .']]","[[-0.17748206853866577], [-0.10170184820890427], [-0.0005042906850576401], [0.09922968596220016], [0.19668059051036835], [0.2810211777687073]]",126.07901763916016,134.08485412597656,"[171.532958984375, 125.84909057617188, 144.7874755859375, 160.19512939453125, 129.57473754882812, 123.00222778320312]"
