target_idx,target_sent,sents_intrp_all_bins,sim_intrp_all_bins,base_PPL,unintrp_PPL,intrp_PPL_all_bins
15,Education also plays a role.,"[['Then the flames were gone , the stillness fell upon the severe black face and Richard began to tremble violently .', 'They crept down the muddy slope toward the waiting boats .', ""When several minutes had passed and Curt hadn't emerged from the livery stable , Brenner reentered the hotel and faced Summers across the counter ."", ""Following Day was Woodbury who spoke of his disapproval of Brown's attempt at servile insurrection , his admiration of Brown's character , and his opposition to slavery .""], [""And yet Mr. Kennedy persists in trying to mollify the intransigents of the right with apologies and promises of `` tightening up '' and `` economizing '' ."", 'Except for the odd uptown sex maniac or an overeager Greek sailor , the people watch in calm absorption .', 'For he had just remembered : tonight they were having their first guests .', '-- Your July 26 editorial regarding the position of Attorney General Robert F. Kennedy on prospective tax relief for DuPont stockholders is based on an erroneous statement of fact .'], ['To have Christ dwelling through faith in your hearts .', 'His energy was gone .', 'He ran a finger down his cheek , tracing the scratch there .', ""`` I'll talk to him , all right '' .""], ['I now grok you are my people -- teach plants another way .', '`` A better position for negotiations is the real point of this speech .', 'The contraction therefore partakes of the character of a phase transition .', ""As I was playing Mother Cabrini , the picture was actually `` all mine '' , with nearly every scene built around me .""], ['The Draft Program was interesting in other respects , too .', 'I always keep a set in the car .', 'I always keep a set in the car .', 'Fourth , in the segregated school system , during the period before desegregation , how can we assure equal opportunity ? ?'], [""That's out of a play ."", ""We set up the Lloyd's Neck school , worked out its curriculum , and taught there ."", ""We set up the Lloyd's Neck school , worked out its curriculum , and taught there ."", 'In fact , in the desegregated school system which may have a good many schools with all-Negro population , how can we assure equal opportunity ? ?']]","[[-0.19101816415786743, -0.19094619154930115, -0.1903737485408783, -0.1890905797481537], [-0.10031691193580627, -0.10031033307313919, -0.10026417672634125, -0.1002587080001831], [-0.00019872933626174927, -0.00019294768571853638, -0.00015907734632492065, -0.00014411471784114838], [0.0991542786359787, 0.09916834533214569, 0.0993582010269165, 0.09935988485813141], [0.19416409730911255, 0.19424408674240112, 0.19424408674240112, 0.19480293989181519], [0.2585022747516632, 0.2625270485877991, 0.2625270485877991, 0.26771417260169983]]",101.02440643310547,54.327999114990234,"[230.49362182617188, 61.82490158081055, 76.99742126464844, 71.28075408935547, 54.0145263671875, 40.97669219970703]"
111,"Stress, for example, can cause even the strongest relationships to crumble, psychologists' research finds.","[['Retracing my steps to the Mosque of Sultan Ahmet , only one with six minarets , I entered the courtyard , with a gallery supported by pointed arches running around it and a fountain in the middle .', 'Retracing my steps to the Mosque of Sultan Ahmet , only one with six minarets , I entered the courtyard , with a gallery supported by pointed arches running around it and a fountain in the middle .', 'This system is divided into a forest highway system , administered by the Secretary of Commerce , and a forest development road and trail system , administered by the Secretary of Agriculture .', ""The Keystone Broadcasting System's Negro network includes 360 affiliated stations , whose signals reach more than half the total U.S. Negro population .""], ['The attendant waved me on .', 'For further information , contact the Bank for Cooperatives serving the region , or the Farm Credit Administration , Research and Information Division , Washington 25 , D.C. .', 'Cities and counties interested in industrial development would do well in the months ahead to keep their eyes peeled toward the 13 northwest Georgia counties that are members of the Coosa Valley Area Planning and Development Commission .', 'They start on the East side of the Schuylkill , have to cross over to the West to use the expressway and cross over again to the East at their destination .'], [""`` Get the hell out of here '' ."", 'A completely amorphous institution would be a contradiction in terms ; ;', 'Said the whining voice .', 'Said the whining voice .'], [""In the case of academic personnel the `` feeling '' of participation can hardly be `` faked '' ."", ""`` He said a fat hell on Big Hans '' ."", ""`` He said a fat hell on Big Hans '' ."", 'The combination proved quite irresistible last night .'], ['Muller was attracted to the lore of mailboxes .', 'The miserable people of China , the largest cast ever conscripted to enact an ideological passion play , cannot themselves resist overtly .', 'The miserable people of China , the largest cast ever conscripted to enact an ideological passion play , cannot themselves resist overtly .', ""He had found Curt's weakness , or what to Jess was a weakness , and was smart enough to take advantage of it .""], ['Perhaps the army will be able to maintain stability , but the vacuum of free institutions creates a great danger .', 'The stress on have , which here represents have finished reading the paper , is quite strong .', 'Final adjuncts may or may not have dominant stress .', ""A brief list of the great detective's little idiosyncrasies would provide Dr. Freud with ample food for thought .""]]","[[-0.17282941937446594, -0.17282941937446594, -0.17225083708763123, -0.17036676406860352], [-0.10049501061439514, -0.10047723352909088, -0.10046108067035675, -0.10040678083896637], [-0.00011327769607305527, -8.291658014059067e-05, -7.441546767950058e-05, -7.441546767950058e-05], [0.09957579523324966, 0.09969571977853775, 0.09969571977853775, 0.09969915449619293], [0.19653576612472534, 0.1971656233072281, 0.1971656233072281, 0.19789738953113556], [0.2953898310661316, 0.30075448751449585, 0.3020014762878418, 0.3046734929084778]]",446.54559326171875,220.7255859375,"[470.78399658203125, 287.3151550292969, 234.5851287841797, 239.34127807617188, 262.7676086425781, 199.24032592773438]"
47,Orbuch's analysis suggests the trajectory from bad to worse is likely to continue throughout the marriage and eventually to lead to divorce.,"[['In the physical sciences , these achievements concern electricity , chemistry , and atomic physics .', 'For we believed that the electrons obeyed the law of mechanics and electrodynamics ; ;', 'They had pistols in their hands .', 'So much for the prototype .'], ['They looked a good deal alike , Morgan thought .', 'Everyone who believes that Jesus is the Christ is born of God .', 'They were a little late in getting home .', 'They were a little late in getting home .'], ['In these damp circumstances , he was an odds-on bet to develop pneumonia .', ""`` I read those newspaper stories about you '' , she had said ."", 'One is not more true than the other .', ""`` Now they've gone , they didn't come back , and they didn't arrest that Dronk boy '' .""], ['Mr. Kennan takes careful account of every mitigating circumstance in recalling the historical atmosphere in which mistaken decisions were taken .', 'He succeeds Buck Shaw , who retired at the end of last season .', ""`` It is a duty '' , said Hough , `` not to let pass this opportunity of protesting against the methods of taking and printing testimony in Equity , current in this circuit ( and probably others ) , excused if not justified by the rules of the Supreme Court , especially to be found in patent causes , and flagrantly exemplified in this litigation ."", 'He might deny the latter ; ;'], ['The female parasite spends much time in her efforts to find a nest of her host .', 'Important as these differences are , they should not obscure the basic fact that by shifting the hypothalamic balance sufficiently to the parasympathetic side , we produce depressions , whereas a shift in the opposite direction causes excitatory effects and , eventually , maniclike changes .', 'The impending death of Pope', 'Then we have informed a large number of our crew that when they reach the United States , they will be punished but that in the meanwhile , they may run loose and are expected to perform their jobs in good order .'], ['Sometimes a burst of aggressiveness will sweep over a man -- or his wife -- because he or she feels age creeping up .', ""In a letter to Meynell , which was written in June , less than a month before Katie's wedding , he was highly melodramatic in his despair and once again announced his intention of returning to the life of the streets : ``"", 'More typical is the case of a suburban Long Island housewife described by a marriage counselor .', ""It's inevitable in this case , for the couple will be separated for , at the least , forty years .""]]","[[-0.14700129628181458, -0.1469157487154007, -0.1467665731906891, -0.1458148956298828], [-0.10121120512485504, -0.10098481178283691, -0.10093134641647339, -0.10093134641647339], [-0.00022011622786521912, -0.00018896162509918213, -0.00017073750495910645, -0.00017009093426167965], [0.09967704117298126, 0.09970089048147202, 0.09974595904350281, 0.09977386146783829], [0.19901788234710693, 0.19905313849449158, 0.19905723631381989, 0.19907695055007935], [0.36185887455940247, 0.3651617765426636, 0.36928030848503113, 0.383942186832428]]",128.54847717285156,91.52555847167969,"[111.40650939941406, 91.30607604980469, 103.55929565429688, 102.116943359375, 99.13137817382812, 82.40718078613281]"
70,"After a decade, the most striking difference between the couples who had divorced and the ones who stayed together was how they had handled conflict during their first year of marriage.","[['In the f-plane the coordinates of the corresponding point are Af .', 'In the f-plane the coordinates of the corresponding point are Af .', 'These are particularly suitable for regions where water or rock is close to the surface .', 'There should be a task for everyone and these tasks should be rotated .'], ['This , again , applies to Katanga .', ""`` Wait here , Neal '' , said Tilghman ."", ""Helva's civilization was not without busy , do-good associations , exploring possible inhumanities to terrestrial as well as extraterrestrial citizens ."", 'The primitive-eclogue quality of his drawings , akin to that of graffiti scratched on a cave wall , is equally well known .'], ['When he paused to moisten his throat , the stranger broke in .', 'When he paused to moisten his throat , the stranger broke in .', 'Thomas Douglas , fifth Earl of Selkirk , a noble humanitarian Scot concerned with the plight of the crofters of his native Highlands , conceived a plan to settle them in the valley of the Red River of the North .', 'He never knew just what woke him .'], ['Old Order , acted and atonally sung by Grunnfeu Arapacis , the lovely Serbantian import , then entered and delivered the well-known invocation to the god Phineoppus , whereupon the stage is quite unexpectedly visited by a company of wandering Gorshek priests , symbolizing Love , Lust , Prudence and General Motors , respectively .', 'and whenever the Lo Shu involved directional symbolism , it was oriented in this same fashion .', 'What had he thought of , to go to John , grovel and beg understanding ? ?', 'All over the country , belly clubs have never been bigger , especially in Detroit , Boston and Chicago , and even in small towns ; ;'], ['It was a session at which all the youngsters were told to express their fears , to get them out in the open where they could talk about them freely .', 'It is of interest that her menarche was somewhat later than the average for the girls in this group .', 'In my person they would always remember that last long time of me alone with her , so if they told themselves that I could have prevented it , I can understand that by now and love them still , because everyone must justify , have a scapegoat for what is not to be borne .', 'Some telephoned because he had done them a favor in the past .'], ['Mary was free to marry again , not knowing that the Sturch had secretly given her a divorce , thinking that death had dissolved her marriage .', ""A weekly newspaper reported a local romance : `` and the couple were married last Saturday , thus ending a friendship which began in their schooldays '' ."", ""A weekly newspaper reported a local romance : `` and the couple were married last Saturday , thus ending a friendship which began in their schooldays '' ."", ""A weekly newspaper reported a local romance : `` and the couple were married last Saturday , thus ending a friendship which began in their schooldays '' .""]]","[[-0.14649829268455505, -0.14649829268455505, -0.14541295170783997, -0.14541085064411163], [-0.1016092598438263, -0.1015191376209259, -0.1011873260140419, -0.10107757151126862], [-0.0001587127335369587, -0.0001587127335369587, -0.0001347362995147705, -0.00013006292283535004], [0.09977775067090988, 0.09981532394886017, 0.09987404942512512, 0.09987720102071762], [0.19831141829490662, 0.19839169085025787, 0.19861873984336853, 0.19876092672348022], [0.4176790714263916, 0.42638999223709106, 0.42638999223709106, 0.42638999223709106]]",63.396236419677734,66.15364074707031,"[87.6064453125, 74.36144256591797, 63.419822692871094, 66.94927215576172, 52.1439208984375, 57.105472564697266]"
26,"""That act of cherishing is something that some couples build.""","[['Prokofieff was guided in a consistent direction by the life of his own people -- by the compass of their national ideas .', 'A reporter who consulted a Middle East Information officer for routine vital statistics got nowhere until the State Department man produced from his bottom desk drawer a brochure published by the Arabian-American Oil Company .', ""Since I have already discussed his moral position , that discussion is incorporated by reference into the following pages , which will focus on the empirical and analytic side of Fromm's treatment ."", 'The broad conclusions of that pioneering work remain undisturbed , but subsequent research has expanded and somewhat altered their empirical support , has suggested important revisions in the general analytic frame of reference , and has sharpened the meaning of particular analytic concepts in this area .'], ['But Hoag had not stayed on the front steps when Griffith disappeared into the building .', 'Sonic , electronic , galvanic -- all blank .', 'With the rapid rate of closure , the approach from below , the side , and ahead , there would be only a moment when damage could be done .', 'The searching party consisted of the police captain , Welch , Barco , policemen with shovels , newspaper reporters , and cameramen .'], [""`` Yes , a little parkish place '' , Charlotte said , and concluded , `` Anyhow , it's all very nice ."", 'Molten glare singed their eyelids an angry crimson ; ;', ""These are grouped into sections according to the crystal system , and within each section compounds are arranged in the same order as in Groth's Chemische Krystallographie ."", 'Pat pushed through first .'], ['It would have been a good excuse for his being there at all .', ""On ships at sea , on railroad trains , in summer hotels with mountain views , they always said , `` I've never done this before '' ."", 'He injected more vitality into the score than it has revealed in many years .', ""`` How do you like it '' ? ?""], ['This is what Porter did .', 'The number of people acting as one body by this scheme gives a surprisingly large army of 55,987 men .', ""I don't ask you who 'tis you're being unfaithful to , husband or lover ."", 'The two in the bed knew each other as old people know the partners with whom they have shared the same bed for many years , and they needed to say no more .'], ['One might say it combines the man ; ;', 'It is a question which New Englanders long ago put out of their minds .', ""He didn't want us to get married ."", ""The specific analogy to the dilemma of love is the problem of the `` breakthrough '' in the realm of art .""]]","[[-0.1632501184940338, -0.16314509510993958, -0.1630716621875763, -0.1617184281349182], [-0.10106873512268066, -0.10091131925582886, -0.10070982575416565, -0.10069982707500458], [-0.00017197243869304657, -0.0001637851819396019, -0.0001483578234910965, -0.00013468973338603973], [0.09958559274673462, 0.0995880588889122, 0.09966711699962616, 0.09971501678228378], [0.19702976942062378, 0.19726330041885376, 0.1973133385181427, 0.1985800415277481], [0.27535006403923035, 0.27727386355400085, 0.281247079372406, 0.28689709305763245]]",314.0726318359375,258.8265380859375,"[399.7731018066406, 427.5660705566406, 258.26458740234375, 281.2799377441406, 293.0319519042969, 260.54400634765625]"
