target_idx,target_sent,sents_intrp_all_bins,sim_intrp_all_bins,base_PPL,unintrp_PPL,intrp_PPL_all_bins
105,"In her work with the Early Years of Marriage Project, a longitudinal study of 373 couples who married in 1986 (funded by the National Institutes of Health), Orbuch has found that seven out of 10 pairs name finances a cause of relationship trouble.","[['In her work with the Early Years of Marriage Project, Orbuch found that seven out of 10 pairs named finances as a cause of relationship trouble.']]",[[0.81044286]],88.1949691772461,77.33015441894531,[80.19918823242188]
84,"""They're kinder, they're more considerate, they soften the way they raise a complaint.""","[[""They're kind, they're more respectful, and they're a little bit softer in the way they raise a complaint.""]]",[[0.80284613]],183.23486328125,227.55923461914062,[184.8534698486328]
67,Other research suggests that supporting a spouse when times are good might go further than doing so when life goes sour.,"[['When times are good, supporting a spouse may go further than when life goes bad.']]",[[0.77283067]],426.05126953125,273.5975036621094,[247.26104736328125]
108,"If you're a lawyer, you take continuing education.","[[""You take continuing education if you're a lawyer.""]]",[[0.96486008]],115.65143585205078,49.11747360229492,[37.52970504760742]
22,"""That, to me, is just very backwards.""","[['That, to me, is very backwards.']]",[[0.95353711]],217.03834533691406,222.7162628173828,[209.38912963867188]
