target_idx,target_sent,sents_intrp_all_bins,sim_intrp_all_bins,base_PPL,unintrp_PPL,intrp_PPL_all_bins
52,"For decades, psychologists have been trying to answer the key question: What's going on when two people who once said ""I do"" to a lifetime together decide they're better off apart?","[['When two people who said ""I do"" to a lifetime together decide they\'re better off apart, psychologists have been trying to answer the question for decades.']]",[[0.90695882]],96.22677612304688,108.0979995727539,[85.63370513916016]
61,What does work?,[['What is it that works?']],[[0.66342098]],585.5951538085938,124.12664794921875,[35.25422286987305]
75,Orbuch postulates that's because women are more likely to receive such affirmations from others — a hug from a friend or a compliment from a stranger in line at the deli.,"[['According to Orbuch, women are more likely to get a hug from a friend or a compliment from a stranger in line at the deli.']]",[[0.89143836]],129.41055297851562,121.08757019042969,[110.4857406616211]
7,Talk about more than the dishes.,[['You should talk about more than the dishes.']],[[0.84927571]],442.5981750488281,1402.3951416015625,[416.02923583984375]
110,"""What makes love last is cherishing your partner and feeling lucky that you have this person in your life,"" he says.",[['He says cherishing your partner and feeling lucky that you have this person in your life are the things that make love last.']],[[0.8593955]],187.33352661132812,129.326904296875,[114.74436950683594]
