target_idx,target_sent,sents_intrp_all_bins,sim_intrp_all_bins,base_PPL,unintrp_PPL,intrp_PPL_all_bins
117," Because Sam and Ted were busy working at the apartment, David and Kohana wanted to hurry up and join them.","[['A minor child is allowed A personal exemption of $600 on his own return regardless of how much money he may earn .', 'A press with an 11 inch capacity lets you drill to the center of a 22 inch board or circle .'], ['The relative forces can be calculated from the various radii of curvature if we assume : ( A ) The surface tension is uniform on the surface of the drop .', 'He ground his teeth together .'], ['Farther south in New York there is a heavy haze of color over the Catskills in mid-October , notably along routes 23 and 23A .', 'What they meant was that there was no evidence to show that the south and east coasts of Britain received Germanic settlers conspicuously earlier than some other parts of England .'], [""But then , Mario Lanza was no common singer , and his whole career , public and non-public , was studded with the kind of unconventional happenings that terminate with the appearance of his first `` recital '' only when he has ceased to be a living voice ."", 'The miserable people of China , the largest cast ever conscripted to enact an ideological passion play , cannot themselves resist overtly .'], [""But beginning , for all practical purposes , with Frederick Seebohm's English Village Community scholars have had to reckon with a theory involving institutional and agrarian continuity between Roman and Anglo-Saxon times which is completely at odds with the reigning concept of the Anglo-Saxon invasions ."", 'The complexities of communication have been considerably abetted in this case by appropriately stilted English language that has been excellently dubbed in place of the Russian dialogue .'], ['At first Barco was evasive and shifty .', ""The Warren Telegraph stated that many of Rev. Trafton's remarks were inappropriate and savored strongly of radicalism and fanaticism .""]]","[[-0.18898946046829224, -0.18581348657608032], [-0.10330979526042938, -0.10327906906604767], [-0.00080878846347332, -0.0007724082097411156], [0.09926830977201462, 0.09928335249423981], [0.1968633532524109, 0.1968795508146286], [0.2952161431312561, 0.29763278365135193]]",27.395278930664062,21.95673370361328,"[25.485673904418945, 33.04523468017578, 25.29175567626953, 26.926349639892578, 31.88034439086914, 22.87189292907715]"
247,“Of course he did.,"[['Here again we run into the roadblock that Negroes do not like to be designated as Negroes in the press .', 'Here again we run into the roadblock that Negroes do not like to be designated as Negroes in the press .'], ['In my letters I took on a personality that differed from the self I knew in real life .', 'In my letters I took on a personality that differed from the self I knew in real life .'], [""Make sure that the metal tube through which the wire passes is in the shape of an inverted `` L '' , the foot of the `` L '' about three inches long , so that the puppet can hang directly under the light ."", 'Most of the Junkers were above the blinding light of the flares , and the radar-controlled shore gun had been knocked out by one of the first sticks of bombs .'], ['Finally men arrested Him , gave Him a mock trial , flogged Him , nailed Him on a cross and hung Him between earth and heaven ; ;', ""`` Now he's bought it '' , said my wife contentedly .""], ['It was apparent that Welch was in cahoots with Marshall and would use his power as D.A. to drag every possible sensation into the case .', 'The name encouraged him , because he always felt that he could handle the Irish .'], [""`` I guess so '' , she said ."", 'Yes , this is she ? ?']]","[[-0.1575038880109787, -0.1575038880109787], [-0.10431326925754547, -0.10431326925754547], [-0.0007874667644500732, -0.0007787235081195831], [0.09902969002723694, 0.09903720021247864], [0.19518616795539856, 0.19556491076946259], [0.3782711625099182, 0.37842488288879395]]",241.17843627929688,46.73773193359375,"[88.66478729248047, 77.82002258300781, 135.7633056640625, 68.78479766845703, 96.97422790527344, 50.06251907348633]"
149,"According to Luigi, the man suspects Luigi and I of having an affair.","[['A road block to desirable local or borough improvements , heretofore dependent on the pocketbook vote of taxpayers and hence a drag on progress , is removed by making these a charge against the whole city instead of an assessment paid by those immediately affected .', '-- 0.2 gram Dynafac per head daily ( 1 gram of premix per head daily ) for promoting growth , feed conversion , bloom , and full feed earlier .'], ['But after 1832 , the narrative tends to lose its balanced , many-sided quality and to become a medley of topics , often unconnected by any single thread .', 'Because of the means of publication -- science-fiction magazines and cheap paperbacks -- and because dystopian science fiction is still appearing in quantity the full range and extent of this phenomenon can hardly be known , though one fact is evident : the science-fiction imagination has been immensely fertile in its extrapolations .'], [""`` Did you see the car parked across the street '' ? ?"", 'The conventions into which the romantics tried to breath life no longer corresponded to the realities of thought and feeling .'], ['In the last eight years , all Presidential appointments , including those of cabinet rank , have been denied immediate action because of a Senate rule requiring at least a 24 hour delay after they are reported to the floor .', 'In the last eight years , all Presidential appointments , including those of cabinet rank , have been denied immediate action because of a Senate rule requiring at least a 24 hour delay after they are reported to the floor .'], [""Once there , the D.A. with devilish cleverness would provide Marshall with headlines : `` Viola's Multiple Romances '' `` Viola Lake an Addict '' `` Downfall of Another Film Idol '' ! !"", 'The cops would gather up Connor and the foursome on the third floor and bring us those of them who would voluntarily submit to fingerprinting .'], [""I fought like a tigress but by the time I appealed my case to the Supreme Court ( 1937 ) , Mr. Roosevelt and his `` henchmen '' had done their `` dirty work '' all too well , even going so far as to attempt to `` pack '' the highest tribunal in the land in order to defeat little me ."", 'The actor plays his role glumly under the lurid direction of Don Chaffey , as do Basil Sydney as his unsympathetic father and Anton Diffring as an innocent bystander .']]","[[-0.1720447540283203, -0.17202264070510864], [-0.1024005115032196, -0.10237371176481247], [-0.0005248412489891052, -0.0005211420357227325], [0.09909852594137192, 0.09909852594137192], [0.19465716183185577, 0.1946634203195572], [0.24430227279663086, 0.24493618309497833]]",46.490596771240234,46.32395935058594,"[73.33869171142578, 46.605472564697266, 34.35774230957031, 51.38167953491211, 36.96126174926758, 29.622819900512695]"
396,"I now know the why” and closing the door with a big grin on her face, she ran to her phone to spread the news.","[['Utopian communism applies to all Utopians .', ""You may not be responsible '' .""], ['So , for all practical purposes , it was an independent nation and by now had its own organized government ( unrecognized outside its own borders ) .', 'So , for all practical purposes , it was an independent nation and by now had its own organized government ( unrecognized outside its own borders ) .'], ['Further research in the meaning of crises as experienced by the consumers of traditional social casework services -- including attempts to develop a typology of family structures , crisis problems , reaction mechanisms , and differential treatment approaches -- and the establishment of new experimental programs are imperative social needs which should command the best efforts of caseworkers in collaboration with community planners .', 'Such pseudo-questions assume that answers of concrete significance can be supplied to statements involving undefined universals .'], ['Give each new member a certificate of membership .', ""`` Great satire has always been clearly written and readily understandable '' , I said .""], ['Ludie inquired every evening , pretending that he did not care .', 'He might barge into a gallery , start haggling over prices without so much as a word of greeting .'], [""`` I would like to enact a little tableau this afternoon '' , Rector said , He explained about the visit and the effect he wished to create , the picture of a very busy mission ."", ""She it was who had looked to see if I was wearing shoes upon learning that I couldn't drive .""]]","[[-0.1795041412115097, -0.1787043958902359], [-0.10269584506750107, -0.10269584506750107], [-0.0007197707891464233, -0.0007045166566967964], [0.09925758838653564, 0.09927208721637726], [0.19639088213443756, 0.19656839966773987], [0.31743186712265015, 0.3176552355289459]]",96.41002655029297,84.59081268310547,"[93.73892211914062, 110.04959106445312, 100.40724182128906, 79.17353820800781, 86.54853057861328, 82.36000061035156]"
412,"David stood up, and holding his hand out to her, he led her to his desk where he promptly called Carla to give her the good news personally.","[['Over 450 different schools are usually represented in each entering class .', 'With these maps completed , the inventory phase of the plan has been started .'], ['War , under these circumstances , cannot be one massive exchange of nuclear devastation .', 'It is important , however , that the Peace Corps be advanced not as an arm of the Cold War but as a contribution to the world community .'], ['Some churches have six or more training sessions of two hours each , generally held on Sunday night or during the week .', 'Jack Frost is not really responsible for this great seasonal spectacle ; ;'], [""The show is programed and written by the station's assistant continuity editor , Chuck Briefer ."", '`` We have tried to make both paths attractive , so that good men could find opportunity and satisfaction in either .'], ['When her right hand was incapacitated by the rheumatism , Sadie learned to write with her left hand .', 'And Alexander sobbed like a girl for the dreams he had had , and he felt no shame .'], ['He had never heard so many bells , and as he lay there listening , he thought of her scolding him for his remarks when he had looked up at the obelisk and the church at the top of the Spanish Steps .', ""He'd mentioned it , himself , at church and everybody seemed to have the idea that Tolley had left because Jenny had jilted him for Roy Robards .""]]","[[-0.1750529706478119, -0.17486336827278137], [-0.10280313342809677, -0.1027446985244751], [-0.0010051405988633633, -0.0009985938668251038], [0.09878723323345184, 0.09880086779594421], [0.19782093167304993, 0.19794665277004242], [0.3464873135089874, 0.3479425609111786]]",83.38262939453125,61.424617767333984,"[88.9410400390625, 86.54373931884766, 74.62835693359375, 63.50691604614258, 70.11360168457031, 68.38114929199219]"
