target_idx,target_sent,sents_intrp_all_bins,sim_intrp_all_bins,base_PPL,unintrp_PPL,intrp_PPL_all_bins
399,"Judging him to be somewhere between forty-fiveand fifty, and much too young for her, Tess thought he looked like a mixed puppy, obviously spoiled by his wife.","[['But none of these has been implemented .', 'But none of these has been implemented .'], ['The accelerometers are mounted rigidly on the platform .', 'During the year 1959 , we granted 354 Fellowships ; ;'], ['I think you fell short of the real truth in the matter : That the move is working out through the fine cooperation of the staff and all the people .', 'The sections were then thawed by placing a finger under the slide and dried under a fan for 30 minutes ; ;'], ['Then we have surviving at least one instance of a poem prepared for another , in Naturam non Pati Senium , and perhaps also the De Idea Platonica .', ""She might like to take him to St. Peter's .""], ['He listed what he had spent for `` My own diet in London eighteen weeks , in which I was sick a month ; ;', ""As John T. Westbrook says in his article , `` Twilight Of Southern Regionalism '' ( Southwest Review , Winter 1957 ) : `` The miasmal mausoleum where an Old South , already too minutely autopsied in prose and poetry , should be left to rest in peace , forever dead and ( let us fervently hope ) forever done with '' .""], ['It may appear that we were cruel and callous , but no one had time to spend sympathizing with poor Isaac -- except the Reverend .', 'He was so long thinking that my mother had time to inspect her sherry for dregs .']]","[[-0.12564097344875336, -0.12564097344875336], [-0.10359369218349457, -0.1028035506606102], [-0.00027014780789613724, -0.00026247091591358185], [0.09975659102201462, 0.0997956395149231], [0.1986713856458664, 0.19904616475105286], [0.34418654441833496, 0.34560221433639526]]",224.13543701171875,201.81964111328125,"[220.9673614501953, 203.8472442626953, 206.85556030273438, 201.10626220703125, 207.65951538085938, 194.94137573242188]"
111,"She was fed up with arrogant, know it all men who thought they owned the world and felt that it should be jumping to their tune.","[['There are two sides of a coin for this decision .', 'Place a piece of plaster wall board or plaster bat on clay and reverse bat , clay and mold in one action .'], ['The temperature dependent value of **ye was taken from Ref. 7 .', 'Broil or toast as usual .'], [""Later , a bus will carry members to the Chicago Stadium to see Jack Kramer's professional tennis matches at 8 p.m. ."", 'Although the United States and the U.S.S.R. have been arguing whether there shall be four , five or six top assistants , the most important element in the situation is not the number of deputies but the manner in which these deputies are to do their work .'], [""`` We misjudged you '' , he said slowly ."", ""`` We misjudged you '' , he said slowly .""], ['Mr. Dwyer said that although it was obvious that Mr. Rayburn was not well he stopped , gave the youngster his autograph , asked where he was from and expressed the hope that he would enjoy his visit to Congress .', ""`` I knew it all along '' , confessed Arnold with a grin , `` but I just happened to think how much nicer it would be to drop one way up there '' .""], [""It is a characteristic of thoughts that in re-thinking them we come , ipso facto , to understand why they were thought '' ."", ""I think her husband strongly suspects so , and that's why he called me in on the thing in direct defiance of his confederates and almost certainly without telling them why he was doing so .""]]","[[-0.1395527422428131, -0.13941112160682678], [-0.10192499309778214, -0.10162954032421112], [-0.00019063986837863922, -0.00015223678201436996], [0.0998743399977684, 0.0998743399977684], [0.19918306171894073, 0.1994437873363495], [0.3587648272514343, 0.35953253507614136]]",185.50796508789062,168.22474670410156,"[187.76162719726562, 177.27816772460938, 162.494384765625, 147.8580322265625, 148.1045684814453, 146.52952575683594]"
47,"“Oh it’s Tess, is it?”","[[""As a youth he became one of Finney's band of evangelists and gave himself to winning young men ."", ""As a youth he became one of Finney's band of evangelists and gave himself to winning young men .""], ['When , therefore , it turned its attention to the concrete entities with which popular imagination had peopled the world of spirit , these entities soon lost whatever status they had enjoyed as actual elements of external reality .', 'Just before reaching it I came to a grey and brown stone building that looks somewhat like an Oriental pagoda , with Arabic lettering in gold and colored tile decorations -- the Fountain of Sultan Ahmet .'], ['All the more reason why there should have been no place for the frills ; ;', ""Certain pianistic traits are common to all five Schnabelian renditions , most notably the `` Schnabel trill '' ( which differs from the conventional trill in that the two notes are struck simultaneously ) .""], ['`` But John forbad him , saying , I have need to be baptized of thee , and comest thou to me ? ?', 'I felt like a Hun in Rome .'], [""and it is not unlikely that , even as the great Bach lay dormant for so many years , so has the erudite , ingenious SalFininistas passed through his `` purgatory '' of neglect ."", 'The one line on the bride said she was Miss Lisa Carmody from Baton Rouge .'], [""`` Maybe I am padding it a bit , Anne '' , he said ."", ""Why , it's all right , isn't it , Mother '' ? ?""]]","[[-0.14647020399570465, -0.14647020399570465], [-0.10062257945537567, -0.1004956066608429], [-0.0004517659544944763, -0.00034658797085285187], [0.09960703551769257, 0.09963138401508331], [0.19803057610988617, 0.19804561138153076], [0.34674718976020813, 0.35828399658203125]]",265.2174987792969,173.7215118408203,"[269.3739013671875, 249.51055908203125, 222.37571716308594, 171.8421630859375, 235.8058624267578, 165.54466247558594]"
70,"Pulling her back down beside him quickly, David remarked, “I’m still waiting for your answer, Cara”","[['This Europeanization of the law was made explicit by a number of 19th century scholars .', ""All belong to the collection being given to Wilmington over a period of years by Mrs. Sloan , who has cherished such revelatory items ever since she first studied with Sloan at the Art Students League , New York , in the 1920's .""], ['But we abide by their insight .', 'In any given period piece the costumes , bric-a-brac , vehicles , and decor , bear the stamp of unimpeachable authenticity .'], ['We were told that to the Pathet Lao , a kidnaped American was worth at least $750 , a fortune in Laos .', 'Any musician playing Beethoven here , where Beethoven was born , is likely to examine his own interpretations with special care .'], ['The Mayor is finding it awkward to campaign against his own record .', 'Still the guards did not move , but stood inert , aloof from the slow-scrambling man .'], ['Going downstairs with the tray , Winston wished he could have given in to Miss Ada , but he knew better than to do what she said when she had that little-girl look .', 'Draw each outline in a different-color chalk , one on top of the other .'], [""`` Maybe I could '' , he said , surprised that she could turn from herself and notice anything about him ."", ""He looked in her direction but he didn't answer .""]]","[[-0.16539476811885834, -0.16497352719306946], [-0.10085636377334595, -0.10082292556762695], [-0.00030591338872909546, -0.0002694251015782356], [0.09957148134708405, 0.09959100186824799], [0.19881603121757507, 0.1989191621541977], [0.38081181049346924, 0.3810528516769409]]",251.9624786376953,165.9759063720703,"[210.99095153808594, 193.8080291748047, 184.06985473632812, 165.8679962158203, 162.25567626953125, 163.59471130371094]"
410,"“Good, then we’ll get married Wednesday at noon, no matter what, agreed?”","[['It can contribute to the development of critical countries and regions .', 'This machine was demonstrated in two textile machinery exhibitions last year and was well received by the industry .'], ['It was in the air .', 'The formula for computing random addresses from the form of each occurrence will not give a distinct address for each distinct form .'], [""Frederick Seward said his father was sleeping , and then went through a pantomime at his father's door , to prove the statement ."", ""Frederick Seward said his father was sleeping , and then went through a pantomime at his father's door , to prove the statement .""], ['And those of Early Spring , haunted and now full of hurt and envy .', 'Refunds of less than $1 will not be made unless you attach a separate application to your return requesting such a refund .'], [""Now can you tell me who was drunk -- The man , his wife , or me '' ? ?"", ""After a while , Kitty murmured something to Cappy , and he held her close , answering , `` We'll just have to wait till we pull into Philly , honey '' .""], [""`` A marriage can survive almost any kind of stress except an open and direct challenge to the husband's maleness '' , declares Dr. Calderone ."", ""For it seems that Barco , fancying himself a ladies' man ( and why not , after seven marriages ? ?""]]","[[-0.16358795762062073, -0.16354191303253174], [-0.10143423080444336, -0.10133104771375656], [-0.00015119649469852448, -0.00015119649469852448], [0.09957756102085114, 0.09960503876209259], [0.19759492576122284, 0.19792017340660095], [0.3097687065601349, 0.31397324800491333]]",533.0732421875,374.7203063964844,"[537.7237548828125, 492.272216796875, 436.73626708984375, 379.90289306640625, 374.6434631347656, 412.0198059082031]"
