target_idx,target_sent,sents_intrp_all_bins,sim_intrp_all_bins,base_PPL,unintrp_PPL,intrp_PPL_all_bins,local_PPL_all_bins
402,"“I don’t know, Man.","[['Next he addressed himself to our souls .', 'He was prancing along the hall , heading for the next flight of stairs .'], ['Simple elongation has been treated in detail .', ""Only recently new `` holes '' were discovered in our safety measures , and a search is now on for more .""], ['Wilson stared at her .', 'if the angle of fire were too great the jutting buildings on either side would interfere .'], ['This was some freak , two strands of adhesive tape across his nose , like ugly roots from the mass of gauze , suddenly moist over his cheekbones .', ""After I would finish playing the songs , he'd just go away without a comment .""], ['( But that is another story .', ""`` She's probably getting old -- crotchety , I mean -- and we figured uh-uh , better not .""], ['I was just going .', ""It would to me '' .""]]","[[-0.1457912027835846, -0.1455991268157959], [-0.10126134753227234, -0.10121998190879822], [-0.00017891544848680496, -0.00013305246829986572], [0.09972178936004639, 0.09975862503051758], [0.19777557253837585, 0.19786964356899261], [0.422902911901474, 0.4296102225780487]]",41.246150970458984,15.694841384887695,"[19.724266052246094, 25.007457733154297, 19.938282012939453, 18.80013656616211, 21.07158088684082, 16.758636474609375]","[33.28530502319336, 43.54542541503906, 36.54207992553711, 26.92552375793457, 31.634660720825195, 26.906173706054688]"
86,"Speeding to get to her meeting, she ran into a traffic jam and knew that she would never make it in time.","[['In the main stream of historical thinking is a group of scholars , H.M. Chadwick , R.H. Hodgkin , Sir Frank Stenton et al. who are in varying degrees sceptical of the native traditions of the conquest but who defend the catastrophic type of invasion suggested by them .', 'If we are born of God we love God .'], ['And the life that I now live in the flesh , I live in the faith of the Son of God , who loved me and gave himself up for me .', ""`` Too many of our writers seem to be interested only in creatures that crawl out of the woodwork or from under the rock '' .""], ['Naturally , where one or the other of the effects of an action is uncertain , this has to be taken into account .', 'Maybe he felt the same way .'], [""Me , I know the mind of an officer works in a strange and unfathomable manner '' ."", ""The monitor of this discourse grinned with pride and amusement as Helva's tone indicated pity for the unfortunate .""], ['This was a training ship and the training would continue , but there was an element of frightful absurdity here which Alexander recognized .', ""and frightening , as when a wife tells the police that it is funny , but her husband hasn't been home for two days and nights '' .""], ['One shawl was so tremendous that she could not wear it , so she draped it over the banister on the second floor , and it hung over the stairway .', 'Suspecting an ambush , the two deputies decided to ride up a side canyon taking a short cut into Catskill .']]","[[-0.15805649757385254, -0.15762224793434143], [-0.10050138831138611, -0.10037750750780106], [-0.00028920266777276993, -0.00026028044521808624], [0.09988488256931305, 0.09989193826913834], [0.19917337596416473, 0.19917884469032288], [0.3632144331932068, 0.36815571784973145]]",63.7613410949707,39.811588287353516,"[87.3971176147461, 61.6343994140625, 45.66159439086914, 45.240936279296875, 44.57960510253906, 45.149295806884766]","[126.10347747802734, 82.87715148925781, 66.61579132080078, 61.078983306884766, 52.77245330810547, 52.421085357666016]"
327,"Myra is in the States with the kids, and she would never forgive me if something happens to Luigi.","[['Here are some key areas to examine to make sure your pricing strategy will be on target :', 'But the growing number of Negro-appeal radio stations , plus evidence of strong listener support of their advertisers , give time salesmen an impressive argument as they approach new prospects .'], ['The detection and study of such line spectra would add considerably to present information on interstellar gas clouds and , perhaps , planetary atmospheres .', 'All-weather roads must be provided next to the feeding floor so access will be possible all year .'], ['This fascinating story begins with a sketch , rich in personal detail , of the glancing mutual impact of World War 1 , and the two instalments of the Russian Revolution .', ""The same month that Alastor was published , Murray sold twenty thousand copies of The Siege Of Corinth , a slovenly bit of Byronism that even Shelley's generosity rebelled at .""], ['Argiento had been trained so rigorously by the Jesuits that Michelangelo was unable to change his habits : up before dawn to scrub the floors , whether they were dirty or not ; ;', 'But even so Lucy could not give up her intellectual pursuits .'], ['But every time I suggested this to her , Mrs. Wright turned it down and demanded that I go out and punish Mr. Wright .', 'She worked as a domestic , first in Newport for a year , and then in South Bethlehem , Pennsylvania , for another year .'], ['No , I forget Mrs. Mathias , who had been away visiting a married daughter when it happened .', 'When I interviewed Kirby , who as a boy picked up pears in the Borden yard , I asked if anybody else in the household besides Lizzie and Morse had been under any suspicion at the time of the murders .']]","[[-0.14771011471748352, -0.14701008796691895], [-0.10170725733041763, -0.10156776010990143], [-0.000329088419675827, -0.0003215000033378601], [0.09971991181373596, 0.0997345969080925], [0.1985955834388733, 0.19861353933811188], [0.3220069706439972, 0.3220980167388916]]",68.28984069824219,39.92518997192383,"[50.84651184082031, 47.39741516113281, 69.24004364013672, 41.15375518798828, 39.38753890991211, 40.533573150634766]","[69.85713958740234, 95.14311981201172, 106.25745391845703, 52.94001007080078, 78.36678314208984, 50.13600158691406]"
249,"“I don’t believe in having sex during engagements either,” Tess said.","[['For the Lo Shu square was a remarkably complete compendium of most of the chief religious and philosophical ideas of its time .', ""Their locations in all parts of the United States , and their locations in the several kinds of educational and research institutions that are the principal homes of our intellectual and artistic strengths also are factors in the Trustees' minds .""], ['What are the possibilities for operating your cafeteria for a single shift only and relying upon vending machines or prepackaged sandwiches for the second- and third-shift operations ? ?', 'As in experience one is seized by given entities and their interrelations and is forced to respond in value feelings to them , so one is similarly seized in the mimetic presentation of images .'], ['Yet he remains the fiercest of competitors .', 'Despite the 45-degree weather the game was clicked off in 1:48 , thanks to only three bases on balls and some good infield play .'], ['We want the past forgiven , but at the same time we must be willing for God to direct the future .', 'Mathematically , we shall not distinguish the experiment of three dice tossed once from that of one die tossed three times .'], [""`` He works for my father '' , the girl said , and then seemed to change her mind ."", ""Because your soul was made to be filled with God Himself , not religious functions `` about '' Him .""], [""For it seems that Barco , fancying himself a ladies' man ( and why not , after seven marriages ? ?"", ""`` Maybe I am padding it a bit , Anne '' , he said .""]]","[[-0.1501716524362564, -0.14967258274555206], [-0.1006392240524292, -0.10057415068149567], [-0.0003248453140258789, -0.0003055743873119354], [0.09979815781116486, 0.09983374923467636], [0.19789567589759827, 0.19830723106861115], [0.31397688388824463, 0.3155544400215149]]",66.8509521484375,29.754802703857422,"[50.17802429199219, 33.582359313964844, 38.78207015991211, 46.18184280395508, 34.18106460571289, 34.400238037109375]","[76.28086853027344, 54.65162658691406, 67.81099700927734, 64.24822235107422, 48.25142288208008, 48.753173828125]"
95,“Are you sure?” Tess asked softly.,"[[""It cuts the lumber dealer's cost because it takes only one man -- the driver -- to unload it , and because it unloads in a fraction of the time and at a fraction of the cost of hand unloading ."", 'Man is not confined to one outlet for his vital energy .'], ['Pueri aquam de silvas ad agricolas portant , a delightful vignette set in the unforgettable epoch of pre-Punic War Rome .', 'For the central storage , Tri-State buys one acre , Buries its tanks and simply holds permanent title to that piece .'], ['There shall be deducted from the amount of each payment made pursuant to subsection ( C ) of Section 8 , as reimbursement for the expenses incurred by the United States , an amount equal to 5 per centum of such payment .', 'There shall be deducted from the amount of each payment made pursuant to subsection ( C ) of Section 8 , as reimbursement for the expenses incurred by the United States , an amount equal to 5 per centum of such payment .'], ['He saw the child-face grimace as the head was cut ; ;', 'A number of strong independent agencies , established in some cases with governmental or royal support , have conducted large medical , social , educational and research operations in particular parts of the Congo and Ruanda-Urundi .'], ['`` Listen to me , Leigh .', ""`` Well , all right then '' .""], [""`` Oh , Mr. Davis , are you there '' ? ?"", ""He thought a moment , then inquired , `` You mean petted '' ? ?""]]","[[-0.15562011301517487, -0.15466323494911194], [-0.10118284821510315, -0.10113497823476791], [-0.00011236220598220825, -0.00011236220598220825], [0.0995301827788353, 0.09958098828792572], [0.19938623905181885, 0.199479877948761], [0.3671848773956299, 0.3674412667751312]]",1484.405517578125,486.8308410644531,"[654.7465209960938, 964.1921997070312, 1824.59326171875, 809.2862548828125, 410.4561767578125, 305.87689208984375]","[1608.2059326171875, 2268.0205078125, 4266.3046875, 2410.961181640625, 1256.173095703125, 774.8806762695312]"
