target_idx,target_sent,sents_intrp_all_bins,sim_intrp_all_bins,base_PPL,unintrp_PPL,intrp_PPL_all_bins
94,"In addition, a person whose first child is born after the wedding is more likely to stay married than one who enters a marriage already a parent.","[['When sufficiently accurate and complete measurements are available , it will be possible to set limits on the thermal and electrical characteristics of the surface and subsurface materials of the moon .', ') , George Jean Nathan and Alexander Woollcott were honored in odd quarters , and the whole Booth Tarkington , Willa Catheter ( sic ) , ) Pearl , Buck , , Amy Lowell , William Lyon Phelps atmosphere lay thick as Los Angeles smog'], ['Incorporated in commercially prepared feed at proper levels .', 'Lack of rainfall and extreme temperatures may call for the development of shade and irrigation of a site to make it useable .'], [""In his great and glorious wisdom , he knew that our enemies the Israelites must not be able to read therein what we planned '' ."", ""In many cases that statement -- `` We break even on our downtown operation and make money on our branches '' -- would be turned around if the cost analysis were recalculated on terms less prejudicial to the old store .""], [""Teaching is at present a sellers' market ; ;"", 'For it is such a distinguished place , with such fine works of art and such a big library , that there can be little doubt but that the owner has become depraved by all this culture .'], ['It now means ominous , as when one speaks of a funny sound in the motor ; ;', 'There are 70 children there and the mothers donate one day a week to the school .'], ['The two in the bed knew each other as old people know the partners with whom they have shared the same bed for many years , and they needed to say no more .', 'This included Mamma , jolly , generous , and pretty , with whom they all fell in love , just as Papa had first fallen in love with her Mamma before he chose her ; ;']]","[[-0.17006602883338928, -0.16842114925384521], [-0.10364829748868942, -0.10360845923423767], [-0.0007221028208732605, -0.0006857244297862053], [0.09841659665107727, 0.09858953207731247], [0.1929439753293991, 0.19313344359397888], [0.29602938890457153, 0.2968675494194031]]",199.46714782714844,129.1075439453125,"[190.1811065673828, 143.19593811035156, 145.71397399902344, 138.8791046142578, 128.18544006347656, 137.36685180664062]"
18,"Every day for 14 days, each participant responded to prompts about stressful circumstances (such as getting stuck in traffic), the energy expended to handle those stressors, their positive and negative interactions with partners, and their levels of satisfaction with their relationships.","[['There shall be covered into the Treasury to the credit of the proper special fund all funds hereinafter specified .', 'she fits into the general scheme well enough .'], [""Here are a few facts and figures I've assembled ."", ""`` Or would it be easier if I put my hands in my pockets '' ? ?""], ['in 1950 it had become 47.1% urban .', ""So when textbooks , like that of Baker set out drawings of the ' Ptolemaic System ' , complete with earth in the center and the seven heavenly bodies epicyclically arranged on their several deferents , we have nothing but a misleading 20th-century idea of what never existed historically .""], [""Whenever he deigned to appear at the studio he was `` hung over '' , uncooperative , rude and insulting ."", 'I made plans for the afternoon -- doing the breakfast and luncheon dishes all at once , making the beds , and then maybe painting the kitchen .'], ['Earthquakes result when movements in the earth twist rocks until they break .', 'Afraid at one and the same time that his work might be turned down -- which would be a blow to his pride even though no one knew he was the author -- and that the work would be accepted , and then that his violent feelings in the matter would certainly betray how deeply concerned he was in spite of himself .'], ['In repetitions of the experiment from couple to couple , the votes of the two persons in a couple probably agree more often than independence would imply , because couples who visit the museum together are more likely to have similar tastes than are a random pair of people drawn from the entire population of visitors .', 'We are tempted to blame others for our problems rather than look them straight in the face and realize they are of our own making and possible of solution only by ourselves with the help of desperately needed , enlightened , competent leaders .']]","[[-0.2036978304386139, -0.20286568999290466], [-0.10229241847991943, -0.10222111642360687], [-0.0006486345082521439, -0.0006363913416862488], [0.09830328077077866, 0.09843532741069794], [0.1919124573469162, 0.1922977864742279], [0.26727578043937683, 0.2678235173225403]]",265.82598876953125,244.97877502441406,"[239.3485870361328, 259.8619689941406, 239.40965270996094, 258.8153076171875, 243.83840942382812, 225.45614624023438]"
28,It also matters what you talk about.,"[['First , Arlene had put them through some rapid somersaults .', ""Palfrey returned to Massachusetts greatly relieved to have made an arrangement `` so satisfactory to my judgment & my conscience '' .""], ['Most of the Junkers were above the blinding light of the flares , and the radar-controlled shore gun had been knocked out by one of the first sticks of bombs .', 'Three were doubles , Brooks Robinson getting a pair and Marv Breeding one .'], [""To be sure , the capital investments in ( or , alternatively , the estimated `` fair values '' of ) the plant and equipment are apportioned among the different classes , as are also the gross revenues received from the sales of the different services ."", 'Clams , crabs , and other marine life may add interest at coastal areas .'], ['The Communist countries allocated more than $1,000,000,000 in economic aid alone last year , according to Western estimates .', 'The contemporary painter tends to depict not the concrete objects of his experience but their essences as revealed in abstractions of their lines , colors , masses , and energies .'], ['Look at the things we do to escape our fears and to forget our worries .', ""`` What has impressed you most on your present visit '' ? ?""], ['It is not program music , though .', 'You see what I mean ? ?']]","[[-0.21043244004249573, -0.20978225767612457], [-0.10154053568840027, -0.10149341821670532], [-0.000618400052189827, -0.0006107063964009285], [0.0976242795586586, 0.09770338237285614], [0.1897067427635193, 0.18987315893173218], [0.2619403600692749, 0.2665054500102997]]",674.0325927734375,372.1470642089844,"[238.67626953125, 669.4129028320312, 716.054443359375, 549.729736328125, 249.91551208496094, 260.8248291015625]"
77,"""The positive emotions we get from the change get less and less frequent each time,"" she says.","[['Try to find these Feds .', 'Try to find these Feds .'], [""`` We have made limited application of the ' parallel ladder ' plan ."", 'the question was too wide for the sparse English language .'], ['When the Brown & Sharpe Manufacturing Company reached its 125th year as a going industrial concern during 1958 , it became an almost unique institution in the mechanical world .', ""`` Non-God , no '' , I said .""], ['The sound of his footsteps was like a muffled drum .', '`` However , evidence that the Axis powers are making significant preparations indicative of such an intention is being reported with increasing frequency from a variety of sources .'], ['It may allay our passions and so restore the rule of reason .', 'It may allay our passions and so restore the rule of reason .'], ['The change in perceptions by some of the Kohnstamm-negative subjects , after they had been informed of the possibilities of normal reactions , suggests that their constriction and guardedness is associated with their general mode of responding to strange or unknown situations .', 'All she did was write me a pleasant little note about how it was beautiful while it lasted but that now life had parted our ways and it was goodbye forever .']]","[[-0.17156203091144562, -0.17156203091144562], [-0.10448241233825684, -0.10439838469028473], [-0.0008546039462089539, -0.0008342303335666656], [0.0993284285068512, 0.09934226423501968], [0.19555336236953735, 0.19555336236953735], [0.2987425923347473, 0.29922422766685486]]",340.632080078125,303.2195129394531,"[294.0186767578125, 297.95196533203125, 338.9905090332031, 301.5318603515625, 285.6805725097656, 292.8743896484375]"
108,"""That, to me, is just very backwards.""","[['A blower is essential for the double-wall shelter and for the underground shelters .', 'For the maintenance of a long-term program , the departments , and particularly their chairmen , are strategic .'], ['Rabb , the former Louisiana State field general , came off the bench for his debut with the Bills Sunday and directed his new team to a 22-12 upset victory over the Houston Oilers , defending league champions .', 'When it was over , eight of his company were still alive and all eight were wounded .'], ['High blood pressure can get the best of any of us .', ""`` No '' , said the official .""], ['Like most major works of synthesis , The History Of England is informed by the positive views of a first-class mind , and this is surely a major work .', 'May I add a caution on this particular point ? ?'], [""It's somewhat off the beaten track , to be sure , but therein lies its variety and charm ."", 'He was beginning to see he was too mad to sleep .'], [""`` Well , at least you won't have to do that '' , she was saying ."", ""`` It can't be wrong , can it ? ?""]]","[[-0.17992261052131653, -0.17887914180755615], [-0.10344631224870682, -0.10344204306602478], [-0.0006404146552085876, -0.0006271339952945709], [0.09892981499433517, 0.09894328564405441], [0.19279208779335022, 0.19285079836845398], [0.3001391887664795, 0.30206751823425293]]",291.4726867675781,210.95382690429688,"[299.6753234863281, 310.6060485839844, 272.0409851074219, 187.05735778808594, 203.35142517089844, 181.62391662597656]"
