target_idx,target_sent,sents_intrp_all_bins,sim_intrp_all_bins,base_PPL,unintrp_PPL,intrp_PPL_all_bins,local_PPL_all_bins
282,This was really funny.,"[['In some areas , the progress is slower than in others .', 'About 26,500 miles of existing trails will be replaced in service by the construction of new roads .'], ['But Mr. Hendl does not go straight to any point .', 'The balance is being budgeted for the coming year .'], ['yet he did not stop being human as a result .', 'yet he did not stop being human as a result .'], ['Thus he wired J. P. Lower and Sons of Denver : `` Have you any percussion hand grenades for throwing in a house or across a well loaded with balls or shrapnel shot ? ?', 'the head dropped off ; ;'], [""`` Yes , a little parkish place '' , Charlotte said , and concluded , `` Anyhow , it's all very nice ."", 'Stevie was shouting triumphantly .'], ['This time , it was so grand ; ;', 'He was laughed off the screen .']]","[[-0.13289999961853027, -0.1328171044588089], [-0.10107629001140594, -0.10103337466716766], [-6.27981498837471e-05, -6.27981498837471e-05], [0.09985379874706268, 0.09986497461795807], [0.19843289256095886, 0.19860771298408508], [0.40779954195022583, 0.4408261775970459]]",139.44338989257812,58.821712493896484,"[201.14866638183594, 84.30889129638672, 79.48580169677734, 62.100059509277344, 37.481689453125, 48.78148651123047]","[591.7649536132812, 264.0147705078125, 99.97807312011719, 70.43579864501953, 25.462934494018555, 61.387577056884766]"
247,"Carla burst into tears and ran into the living room, leaving Tess standing there surprised, wondering what she’d said to upset her.","[['Second , we can make assistance for particular projects conditional on the consistency of such projects with the program .', 'Such modifications are all for the best but it takes something as different as a Deerstalker or a Jet to change arms-making concepts .'], ['Pre-shaped corrugated metal sections or pre-cast concrete can be used for shelters either above or below ground .', 'In presenting it to other governments and to the United Nations , we could propose that every nation consider the formation of its own peace corps and that the United Nations sponsor the idea and form an international coordinating committee .'], ['He is the conveyor of a sacred reality by which he has been grasped .', 'Moreover , progress in a national transformation can be only gradually earned ; ;'], [""Its citizens spoke all of the world's surviving tongues , plus a new one called Lingo , a pidgin whose vocabulary was derived from the other six and whose syntax was so simple it could be contained on half a sheet of paper ."", 'there is none who seeks after God .'], [""`` The past I leave to historians '' , Felix intoned , demonstrating that he could be pompous as well as happy ."", 'And yet Wilson knew that this place must go or he must go .'], ['They were pushed gently into the room by Arlene -- whose only part appearing were hands that crept quickly back around to the kitchen side of the door .', 'They were pushed gently into the room by Arlene -- whose only part appearing were hands that crept quickly back around to the kitchen side of the door .']]","[[-0.1515941023826599, -0.1512930542230606], [-0.10100981593132019, -0.10097631812095642], [-0.00022029783576726913, -0.00021972693502902985], [0.0997360348701477, 0.09974613785743713], [0.1989031583070755, 0.19942733645439148], [0.4131699800491333, 0.4131699800491333]]",67.73143768310547,44.34614562988281,"[62.83102798461914, 94.41004180908203, 61.66899871826172, 62.82794189453125, 49.35363006591797, 47.12764358520508]","[101.01415252685547, 126.5946273803711, 92.97893524169922, 84.43968963623047, 65.35768127441406, 53.384727478027344]"
179,"According to Luigi, the man suspects Luigi and I of having an affair.","[['Bisque fire to cone 08 .', 'Each one of these is , by its nature , a focal point or a point of natural congestion .'], ['And , still , they did not have to be so crude in their approach .', 'They hail from Travancore , a state in the subcontinent where Kali , the goddess of death , is worshiped .'], ['`` I am worried about the current meanings of the word funny .', '`` I am worried about the current meanings of the word funny .'], [""Ernie was screaming inside himself : No , damn you , you ain't gonna take my meal ticket away from me ! !"", 'These boys acknowledged an introduction to anybody by gently pressing one of his hands in both of theirs , while they gazed , misty-eyed with care , into the eyes of the person they were meeting .'], ['For all involved in this discussion the devil is a real entity who can really be confronted in the woods on a dark night , the demon world is populated with real creatures , and witches actually can be seen flying through the air .', ""First I've got to intercept my brothers before they get any deeper into trouble .""], [""The cops didn't suspect a thing , and I thought it was a coincidence ."", 'So was the attack upon Charles E. Bohlen when Eisenhower appointed him Ambassador to Moscow .']]","[[-0.15514491498470306, -0.15253779292106628], [-0.10037905722856522, -0.10030397772789001], [-0.0001362515613436699, -0.0001362515613436699], [0.09982360899448395, 0.09983009099960327], [0.199305921792984, 0.19962140917778015], [0.2743610143661499, 0.2810497283935547]]",46.49060821533203,46.324153900146484,"[37.18618392944336, 39.26068878173828, 45.684181213378906, 35.842708587646484, 39.28164291381836, 33.06420135498047]","[50.95817947387695, 43.02906036376953, 43.684383392333984, 31.336130142211914, 39.405677795410156, 32.494388580322266]"
65,"Go right in, he’s expecting you,” Marina replied with a smile.","[['Some churches have six or more training sessions of two hours each , generally held on Sunday night or during the week .', 'Its people , including Pierre Bottineau and other American Fur Company employees and the refugees from Fort Garry , were joined by the remaining Scots and Swiss from Fort Snelling when Major Joseph Plympton expelled them from the reservation in May 1840 .'], [""But I can only make this choice because I believe that the risk need not increase , but may be deliberately reduced '' ( by precautions against accidents or by limiting war ? ?"", 'The memory of this southern hospitality did not survive the trials of coming antislavery years and Civil War .'], [""Voting for one picture may be called `` success '' , for the other `` failure '' ."", 'Could it do otherwise ? ?'], ['The combination proved quite irresistible last night .', 'The combination proved quite irresistible last night .'], ['Lewis looked at him and began to cry , and then , saying that he was going to make a promise , he asked Blackman to call the porter and to tell him to take out all the liquor that he did not want .', ""Here is one of the loveliest fountains in Rome , the Fontana delle Tartarughe or `` Fountain of the Tortoises '' .""], ['The policeman got a confused , funny look on his face , and he had answered kind of politely , `` Now , look here , lady : I know you got to entertain these kids and all .', 'She smiled at him with benign , remote happiness ; ;']]","[[-0.15539628267288208, -0.15488673746585846], [-0.10077157616615295, -0.10068024694919586], [-0.00016586855053901672, -0.00015629082918167114], [0.09988389909267426, 0.09988389909267426], [0.1994183361530304, 0.19944041967391968], [0.40225064754486084, 0.4113045930862427]]",348.12908935546875,77.82498931884766,"[196.78338623046875, 196.97537231445312, 90.80567932128906, 110.26436614990234, 109.68585205078125, 86.72216033935547]","[796.6543579101562, 338.98919677734375, 218.1985626220703, 509.357666015625, 185.46983337402344, 121.80123901367188]"
393,Could you arrange for a champagne hour today at three for all the staff in the conference room?”,"[['He did not let the strings , for instance , weep , whine or get hysterical .', 'He did not let the strings , for instance , weep , whine or get hysterical .'], ['Whether he sang well or badly had nothing to do with it .', 'Then he thought me more perverse than ever .'], ['Parker could weep -- and he wept astonishingly often and on the slightest provocation -- but the psychology of those tears was entirely compatible with a remorseless readiness to massacre his opponents .', 'Parker could weep -- and he wept astonishingly often and on the slightest provocation -- but the psychology of those tears was entirely compatible with a remorseless readiness to massacre his opponents .'], ['This is the most endearing of Lao ceremonies .', 'I quickly turned around and began to drink .'], [""Peter , you lummox , you've forgot to order the musicians '' ."", ""Did he trouble to memorize the very small part which I had `` tailor-made '' to his specifications , a role eventually cut down to three short speeches ? ?""], ['The presentation was made before several hundred persons at the annual meeting of the League at Olney Hall , College of Marin , Kentfield .', ""On the second landing he paused to look for Docherty , didn't see him , and accepted a glass of champagne .""]]","[[-0.15877896547317505, -0.15877896547317505], [-0.10056181252002716, -0.10044685006141663], [-7.464364171028137e-05, -7.464364171028137e-05], [0.0996984913945198, 0.09970065206289291], [0.19783525168895721, 0.19798901677131653], [0.28764867782592773, 0.29265734553337097]]",428.8088684082031,425.3570251464844,"[388.8094787597656, 419.110107421875, 416.5205078125, 383.8927307128906, 274.0735778808594, 395.26788330078125]","[454.4189147949219, 388.2507019042969, 446.9742126464844, 318.798828125, 275.13409423828125, 482.1961364746094]"
