target_idx,target_sent,sents_intrp_all_bins,sim_intrp_all_bins,base_PPL,unintrp_PPL,intrp_PPL_all_bins
21,"That comes as no surprise to Terri Orbuch, PhD, of the University of Michigan and Oakland University, who says arguments over money — how to spend, save and split it — plague even well-off couples.","[['The stockade was brilliantly lighted and the guerrillas sighted him .', 'Somebody brought a light .'], ['The current was regulated by means of a variable resistor and measured with a 50 mV shunt and millivoltmeter .', 'Once , like you , I had one head , two hands , ten fingers on my hands .'], ['Move from the line or I will settle the whip on you .', 'What limited knowledge he possessed he forced upon me .'], [""`` You've been hiding things from me and Nogol every jump we've made with you ."", ""Imagine a stag dinner with Toodle Williams '' .""], [""You don't believe that I'm going back to medical school and finish , do you '' ? ?"", ""To be sure , when this is pointed out , a common response among certain churchmen is to fulminate about `` the little flock '' and `` the great crowd '' and to take solace from Paul's castigation of the `` wisdom of the wise '' in the opening chapter of First Corinthians .""], ['Only two teams in each league ( the Yankees and Detroit , the Dodgers and Cincinnati ) are battling for first place .', 'Only two teams in each league ( the Yankees and Detroit , the Dodgers and Cincinnati ) are battling for first place .']]","[[-0.15315136313438416, -0.1520611047744751], [-0.10126826167106628, -0.10101722180843353], [-0.00015633739531040192, -0.0001515764743089676], [0.09981539100408554, 0.09982062876224518], [0.19899317622184753, 0.19908438622951508], [0.3061935305595398, 0.3061935305595398]]",186.73875427246094,171.1220245361328,"[169.2616729736328, 195.1096954345703, 160.4789276123047, 160.145263671875, 162.15272521972656, 197.91714477539062]"
82,"Every day for 14 days, each participant responded to prompts about stressful circumstances (such as getting stuck in traffic), the energy expended to handle those stressors, their positive and negative interactions with partners, and their levels of satisfaction with their relationships.","[[""And the key to the suite is still missing '' ."", 'Our chief aim becomes that of finding favor in neutralist eyes .'], [""Thus `` America '' , the most widely sung of the patriotic songs , was written by a New England Baptist clergyman , Samuel Francis Smith ( 1808-1895 ) , while a student in Andover Theological Seminary ."", ""There's more specialization and a narrower purpose in two albums recently issued by Dover Publications .""], ['The cops would gather up Connor and the foursome on the third floor and bring us those of them who would voluntarily submit to fingerprinting .', 'In their case , the god of this world ( Satan ) has blinded their unbelieving minds , that they should not see the light of the gospel of the glory of Christ , who is the image of God .'], ['Frostbite was treated by putting the feet and hands in ice water or by rubbing them with snow .', ""In his Message of December 2 , 1862 , he put his purpose and his policy in these words -- which I would call the Lincoln Law of Liberty-and-Union : `` In giving freedom to the slave , we assure freedom to the free '' .""], ['Their great error is to mingle the responses typical of each of the three types of change .', 'The United States was engaged in a military attack on a peaceful , orderly people governed by a regime that had proved itself the most pro-Western and anti-Communist within any of the new nations -- the only place in Africa , moreover , where a productive relationship between whites and blacks had apparently been achieved .'], ['Once on the water , these little visitors seldom leave , and this adds to your filtering and vacuuming problems as well as providing a slapping good time for all those present .', ""Each time Letch `` went up '' in his `` lines '' , I was the one to be patient , helpful and apologetic while he indulged in outbursts of temperament , profanity and abuse , blaming others , going into `` sulks '' and , on more occasions than I care to count , storming off the `` set '' for the rest of the day .""]]","[[-0.17794468998908997, -0.1774987429380417], [-0.10118566453456879, -0.10117433220148087], [-0.0002108439803123474, -0.00019257515668869019], [0.09958889335393906, 0.09966237097978592], [0.19638118147850037, 0.19649609923362732], [0.31644147634506226, 0.31935927271842957]]",142.99600219726562,145.35096740722656,"[134.709228515625, 139.375732421875, 152.248291015625, 146.45156860351562, 135.89181518554688, 129.40240478515625]"
98,Men who didn't feel affirmed by their wives were twice as likely to divorce as those did.,"[['We have Alfredo Antonini to thank for this healthy change of diet as well as the lively performances of the Stadium Symphony .', ""'' At Veterans Memorial Auditorium .""], ['We need you to start it .', 'To achieve this destiny , acts as well as words are needed -- not only acts that lead to physical strength but also acts that lead to strength based on right doing and respect .'], ['There was the slate roof of the church ; ;', 'It has identified itself with the very tension and terror it once did so much to alleviate .'], ['During the next weeks he looked over the situation .', 'The Hotel King Arthur across the street provided almost twice as many problems .'], ['In between teratologies , she was a pretty and shapely woman ; ;', 'In between teratologies , she was a pretty and shapely woman ; ;'], ['Ambushes are laid by those who doubt themselves , as any man may against a tiger .', 'Both man and wife should be aware of the fact that a lack of climax , and even the absence of the anticipated keen pleasure are not a sign that the wife may be cold or frigid .']]","[[-0.1408006250858307, -0.14078930020332336], [-0.10271762311458588, -0.10260607302188873], [-0.0003855321556329727, -0.0002774251624941826], [0.09965407103300095, 0.09969256818294525], [0.19844698905944824, 0.19844698905944824], [0.35507017374038696, 0.3573713004589081]]",1103.8485107421875,850.4464111328125,"[942.0714111328125, 785.3778076171875, 816.7590942382812, 743.446044921875, 783.8359985351562, 784.6478881835938]"
59,"Conversing about ""who are we, what's our mission and what's our legacy"" creates shared meaning and purpose in the relationship, he says.","[['It could have continued testing to the full on the grounds that the radiation danger was far less than the danger of Communist world domination .', 'After a flood of protests , they were reinstated at the beginning of 1953 .'], ['The system of indicating gender varied according to tense .', 'They involve only simple mathematics that are taught in grammar school arithmetic classes .'], ['He at once cancels the celebrations and , buckling on his scimitar , stumbles blindly from the house , where he is hit and killed by a passing oxcart .', 'He at once cancels the celebrations and , buckling on his scimitar , stumbles blindly from the house , where he is hit and killed by a passing oxcart .'], [""`` You see , first of all and in a sense as the source of all other ills , the unshakeable American commitment to the principle of unconditional surrender : The tendency to view any war in which we might be involved not as a means of achieving limited objectives in the way of changes in a given status quo , but as a struggle to the death between total virtue and total evil , with the result that the war had absolutely to be fought to the complete destruction of the enemy's power , no matter what disadvantages or complications this might involve for the more distant future '' ."", 'some women with father fixations do .'], ['As only a member of the family can share in the innermost joys of the family , likewise one must belong to the family of God in order to receive the benefits that are promised to those who are His own .', 'A good word for it is fellowship .'], ['He had had the need to understand what life lurked behind the mask of flesh , behind the oath , the banter , the sadness .', ""How literature does this , or for whom , is certainly not clear , but the content , form , and language of the `` message '' , as well as the source , would all play differentiated parts in giving and molding a sense of purpose .""]]","[[-0.17645928263664246, -0.17438003420829773], [-0.1009635180234909, -0.10092058032751083], [-0.000124393031001091, -0.000124393031001091], [0.09959013760089874, 0.0996224656701088], [0.19637325406074524, 0.19668924808502197], [0.2944701611995697, 0.29568666219711304]]",299.9875793457031,263.8764343261719,"[282.5903015136719, 262.3375549316406, 268.2840270996094, 228.70896911621094, 252.63967895507812, 238.08848571777344]"
28,"By trying new and exciting activities together, couples can rekindle feelings similar to ones they once had, Lyubomirsky says.","[['I had no doubt that it was .', ""I don't think his diligence mitigates your negligence , Matson '' .""], ['I shall touch on three areas : personal , national , and theological .', 'and it must be enforced without discrimination .'], ['Any other reaction would have been reported instantly .', 'Earlier this month Edward R. Murrow , director of the United States Information Agency , came to Hollywood and had dinner with more than 100 leaders of the motion picture industry .'], ['Then we were off again .', ""The PM might show he drowned instead , but that's what the once-over-lightly gives us .""], ['His wife had said to him : `` Nellie is in love with Clayton Roy .', 'The statement also points to a classic paradox : The more men turn toward God , who is not only in himself the paradigm of all unity but also the only ground on which human unity can ultimately be established , the more men splinter into groups and set themselves apart from one another .'], ['If they feel that we are taking a long-term view of their problems and are prepared to enter into reasonably long-term association with them in their development activities , they will be much more likely to undertake the difficult tasks required .', 'Arlene had taught them a new way to have fun in their little private area ; ;']]","[[-0.1548416018486023, -0.1536635458469391], [-0.10124889016151428, -0.10124880075454712], [-0.00034033507108688354, -0.00029532238841056824], [0.099537193775177, 0.09954614192247391], [0.19724765419960022, 0.19737038016319275], [0.3245401680469513, 0.33793675899505615]]",403.62890625,255.8011016845703,"[318.1391296386719, 280.4354248046875, 390.2690734863281, 260.35784912109375, 277.96051025390625, 266.7469177246094]"
