target_idx,target_sent,sents_intrp_all_bins,sim_intrp_all_bins,base_PPL,unintrp_PPL,intrp_PPL_all_bins
70,"In addition, a person whose first child is born after the wedding is more likely to stay married than one who enters a marriage already a parent.","[['Such sections showed bright yellow-green specific fluorescence in the cells of the pseudophloem tissue ( Lee and Black , 1955 ) .', ""' not flash in pan '""], ['Lay the cloth in place and trim it to size .', 'A terrible chill swept through the grove .'], ['Once again life went its serene way -- soirees , fox hunts , balls and dinners .', 'There has been an increase in cooperative research with other Federal agencies and civilian institutions .'], [""Helva's class was doing Fine Arts , a selective subject in her crowded program ."", 'Old Order , acted and atonally sung by Grunnfeu Arapacis , the lovely Serbantian import , then entered and delivered the well-known invocation to the god Phineoppus , whereupon the stage is quite unexpectedly visited by a company of wandering Gorshek priests , symbolizing Love , Lust , Prudence and General Motors , respectively .'], ['there is a struggle there , in which , if he falls , it is easy for him to rise again , there is freedom of utterance there , which draws after it no irreparable consequences on society .', ""Personally , it is the Southerner's sexual coming of age , when , without any warning , unbreakable taboos are set up between himself and his past .""], ['It was on the tenth day after the wedding ( how could it have been so soon ? ?', ""A world in which wives have taken a more active role is likely to produce sexual relationships in which wives are more self-assertive , too '' .""]]","[[-0.14690691232681274, -0.14662320911884308], [-0.10056084394454956, -0.10054618120193481], [-0.00019435212016105652, -0.00019392743706703186], [0.09971961379051208, 0.09979771822690964], [0.19931159913539886, 0.199314147233963], [0.3606738746166229, 0.36418017745018005]]",97.53136444091797,53.68833541870117,"[77.47664642333984, 57.70804214477539, 62.98878860473633, 64.28257751464844, 56.90229034423828, 56.072296142578125]"
41,"""It appears that those things are paying off.""","[['On the other hand , he did not want to offend Edward either , and he found himself in a very difficult position .', 'An additional 15 million acres will be given a lesser degree of protection but adequate to meet the average fire situation .'], ['But , admit or not , Bonner was helpless .', 'A copy was released to the press .'], ['All false gods resemble Moloch , at least in the early phases of their careers , so it would be unreasonable to expect any form of idol-worship to become widespread without the accompaniment of human sacrifice .', 'In the second , the fixed elements are the lines which join the vertex , P , to the two intersections of **zg and the plane of the pencil which do not lie on the multiple secant .'], ['This resulted in an improved appearance , but was followed by an increase in printing cost that necessitated the institution of major economies to keep within the total of allocated funds .', 'Next he addressed himself to our souls .'], ['These men are considered managers of engineers .', 'I suppose I should have paid attention to that half-murmured remark , but it seemed one of those extreme statements women under stress indulge in .'], [""`` They're stealin' the stock '' ! !"", ""He's really asking for it '' .""]]","[[-0.16107720136642456, -0.1606563925743103], [-0.10093995928764343, -0.10066640377044678], [-0.00020804628729820251, -0.00013767927885055542], [0.09971688687801361, 0.0997532457113266], [0.19830963015556335, 0.19866231083869934], [0.3543429672718048, 0.3601645231246948]]",300.4670104980469,270.8009948730469,"[290.9872131347656, 279.3006896972656, 265.091552734375, 352.5836181640625, 293.88677978515625, 251.83612060546875]"
18,"After a decade, the most striking difference between the couples who had divorced and the ones who stayed together was how they had handled conflict during their first year of marriage.","[['These are particularly suitable for regions where water or rock is close to the surface .', 'There should be a task for everyone and these tasks should be rotated .'], [""Helva's civilization was not without busy , do-good associations , exploring possible inhumanities to terrestrial as well as extraterrestrial citizens ."", 'The primitive-eclogue quality of his drawings , akin to that of graffiti scratched on a cave wall , is equally well known .'], ['Thomas Douglas , fifth Earl of Selkirk , a noble humanitarian Scot concerned with the plight of the crofters of his native Highlands , conceived a plan to settle them in the valley of the Red River of the North .', 'He never knew just what woke him .'], ['What had he thought of , to go to John , grovel and beg understanding ? ?', 'All over the country , belly clubs have never been bigger , especially in Detroit , Boston and Chicago , and even in small towns ; ;'], ['In my person they would always remember that last long time of me alone with her , so if they told themselves that I could have prevented it , I can understand that by now and love them still , because everyone must justify , have a scapegoat for what is not to be borne .', 'Some telephoned because he had done them a favor in the past .'], [""A weekly newspaper reported a local romance : `` and the couple were married last Saturday , thus ending a friendship which began in their schooldays '' ."", ""A weekly newspaper reported a local romance : `` and the couple were married last Saturday , thus ending a friendship which began in their schooldays '' .""]]","[[-0.14541295170783997, -0.14541085064411163], [-0.1011873260140419, -0.10107757151126862], [-0.0001347362995147705, -0.00013006292283535004], [0.09987404942512512, 0.09987720102071762], [0.19861873984336853, 0.19876092672348022], [0.42638999223709106, 0.42638999223709106]]",68.54901885986328,55.18286895751953,"[62.88240051269531, 70.28636169433594, 62.55689239501953, 59.11546325683594, 54.650245666503906, 53.18053436279297]"
104,But feeling supported during negative events was inconsistently — and sometimes even negatively — linked to similar good feelings.,"[[""If these services are to be maintained , the New York Central must have the revenues to make them possible '' ."", 'He had no idea how much time Budd would give him .'], [""`` I've solved the mystery of the little bag ."", 'The State Ballet of Rhode Island Week proclamation by John A. Notte , Jr. , Governor'], ['and a host of others .', 'She was another human being and happened to be a hustler .'], [""Whenever he deigned to appear at the studio he was `` hung over '' , uncooperative , rude and insulting ."", ""During this precarious period of development the mother should continue to influence the growth of the child's conscience .""], ['It seemed to be only a riot of color , light and meaningless activity .', 'It seemed to be only a riot of color , light and meaningless activity .'], ['( 3 ) in a state of depression , the positive conditioned stimulus may fail to elicit a conditioned reaction but cause an increased synchrony instead of the excitatory desynchronizing ( alerting ) effect on the Aj .', 'Theirs is no mere lack of sympathy , but something closer to the passionate hatred that was directed against Fascism .']]","[[-0.1647609919309616, -0.16467738151550293], [-0.10034240782260895, -0.10026709735393524], [-0.00013768300414085388, -0.00012572575360536575], [0.09969103336334229, 0.0997723862528801], [0.19817689061164856, 0.19817689061164856], [0.33088812232017517, 0.33089008927345276]]",707.1201782226562,558.667724609375,"[574.0702514648438, 758.067626953125, 558.7401733398438, 586.457763671875, 541.330322265625, 546.6554565429688]"
86,"""So many people do lifelong training in so many things — if you're a golf enthusiast you go to the driving range a couple times a week.","[['Instead of that he was engulfed by bedlam .', 'Ann was plainly disappointed in his appearance .'], ['The General Assembly , which adjourns today , has performed in an atmosphere of crisis and struggle from the day it convened .', 'The General Assembly , which adjourns today , has performed in an atmosphere of crisis and struggle from the day it convened .'], ['He was tall and dark-skinned , a half-breed , Wilson thought .', 'For the Lo Shu square was a remarkably complete compendium of most of the chief religious and philosophical ideas of its time .'], ['Hence the minimal polynomial for Af is Af .', 'A skilled worker on the assembly line , for example , earns $37 a week .'], ['While they were away Blanche came into the office every morning , running things as she had always run them for Stanley , going through the week in a dazed stupor , getting things done automatically , out of habit .', 'He listed what he had spent for `` My own diet in London eighteen weeks , in which I was sick a month ; ;'], ['In spite of the shading of one type of course into another , I believe it is useful to talk about vocational courses as apart from academic courses .', ""Carpenters all wanted steady work and at the moment every mother's son for twenty miles around that could hammer nails for twenty-five dollars a day was working on the school job .""]]","[[-0.15745821595191956, -0.15708103775978088], [-0.10079333931207657, -0.10079333931207657], [-0.00016366224735975266, -0.00014452263712882996], [0.09965021908283234, 0.09967587143182755], [0.19907014071941376, 0.19912290573120117], [0.3228800296783447, 0.32444512844085693]]",174.4749755859375,138.84420776367188,"[157.35833740234375, 182.40704345703125, 162.3858642578125, 141.34730529785156, 140.1364288330078, 155.444091796875]"
