target_idx,target_sent,sents_intrp_all_bins,sim_intrp_all_bins,base_PPL,unintrp_PPL,intrp_PPL_all_bins,local_PPL_all_bins
400,“Tess is like a sister to me.,"[['A reporter who consulted a Middle East Information officer for routine vital statistics got nowhere until the State Department man produced from his bottom desk drawer a brochure published by the Arabian-American Oil Company .', 'It was a session at which all the youngsters were told to express their fears , to get them out in the open where they could talk about them freely .'], [""He had a purring voice and poker player's immobility of features which somehow conveyed the feeling that he knew where all the bodies were buried ."", 'Considering that the current school-age potential is 23 million youths , the project and its message on hunting and shooting education have many more to reach .'], ['In the physical sciences , these achievements concern electricity , chemistry , and atomic physics .', 'She turned and walked stiffly into the parlor to the dainty-legged escritoire , warped and cracked now from fifty years in an atmosphere of sea spray .'], [""This would be by far the better choice , when `` it is a question of allowing the human race to survive , possibly under the domination of a regime which most of us detest , or of allowing it to destroy itself in appalling and prolonged anguish '' ."", ""This would be by far the better choice , when `` it is a question of allowing the human race to survive , possibly under the domination of a regime which most of us detest , or of allowing it to destroy itself in appalling and prolonged anguish '' .""], ['One could hear a very faint , ladylike sigh of relief .', 'One could hear a very faint , ladylike sigh of relief .'], ['Asked a red-haired girl named Ceecee Witter .', ""Oh , dear , I'm all unstrung '' .""]]","[[-0.2035580575466156, -0.19955170154571533], [-0.10385993123054504, -0.10377252101898193], [-0.0006728209555149078, -0.0006571710109710693], [0.09870050847530365, 0.09870050847530365], [0.1952897012233734, 0.1952897012233734], [0.29330143332481384, 0.2939184308052063]]",115.54147338867188,29.58430290222168,"[47.67845153808594, 56.24442672729492, 40.47529220581055, 61.89436340332031, 33.920799255371094, 42.26829147338867]","[92.99578857421875, 113.45504760742188, 97.82414245605469, 125.25048065185547, 85.5605239868164, 79.59590148925781]"
207,"“Oh, you do, these are pretty big apartments.”","[['As the knack gradually comes back to him , his rhythm becomes steadier , with the rigid monotony of an unskilled reader .', ""If the content of faith is to be presented today in a form that can be `` understanded of the people '' -- and this , it must not be forgotten , is one of the goals of the perennial theological task -- there is no other choice but to abandon completely a mythological manner of representation .""], ['The various forces result from the reaction of the removed paint chip against the face of the knife and along the shear plane , which makes an angle **yf with the substrate .', ""Mr. Skolovsky's approach to the concerto was bold , sweeping and tonally percussive .""], [""however the President , who would like to woo the former Chinese province away from both Peking and Moscow , would promise Chen nothing more than an abstention by the U.S. if Outer Mongolia's admission comes to a vote ."", 'The matter of sympathy of the academic professors for art objectives also must be taken into account .'], [""`` You didn't tell me I had cancer '' ."", 'And the league takes a stand , with great regularity , on the side of right .'], ['As wars go , Laos is an extremely little one .', 'As wars go , Laos is an extremely little one .'], ['You read various guesses on how many Americans are camping .', 'You read various guesses on how many Americans are camping .']]","[[-0.21513724327087402, -0.21033436059951782], [-0.1018931120634079, -0.10181242227554321], [-0.000706356018781662, -0.0006927903741598129], [0.09775332361459732, 0.09776157140731812], [0.1916343718767166, 0.1916343718767166], [0.25320082902908325, 0.25320082902908325]]",188.8760986328125,88.93590545654297,"[149.23194885253906, 144.36383056640625, 129.3558349609375, 128.73728942871094, 105.56723022460938, 122.79600524902344]","[203.6656494140625, 221.35787963867188, 206.48678588867188, 196.0381622314453, 155.50390625, 183.98291015625]"
233,"Suddenly her shyness appeared, and she wanted to get out of there and quickly.","[['What we will be sacrificing in any such arrangement will be our power to be selective which is contained in the reciprocal trade principle under which we now operate .', 'You may have misgivings about certain aspects of our military establishment -- I certainly do -- but you know any comparison of over-all American strength with over-all Soviet strength finds the United States not only superior , but so superior both in present weapons and in the development of new ones that our advantage promises to be a permanent feature of U.S.-Soviet relations for the foreseeable future .'], ['So rules we made , in unabashed collusion .', 'but his morality rests upon that of his society .'], ['but never from Mr. Nixon , who looked on reporters with suspicion and distrust .', 'Mr. White admires him profoundly and leaves no doubt that he is a Democrat himself who expects Mr. Kennedy to be a fine President .'], ['I myself hear it said constantly -- in drawing-rooms .', 'Many years have passed since a Metropolitan audience heard anything comparable .'], ['They would feel what Mary was undergoing .', ""The night he saw it , a rather unpleasant situation arose when the soloist refused to approach the armadillo , complaining -- in ad-lib -- that `` it smelled '' .""], ['She was sure she would reach the pool by climbing , and she clung to that belief despite the increasing number of obstacles .', 'She was sure she would reach the pool by climbing , and she clung to that belief despite the increasing number of obstacles .']]","[[-0.1971716284751892, -0.19624222815036774], [-0.10364046692848206, -0.10349032282829285], [-0.0008238814771175385, -0.0007421504706144333], [0.09864863753318787, 0.0986582562327385], [0.19438853859901428, 0.19441702961921692], [0.3258201479911804, 0.3258201479911804]]",130.70501708984375,75.66627502441406,"[145.99307250976562, 101.84073638916016, 126.9027328491211, 86.3075180053711, 74.38658905029297, 67.14348602294922]","[177.18994140625, 139.4266357421875, 162.16989135742188, 111.83721923828125, 82.45662689208984, 79.50357818603516]"
112,Arrogant Boor.,"[['for Mother to be able to call , Susan must be napping now , surrounded by her multitude of dolls .', 'See the table on page 34 for exact recommended speeds .'], ['But even if that other plant employs the same number of workers and makes the same product , there are other facts to consider .', 'Such sections showed bright yellow-green specific fluorescence in the cells of the pseudophloem tissue ( Lee and Black , 1955 ) .'], ['Merchant ships illuminated in the light of the flares , made to seem like stones imbedded in a lake of polished mud , were impossible to miss .', 'The white girl with the penetrating green eyes sipped the lemonade handed to her by a handsome man of about 30 , who had coppery skin and beetling eyebrows .'], [""`` And whiskey '' , she said , smiling and blinking at the highball glasses ."", ""`` Don't you be afraid '' ! !""], [""Bridget's testimony was in direct contradiction ."", ""Barco was clearly a `` nut '' .""], ['He is a dull , unformed , and aimless person ; ;', 'For a moment his hatred toward drunken or careless drivers softened .']]","[[-0.1786772459745407, -0.17615389823913574], [-0.10540030151605606, -0.10525451600551605], [-0.0007632896304130554, -0.0007263161242008209], [0.09838926792144775, 0.09845687448978424], [0.18547526001930237, 0.18573954701423645], [0.22553077340126038, 0.2287783920764923]]",365.4657897949219,541.0968017578125,"[473.00921630859375, 494.0443420410156, 808.560302734375, 495.49005126953125, 382.9376525878906, 559.6870727539062]","[754.4755249023438, 1864.10302734375, 1032.26611328125, 354.61956787109375, 1498.7275390625, 510.4868469238281]"
371,Tess was frightened.,"[['It can contribute to the development of critical countries and regions .', 'As you can count on me to do the same .'], ['This is a normal governmental procedure which reflects more accurately cost-accounting principles .', 'What we will be sacrificing in any such arrangement will be our power to be selective which is contained in the reciprocal trade principle under which we now operate .'], ['Forty-five new Clinico-pathologic Conferences were prepared , bringing the total to 61 available for loan distribution .', 'We should recall the number of movements for the service of mankind which arose from the kindred Evangelicalism of the British Isles and the Pietism of the Continent of Europe -- among them prison reform , anti-slavery measures , legislation for the alleviation of conditions of labour , the Inner Mission , and the Red Cross .'], ['The police captain chortled .', 'Then we were off again .'], [""Still , he couldn't help thinking , we're all getting old , getting small ; ;"", 'Neither has Congressman Martin nor Senator McClellan been heard from on the matter ; ;'], ['Stanley really was quite predictable .', 'Pat meanwhile was bubbling over with sentiment .']]","[[-0.189693883061409, -0.18890057504177094], [-0.103705033659935, -0.10359549522399902], [-0.000897090882062912, -0.000880412757396698], [0.09849689155817032, 0.09853006899356842], [0.19415098428726196, 0.19415923953056335], [0.31213653087615967, 0.31238532066345215]]",97.29646301269531,70.8714828491211,"[164.0434112548828, 420.8134460449219, 389.06744384765625, 70.49957275390625, 106.55701446533203, 86.36466217041016]","[274.5926513671875, 491.3243408203125, 390.401611328125, 91.76271057128906, 139.15081787109375, 109.26900482177734]"
