target_idx,target_sent,sents_intrp_all_bins,sim_intrp_all_bins,base_PPL,unintrp_PPL,intrp_PPL_all_bins,local_PPL_all_bins
113,"She’s the same woman that Myra has been trying to get you to meet, but you’ve never taken the time,” Luigi said in defense of using her first name.","[['gauche rainbow shapes replaced the poignant ovals of gold .', 'They either walked or were driven .'], ['Inorganic structures are found in Chapters 2 - 12 , organic structures in Chapters 13 - 15 .', 'Sales and other operating income increased 25.1% from $24,926,615 in 1959 to $31,179,816 in 1960 .'], ['So I got out .', 'high-voltage electrophoresis and paper chromatography were used in preliminary structural studies ; ;'], [""`` Yes , ma'am '' , the children chorused heartily ."", ""In his answer thereto , he advised the Board that he had made no such statement in 1956 , and asserted that his only claim to `` pioneering '' was in 1952 .""], ['Over the weekend , Mrs. Self , personnel clerk , was a feted and honored guest of the Atlanta Club , organization of women employes at City Hall .', 'the attitudes of a U.N. delegate who experiences difficulty in finding adequate housing in New York City , or of a foreign diplomat in similar circumstances in our Capital , can easily be directed against the United States and all that it stands for .'], [""If asked how she gets her impressions , she probably can only say that she `` just gets them '' -- some more vividly than others ."", ""She has the small , highly developed body of a prime athlete , and holds in contempt the `` girls who just move sex '' .""]]","[[-0.16282594203948975, -0.16206923127174377], [-0.10386677831411362, -0.10373803973197937], [-0.0008478239178657532, -0.0008381875231862068], [0.09866154938936234, 0.09873361140489578], [0.1967773735523224, 0.19680340588092804], [0.29697173833847046, 0.29704561829566956]]",41.04179763793945,26.210660934448242,"[27.4342098236084, 28.534265518188477, 28.75305938720703, 30.792654037475586, 29.832321166992188, 26.181180953979492]","[44.04386520385742, 51.5836296081543, 40.232357025146484, 45.131622314453125, 38.09696578979492, 29.4949951171875]"
350,Marina had been surprised that her boss was already there.,"[['We do not favor one field over another : we think that all inquiry , all scholarly and artistic creation , is good -- provided only that it contributes to a sense and understanding of the true ends of life , as all first-rate scholarship and artistic creation does .', 'Different cards are used for males and females , and a corner is clipped from the cards of adults , and of children when they reach puberty .'], ['There we shall be free and unknown ; ;', ""We hope that he will execute it in a manner that will entitle him to credit '' .""], ['Whosoever violates our rooftree , the legend states , can expect maximal sorrow .', ""Today , seven years after the date of my initial induction as a draftee , I am Assistant Professor of Philosophy and Science at St. Michael's College .""], ['So , for all practical purposes , it was an independent nation and by now had its own organized government ( unrecognized outside its own borders ) .', 'So , for all practical purposes , it was an independent nation and by now had its own organized government ( unrecognized outside its own borders ) .'], ['It was blackmail and the clerk knew it .', ""Yet it wasn't so .""], ['the killing was already forgotten in that clear mind of his .', 'From here on out , the Ariadne was going to be hotter than any space cruiser man had ever dreamed of .']]","[[-0.19221822917461395, -0.1890919953584671], [-0.10323077440261841, -0.10314071178436279], [-0.0008866386488080025, -0.0008644461631774902], [0.0987350195646286, 0.0987350195646286], [0.19457024335861206, 0.19464971125125885], [0.31895846128463745, 0.3205946981906891]]",161.6670379638672,78.23595428466797,"[179.18057250976562, 93.75005340576172, 88.09870910644531, 131.062744140625, 82.83747863769531, 86.5079345703125]","[271.8795471191406, 173.87118530273438, 173.13461303710938, 303.7310485839844, 130.56292724609375, 125.01020050048828]"
274,"“Here is my resignation,” he said.","[['30% of them worried about past happenings which were completely beyond their control ; ;', 'She was closely associated with the Founders in all their trials and hardships .'], ['Another element to concern the choreographer is that of the visual devices of the theatre .', 'These keys are the working principles of physics , mathematics and astronomy , principles which are then extrapolated , or projected , to explain phenomena of which we have little or no direct knowledge .'], ['and an Air Force of 91 combat wings and 825,000 men .', 'but the old fellow , a lifelong teetotaler , refused it , and no more was thought of the matter .'], [""the administration's official budget review , which estimates a 6.9 billion dollar deficit for the current fiscal year , isn't making anyone happy ."", ""the administration's official budget review , which estimates a 6.9 billion dollar deficit for the current fiscal year , isn't making anyone happy .""], [""He kept sayin , not me , not me , I don't wanta wind up like em ."", ""`` Oh , Mr. Davis , are you there '' ? ?""], [""He said , `` Right around the corner '' ."", ""`` Now don't shut this door .""]]","[[-0.18073904514312744, -0.17963257431983948], [-0.10318490862846375, -0.10314853489398956], [-0.0007575824856758118, -0.0007269568741321564], [0.0988907516002655, 0.0988907516002655], [0.19529616832733154, 0.19561325013637543], [0.33652132749557495, 0.33720964193344116]]",63.308570861816406,29.388355255126953,"[34.566471099853516, 45.430355072021484, 37.851478576660156, 34.591796875, 39.3216438293457, 34.83861541748047]","[46.491661071777344, 64.82624053955078, 49.7944221496582, 47.618629455566406, 43.7112922668457, 34.2237434387207]"
412,"Imagining the argument between the two, he looked at David, smiling as he said, “I’ll be in the office, if you need any help convincing her, David.”","[['yet each historical event remains unique .', 'To achieve this destiny , acts as well as words are needed -- not only acts that lead to physical strength but also acts that lead to strength based on right doing and respect .'], [""It's year-round , and everywhere ."", 'Unlimited game bags are possible and legal in more than 40 states , on shooting preserves ( one of the newer phases of modern game-management ) for five and six months each year .'], ['But he was too late .', ""Wine : `` Then you were typing poems this afternoon '' ? ?""], ['He rose at 4:00 A.M. the year round and was apt to stride through camp crowing like a cock to wake his men .', 'He rose at 4:00 A.M. the year round and was apt to stride through camp crowing like a cock to wake his men .'], ['That was his complete discussion of Bridget Sullivan as a possible suspect .', 'Their names had not come up in any discussions with Laura , and he had no idea what they would be like .'], [""`` Maybe I could '' , he said , surprised that she could turn from herself and notice anything about him ."", ""`` Maybe I could '' , he said , surprised that she could turn from herself and notice anything about him .""]]","[[-0.19574761390686035, -0.1915414184331894], [-0.10385707020759583, -0.1038018986582756], [-0.0012261178344488144, -0.0012059938162565231], [0.09918681532144547, 0.09918681532144547], [0.19755850732326508, 0.19775766134262085], [0.30839434266090393, 0.30839434266090393]]",82.17829132080078,50.59126663208008,"[68.87174224853516, 59.31314468383789, 58.85114288330078, 52.413169860839844, 53.06049728393555, 51.15907287597656]","[92.66521453857422, 79.31183624267578, 74.02379608154297, 65.24523162841797, 66.72216796875, 55.52277374267578]"
333,"David stood up, and holding his hand out to her, he led her to his desk where he promptly called Carla to give her the good news personally.","[['These factors practically insure that no single financing formula is feasible ; ;', ""`` A pack of dogs makes less noise '' ! !""], [""We simply can't tolerate further Russian weapons , including the possibility of long-range nuclear missiles , being located in Cuba ."", 'If it were wholly random and unrelated , it would be 2.0 , assuming the five classes were equal in n , which approximately they are .'], ['However , in recent decades , for what doubtless are multiple reasons , an unannounced but nonetheless readily observable shift has occurred in both facets of national activity .', 'What was it to Prokofieff ? ?'], ['When it was over , eight of his company were still alive and all eight were wounded .', 'Hatless , in an overcoat of rough blue wool , I was given a proud farewell by my mother and father , and I set out into the strangely still streets of Brooklyn .'], ['sometimes she opened her eyes and looked around , and sometimes she took a little milk or soup .', 'His problem then became one of restraining the American fighters who wanted to clean out the Vermejo by force immediately .'], [""Now , Mis-ter McBride '' , said Lord , and he laid a firmly restraining hand on the field boss's arm ."", 'She did not look at him , but he noticed that her face was flushed and her eyes unsteady .']]","[[-0.17772385478019714, -0.17647944390773773], [-0.10292471945285797, -0.1028117835521698], [-0.001054711639881134, -0.0010308129712939262], [0.09877556562423706, 0.09877929091453552], [0.1977091133594513, 0.19771361351013184], [0.34571021795272827, 0.3457568883895874]]",83.38274383544922,61.42482376098633,"[80.78157806396484, 71.4800033569336, 76.34698486328125, 62.625205993652344, 68.75932312011719, 64.5496826171875]","[98.03352355957031, 95.47702026367188, 96.59790802001953, 64.99706268310547, 71.54056549072266, 69.5750732421875]"
