target_idx,target_sent,sents_intrp_all_bins,sim_intrp_all_bins,base_PPL,local_unintrp_PPL,local_intrp_PPL_all_bins,global_unintrp_PPL,global_intrp_PPL_all_bins
4,"According to the latest national data from the National Center for Health Statistics (NCHS), the likelihood that a couple will celebrate their 20th wedding anniversary today isn't much greater than a coin toss: 52 percent for women and 56 percent for men.","[['In view of the increasing shortage of usable surface and ground water in many parts of the Nation and the importance of finding new sources of supply to meet its present and future water needs , it is the policy of the Congress to provide for the development of practicable low-cost means for the large-scale production of water of a quality suitable for municipal , industrial , agricultural , and other beneficial consumptive uses from saline water , and for studies and research related thereto .', 'A press with an 11 inch capacity lets you drill to the center of a 22 inch board or circle .', 'It should be noted that there are other and equally important reasons for establishing meaningful intergovernmental reporting bases on a uniform fiscal year .', 'Sometimes , you have a choice of exposure for sites where the topography or trees of the area will provide afternoon shade , morning sun , or whatever may be most desirable for the use intended .'], ['Protection from other damage', ""Now look , there's work to be done and lots of it ."", ""Now look , there's work to be done and lots of it ."", 'The revolution now under way in materials handling makes this much easier .'], ['I tossed the bottle .', 'Her hum became a gurgle of surprise .', 'In the main , this course took the following directional high roads .', 'Furthermore , there is a cautious conservatism on the part of those making local skill surveys .'], ['he studied them , compared them with what he had been taught as a nestling , struggling to bridge between languages , the one he thought with and the one he was learning to think in .', 'he studied them , compared them with what he had been taught as a nestling , struggling to bridge between languages , the one he thought with and the one he was learning to think in .', ""When Johnson ejaculated `` Howsabout my buying us all a nice cold Co-cola , Ma'am '' ? ?"", ""but the nicest thing about their relationship was her whisper to him , repeated some thousands of time , repeated with smiles and hope , `` People never live forever '' .""], ['The first incident occurred before the trial got under way when Judge H. Hobart Grooms told the jury panel he had heard reports of jury-tampering efforts .', ""to Alex they were merely six not unusual hens' eggs ."", 'For that is the one an increasingly large number of prominent Americans are now proposing .', ""`` Never mind '' , Arlene had said , after the policeman had left , having pursued the usual unco-operative course of grownups .""], [""for to attend the dying was something she had never experienced , and certainly had not imagined when she thought of the duties she would have as Bobby Joe's wife ."", 'The blue-draped Virgin was still there , but no one knelt before her now .', ""`` Not the least bit '' , Arlene snapped ."", ""I had thought we would never again speak to each other '' .""]]","[[-0.16264352202415466, -0.16258835792541504, -0.1602286696434021, -0.15973205864429474], [-0.10488127171993256, -0.10486060380935669, -0.10486060380935669, -0.10430242866277695], [-0.0006678774952888489, -0.0006439611315727234, -0.0006285272538661957, -0.0006081424653530121], [0.09949374198913574, 0.09949374198913574, 0.09950883686542511, 0.09950894117355347], [0.19672182202339172, 0.19680652022361755, 0.1970362365245819, 0.19705167412757874], [0.29995423555374146, 0.3007507622241974, 0.3014373779296875, 0.3024076819419861]]",53.13038635253906,46.063072204589844,"[50.951908111572266, 47.65409851074219, 48.8870735168457, 53.34381103515625, 56.50886917114258, 50.36921691894531]",47.830345153808594,"[50.865501403808594, 48.04661178588867, 49.24422836303711, 50.86628723144531, 56.65934371948242, 50.49263000488281]"
49,"Still, many happy honeymooners go on to divorce years later.","[['and that which is born of the Spirit is spirit .', 'There shall be deducted from the amount of each payment made pursuant to subsection ( C ) of Section 8 , as reimbursement for the expenses incurred by the United States , an amount equal to 5 per centum of such payment .', 'There shall be deducted from the amount of each payment made pursuant to subsection ( C ) of Section 8 , as reimbursement for the expenses incurred by the United States , an amount equal to 5 per centum of such payment .', 'They must be persuaded to adopt the other necessary self-help measures which are described in the preceding section .'], ['Third , there were those ( notably Patrice Lumumba ) who favored a unified Congo with a very strong central government .', ""The 1961 theme is the Dakota Territorial Centennial , with the pictures including the Lewis and Clark expedition , the first river steamboat , the 1876 gold rush , a little red schoolhouse on the prairie , and today's construction of large Missouri River reservoirs ."", ""The 1961 theme is the Dakota Territorial Centennial , with the pictures including the Lewis and Clark expedition , the first river steamboat , the 1876 gold rush , a little red schoolhouse on the prairie , and today's construction of large Missouri River reservoirs ."", 'They enjoyed lemonade and cookies served before and during the concert by teenage sons and daughters of members of the White House staff .'], [""They run their show their way -- the Universe has variety , something for everybody -- a fact you field workers often miss '' ."", 'There was no implication made that their initial reaction ( absence of an arm-elevation ) was less preferred than the presence of levitation .', 'The buckskin bolted out of the stall .', 'Areas should be large enough to include the attractions , have ample space for the use of facilities needed , and have room around the edges to protect the values of the area from encroachment by private developments .'], [') But he read on .', 'Holders of toll-road bonds are finding improvements in monthly reports on operation of the turnpikes .', ""From next New Year's Day let us keep careful account of each successive fatality on the highways , publicizing it on all media of communication ."", ""Mr. Nagrin has described four `` places '' , each with its scenery and people , added two `` diversions '' , and concluded with `` A Toccata for the Young '' , a refreshingly underplayed interpretation of rock'n'roll dancing .""], ['Queried about the impasse , Allied Arts said : `` Better cancel the Kirov for the time being .', 'Opera in the Grand Tradition , along with mah-jongg , seems to be staging a well-deserved comeback .', 'Afraid at one and the same time that his work might be turned down -- which would be a blow to his pride even though no one knew he was the author -- and that the work would be accepted , and then that his violent feelings in the matter would certainly betray how deeply concerned he was in spite of himself .', 'Inevitably this means some compromise .'], ['at least until repeated intercourse has dilated it and pain is no longer a possible threat against the full pleasure of love-making .', 'More time was spent in trying to marry these incompatibles than over any subject discussed at Yalta .', 'Gunny symbolized so much that was unpleasant -- Tolley , the indifference with which the Fairbrothers and indeed the whole neighborhood now treated her and which she would die rather than acknowledge to her husband , his lack of understanding and sympathy in her present condition , her disgusting swollen stomach .', 'that aside from due notification of certain major events in their lives ( two marriages , two births , one divorce ) , Christmas and Easter cards of the traditional sort had been the only thin link she had with them through the widowed years .']]","[[-0.16241705417633057, -0.160369411110878, -0.160369411110878, -0.15966621041297913], [-0.10507728159427643, -0.1050279289484024, -0.1050279289484024, -0.10403530299663544], [-0.0010688276961445808, -0.0010623764246702194, -0.0009355966467410326, -0.0008489442989230156], [0.09916696697473526, 0.09925124794244766, 0.09929092228412628, 0.09931746125221252], [0.19654954969882965, 0.19656527042388916, 0.19664716720581055, 0.1966896802186966], [0.3134358823299408, 0.3151111602783203, 0.3243231773376465, 0.3244798183441162]]",107.7564926147461,98.36949920654297,"[98.80476379394531, 77.6375503540039, 100.42533874511719, 85.59925079345703, 80.67171478271484, 83.15919494628906]",135.37698364257812,"[121.0834732055664, 85.93415832519531, 135.02137756347656, 125.62808227539062, 112.70935821533203, 109.12435913085938]"
58,"Men seem to need these affirmations most, Orbuch's analysis suggests.","[[""At the University of Washington Medical School , the electronics group has developed the `` Respiratory Gas Analyzer '' shown in Fig. 3 ."", ""We'll still have the rifle , and I might be able to round up some more ."", 'I will get you inside the guard camp as a member of my crew .', 'During the period , the laboratory rendered centralized macropathological service to qualified requesters .'], ['Three groups to meet', 'Moreover , even getting this across would be difficult .', 'I dropped the sheet , glanced at my watch .', ""I'll switch on the floods '' .""], ['There is even some question whether the U.S. can any longer defend itself against an initiative by the Left .', 'As she reached the kitchen door the answer presented itself ; ;', 'He was a fine and showy rider , but his skill was wasted on us .', 'It had been a big battle , and the Confederate forces had won .'], ['Later , browsing in an old issue of the Gazette Des Beaux-Arts , she found a description of a handsome gilt pier-table purchased in 1817 by President James Monroe .', 'Later , browsing in an old issue of the Gazette Des Beaux-Arts , she found a description of a handsome gilt pier-table purchased in 1817 by President James Monroe .', ""`` At first I was homesick '' , he answered ."", ""`` At first I was homesick '' , he answered .""], [""Even though I have always had a genius for `` throwing myself '' into every role and `` playing it for all it's worth '' , no actress can be expected to do her best work when her fortune , her reputation , her livelihood , her home and her nation itself are all imperilled ."", 'She smiled at him with benign , remote happiness ; ;', ""Her words jumbled together and she all but ran from the office and from the question in Rev's face ."", 'The children looked at each other and sagged their bottoms down even more comfortably than ever .'], [""If it is love , you don't ."", ""But the greater part of semester time was actually centered around the attitudes : `` So we are married -- now how do we make the best of it '' ? ?"", ""I don't ask you who 'tis you're being unfaithful to , husband or lover ."", ""I'm honey only to my husband , understand '' ? ?""]]","[[-0.16390004754066467, -0.16308528184890747, -0.16280706226825714, -0.16263613104820251], [-0.10346764326095581, -0.10327011346817017, -0.10320572555065155, -0.10302527248859406], [-0.0006917649880051613, -0.0006847549229860306, -0.00067139882594347, -0.0006704935804009438], [0.09925977885723114, 0.09925977885723114, 0.09928561747074127, 0.09928561747074127], [0.1955171823501587, 0.1955224871635437, 0.19590342044830322, 0.19601446390151978], [0.3043908476829529, 0.3072017431259155, 0.30875521898269653, 0.31032323837280273]]",360.791748046875,245.14108276367188,"[247.60531616210938, 244.43093872070312, 252.10787963867188, 257.8356628417969, 258.31817626953125, 242.53488159179688]",216.71401977539062,"[241.10450744628906, 223.28334045410156, 232.3770751953125, 235.80035400390625, 242.32115173339844, 230.98069763183594]"
72,"Couples' communication patterns proved to be more predictive of divorce than their reported levels of commitment, personality assessments and stress (, 2012).","[['These data are not of the precision obtainable by the methods previously mentioned , but the vast number of approximate values available will be useful in many areas .', 'Lighting my pipe , I took a walk .', '`` I got a bone to pick with you , Mr. Paxton .', 'he is a coordinate part of all of the mysterious energy and being and movement .'], [""The Keystone Broadcasting System's Negro network includes 360 affiliated stations , whose signals reach more than half the total U.S. Negro population ."", ""`` A body would swear I floated right up here on a cloud '' ! !"", 'information concerning patents , copyrights and trade marks , availability of technical reports , and other subjects of interest to small business .', ""The charge , I tell you '' ! !""], ['One of the offices slated for reconstruction is the aged Court of Claims , diagonally across the street from the White House .', 'The Mississippi Sound leads into a protected waterway running about 200 miles from Pascagoula to Apalachicola .', 'This was accounted for primarily by the presence of a bronchial artery closely following the pulmonary artery .', ""It is also significant that neither this report nor the hearing officer's notes were furnished to the appeal board .""], ['In each case , lines of the bundles are transformed by involutions within the pencils they determine with the multiple secant .', 'Sections of sweet clover stem and root tumors were treated with 1 : 10 solution of Af for 30 minutes , washed in buffered saline for 15 minutes , stained with Af for 30 minutes , and washed for 15 minutes in Aj .', ""In discussing the ways this crisis is germane to consderations for the prevention of illegitimacy , we shall again superimpose Erikson's concept on our data ."", 'Mr. A has recovered , but he is , justifiably , a bitter man .'], [""in three months the Army spent three-quarters as much as had been expended on the `` big Ditch '' in ten years ."", 'This torque causes the entire system to rotate about the **yf axis , since the response to Af .', 'In the range and variety of characters who , in their literary lives , get along all right with life styles one never imagined possible , there is an implicit lesson in differentiation .', 'Both of them did communicate one central theme : Against the ruin of the world , there is only one defense -- the creative act .'], ['The years , if they were years , went by .', 'He had known when he first helped her to meet the right people and work with them that she did not intend to marry him .', 'Then Miriam varied the senseless psychological warfare by suddenly withdrawing a suit for separate maintenance that had been pending , and asking for divorce on the grounds of cruelty , with the understanding that Wright would not contest it .', ""`` You are bound to get involved with people when you have children '' , Fran had told me at our first meeting , `` so it is good to know that those with whom you get involved are not just dreary little housewives and dull husbands , but People Who Do Things '' .""]]","[[-0.16307473182678223, -0.1604040563106537, -0.16001325845718384, -0.15968680381774902], [-0.10351765155792236, -0.10350659489631653, -0.10344162583351135, -0.10341671854257584], [-0.0006300471723079681, -0.0006175041198730469, -0.0005987528711557388, -0.0005790367722511292], [0.09903259575366974, 0.09906285256147385, 0.09909122437238693, 0.09911824762821198], [0.19479264318943024, 0.19480767846107483, 0.1948886513710022, 0.19492726027965546], [0.3169121742248535, 0.3174125552177429, 0.32259249687194824, 0.3272136449813843]]",211.8409881591797,171.7277374267578,"[167.86495971679688, 157.539794921875, 160.90887451171875, 159.2192840576172, 189.69293212890625, 178.9653778076172]",139.5576171875,"[142.75558471679688, 131.6876220703125, 142.5232391357422, 137.33291625976562, 144.92955017089844, 153.48446655273438]"
107,"And somehow, there's this belief that we don't have to work at learning how to be a couple, it should just come naturally,"" he says.","[[""For it is their catastrophic concept of the Anglo-Saxon invasions rather than Kemble's gradualist approach which dominates the field ."", 'So much for the prototype .', 'We found no obvious effects due to preferred orientation of the crystallites in this sample nor would we expect to on the basis of the shape found from electron microscopic examination .', 'There is no way for him not to know it : there are few things under heaven more unnerving than the silent , accumulating contempt and hatred of a people .'], [""We fail to see how such procedure resulted in any prejudice to petitioner's contention , which was considered by the appeal board and denied by it ."", 'Small antelope were generally grassed with one shot , and the Magnum carbine also bagged reedbuck , kob and wart hog with deadly efficiency ; ;', 'and again , that `` the object of non-violent resistance is partly analogous to this object of war -- namely , to demoralize the opponent , to break his will , to destroy his confidence , enthusiasm , and hope .', 'But consideration of the frequency of stems per constant meaning seems to be established as having significance in comparative situations with diachronic and classificatory relevance ; ;'], ['Its Completion thus becomes one of the convenient maturity indicators to include in studies of growth , dietary patterns , and health during adolescence .', ""He recalls with a wry smile the wit who said , on returning from a homecoming reunion , that he would never go again because all his class had changed so much they didn't even recognize him ."", 'In addition to the regular schedule , advertisements were run for maximum impact in special editions of the New York Times , Boston Herald , American Banker , Electronic News and , for local promotion , the Providence Sunday Journal .', 'Morse said Borden let him out and locked the screen door .'], [""Miss Hardwick speaks of his `` superb gift for intellectual friendship '' , and it is certainly a joy to see the intellectual life lived so free from either academic aridity or passionate dogmatism ."", 'Already , however , several of the turnpikes are earning enough to cover interest requirements by comfortable margins .', ""The instruments don't show them '' ."", ""The instruments don't show them '' .""], [""`` But it really wouldn't be fair , taking your jobs away from you '' ."", ""But with Welch's relentless pursuit of the subject , Barco finally `` broke '' and started confessing to one murder after another ."", 'So , if anybody solicits by phone , make sure you mail the dough to the above .', ""`` You're leading Dad down the garden path '' .""], [""`` A person with a master's degree in physics , chemistry , math or English , yet who has not taken Education courses , is not permitted to teach in the public schools '' , said Grover ."", 'This the therapist may pursue in later questioning .', 'Start on the knees in a large circle .', 'You also , when you were dead by reason of your offenses and sins .']]","[[-0.17153489589691162, -0.16894428431987762, -0.16782401502132416, -0.16714781522750854], [-0.1019914299249649, -0.10198486596345901, -0.10198405385017395, -0.10198094695806503], [-0.0006188936531543732, -0.0006174612790346146, -0.0006160587072372437, -0.0005990825593471527], [0.09908163547515869, 0.09910166263580322, 0.09914235770702362, 0.09914235770702362], [0.188741073012352, 0.1887778341770172, 0.18901044130325317, 0.1891733705997467], [0.23772601783275604, 0.23865944147109985, 0.2394379824399948, 0.2412036657333374]]",177.20286560058594,118.69349670410156,"[116.82431030273438, 121.88728332519531, 127.9215316772461, 120.20146942138672, 124.76354217529297, 118.08309173583984]",110.71989440917969,"[109.05122375488281, 112.04891967773438, 122.01998901367188, 114.71247100830078, 115.63504791259766, 111.14572143554688]"
