target_idx,target_sent,sents_intrp_all_bins,sim_intrp_all_bins,base_PPL,local_unintrp_PPL,local_intrp_PPL_all_bins,global_unintrp_PPL,global_intrp_PPL_all_bins,base_entropy,local_unintrp_entropy,local_intrp_entropy_all_bins,global_unintrp_entropy,global_intrp_entropy_all_bins
6,"As a result, experts routinely estimate that between 40 percent and 50 percent of marriages today will end in divorce.","[['The scant flesh grew cool beneath her frantic hands .', 'Somebody brought a light .'], ['Petitioner was not entitled , either in the administrative hearing at the Department of Justice or at his trial , to inspect the original report of the Federal Bureau of Investigation , since he was furnished a resume of it , did not challenge its accuracy , and showed no particular need for the original report .', ""It fits the pattern of secrecy and stealth you've been involved in '' .""], [""He didn't seem to think that attaching a pegboard to a stone wall was much of a problem and he tossed off the building of the worktable equally lightly ."", '`` What shall we do with this one ? ?'], ['It had been here fifty years .', 'Perhaps the Pirate who will be the unhappiest over the news that Musial probably will sit out most of the series is Bob Friend , who was beaten by The Man twice last season on dramatic home runs .'], ['The flood is not as great -- only 700 a week according to one apparently conservative account -- but it is symptomatic .', 'Of course , some of the credit for the sale boost must be given to improvement in the weather and to the fact that Easter comes more than two weeks earlier than in 1960 .'], ['They were married at a lavish ceremony which was duly recorded in Parvenu and all other magazines and newspapers , and then they honeymooned in Bermuda .', 'Stars throughout the volume denote dates of marriages during the past year .']]","[[-0.17150527238845825, -0.1706210970878601], [-0.10145042836666107, -0.10123760998249054], [-0.00043676793575286865, -0.000431794673204422], [0.09846551716327667, 0.09856255352497101], [0.19244883954524994, 0.19250695407390594], [0.2700614929199219, 0.27195751667022705]]",38.10108947753906,38.10108947753906,"[39.33930969238281, 41.69935607910156, 44.34929656982422, 39.808284759521484, 31.653831481933594, 27.654367446899414]",20.923343658447266,"[23.01170539855957, 31.946271896362305, 28.487064361572266, 27.464717864990234, 21.657739639282227, 25.343753814697266]",2.7188358306884766,2.7188358306884766,"[2.7414767742156982, 2.7900688648223877, 2.9539432525634766, 2.665156602859497, 2.7015273571014404, 2.5927534103393555]",2.4383368492126465,"[2.7465054988861084, 2.810786008834839, 2.923968553543091, 2.482367515563965, 2.537926435470581, 2.595979690551758]"
7,"For decades, psychologists have been trying to answer the key question: What's going on when two people who once said ""I do"" to a lifetime together decide they're better off apart?","[['This document began : `` No. 1 Newbury Port , may 30th , 1791', 'Ekstrohm shouldered his way outside and scanned the veldt .'], ['The bandit laughs in his face .', 'There was no chance .'], ['State aid to schools , the continuance of railroad passenger service , the proper uses of surplus funds of the Port of New York Authority , and making New Jersey attractive to new industry .', 'If that was the skiff , it was making unprecedented speed .'], ['We have so many new things to fear in this age of nuclear weapons , dreadful things which are too horrible to contemplate .', 'Though it may exist in either literate or illiterate societies , it assumes a role of true cultural importance only in the latter .'], ['It is not much better if he meets with old classmates .', 'The truth is , though , that men react differently to different treatment .'], [""Each of the organization's ninety-nine members would get two professional posts , such as political affairs officer , a department head or an economist , to start ."", 'He thought that if once , only once , he could talk with Simms Purdew , something about his own life , and all life , would be clear and simple .']]","[[-0.1627037525177002, -0.16067898273468018], [-0.10238942503929138, -0.10233944654464722], [-0.0005751661956310272, -0.00044492539018392563], [0.09932039678096771, 0.09933538734912872], [0.19597592949867249, 0.19610655307769775], [0.307431697845459, 0.30755332112312317]]",96.2269515991211,96.2269515991211,"[101.86881256103516, 92.50835418701172, 92.8284912109375, 94.90233612060547, 90.05735778808594, 92.56028747558594]",108.0985107421875,"[92.7145767211914, 95.30667114257812, 99.46491241455078, 107.02324676513672, 101.53719329833984, 92.47901916503906]",4.012792587280273,4.012792587280273,"[3.9253315925598145, 3.986020565032959, 4.032358646392822, 3.9937310218811035, 3.933588981628418, 3.9144537448883057]",3.9095892906188965,"[3.9376165866851807, 4.003068447113037, 3.989452600479126, 4.000360012054443, 3.8796279430389404, 3.9339756965637207]"
10,"Some of those factors, including ethnic background and socioeconomic status, are beyond a couple's control.","[['If you plan to add cooling later to your heating system , there are things to watch for .', 'Turning to the Word of God , we find the only sure way to do that .'], ['The story opens on the eve of his fifty-third birthday , as he prepares for the two weeks of festivities that are to follow .', ""`` We won't live long enough if I wait for you , besides which you don't need to worry -- there'll be plenty more '' .""], ['The double meaning in the anatomical made it a familiar vaudeville device , as in the gags of Weber and Fields .', ""`` Uh-huh '' , Ryan admitted .""], ['He said he would not be surprised if some of the more than 30 members of the group are interested in running on the required non-partisan ballot for posts on the charter commission .', ""I grew up in an Irish neighborhood on Chicago's West Side .""], ['Forces will survive a surprise attack , and these forces will give depth , or considerable duration , to the conflict .', 'At the same time that religion exercises a conserving influence , it also energizes and motivates both individuals and groups .'], ['Out of many factors which might be cited , five are most important : 1 .', ""It combines qualities that are seldom found in one work : Scrupulous scholarship , a fund of personal experience , a sense of drama and characterization and a broad grasp of the era's great historical issues .""]]","[[-0.18109889328479767, -0.18099479377269745], [-0.10146427154541016, -0.10132645070552826], [-0.00043534673750400543, -0.00037511158734560013], [0.09884858131408691, 0.09887652099132538], [0.19020843505859375, 0.19040842354297638], [0.24038301408290863, 0.24091582000255585]]",65.64418029785156,65.64418029785156,"[69.62047576904297, 71.58789825439453, 80.3161849975586, 53.723228454589844, 57.22800064086914, 51.10783386230469]",56.45120620727539,"[51.762760162353516, 53.1794548034668, 52.65144348144531, 43.655155181884766, 50.65213394165039, 42.24337387084961]",4.031998634338379,4.031998634338379,"[4.182384490966797, 4.15963077545166, 3.9377353191375732, 4.002969741821289, 3.9559600353240967, 4.026569366455078]",4.031766414642334,"[4.1185622215271, 4.2203803062438965, 4.033125877380371, 4.113165855407715, 4.0256452560424805, 4.117730617523193]"
31,"Couples who rarely get a chance to restore their ""reserves,"" such as those from low-income communities, can be particularly prone to marital dissatisfaction and divorce.","[['He climbed the steps of the first and opened the door to the vestibule .', 'the killing was already forgotten in that clear mind of his .'], [""Then his son did something '' -- Rachel threw up her hands -- `` I don't know what , but something , to an official here -- it was during the Mandate -- and the son was imprisoned ."", 'Every eye was on him as he began to speak .'], ['In addition , Blue Cross coverage for all employees and their dependents was extended to provide the full cost of semi-private hospital accommodations .', 'Bill shook his head .'], ['Such a man must be able and willing to give clear and sensible advice to the whole group , a person in whom all the member nations will have absolute confidence .', 'She can decrease the number of temptations .'], ['These public efforts were rare because Mr. Rayburn normally did his counseling , persuading and educating long before an issue reached its test on the House floor .', ""If , however , it would help to intensify your anguish , I can delimit the powers of a few of the divinities you've affronted and describe the punishment they meted out in one analogous instance .""], ['I know of no other solution than the one N.C. proposes -- to do what we can for each sufferer as he confronts us , hoping that this will spread beyond him to others at some time and some place .', 'Fortunately , there are no cities or towns in the state , with one or two possible exceptions that are in too difficult a position to finance the proposed change .']]","[[-0.1747283637523651, -0.17420083284378052], [-0.10166049003601074, -0.10164960473775864], [-0.0003928225487470627, -0.00039039086550474167], [0.09928230196237564, 0.09928436577320099], [0.19591742753982544, 0.19630423188209534], [0.31067949533462524, 0.31511110067367554]]",233.86842346191406,233.86842346191406,"[324.9182434082031, 333.1283874511719, 276.3974914550781, 180.3922576904297, 226.69422912597656, 192.4132537841797]",165.47930908203125,"[213.38124084472656, 260.7707214355469, 193.9145050048828, 187.97116088867188, 183.177978515625, 157.01968383789062]",4.259987831115723,4.259987831115723,"[4.417442321777344, 4.477228164672852, 4.376646041870117, 4.30268669128418, 4.47063684463501, 4.422231197357178]",4.212554931640625,"[4.396483421325684, 4.421973705291748, 4.42043399810791, 4.231629371643066, 4.28840446472168, 4.308099746704102]"
79,"The happiest couples also share their hopes, dreams and fears.","[['Although a somewhat technical subject , it has important political implications as the above discussion of the voting system indicated .', 'A number of strong independent agencies , established in some cases with governmental or royal support , have conducted large medical , social , educational and research operations in particular parts of the Congo and Ruanda-Urundi .'], [""You've got no business up here '' ."", 'for still others , mostly of the nineteenth-century immigration , it was Roman Catholicism , and for a small minority it was Eastern Orthodoxy .'], [""`` Keith '' , said Penny , `` Keith , you were wonderful ."", ""`` Squaresville , man , and all the palazzos are crummy Palasts '' .""], [""`` Doctor '' Lee asked her to lie down on a bed and remove her shoes ."", 'Nothing is easier to grow from seed than pansies .'], ['Mike liked having light up through the ripples ; ;', 'They were married at a lavish ceremony which was duly recorded in Parvenu and all other magazines and newspapers , and then they honeymooned in Bermuda .'], ['She was rollickingly happy .', 'In repetitions of the experiment from couple to couple , the votes of the two persons in a couple probably agree more often than independence would imply , because couples who visit the museum together are more likely to have similar tastes than are a random pair of people drawn from the entire population of visitors .']]","[[-0.1913338154554367, -0.1902630627155304], [-0.1015113890171051, -0.10143217444419861], [-0.00043427571654319763, -0.00041805580258369446], [0.09893326461315155, 0.0989801287651062], [0.19154945015907288, 0.19197990000247955], [0.2736152112483978, 0.27393853664398193]]",446.6719055175781,446.6719055175781,"[407.87200927734375, 326.71142578125, 252.54693603515625, 567.0313110351562, 515.5722045898438, 272.332763671875]",276.6875915527344,"[381.1276550292969, 232.2120361328125, 178.40354919433594, 259.1575012207031, 254.9609832763672, 228.01011657714844]",4.128765106201172,4.128765106201172,"[4.20085334777832, 3.9143073558807373, 3.990680456161499, 4.256744384765625, 3.952357053756714, 4.313271522521973]",4.3621344566345215,"[4.3277587890625, 4.174209117889404, 4.180594444274902, 4.351020812988281, 4.266838073730469, 4.349968910217285]"
