target_idx,target_sent,sents_intrp_all_bins,sim_intrp_all_bins,base_PPL,local_unintrp_PPL,local_intrp_PPL_all_bins,global_unintrp_PPL,global_intrp_PPL_all_bins,base_entropy,local_unintrp_entropy,local_intrp_entropy_all_bins,global_unintrp_entropy,global_intrp_entropy_all_bins
44,"Men's feet, on the other hand, did not have such predictive powers — they were more likely to be cold in the first place (Journal of Family Psychology, 2012).","[['For the treatment of bacterial scours , feed 100-200 grams .', 'method of distributing funds'], ['`` Okay , take the tray .', 'the balanced use of recreation , hunting , and fishing areas ; ;'], ['He had never heard so many bells , and as he lay there listening , he thought of her scolding him for his remarks when he had looked up at the obelisk and the church at the top of the Spanish Steps .', ""Now you go outside and beckon me when it's safe '' .""], ['She looked mighty interested , though .', 'Once I had a religious emotion .'], [""On the basis of the long chronicle of military history Funston and his brethren assumed that the issue was insoluble and that anyone interested in a mission like Fosdick's was an impractical idealist or a do-gooder ."", 'Instead it means that the thinking in which decision issues has the power to determine the morality of the decision , as in this instance the pressure for renewed practical or legislative attention to the constitutional problems the decision had uncovered might have done .'], ['Whatever the cause , his mood in the fifties rarely rises above the level of the capably sardonic .', ""Adams was not breaking new ground when he claimed that the worship of an unseen power was in reality a reflection of man's inability to cope with his environment .""]]","[[-0.14265459775924683, -0.14225450158119202], [-0.100301593542099, -0.10017552971839905], [-9.007938206195831e-05, -6.309524178504944e-05], [0.09989932924509048, 0.09990356862545013], [0.1993962675333023, 0.19989392161369324], [0.336807519197464, 0.3620694875717163]]",61.292842864990234,61.292842864990234,"[58.25688171386719, 58.007266998291016, 65.86148834228516, 54.73093032836914, 58.1353645324707, 53.86701965332031]",40.92763900756836,"[45.070159912109375, 46.01877212524414, 54.817562103271484, 42.05691909790039, 49.954471588134766, 43.90570831298828]",4.008970260620117,4.008970260620117,"[3.89996600151062, 4.185873508453369, 4.04818868637085, 3.8372464179992676, 3.704282522201538, 3.867966651916504]",3.495105743408203,"[3.721623420715332, 3.919804573059082, 3.902085542678833, 3.674098253250122, 3.531757354736328, 3.6911325454711914]"
58,"Men seem to need these affirmations most, Orbuch's analysis suggests.","[['There are 70 children there and the mothers donate one day a week to the school .', 'Presently she came out of the schoolhouse .'], ['The camp was a cluster of aluminum bubbles , ringed with a spy web to alert the Earthmen to the approach of any being .', ""Mongi Slim of Tunisia and Frederick Boland of Ireland were early favorites in the running , but France didn't like the former and the Soviet Union would have none of the latter .""], ['Then the audience saw a small , dim figure appear at the edge of the Presidential box .', 'Two entries in The Early Life support the assumption that during this period Hardy had virtually suspended the writing of poetry .'], ['At the opening of the Dusseldorf show , Thompson himself scarcely glanced at the treasures that he was seeing together for the last time .', 'Monel shows improvement with each work-out and looks the makings of a good brood mare after winning her share of races .'], [""`` Ekstrohm , Nogol , you guys okay '' ? ?"", 'Final adjuncts may or may not have dominant stress .'], ['I suppose I should have paid attention to that half-murmured remark , but it seemed one of those extreme statements women under stress indulge in .', ""Men of more delicate sensibilities referred to this condition as `` looseness of the bowels '' ; ;""]]","[[-0.1733437478542328, -0.1732485145330429], [-0.10012143850326538, -0.10010959208011627], [-0.00011444836854934692, -0.00010753050446510315], [0.0998065322637558, 0.09984692186117172], [0.19918182492256165, 0.1992139220237732], [0.34110772609710693, 0.36941611766815186]]",360.791748046875,360.791748046875,"[443.606689453125, 442.4410095214844, 384.3295593261719, 452.91070556640625, 285.0773620605469, 295.4627685546875]",216.7139129638672,"[243.96681213378906, 268.17059326171875, 302.14007568359375, 263.2755432128906, 218.784912109375, 240.0447540283203]",4.385313987731934,4.385313987731934,"[4.394364833831787, 4.25502872467041, 4.441420555114746, 4.507197856903076, 4.551570892333984, 4.548741817474365]",4.302912712097168,"[4.333867073059082, 4.169356822967529, 4.397671699523926, 4.230147361755371, 4.3987226486206055, 4.463566303253174]"
77,It also matters what you talk about.,"[['In the very front rank , two men were wounded and staggered along , trailing blood behind them .', ""The secretary's tone indicated that an appointment at such short notice was a concession for which Madden should be duly grateful .""], [""Miami Beach and surroundings feature fabulous `` hotel row '' , palm-studded beaches plus the Miami Seaquarium and Parrot Jungle ."", ""Mr. Ailey's `` Roots Of The Blues '' , an earthy and very human modern dance work , provided strong contrast to the ballet selections of the evening .""], ['A man with a sketch pad in hand sat with a large pink woman in a small office at the end of a long , dim corridor and made pencil lines on paper and said , `` Is this more like it , Mrs. MacReady ? ?', ""For its part the Hudson's Bay Company was troubled by the approach of American settlement .""], [""`` They eat chickens sometimes '' , the boy said ."", 'He was pressed far back into the corner of the car on his hay sacks , the rattling and tinning of the wheels on the rails almost covering the sound of his ocarina .'], ['This is followed by a boom in conferences .', ""There's a lot of talk about the problem of education in America today .""], ['It accounts for so many things .', 'He talked about unauthentic storylines too .']]","[[-0.18000513315200806, -0.17967602610588074], [-0.10019385814666748, -0.10019341111183167], [-7.834192365407944e-05, -4.0611252188682556e-05], [0.09951802343130112, 0.09955684840679169], [0.1992599070072174, 0.19944451749324799], [0.36453598737716675, 0.4006795883178711]]",140.61489868164062,140.61489868164062,"[203.7942657470703, 181.1723175048828, 198.30038452148438, 140.73294067382812, 51.568111419677734, 95.98356628417969]",118.63544464111328,"[204.328857421875, 136.41490173339844, 144.1066131591797, 162.8961639404297, 65.651123046875, 116.46937561035156]",3.9498260021209717,3.9498260021209717,"[3.728468894958496, 3.797417640686035, 4.037001609802246, 3.7929553985595703, 3.8877792358398438, 3.8472774028778076]",4.023501873016357,"[3.9612302780151367, 4.0237226486206055, 3.969987630844116, 3.871033191680908, 3.9616284370422363, 4.008160591125488]"
87,The researchers explain that finding by comparing it to a fire alarm: Testing the alarm to find it works makes you happier and more satisfied than discovering it works because there is a fire.,"[['He meandered down Pike Street , past the First National Bank with its green window shades .', 'Yet he remains the fiercest of competitors .'], [""This cited Bang-Jensen's ' aberrant conduct ' '' ."", 'Louisiana , however , collected an income tax on the profits from the sale .'], ['-- of a rifle and killed ? ?', 'Runyon , for his part , had a contemptuous regard for Mr. Watson .'], [""Sloan created such works for newspaper supplements before syndication threw him out of a job and sent him to roam the streets of New York , thereby building for America an incomparable city survey from paintings of McSorley's Saloon to breezy clotheslines on city roofs ."", 'However , the system is designed , ingeniously and hopefully , so that no one man could initiate a thermonuclear war .'], [""Only paved alleyways tunneled through the walls of those fortresses into the mysterious core of intimacy behind the houses where backyards owned no fences , where one man's property blended with the next to form courtyards in which no one knew privacy ."", 'The recipe , which he got from the baker , and wrote down in his ledger , is basically this :'], [""We discussed the candle and decided the hypothetical other bum would have left it burning to light his way to the window and because he'd have no reason to blow it out ."", ""Only recently new `` holes '' were discovered in our safety measures , and a search is now on for more .""]]","[[-0.14699465036392212, -0.14652784168720245], [-0.10023054480552673, -0.10020489990711212], [-3.710202872753143e-05, -3.5906676203012466e-05], [0.09995553642511368, 0.09998411685228348], [0.19962982833385468, 0.19973471760749817], [0.3290255665779114, 0.34260061383247375]]",278.2998962402344,278.2998962402344,"[291.96832275390625, 313.0762023925781, 346.5847473144531, 280.4007873535156, 268.69793701171875, 245.8112030029297]",296.5513000488281,"[259.1058349609375, 296.2518310546875, 323.4734802246094, 224.94241333007812, 249.81602478027344, 228.3569793701172]",4.210339069366455,4.210339069366455,"[4.277622699737549, 4.2599406242370605, 4.221498489379883, 4.207930564880371, 4.317668437957764, 4.22202730178833]",4.334873676300049,"[4.352758407592773, 4.306185245513916, 4.343816757202148, 4.2672438621521, 4.3786163330078125, 4.374233722686768]"
106,If you're an artist you take workshops.,"[[""The next morning he summoned a group of top Democrats to his private office and broke the news : he would lead the fight to oust Colmer , whom he is said to regard as `` an inferior man '' ."", 'Jess stared at him without answering and let his hands fall to his sides .'], ['He had never heard so many bells , and as he lay there listening , he thought of her scolding him for his remarks when he had looked up at the obelisk and the church at the top of the Spanish Steps .', 'Her eyes opened as soon as she heard me , though , and once again , I felt an inward shiver .'], ['Superintendents at dog shows state it is becoming more difficult to obtain a licensed Handler to Judge Junior Showmanship Competition .', 'a trial balloon to test the aesthetic climate of the times ; ;'], ['Six cities and towns are presently on a July 1 to June 30 fiscal year and have coordinated their tax collection year with it .', 'Work that might cost $500 to $750 in the South could cost $750 to $1,200 in New York City or Chicago .'], ['In spite of the shading of one type of course into another , I believe it is useful to talk about vocational courses as apart from academic courses .', ""Do you take in all the strays who come by '' ? ?""], ['Do you like to sew ? ?', 'With an art that almost conceals art , J. D. Salinger can create a fictional world so authentic that it hurts .']]","[[-0.1597145050764084, -0.1597006767988205], [-0.10011990368366241, -0.10004017502069473], [-7.942225784063339e-05, -7.490720599889755e-05], [0.0998346209526062, 0.09989884495735168], [0.19852080941200256, 0.1988053023815155], [0.2984631061553955, 0.37917637825012207]]",197.6966094970703,197.6966094970703,"[450.1163635253906, 145.74232482910156, 202.34519958496094, 356.4425048828125, 102.6236801147461, 126.61726379394531]",69.97632598876953,"[217.03286743164062, 128.19448852539062, 112.02775573730469, 123.35911560058594, 85.95284271240234, 111.7402572631836]",4.201407432556152,4.201407432556152,"[3.990017890930176, 3.9880833625793457, 4.392233371734619, 3.9859695434570312, 4.101132392883301, 4.208520412445068]",3.716923952102661,"[3.9897661209106445, 3.947628974914551, 4.257683753967285, 3.9209866523742676, 3.9095747470855713, 4.139467716217041]"
