target_idx,target_sent,sents_intrp_all_bins,sim_intrp_all_bins,base_PPL,local_unintrp_PPL,local_intrp_PPL_all_bins,global_unintrp_PPL,global_intrp_PPL_all_bins,base_entropy,local_unintrp_entropy,local_intrp_entropy_all_bins,global_unintrp_entropy,global_intrp_entropy_all_bins
9,"""Today, we have a pretty good idea of what's likely to make for a good marriage,"" says Stony Brook University researcher Arthur Aron, PhD.","[['The result had nothing of the polish , pace or cohesion of the previous night .', 'her arms were straining with a burden of dolls .'], ['I had watched Castro handling his enemies before the paredon .', 'The Earthmen made camp outside the spaceship .'], ['Second , there were those ( Moise Tshombe ) who favored near-Balkanization , a loose federalism having a central government of limited authority , with much power residing in the states .', 'The answer is different for each autistic child , but for most there is an answer .'], ['As a result , he was persuaded out to dinner .', ""If one asks about this play , what it is that comes upon this community and works within it with such terrible power , there is no better answer to give than `` spirit '' .""], [""Thus , when Dartmouth's Winter Carnival -- widely recognized as the greatest , wildest , roaringest college weekend anywhere , any time -- was broadcast over a national television hookup , Prexy John Sloan Dickey appeared on the screen in rugged winter garb , topped off by a tam-o'-shanter which he confessed had been acquired from a Smith girl ."", 'This is a problem , and I believe there is little difference of opinion that wherever possible a local school board should devise and effect a plan of desegregation .'], [""Thus , the writer decided to hold one experimental section of the functional preparation for marriage course in the spring semester of 1960 exclusively for persons already married -- that is , prerequisite : `` marriage '' ."", 'This might put Wright in such a bad light before a court that Miriam would be awarded Taliesin ; ;']]","[[-0.16367802023887634, -0.16336137056350708], [-0.10217298567295074, -0.10201974213123322], [-0.00048205815255641937, -0.0004700366407632828], [0.09910135716199875, 0.09911847114562988], [0.19708575308322906, 0.19708958268165588], [0.293825626373291, 0.2952488660812378]]",61.03892135620117,61.03892135620117,"[73.22621154785156, 77.16764068603516, 70.06360626220703, 57.54619216918945, 58.404937744140625, 54.750038146972656]",49.10096740722656,"[53.54955291748047, 50.518310546875, 56.89521026611328, 49.145694732666016, 49.11665344238281, 49.230587005615234]",3.957592725753784,3.957592725753784,"[4.115081310272217, 3.9744884967803955, 4.091258525848389, 3.981766700744629, 3.9967026710510254, 4.08697509765625]",4.089944839477539,"[4.1539387702941895, 4.0296759605407715, 4.133922100067139, 4.060611248016357, 4.020116329193115, 4.151289463043213]"
47,Orbuch's analysis suggests the trajectory from bad to worse is likely to continue throughout the marriage and eventually to lead to divorce.,"[['They had pistols in their hands .', 'So much for the prototype .'], ['As can be seen from Figure 2 , an extensive area was covered by this aerosol .', ""I'll call you there in ten minutes '' --""], ['But in so many other areas we still are dragging .', 'The public should understand that whether they support a state hospital or a VA hospital , the tax dollar has to be paid one way or the other .'], [""But one night Dookiyoon moved in the direction of the women's lodge , where Shades of Night had gone to purify herself ."", 'We may show , first , that there cannot possibly be an alternative other than the three typically represented by Bultmann , Barth , and Buri .'], ['Also , he thought , I doubt if she could hit the side of a barn with a shotgun .', ""`` A Toast To The Bride '' , sung by Clarence Nordstrom , playing a character called Old Man Toomey , is quite simple , direct and touching .""], ['But , from our reading of the Western Talmud , we Urielites believe that the Forerunner , knowing this situation would arise , made reference to and provision for divorce .', 'Otherwise it will be headed for bankruptcy , at worst , and at best towards starvation of other less dramatic but socially and culturally indispensable branches of learning .']]","[[-0.1467665731906891, -0.1458148956298828], [-0.10259070992469788, -0.10250923037528992], [-0.0006012329831719398, -0.0005617751739919186], [0.0995151549577713, 0.09953126311302185], [0.19782626628875732, 0.19784528017044067], [0.35085099935531616, 0.3513702154159546]]",128.5489044189453,128.5489044189453,"[174.2487335205078, 171.55445861816406, 125.62323760986328, 139.0216827392578, 117.38739776611328, 107.82608032226562]",91.526123046875,"[98.507080078125, 121.84033966064453, 86.88237762451172, 92.39421081542969, 85.17657470703125, 84.2063980102539]",3.955491065979004,3.955491065979004,"[3.971012592315674, 4.02786922454834, 4.061383247375488, 3.87461519241333, 3.9959332942962646, 4.071244716644287]",4.074134349822998,"[4.1208648681640625, 4.1951494216918945, 4.144314765930176, 4.065247535705566, 4.112645149230957, 4.108722686767578]"
58,"Men seem to need these affirmations most, Orbuch's analysis suggests.","[['She lived in an ultra-modern house whose decoration , appointments , paint , and even pets were chosen to complement her coloring ; ;', 'she had made no friends .'], [""Late September finds Quebec's color at its peak , especially in the Laurentian hills and in the area south of the St. Lawrence River ."", ""As far as they were aware , the Connecticut Association of Real Estate Boards had not officially opposed the bill's passage or lobbied in its support .""], ['Except for that one morning .', 'We quickly ran into the same trouble that plagued Bill Ruger in his first experiments : Three or four bullets would be placed well in a six-inch bull at 100 yards and then , unaccountably , one could stray far out of the group .'], ['Greg pushed the radio button again .', ""and whether these would qualify them for `` congenial '' , `` happy '' relations to other people in certain community areas .""], ['Instead the cartoons seem to deal with foibles .', ""`` You think the Russians are getting ahead of us in comedy '' ? ?""], [""`` You think Black's the one we're looking for '' ? ?"", 'If women replaced people , it would normally have dominant stress .']]","[[-0.18168380856513977, -0.1804293692111969], [-0.10081995278596878, -0.1008029654622078], [-0.0006285468116402626, -0.0005718506872653961], [0.09926275908946991, 0.09926515817642212], [0.19714078307151794, 0.19744455814361572], [0.2783305048942566, 0.27996814250946045]]",360.791748046875,360.791748046875,"[405.4197082519531, 527.5526123046875, 375.84320068359375, 379.3487854003906, 253.24468994140625, 296.3740234375]",216.7139129638672,"[276.3418884277344, 325.59771728515625, 316.235107421875, 212.2996826171875, 190.33714294433594, 226.85122680664062]",4.385313987731934,4.385313987731934,"[4.453579902648926, 4.241416931152344, 4.471762180328369, 4.3851847648620605, 4.647982120513916, 4.492412567138672]",4.302912712097168,"[4.378168106079102, 4.089730739593506, 4.2915544509887695, 4.314675331115723, 4.485564708709717, 4.356733798980713]"
66,"""The people who have stable, happy relationships are much gentler with one another than people who have unhappy relationships or break up,"" says Gottman, who's known for his ability to predict which newlyweds will divorce with more than 90 percent accuracy by observing how they communicate (, 1992).","[[""`` We'll go to the storehouse '' ."", ""`` Well , I should find Alma '' -- I began .""], ['They must be persuaded to adopt the other necessary self-help measures which are described in the preceding section .', ""`` Might get there faster walkin' '' , Lord drawled , `` seein' as how I got a busted front spring .""], ['Stevie was shouting triumphantly .', ""Some of Curzon's playing strikes me as finicky , however .""], ['Each year , reports the American Medical Association , ten million Americans spend $900 million on vitamins , tonics and other food supplements .', 'The angry burnt-red face of Ryan greeted him .'], ['Now the Czarship had not affected my own sense of social values , but Mother had attained a reflected glory through it , which had opened the doors of Los Angeles-Pasadena Society to her .', 'This torque causes the entire system to rotate about the **yf axis , since the response to Af .'], [""Seven years they'd been married ."", 'The change in perceptions by some of the Kohnstamm-negative subjects , after they had been informed of the possibilities of normal reactions , suggests that their constriction and guardedness is associated with their general mode of responding to strange or unknown situations .']]","[[-0.1673494428396225, -0.1668792963027954], [-0.10228142887353897, -0.1021835058927536], [-0.00022984668612480164, -0.00022972607985138893], [0.09911619126796722, 0.09913024306297302], [0.19669269025325775, 0.19672542810440063], [0.3189588785171509, 0.3216904401779175]]",166.90223693847656,166.90223693847656,"[167.53550720214844, 169.4278564453125, 166.9471435546875, 191.9657745361328, 174.6341094970703, 153.0437774658203]",160.63267517089844,"[150.85812377929688, 151.14561462402344, 143.17579650878906, 155.8980712890625, 158.1533660888672, 155.8629150390625]",4.360706329345703,4.360706329345703,"[4.38894510269165, 4.465997695922852, 4.4096879959106445, 4.349759578704834, 4.574230670928955, 4.325655460357666]",4.233996868133545,"[4.344900608062744, 4.366623401641846, 4.375072002410889, 4.268013954162598, 4.321786880493164, 4.227536678314209]"
91,"In the Early Years of Marriage Project, she and her colleagues, including Aron, found that couples reporting boredom in the seventh year of marriage were significantly less likely to be satisfied with the relationship by their 16th anniversary (, 2009).","[['Again , a force too strong for unfrozen bodies to endure would be applied .', ""Negro radio is vitally necessary during the process of assimilation '' .""], ['His energy was gone .', 'He had been sighted , and his attacker pumping shot after shot .'], ['Never forget that a chain is only as strong as its weakest link .', 'Those ten days were like no others that Blanche had known .'], [""Eileen got to dancing , just a little tiny dancing step to a hummed tune that you could hardly notice , and trying to pick up strange men , but each time I was ready to say to hell with it and walk out she'd pull herself together and talk so understandingly in that sweet husky voice about the good times and the happiness we'd had together and there I was back on the hook ."", ""However , as Erickson has noted , the individual's failure to develop preliminary identities during infancy and childhood need not be irreversibly deterministic with respect to a given area of identity diffusion in his ( or her ) adolescence .""], ['A top official of the New Frontier who kept a record of his first weeks on the job here gives this report of his experiences :', 'Having persisted too long in deliberate ignorance and denial of the forces that threatened her , Pamela was relieved now to admit their potency and to be taking definite steps toward grappling with them .'], ['He had picked out this pathless trail , instead of the common one , in a moment of romantic fancy , to give them privacy on their honeymoon .', ""For it seems that Barco , fancying himself a ladies' man ( and why not , after seven marriages ? ?""]]","[[-0.16807708144187927, -0.1679832637310028], [-0.1015133410692215, -0.1014656350016594], [-0.0003852918744087219, -0.0003668731078505516], [0.09945926070213318, 0.09951838105916977], [0.19574855268001556, 0.1958262026309967], [0.32530415058135986, 0.33413392305374146]]",74.61945343017578,74.61945343017578,"[86.21324920654297, 83.67760467529297, 84.07953643798828, 67.78433227539062, 80.63544464111328, 89.07905578613281]",81.12361907958984,"[81.29764556884766, 87.5370101928711, 84.92791748046875, 66.80155944824219, 75.39127349853516, 92.24040985107422]",3.6707041263580322,3.6707041263580322,"[3.7071564197540283, 3.5823445320129395, 3.708170175552368, 3.6418378353118896, 3.7477357387542725, 3.8390066623687744]",3.9765284061431885,"[3.9815433025360107, 3.82892107963562, 3.90636944770813, 3.7460551261901855, 3.875404119491577, 4.05147647857666]"
