target_idx,target_sent,sents_intrp_all_bins,sim_intrp_all_bins,base_PPL,local_unintrp_PPL,local_intrp_PPL_all_bins,global_unintrp_PPL,global_intrp_PPL_all_bins,base_entropy,local_unintrp_entropy,local_intrp_entropy_all_bins,global_unintrp_entropy,global_intrp_entropy_all_bins
35,"""[Low-income couples] don't say, ‘If only we had more skills training and better communication,'"" says Karney.","[['While here , visit Theodore Roosevelt National Park for its spectacular scenery .', 'With these maps completed , the inventory phase of the plan has been started .'], ['The forced sale of the General Motors stock owned by or allocable to Christiana , Delaware , and the stockholders of Delaware , and deposited with the trustee , would result in a tax to those parties at the capital gains rate .', 'There , Mother was received by the scions of aristocratic lines which are dominated by the Budweisers ( of beer derivation ) , the Chalmers ( of underwear origin ) , and the Heinzes ( whose forbears founded a nationally famous trade in pickles ) .'], ['Ryan shook his head .', 'He has Henri do from four to six sets of the Incline Bench Press ( note the high incline ) .'], [""He cites with pleasure the comment of a lady , who exclaimed after a concert : `` Why , it's extremely interesting ."", ""Hallmark Cards , Inc. , Kansas City , Mo. , has a do-it-yourself quiz game called `` Benefit Bafflers '' , which it distributes to employees .""], [""We couldn't be seen together , for the tongue of Scandal was ever ready to link our names , and the tongue of Scandal finds but one thing to say of the association of a man with a girl , no matter how innocent ."", 'The United States was engaged in a military attack on a peaceful , orderly people governed by a regime that had proved itself the most pro-Western and anti-Communist within any of the new nations -- the only place in Africa , moreover , where a productive relationship between whites and blacks had apparently been achieved .'], ['A few weeks ago , I read in the Bulletin that there were to be given Chinese classes in Cranston .', 'Let the best sex win .']]","[[-0.1717214733362198, -0.17135675251483917], [-0.10423573106527328, -0.10418052971363068], [-0.0006855819374322891, -0.0006795693188905716], [0.09879495203495026, 0.09879957139492035], [0.19447802007198334, 0.19467876851558685], [0.2566204071044922, 0.2567967474460602]]",501.35009765625,501.35009765625,"[575.46826171875, 642.0017700195312, 506.8667297363281, 476.1554260253906, 688.3681030273438, 449.93353271484375]",574.15673828125,"[531.2717895507812, 625.0236206054688, 468.3847351074219, 437.4223327636719, 586.2933959960938, 430.0807189941406]",3.9810068607330322,3.9810068607330322,"[4.034750461578369, 3.9370455741882324, 3.923644781112671, 4.0071516036987305, 3.9770562648773193, 3.985436201095581]",4.248181343078613,"[4.156375408172607, 4.024799823760986, 4.142266273498535, 4.159123420715332, 4.000505447387695, 4.122615814208984]"
45,Another study by the same team showed that marital trouble is also often evident soon after the vows.,"[['This will be for the shell of the house only ( roof , walls , and floor ) , and does not include the carport or balcony .', 'I rapped my knuckles on the counter .'], [""He : `` Come with me to the Casbah '' ."", 'Upon all of them played the intellectual , social , political , and economic attitudes , institutions , and customs of the nation .'], ['The boldness of champions', 'They ignored the ladder down to the planet surface and , with only a glance at the seismological gauge to judge surface resistance , dropped to the ground .'], ['Maybe it would work the other way .', ""for example , if one driver puts on 22,000 miles per year and another driver 8,000 miles per year , their cars will be switched so that both cars will have 30,000 miles after two years , rather than 44,000 miles ( and related higher maintenance costs ) and 16,000 miles respectively '' .""], ['This development is reflected in the action taken in February , 1961 , by the general board of the National Council of Churches , the largest Protestant organization in the Aj .', ""He'd mentioned it , himself , at church and everybody seemed to have the idea that Tolley had left because Jenny had jilted him for Roy Robards .""], [""`` Most often '' , she says , `` it's the monogamous relationship that is dishonest '' ."", ""It is no longer possible to say that a sceptical attitude towards the received accounts of the invasions almost automatically produces a `` shore occupied by '' interpretation .""]]","[[-0.16213446855545044, -0.16181454062461853], [-0.1053205132484436, -0.10518231987953186], [-0.0006710104644298553, -0.0006095562130212784], [0.09893082082271576, 0.09894506633281708], [0.19702018797397614, 0.19704246520996094], [0.3049507439136505, 0.30565935373306274]]",159.47018432617188,159.47018432617188,"[188.39776611328125, 181.4256134033203, 164.7130126953125, 149.94137573242188, 146.26942443847656, 147.02603149414062]",147.08030700683594,"[141.5360107421875, 144.234130859375, 138.95535278320312, 127.69841766357422, 121.74004364013672, 146.43711853027344]",3.8582682609558105,3.8582682609558105,"[4.110906600952148, 4.021669864654541, 3.8823659420013428, 3.990635871887207, 3.868448495864868, 3.933332681655884]",3.629808187484741,"[4.0842742919921875, 3.9225094318389893, 3.7348597049713135, 3.9259755611419678, 3.8183207511901855, 3.710649251937866]"
69,He looked at data from 136 couples over the 10 years since their weddings.,"[['On the other hand , Molesworth was naturally assailed in the Tory press .', 'Though Walter Ulbricht , by grace of Soviet tanks , may be head man in East Germany , that does not give him any right to usurp the government of East Berlin or to absorb that semi-city into the Soviet zone .'], [""That's quite minor , nothing to worry about ."", 'Goethe believed that the Germanic spirit , with its grave strength but flagrant streaks of brutality and intolerance , should be tempered with the old sensuous wisdom and humanism of the Hellenic .'], ['It was merely an attempt to frighten her .', 'So you look down there and you see a tiny , whirling point about the size of the head of a pin .'], [""Man in a boat , there's a lot of places he can put in at and a lot of reasons he can be away for a bit ."", ""Pamela North said , `` Hi '' , to her cats , and added that proper cats met their humans at the door .""], ['He had left her inviolate , thinking familiarity would gentle her in time .', 'The clock on the mantel piece was scandalized and ticked so loudly that he glanced at it over his shoulder and then quickly left the room .'], ['he studied them , compared them with what he had been taught as a nestling , struggling to bridge between languages , the one he thought with and the one he was learning to think in .', 'Here , in an atmosphere of forthrightness and mutual criticism , each sought to bring his particular insights to bear upon the question of discrimination in housing and the part each man present played in it .']]","[[-0.1776779443025589, -0.17752213776111603], [-0.10211880505084991, -0.10208497196435928], [-0.00071709044277668, -0.0007114093750715256], [0.09876199066638947, 0.0987650603055954], [0.1937362253665924, 0.19386720657348633], [0.2803521156311035, 0.28365206718444824]]",98.6041259765625,98.6041259765625,"[117.14197540283203, 106.70410919189453, 131.4651336669922, 116.92556762695312, 133.43861389160156, 99.59138488769531]",87.86754608154297,"[80.94923400878906, 90.65970611572266, 109.6129150390625, 84.12195587158203, 76.63461303710938, 86.06016540527344]",3.6884005069732666,3.6884005069732666,"[3.653014898300171, 3.5873541831970215, 3.843573808670044, 3.69362211227417, 3.6031572818756104, 3.674172878265381]",3.5346202850341797,"[3.5527572631835938, 3.526327610015869, 3.6518256664276123, 3.689213514328003, 3.673804998397827, 3.578939437866211]"
72,"Couples' communication patterns proved to be more predictive of divorce than their reported levels of commitment, personality assessments and stress (, 2012).","[[""Back at the Kaiser's Fountain , I walked left to the streetcar stop and rode up the hill -- any car will do -- past the Column of Constantine , also known as the Burnt Column , at the top on my right ."", 'From the outside it was an ordinary enough house of the gentry .'], ['Perhaps the idea of sidewalk cafes could be extended .', ""Because I'm looking for the son of a bitch that killed that old man , and I'm going to get him .""], [""`` But you didn't know a thing about it , did you '' ? ?"", 'And acculturation into the world at large is likely to occur for the Brooklyn College student after college rather than during the four school years .'], [""I don't ask you who 'tis you're being unfaithful to , husband or lover ."", ""Word of Dag Hammarskjold's death in an African plane crash has sent a shockwave around the globe .""], ['It is our hypothesis that Kohnstamm-positive subjects are less hesitant about relinquishing control than are Kohnstamm-negative subjects ; ;', ""The fundamental difficulty of which the Selden case was `` a striking ( though not singular ) example '' , concluded Hough , `` will remain as long as testimony is taken without any authoritative judicial officer present , and responsible for the maintenance of discipline , and the reception or exclusion of testimony '' .""], [""In a letter to Meynell , which was written in June , less than a month before Katie's wedding , he was highly melodramatic in his despair and once again announced his intention of returning to the life of the streets : ``"", 'They were married at a lavish ceremony which was duly recorded in Parvenu and all other magazines and newspapers , and then they honeymooned in Bermuda .']]","[[-0.18018066883087158, -0.18012377619743347], [-0.1019560694694519, -0.10187777131795883], [-0.0007152250036597252, -0.0007026204839348793], [0.09864377975463867, 0.09865207970142365], [0.1876634806394577, 0.18787932395935059], [0.24865438044071198, 0.24897970259189606]]",211.8409881591797,211.8409881591797,"[256.9678955078125, 273.9333801269531, 249.51637268066406, 247.12054443359375, 257.662841796875, 223.20201110839844]",139.5577392578125,"[186.7687530517578, 200.59310913085938, 168.9409942626953, 166.27984619140625, 161.1913299560547, 179.36598205566406]",4.0327324867248535,4.0327324867248535,"[4.072076320648193, 4.002179145812988, 4.071895599365234, 4.15385627746582, 4.091521263122559, 3.9409096240997314]",3.8796885013580322,"[3.936560869216919, 3.933828353881836, 4.065445423126221, 4.0711188316345215, 4.002115726470947, 3.9020612239837646]"
73,"In the Early Years of Marriage Project, Orbuch also found that good communication set the happiest of couples apart from the less blissful.","[['I walked with him back to the entrance .', 'There is no room for error or waste .'], ['Preparation of frozen sections', 'But theirs defied the detectors .'], ['Armbro Comet ( Nibble Hanover-Mauri Hanover ) has been in 2:38 .', 'She had tuned her sight to the proper degree .'], ['The expedient thing -- yes , very true , one must make do as one could , in some situations .', 'He shares with Mr. Morse a parody of the college anthems he once sang while his second song is whisked away from him by Virginia Martin , a girl with a remarkably expressive yip in her voice .'], ['Mr. Herman has managed to mix musical ideas drawn from Israel and the standard American ballad style in a manner that stresses the basic tunefulness of both idioms .', ""Thus in it's incredible what that boy can eat dominant stress is likely to be on incredible , and eat will have strong stress also .""], ['In their views on dating , courtship , sex , and family life , our students prefer what they are expected to prefer .', 'It helps children grow up with at least a nodding acquaintance with the Bible .']]","[[-0.17371496558189392, -0.17136698961257935], [-0.10376644879579544, -0.10357944667339325], [-0.0008787894621491432, -0.0008623115718364716], [0.09892304241657257, 0.09900417178869247], [0.1937302052974701, 0.193863183259964], [0.27862972021102905, 0.2797870635986328]]",127.29163360595703,127.29163360595703,"[144.9296112060547, 127.1810302734375, 133.34205627441406, 127.41157531738281, 118.3550796508789, 102.8124008178711]",103.32057189941406,"[113.33635711669922, 106.70980834960938, 91.6354751586914, 91.46491241455078, 104.10098266601562, 99.20603942871094]",3.7193498611450195,3.7193498611450195,"[3.8775041103363037, 3.7907443046569824, 3.6653740406036377, 3.629091501235962, 3.90402889251709, 3.9171502590179443]",3.9923903942108154,"[4.172485828399658, 4.017189979553223, 3.9500439167022705, 3.909824848175049, 4.084062576293945, 4.042555332183838]"
