target_idx,target_sent,sents_intrp_all_bins,sim_intrp_all_bins,base_PPL,local_unintrp_PPL,local_intrp_PPL_all_bins,global_unintrp_PPL,global_intrp_PPL_all_bins,base_entropy,local_unintrp_entropy,local_intrp_entropy_all_bins,global_unintrp_entropy,global_intrp_entropy_all_bins
11,"But, say psychologists, there are many behaviors, such as how a couple talks and fights and even the type of dates they go on, that can be learned and practiced — and can give a pair a fighting chance at 'til death do they part.","[['Sonic , electronic , galvanic -- all blank .', 'Kate felt she had deserted the boy in her own loss .'], ['The fisherman was right in the middle of the Deep .', 'The new formula for filling staff positions in the Secretariat is one of a number of recommendations made by a panel of eight in a long and detailed report .'], ['We would lose our export markets and deny ourselves the imports we need .', 'I quit work at my usual hour as if this day was no different from other days .'], ['These people were not talking much about it , but you , a foreigner , sensed their apprehension and disappointment .', ""If the content of faith is to be presented today in a form that can be `` understanded of the people '' -- and this , it must not be forgotten , is one of the goals of the perennial theological task -- there is no other choice but to abandon completely a mythological manner of representation .""], [""I never liked going straight into an examination with patients -- it relaxes them , I've always thought , to chat first ."", ""The Louisiana city is known , of course , for its fine food , good music and its colorful hospitality `` and , when guests arrive at Philmont that night '' , says Mrs. Grinsfelder , `` that is exactly what we expect to offer them .""], ['But Aristotle kept the principle of levels and even augmented it by describing in the Poetics what kinds of character and action must be imitated if the play is to be a vehicle of serious and important human truths .', 'In repetitions of the experiment from couple to couple , the votes of the two persons in a couple probably agree more often than independence would imply , because couples who visit the museum together are more likely to have similar tastes than are a random pair of people drawn from the entire population of visitors .']]","[[-0.1549372673034668, -0.15454703569412231], [-0.10113902390003204, -0.10104964673519135], [-0.00015835650265216827, -0.00014828983694314957], [0.09962250292301178, 0.09963497519493103], [0.1985437572002411, 0.19865882396697998], [0.32787269353866577, 0.3286077380180359]]",170.0977783203125,170.0977783203125,"[170.28485107421875, 177.28501892089844, 157.92044067382812, 149.5094451904297, 167.28509521484375, 152.80540466308594]",148.60606384277344,"[143.01795959472656, 174.48768615722656, 145.37916564941406, 139.29547119140625, 152.49386596679688, 154.04978942871094]",4.3311285972595215,4.3311285972595215,"[4.329448223114014, 4.34294319152832, 4.2897186279296875, 4.324095726013184, 4.407134056091309, 4.273679256439209]",4.264558792114258,"[4.28212833404541, 4.206844806671143, 4.225269317626953, 4.228281021118164, 4.348456859588623, 4.139206409454346]"
41,"""It appears that those things are paying off.""","[[""For paradigmatic history `` breaks '' rather than unfolds precisely when the movement is from order to disorder , and not from one order to a new order ."", ""'' thick and 1'' '' dia. fitted on a 1/8'' '' dia. mandrel .""], ['For the case of a purely inertial autonavigator consisting of three restrained gyros , a coordinate system is used where the sensitive axis of the X accelerometer is parallel to the east-west direction at the base point , and the Y accelerometer sensitive axis is parallel to the north-south direction at the base point .', 'But , admit or not , Bonner was helpless .'], [""`` I'll pick murder ."", 'All false gods resemble Moloch , at least in the early phases of their careers , so it would be unreasonable to expect any form of idol-worship to become widespread without the accompaniment of human sacrifice .'], [""They range from the Soviet Embassy on Sixteenth Street , a gray shuttered pile suggesting a funeral-accessories display house , to what Congressman Rooney has called `` that monstrosity on Thirty-fourth Street '' , the modern cement-and-glass chancery of the Belgians ."", ""It might be called the `` public utility '' type because of the considerable use to which it has been put in gas and electric utility rate cases .""], ['They either walked or were driven .', '`` It never seemed to widen .'], ['This way of describing the matter is unfortunate .', ""`` They're stealin' the stock '' ! !""]]","[[-0.1596318632364273, -0.1588660031557083], [-0.10099627077579498, -0.10093995928764343], [-0.0002299528568983078, -0.00020804628729820251], [0.09959989786148071, 0.0996284931898117], [0.19777867197990417, 0.19816291332244873], [0.3482183814048767, 0.3543429672718048]]",259.2994079589844,259.2994079589844,"[273.77459716796875, 316.7992858886719, 276.19012451171875, 309.0331115722656, 340.2382507324219, 189.38536071777344]",306.36865234375,"[378.1012878417969, 366.3648986816406, 329.5452880859375, 294.13214111328125, 291.6250305175781, 215.48757934570312]",3.864297389984131,3.864297389984131,"[4.140562534332275, 4.064857482910156, 3.9882872104644775, 3.7248077392578125, 4.148683071136475, 3.7700445652008057]",3.8833205699920654,"[3.8646769523620605, 3.702070951461792, 3.8356144428253174, 3.696937084197998, 4.024430751800537, 3.8249006271362305]"
60,The same effect didn't hold true for women.,"[['A few of the more prominent must serve as examples of what a complete listing and description would disclose .', 'In Figure 2 , the points in the network are designated by a letter accompanied by a number .'], ['Beckworth handed the pass to the colonel .', 'Stravinsky , nearing the age of eighty , is like a lost and frantic bird , flitting from one abandoned nest to another , searching for a home .'], [""The single-barrel Stevens 940Y ( under $35 ) is made with a side lever rather than a top-tang lever because many youngsters aren't strong enough to operate a top tang to open a gun -- and the side lever does indeed open very easily ."", ""He'd been in an angry mood : Conchita had thought his face almost ugly with the anger in him .""], ['The cloth is laid on one half of the bottom at a time .', 'In the next few days they had cause to rejoice .'], ['Payne was more methodical than that .', 'For an instant John was stunned .'], [""`` It's people of your own kind '' , a girl remarked ."", ""It is the only method left for a man to escape from a woman's world .""]]","[[-0.1616523712873459, -0.16096419095993042], [-0.10062331706285477, -0.10062135010957718], [-0.00019739195704460144, -0.00019499100744724274], [0.09960100054740906, 0.09960661083459854], [0.19820959866046906, 0.19844861328601837], [0.33885398507118225, 0.35377049446105957]]",649.927001953125,649.927001953125,"[1102.218505859375, 1096.6865234375, 884.7714233398438, 705.7969970703125, 763.8125610351562, 601.1802368164062]",491.55584716796875,"[754.7785034179688, 687.4696044921875, 679.8093872070312, 557.8052368164062, 466.1839599609375, 516.277099609375]",4.124594688415527,4.124594688415527,"[4.219244480133057, 4.093947887420654, 4.047767162322998, 4.2156219482421875, 4.023499965667725, 4.293618202209473]",4.278170108795166,"[4.167588710784912, 4.273248195648193, 4.074249267578125, 4.186501979827881, 4.303109645843506, 4.309947490692139]"
74,"Partners who reported patterns of destructive behavior when dealing with conflict in the first year of marriage, for example, were more likely to divorce years later (, 2010).","[['It is , I insist , hard to define the Rayburn contribution to our political civilization because it is so massive and so widespread and so complicated , and because it goes so deep .', 'Powers was covering the remaining guard .'], ['Anyhow , it was high time the boy was salted .', 'then they turned to the right , climbed the embankment , and walked into the valley again .'], ['It was her work to go among her neighbors and collect their checks .', 'It had been a very long time that had no form and no end .'], [""But then , Mario Lanza was no common singer , and his whole career , public and non-public , was studded with the kind of unconventional happenings that terminate with the appearance of his first `` recital '' only when he has ceased to be a living voice ."", 'after all , he had had the same set of facts as Jack had had to work from , and he was an almost frighteningly observant man .'], ['The state had elected Republican candidates in the past two years .', ""Instead -- and not just to prove my objectivity -- I hasten to report that it's a highly amusing film which probably does a fairly accurate job of reporting on the Easter vacation shenanigans of collegians down in Fort Lauderdale , and that it seems to come to grips quite honestly with the moral problem that most commonly vexes youngsters in this age group -- that is to say , sex .""], [""Thus , the writer decided to hold one experimental section of the functional preparation for marriage course in the spring semester of 1960 exclusively for persons already married -- that is , prerequisite : `` marriage '' ."", ""A weekly newspaper reported a local romance : `` and the couple were married last Saturday , thus ending a friendship which began in their schooldays '' .""]]","[[-0.1617065668106079, -0.16163837909698486], [-0.10058435797691345, -0.10056377947330475], [-0.0001897597685456276, -0.00016809627413749695], [0.0996798649430275, 0.0996890515089035], [0.19797171652317047, 0.19803567230701447], [0.3645585775375366, 0.3753299415111542]]",85.91535186767578,85.91535186767578,"[104.74909973144531, 101.84491729736328, 87.03741455078125, 108.24995422363281, 93.62162017822266, 67.31316375732422]",69.38239288330078,"[68.63729858398438, 68.3803939819336, 69.38682556152344, 80.00645446777344, 70.62605285644531, 59.151981353759766]",3.9354729652404785,3.9354729652404785,"[3.9239957332611084, 4.017184734344482, 3.865053176879883, 3.6935977935791016, 3.9660279750823975, 3.7548117637634277]",3.741241455078125,"[3.897047758102417, 3.869558811187744, 3.8122851848602295, 3.795907735824585, 3.851752519607544, 3.781195878982544]"
95,"""So the question is, how do you thwart that process?","[[""A dark bathroom can be pretty scary , and he'd creep back to bed , proud of himself , thinking : Tomorrow , for sure , I'll go down to the rock and keep my promise to Dad ."", 'He only rarely tells a personal anecdote and hardly ever sketches an individual or quotes his opinions .'], ['Bluntly , there never was a Ptolemaic system of astronomy .', 'The boldness of champions'], ['He regulated the dualities of light and darkness , Yang and Yin , which are locked in eternal struggle .', 'Phil was like that .'], ['Nevertheless , it will seem funny to have to send for a mechanic to improve conversation .', 'It poured out of him like an electric current , a feeling that the muscles and nerves of his fine-drawn body were coiling for action , and that that action would be all that he anticipated .'], ['Thus , this readiness to relax controls , evidenced in the Kohnstamm situation , appears to be a more general personality factor .', ""`` We are directed to develop a sense of proportion , sir , which contributes the same effect '' .""], [""What do you think I did with them '' ? ?"", '`` How would I know ? ?']]","[[-0.1640661209821701, -0.16392433643341064], [-0.10041675716638565, -0.10037417709827423], [-0.00027040764689445496, -0.00020934641361236572], [0.09945741295814514, 0.09949250519275665], [0.19578856229782104, 0.19592055678367615], [0.31948795914649963, 0.3223259449005127]]",179.56126403808594,179.56126403808594,"[148.76239013671875, 241.20074462890625, 224.57618713378906, 155.80532836914062, 160.57278442382812, 99.63636779785156]",122.45207214355469,"[131.28640747070312, 140.3009796142578, 110.54054260253906, 118.79071807861328, 125.74111938476562, 84.39029693603516]",4.043023109436035,4.043023109436035,"[4.105591773986816, 4.339315891265869, 4.108464241027832, 4.166621208190918, 4.168056488037109, 4.02963399887085]",4.196554183959961,"[4.027083396911621, 4.408108234405518, 4.237832069396973, 4.174417972564697, 4.281652927398682, 4.056619167327881]"
