target_idx,target_sent,sents_intrp_all_bins,sim_intrp_all_bins,base_PPL,local_unintrp_PPL,local_intrp_PPL_all_bins,global_unintrp_PPL,global_intrp_PPL_all_bins,base_entropy,local_unintrp_entropy,local_intrp_entropy_all_bins,global_unintrp_entropy,global_intrp_entropy_all_bins
23,"""Money is the No.","[['Facilitatory processes take place between neocortex and hypothalamus via ascending and descending pathways .', 'Everybody returned after intermission for the miscellaneous sweepings of the Fantasy For Piano , Chorus , And Orchestra In C Minor , made up by its composer to fill out one of his programs .'], ['The dweller at p is last to hear about a new cure , the slowest to announce to his neighbors his urgent distresses , the one who goes the farthest to trade , and the one with the greatest difficulty of all in putting over an idea or getting people to join him in a cooperative effort .', ""and `` Marmee '' March , like Sophie Szold , was the competent manager of her brood of girls , of whom the Marches had only four to the Szolds' five .""], ['The colony had been small until the Spanish Inquisition of 1492 drove many Jews into Rome .', 'I also use a small electric hand-blower to dry large washes in the studio .'], [""`` Don't worry about my being tough , Moore ."", 'Here some innovation is attempted .'], [""He didn't want us to get married ."", ""`` You're in for trouble '' .""], [""It is Mars , isn't it ? ?"", ""`` Can I bear it '' ? ?""]]","[[-0.1798606514930725, -0.17823095619678497], [-0.10217661410570145, -0.10207772254943848], [-0.0006559882313013077, -0.0006486587226390839], [0.09872246533632278, 0.09875743836164474], [0.19107916951179504, 0.19127652049064636], [0.2543752193450928, 0.2547340393066406]]",226.324951171875,226.324951171875,"[408.13214111328125, 259.08447265625, 385.32562255859375, 189.84902954101562, 156.99798583984375, 233.6939697265625]",214.69375610351562,"[182.1267547607422, 155.32249450683594, 171.1842803955078, 184.79214477539062, 115.55644989013672, 136.77467346191406]",4.75032901763916,4.75032901763916,"[4.571147441864014, 4.669986724853516, 4.914883136749268, 5.179475784301758, 4.892806529998779, 4.172572135925293]",4.548386573791504,"[5.055341720581055, 4.542536735534668, 5.033842086791992, 4.991426467895508, 4.943040370941162, 4.713471412658691]"
44,"Men's feet, on the other hand, did not have such predictive powers — they were more likely to be cold in the first place (Journal of Family Psychology, 2012).","[['Its initial expenses will be paid from appropriations currently available for our foreign aid program .', 'We waited till he had finished laughing , and that gave us a few moments for taking stock of him .'], ['The anti-slavery movement took many forms .', 'The growing communications needs of this new State can best be met , as they have in other States , through the operation and development of such facilities by private enterprise .'], ['He rose slowly and looked into the mirror on the inside of the closet door .', ""All of you be ready to ride hell for leather '' .""], ['She was sure she would reach the pool by climbing , and she clung to that belief despite the increasing number of obstacles .', ""Ernie was screaming inside himself : No , damn you , you ain't gonna take my meal ticket away from me ! !""], ['It was nothing more than a tiny distant rain squall , a dull gray sheet which reached from a layer of clouds to the earth .', 'They could not guess that from their concepts of liberty and freedom would some day be born a new nation that for years would be the symbol of hope to the oppressed countries of the world .'], ['Wild kicks never are , but I hoped to dig up a better frame of mind .', 'Sometimes a burst of aggressiveness will sweep over a man -- or his wife -- because he or she feels age creeping up .']]","[[-0.1635701060295105, -0.16286346316337585], [-0.10388630628585815, -0.10379979014396667], [-0.0008320966735482216, -0.0008245315402746201], [0.0992405116558075, 0.09924773871898651], [0.1967160999774933, 0.1967204213142395], [0.27629420161247253, 0.2767603099346161]]",61.292842864990234,61.292842864990234,"[61.22866439819336, 63.5114860534668, 55.5443000793457, 67.78914642333984, 55.393882751464844, 51.738502502441406]",40.92763900756836,"[47.59683609008789, 47.83058547973633, 45.8797721862793, 58.26410675048828, 45.93690872192383, 40.658409118652344]",4.008970260620117,4.008970260620117,"[4.063967227935791, 3.8244612216949463, 4.042996406555176, 4.053133487701416, 3.9080445766448975, 3.996311664581299]",3.495105743408203,"[3.79363751411438, 3.57401967048645, 3.9005279541015625, 4.014223575592041, 3.708162546157837, 3.695276975631714]"
56,"""Doing or saying small things frequently to make your partner feel special, cared for and loved … is very predictive of staying together, being happy and [preventing] divorce,"" she says.","[['Eighty-five specimens were loaned for study purposes .', 'A metal table and four chairs stood in the center .'], ['However , there is a minimum of legislative restriction on boating .', 'Among the other artists , whose paintings were discussed were Boucher , Courbet , Fra Angelico .'], ['The work of Lay Visitation Evangelism is not completed when all of the persons on the Responsibility List have been interviewed .', 'Within certain wide limits anatomy dictates function and , if one is permitted to speculate , potential pathology should be included in this statement as well .'], ['Men need unity and they need God .', 'They specialize in out-of-the-way items and old French music naturally occupies a good deal of their attention .'], [""Even though I have always had a genius for `` throwing myself '' into every role and `` playing it for all it's worth '' , no actress can be expected to do her best work when her fortune , her reputation , her livelihood , her home and her nation itself are all imperilled ."", 'She smiled at him with benign , remote happiness ; ;'], [""`` To get a marriage back where it belongs '' , comments Dr. Schillinger of the Lincoln Institute , `` the husband must take some very basic steps ."", ""It's inevitable in this case , for the couple will be separated for , at the least , forty years .""]]","[[-0.1609993726015091, -0.1599782258272171], [-0.10357435047626495, -0.10347206145524979], [-0.0007768049836158752, -0.0007141875103116035], [0.0991457998752594, 0.09918533265590668], [0.1955171823501587, 0.1955224871635437], [0.30259203910827637, 0.30275052785873413]]",403.3009033203125,403.3009033203125,"[546.2374877929688, 407.0033874511719, 406.0730895996094, 384.0650329589844, 339.2194519042969, 330.724365234375]",339.8995056152344,"[394.4920959472656, 273.30255126953125, 404.1142272949219, 344.4654846191406, 263.8597106933594, 310.8792724609375]",4.468944549560547,4.468944549560547,"[4.566315650939941, 4.602729320526123, 4.477957248687744, 4.5574235916137695, 4.434227466583252, 4.529593467712402]",4.547665119171143,"[4.566981315612793, 4.462831974029541, 4.516253471374512, 4.4625067710876465, 4.476755142211914, 4.4557204246521]"
97,"Psychologists say the answer can be summed up in three words: novelty, variety and surprise.","[[""But there hadn't been enough time to build it for keeps ."", 'All evening Eileen had been as demure as a little girl getting ready for her first communion .'], ['Among the chief victims of such an ill-conceived imposition would be religion itself .', 'But under the direction of Mira Ziminska-Sygietynska , who with her late husband founded the organization in 1948 , it has all been put into theatrical form , treated selectively , choreographed specifically for presentation to spectators , and performed altogether professionally .'], ['Hostile glances were flashed at both Alexander and Gansevoort .', ""No matter that Gizenga is Moscow's man in the Congo .""], ['( Special compliments to the double bass playing of Johann Krumpp : his scrawny , tottering sound adds a delightful hilarity to the performance .', 'You were sorry when he finished talking because while he was up there you were someone else and the world was something else too .'], ['There was too little occasion beforehand for resistance , the brave strong delights of emotional clash and meeting .', ""`` I was hitting the ball well '' , Player said later , `` and I felt strong .""], ['There are brain-wracking searches for the right word , the best phrase , the most helpful idea .', 'The very faces of the people bore this expectation of fun and pleasure .']]","[[-0.17751064896583557, -0.17494270205497742], [-0.10200750827789307, -0.1019565612077713], [-0.0007489407435059547, -0.0006860531866550446], [0.09868503361940384, 0.09871422499418259], [0.1952533721923828, 0.1954018771648407], [0.27669912576675415, 0.2775333821773529]]",125.38194274902344,125.38194274902344,"[130.84263610839844, 133.347900390625, 110.46529388427734, 140.8870391845703, 116.64517211914062, 109.62482452392578]",66.63842010498047,"[81.67548370361328, 78.76888275146484, 61.515220642089844, 93.83485412597656, 78.95773315429688, 62.09650802612305]",3.6240577697753906,3.6240577697753906,"[3.563894510269165, 3.436021089553833, 3.529039144515991, 3.916498899459839, 3.6514391899108887, 3.6417977809906006]",3.5481038093566895,"[3.6509852409362793, 3.4194397926330566, 3.6916134357452393, 3.8793399333953857, 3.638697862625122, 3.659196615219116]"
102,Know that love's not enough.,"[['On the other hand , Dr. Ezra Styles recorded the following testimony of John Angell , the last disciple of Gorton : ``', ""We have been using the word `` public '' in quotation marks , that is , in its vernacular connotation with reference to the odd-lot index theory .""], [""The success of the project depended upon Fiedler's flight ."", 'These antibody titers were determined by reaction with homozygous Af red cells .'], ['Every so often he turned the knife .', 'Since attack serves to stimulate interest in broadcasts , I added to my opening statement a sentence in which I claimed that German youth seemed to lack the enthusiasm which is a necessary ingredient of anger , and might be classified as uninterested and bored rather than angry .'], ['This is an area nearly as large as Western Europe ; ;', 'My own stern hand has rent the ancient bond , And thereof shall the ending not have end : But not for me , that loved her , to be fond Lightly to please me with a newer friend Then hold it more than bravest-feathered song , That I affirm to thee , with heart of pride , I knew not what did to a friend belong Till I stood up , true friend , by thy true side ; ;'], ['one had always felt the need to make a safe world around her .', ""`` More arrests , I fear '' .""], ['just listening to him made me feel intelligent .', 'He had no idea how much time Budd would give him .']]","[[-0.2023165076971054, -0.201710045337677], [-0.10171666741371155, -0.10169361531734467], [-0.0006237383931875229, -0.0006051007658243179], [0.09868098795413971, 0.09868405759334564], [0.19387251138687134, 0.19395104050636292], [0.3030775189399719, 0.30508020520210266]]",332.8218078613281,332.8218078613281,"[792.0480346679688, 1610.6171875, 555.50341796875, 241.9557342529297, 261.224609375, 338.157958984375]",434.3404541015625,"[568.9564208984375, 788.6607666015625, 756.4550170898438, 165.26712036132812, 289.6779479980469, 374.6665344238281]",4.732029914855957,4.732029914855957,"[4.832322120666504, 4.9545416831970215, 5.013400077819824, 4.6202898025512695, 5.019557952880859, 4.767253875732422]",4.840134620666504,"[4.822492599487305, 4.890839576721191, 4.780555725097656, 4.6339616775512695, 4.977095603942871, 4.8206963539123535]"
