target_idx,target_sent,sents_intrp_all_bins,sim_intrp_all_bins,base_PPL,local_unintrp_PPL,local_intrp_PPL_all_bins,global_unintrp_PPL,global_intrp_PPL_all_bins,base_entropy,local_unintrp_entropy,local_intrp_entropy_all_bins,global_unintrp_entropy,global_intrp_entropy_all_bins
11,"But, say psychologists, there are many behaviors, such as how a couple talks and fights and even the type of dates they go on, that can be learned and practiced — and can give a pair a fighting chance at 'til death do they part.","[['Later accounts blamed defective wiring for starting the fire ; ;', 'Out and out and never to return again .'], [""Joseph Papp , impassioned founder of the festival and director of `` Much Ado '' , had a vibrant , colorful production under way ."", 'The dromozoa fed him in their mysterious way ; ;'], ['I now ever look for Christ according to His promises and those of the Old Testament as well , to appear again in glory to put away all sin and to reign in righteousness over the whole earth .', 'In one sense it can be said that one of the most important Brown & Sharpe products over the years has been the men who began work with the company and subsequently came to places of industrial eminence throughout the nation and even abroad .'], ['Sarah had begun to tell Lucien of Emile , she had begun to question and a little draft had crept across the room from the bedroom door , open barely enough to show a rim of blackness in the hall .', 'Hunter and fisherman visits since 1949 have increased 8 times faster than the nationwide sale of hunting and fishing licenses .'], ['She was closing and within one more bound would have been able to reach the rear end of the bay , but -- and here Jones and Loveless and Ulyate were holding breath for all they were worth -- she never quite caught up that last bound .', 'One such wife , Dr. Linden says , became disgusted with her weak husband and flurried through a series of extramarital affairs in the hope of finding a stronger man .'], ['Or certain words or rituals that child and adult go through may do the trick .', 'But we can say that since a writing poet , with leisure before him , would seem unlikely to invent a technique based upon frequent and substantial circumlocution , the kennings like the epithets must reasonably be ascribed to an oral tradition .']]","[[-0.1592019498348236, -0.15862996876239777], [-0.10181523859500885, -0.10171180218458176], [-0.0002898871898651123, -0.0002886764705181122], [0.09947361052036285, 0.09948328137397766], [0.19763675332069397, 0.19770441949367523], [0.3059598207473755, 0.3076642155647278]]",170.0977783203125,170.0977783203125,"[180.8976287841797, 175.44932556152344, 167.96713256835938, 160.4842987060547, 170.58660888671875, 147.7869110107422]",148.60606384277344,"[158.00811767578125, 148.78472900390625, 151.49124145507812, 151.0325927734375, 152.62721252441406, 140.24559020996094]",4.3311285972595215,4.3311285972595215,"[4.416679859161377, 4.366202354431152, 4.397649765014648, 4.334949016571045, 4.234278678894043, 4.344043254852295]",4.264558792114258,"[4.32694673538208, 4.335789203643799, 4.328368663787842, 4.265984058380127, 4.1784138679504395, 4.2527995109558105]"
22,"In her work with the Early Years of Marriage Project, a longitudinal study of 373 couples who married in 1986 (funded by the National Institutes of Health), Orbuch has found that seven out of 10 pairs name finances a cause of relationship trouble.","[[""Any little dose of radiation might knock off these critters '' ."", 'Vastly relieved , Summers nodded and started toward the door .'], ['The plane was sent back to the United States , for a change , but Castro kept the crazy gunman , who will prove a suitable recruit to the revolution .', 'I remembered it was the Peeping Tom place .'], ['Boyer is suffering from a stiff neck .', 'But , but and but .'], ['The United States was engaged in a military attack on a peaceful , orderly people governed by a regime that had proved itself the most pro-Western and anti-Communist within any of the new nations -- the only place in Africa , moreover , where a productive relationship between whites and blacks had apparently been achieved .', ""There are the full-bodied , resourceful voices of Robert Weede , Mimi Benzell and Tommy Rall to make the most of Mr. Herman's lilting melodies and , for an occasional change of pace , the bright humor of Molly Picon .""], ['The shelter illustrated in figure 12 is based on such a room built in a new home in the Washington , D.C. area in the Spring of 1959 .', 'Aug. 4 , 1821 , nearly a century after Benjamin Franklin founded the Pennsylvania Gazette -- a century during which it had undergone several changes in ownership and a few brief suspensions in publication -- this paper made its first appearance as the Saturday Evening Post .'], ['Twelve projects proposed by private groups are at the contract-negotiation stage , Gordon Boyce , director of relations with the voluntary agencies , said in a Washington interview .', 'Mrs. Blanche Dunkel , 60 , who has spent 25 years in the Dwight reformatory for women for the murder in 1935 of her son-in-law , Ervin Lang , then 28 , appealed for a parole at a hearing yesterday before two Illinois pardon and parole board members , John M. Bookwalter and Joseph Carpentier .']]","[[-0.18032772839069366, -0.1799810528755188], [-0.10106337070465088, -0.10076256096363068], [-0.00027954205870628357, -0.0002729548141360283], [0.09912784397602081, 0.09916934370994568], [0.19699642062187195, 0.19700860977172852], [0.30989399552345276, 0.31363505125045776]]",88.19522094726562,88.19522094726562,"[95.28536224365234, 108.48616790771484, 87.4268798828125, 99.61128997802734, 98.18861389160156, 86.55389404296875]",77.33037567138672,"[77.6108627319336, 95.8093490600586, 77.9478530883789, 90.90385437011719, 79.85673522949219, 84.14543151855469]",3.4738316535949707,3.4738316535949707,"[3.5013861656188965, 3.525864362716675, 3.504079818725586, 3.3281807899475098, 3.3378868103027344, 3.357529401779175]",3.5344443321228027,"[3.6843154430389404, 3.618952751159668, 3.6339526176452637, 3.4288442134857178, 3.4136857986450195, 3.391631841659546]"
24,"1 source of conflict or tension,"" she says.","[['Mr. Sansom can be eloquent in a spectacular way which recalls ( to those who recall easily ) the statues of Bernini and the gigantic paintings of Tintoretto .', 'The original machine , bearing its famous serial number , is still on exhibition at the Brown & Sharpe Precision Center in Providence .'], ['The bill is designed to provide special schooling for more deaf students in the scholastic age at a reduced cost to the state .', 'Speaking of his work with Johnny Mercer , Arlen says , `` Our working habits were strange .'], ['Such ambiguous exercises compound confusion by making it worse compounded , and they are sometimes expanded until the cream of the jest sours .', ""The result was the `` Gross Report '' , prepared by Gross , as chairman , with the assistance of two U.N. Under Secretaries , Constantin Stavropoulos and Philippe De Seynes .""], ['A good word for it is fellowship .', ""He's really asking for it '' .""], ['If women replaced people , it would normally have dominant stress .', ""He must become more expressive of his own desires , more demanding and less ' understanding ' '' .""], ['Yes , and as tension mounts in this world , fear is increasing .', 'She wondered , with a baffled feeling of helplessness .']]","[[-0.16981835663318634, -0.16885906457901], [-0.10071784257888794, -0.10070076584815979], [-0.00030011124908924103, -0.00029999949038028717], [0.09909462928771973, 0.09912202507257462], [0.1925976574420929, 0.19270861148834229], [0.2488790899515152, 0.24909290671348572]]",153.14773559570312,153.14773559570312,"[446.610107421875, 300.63555908203125, 486.20330810546875, 211.97303771972656, 262.69769287109375, 201.21820068359375]",104.72777557373047,"[287.7061462402344, 298.1739807128906, 328.3243713378906, 152.83908081054688, 231.0020751953125, 160.01565551757812]",4.673138618469238,4.673138618469238,"[4.496578693389893, 4.798349857330322, 4.635796070098877, 4.822287082672119, 4.765625953674316, 4.866272449493408]",4.446310043334961,"[4.499542236328125, 4.819282531738281, 4.708395004272461, 4.750025749206543, 4.710117340087891, 4.738426208496094]"
70,"After a decade, the most striking difference between the couples who had divorced and the ones who stayed together was how they had handled conflict during their first year of marriage.","[['He was not stone .', 'I stopped by the counter .'], ['This volume is added to the total volume of the combustion chamber and head gasket opening .', 'These forty-seven special purpose governments have the authority to levy taxes , to borrow money , own property , sue and be sued , and in general to exercise normal corporate powers .'], ['On the hillside above was caged what might have been an incarnation of Fudo , or perhaps a demon .', 'In the midst of a great busy city , people take time to enjoy the beauty of natural reflection of artificial light .'], ['He had come into the Navy too young , with the image of the fun-loving Guns Appleby before him .', '( Several times recently I have wondered whether shows were being staged for the sake of the script or just to entertain the audience with the spectacle of scenery being shifted right in front of their eyes .'], ['These boys acknowledged an introduction to anybody by gently pressing one of his hands in both of theirs , while they gazed , misty-eyed with care , into the eyes of the person they were meeting .', 'Neither was his wife .'], ['She finds married life stifling and every prolonged sex relationship unbearably monotonous .', ""( `` One of the reasons they get along fine '' , says a sportswriter who is friendly with the two men , `` is that both realize Mantle is head-and-shoulders above Maris '' .""]]","[[-0.14708060026168823, -0.1467583030462265], [-0.10258633643388748, -0.10251874476671219], [-0.0003206320106983185, -0.0002912767231464386], [0.09958784282207489, 0.09958802908658981], [0.1976623684167862, 0.19769605994224548], [0.3498241901397705, 0.34988003969192505]]",63.39647674560547,63.39647674560547,"[65.4105224609375, 73.56905364990234, 67.64771270751953, 63.986846923828125, 53.74464797973633, 52.98762512207031]",66.15398406982422,"[61.47501754760742, 67.26786041259766, 61.632896423339844, 57.76034927368164, 59.92666244506836, 64.57185363769531]",3.936660051345825,3.936660051345825,"[4.143283843994141, 3.9670956134796143, 4.064607620239258, 4.0905022621154785, 3.787245750427246, 3.9006736278533936]",3.9927170276641846,"[4.1743950843811035, 4.089850902557373, 4.107963562011719, 4.152061462402344, 4.040393352508545, 4.070201873779297]"
92,"Growing used to your partner is natural, but it's a process that can be slowed down, says Sonja Lyubomirsky, PhD, a social psychologist at the University of California, Riverside, and author of the 2013 book ""The Myths of Happiness.""","[['He scarcely saw them .', ""Now lay 12 pieces of Af cut 5-3/4'' '' long side by side but separated by 12 pieces of the same material 1/2'' '' sq. .""], ['But , so far as its territorial objectives were concerned , the campaign was successful .', 'Trooper J. A. Grzesiak spotted the wanted car , with three boys , at a Route 2 service station , just outside Annapolis .'], ['The bronchial artery , except for a small number of short branches in the hilum , contributes none of the pleural blood supply .', ""`` All right '' , Pam said .""], [""Every night when he wanted a drink of water , didn't he practice being fearless by not turning on the bathroom light ? ?"", 'Institutionalization Though undoubtedly all six processes are operative within the whole social system and its subsystems , two processes that are of crucial importance to this study will be singled out for particular emphasis .'], ['In the calm which follows the reading of a poem , for example , is the effect produced by the enforced quiet , by the musical quality of words and rhythm , by the sentiments or sense of the poem , by the associations with earlier readings , if it is familiar , by the boost to the self-esteem for the semi-literate , by the diversion of attention , by the sense of security in a legitimized withdrawal , by a kind license for some variety of fantasy life regarded as forbidden , or by half-conscious ideas about the magical power of words ? ?', 'A woman met a famous author at a literary tea .'], ['For , after leaving the Army in 1956 , I spent five years in Graduate School first at Boston College and then at the University of Toronto .', ""That you have refused to drive him into the family business or push him into a profession so you can say at the club , `` Of course David has known since he was twelve he wanted to be an engineer '' -- or a lawyer , or an editor ? ?""]]","[[-0.16240087151527405, -0.16178244352340698], [-0.10215981304645538, -0.10210864990949631], [-0.0002640578895807266, -0.00026149582117795944], [0.09937918186187744, 0.09943351149559021], [0.19505704939365387, 0.19519948959350586], [0.25435012578964233, 0.2564600110054016]]",85.72366333007812,85.72366333007812,"[82.65184020996094, 92.44520568847656, 89.87773895263672, 80.49994659423828, 84.55823516845703, 81.71583557128906]",88.14115142822266,"[78.64143371582031, 81.22766876220703, 88.19345092773438, 80.64202117919922, 78.50415802001953, 76.90377807617188]",3.993377923965454,3.993377923965454,"[4.018596649169922, 4.001701831817627, 3.9962992668151855, 4.087510585784912, 3.9047842025756836, 3.770698308944702]",3.982982635498047,"[4.013794422149658, 3.9933762550354004, 4.026309013366699, 4.017588138580322, 4.003856182098389, 3.7629916667938232]"
