target_idx,target_sent,sents_intrp_all_bins,sim_intrp_all_bins,base_PPL,unintrp_PPL,intrp_PPL_all_bins
277,"She’d told Luigi that she would catch the bus, but knowing that Myra and the kids were away, it was not unusual for Luigi to come by for coffee or to spend the night.","[['As Littlepage noted : `` A complete picture of Prince Potemkin may be had in his 1788 operations .', 'This is a normal governmental procedure which reflects more accurately cost-accounting principles .', 'I pointed to the splintered , upright stake .', 'The Medical Illustration Service is responsible for the collection , publication , exhibition , and file of medical illustration material of medico-military importance to the Armed Forces .'], [""If the content of faith is to be presented today in a form that can be `` understanded of the people '' -- and this , it must not be forgotten , is one of the goals of the perennial theological task -- there is no other choice but to abandon completely a mythological manner of representation ."", 'I would like to quote from the Charter of the United Nations :', ""You may not be responsible '' ."", 'And Django owed much to Louis Armstrong .'], ['He knew the whyfores and the wherefores but he was weak , very weak , on the therefores .', '361 U. S. 899 .', 'Considering that the current school-age potential is 23 million youths , the project and its message on hunting and shooting education have many more to reach .', 'In 1910 it required the convening of a special three-judge court for the issuance of certain injunctions and allowed direct appeals to the Supreme Court .'], [""He would sit , slim-waisted and spare , on the edge of Scotty's bed , his legs crossed so elaborately that the crossed foot could tap the floor ."", 'Martin gave her a teasing pat .', 'The musical cleverness and spirit plus a strong sense of taste and measure save a wry little joke from becoming either bawdy or mawkish .', ""Best Bet for Tonight : That darlin' dazzler from Paree , Genevieve , opening in the Empire room .""], ['Actually , there was a lot of force in him , which is why I kept on in that class instead of quitting after a week .', 'A sudden thought wiped the smirk from his face .', ""She wouldn't go back to New York as Maude suggested ; ;"", 'It was that oddly shaped space at the very top of the house , where ceiling heights had to accommodate themselves to the varying angles of roof slope .'], [""A couple of years back , I occupied a Village apartment whose outer staircase contained the type of niche called a `` coffin turn '' ."", 'At the time Alex arrived he was engaged in some sort of intimate communication with the hen , who had settled herself on the nest most peacefully after the occurrences of the morning .', 'In the apartment itself , all was still .', 'She remarked that she found the night wind a little chilly , and Mr. Podger took her inside the fringe .']]","[[-0.17749537527561188, -0.17747078835964203, -0.17686618864536285, -0.17340095341205597], [-0.10415878891944885, -0.10408693552017212, -0.1038745865225792, -0.10363070666790009], [-0.0009300513193011284, -0.00090017169713974, -0.0008952142670750618, -0.0008519338443875313], [0.09873876720666885, 0.09875006228685379, 0.09881085157394409, 0.0988747626543045], [0.19582980871200562, 0.1958915889263153, 0.1959608793258667, 0.19601920247077942], [0.3271694779396057, 0.3280184864997864, 0.3284772038459778, 0.33093374967575073]]",52.89902877807617,36.59911346435547,"[39.91651916503906, 38.28940963745117, 36.39257049560547, 38.01250457763672, 36.99939727783203, 35.849666595458984]"
137,"As Tess returned home that evening, she was tired and worried.","[['One of the uniformed officers stepped in my way , demanding to know whether I had permission to enter Germany .', 'I forced confidence into myself .', 'You can wait , of course , until you arrive in Europe before renting your car .', 'A precision transit is set up so that it is aligned with respect to true north .'], [""Progress is being made , too , in improving motorists' access to many turnpikes ."", 'This creates an amusing effect because its position in a sentence seems to make it apply to the wrong word .', ""It sure as hell doesn't look like any dominant intelligent species to me ."", ""It sure as hell doesn't look like any dominant intelligent species to me .""], ['When sufficiently accurate and complete measurements are available , it will be possible to set limits on the thermal and electrical characteristics of the surface and subsurface materials of the moon .', 'When sufficiently accurate and complete measurements are available , it will be possible to set limits on the thermal and electrical characteristics of the surface and subsurface materials of the moon .', ""Ma had found one of Pa's hiding places ."", 'I quit work at my usual hour as if this day was no different from other days .'], ['The suggestion is naive .', 'The common belief was that there existed one moral order , which included everything .', ""And wasn't John's wife , Edythe , even more appalling , if possible ? ?"", ""And wasn't John's wife , Edythe , even more appalling , if possible ? ?""], ['Mr. White admires him profoundly and leaves no doubt that he is a Democrat himself who expects Mr. Kennedy to be a fine President .', 'for Mother to be able to call , Susan must be napping now , surrounded by her multitude of dolls .', 'No , Cady , he made second team .', 'All the women were beautiful , and the men were equal to them ; ;'], ['He could think of nothing else save his mental image of her nude figure and what Charles had said that morning about Margaret Rider .', 'Besides , Miss Henrietta -- as she was generally known since she had put up her hair with a chignon in the back -- had little time to spare them from her teaching and writing ; ;', 'She would look at Jack , with that hidden something in her eyes , and Jack would see the Woman and become breathless and a little sick .', ""This officer had asked Lizzie if she suspected her Uncle Morse , and she replied she didn't think he did it because he left the house before the murders and returned after them .""]]","[[-0.19401271641254425, -0.18965968489646912, -0.18539492785930634, -0.1839158535003662], [-0.10391983389854431, -0.10374648869037628, -0.10364529490470886, -0.10364529490470886], [-0.0007402608171105385, -0.0007402608171105385, -0.0007117306813597679, -0.000700631644576788], [0.09885342419147491, 0.09893624484539032, 0.098969966173172, 0.098969966173172], [0.19407156109809875, 0.19414588809013367, 0.19418352842330933, 0.1943008005619049], [0.3040715157985687, 0.30468952655792236, 0.30519425868988037, 0.3054734170436859]]",63.16359329223633,31.182758331298828,"[31.987375259399414, 31.249286651611328, 31.28596305847168, 31.589214324951172, 32.0495719909668, 30.59552764892578]"
27,"Well, well.","[['Miss Upton spoke gratefully of the response of Spelman graduates and Negro friends in helping to raise the Fund , and their continuing efforts to raise money for greatly needed current expenses .', 'It is known that at least five towns ( Barrington , Bristol , Narragansett , Newport and Westerly ) place some value on some boats for tax purposes .', ""the difference between Mr. Parker and the Association is a difference between no Christianity and Christianity '' -- despite these supposed conclusive assurances , the modern liberal heaves repeatedly a sigh of relief , of positive thanksgiving , that the Association never quite brought itself officially to expel Parker ."", 'Two entries in The Early Life support the assumption that during this period Hardy had virtually suspended the writing of poetry .'], ['The Creston is purely a potboiler , with Spanish , English , French and American dances mixed into the stew .', 'Few of the native Jews who had lived in Lublin were still in the ghetto .', 'Does it attack other traditional American institutions with unsupportable and wild charges ? ?', 'The event is the sixth on the annual calendar of the local members of the National Council of Jewish Women .'], ['So she brought the fish in whole , and she carried a lemon in her mouth .', 'Other steps would be developed after information drifts down to the local level from the federal government .', 'There were hideous scars inside the throat and the palate was mutilated .', 'Besides proteolytic enzymes the thyroid possesses de-iodinating enzymes .'], ['The name encouraged him , because he always felt that he could handle the Irish .', ""Curt reached out and dropped Jess's pistol back into the holster ."", 'and a host of others .', 'The description of the Siddo syntax was very restricted .'], [""It was pleasant last night , therefore , to hear him do something else : a concerto he has recently recorded , `` The Emperor '' ."", ""`` I would like to enact a little tableau this afternoon '' , Rector said , He explained about the visit and the effect he wished to create , the picture of a very busy mission ."", 'Would the man make it or not ? ?', 'The motive may have been the mysterious quarrel ; ;'], ['`` Listen to me , Leigh .', ""This snake could not harm anything '' ."", 'Ramey smiled but he thought to himself , I always see me too .', 'Ramey smiled but he thought to himself , I always see me too .']]","[[-0.19043384492397308, -0.18643246591091156, -0.18484088778495789, -0.18467971682548523], [-0.10376589000225067, -0.10375005006790161, -0.10370379686355591, -0.10363703221082687], [-0.0009185969829559326, -0.0008259676396846771, -0.0008223913609981537, -0.0008219853043556213], [0.09836859256029129, 0.0983688235282898, 0.09839162230491638, 0.09849628806114197], [0.19492170214653015, 0.19509857892990112, 0.19544264674186707, 0.19554241001605988], [0.26497918367385864, 0.2661585509777069, 0.2665575444698334, 0.2665575444698334]]",199.68031311035156,257.9934387207031,"[256.62921142578125, 335.2046203613281, 342.0621337890625, 330.127685546875, 256.3273620605469, 264.2296142578125]"
332,"Telling Marina to let him in, Luigi came storming in like a bull that had just been untied.","[[""In a set of case studies of teachers with various social-class backgrounds , Wattenberg illustrates a variety of approaches to students and to teaching which depend upon the teacher's personality as well as on his social-class background ."", ""In a set of case studies of teachers with various social-class backgrounds , Wattenberg illustrates a variety of approaches to students and to teaching which depend upon the teacher's personality as well as on his social-class background ."", ""But he was homesick '' ."", ""But he was homesick '' .""], ['A squadron of Navy jets and another of long-range patrol planes would add support to the carrier task forces .', 'The tiny hamlet of Chesterton to the north , with the fens and marshes lying on down the Ouse River , may have attracted him often , as it did many other youths of the time .', 'Drawing and models were his thinking .', ""Moreover , her central figures are so busily fulfilling their multitudinous assignments that none emerges as an arresting individual in his own right or as a provocative symbol of mankind's ills .""], ['and it must be enforced without discrimination .', 'and it must be enforced without discrimination .', 'Payne did not notice him .', 'I saw the pony fall like a stone and the young warrior flew over its head , bouncing like a rubber ball .'], [""There had been some coconut in it , for I remember my mother's taking a quick glance at a stringy bit of this nut on the cheek of one of them and then putting down her radish with a shiver ."", ""There had been some coconut in it , for I remember my mother's taking a quick glance at a stringy bit of this nut on the cheek of one of them and then putting down her radish with a shiver ."", ""There had been some coconut in it , for I remember my mother's taking a quick glance at a stringy bit of this nut on the cheek of one of them and then putting down her radish with a shiver ."", 'The many-bodied girl lay near him .'], [""`` Name one , I been there '' ."", ""I couldn't make out what his racket was ."", 'How long you may stay outside .', 'He found the key to the Jeep , got it started and warmed it up for five minutes .'], [""`` It's only that I like to know where you go '' ."", ""`` You go to bed '' , I said curtly ."", ""Sposato couldn't wait to get me hired ."", ""`` Mr. Wycoff's car is waiting for you at the east entrance '' .""]]","[[-0.19443379342556, -0.19443379342556, -0.19405663013458252, -0.19405663013458252], [-0.1026955097913742, -0.10246642678976059, -0.10240596532821655, -0.10238289833068848], [-0.0005951113998889923, -0.0005951113998889923, -0.0005928389728069305, -0.0005605313926935196], [0.09766237437725067, 0.09766237437725067, 0.09766237437725067, 0.0978584885597229], [0.1898011863231659, 0.1898142695426941, 0.1898246705532074, 0.19021227955818176], [0.2706524729728699, 0.2735693156719208, 0.274719774723053, 0.2747853696346283]]",222.6274871826172,172.60401916503906,"[169.27281188964844, 168.3682403564453, 166.85824584960938, 169.6217041015625, 164.6677703857422, 169.28355407714844]"
381,"“Ko, arrange with Luigi to get Myra and the kids back as soon as possible!”","[['But this will not happen merely through the natural process of social life .', ""I'm always trying to find a breaking table in blackjack ."", 'That is , there was no trace of Anglo-Saxons in Britain as early as the late third century , to which time the archaeological evidence for the erection of the Saxon Shore forts was beginning to point .', 'This is not due to any policy of discrimination on the part of the Northern universities .'], ['The original machine , bearing its famous serial number , is still on exhibition at the Brown & Sharpe Precision Center in Providence .', 'In southern Europe , between the Israeli Republics and the Icelandic-speaking peoples of northern Europe , was a thin but long stretch of territory called March .', ""When Johnson ejaculated `` Howsabout my buying us all a nice cold Co-cola , Ma'am '' ? ?"", 'and Frank W. Pesce , operator of a Glimco dominated deodorant firm , the Best Sanitation and Supply company , 1215 Blue Island Av. .'], ['The Twenty-second Soviet Communist Party Congress opens in Moscow today in a situation contrasting sharply with the script prepared many months ago when this meeting was first announced .', 'Government research will look into new products and methods .', 'for another , it was here that one of the old caravan routes came in .', ""`` I'm just logging '' , the cowboy explained .""], ['Even as she called to the children , Conchita let her gaze seek Tom Brannon .', 'But he weighted the Eighth Symphony , at times , with a shuddering subjectivity which seemed considerably at odds with the music .', ""Richardson had returned their departing grins with the noncommittal nod that is the security officer's stock in trade ."", ""`` Oh he's just an international spy '' , Eileen would shout with her screechy laugh .""], [""You don't head back down again ."", 'In general , Mr. Loesser has done a more consistent job as lyricist than he has as composer .', 'They bent over yellowed prayerbooks and looked up only to watch the teacher .', 'Now he saw that the approaching car was painted white , and he began to wave his arms frantically .'], ['He finished with the team and filled his pipe and stood looking about him .', 'He would wake up in the middle of the night and fret about it .', 'He would wake up in the middle of the night and fret about it .', 'Roberts sagged and slashed at him wildly .']]","[[-0.18576112389564514, -0.18487918376922607, -0.18479834496974945, -0.18456846475601196], [-0.10438510775566101, -0.10436459630727768, -0.10424253344535828, -0.10421641916036606], [-0.0008487743325531483, -0.0008169189095497131, -0.0008124914020299911, -0.0008078552782535553], [0.09840051829814911, 0.09843447804450989, 0.09849021583795547, 0.09854485094547272], [0.19429618120193481, 0.19441533088684082, 0.19444313645362854, 0.1945643573999405], [0.33110952377319336, 0.33152177929878235, 0.33152177929878235, 0.33211466670036316]]",128.0385284423828,74.25996398925781,"[82.04986572265625, 76.54097747802734, 76.00724792480469, 74.30937194824219, 74.15483093261719, 75.29857635498047]"
