target_idx,target_sent,sents_intrp_all_bins,sim_intrp_all_bins,base_PPL,unintrp_PPL,intrp_PPL_all_bins
346,"They’re just people and anyone can make a mistake, Mister.","[['Nothing less would serve .', 'Nothing less would serve .', ""The provisions for determining a State's unadjusted Federal share are designed to reflect the varying financial resources among the States ."", 'Independent art schools granting degrees must , naturally , follow this with academic accreditation by the appropriate regional group .'], ['For top and bottom pieces , use short end of mold as measurement guide .', ""`` Against the grain of creation ''"", ""whaddya gonna do with all those muscles ( of which he has none at the time ) '' ? ?"", 'The anti-slavery movement took many forms .'], ['Yet Alfredo wanted money wanted money to roam through the deserts .', 'Resolving to get something done , I started in on the dishes .', 'I am sure that they did when Eisenhower was President .', 'To begin with , what is an interior designer ? ?'], ['This habit had become so fixed over the years that it seemed futile to do anything for which no one was waiting .', 'One of the roughest was the TV quiz shows , which gave him inferiority complexes .', 'Because the bobbin-to-cone winding process is a relatively high-cost operation for the mill , the almost complete automation provided by the Uniconer can mean important economies in textile production , at the same time upgrading quality .', ""Too many husbands , Dr. Schillinger continues , worry about `` how well they're doing '' , and fear that their success depends on some trick or technique of sexual play .""], [""The sound mockery of sheep is like the salubrious horse laugh '' ."", 'Sam is having his troubles with Layton Hanover ( Dean Hanover-Lucy Hanover ) , but hopes to have him straightened out and going before long .', ""Doc Doolittle's scheduled appearance at captain's mast was a very unusual thing , because the discipline dispensed there is ordinarily for the young and immature , and a chief is naturally expected to stay off the report ."", 'That mention of this should bring smiles to our lips today is as clear an indication as we could wish of the extent to which attitudes have changed .'], ['She retreated before the naked shame in the old man and the fury beyond it and sank into the darkness of her lodge where Walitzee stirred , mumbling , sitting up in a half stupor to say :', ""Eileen had a wonderful way of not listening to things she didn't want to hear ."", 'An eyewitness recalled how awkward the red-turbaned colored women appeared as they curtseyed in the church doorway , and the diffidence the former slaves displayed while they listened to the few words that declared them free .', 'Finally , in desperation , he opened the refrigerator , filched her hand lotion , and left a note .']]","[[-0.18443571031093597, -0.18443571031093597, -0.18403437733650208, -0.18252788484096527], [-0.10466087609529495, -0.1045694500207901, -0.10415536165237427, -0.10414360463619232], [-0.0009177490137517452, -0.0008182656019926071, -0.0008098743855953217, -0.0008041597902774811], [0.09888650476932526, 0.09890249371528625, 0.09896618127822876, 0.09899930655956268], [0.1981966495513916, 0.19827306270599365, 0.19831715524196625, 0.19832535088062286], [0.34662187099456787, 0.34842461347579956, 0.34872838854789734, 0.34911733865737915]]",82.89983367919922,45.02420425415039,"[86.0195083618164, 58.296566009521484, 40.89994430541992, 73.12128448486328, 47.964752197265625, 87.4923095703125]"
184,"Tess did not know that David was discussing their encounter with one of his best friends, Samuel Adams.","[[""In our present era of Science and Angst , the heart has been downgraded , to use one of our popular retrogressive verbs '' ."", ""In our present era of Science and Angst , the heart has been downgraded , to use one of our popular retrogressive verbs '' ."", ""In many cases that statement -- `` We break even on our downtown operation and make money on our branches '' -- would be turned around if the cost analysis were recalculated on terms less prejudicial to the old store ."", 'It places terrific tension on the leg muscles from start to finish of each repetition .'], ['But consideration of the frequency of stems per constant meaning seems to be established as having significance in comparative situations with diachronic and classificatory relevance ; ;', 'We are interested in further diversification into other fields of capital goods , or components for industrial products , and have recently intensified our efforts in that direction .', ""Apparently at the insistence of the U. S. , the simultaneous announcements issued in Washington and Moscow last Friday emphasized the `` informal '' nature of the meeting ."", 'To the extent that our sampling of the orientations of American college students in the years 1950 and 1952 may be representative of our culture -- and still valid in 1959 -- we are disposed to question the summary characterization of the current generation as silent , beat , apathetic , or as a mass of other-directed conformists who are guided solely by social radar without benefit of inner gyroscopes .'], [""`` Uh-huh '' , Ryan admitted ."", '-- Not less than 70 milligrams of Aureomycin per head daily to aid in the prevention of liver abscesses in feed-lot beef cattle .', 'He wiped the steering wheel and all the places he might have touched the Jeep .', 'His normal specialty is playing the good-natured old man , frequently stupid or deluded but never mean or sly .'], [""After I would finish playing the songs , he'd just go away without a comment ."", 'It took thirty of our women almost six moons to build this one , which is higher and stronger than the old one .', 'All things are possible to God , but He chooses -- usually -- to work through people .', 'All things are possible to God , but He chooses -- usually -- to work through people .'], [""`` Well -- women and unhappiness go together '' , I observed profoundly , adding , `` You can wager your derriere on that '' ."", ""Those qualities make Esther Marr a popular asset at the Salvation Army's Social Center at 1200 Larimer St. ."", 'Some have lovely homes -- some live in small apartments .', ""`` You're too lazy to go out and look for another job .""], ['The bride was given in marriage by her father .', 'Anthony Steel , as the husband , is a jealous type who argues against her course and sues for divorce , labeling her action adulterous .', ""I don't ask you who 'tis you're being unfaithful to , husband or lover ."", ""Wisely , the Comedie has brought Moliere's `` Tartuffe '' on its tour and has left `` The School For Wives '' at home .""]]","[[-0.19085708260536194, -0.19085708260536194, -0.1899651736021042, -0.18855270743370056], [-0.10301730036735535, -0.10301356762647629, -0.10295358300209045, -0.10292203724384308], [-0.0006894934922456741, -0.0006603430956602097, -0.0006436705589294434, -0.0006209602579474449], [0.09900736808776855, 0.09901104867458344, 0.09901624172925949, 0.09901624172925949], [0.19487538933753967, 0.19491182267665863, 0.1949448585510254, 0.19504694640636444], [0.31031131744384766, 0.31234872341156006, 0.3137575089931488, 0.314131498336792]]",19.196924209594727,18.405879974365234,"[22.49982452392578, 27.22020721435547, 17.38947296142578, 20.45885467529297, 21.152822494506836, 18.719038009643555]"
82,"David, holding Carla in his arms, Kohana, Sam, and Ted were also shocked.","[[""It's simple enough from my point of view ."", 'By that time we should be in a much better position to determine the value of that aircraft as a weapon system .', 'By that time we should be in a much better position to determine the value of that aircraft as a weapon system .', 'All I ever wanted was to be a free man in my own country .'], [""Today , seven years after the date of my initial induction as a draftee , I am Assistant Professor of Philosophy and Science at St. Michael's College ."", 'For his workmanship we are , created in Christ Jesus .', 'One might say it combines the man ; ;', ""Only Walter Lippman envisioned the possibility of our having `` outlived most of what we used to regard as the program of our national purposes '' .""], ['Turning to the Word of God , we find the only sure way to do that .', 'Union soldiers at times used it for sleeping quarters to escape from the rain or other inclement weather , and some of them left momentoes of their stay by carving their names and small tokens on its walls and beams .', 'The truth is , however , that when Mel Chandler first reported to the regiment the only steed he had ever ridden was a swivel chair and the only weapon he had ever wielded was a pencil .', 'Forty-five new Clinico-pathologic Conferences were prepared , bringing the total to 61 available for loan distribution .'], [""Adams was not breaking new ground when he claimed that the worship of an unseen power was in reality a reflection of man's inability to cope with his environment ."", 'In the frame are two sets of bars which interact with each other to prevent the operator from making dangerous moves .', 'This French film , set in Italy , is a summertime splurge in shock and terror all shot in lovely sunny scenery -- so breath-taking that at times you almost forget the horrors the movie is dealing with .', 'Thus the lack of effective recognition of the responsibilities involved in caring for two babies showed signs of becoming a disabling problem .'], [""Gavin's lips moved so that Clayton had to stoop to catch the words ."", 'No fasciculations or sensory defects were found .', ""`` Come sit '' , said Feathertop , motioning them toward him ."", 'Then we were off again .'], ['As his feet slowed , he felt ashamed of the panic and resolved to make a stand .', 'He released her reluctantly for her enthusiastic reunion with Old Hap .', 'Quietly he determined to foil her .', 'There was no place to sit , but Watson walked slowly from the ladder to the window slits and back , stooping slightly to avoid striking his head on the heavy beams .']]","[[-0.17935647070407867, -0.17800381779670715, -0.17800381779670715, -0.17714932560920715], [-0.10297918319702148, -0.10296674072742462, -0.10289525985717773, -0.10269556939601898], [-0.0008492888882756233, -0.0008222544565796852, -0.0007937513291835785, -0.0007870569825172424], [0.09880486875772476, 0.09885820746421814, 0.09887685626745224, 0.09890967607498169], [0.1972033977508545, 0.19723430275917053, 0.197307288646698, 0.19735588133335114], [0.3135039210319519, 0.3139009475708008, 0.31486064195632935, 0.31958433985710144]]",23.890514373779297,20.262296676635742,"[25.10470199584961, 21.063753128051758, 23.108413696289062, 22.524385452270508, 23.252626419067383, 20.106834411621094]"
24,"I told him not to do it, but since he doesn’t seem to understand English very well, there was a miscommunication,” and everyone in the room laughed, including David.","[['We are not given to lamentations , neither personally nor in these Reports .', 'and it was filled then as now by quarreling tribes with no political or historical unity .', ""The working test of `` the facts '' must always be the best available description obtainable from scholars and scientists who have applied their methods of investigation to relevant situations ."", ""Ambassador Thompson reported from Moscow that the Soviet leader's mood was cocky and aggressive .""], ['for example , the organization of steamship conferences to set freight rates and the encouragement of railroads to seek mergers .', 'for example , the organization of steamship conferences to set freight rates and the encouragement of railroads to seek mergers .', 'In the thirties we would not face our enemy ; ;', ""Sprinkel strongly refuted the current neo-stagnationist thesis that we are facing a future of limited and slow growth , declaring that this pessimism `` is based on very limited and questionable evidence '' .""], ['She had picked up the quirt and was twirling it around her wrist and smiling at him .', ""`` Both because of our culture's stress on beauty and our improved economic conditions , some parents demand that the dentist try to correct a problem before it is wise to do so ."", 'Conchita kept an eye on the twins and little Elena , trying to keep them from falling into the creek by which they persisted in playing .', ""Reinforcements came up quickly to take advantage of the opening made by Goulding's platoon .""], ['In either case , it could call a special session of the Legislature later in 1961 to make another stab at raising additional revenues through a tax raiser .', 'Her debut over , perhaps the earlier scenes will emerge equally fine .', 'With a bellow Carmer lunged at him .', 'With a bellow Carmer lunged at him .'], ['`` Okay , take the tray .', '`` Okay , take the tray .', '`` Okay , take the tray .', '`` Okay , take the tray .'], ['Her woolly-minded parent agreed .', 'some women with father fixations do .', 'Boy , could she catch ! !', ""Well , we can't have everything .""]]","[[-0.20204055309295654, -0.19974203407764435, -0.19769926369190216, -0.19210395216941833], [-0.10293646156787872, -0.10293646156787872, -0.10290306806564331, -0.10259416699409485], [-0.0005805352702736855, -0.0005782525986433029, -0.0005538444966077805, -0.0005464386194944382], [0.0979987159371376, 0.0981064885854721, 0.09830182790756226, 0.09830182790756226], [0.19182851910591125, 0.19182851910591125, 0.19182851910591125, 0.19182851910591125], [0.29021579027175903, 0.29607856273651123, 0.2990308403968811, 0.29926714301109314]]",28.734514236450195,19.783161163330078,"[24.140243530273438, 33.468528747558594, 24.233535766601562, 23.248985290527344, 21.688474655151367, 20.454730987548828]"
238,He is the man that I was telling you about.,"[['The order to abandon ship was given , but cries of pain could be heard from the wounded below decks .', 'If it were not for the effect of destructive agencies , sawtimber growth would have been nearly twice as great as the 47 billion board feet in 1952 .', 'In the jungle , birds were mute , while insects preserved only the monotony of living .', 'They may be claimed only by itemizing them on page 2 of Form 1040 .'], ['The value of place-names in the reconstruction of early English history had long been recognized .', 'No doubt the underlying idea was to show that for all the elegance and artistry that have distinguished its presentations thus far , it too could give a circus if it pleased .', 'And not one single dwelling left there , though once , in the early eighteenth century , there were close to a hundred houses .', 'Each film consisted of fifty feet , which gives a running time of about one minute on the screen .'], ['A vision handicap that may produce nervous tension and reading disability for one child may spur another child on to even greater achievement in reading .', 'All I ever wanted was to be a free man in my own country .', ""We have evaluated the `` matching integrals '' for two types of photocathodes ( S-11 and S-20 ) and three types of light input ."", 'He handed the bayonet to Dean and kept the pistol .'], ['those who could talk declared it to be the breathing of Captain Alvarez .', ""But there is a dignity and even a hint of the inspired prophet in his words to one correspondent : `` You ask what I am going to ' reply ' to Bradley ."", ""Done in the modern style of a `` confession '' , Fink tells in exquisite detail how he came to know , and , more important , love his mother's pet salamander , Alicia ."", 'Mike passed through it and moved toward the dark mass of horses .'], [""`` Oh , that is demonstrable '' , I told him ."", '-- Let me help him , for the love of God ! !', ""`` Join me in another '' ? ?"", 'The quest offers careers .'], [""I am with you , of course , Tomas '' ."", 'He was a cagey sonofabitch .', ""`` Cool '' , I told him ."", ""`` You live in the present '' ? ?""]]","[[-0.1829216480255127, -0.18247437477111816, -0.1811259537935257, -0.1794898808002472], [-0.10219975560903549, -0.10209161043167114, -0.10202223062515259, -0.10190488398075104], [-0.0007158089429140091, -0.000695355236530304, -0.0006106826476752758, -0.0006102873012423515], [0.09830492734909058, 0.09832130372524261, 0.09845811128616333, 0.09849923849105835], [0.19384534657001495, 0.19385403394699097, 0.19385619461536407, 0.19387392699718475], [0.29407957196235657, 0.2977195680141449, 0.2997993230819702, 0.3001610040664673]]",55.72121810913086,21.609804153442383,"[75.09007263183594, 43.793827056884766, 30.878000259399414, 28.619403839111328, 19.21445083618164, 15.295272827148438]"
