target_idx,target_sent,sents_intrp_all_bins,sim_intrp_all_bins,base_PPL,unintrp_PPL,intrp_PPL_all_bins
43,"After I get Carla settled, you’re mine, Lady.","[['Modern Zen presentation to the West insists on the anti-authoritarian , highly pragmatic nature of the Zen belief -- scriptures are burned to make fire , action is based on direct self-confidence , and so on .'], ['These contemporary structures , beautifully adapted to a school in the country , are home to 60 children , ages eight to fourteen , grades four through eight .'], ['One of the more remarkable of the new cooling systems is one that can be switched to heating .'], [""`` We'll stampede the rest .""], [""`` If you are trying to get us out of the brothel , the dustbin , the kitchen sink , and the tawdry living-room , you are probably wasting your time '' , Moreland told me .""], [""`` That's swell '' , I said sweetly .""]]","[[-0.23502963781356812], [-0.1034558117389679], [-0.0013919072225689888], [0.09835666418075562], [0.19294503331184387], [0.2692803144454956]]",197.40008544921875,139.0232696533203,"[171.1962127685547, 152.31748962402344, 141.17762756347656, 97.7203140258789, 86.95793914794922, 106.7801513671875]"
241,Another man had joined him because she heard two voices.,"[['The revolution now under way in materials handling makes this much easier .'], ['It changes the answers on when to do what at the site .'], ['The central city areas , in other words , exhibit the two characteristics which violate the life principle of congregations of the major denominations : they have too few middle-class people ; ;'], [""I was sure that was the difficulty -- she just didn't want to stay here , where she couldn't get to the liquor .""], ['There is much to be said for such a college -- and Dartmouth men have been accused of saying it too often and too loudly .'], ['they listened and suddenly a step towards the door announced another important fact .']]","[[-0.24386167526245117], [-0.10518942773342133], [-0.0010788198560476303], [0.09823940694332123], [0.19595597684383392], [0.31873267889022827]]",253.95498657226562,139.39833068847656,"[194.33680725097656, 160.7329559326172, 213.8905029296875, 158.49392700195312, 160.05685424804688, 134.3792724609375]"
402,"“Thank you, but it was a long night.","[['However , it is not enough to bring persons to Christian commitment and train them in the meaning of Christian discipleship .'], [""The process of social control is operative insofar as sanctions play a part in the individual's behavior , as well as the group's behavior .""], ['Hector Lopez , subbing for Berra , smashed a 3-run homer off Bill Henry during another 5-run explosion in the fourth .'], ['The family is largely broken up ; ;'], [""`` Y'all should have let me take that money out '' , Andrus said .""], [""After that day , Blanche still didn't know exactly what had happened .""]]","[[-0.2755754292011261], [-0.10516875982284546], [-0.0008283560164272785], [0.09862785041332245], [0.1948389708995819], [0.2890110909938812]]",67.77802276611328,62.58926773071289,"[65.23686981201172, 80.13126373291016, 70.23714447021484, 55.110843658447266, 54.812599182128906, 64.39138793945312]"
78,Arrogant Boor.,"[['and industrial uses for agricultural products .'], [""South Viet Nam's rice surplus for next year -- more than 300,000 tons -- may have been destroyed .""], [""After I would finish playing the songs , he'd just go away without a comment .""], [""`` You always live up to your name , always like this , always making happy '' ? ?""], ['One thing you can say about Mr. Lyford is that he does not suffer from any insecurity as an American .'], ['Ryan shook his head .']]","[[-0.21468761563301086], [-0.10573071986436844], [-0.0008150152862071991], [0.09780111163854599], [0.1846199929714203], [0.22122639417648315]]",528.862548828125,1910.2808837890625,"[1450.416259765625, 1991.10888671875, 728.5528564453125, 346.0239562988281, 759.6485595703125, 1470.9854736328125]"
261,“Are you sure?” Tess asked softly.,"[['This gives him the power to form in his mind new image combinations of old memories , ideas and experiences and to project them outside of himself into his environment in new and ever-changing forms .'], [""It is a full scale , small , but efficient house that can become a year 'round retreat complete in every detail .""], ['They had been through trying times , but their faith in the Almighty had given them the courage and the strength to meet and overcome the many problems and difficulties that were the price they had to pay for freedom .'], [""`` I've been here for some time '' .""], ['She had lost the extra torsos .'], ['She replied , `` I know of one man that has not been friendly with him .']]","[[-0.22148442268371582], [-0.10536458343267441], [-0.0010074041783809662], [0.09802370518445969], [0.19513902068138123], [0.30144253373146057]]",4884.83935546875,3550.307373046875,"[5231.49462890625, 4894.552734375, 4408.88671875, 3672.597412109375, 4350.69921875, 3795.409423828125]"
