target_idx,target_sent,sents_intrp_all_bins,sim_intrp_all_bins,base_PPL,unintrp_PPL,intrp_PPL_all_bins,local_PPL_all_bins
48,Other predictors of divorce are more contextual than personal.,"[['Abel Poupin , a tall man with sunken cheeks and deep-set eyes , got to his feet .'], ['But there he was at the train with an Oregon State pennant in his hand .'], ['If the coating becomes still thicker , a peeling type failure finally can occur .'], ['the other is how to finance the adjustments when necessary .'], ['Yet , paradoxically , according to Dr. Maurice Linden , many wives despise their husbands for not standing up to them .'], [""By saying `` another emotional death '' , she reveals that there has been a previous one , although she has not described it in words .""]]","[[-0.19092586636543274], [-0.10192010551691055], [-0.0006750486791133881], [0.09835591912269592], [0.19201597571372986], [0.2602062523365021]]",616.6373901367188,264.20367431640625,"[446.1280212402344, 376.8253479003906, 265.2951354980469, 257.1664733886719, 289.2589111328125, 336.212158203125]","[945.8717651367188, 951.1871337890625, 615.1959228515625, 615.043701171875, 440.1059875488281, 679.7089233398438]"
25,"By looking at how the Early Years of Marriage Project participants rated their marital happiness over time, she and her colleagues found couples tended to fit into two groups: those whose happiness started high and stayed that way, and those whose contentment started medium or low and got worse (Research in Human Development, 2012).","[[""Negro radio is vitally necessary during the process of assimilation '' .""], ['Mercer never noticed the needle touch his arm .'], ['She looked out at the corn field , the great green deep acres of it rolled out like the sea in the field beyond the whitewashed fence bordering the grounds .'], ['Gradually others will move up to the same level'], [""He spoke through the public address box built into the cabin , and his gigantic voice roared out over the empty plain , so that the pink herd of talking people stirred gently in their happiness and wondered what their friend B'dikkat might be wanting to tell them .""], ['The children looked at each other and sagged their bottoms down even more comfortably than ever .']]","[[-0.1891603171825409], [-0.10193502902984619], [-0.0005445722490549088], [0.09903133660554886], [0.1937563270330429], [0.28637877106666565]]",190.9461212158203,145.00213623046875,"[157.85177612304688, 158.8517303466797, 160.3437042236328, 167.72366333007812, 165.26443481445312, 155.94662475585938]","[195.1097869873047, 206.91989135742188, 197.8619384765625, 198.1293182373047, 205.3927459716797, 182.1640167236328]"
75,"In the Early Years of Marriage Project, Orbuch found that three-fourths of the happy couples reported that their spouses made them feel cared for or special often, while less than half of the unhappy couples reported the same.","[['The attendant waved me on .'], ['So the results are subject to considerable confusion .'], [""The film consists of a series of still , transparent photographs , or `` frames '' , 35-mm.-wide .""], ['It is evident that Lizzie did not tell everything she overheard between her father and her Uncle Morse .'], ['Retired pay costs are increased by $94 million in 1961 over 1960 , partly because of a substantial increase in the number of retired personnel .'], ['Because neither of them really wanted their marriage to break up , Mr. and Mrs. Black agreed to a series of interviews at Family Service of Northern Virginia , the agency nearest them .']]","[[-0.17439943552017212], [-0.10425238311290741], [-0.0005211643874645233], [0.0989263728260994], [0.1968705952167511], [0.33262723684310913]]",145.22715759277344,127.42730712890625,"[134.8111572265625, 121.98544311523438, 133.1478271484375, 121.34119415283203, 128.1677703857422, 119.37905883789062]","[157.06312561035156, 137.77685546875, 161.94479370117188, 137.63534545898438, 149.51170349121094, 129.97108459472656]"
68,"More recently, UCLA's Lavner led another study reevaluating how a couple's fighting style affected their marriages.","[['Provision for emergency toilet facilities and disposal of human wastes will be an unfamiliar problem .'], ['Traces of oil on green tissue ? ?'], ['yet her inflection seemed forced or rehearsed .'], ['Some of them ignored the texts and had apparently memorized the words long ago .'], ['On the other side of the ledger is the fact that he did see his niece and the woman with whom she was staying .'], ['Sometimes a burst of aggressiveness will sweep over a man -- or his wife -- because he or she feels age creeping up .']]","[[-0.1688767671585083], [-0.10416338592767715], [-0.0007430166006088257], [0.09940938651561737], [0.1951795071363449], [0.2791181206703186]]",148.7038116455078,98.41229248046875,"[112.94904327392578, 111.44258880615234, 102.49960327148438, 93.58015441894531, 88.20648193359375, 103.14601135253906]","[177.77931213378906, 158.64810180664062, 141.2682647705078, 138.30673217773438, 128.26535034179688, 123.51261901855469]"
55,Talk about more than the dishes.,"[['But the warm joy of her brown eyes was open to the general public .'], ['Dr. Hilprecht was uncertain as to the language used by the ancient priest in his dream .'], [""`` Ladies and gentlemen , in place of my regular closing number tonight , I'd like to sing something of a different nature for you .""], ['Such needs may rise to pathological proportions .'], [""Ernie was screaming inside himself : No , damn you , you ain't gonna take my meal ticket away from me ! !""], [""Said you wore yourself out , cleaning all these empty rooms '' .""]]","[[-0.1832197904586792], [-0.10204146802425385], [-0.000550808385014534], [0.09875266999006271], [0.1927248239517212], [0.2580692172050476]]",442.59796142578125,1402.3970947265625,"[940.5166015625, 999.6787109375, 343.65631103515625, 1845.4698486328125, 218.07342529296875, 459.6172180175781]","[337.28173828125, 519.3768310546875, 260.39508056640625, 743.0023193359375, 172.26870727539062, 264.3205871582031]"
