target_idx,target_sent,sents_intrp_all_bins,sim_intrp_all_bins,base_PPL,unintrp_PPL,intrp_PPL_all_bins,local_PPL_all_bins
344,"At that moment another loud bang was heard and, listening to the angry voice outside of her door, Tess knew that the movers were in trouble.","[['Nothing less would serve .'], ['For top and bottom pieces , use short end of mold as measurement guide .'], ['Yet Alfredo wanted money wanted money to roam through the deserts .'], ['This habit had become so fixed over the years that it seemed futile to do anything for which no one was waiting .'], [""The sound mockery of sheep is like the salubrious horse laugh '' .""], ['She retreated before the naked shame in the old man and the fury beyond it and sank into the darkness of her lodge where Walitzee stirred , mumbling , sitting up in a half stupor to say :']]","[[-0.18443571031093597], [-0.10466087609529495], [-0.0009177490137517452], [0.09888650476932526], [0.1981966495513916], [0.34662187099456787]]",107.03314971923828,65.40094757080078,"[66.1978759765625, 67.4483642578125, 67.08575439453125, 68.00733184814453, 65.93995666503906, 64.8777847290039]","[105.99507141113281, 113.07093811035156, 100.33100128173828, 96.43182373046875, 98.31867218017578, 79.36991119384766]"
182,"LORD, help those poor women who are married to them.","[[""In our present era of Science and Angst , the heart has been downgraded , to use one of our popular retrogressive verbs '' .""], ['But consideration of the frequency of stems per constant meaning seems to be established as having significance in comparative situations with diachronic and classificatory relevance ; ;'], [""`` Uh-huh '' , Ryan admitted .""], [""After I would finish playing the songs , he'd just go away without a comment .""], [""`` Well -- women and unhappiness go together '' , I observed profoundly , adding , `` You can wager your derriere on that '' .""], ['The bride was given in marriage by her father .']]","[[-0.19085708260536194], [-0.10301730036735535], [-0.0006894934922456741], [0.09900736808776855], [0.19487538933753967], [0.31031131744384766]]",199.0150146484375,158.02198791503906,"[141.9401092529297, 140.2605743408203, 146.49151611328125, 162.5987091064453, 110.76985168457031, 168.2177734375]","[165.75096130371094, 201.78038024902344, 196.67539978027344, 148.18016052246094, 91.37702941894531, 242.66873168945312]"
80,"Following her into the room to apologize, Tess stopped, lightly shocked.","[[""It's simple enough from my point of view .""], [""Today , seven years after the date of my initial induction as a draftee , I am Assistant Professor of Philosophy and Science at St. Michael's College .""], ['Turning to the Word of God , we find the only sure way to do that .'], [""Adams was not breaking new ground when he claimed that the worship of an unseen power was in reality a reflection of man's inability to cope with his environment .""], [""Gavin's lips moved so that Clayton had to stoop to catch the words .""], ['As his feet slowed , he felt ashamed of the panic and resolved to make a stand .']]","[[-0.17935647070407867], [-0.10297918319702148], [-0.0008492888882756233], [0.09880486875772476], [0.1972033977508545], [0.3135039210319519]]",333.7890625,130.72413635253906,"[130.97821044921875, 230.19937133789062, 123.81753540039062, 172.9032745361328, 125.69705200195312, 127.32697296142578]","[310.04449462890625, 562.7769775390625, 306.1802673339844, 295.0437927246094, 231.43304443359375, 258.254638671875]"
22,"“Well, here is something for the baby.","[['We are not given to lamentations , neither personally nor in these Reports .'], ['for example , the organization of steamship conferences to set freight rates and the encouragement of railroads to seek mergers .'], ['She had picked up the quirt and was twirling it around her wrist and smiling at him .'], ['In either case , it could call a special session of the Legislature later in 1961 to make another stab at raising additional revenues through a tax raiser .'], ['`` Okay , take the tray .'], ['Her woolly-minded parent agreed .']]","[[-0.20204055309295654], [-0.10293646156787872], [-0.0005805352702736855], [0.0979987159371376], [0.19182851910591125], [0.29021579027175903]]",178.92323303222656,60.9375114440918,"[76.13943481445312, 85.18254089355469, 69.62256622314453, 86.45613098144531, 60.442222595214844, 57.68022918701172]","[132.08135986328125, 148.64015197753906, 105.38943481445312, 160.57537841796875, 104.60818481445312, 98.66427612304688]"
236,"“So, when did you meet him?”","[['The order to abandon ship was given , but cries of pain could be heard from the wounded below decks .'], ['The value of place-names in the reconstruction of early English history had long been recognized .'], ['A vision handicap that may produce nervous tension and reading disability for one child may spur another child on to even greater achievement in reading .'], ['those who could talk declared it to be the breathing of Captain Alvarez .'], [""`` Oh , that is demonstrable '' , I told him .""], [""I am with you , of course , Tomas '' .""]]","[[-0.1829216480255127], [-0.10219975560903549], [-0.0007158089429140091], [0.09830492734909058], [0.19384534657001495], [0.29407957196235657]]",211.136474609375,90.1335220336914,"[117.82329559326172, 138.22425842285156, 144.33602905273438, 119.65916442871094, 93.96841430664062, 98.25984954833984]","[204.57403564453125, 219.2502899169922, 255.37197875976562, 199.81411743164062, 190.69444274902344, 186.8666534423828]"
