target_idx,target_sent,sents_intrp_all_bins,sim_intrp_all_bins,base_PPL,unintrp_PPL,intrp_PPL_all_bins,local_PPL_all_bins
48,"In addition, a person whose first child is born after the wedding is more likely to stay married than one who enters a marriage already a parent.","[['Petitioner was not entitled , either in the administrative hearing at the Department of Justice or at his trial , to inspect the original report of the Federal Bureau of Investigation , since he was furnished a resume of it , did not challenge its accuracy , and showed no particular need for the original report .'], ['His smile was quick , and his eyes held some promised secret that made my knees go limp .'], [""`` I am satisfied that in the Selden case had this power existed and this course ( been ) pursued , it would have shortened the depositions of some of the experts nearly one-half and of some of the other witnesses thereto more than that '' .""], ['Well , ordinarily he is , except ( as the Wheel of the Law specifies ) toward impious folk who steal , disturb , or maltreat the Presence .'], ['This does not mean , though , that a red wine improves with prolonged aeration : there is a reasonable limit -- and wines kept over to the next meal or the next day , after they have once been opened , are never as good .'], ['that aside from due notification of certain major events in their lives ( two marriages , two births , one divorce ) , Christmas and Easter cards of the traditional sort had been the only thin link she had with them through the widowed years .']]","[[-0.14426949620246887], [-0.10011731088161469], [-6.041489541530609e-05], [0.09994595497846603], [0.19994664192199707], [0.47287851572036743]]",74.51516723632812,32.0823974609375,"[40.217430114746094, 42.100276947021484, 34.563995361328125, 32.184776306152344, 34.39018630981445, 33.61334228515625]","[98.0938949584961, 89.22981262207031, 77.96766662597656, 50.268798828125, 54.59785079956055, 53.33268356323242]"
51,"The researchers found that couples whose relationship satisfaction declined during the first four years of marriage were most often those who had reported less satisfaction to begin with (, 2012).","[['May I add a caution on this particular point ? ?'], ['A rowdy with a big blob of a nose roared .'], [""`` Aw , shut up '' , he said .""], ['He who had tried so hard , who had yearned so passionately to be a great officer .'], ['core - marginal marriages still belong in the category of permissive unions ; ;'], ['The two in the bed knew each other as old people know the partners with whom they have shared the same bed for many years , and they needed to say no more .']]","[[-0.16835886240005493], [-0.10002969950437546], [-3.167986869812012e-05], [0.09993163496255875], [0.19965499639511108], [0.37765753269195557]]",148.52883911132812,74.47019958496094,"[85.16942596435547, 79.4491195678711, 80.12178039550781, 81.06352996826172, 97.25721740722656, 76.27740478515625]","[161.1436767578125, 163.08502197265625, 162.0367889404297, 177.22415161132812, 129.42739868164062, 151.5465850830078]"
46,"By looking at how the Early Years of Marriage Project participants rated their marital happiness over time, she and her colleagues found couples tended to fit into two groups: those whose happiness started high and stayed that way, and those whose contentment started medium or low and got worse (Research in Human Development, 2012).","[[""And His glory is flooding my soul '' .""], [""`` If I catch you one more time down here without stockings '' --""], [""Carroll diagnosed Mrs. Hull by taking a drop of blood from her ear and putting it on his `` radionic '' machine and twirling some knobs ( fee $50 ) .""], ['-- Surrounding pioneer pastors with vocational volunteers ( laymen , who will be urged to move into the area of new churches in the interest of lending their support to the new project ) .'], ['It would hardly be an exaggeration to say that ninety per cent of the energy of most churches -- whether in terms of finance or spiritual concern -- is poured into the private and domestic interests of the members .'], ['In repetitions of the experiment from couple to couple , the votes of the two persons in a couple probably agree more often than independence would imply , because couples who visit the museum together are more likely to have similar tastes than are a random pair of people drawn from the entire population of visitors .']]","[[-0.16862273216247559], [-0.10007087141275406], [-1.173466444015503e-05], [0.09999451041221619], [0.19937631487846375], [0.39561423659324646]]",190.9461212158203,145.00213623046875,"[146.75083923339844, 168.33082580566406, 154.33409118652344, 144.42926025390625, 152.06719970703125, 143.48477172851562]","[193.13134765625, 207.8058319091797, 195.66580200195312, 181.54054260253906, 196.86962890625, 166.7876739501953]"
60,"""You don't have to buy that $10,000 trip"" to keep your partner satisfied, says Orbuch.","[['Realtors live in their communities as specialists in a given area of work , as members of social and professional organizations , as citizens and civic leaders , as church laymen , as university alumni , as newspaper readers , etc. .'], ['The acceptance of collective bargaining as a national policy in 1934 , implicit in the writing of Section 7A of the National Industrial Recovery Act , has made it impolitic to oppose collective bargaining in principle .'], ['As we have seen , Methodism early took a stand against slavery .'], [""But to operate in American politics one must go a step further -- one must build a bridge to such names , establish a warmth , a personal connection '' .""], [""While it is easy enough to ridicule Hawkins' pronouncement in Pleas Of The Crown from a metaphysical point of view , the concept of the `` oneness '' of a married couple may reflect an abiding belief that the communion between husband and wife is such that their actions are not always to be regarded by the criminal law as if there were no marriage .""], [""If he snatches a toy , she says , `` Caroline wants her own truck just as you do '' .""]]","[[-0.15092253684997559], [-0.10036702454090118], [-3.832206130027771e-05], [0.09997938573360443], [0.19940732419490814], [0.34664207696914673]]",996.6668090820312,1506.125244140625,"[1201.1427001953125, 1516.20751953125, 989.3003540039062, 1038.009521484375, 1398.5426025390625, 849.1573486328125]","[1110.2510986328125, 1440.8436279296875, 1073.176513671875, 965.3658447265625, 1500.727783203125, 712.776611328125]"
18,The same effect didn't hold true for women.,"[['A few of the more prominent must serve as examples of what a complete listing and description would disclose .'], [""Rhythmic interest , melodic beauty and the expansiveness of the writing are all qualities which hold one's attention with the Gilels playing .""], [""For instance , so-called `` conservative '' organizations , some of them secret , are sprouting in the garden of joining where `` liberal '' organizations once took root .""], ['Their clapping grew more fervent ; ;'], ['But he was too busy to hear what she was saying .'], ['it was only too true .']]","[[-0.1616523712873459], [-0.10013355314731598], [-2.8815120458602905e-06], [0.09996244311332703], [0.19935408234596252], [0.4199028015136719]]",649.927001953125,491.55584716796875,"[594.0170288085938, 446.70318603515625, 535.7315673828125, 444.4639892578125, 531.463134765625, 452.6280822753906]","[773.4656372070312, 697.6460571289062, 779.3529052734375, 583.1305541992188, 807.3964233398438, 714.3656005859375]"
