target_idx,target_sent,sents_intrp_all_bins,sim_intrp_all_bins,base_PPL,unintrp_PPL,intrp_PPL_all_bins
415,"“I don’t know, Man.","[['Jones followed him into the front room , closing the door behind him .'], ['A few of the more prominent must serve as examples of what a complete listing and description would disclose .'], ['These deductions may not be claimed if you elect to use the Standard Deduction or Tax Table .'], ['From the standpoint of the army of duffers , however , this was easily the most heartening exhibition they had had since Ben Hogan fell upon evil ways during his heyday and scored an 11 in the Texas open .'], [""`` I'm sorry '' , she said .""], [""Oh , dear , I'm all unstrung '' .""]]","[[-0.16807520389556885], [-0.10446934401988983], [-0.0005906575825065374], [0.09885305911302567], [0.19092993438243866], [0.30565327405929565]]",48.83019256591797,43.413814544677734,"[40.96983337402344, 48.01617431640625, 45.53043746948242, 47.82301330566406, 29.122657775878906, 30.461383819580078]"
197,"Thinking about the man who had rung her doorbell, she silently blamed him.","[['And although these insights into the nature of art may be in themselves insufficient for a thoroughgoing philosophy of art , their peculiar authenticity in this day and age requires that they be taken seriously and gives promise that from their very substance , new and valid chapters in the philosophy of art may be written .'], ['That helped a lot .'], [""The U. S. Government pays for all its overseas workers '' .""], ['But the warm joy of her brown eyes was open to the general public .'], [""And despite Knowlton's attempts to show that the house was locked up tighter than a drum , this was not true .""], ['He nodded at the door in front of him .']]","[[-0.19935443997383118], [-0.10462172329425812], [-0.0009643035009503365], [0.09861790388822556], [0.197454035282135], [0.34063759446144104]]",150.41586303710938,85.19184875488281,"[115.26116180419922, 82.70320892333984, 107.95340728759766, 84.05784606933594, 81.688720703125, 76.2905044555664]"
86,Jordan and I had our encounter this morning.”,"[['His hubris , deficiency of taste , and sadism carried him straightaway to the top .'], ['By preying on the sick , by playing callously on the hopes of the desperate , by causing the sufferer to delay proper medical care , these medical ghouls create pain and misery by their very activity .'], ['The measure was instantly taken , as always in such cases , of public men at many levels .'], ['Samples : He walked in upon her invitation .'], [""Georgia's Dick Russell objected politely , and the battle was joined .""], ['`` This whole Washington venture was my last gesture , and it has failed .']]","[[-0.20411086082458496], [-0.10199075937271118], [-0.0011018025688827038], [0.09862002730369568], [0.19234314560890198], [0.24237018823623657]]",778.055908203125,265.2841491699219,"[427.3009033203125, 544.6589965820312, 363.08367919921875, 301.1568298339844, 548.7978515625, 372.8328552246094]"
97,"“It is true that he’s asked me to marry him, but I didn’t know David Donatelli was Myra’s friend or our boss.”","[['A bevy of interlacing lagers , work camps , concentration camps erupted in the area .'], ['These local variations were to become ever sharper in the next century and a half .'], ['It has been endlessly rephrased , but I may here put it thus : at what point do the tolerant find themselves obliged to become intolerant ? ?'], ['Billy Tilghman did just that .'], ['Enthusiastically , Americans have swept subliterary and bogus materials like Paul Bunyan tales , Abe Lincoln anecdotes and labor union songs up as true products of our American oral tradition .'], [""It was pleasant last night , therefore , to hear him do something else : a concerto he has recently recorded , `` The Emperor '' .""]]","[[-0.18201465904712677], [-0.105094313621521], [-0.0007806476205587387], [0.09889177978038788], [0.1954946368932724], [0.2912803888320923]]",40.522159576416016,35.009368896484375,"[39.72370910644531, 39.07618713378906, 37.555763244628906, 35.985755920410156, 36.81731414794922, 36.40180206298828]"
343,"“We can make it on Thursday, if you want?” she replied shyly.","[[""How literature does this , or for whom , is certainly not clear , but the content , form , and language of the `` message '' , as well as the source , would all play differentiated parts in giving and molding a sense of purpose .""], ['One of the roughest was the TV quiz shows , which gave him inferiority complexes .'], [""But he is a West Point graduate and therefore must be born to command '' .""], ['Rachel had to bend toward Scotty and ask him to repeat .'], ['He will attend a meeting of the Republican State Central Committee Saturday in Portland and see the Washington-Oregon football game .'], ['( On Thursday nobody except Charlie Coe was thinking of Charlie Coe .']]","[[-0.20807737112045288], [-0.101435586810112], [-0.0007124524563550949], [0.09783846884965897], [0.18647390604019165], [0.24998939037322998]]",302.3082580566406,227.49327087402344,"[268.9491882324219, 293.4041442871094, 294.7016906738281, 265.7921447753906, 270.09466552734375, 174.9689483642578]"
