target_idx,target_sent,sents_intrp_all_bins,sim_intrp_all_bins,base_PPL,unintrp_PPL,intrp_PPL_all_bins
25,Tess was getting up to put on a change of clothes when her doorbell rang.,"[['The Communist countries allocated more than $1,000,000,000 in economic aid alone last year , according to Western estimates .'], ['Glance at the list : Burckhardt , Tolstoy , Proudhon , Thoreau , London , Marx , Tawney , Mayo , Durkheim , Tannenbaum , Mumford , A. R. Heron , Huxley , Schweitzer , and Einstein .'], ['But in the moment of truth everyone could see that the U.S. was in reality the principal .'], [""Just glad the rain's stopped '' .""], ['He was passing through town and phoned to say hello .'], ['the halls were empty and they passed down the stairs to number nine and listened at the door .']]","[[-0.17052209377288818], [-0.10234154760837555], [-0.0005816752091050148], [0.09923341870307922], [0.19864504039287567], [0.32151612639427185]]",114.2934799194336,81.84748840332031,"[91.91866302490234, 98.13440704345703, 81.6805419921875, 78.32157897949219, 77.15071105957031, 78.0603256225586]"
190,"“Well, someone is at home.","[['We look forward to a stronger position in this expanding field .'], ['Her lips , moist and parted , spoke his name .'], ['Begging my pardon , he must express his astonishment over seeing a person of my background applying at the hall .'], ['She had made curtains for all the windows of her little house , and she had kept it spotless and neat , shabby as it was , and cooked good meals for Bobby Joe .'], [""In the case of academic personnel the `` feeling '' of participation can hardly be `` faked '' .""], ['He is in your hands -- now .']]","[[-0.194238543510437], [-0.10126783698797226], [-0.00041205063462257385], [0.09862712770700455], [0.19480067491531372], [0.3375197947025299]]",137.98487854003906,114.53418731689453,"[114.88282775878906, 136.1187286376953, 137.0542449951172, 146.49075317382812, 123.76483154296875, 100.92339324951172]"
334,"“Tess Jordan,” she replied.","[['For 25-cents load up the cooler with ice and keep cool pop in the car .'], [""From this belief is derived the practical orientation of our policy on the `` uncommitted '' ( `` neutralist '' , `` contested '' ) nations , especially on those whose leaders make the most noise -- Nehru , Tito , Nkrumah , Sukarno , Betancourt , etc. .""], ['It is , he said , a bifocal vision , which can see both the near-at-hand and the distant and keep a Christian in right relation to both .'], ['But the warm joy of her brown eyes was open to the general public .'], [""`` It's people of your own kind '' , a girl remarked .""], [""`` Thank you '' , I told her .""]]","[[-0.16041108965873718], [-0.10153285413980484], [-0.0006773173809051514], [0.09903309494256973], [0.19595175981521606], [0.3122215270996094]]",38.45671463012695,20.72262191772461,"[32.816871643066406, 33.92734909057617, 36.07182693481445, 32.09574890136719, 26.24979019165039, 24.97428321838379]"
37,"“Well, what do you want?","[['Here again we run into the roadblock that Negroes do not like to be designated as Negroes in the press .'], ['He feels , suddenly , the weight of the fat that is on him .'], [""If one of Mr. Rodgers' melodies seemed to deserve a better fate than interment in Boston or the obscurity of a Broadway failure , Mr. Hart was likely to deck it out with new lyrics to give it a second chance in another show .""], [""`` I haven't had any luck since I was a baby '' .""], ['But they wish they could bring it back .'], ['You see what I mean ? ?']]","[[-0.1577799916267395], [-0.10105501115322113], [-0.0002682618796825409], [0.09853115677833557], [0.19003096222877502], [0.3531886637210846]]",50.97917556762695,41.77768325805664,"[47.78104019165039, 42.02348327636719, 56.39239501953125, 56.27863311767578, 50.65411376953125, 38.241485595703125]"
318,“Stop harassing Tess.,"[['He carried the wood , carried the water , did the cooking , cleaning and mending , and occasionally got a kick in the butt for his pains .'], [""As I was playing Mother Cabrini , the picture was actually `` all mine '' , with nearly every scene built around me .""], [""Howard E. Simpson , the railroad's president , said , `` A drastic decline in freight loading due principally to the severe slump in the movement of heavy goods has necessitated this regrettable action '' .""], ['He and Mary would no longer have to tear and rend at each other ; ;'], ['Penny would not rise to his mood .'], [""I don't blame that girl for breaking her engagement with you .""]]","[[-0.18116962909698486], [-0.10106753557920456], [-0.0007012588903307915], [0.09915494918823242], [0.1946062445640564], [0.25759264826774597]]",865.6430053710938,1000.9528198242188,"[1467.322998046875, 1232.7332763671875, 1187.6834716796875, 721.160400390625, 1322.0706787109375, 1176.9510498046875]"
