target_idx,target_sent,sents_intrp_all_bins,sim_intrp_all_bins,base_PPL,unintrp_PPL,intrp_PPL_all_bins
7,"For decades, psychologists have been trying to answer the key question: What's going on when two people who once said ""I do"" to a lifetime together decide they're better off apart?","[['He was laughed off the screen .'], ['His heart , he discovered , was pounding .'], [""And the key to the suite is still missing '' .""], ['National defense considerations have been the major reason behind most Federal training expenditures in recent decades .'], ['Their experience is quite in contrast with that of children of upper- and upper-middle-class native-born parents , who are more likely to regard education as good for its own sake and to discount the vocational emphases in the curriculum .'], [""`` You are bound to get involved with people when you have children '' , Fran had told me at our first meeting , `` so it is good to know that those with whom you get involved are not just dreary little housewives and dull husbands , but People Who Do Things '' .""]]","[[-0.16311559081077576], [-0.10177808254957199], [-0.0003922656178474426], [0.09940291941165924], [0.19673003256320953], [0.31437796354293823]]",361.7338562011719,362.4324035644531,"[344.8995361328125, 348.37469482421875, 350.23919677734375, 380.4957275390625, 358.020751953125, 269.61907958984375]"
11,"""Today, we have a pretty good idea of what's likely to make for a good marriage,"" says Stony Brook University researcher Arthur Aron, PhD.","[[""and concentrate its constructive efforts on eliminating in other parts of Latin America the social conditions on which totalitarian nationalism feeds '' .""], ['Climbing the steps steadily , they reached the top and headed for the door .'], ['Are tractors available for him ? ?'], ['The moment simultaneously revealed that in the crisis our policy ran counter to that of all our NATO allies , to the entire Western community .'], ['He had picked out this pathless trail , instead of the common one , in a moment of romantic fancy , to give them privacy on their honeymoon .'], ['-- The New York University Board of Trustees has elected the youngest president in the 130-year history of NYU , it was announced yesterday .']]","[[-0.16650539636611938], [-0.10273537039756775], [-0.0005292147397994995], [0.09902629256248474], [0.19691459834575653], [0.2873550057411194]]",133.647216796875,126.07865142822266,"[130.17874145507812, 135.65931701660156, 129.89109802246094, 128.86460876464844, 122.79600524902344, 116.37683868408203]"
28,"But, say psychologists, there are many behaviors, such as how a couple talks and fights and even the type of dates they go on, that can be learned and practiced — and can give a pair a fighting chance at 'til death do they part.","[['Mr. Paray resisted the temptation to over-emphasize the melodic elements of the score .'], ['The voice issued from the cavern of the hall below .'], ['At the opening of the Dusseldorf show , Thompson himself scarcely glanced at the treasures that he was seeing together for the last time .'], ['Proponents of single elements tend to ensure predominance of that element without determining if it is justified , and the element with the most enthusiastic and vociferous proponents has assumed the greatest importance .'], [""`` You see , first of all and in a sense as the source of all other ills , the unshakeable American commitment to the principle of unconditional surrender : The tendency to view any war in which we might be involved not as a means of achieving limited objectives in the way of changes in a given status quo , but as a struggle to the death between total virtue and total evil , with the result that the war had absolutely to be fought to the complete destruction of the enemy's power , no matter what disadvantages or complications this might involve for the more distant future '' .""], ['But his is still a simple life relatively free of the female presence or influence , and he must go far , even though he may go fast , for sophisticated pleasures .']]","[[-0.1661081165075302], [-0.1021447703242302], [-0.0003505488857626915], [0.09935915470123291], [0.19708402454853058], [0.2973479926586151]]",298.1954345703125,270.7572021484375,"[276.68560791015625, 279.9677734375, 276.9667663574219, 273.27520751953125, 271.3821716308594, 249.82330322265625]"
38,"Every day for 14 days, each participant responded to prompts about stressful circumstances (such as getting stuck in traffic), the energy expended to handle those stressors, their positive and negative interactions with partners, and their levels of satisfaction with their relationships.","[['Production must be adjusted accordingly , at minimum cost and quickly .'], ['`` I reached into that funny little pocket that is high up on my dress .'], [""Then will you give me a visa to re-enter France '' ? ?""], [""`` Every month , f'r three days '' , he said happily , `` I take no water into my system , no water whatsoever .""], ['The new year might see some house-cleaning , either genuine or token , depending upon developments , to give Davis an opportunity to combat some of these criticisms .'], [""A weekly newspaper reported a local romance : `` and the couple were married last Saturday , thus ending a friendship which began in their schooldays '' .""]]","[[-0.1837298572063446], [-0.1014527678489685], [-0.0004339069128036499], [0.09900964051485062], [0.19484657049179077], [0.2926006019115448]]",265.82598876953125,244.97877502441406,"[237.52627563476562, 259.1677551269531, 264.3819885253906, 247.42391967773438, 242.58323669433594, 265.2218017578125]"
9,"His team's study found that military personnel are much more likely than civilians to be married and not as likely to be divorced compared with civilians of similar ages, races, employment statuses and education levels (, 2012).","[[""`` Do you need that big bundle '' ? ?""], ['Hub picked up the telephone .'], ['Suspecting an ambush , the two deputies decided to ride up a side canyon taking a short cut into Catskill .'], [""This officer had asked Lizzie if she suspected her Uncle Morse , and she replied she didn't think he did it because he left the house before the murders and returned after them .""], ['As the new clouds of radioactive fallout spread silently and invisibly around the earth , the Soviet Union stands guilty of a monstrous crime against the human race .'], ['Their experience is quite in contrast with that of children of upper- and upper-middle-class native-born parents , who are more likely to regard education as good for its own sake and to discount the vocational emphases in the curriculum .']]","[[-0.16433000564575195], [-0.10164877027273178], [-0.00038488395512104034], [0.09919165074825287], [0.19505369663238525], [0.2683313488960266]]",245.70352172851562,229.68492126464844,"[257.1954040527344, 231.092529296875, 245.73597717285156, 247.65988159179688, 235.26239013671875, 217.43414306640625]"
