target_idx,target_sent,sents_intrp_all_bins,sim_intrp_all_bins,base_PPL,unintrp_PPL,intrp_PPL_all_bins
175,I hope she is much nicer than he is.,"[['Even in the very area where the shooting had been done , cattle were still disappearing .'], [""Reinforcements came up quickly to take advantage of the opening made by Goulding's platoon .""], ['The English never again developed a strong native music that could obliterate the traces of an earlier great age the way , say , the opera in Italy blotted out the Italian madrigal .'], ['As artists we feel the same obligation , as do other individuals , in considering ourselves responsible citizens of a great nation .'], ['Never forget that a chain is only as strong as its weakest link .'], [""`` I knew it all along '' , confessed Arnold with a grin , `` but I just happened to think how much nicer it would be to drop one way up there '' .""]]","[[-0.17993754148483276], [-0.10327450931072235], [-0.00074949418194592], [0.09887690842151642], [0.19767838716506958], [0.3401171565055847]]",53.64048385620117,43.058448791503906,"[52.31180191040039, 63.41289520263672, 47.39620590209961, 34.05498123168945, 29.972991943359375, 27.2341251373291]"
244,"Arriving at the office, Tess found Luigi highly upset.","[['it is not working now .'], ['He thought that if once , only once , he could talk with Simms Purdew , something about his own life , and all life , would be clear and simple .'], ['And watch for a headline from this pair any time now .'], ['Because the bobbin-to-cone winding process is a relatively high-cost operation for the mill , the almost complete automation provided by the Uniconer can mean important economies in textile production , at the same time upgrading quality .'], [""`` Thank you '' , the German had said courteously .""], ['At first Barco was evasive and shifty .']]","[[-0.18873566389083862], [-0.10169032216072083], [-0.0006593316793441772], [0.09853032231330872], [0.19435448944568634], [0.3132336735725403]]",155.10513305664062,105.14427947998047,"[116.62660217285156, 100.01278686523438, 115.16875457763672, 182.0788116455078, 115.08525085449219, 91.64342498779297]"
127,"“Hi, I’m Carla.","[[""We hope that he will execute it in a manner that will entitle him to credit '' .""], ['The General Assembly shall consider and approve the budget of the Organization .'], [""He served `` with '' him .""], ['for Mother to be able to call , Susan must be napping now , surrounded by her multitude of dolls .'], [""`` You ought to shake '' , Arlene advised them .""], [""`` I'm Billy Jones '' , the boy answered .""]]","[[-0.1751793920993805], [-0.10212773084640503], [-0.00048013217747211456], [0.09897851943969727], [0.18864917755126953], [0.2636270523071289]]",41.23873519897461,12.509833335876465,"[13.283390998840332, 17.23710823059082, 15.454788208007812, 14.488325119018555, 11.191267013549805, 9.262969017028809]"
75,“A meeting with an arrogant boor you say?” Ko asked edging her on.,"[['It accounts for so many things .'], [""People and books are enough for them '' .""], ['`` For instance , Djakarta , Indonesia , has three groups of dancers interested in coming here .'], ['`` As for my elders , they have already admitted that they were wrong .'], [""The sweat broke out on Mr. Skyros' forehead as he realized he had been actually thinking -- hoping -- planning -- perhaps --""], ['Locker-room talk often stresses the idea that a man is doing the girl a favor if he is forceful and ruthless during the first penetration .']]","[[-0.1663992702960968], [-0.10373872518539429], [-0.0007040426135063171], [0.09911765903234482], [0.19630101323127747], [0.2729138135910034]]",1009.222412109375,617.565185546875,"[825.6998901367188, 885.0300903320312, 827.1705322265625, 765.8475341796875, 786.172119140625, 772.3291015625]"
327,"“I don’t believe in having sex during engagements either,” Tess said.","[['That encourages rooting , and the better developed the roots , the larger and more plentiful the flowers .'], ['Moscow TASS in Russian datelined Sochi :'], [""Andy couldn't help but be touched .""], ['Arlene was boosting them up when the policeman came by .'], ['Winston had heard her shaking out the skirt of her new pink silk hostess gown .'], [""`` But she promised -- This will be different '' , he said at last .""]]","[[-0.16535684466362], [-0.10329371690750122], [-0.0007033273577690125], [0.09903501719236374], [0.19402170181274414], [0.2611822485923767]]",66.85076141357422,29.754619598388672,"[35.874916076660156, 32.92003631591797, 31.601675033569336, 34.15142822265625, 31.468446731567383, 32.27360153198242]"
