target_idx,target_sent,sents_intrp_all_bins,sim_intrp_all_bins,base_PPL,unintrp_PPL,intrp_PPL_all_bins,local_PPL_all_bins
128,"“And if she doesn’t?” Sam asked, knowing that his friend had just experienced one of those, first time I saw you, love at first sight, I am in love experiences.","[['Yet he remains the fiercest of competitors .'], ['There were gigantic blisters and rope burns on our hands ; ;'], ['a man in whose entourage none was ever safe ; ;'], [""A Birmingham newspaper printed in a column for children an article entitled `` The True Story of Guy Fawkes '' , which began :""], ['Perhaps he sensed some connection between the incident on the freighter and the ascetic at Ryusenji , he was unable to put it together .'], ['Joyce had seen him like this once before -- more than once , actually , but on one particularly memorable occasion .']]","[[-0.1748548448085785], [-0.10110796988010406], [-0.00036471523344516754], [0.09959501773118973], [0.1975409835577011], [0.32976940274238586]]",159.71163940429688,124.32247924804688,"[140.9263458251953, 138.85507202148438, 117.04560852050781, 134.8022003173828, 143.20623779296875, 136.4308319091797]","[175.23243713378906, 171.2451934814453, 142.5893096923828, 154.26589965820312, 168.9000701904297, 162.3832244873047]"
367,"He immediately began screaming at her, something he had never done.","[[""If you've got any ideas '' .""], ['The musical cleverness and spirit plus a strong sense of taste and measure save a wry little joke from becoming either bawdy or mawkish .'], [""it is manic as a man '' .""], ['She thought as warm , drizzling rain touched her face .'], ['Madden knew that he could be completely wrong about all this , but also knew that he would go right on disliking Garth .'], ['Others admitted he was absolutely correct -- he never slept .']]","[[-0.1770089864730835], [-0.10144426673650742], [-0.0004971586167812347], [0.09962356835603714], [0.1993960738182068], [0.3564665615558624]]",50.98023986816406,20.72662353515625,"[29.252426147460938, 29.97789192199707, 22.34176254272461, 20.926620483398438, 22.149375915527344, 20.454206466674805]","[52.50794219970703, 53.54969787597656, 43.412540435791016, 37.269500732421875, 36.44426727294922, 36.637142181396484]"
252,"“Well, I had a meeting with the obnoxious boor today that I missed.","[['and that which is born of the Spirit is spirit .'], ['Our weapons production , our world prestige , our ideas of democracy , our actions of trust or stubbornness or secrecy or espionage ? ?'], ['This system provides long- and short-term credit to farmers and their cooperative marketing , purchasing , and business service organizations .'], [""The road to a guaranteed-neutral , coup-proof Laos is today almost as difficult as warfare on that nation's terrain .""], [""I remember Ernest Bloch in the foyer , shouting in his high-pitched voice : `` it may be a tour de force , mais mon Dieu , can anyone take this music seriously '' ? ?""], [""`` There wasn't a bit of trouble '' .""]]","[[-0.15842360258102417], [-0.10233798623085022], [-0.0003616809844970703], [0.09929630905389786], [0.1987217664718628], [0.3481511175632477]]",151.2034454345703,65.1223373413086,"[76.2283935546875, 76.6153564453125, 84.74774169921875, 81.46466064453125, 73.34851837158203, 66.6677474975586]","[126.37797546386719, 122.47676849365234, 136.3605194091797, 132.13357543945312, 112.97716522216797, 101.50142669677734]"
91,"I don’t believe in divorces either, so when you marry me, it is forever.”","[['The endothelial cells lining the sinusoids were prominent , and many contained large quantities of hemosiderin .'], ['Even the officer in charge , be it a captain ( for small display ) or a general , is restrained by monitoring .'], ['Both were dressed rather formally .'], ['That , I smarted , is a royal rebuff if ever there was one .'], ['Sometimes I wondered vaguely what he did about women for my Aunt , by blood , had died some years ago , but neither of us said anything .'], [""I don't blame that girl for breaking her engagement with you .""]]","[[-0.15401282906532288], [-0.10105618834495544], [-0.00034019723534584045], [0.09946314990520477], [0.19432657957077026], [0.3091175854206085]]",112.24838256835938,52.70109939575195,"[68.0491714477539, 54.09537124633789, 57.627471923828125, 52.106388092041016, 48.691986083984375, 46.044639587402344]","[169.72589111328125, 117.45217895507812, 127.90677642822266, 84.00519561767578, 77.2891616821289, 66.09066772460938]"
330,"When Kohana walked into David’s office, Tess received the next shock.","[[""Adolescents have a much-discussed tendency to polarize ideas and values , to perceive things as `` either-or '' , black or white -- nuances of meaning are relatively unimportant .""], ['Maybe it would work the other way .'], [""My , you look chipper '' .""], ['They are putting strong pressure on their police departments to keep order .'], ['A shine in her eyes suddenly became tears and she turned back to her husband again .'], ['First , Arlene had put them through some rapid somersaults .']]","[[-0.1819431483745575], [-0.10069072246551514], [-0.00031656771898269653], [0.09936755895614624], [0.1973920613527298], [0.2947133183479309]]",43.154266357421875,29.84511947631836,"[33.98504638671875, 28.986553192138672, 33.85566711425781, 32.15113830566406, 28.63519859313965, 29.022857666015625]","[46.7695426940918, 40.17574691772461, 41.379425048828125, 42.5932731628418, 34.88786315917969, 37.54163360595703]"
