target_idx,target_sent,sents_intrp_all_bins,sim_intrp_all_bins,base_PPL,unintrp_PPL,intrp_PPL_all_bins
361,I didn’t mean to insinuate that you were having an affair with your boss.,"[[""But its relentless discursiveness and determined complexity are so overwhelming that after an hour and a half a listener's stamina begins to wilt .""], ['These factors practically insure that no single financing formula is feasible ; ;'], ['Some disappeared with the attainment of their purpose .'], [""Sonuvabitch , I can't figure out what in hell for they went and put niggers in my squad for .""], [""`` Evadna Mae Evans said she didn't put a thing on her child but a flannel wrapper until it was nine months old '' .""], [""You don't know me but I know you .""]]","[[-0.16969287395477295], [-0.1034824401140213], [-0.0004914505407214165], [0.09872668236494064], [0.19629356265068054], [0.30901429057121277]]",26.082841873168945,16.19573402404785,"[15.234694480895996, 14.561939239501953, 15.257092475891113, 15.136552810668945, 15.152328491210938, 15.021971702575684]"
277,Kohana was utterly charmed by the fact that Tess had just conquered his best friend’s heart.,"[['Have you examined these trends , forecast the effects , and planned your marketing strategy to compete effectively under changing circumstances ? ?'], ['Why , then , with these voluntary barricades and some state laws barring liquor ads , is it necessary to seek congressional action ? ?'], ['So , too , is the mathematical competence of a college graduate who has majored in mathematics .'], [""Mrs. Williams had a list which she said contained about nine or ten discrepancies between her memory of Dr. Jenkins's conversation and how they were written up for the board's approval .""], [""Those famous lines of the Greek Anthology with which a fading beauty dedicates her mirror at the shrine of a goddess reveal a wise attitude : `` Venus , take my votive glass , Since I am not what I was , What from this day I shall be , Venus , let me never see '' .""], [""`` The world that was once foot-loose and fancy-free '' , he said , `` has now become screw-loose and frenzy-free .""]]","[[-0.1719159334897995], [-0.10479731112718582], [-0.0009908555075526237], [0.09903855621814728], [0.19781912863254547], [0.32791680097579956]]",50.135501861572266,34.463375091552734,"[35.85985565185547, 35.199432373046875, 38.858741760253906, 36.99050521850586, 42.270729064941406, 34.03330993652344]"
229,"Well, well.","[[""And the key to the suite is still missing '' .""], [""Acey Squire's station wagon .""], ['A blower is essential for the double-wall shelter and for the underground shelters .'], ['Perhaps he had better have someone help him put up the pegboard and build the workbench -- someone who knew what he was about .'], ['Joking and talking may be freer and easier , but the important factual information is still lacking for far too many newly-married men and women .'], [""That's my wish .""]]","[[-0.16354326903820038], [-0.1036115288734436], [-0.0004340633749961853], [0.09895673394203186], [0.1882649064064026], [0.31997597217559814]]",199.68011474609375,257.9925842285156,"[138.995361328125, 190.61407470703125, 401.81170654296875, 76.0972900390625, 192.11366271972656, 74.4169921875]"
418,Luigi smiled at Tess.,"[[""Don't position your studs before you insert your windows in conventional construction ; ;""], ['He bases his present contention on the general right to explore , indicating that he hopes to find some discrepancy in the resume .'], ['They recognized that slavery was a moral issue and not merely an economic interest , and that to recognize it explicitly in their Constitution would be in explosive contradiction to the concept of sovereignty they had set forth in the Declaration of 1776 that `` all men are created equal , that they are endowed by their Creator with certain unalienable rights , that among them are life , liberty and the pursuit of happiness .'], [""The company sued under the anti-trust laws , alleging that the union's activity interfered with the movement of interstate commerce .""], ['Phil was like that .'], ['Cady appeared slightly mollified .']]","[[-0.18018603324890137], [-0.10292323678731918], [-0.0004683956503868103], [0.09896646440029144], [0.19321012496948242], [0.29507920145988464]]",58.571746826171875,45.27226257324219,"[55.35282516479492, 77.49685668945312, 101.41327667236328, 73.7340087890625, 33.94160461425781, 39.905052185058594]"
224,"“Alright, just thought I would try,” he said kissing her once again before returning to his office, one happy man.","[['The scheme , in theory , is an ingenious adaptation of European registration systems to the conditions of African life .'], ['Production assistance often takes the form of locating tools or materials which are urgently needed .'], [""I'd often find one or other of them up around Dogtown sketching .""], [""As long as the bar prefers to adduce evidence by written deposition , rather than viva voce before an authoritative judicial officer , I fear that the antiquated rules will remain unchanged , and expensive prolixity remain the best known characteristic of Equity '' .""], [""She wouldn't go back to New York as Maude suggested ; ;""], [""She said , `` Well , those are the really interesting things , but if you don't like any of those I can turn over some of my extra typing jobs to you , if you think you can type well enough '' .""]]","[[-0.16668763756752014], [-0.10386908054351807], [-0.0008201524615287781], [0.09903819859027863], [0.19628623127937317], [0.3516542911529541]]",210.02891540527344,99.9579086303711,"[137.0582275390625, 133.43032836914062, 114.8653564453125, 135.1088409423828, 105.12252807617188, 120.37779998779297]"
