target_idx,target_sent,sents_intrp_all_bins,sim_intrp_all_bins,base_PPL,unintrp_PPL,intrp_PPL_all_bins
128,"He immediately began screaming at her, something he had never done.","[['The appeal is going to be to the pocketbook and may be very convincing to those who do not see its relation to political and legal , as well as economic , self-rule .'], ['There is an inwardness and a luster to old furniture ( look at that mahogany highboy behind you ) which has a provocative emanation , if I may say so .'], ['in an instant the doctor was stalking across the room with an antique ledger in his hands , thoroughly eared and big as a table top .'], ['He went on to use objects -- hoops , poles , capes -- which he employed as extensions of the body of the dancer , who moved with them .'], ['`` I get no readings from them at all .'], ['When police arrived the man was still violent , Slate said .']]","[[-0.24353328347206116], [-0.10418381541967392], [-0.0010881796479225159], [0.09866290539503098], [0.19797635078430176], [0.32864081859588623]]",186.1656494140625,103.76111602783203,"[132.41148376464844, 96.91270446777344, 109.8251724243164, 111.6973648071289, 92.4926528930664, 111.70535278320312]"
180,Thinking about Mr.,"[['First , T may not have a single characteristic value ; ;'], ['She then went over them thoroughly giving each a strenuous test in showmanship .'], ['There was nothing he could do but wait .'], ['Sometimes a burst of aggressiveness will sweep over a man -- or his wife -- because he or she feels age creeping up .'], ['I thought : Who is older now ? ?'], ['I had mixed emotions about going .']]","[[-0.20659992098808289], [-0.10177332907915115], [-0.0008348673582077026], [0.09747685492038727], [0.18875998258590698], [0.25725990533828735]]",130.78250122070312,226.56260681152344,"[182.0045928955078, 266.1788330078125, 190.2383270263672, 202.30120849609375, 95.29808044433594, 149.79251098632812]"
203,"“Not meaning to be nosey, but I am curious, what do you do for a living, Ms. Jordan?”","[['This strategy heightened the possibility that we would have a nuclear war .'], ['When this happened , everything stopped .'], [""He turned and looked around at the lobby as though seeing things he hadn't before noticed .""], [""Despite the successful rehabilitation of over a half million disabled persons in the first eleven years after 1943 , the existing program was still seen to be inadequate to cope with the nation's backlog of an estimated two million disabled .""], [""Do you have anything to read while you're shut up ? ?""], [""`` It's Dave who is applying to Hanford College .""]]","[[-0.20913004875183105], [-0.10331703722476959], [-0.0011615380644798279], [0.0983009934425354], [0.19195318222045898], [0.2638070583343506]]",109.72885131835938,110.09494018554688,"[102.54639434814453, 116.10458374023438, 114.78262329101562, 116.68890380859375, 96.04592895507812, 109.7094955444336]"
391,* * * * *,"[['The buddies invariably took advantage of him .'], ['The action is a drop-block , handling all the standard'], ['Each man had a bubble to himself , privacy after the long period of enforced intimacy on board the ship .'], [""Alex explained that they had been out for a stroll before breakfast while the doctor edged around behind him , attempting to hide the protuberance at his left side behind Alex's arm and back .""], ['I shook my head .'], [""Harold Clurman is right to say that `` Waiting For Godot '' is a reflection ( he calls it a distorted reflection ) `` of the impasse and disarray of Europe's present politics , ethic , and common way of life '' .""]]","[[-0.1804494857788086], [-0.10401780903339386], [-0.0006931163370609283], [0.098281130194664], [0.15805654227733612], [0.16989557445049286]]",223.49105834960938,374.2547607421875,"[356.398681640625, 1185.9071044921875, 287.9876403808594, 636.4928588867188, 460.6207580566406, 260.1997375488281]"
366,Tess has a right to be here.,"[['The most common are the twist drill , the solid center shaft with interchangeable cutting blades , the double spur bit , and the power wood bit .'], ['After all , the money dispensed by State goes not to the farmer , the laborer , or the businessman , but to foreigners .'], ['He straightened up , alert now as the buffalo hunter came closer .'], [""Now , Mis-ter McBride '' , said Lord , and he laid a firmly restraining hand on the field boss's arm .""], ['The era , however , is Janus-faced .'], [""`` We aim t' be see-lective , y'know ? ?""]]","[[-0.2203996479511261], [-0.10331679880619049], [-0.0010102740488946438], [0.09851126372814178], [0.1929960995912552], [0.24775925278663635]]",51.38644790649414,40.62965774536133,"[35.71319580078125, 41.803688049316406, 39.62175369262695, 47.90835189819336, 37.8130989074707, 43.10188674926758]"
