target_idx,target_sent,sents_intrp_all_bins,sim_intrp_all_bins,base_PPL,local_unintrp_PPL,local_intrp_PPL_all_bins,global_unintrp_PPL,global_intrp_PPL_all_bins,base_entropy,local_unintrp_entropy,local_intrp_entropy_all_bins,global_unintrp_entropy,global_intrp_entropy_all_bins
23,"""Money is the No.","[[""The clerk wagged his head toward the captain's office ."", 'It was the marine : head lifted , he strained and called .', 'The last night I had called , but the line was always busy and it reassured me .', ""Dylan Thomas's verse had to find endurance in a world of burning cities and burning Jews .""], ['As she reached the kitchen door the answer presented itself ; ;', 'Many of them , moreover , are beginning to complain about the scarcity of Western amusements and to ridicule the old life of the bazaar merchant , the mullah , and the peasant .', 'the ever burning lusts of the flesh or the powerful victory of Holy Spirit discipline .', 'Awkwardly with one hand Matsuo got the cap back on the water bottle .'], ['It was quite an evening ! !', 'There is no question as to just what is available .', 'Could it just be , Theresa wondered , that Anne had understood only too well , and that George all along was extraordinary only in the degree to which he was dull ? ?', ""`` Mough -- it's my mough '' , the man said , trying to talk without moving his lips .""], [""He does not mean , in fact he addresses himself specifically to reject the proposition , that `` if we took the risk of surrendering , a new generation in Britain would soon begin to amass its strength in secret in order to reverse the consequences of that surrender '' ."", 'It is obvious that this is a potential and lucrative source of revenue for the assessors of those towns where a substantial amount of such property would be subject to taxation .', 'Moreover , his testimony at trial never developed any such facts .', 'The Dharma Dictionary , a list of highly unusual terms used in connection with Eurasian proto-senility cults .'], [""-- `` The present recovery movement will gather steady momentum to lift the economy to a new historic peak by this autumn '' , Beryl W. Sprinkel , economist of Harris Trust & Savings Bank , Chicago , predicted at the closing session here Tuesday of Investment Bankers Assn. , California group , conference ."", ""Once there , the D.A. with devilish cleverness would provide Marshall with headlines : `` Viola's Multiple Romances '' `` Viola Lake an Addict '' `` Downfall of Another Film Idol '' ! !"", 'Twenty-seven assessors stated that they were in favor of improved means for assessing movable personal property , and only five were opposed .', 'The New Testament offered to the public today is the first result of the work of a joint committee made up of representatives of the Church of England , Church of Scotland , Methodist Church , Congregational Union , Baptist Union , Presbyterian Church of England , Churches in Wales , Churches in Ireland , Society of Friends , British and Foreign Bible Society and National Society of Scotland .'], ['The Government reported last week that the index of prices received by farmers rose in the month ended at mid-September for the third consecutive month , reaching 242% of the 1910-14 average compared with 237% at mid-July .', 'It told him little more than Mrs. Calhoun had remembered , stating that it had been a small , modest wedding compared to some of the others .', ""It has a great many assets to recommend it and if you haven't made avocado a part of your diet yet , you really should ."", 'It should be admitted , too , that there is a good percentage of lapsed or nonchurchgoing Catholics ( one paper writes 50 per cent ) .']]","[[-0.19138948619365692, -0.19008684158325195, -0.18619093298912048, -0.18437358736991882], [-0.10380471497774124, -0.1037142276763916, -0.10337097197771072, -0.10337051004171371], [-0.0005897814407944679, -0.0005856752395629883, -0.0005524298176169395, -0.0005417317152023315], [0.09804796427488327, 0.09813159704208374, 0.098150834441185, 0.09819946438074112], [0.19075492024421692, 0.19085103273391724, 0.19096235930919647, 0.19120049476623535], [0.254263311624527, 0.25579020380973816, 0.2563815712928772, 0.25920456647872925]]",226.324951171875,165.3505859375,"[174.3306884765625, 209.4027099609375, 168.57420349121094, 168.56239318847656, 156.18946838378906, 188.7252197265625]",214.6935577392578,"[187.30172729492188, 225.7606964111328, 189.48573303222656, 196.29820251464844, 158.9838104248047, 175.06199645996094]",4.75032901763916,4.497068881988525,"[4.601231098175049, 4.594229221343994, 4.5979228019714355, 4.584863185882568, 4.524543285369873, 4.5540595054626465]",4.548386096954346,"[4.574350357055664, 4.588808059692383, 4.552305221557617, 4.554542541503906, 4.568714618682861, 4.562487602233887]"
68,"More recently, UCLA's Lavner led another study reevaluating how a couple's fighting style affected their marriages.","[['The deposit of rupees to the account of the Government of the United States of America in payment for the commodities and for ocean transportation costs financed by the Government of the United States of America ( except excess costs resulting from the requirement that United States flag vessels be used ) shall be made at the rate of exchange for United States dollars generally applicable to import transactions ( excluding imports granted a preferential rate ) in effect on the dates of dollar disbursement by United States banks , or by the Government of the United States of America , as provided in the purchase authorizations .', 'The forced sale of the General Motors stock owned by or allocable to Christiana , Delaware , and the stockholders of Delaware , and deposited with the trustee , would result in a tax to those parties at the capital gains rate .', 'he is a coordinate part of all of the mysterious energy and being and movement .', 'It was then that I availed myself of the rights of a citizen and declared the income tax unconstitutional .'], ['His speed was dropping rapidly .', 'Among current problems that require solutions , participated in by citizens as well as government , are :', 'In accordance with the two-year contract signed in May , 1959 , with the International Association of Machinists , AFL-CIO , wages of hourly employees were increased by 4% in May , 1960 , and pay levels for non-exempt salaried employees were increased proportionately .', 'The Zeitgeist is not crazy as a loon or mad as a March hare ; ;'], ['Macneff stopped pacing to stare at Hal with his pale blue eyes .', 'In the main , this course took the following directional high roads .', 'Where there is a left-hand entry in the ledger , there is a right-hand one , he remembered from his school days .', 'The Sons were out tonight .'], [""While it is easy enough to ridicule Hawkins' pronouncement in Pleas Of The Crown from a metaphysical point of view , the concept of the `` oneness '' of a married couple may reflect an abiding belief that the communion between husband and wife is such that their actions are not always to be regarded by the criminal law as if there were no marriage ."", 'Often , I heard my uncles and cousins speak of it when I was a small boy growing up in Rabaul .', ""She had talked her `` boy friend '' into sending her to New York to take a screen test ."", 'A popular belief grew up after the war that the only time during the Civil War that Thomas ever put his horse to a gallop was when he went to hurry up Stanley for this assault .'], ['If the artist would study his work more thoroughly and move certain units in his design , often only slightly , finer pictures would result .', ""If you can possibly avoid it , you don't hand out any extra chances ."", 'Yet if Washington gets too indignant about Soviet fallout , it will have to do a lot of fast footwork if America decides it too must start pushing up the radiation count .', 'But it was small consolation .'], ['But it may be , also , that he is merely more mindful of athletics than of esthetics at the present time .', ""Besides , 'tain't no more'n right for me to follow with my black oxen , so's I can unhook and pull up fast if either of you get in a pinch '' ."", 'It seemed to him that if the Ferraros felt sure of them , could place them , it would help him to feel more sure of himself with Carla .', 'Yet they keep running from one physician to another , largely to get a willing ear who will listen to their parade of troubles .']]","[[-0.2085101306438446, -0.2075640857219696, -0.2061036229133606, -0.2060236930847168], [-0.10366000235080719, -0.10358733683824539, -0.10357613861560822, -0.10356206446886063], [-0.0008629229851067066, -0.0008297059684991837, -0.0008119703270494938, -0.0007866006344556808], [0.0984518975019455, 0.09846538305282593, 0.09846930205821991, 0.09853337705135345], [0.19358818233013153, 0.1936652958393097, 0.19413237273693085, 0.19425112009048462], [0.24786129593849182, 0.2482663094997406, 0.24844148755073547, 0.24856242537498474]]",148.7038116455078,98.1594467163086,"[100.4213638305664, 97.66902160644531, 106.82777404785156, 100.0236587524414, 115.62006378173828, 99.38095092773438]",98.41219329833984,"[96.60205841064453, 94.42571258544922, 101.81383514404297, 94.44237518310547, 101.65540313720703, 98.01496887207031]",4.521467208862305,4.478574752807617,"[4.529200077056885, 4.436614990234375, 4.56196928024292, 4.516117095947266, 4.523028373718262, 4.463808536529541]",4.349396705627441,"[4.461899280548096, 4.397948265075684, 4.330811977386475, 4.410250663757324, 4.345134735107422, 4.363962650299072]"
85,"In a 2012 paper in the , Shelly Gable, PhD, of the University of California, Santa Barbara, and colleagues found that participants who felt supported by a partner during a positive event, such as receiving a high rating at work, felt better about themselves and about their relationships.","[['Also , when she had bitten off half of the small radish , she found the suspense unbearable ; ;', 'Such was not the case in Rhode Island .', 'And now a million January Guideposts are in circulation .', 'It was too unprecedented .'], ['But this was only accomplished by excessive cruelty and extremes of totalitarian despotism .', 'The skiff was not heading for the nursery , however .', 'Within the units in the National Forest System the pattern of land ownership is quite irregular .', 'For added comfort some of the Italian designed sandals have foam padded cushioning .'], ['Save for brief periods in garrison or winter quarters , soldiers rarely enjoyed the luxury of a writing desk or table .', 'In the second , the fixed elements are the lines which join the vertex , P , to the two intersections of **zg and the plane of the pencil which do not lie on the multiple secant .', ""Certain pianistic traits are common to all five Schnabelian renditions , most notably the `` Schnabel trill '' ( which differs from the conventional trill in that the two notes are struck simultaneously ) ."", 'Complete power not only corrupts but it also attracts the mad .'], [""Even though I have always had a genius for `` throwing myself '' into every role and `` playing it for all it's worth '' , no actress can be expected to do her best work when her fortune , her reputation , her livelihood , her home and her nation itself are all imperilled ."", ""After a moment of thought , her mind cleared and , in the interest of clarity , she typed into the record : `` Shot in the woods '' ."", ""`` We misjudged you '' , he said slowly ."", 'As we find out at the end , it is not the stool ( symbolizing Doris , therefore the English ) that he is punishing but the piece of Venetian blind .'], [""It is the art of relating the finite to the infinite , of doing our best to insure that the particularistic requirements of religious institutions will not thwart God's intent of unity among men more than is minimally necessary ."", ""Miriam said that she must be assured that `` that other woman , Olga , will not be in luxury while I am scraping along '' ."", 'It is evident that Lizzie did not tell everything she overheard between her father and her Uncle Morse .', 'And while every writer must be dealt with as a special case , the interested student will want to ask himself a number of questions about each .'], [""`` I would like to enact a little tableau this afternoon '' , Rector said , He explained about the visit and the effect he wished to create , the picture of a very busy mission ."", ""`` We grind , too '' , he said ."", ""`` He says I'm to take the message '' ."", 'His duty was to write a school text and to teach the entire personnel of the Gabriel how to speak Ozagen .']]","[[-0.20560307800769806, -0.19835162162780762, -0.19828686118125916, -0.19783338904380798], [-0.10328454524278641, -0.10304056107997894, -0.10298823565244675, -0.1028778925538063], [-0.0008214190602302551, -0.000816933810710907, -0.0008080676198005676, -0.0008024652488529682], [0.09829051047563553, 0.09830822795629501, 0.09832120686769485, 0.0983598381280899], [0.1901659369468689, 0.1903260350227356, 0.19040727615356445, 0.19052782654762268], [0.26194727420806885, 0.2623281478881836, 0.2630441188812256, 0.26356205344200134]]",58.69154357910156,45.27212142944336,"[45.620540618896484, 49.51982116699219, 44.7546501159668, 48.26360321044922, 44.390254974365234, 50.51255416870117]",39.11440658569336,"[39.57460403442383, 41.675559997558594, 39.677860260009766, 41.83147048950195, 39.458675384521484, 40.70033645629883]",3.5772581100463867,3.5019264221191406,"[3.4767849445343018, 3.5747275352478027, 3.5681872367858887, 3.493610143661499, 3.474376678466797, 3.5005359649658203]",3.5271642208099365,"[3.5445005893707275, 3.495386838912964, 3.5228359699249268, 3.5018959045410156, 3.4808688163757324, 3.515352487564087]"
106,If you're an artist you take workshops.,"[['Such sections showed bright yellow-green specific fluorescence in the cells of the pseudophloem tissue ( Lee and Black , 1955 ) .', 'Start by laying out the six frames and the transom on a level floor .', 'What could a blockade accomplish ? ?', 'Forty-six of the 53 Juniors who mailed in entries were present .'], ['These contrasting trends in procurement reflect the anticipated changes in the composition and missions of our Armed Forces in the years ahead .', 'or to supply working capital .', 'The examples were plain .', 'The last category overlaps the others in amphibious operations and near terminals and bases .'], ['Thus , for non-negative changes in the basic wage rate , the industry becomes the active wage-setter , since any increase in the basic wage rate can occur only by reason of industry acquiescence .', 'The 300th anniversaries of Staten Island ( through Sept. 23 ) and of Mamaroneck , N.Y. ( through Sept. 24 ) will both include parades and pageants .', 'Harmony , melody , counterpoint symphonic structure are there ; ;', 'You look like a tweedy Englishman .'], ['It was a Cadillac , black grayed with the dust of the road , its windows closed tight so you knew that the people who climbed out of it would be cool and unwrinkled .', 'The degree of saturation depends on the number of hydrogen atoms on the fat molecule .', ""Spahn not only is a superior pitcher but a gentlemanly fine fellow , a ball player's ball player , as they say in the trade ."", 'a friend of mine removing her from the curio cabinet for inspection was felled as if by a hammer , but he had previously drunk a quantity of applejack .'], [""Oldenburg's contributions were soon exhausted and the boys had to turn to a wider circle of the town's learned , such as the pastor , to supplement the simple teaching ."", ""`` and the more the action claims to be total , the smaller is the part of man engaged '' ."", ""In discussing the ways this crisis is germane to consderations for the prevention of illegitimacy , we shall again superimpose Erikson's concept on our data ."", 'Lewis looked at him and began to cry , and then , saying that he was going to make a promise , he asked Blackman to call the porter and to tell him to take out all the liquor that he did not want .'], ['therapist and/or linguist must always consider the alternatives .', ""`` You are bound to get involved with people when you have children '' , Fran had told me at our first meeting , `` so it is good to know that those with whom you get involved are not just dreary little housewives and dull husbands , but People Who Do Things '' ."", ""The man most firmly at grips with the problem is the University of Minnesota's Physiologist Ancel Keys , 57 , inventor of the wartime K ( for Keys ) ration and author of last year's bestselling Eat Well And Stay Well ."", ""It is the art of relating the finite to the infinite , of doing our best to insure that the particularistic requirements of religious institutions will not thwart God's intent of unity among men more than is minimally necessary .""]]","[[-0.17653919756412506, -0.17145881056785583, -0.17007124423980713, -0.17003610730171204], [-0.10583394020795822, -0.10577282309532166, -0.105561263859272, -0.10551492869853973], [-0.0009161932393908501, -0.0008977092802524567, -0.0008458029478788376, -0.0008373772725462914], [0.09874619543552399, 0.09883163869380951, 0.09884757548570633, 0.0988505557179451], [0.1943759322166443, 0.1944548487663269, 0.19447879493236542, 0.1945372372865677], [0.2767569422721863, 0.2767767310142517, 0.276824414730072, 0.2769336402416229]]",197.6966094970703,62.02595520019531,"[63.66029739379883, 66.73851776123047, 60.113609313964844, 60.69956588745117, 73.17015075683594, 65.2421875]",69.97632598876953,"[66.6693115234375, 73.37237548828125, 62.199310302734375, 63.025352478027344, 67.68778228759766, 65.7055892944336]",4.201407432556152,3.728093385696411,"[3.775925636291504, 3.682840585708618, 3.7311630249023438, 3.7544310092926025, 3.7858433723449707, 3.7973921298980713]",3.7169244289398193,"[3.7138736248016357, 3.6663811206817627, 3.668841600418091, 3.6717846393585205, 3.7207539081573486, 3.7835142612457275]"
109,"And the earlier you acquire the tools to maintain a relationship, the better, adds Gottman, who estimates that newlyweds who engage in his programs are three times more likely to succeed than those who wait until they need an intervention.","[['Her initial intelligence tests registered above normal and her adaptation index was unusually high .', 'The many and frequent performances of the Trout serve to emphasize the dual nature of its writing .', ""It is also significant that neither this report nor the hearing officer's notes were furnished to the appeal board ."", 'In the care-free indolence of the East he sees the last reflection of the old happy existence , and for that reason he loves it .'], ['Dependent upon it were posts on the lower Mississippi and the region westward to the frontiers of New Spain .', 'Over the years , enlivened chiefly by disputes about the relative merits of Maine and Idaho potatoes , the menu has pursued its drab all-American course .', 'Another problem in the area of federal-state relationships is this : what constitutes reversible error in a state decision ? ?', 'They are putting strong pressure on their police departments to keep order .'], ['Their names had not come up in any discussions with Laura , and he had no idea what they would be like .', ""This Court's judgment was filed in the District Court on July 18 , 1957 ."", ""Among the particular gems in this collection is the impudent opening song of `` The Garrick Gaieties '' , an impressive forecast of the wit and melody that were to come from Rodgers and Hart in the years that followed ; ;"", 'In the heat of the summer , the garden solitudes were ours alone ; ;'], ['Bedbugs were a common pest in pioneer days ; ;', ""If that picture gets around and I find out you had anything to do with it , I'm going to send a couple of my boys around to see you '' ."", 'Also , I am convinced that if my company were a sole proprietorship instead of a partnership , I would have been even abler to solve long-range problems for myself and my fellow-employees .', ""Forgive the hearts and flowers theme '' .""], ['Was it all vain labor ? ?', 'There is a risk that instead of teaching a person how to be himself , reading fiction and drama may teach him how to be somebody else .', 'It does cost a lot of money for most hobbies but there are hobbies that are for free .', ""You must've known I'd gone to get the sheriff .""], [""Would you like to see my work '' ? ?"", ""No one will even suspect that it is your work '' ."", 'That spring Welcome To Our City was selected for production by the 47 Workshop and it was staged in the middle of May .', ""Make sure you don't pay for holidays that occur when an employee would not otherwise be working .""]]","[[-0.20575696229934692, -0.20382177829742432, -0.19941943883895874, -0.19893918931484222], [-0.10296031087636948, -0.10293745994567871, -0.10285363346338272, -0.10281798243522644], [-0.0009103594347834587, -0.000894404947757721, -0.0008785482496023178, -0.000874396413564682], [0.09690004587173462, 0.09705394506454468, 0.0973050594329834, 0.09731613844633102], [0.17601506412029266, 0.1760866343975067, 0.17636501789093018, 0.17658714950084686], [0.20730264484882355, 0.20936739444732666, 0.21208810806274414, 0.21325641870498657]]",102.76642608642578,104.41213989257812,"[108.22823333740234, 103.06381225585938, 116.53699493408203, 99.9686279296875, 101.69017028808594, 107.00242614746094]",96.64665985107422,"[97.36649322509766, 99.32613372802734, 107.12286376953125, 99.1946029663086, 97.7371826171875, 101.20613098144531]",4.334269046783447,4.256100654602051,"[4.314899921417236, 4.2727274894714355, 4.26771354675293, 4.236563205718994, 4.23748254776001, 4.216042518615723]",4.1886491775512695,"[4.252376556396484, 4.235342502593994, 4.2295732498168945, 4.182821750640869, 4.206437110900879, 4.1758294105529785]"
