target_idx,target_sent,sents_intrp_all_bins,sim_intrp_all_bins,base_PPL,local_unintrp_PPL,local_intrp_PPL_all_bins,global_unintrp_PPL,global_intrp_PPL_all_bins,base_entropy,local_unintrp_entropy,local_intrp_entropy_all_bins,global_unintrp_entropy,global_intrp_entropy_all_bins
22,"In her work with the Early Years of Marriage Project, a longitudinal study of 373 couples who married in 1986 (funded by the National Institutes of Health), Orbuch has found that seven out of 10 pairs name finances a cause of relationship trouble.","[['Instead of inflecting a verb or using an unattached particle to indicate the past or future , Siddo used an entirely different word .', 'Nowhere in the boat do the frames come in contact with the plywood planking .', 'Eleazar , pausing on the Hanover plain , found its great forests and remoteness good and with his own hands built the first College Hall , a log hut dedicated `` for the education & instruction of Youth of the Indian Tribes in this Land in reading , writing & all parts of learning which shall appear necessary and expedient for civilizing & christianizing Children of Pagans as well as in all liberal Arts and Sciences ; ;', ""Ben and Stinky went home an hour ago and people started going to bed '' .""], [""`` The world that was once foot-loose and fancy-free '' , he said , `` has now become screw-loose and frenzy-free ."", 'He who had tried so hard , who had yearned so passionately to be a great officer .', 'If coffee is sold at the cafeteria , let a few workers in each department get it for the whole group .', 'To say this , of course , is to take up a position on one side of a controversy going on now for some two hundred years , or , at any rate , since the beginning of the distinctively modern period in theological thought .'], [""To be sure , when this is pointed out , a common response among certain churchmen is to fulminate about `` the little flock '' and `` the great crowd '' and to take solace from Paul's castigation of the `` wisdom of the wise '' in the opening chapter of First Corinthians ."", 'The same arrangement was used when the Lo Shu was equated with the Nine Provinces ; ;', '`` If Philip Toynbee is claiming that the choice lies between capitulation and the risk of nuclear war , I think he is right .', 'His duty was to write a school text and to teach the entire personnel of the Gabriel how to speak Ozagen .'], [""`` Pittsburgh definitely is the team to beat '' , Mauch said here the other day ."", 'A simplified version of the instrumentation for this procedure is shown in Fig. 2 .', 'None of us was aware that the biggest fight was still ahead .', 'It came from the top of the Reef not half a mile away .'], ['This is an area nearly as large as Western Europe ; ;', 'Two of three report gains', ""It's a horror ."", 'The Great Smoky Mountains is another area of the South well worth a visit .'], ['Rev had stressed the need for money .', 'There was somebody else in the apartment .', 'Protection from other damage', 'It is a sound investment .']]","[[-0.1827775537967682, -0.1820623278617859, -0.18063214421272278, -0.18048952519893646], [-0.10093079507350922, -0.10088423639535904, -0.10077380388975143, -0.10064654052257538], [-0.00030337460339069366, -0.00029686465859413147, -0.00027792900800704956, -0.0002706572413444519], [0.09960807859897614, 0.09961144626140594, 0.09962564706802368, 0.09963499009609222], [0.19474732875823975, 0.19485175609588623, 0.1948992758989334, 0.19547463953495026], [0.2717375159263611, 0.2724105715751648, 0.27296340465545654, 0.27519088983535767]]",88.19522094726562,76.70816802978516,"[81.79267883300781, 80.3465576171875, 82.727783203125, 79.74763488769531, 79.81405639648438, 77.86006927490234]",77.33037567138672,"[79.2638168334961, 79.10210418701172, 79.20064544677734, 76.43699645996094, 77.82614135742188, 78.45240020751953]",3.4738316535949707,3.4743800163269043,"[3.4946906566619873, 3.5371928215026855, 3.5101070404052734, 3.4993557929992676, 3.4973888397216797, 3.521949529647827]",3.5344443321228027,"[3.511875629425049, 3.563687801361084, 3.5403449535369873, 3.52099609375, 3.5422160625457764, 3.556462049484253]"
40,"That includes providing health care, child care and allowances for housing and children.","[['On an impulse , she turned back and said good morning .', 'Then there was North America , where American was the native speech of all except the twenty descendants of French-Canadians living on the Hudson Bay Preserve .', 'Complete the construction and reconstruction of about 79,400 miles of multiple-purpose roads and 8,000 miles of trails .', ""Eugene Lester assembled a witty and explicit score for `` An American Journey '' , and Malcolm McCormick gave it sprightly imaginative costumes .""], [""The Warren Telegraph stated that many of Rev. Trafton's remarks were inappropriate and savored strongly of radicalism and fanaticism ."", ""I'm not pleading for the heart that leaps up when it beholds a rainbow in the sky , or for the heart that with rapture fills and dances with the daffodils ."", ""`` Not the least bit '' , Arlene snapped ."", 'I crossed the beautifully furnished living room to the pale yellow phone .'], ['They felt rough and kind and warm .', 'However , even if the latent demand for demythologization is not nearly as widespread as we are claiming , at least among the cultured elements of the population there tends to be an almost complete indifference to the church and its traditional message of sin and grace .', 'The result was a landslide for the Republican candidates .', 'At Cypress Gardens special bleachers are set up for photographers at water-ski shows and lovely models pose for pictures in garden settings .'], ['In recent years , this burden ( which includes allowances for revenue deficiencies in the passenger business and in less-than-carload freight traffic ! !', 'the drug canceled out his needs for cycles of the body .', 'Some time ago , however , Mr. Khrushchev decided that when bigger bombs were made , the Soviet Union would make them .', 'Let the best sex win .'], [""He served `` with '' him ."", 'McClellan , who had once lost his medical license temporarily on a charge of drug addiction , was with her when she died .', 'In spite of the shading of one type of course into another , I believe it is useful to talk about vocational courses as apart from academic courses .', 'He would not look up .'], ['More typical is the case of a suburban Long Island housewife described by a marriage counselor .', ""A world in which wives have taken a more active role is likely to produce sexual relationships in which wives are more self-assertive , too '' ."", 'He hovered over her to shield her , for spent bullets were thudding against the rear walls .', 'Perhaps his most important private activity was the combination of reading , discussion with a few -- if we can trust his writings to Diodati and the younger Gill , very few -- congenial companions .']]","[[-0.1695510894060135, -0.16893723607063293, -0.1661483198404312, -0.16590732336044312], [-0.10140915215015411, -0.10124564915895462, -0.10123062133789062, -0.10103776305913925], [-0.00033755041658878326, -0.00029379595071077347, -0.00025943294167518616, -0.0002439841628074646], [0.09900598973035812, 0.09900803864002228, 0.09907127916812897, 0.09909024834632874], [0.195746511220932, 0.19588002562522888, 0.1959993541240692, 0.1961243897676468], [0.28543567657470703, 0.28726518154144287, 0.29172760248184204, 0.2929042875766754]]",125.48344421386719,83.25012969970703,"[91.7009048461914, 89.18340301513672, 82.75899505615234, 87.10517883300781, 83.12787628173828, 89.52583312988281]",75.91387176513672,"[81.9746322631836, 76.37097930908203, 77.22602081298828, 78.83027648925781, 75.93309020996094, 83.12787628173828]",3.784634828567505,3.8687260150909424,"[3.860790252685547, 3.8603878021240234, 3.87666654586792, 3.9188263416290283, 3.8786697387695312, 3.8967323303222656]",3.988410711288452,"[3.9151031970977783, 3.9469449520111084, 3.9608354568481445, 4.0016865730285645, 3.934880256652832, 3.978707790374756]"
62,"""Men don't get it from other people in their lives so they especially need it from their female partners or wives,"" she says.","[['A press with an 11 inch capacity lets you drill to the center of a 22 inch board or circle .', 'A systematic approach to development budgeting and programing is one important kind of self-help .', 'She looked out at the corn field , the great green deep acres of it rolled out like the sea in the field beyond the whitewashed fence bordering the grounds .', 'International law had to fit the conditions of Europe , and nothing that could not fit this system , or the interests of the great European nations collectively , could possibly emerge as law in any meaningful sense .'], [""Such proposals look to an apocalyptic act , a kind of Lockian `` social contract '' on a world-wide scale ."", 'We need you to start it .', 'To achieve this destiny , acts as well as words are needed -- not only acts that lead to physical strength but also acts that lead to strength based on right doing and respect .', 'With these maps completed , the inventory phase of the plan has been started .'], ['That got everybody up .', 'There was the slate roof of the church ; ;', 'It has identified itself with the very tension and terror it once did so much to alleviate .', 'The words were hollow .'], ['he could be subjected to law only because he agreed to be .', ""Vincent Berger's mission is a failure because the Ottoman nationalism on which Enver Pasha counted does not exist ."", 'Few people realize that one kiloton of nuclear explosive power will create 1,000 psi overpressure at 100 feet .', 'During the next weeks he looked over the situation .'], ['Helion did not realize it at the time , but it was true .', 'Mike felt disappointed that Mahmoud had left ; ;', 'Arlene was boosting them up when the policeman came by .', 'In between teratologies , she was a pretty and shapely woman ; ;'], [""The wife's attempt at control , these psychologists contend , is sometimes merely a pathetic effort to compel her husband to pay as much attention to her as he does to his job ."", 'Ambushes are laid by those who doubt themselves , as any man may against a tiger .', 'Both man and wife should be aware of the fact that a lack of climax , and even the absence of the anticipated keen pleasure are not a sign that the wife may be cold or frigid .', 'A verse familiar to all grammarians is the quatrain : `` I saw a man once beat his wife When on a drunken spree .']]","[[-0.13976050913333893, -0.13963726162910461, -0.13938337564468384, -0.1371423900127411], [-0.10274972021579742, -0.10271762311458588, -0.10260607302188873, -0.10220585018396378], [-0.00040191784501075745, -0.0003855321556329727, -0.0002774251624941826, -0.00021892599761486053], [0.09959518909454346, 0.09960256516933441, 0.0996205061674118, 0.09965407103300095], [0.19818252325057983, 0.19820082187652588, 0.1983213871717453, 0.19844698905944824], [0.3549779951572418, 0.35507017374038696, 0.3573713004589081, 0.3620038628578186]]",193.71527099609375,153.07107543945312,"[151.35731506347656, 153.38204956054688, 152.43905639648438, 158.31491088867188, 159.89414978027344, 146.67584228515625]",150.53346252441406,"[145.45191955566406, 151.83056640625, 144.61358642578125, 150.05101013183594, 150.0423583984375, 140.94261169433594]",3.916114330291748,3.7954463958740234,"[3.833693504333496, 3.7175333499908447, 3.819708824157715, 3.7880446910858154, 3.7694849967956543, 3.7736446857452393]",3.7119226455688477,"[3.7733309268951416, 3.6988797187805176, 3.7036020755767822, 3.7445881366729736, 3.6885340213775635, 3.7193779945373535]"
70,"After a decade, the most striking difference between the couples who had divorced and the ones who stayed together was how they had handled conflict during their first year of marriage.","[[""Never a `` quick study '' , he now made no attempt to learn his `` lines '' and many a mile of film was wasted , many a scene -- sometimes involving as many as a thousand fellow thespians -- was taken thirty , forty , fifty times because Miss Poitrine's co-star and `` helpmate '' had never learned his part ."", 'More than a streak had ended .', 'It is estimated that more than 600 stations ( of a total of 3,400 ) do a significant amount of programing for the Negro .', ""After a moment of thought , her mind cleared and , in the interest of clarity , she typed into the record : `` Shot in the woods '' .""], ['( On Thursday nobody except Charlie Coe was thinking of Charlie Coe .', 'Outside his window bloomed a beautiful summer day .', 'When the Brown & Sharpe Manufacturing Company reached its 125th year as a going industrial concern during 1958 , it became an almost unique institution in the mechanical world .', 'A second later she came behind the wheel and backed off the anchor line until it was set in the ocean floor .'], [""`` You came well equipped to die '' ."", 'Thus to has light stress both in that was the conclusion that I came to and in that was the conclusion I came to .', 'Shea and his wife , Nori , make their home at Sands Point , L. I. .', 'He lived at 6124 N. Willamette Blvd. .'], [""The commercial propagandist , who can't afford to be critical , gets along well with the amateur , from whom he feeds , but he frequently steps on the analyst's toes by refusing to keep his material genuine ."", 'They recognized that slavery was a moral issue and not merely an economic interest , and that to recognize it explicitly in their Constitution would be in explosive contradiction to the concept of sovereignty they had set forth in the Declaration of 1776 that `` all men are created equal , that they are endowed by their Creator with certain unalienable rights , that among them are life , liberty and the pursuit of happiness .', 'If the investigation committee spent months digesting the thoughtful food served them at the Laboratory School , they left Helva with a morsel as well .', 'If Blanche had been honest , she would have yelled , slammed at least a couple of doors , and thrown a few little , valueless things .'], [""The department needs a clearer `` sense of direction '' at the top and it needs fewer , but better , people , Sen. Jackson says ."", 'the love-making , perhaps because it is pale and low-key when one has been conditioned to expect harsh colors and explicitness , is often charming ; ;', 'In his mood , it was the best way to handle him ; ;', 'Sure , for the most of us , a frankfurter is the favorite .'], [""Treat them right and they'll make a showing every month in the year except the frigid ones ."", ""They're not even food ."", ""They buy some supplies from our colored grocers and they are patronized by some of the best white gentlemen in town '' ."", ""They're doin it now .""]]","[[-0.14811396598815918, -0.14397546648979187, -0.14376136660575867, -0.14257818460464478], [-0.10169520229101181, -0.10151716321706772, -0.10132069885730743, -0.10123340040445328], [-0.00028547830879688263, -0.00025283917784690857, -0.00024145003408193588, -0.00023165158927440643], [0.09958800673484802, 0.0997198224067688, 0.09972411394119263, 0.09974023699760437], [0.19769340753555298, 0.1978052705526352, 0.19785961508750916, 0.19804996252059937], [0.29120072722435, 0.295261949300766, 0.3024572730064392, 0.3044072985649109]]",63.39647674560547,58.48269271850586,"[52.03984832763672, 55.861812591552734, 63.186431884765625, 57.787899017333984, 57.961952209472656, 57.579620361328125]",66.15394592285156,"[53.54123306274414, 56.334022521972656, 59.65845489501953, 55.859073638916016, 64.46847534179688, 59.13446807861328]",3.936660051345825,3.788917064666748,"[3.7579703330993652, 3.822443723678589, 3.693732500076294, 3.7488958835601807, 3.8244924545288086, 3.8236987590789795]",3.9927170276641846,"[3.900198459625244, 3.933009386062622, 3.83091139793396, 3.8385634422302246, 3.9675817489624023, 3.9544613361358643]"
80,"""They're spending time getting to know one another,"" Orbuch says.","[[""Sing Sing's prisoner strike was motivated by a reasonable purpose , a fair break from parole boards ."", ""Some of these apprentices were , in physical strength , already men and doubtless a percentage of them were Spencer's followers ."", 'Since Election Day , Vice President Richard Nixon had virtually retired -- by his own wish -- from public view .', 'A visit in the early spring after a thaw will be very informative .'], ['A fund-raising drive to buy tractors and machinery was launched .', ""His eyes were old and they never saw well , but heated with whisky they'd glare at my noise , growing red and raising up his rage ."", 'in half an hour the reception would be over .', 'Many people seem hopeful , yet it is difficult to predict whether or not there will be any more real attainment of Christian unity in 1961 than there was in 1861 .'], ['administrative organization and delicate diplomatic relations with Top Brass -- British , American and Chinese ; ;', 'The floc particles were all small as the heavier floc settled out .', ""That was almost forty years ago '' ."", 'I sensed no stranger in her .'], ['Kinda like a zombie ? ?', ""one with blood all over it , Arbuckle's blood '' ."", 'SBA serves also as a clearing house for information on products and processes particularly adaptable for exploitation by small firms .', 'The pamphlets are about law , the corporation , forms of government , the idea of freedom , the defense of liberty , the various lethargies which overtake our major institutions , the gap between traditional social ideals and the working mechanisms that have been set in motion for their realization .'], ['The impact of technological factors is also illustrated by the history of the high-energy fuel program .', 'And it was his main present ! !', 'He said tensely , `` All right .', ""He couldn't make out what he was saying .""], [""You've got no business up here '' ."", 'And if you bore each other then , heaven help you .', ""`` What's that you say '' ? ?"", ""Well , why don't you say something '' ? ?""]]","[[-0.18531093001365662, -0.18515148758888245, -0.18494746088981628, -0.18450558185577393], [-0.10054904222488403, -0.10052841901779175, -0.100430428981781, -0.1003885418176651], [-0.0003735143691301346, -0.00029030442237854004, -0.00027028098702430725, -0.0002688579261302948], [0.09863351285457611, 0.0986693948507309, 0.09873571246862411, 0.09884905815124512], [0.1953769028186798, 0.195637047290802, 0.19619150459766388, 0.19635021686553955], [0.3024584949016571, 0.3039473593235016, 0.304618239402771, 0.30508291721343994]]",58.930389404296875,48.08325958251953,"[45.109130859375, 49.732688903808594, 48.56512451171875, 50.75868606567383, 46.818809509277344, 45.64088439941406]",53.91336441040039,"[47.94639205932617, 50.662471771240234, 52.890869140625, 54.70799255371094, 49.880592346191406, 49.009281158447266]",3.9922361373901367,4.070669651031494,"[3.9392361640930176, 4.08691930770874, 4.0233283042907715, 4.0841193199157715, 4.0633111000061035, 4.039178371429443]",4.10513162612915,"[3.9762935638427734, 4.113122940063477, 4.061160087585449, 4.154148578643799, 4.111283302307129, 4.072429656982422]"
