target_idx,target_sent,sents_intrp_all_bins,sim_intrp_all_bins,base_PPL,local_unintrp_PPL,local_intrp_PPL_all_bins,global_unintrp_PPL,global_intrp_PPL_all_bins,base_entropy,local_unintrp_entropy,local_intrp_entropy_all_bins,global_unintrp_entropy,global_intrp_entropy_all_bins
14,"For white men and women as well as black men, the chances are just more than 50 percent, NCHS reports.","[['It was proposed that aerated lagoons be used to eliminate the problem at the existing oxidation ponds and to provide the necessary treatment for the additional development .', 'At dawn Argiento went to Jacopo Galli .', '`` Thrifty of her to use it up .', 'Proceeds realized from these pageants are used by the Jaycees to help support their various youth , health , welfare and community betterment activities throughout the state .'], ['This impressed me , until I realized how limited was his sphere of influence .', 'Article 2 , uses of rupees', ""I was sure that was the difficulty -- she just didn't want to stay here , where she couldn't get to the liquor ."", ""The covers slid down his skinny neck so I saw his head , fuzzed like a dandelion gone to seed , but his face was turned to the wall -- there was the pale shadow of his nose on the plaster -- and I thought , Well you don't look much like a pig-drunk bully now .""], [""Do you have anything for me '' ? ?"", ""Alvin Ailey and Carmen De Lavallade appeared in the first New York performance of Mr. Ailey's `` Roots Of The Blues '' , a work given its premiere three weeks ago at the Boston Arts Festival ."", 'Nineteenth-century virtues , however , seem somehow to have gone out of fashion and the Bright book has never been particularly popular .', 'Rhode Island law specifies that all real estate is taxable in the town in which it is situated .'], ['There are 70 children there and the mothers donate one day a week to the school .', 'As you can count on me to do the same .', 'There was a significantly greater number in this group who reported a desk as being in a tilted position while a tennis ball resting on it remained stationary on the incline .', 'Significantly , the initiation and leadership of a major proportion of the reform movements , especially those in the first half of the nineteenth century , came from men and women of New England birth or parentage and from either Trinitarian or Unitarian Congregationalism .'], ['This matter is of great importance , and the outcome may mean the difference between life or death , or at least serious injuries , for many veterans .', 'You stay with the ladies .', 'Africans and Asians tend to consider not only missions but the local churches they have produced as centers and agents of Western culture and ideology if not of direct political propaganda .', ""It is the only method left for a man to escape from a woman's world .""], ['At least 60 stations devote all of their time to reaching this audience in about half of the 50 states .', 'Indeed , no richer humor is to be found in the whole of American literature than in the letters of the semi-literate men who wore the blue and the gray .', 'It should be admitted , too , that there is a good percentage of lapsed or nonchurchgoing Catholics ( one paper writes 50 per cent ) .', 'The United States was engaged in a military attack on a peaceful , orderly people governed by a regime that had proved itself the most pro-Western and anti-Communist within any of the new nations -- the only place in Africa , moreover , where a productive relationship between whites and blacks had apparently been achieved .']]","[[-0.1685759723186493, -0.16805435717105865, -0.1680057793855667, -0.1669364869594574], [-0.10228665173053741, -0.10226509720087051, -0.10223434865474701, -0.10223329812288284], [-0.0005389899015426636, -0.0005157236009836197, -0.0004836227744817734, -0.0004795510321855545], [0.09886541217565536, 0.0989312157034874, 0.09898706525564194, 0.09902066737413406], [0.18846061825752258, 0.18854522705078125, 0.18940746784210205, 0.18964196741580963], [0.24932828545570374, 0.2496699094772339, 0.25064852833747864, 0.25148630142211914]]",63.931312561035156,63.931312561035156,"[56.06245803833008, 64.73088836669922, 57.11435317993164, 52.65496826171875, 43.54733657836914, 66.91974639892578]",44.92887496948242,"[42.72855758666992, 50.83035659790039, 48.780277252197266, 47.432289123535156, 37.732948303222656, 56.60860061645508]",4.050803184509277,4.050803184509277,"[3.5462701320648193, 4.116395473480225, 3.9266066551208496, 3.381749153137207, 3.827249765396118, 3.57248854637146]",3.2818078994750977,"[3.449021816253662, 4.018527030944824, 3.7113120555877686, 3.352200746536255, 3.7117881774902344, 3.3735663890838623]"
77,It also matters what you talk about.,"[['There was no implication made that their initial reaction ( absence of an arm-elevation ) was less preferred than the presence of levitation .', 'I knew that both these cynics were waiting with impatience for the dramatic moment when Viola was called to the stand .', ""In a sample of new members of Pittsburgh churches , almost 60 per cent were recruited by initial `` contacts with friendly members '' ."", ""He realized now he had more than half hoped he wouldn't find him -- that Muller would not be here , that the attempt would be scheduled for somewhere beyond Hoag's control .""], ['Thomas Douglas , fifth Earl of Selkirk , a noble humanitarian Scot concerned with the plight of the crofters of his native Highlands , conceived a plan to settle them in the valley of the Red River of the North .', 'Occasionally , Seigner draws some justly deserved laughs by his quick shifts from one personality to another .', 'The announcement that the city would sue for recovery on the performance bond was made by City Solicitor David Berger at a press conference following a meeting in the morning with Wagner and other officials of the city and the PTC as well as representatives of an engineering firm that was pulled off the El project before its completion in 1959 .', 'Ludie could be hateful .'], [""Men of more delicate sensibilities referred to this condition as `` looseness of the bowels '' ; ;"", 'He muttered , and took off , obviously feeling like a fool .', 'She is an aggressive , nervous child .', 'Art Lund , a fine big actor with a great head of blond hair and a good voice , impersonates Enright .'], ['`` If I have seemed to emphasize the structure of the composition , I mean to project equal concern for color .', 'and I asked myself a question : Suppose I had the same number of peas as there are atoms in my body , how large an area would they cover ? ?', 'You will probably want to hire someone to do the plowing , however .', 'Nothing is more revealing of the way of life and literary aspirations of this group than their attitude toward sex .'], [""But he'd find out about this one because we were using it ."", 'You might try looking into his wife too .', ""Don't close in your house until everything has been carried in ."", 'and industrial uses for agricultural products .'], ['It is awfully talky , for instance , and not all of the talk is terribly impressive .', ""That's all I know about it and that's all I care '' ."", ""He's informed them of everything you've ever written him ."", 'Then he was asking himself the usual early morning questions : What the Hell am I doin here ? ?']]","[[-0.19092485308647156, -0.19060389697551727, -0.19059598445892334, -0.18953777849674225], [-0.10104981809854507, -0.10104542970657349, -0.10103633999824524, -0.10092692822217941], [-0.0004935264587402344, -0.0004896735772490501, -0.0004785992205142975, -0.0004762532189488411], [0.09812026470899582, 0.09812618046998978, 0.09817780554294586, 0.09821123629808426], [0.19197040796279907, 0.1927168369293213, 0.19334888458251953, 0.19340309500694275], [0.2730206847190857, 0.2731779217720032, 0.27825745940208435, 0.2801806330680847]]",140.61489868164062,140.61489868164062,"[269.3402404785156, 205.75828552246094, 71.43635559082031, 40.208656311035156, 47.93504333496094, 51.76609420776367]",118.63544464111328,"[196.29605102539062, 157.64295959472656, 68.44734191894531, 50.98088836669922, 57.910484313964844, 63.76447296142578]",3.9498260021209717,3.9498260021209717,"[3.774915933609009, 3.7917661666870117, 3.7145590782165527, 3.958306074142456, 3.7961063385009766, 3.7030162811279297]",4.023501873016357,"[3.8962082862854004, 3.7774384021759033, 3.7601895332336426, 3.91328501701355, 3.85555100440979, 3.912820816040039]"
83,Celebrate good times.,"[[""It has a hull patterned on that of the United States navy's Nautilus , the world's first atomic submarine ."", 'The disagreement was over what Dr. Jenkins had said at a previous session and how his remarks appeared in the minutes presented at the following meeting .', ""the Commission on Race and Housing concluded that `` there is no reason to believe that real estate men are either more or less racially prejudiced , on the whole , than any other segment of the American population '' ."", ""As an engineer approaches the plant the position of the home signal is seen in advance when he passes the `` distant '' signal located beyond the limits of the interlocking plant .""], [""She described herself as having the same kind of `` irresponsible '' feeling as she had once experienced under hypnosis ."", ""With Martha's Vineyard on one side and the open sea on the other , it makes an excellent trip of about three hours ."", 'However , we sent a third vessel out , a much smaller and faster one than the first two .', 'William Coddington , who was running the colony , felt constrained to move seven miles south where , with others -- as mentioned above -- he founded Newport .'], ['The phone had been disconnected but telegrams came for him and notes by special messenger .', ""No doubt , there was still a lot in the Draft Program -- and in Khrushchev's speech -- which left many points obscure ."", 'As you have doubtless guessed already , the plot is plastered with Freudian , Jungian , and Meinckian theory .', ""The former President blithely ignored recent history in speaking of `` dollarette '' dollars under Kennedy Administration fiscal policies .""], ['These registries are sponsored by 18 national medical , dental , and veterinary societies and have as their mission the assembling of selected cases of interest to military medicine and of establishing through the mechanism of follow-up of living patients the natural history of various diseases of military-medical importance .', 'The Holy Sacrifice of the Mass with commentary has been televised several times in recent months .', 'The reactionary is confused about the existential status of a decaying tradition , but he does perceive the unity tradition had when it was healthy .', 'The enemy did not veer .'], ['In good time I shall get to the distressing actuality , to Red McIver and Handley Walker , to murder and sudden death .', 'turn just a little .', 'I sat and watched proceedings .', ""I've got a day's work to do .""], [""It's our pleasure ! !"", ""`` Join me in another '' ? ?"", 'Take your time with your drink .', ""`` Hold his head up '' .""]]","[[-0.16500230133533478, -0.16439484059810638, -0.16353589296340942, -0.1633802354335785], [-0.10191626846790314, -0.10173552483320236, -0.10150231420993805, -0.10147866606712341], [-0.0006120912730693817, -0.0005535092204809189, -0.0005423054099082947, -0.0005414420738816261], [0.09860627353191376, 0.09860765188932419, 0.09873868525028229, 0.0987912118434906], [0.19401216506958008, 0.19413870573043823, 0.19414955377578735, 0.19516298174858093], [0.26107773184776306, 0.2624785304069519, 0.26276087760925293, 0.26284295320510864]]",1326.7529296875,1326.7529296875,"[5839.30517578125, 1773.4056396484375, 5364.68603515625, 2650.2080078125, 1099.8128662109375, 623.097412109375]",1190.04345703125,"[6438.15087890625, 1183.674560546875, 2882.225830078125, 2305.03076171875, 1111.0625, 893.8048095703125]",3.9378480911254883,3.9378480911254883,"[4.137945175170898, 3.9526567459106445, 3.8131184577941895, 4.242171764373779, 3.9258975982666016, 4.237109661102295]",4.274341583251953,"[4.162214756011963, 4.17022705078125, 4.1731157302856445, 4.457513809204102, 4.0605998039245605, 4.1128644943237305]"
88,"At that point, the distress of the fire distracts from the appreciation of the alarm.","[['Many years have passed since a Metropolitan audience heard anything comparable .', '`` No one has come .', 'Mr. Nixon , he believes , has no particular political philosophy and mismanaged his own campaign .', 'Let us focus on an atom of calcium from the tip of the bone of my finger and let us suppose that I swallow a magic Alice In Wonderland growing pill .'], ['Dan grinned , and changed the subject .', 'Such sections showed bright yellow-green specific fluorescence in the cells of the pseudophloem tissue ( Lee and Black , 1955 ) .', 'Regina Resnik as Laura and Cesare Siepi as Alvise also were new to the cast , but only with respect to this season ; ;', 'individually they are nearly as mortal as you -- the difference does not seem very marked to us , where it exists .'], ['Tradition has assigned medicinal values to seeds because of their alkaloids , aromatic oils , and highly flavored components .', 'Whole families are moving and removal firms are booked for months ahead .', 'They were headed straight for each other on a collision course .', '`` It never seemed to widen .'], ['This has necessitated a continuous review and reevaluation of the defense program in order to redirect resources to the newer and more important weapons systems and to eliminate or reduce effort on weapons systems which have been overtaken by events .', 'It is not a substitute for sex but a dynamic expression of the creative impulse in unfettered man .', ""`` Did they remember to program a sense of humor , as well , young lady '' ? ?"", ""Or maybe it's sheer xenophobia .""], ['The Faget case was the kind of salvage job the Administration should not have to repeat .', 'As his feet slowed , he felt ashamed of the panic and resolved to make a stand .', 'Actually , he regretted having opened his mouth when the truck came to a stop and the angry driver jumped down from the cab and walked back toward them .', 'Muller was attracted to the lore of mailboxes .'], [""The previous night's horror -- the absolute failure , overcast with the intrusions of the press , had left them all with a wan sense of uselessness , of play-acting ."", 'We knew the enemy was subdued , because a flare was fired as the signal .', 'To get around this quite difficult corner , there is one first aid to objectiveness : prevent the distant sitter from knowing which reading was for him .', 'After the recommendation of the Department is forwarded to the appeal board , that is the appropriate place for a registrant to lodge his denial .']]","[[-0.17175835371017456, -0.17139512300491333, -0.16963070631027222, -0.16846194863319397], [-0.10148417204618454, -0.10145048797130585, -0.10143192112445831, -0.10142844170331955], [-0.0006913580000400543, -0.000672854483127594, -0.0006439220160245895, -0.0006355196237564087], [0.09908599406480789, 0.09908965975046158, 0.09915181994438171, 0.09916209429502487], [0.19604970514774323, 0.1961337924003601, 0.1962657868862152, 0.1962765008211136], [0.27049997448921204, 0.27114641666412354, 0.2719830274581909, 0.2746027112007141]]",61.05356216430664,61.05356216430664,"[63.989505767822266, 65.3923110961914, 65.26175689697266, 80.1546859741211, 69.0403823852539, 56.676204681396484]",43.346038818359375,"[57.325557708740234, 63.20945358276367, 61.79542541503906, 66.3916244506836, 64.5941162109375, 53.3682861328125]",3.857816457748413,3.857816457748413,"[4.061995983123779, 4.097236156463623, 4.208489894866943, 4.143772602081299, 3.7473649978637695, 4.043229103088379]",4.128122806549072,"[4.142671585083008, 4.110997676849365, 4.32057523727417, 4.205140113830566, 3.9622933864593506, 4.173242568969727]"
103,"Perhaps the most important lesson relationship research has taught us is that marriage, like any other commitment, takes conscious effort to preserve, says Nicholas Kirsch, PhD, a couples therapist in Bethesda, Md.","[['The luminous flux gain of a single stage is given by : Af .', 'What are the existing recreation features ? ?', 'I was all set for what came next .', 'In many others , the previous patenting of land under the public land laws , or the way in which land was available for purchase , resulted in a scattered pattern of ownership .'], ['They moved in on him , crowded him from all sides .', 'These poured through the gate and joined the flight .', 'She lived in an ultra-modern house whose decoration , appointments , paint , and even pets were chosen to complement her coloring ; ;', 'What has this to do with the present ? ?'], [""I've drawn his fangs '' , he snapped ."", ""Warren and White each carried , in addition to their own weapons and ammo , a box of ammo for the ROK's machine gun ."", 'Our take-up machines and our twister-coners are undergoing important pilot plant testing for application with new high polymer yarns , in several fiber producing plants .', 'In the main , this course took the following directional high roads .'], [""`` My dress needs some work on it '' ."", 'Eleazar , pausing on the Hanover plain , found its great forests and remoteness good and with his own hands built the first College Hall , a log hut dedicated `` for the education & instruction of Youth of the Indian Tribes in this Land in reading , writing & all parts of learning which shall appear necessary and expedient for civilizing & christianizing Children of Pagans as well as in all liberal Arts and Sciences ; ;', 'but when the bird is found at last , it turns out to be a fake .', 'In rejecting any claim to the value of the slave property , Palfrey was giving up close to $7,000 .'], ['Secretary Hart had taught Jack , at least partially , to be content with small beginnings in all diplomatic matters ; ;', ""And when questioned by ship's reporters about the separation , she said , `` I adore him , and he adores me '' ."", 'Whenever some Washington circles were really ready for talks to eliminate friction they have always succumbed to pressure from the war clique in the Pentagon and in Bonn .', 'Dr. W. B. Bonnor , reader in mathematics at Queen Elizabeth College , London ; ;'], [""It's inevitable in this case , for the couple will be separated for , at the least , forty years ."", 'Perhaps his most important private activity was the combination of reading , discussion with a few -- if we can trust his writings to Diodati and the younger Gill , very few -- congenial companions .', ""`` We have no reason to fear failure , but we must be extraordinarily patient '' , the assistant secretary said ."", 'In their views on dating , courtship , sex , and family life , our students prefer what they are expected to prefer .']]","[[-0.15743398666381836, -0.1570180207490921, -0.15645208954811096, -0.1563825011253357], [-0.10340239107608795, -0.10319150984287262, -0.10315223783254623, -0.10293744504451752], [-0.0005314890295267105, -0.0004930971190333366, -0.0004903208464384079, -0.00048193149268627167], [0.0994940847158432, 0.09949545562267303, 0.09953531622886658, 0.09954947978258133], [0.19695930182933807, 0.19717049598693848, 0.1972995400428772, 0.1973264217376709], [0.3055819272994995, 0.30745434761047363, 0.3074865937232971, 0.3095031976699829]]",145.5843048095703,145.5843048095703,"[139.0916290283203, 121.28641510009766, 139.74208068847656, 124.62024688720703, 126.00225830078125, 99.47624206542969]",109.71582794189453,"[107.36366271972656, 108.10840606689453, 123.50596618652344, 102.67884826660156, 114.41545867919922, 90.28196716308594]",3.8263440132141113,3.8263440132141113,"[3.7958359718322754, 3.9568402767181396, 3.8433213233947754, 3.7660269737243652, 3.8725762367248535, 3.833200693130493]",3.867419481277466,"[3.8440027236938477, 3.978515625, 3.9281089305877686, 3.8294522762298584, 3.8656842708587646, 3.802452802658081]"
