target_idx,target_sent,sents_intrp_all_bins,sim_intrp_all_bins,base_PPL,unintrp_PPL,intrp_PPL_all_bins
73,Education also plays a role.,"[['A glance revealed that the main topgallant mast had been carried away .', 'A glance revealed that the main topgallant mast had been carried away .', 'A glance revealed that the main topgallant mast had been carried away .', ""El Benefactor's vanity grew with his personal wealth .""], ['Mike felt disappointed that Mahmoud had left ; ;', 'After a flood of protests , they were reinstated at the beginning of 1953 .', 'After a flood of protests , they were reinstated at the beginning of 1953 .', 'In the center of his brilliant curls sat a small black skullcap .'], ['Others admitted he was absolutely correct -- he never slept .', 'The entrance to a church has been walled up , so that the congregation , most of which is in the western sector , cannot worship God there anymore .', 'The troop received a new leader , Lieutenant Robert M. Carroll , fresh out of ROTC and bucking for Regular Army status .', 'And he will avoid eye-strain in the process .'], ['Then , as he doubled , gasping , vomiting the breakfast he had so lately eaten , Lord straightened him with an uppercut .', ""This is an issue which boils down to a matter of opinion , depending on whether you're an American or National fan and anti or pro-Yankee ."", ""`` Then see that your youngster has a routine checkup once a year '' ."", ""Always troubled by poor circulation in his feet , he experimented with various combinations of socks and shoes before finally adopting old-style felt farmer's boots with his sheepskin flying boots pulled over them .""], [""It's inevitable in this case , for the couple will be separated for , at the least , forty years ."", ""It's inevitable in this case , for the couple will be separated for , at the least , forty years ."", ""It's inevitable in this case , for the couple will be separated for , at the least , forty years ."", 'The Symphony Of The Air , greatly assisted by Van Cliburn , last night got its seven-concert Beethoven cycle at Carnegie Hall off to a good start .'], [""Then there are a pair of old biddies played by Grace Carney and Sibly Bowan who may be right off the shelf of stock Irish characters , but they put such a combination of good will and malevolence into their parts that they're quite entertaining ."", ""Thus in it's incredible what that boy can eat dominant stress is likely to be on incredible , and eat will have strong stress also ."", 'And while every writer must be dealt with as a special case , the interested student will want to ask himself a number of questions about each .', 'However , there always is some limit to the numbers who will spend the time and effort to acquire training .']]","[[-0.20446257293224335, -0.20446257293224335, -0.20446257293224335, -0.20293192565441132], [-0.10416372120380402, -0.10398626327514648, -0.10398626327514648, -0.10398240387439728], [-0.0007535852491855621, -0.0007386133074760437, -0.0007166843861341476, -0.0007124841213226318], [0.09862987697124481, 0.09868976473808289, 0.09870877861976624, 0.09876950085163116], [0.19460844993591309, 0.19460844993591309, 0.19460844993591309, 0.19467470049858093], [0.28671085834503174, 0.28677886724472046, 0.2871829867362976, 0.2876380383968353]]",101.02503204345703,54.328529357910156,"[145.35671997070312, 64.8705825805664, 58.90720748901367, 104.08365631103516, 83.11075592041016, 53.52472686767578]"
90,It also matters what you talk about.,"[[""We'll still have the rifle , and I might be able to round up some more ."", 'Frozen , they stared at it whirling down the valley , gouging and spitting out boulders and chunks of earth like a starving hound dog cracking marrowbones .', 'Cady put the well-worn chip back on his shoulder .', ""I won't be guilty of trying to run his life '' .""], ['Preparation of frozen sections', 'But theirs defied the detectors .', 'But theirs defied the detectors .', 'Study surface of clay for defects or desired corrections .'], ['Armbro Comet ( Nibble Hanover-Mauri Hanover ) has been in 2:38 .', 'She had tuned her sight to the proper degree .', 'Carruthers crossed the room to a metal door with an open grillework in the top half .', ""`` We have made limited application of the ' parallel ladder ' plan .""], [""This is the principal point made in this final section of Englishman No. 57 , and it caps Steele's efforts in his other writing of these months to counteract the notion of the Tories as a `` Church Party '' supported by the body of the clergy ."", 'Of course we have before us the example of the great races at the galactic center ; ;', 'Of course we have before us the example of the great races at the galactic center ; ;', 'It seemed to him that if the Ferraros felt sure of them , could place them , it would help him to feel more sure of himself with Carla .'], ['Here it is relevant to remember that men commonly regard some causes as more important than their lives ; ;', 'One had to have friends , and a congenial life in after-duty hours .', 'Mr. Herman has managed to mix musical ideas drawn from Israel and the standard American ballad style in a manner that stresses the basic tunefulness of both idioms .', ""Thus in it's incredible what that boy can eat dominant stress is likely to be on incredible , and eat will have strong stress also .""], [""He didn't want us to get married ."", ""They recommended , also , that `` at a fixed hour , let the entire family be assembled for night prayers , followed by a short reading of the Holy Scriptures '' ."", ""In a letter to Meynell , which was written in June , less than a month before Katie's wedding , he was highly melodramatic in his despair and once again announced his intention of returning to the life of the streets : ``"", 'In their views on dating , courtship , sex , and family life , our students prefer what they are expected to prefer .']]","[[-0.19150027632713318, -0.18641403317451477, -0.18310783803462982, -0.1828770786523819], [-0.10376644879579544, -0.10357944667339325, -0.10357944667339325, -0.10312323272228241], [-0.0008787894621491432, -0.0008623115718364716, -0.0007641003467142582, -0.000750148668885231], [0.09882374107837677, 0.09884976595640182, 0.09884976595640182, 0.0988549143075943], [0.19341424107551575, 0.1934552788734436, 0.1937302052974701, 0.193863183259964], [0.2750548720359802, 0.2772495448589325, 0.27832916378974915, 0.27862972021102905]]",140.61489868164062,118.63544464111328,"[56.446468353271484, 242.05935668945312, 84.0608901977539, 124.24436950683594, 89.3492431640625, 55.48130416870117]"
111,"""The positive emotions we get from the change get less and less frequent each time,"" she says.","[['He meandered down Pike Street , past the First National Bank with its green window shades .', 'This was composed last year as a salute to the automobile industry .', 'This was composed last year as a salute to the automobile industry .', 'This was composed last year as a salute to the automobile industry .'], ['Rabb , the former Louisiana State field general , came off the bench for his debut with the Bills Sunday and directed his new team to a 22-12 upset victory over the Houston Oilers , defending league champions .', 'With these maps completed , the inventory phase of the plan has been started .', 'The growing communications needs of this new State can best be met , as they have in other States , through the operation and development of such facilities by private enterprise .', 'He or his deputy or one of their seven assistants , all full colonels , mans the heart of the command post twenty-four hours a day .'], ['He was actually walking down the stairs .', 'She smiled in a sickly-tolerant fashion .', 'Its initial expenses will be paid from appropriations currently available for our foreign aid program .', 'Its initial expenses will be paid from appropriations currently available for our foreign aid program .'], ['If that was the skiff , it was making unprecedented speed .', 'If that was the skiff , it was making unprecedented speed .', 'If that was the skiff , it was making unprecedented speed .', 'If that was the skiff , it was making unprecedented speed .'], ['`` It narrows down down down and finally there is no way out .', 'Mr. Mitchell had an excuse for losing -- the steel strike lasted much longer than he anticipated .', ""Seven years they'd been married ."", ""Seven years they'd been married .""], ['Poverty imposes a kind of chastity on the ambitious .', 'What persuaded the cow-man to remain on Shayol ? ?', ""and my husband hasn't had a vacation in 14 years ."", 'Nothing , however , could be farther from the truth .']]","[[-0.19167813658714294, -0.18843667209148407, -0.18843667209148407, -0.18843667209148407], [-0.10315357148647308, -0.10310516506433487, -0.10302732139825821, -0.10302437841892242], [-0.0007352754473686218, -0.0007279831916093826, -0.0007206238806247711, -0.0007206238806247711], [0.09912353754043579, 0.09912353754043579, 0.09912353754043579, 0.09912353754043579], [0.1926332414150238, 0.19305060803890228, 0.19318515062332153, 0.19318515062332153], [0.259865939617157, 0.2623024880886078, 0.26245200634002686, 0.26290619373321533]]",194.31845092773438,146.43997192382812,"[241.21237182617188, 158.4730682373047, 149.49945068359375, 125.31858825683594, 154.73170471191406, 117.99539184570312]"
11,Those who succumbed to the safer movie-rental routine didn't reap the same benefits.,"[[""A beginner's shotgun has also been introduced this year ."", 'She was ready for her great adventures and the arrival of her mobile partner .', 'They were strays of every kind -- university students and journalists , Village hangers-on and barflies , taxi drivers and editors and unknown poets , as well as friends like Elinor Wylie and William Rose Benet , the Van Dorens and Nathan , Rebecca West and Hugh Walpole and Osbert Sitwell , Laurence Stallings , Lewis Browne , William Seabrook , Arthur Hopkins , the Woodwards .', 'She soared over the new pastor like an avenging angel lest he stray from the path and not know all the truth and gossip of which she was chief repository .'], ['Back in Bavaria he had seen that gesture , and at that sight his heart had always died within him .', 'The very faces of the people bore this expectation of fun and pleasure .', 'During the Han dynasty , another Yin-Yang conception was applied to the Lo Shu , considering the latter as a plan of Ancient China .', 'During the Han dynasty , another Yin-Yang conception was applied to the Lo Shu , considering the latter as a plan of Ancient China .'], ['-- 0.2 gram Dynafac per head daily ( 1 gram of premix per head daily ) for promoting growth , feed conversion , bloom , and full feed earlier .', 'Drunk or sober she was the most attractive woman in the world for me .', 'Drunk or sober she was the most attractive woman in the world for me .', 'Professionally a lawyer , that is to say associated with dignity , reserve , discipline , with much that is essentially middle-class , he is compelled by an impossible love to exhibit himself dressed up , disguised -- that is , paradoxically , revealed -- as a child , and , worse , as a whore masquerading as a child .'], ['I just want you to take a message to Diane Molinari .', 'For cows , feed providing an intake of 0.1 milligram of Aureomycin per pound of body weight daily aids in the reduction of bacterial diarrhea , in the prevention of foot rot , and in the reduction of losses due to respiratory infection ( infectious rhinotracheitis -- shipping fever complex ) .', ""`` Is his appetite improved '' ? ?"", 'Any free elections that were to be held in Poland would have to produce a government in which Moscow had complete confidence , and all pressure from the West for free voting by anti-Soviet elements in Poland would be met by restrictions on voting by these elements .'], ['What persuaded the cow-man to remain on Shayol ? ?', 'What do you want -- a hundred thousand subscribers ? ?', ""I've got a day's work to do ."", 'He would no longer have to see that fat face , hear that whining voice'], ['Less bull the more you can do with em .', ""Is there anything a frustrated individual can do about Communism's growing threat on our doorstep and around the world ? ?"", ""`` Are you trying to cut your throat '' ? ?"", ""If the resulting difference for the particular State is less or more than these extremes , the State's allotment percentage must be raised or lowered to the appropriate extreme .""]]","[[-0.16865669190883636, -0.16855388879776, -0.16591815650463104, -0.16448329389095306], [-0.10314756631851196, -0.103045754134655, -0.10297009348869324, -0.10297009348869324], [-0.0007336810231208801, -0.0007253885269165039, -0.0007253885269165039, -0.000721389427781105], [0.09795455634593964, 0.09800048172473907, 0.09801315516233444, 0.09815733134746552], [0.1773492395877838, 0.17787879705429077, 0.17972925305366516, 0.18004007637500763], [0.2101561725139618, 0.2102413773536682, 0.21101689338684082, 0.21493378281593323]]",522.6298828125,525.72265625,"[524.9756469726562, 680.3104248046875, 660.257568359375, 521.8021240234375, 827.0648803710938, 744.66796875]"
96,,"[['Speaking into the phone again and recognizing the caller , I resumed my everyday voice .', 'In the hall , after adjournment , Dr. Frothingham took him warmly by the hand and requested Parker to visit him -- whereupon our burly Theodore again burst into tears .', 'Far up the valley I could see the Rees circling and reorganizing .', 'Still , there it is .'], [""Woodruff said nothing , and Pike , frustrated , stormed throughout Little Rock in an unsuccessful search for `` Vale '' , asking his friends to keep their ears open ."", 'Putting on local musicians at this place in the program serves a triple purpose : it saves the top flight jazz men from being wasted in this unenviable spot , when the audience is cold , restless , and in flux ; ;', 'Two data centers have been established for the collection , indexing , critical evaluation , and dissemination of bibliographies and critical values in the fields of transition probabilities and collision cross sections .', ""So I have heard '' .""], [""The theme of Rhode Island Heritage Week for 1961 will be `` Independence and Union '' ."", 'Gray Eyes was in the lead .', 'But it was small consolation .', 'But it was small consolation .'], ['That got everybody up .', 'Perhaps it was insane , Pamela thought .', 'Preparation for Church membership begins immediately after the commitment is received .', 'Preparation for Church membership begins immediately after the commitment is received .'], ['When it is done between races or nations , it is called making a treaty .', 'When it is done between races or nations , it is called making a treaty .', 'Here is the promise of a vacation trip they can afford .', 'When a man is laid to rest , he is entitled to stay put .'], ['It gives , indeed , cause for rejoicing to remember what many catastrophes of the past produced ; ;', 'That , I thought , is at least one thing I can find out when we meet .', 'It was nice to have something a little up-to-date for a change .', ""He oughta be able to build a new house with all them contraptions '' .""]]","[[-0.18493947386741638, -0.1847320795059204, -0.1841612458229065, -0.18340647220611572], [-0.10415393114089966, -0.1041388139128685, -0.10387100279331207, -0.10380984097719193], [-0.000547211617231369, -0.0005246251821517944, -0.0005110278725624084, -0.0005110278725624084], [0.098408542573452, 0.09847508370876312, 0.09861187636852264, 0.09861187636852264], [0.18842364847660065, 0.18842364847660065, 0.18859633803367615, 0.18897664546966553], [0.2397918403148651, 0.24097101390361786, 0.24097195267677307, 0.24242787063121796]]",,,
