target_idx,target_sent,sents_intrp_all_bins,sim_intrp_all_bins,base_PPL,unintrp_PPL,intrp_PPL_all_bins
128,Tess was shocked.,"[['The appeal is going to be to the pocketbook and may be very convincing to those who do not see its relation to political and legal , as well as economic , self-rule .', 'This may be helpful in improving the competitive position of established firms through diversification and expansion or through more economical utilization of plant capacity .', 'Nevertheless I consider it reasonable , because of my commitment as an artist , to assume that the rights and responsibilities of creative individuals are related to humanity as a whole rather than to specific geo-political interests .', 'Thus , if we are to observe American folklore in the twentieth century , we will do well to establish the relationships between folklore , nationalism and imperialism at the outset .'], ['There is an inwardness and a luster to old furniture ( look at that mahogany highboy behind you ) which has a provocative emanation , if I may say so .', 'There is an inwardness and a luster to old furniture ( look at that mahogany highboy behind you ) which has a provocative emanation , if I may say so .', 'somewhat less likely sources are the heavier hydrides SH , SiH , and Aj .', 'Instead , the audience can sit back at ease and , from the perspective of an enlightened time which no longer believes in such things , enjoy the dead seriousness with which the characters in the play take the witches and devils which are under discussion .'], ['in an instant the doctor was stalking across the room with an antique ledger in his hands , thoroughly eared and big as a table top .', 'I loved the city and I particularly loved the gaiety and spirit of Mardi Gras .', 'The hospitals contain patients trampled by elephants or run over by sports cars .', ""`` I'm an advertising hustler , I admit , but I have to get hot once in a larger sphere .""], ['He went on to use objects -- hoops , poles , capes -- which he employed as extensions of the body of the dancer , who moved with them .', ""Raymond Fox reported that the orchestra had hastily rehearsed `` Cradle Song '' in case it was needed ."", 'I sat and watched proceedings .', 'I sat and watched proceedings .'], ['`` I get no readings from them at all .', 'He did receive a resume of it -- the same that was furnished the appeal board -- and he made no claim of its inaccuracy .', 'None of them reached our walls again .', 'The dependable Wright engine was never stopped on these trips .'], ['When police arrived the man was still violent , Slate said .', 'Every movement she made seemed unnecessarily noisy .', ""There was a ragged edge to her voice now , as if she'd been crying ."", ""`` That's one thing I've never done '' , she said promptly .""]]","[[-0.24353328347206116, -0.22648870944976807, -0.21859252452850342, -0.21543344855308533], [-0.10418381541967392, -0.10418381541967392, -0.10414154082536697, -0.1040281131863594], [-0.0010881796479225159, -0.0010734274983406067, -0.0010310690850019455, -0.0010072095319628716], [0.09866290539503098, 0.09866455942392349, 0.09869024157524109, 0.09869024157524109], [0.19797635078430176, 0.1980302929878235, 0.19804802536964417, 0.19809600710868835], [0.32864081859588623, 0.32885029911994934, 0.3290999233722687, 0.32923561334609985]]",45.77351379394531,32.93121337890625,"[113.82113647460938, 79.7414779663086, 55.7747802734375, 29.82455062866211, 28.372241973876953, 25.497039794921875]"
180,"David, holding Carla in his arms, Kohana, Sam, and Ted were also shocked.","[['First , T may not have a single characteristic value ; ;', 'There was no extra horse so it was left to his comrades who , though numbering in the fifties , had stood around on the hillside nearby without firing a shot during the entire attack .', 'The water was there , so much of it that it spread all through the dead orchard .', 'Only in Europe have our lines remained firm -- and there only on the surface .'], ['She then went over them thoroughly giving each a strenuous test in showmanship .', 'This tool can also be made with a lathe .', 'It is the power that holds the stars in their orbits , but allows the wind to bend a blade of grass .', 'It is the power that holds the stars in their orbits , but allows the wind to bend a blade of grass .'], ['There was nothing he could do but wait .', 'In the event the total of rupees accruing to the Government of the United States of America as a consequence of sales made pursuant to this Agreement is different from the rupee equivalent of $1,276 million , the amounts available for the purposes specified in paragraph 1 , Article 2 , will be adjusted proportionately .', 'There were several men of ninety or more whom I knew first or last , all of whom were still productive and most of whom knew one another as if they had naturally come together at the apex of their lives .', 'Strings keep souls in place'], ['Sometimes a burst of aggressiveness will sweep over a man -- or his wife -- because he or she feels age creeping up .', 'Half slyly he enjoyed seeing her stoop to lift the things .', 'Now let us see where this power comes from .', 'He is the sexton of the church .'], ['I thought : Who is older now ? ?', ""I'll switch on the floods '' ."", ""I'll switch on the floods '' ."", 'Could it do otherwise ? ?'], ['I had mixed emotions about going .', 'Consider him seriously , therefore ? ?', ""`` For Christ's sake '' ! !"", ""What do you think I did with them '' ? ?""]]","[[-0.20659992098808289, -0.2008371353149414, -0.19643652439117432, -0.19466184079647064], [-0.10177332907915115, -0.10173383355140686, -0.10166873037815094, -0.10166873037815094], [-0.0008348673582077026, -0.0008270079270005226, -0.0008228681981563568, -0.0008063912391662598], [0.09747685492038727, 0.09748858213424683, 0.09751740097999573, 0.09753869473934174], [0.18875998258590698, 0.18943801522254944, 0.18943801522254944, 0.19010889530181885], [0.25725990533828735, 0.25851577520370483, 0.2599460482597351, 0.26099133491516113]]",23.890514373779297,20.262296676635742,"[23.670726776123047, 26.85567855834961, 23.386350631713867, 22.554773330688477, 23.458965301513672, 24.524688720703125]"
203,"“Oh, you do, these are pretty big apartments.”","[['This strategy heightened the possibility that we would have a nuclear war .', 'As construction progresses , the volume of storm drainage will be sharply reduced .', 'A clot forms at the site , seals off the flow of blood to the heart and provokes a heart attack .', 'We opened on Friday and closed the following Monday .'], ['When this happened , everything stopped .', 'I felt the anger mount within me .', 'And shivering with shame , he crawled to the narrow end of the rock and spat into the water .', 'On that date , according to Gregorio , Huff left his home and took a room in the New Lawrence hotel at 1020 Lawrence Av. .'], [""He turned and looked around at the lobby as though seeing things he hadn't before noticed ."", ""`` Djangology '' , made up of tracks he recorded with Stephane Grappelly and the Quintet of the Hot Club of France ."", 'Locker-room talk often stresses the idea that a man is doing the girl a favor if he is forceful and ruthless during the first penetration .', 'Locker-room talk often stresses the idea that a man is doing the girl a favor if he is forceful and ruthless during the first penetration .'], [""Despite the successful rehabilitation of over a half million disabled persons in the first eleven years after 1943 , the existing program was still seen to be inadequate to cope with the nation's backlog of an estimated two million disabled ."", ""Despite the successful rehabilitation of over a half million disabled persons in the first eleven years after 1943 , the existing program was still seen to be inadequate to cope with the nation's backlog of an estimated two million disabled ."", ""Despite the successful rehabilitation of over a half million disabled persons in the first eleven years after 1943 , the existing program was still seen to be inadequate to cope with the nation's backlog of an estimated two million disabled ."", ""The Thrift Shop , with Mrs. Bernhard S. Blumenthal as president , is one of the city's most successful fund-raisers for the Federation of Jewish Agencies .""], [""Do you have anything to read while you're shut up ? ?"", ""Do you have anything to read while you're shut up ? ?"", 'Your 16 year old son earned $720 in 1961 .', ""Can't you stay with what you have and wait till the dust settles '' ? ?""], [""`` It's Dave who is applying to Hanford College ."", ""`` Why don't you name him Jesus Christ ! !"", ""`` You are bound to get involved with people when you have children '' , Fran had told me at our first meeting , `` so it is good to know that those with whom you get involved are not just dreary little housewives and dull husbands , but People Who Do Things '' ."", ""`` You are bound to get involved with people when you have children '' , Fran had told me at our first meeting , `` so it is good to know that those with whom you get involved are not just dreary little housewives and dull husbands , but People Who Do Things '' .""]]","[[-0.20913004875183105, -0.19686535000801086, -0.1937934309244156, -0.19371888041496277], [-0.10331703722476959, -0.10322181135416031, -0.10320451855659485, -0.10316698998212814], [-0.0011615380644798279, -0.001146840862929821, -0.0011317580938339233, -0.0011317580938339233], [0.0983009934425354, 0.0983009934425354, 0.0983009934425354, 0.09855280071496964], [0.19195318222045898, 0.19195318222045898, 0.19197909533977509, 0.19218337535858154], [0.2638070583343506, 0.2649628221988678, 0.26532822847366333, 0.26532822847366333]]",188.8760986328125,88.93590545654297,"[114.56619262695312, 109.28150939941406, 138.32394409179688, 218.4700927734375, 86.14105224609375, 129.67893981933594]"
391,I see you have conquered your Mr.,"[['The buddies invariably took advantage of him .', 'The buddies invariably took advantage of him .', 'The skiff was not heading for the nursery , however .', 'Forty-six of the 53 Juniors who mailed in entries were present .'], ['The action is a drop-block , handling all the standard', 'The Tax Court rejected this view .', ""Once again B'dikkat moved among them like a father ; ;"", ""Once again B'dikkat moved among them like a father ; ;""], ['Each man had a bubble to himself , privacy after the long period of enforced intimacy on board the ship .', 'Past it I could see part part of a desk , a flag in a corner , a rug on the floor .', 'The bill is designed to provide special schooling for more deaf students in the scholastic age at a reduced cost to the state .', 'Creighton Hague sat in his office above the Ione pit .'], [""Alex explained that they had been out for a stroll before breakfast while the doctor edged around behind him , attempting to hide the protuberance at his left side behind Alex's arm and back ."", ""Done in the modern style of a `` confession '' , Fink tells in exquisite detail how he came to know , and , more important , love his mother's pet salamander , Alicia ."", 'If he were to go with White , he would be out there two days , not just listening in the dark at some point between here and Papa-san , but moving ever deeper into enemy land -- behind Papa-san -- itself .', 'The need is for reference works of a more specialized nature than individual libraries , adequate to satisfy everyday needs , could afford .'], ['I shook my head .', ""Old Mr. Pocket's frantic response to life imprisonment with a useless , social-climbing wife is to `` put his two hands into his disturbed hair '' and `` make an extraordinary effort to lift himself up by it '' , whereas Joe Gargery endures the shrewish onslaughts of Mrs. Joe by apologetically drawing `` the back of his hand across and across his nose '' ."", 'The policeman got a confused , funny look on his face , and he had answered kind of politely , `` Now , look here , lady : I know you got to entertain these kids and all .', ""`` -- had enough brains to call ya up so as ya could do sompin about it when the parents -- I coulda let her go go '' -- His eyes were lowered , so he couldn't have seen the narrow , pointed face of his companion suddenly writhe with fury ; ;""], [""Harold Clurman is right to say that `` Waiting For Godot '' is a reflection ( he calls it a distorted reflection ) `` of the impasse and disarray of Europe's present politics , ethic , and common way of life '' ."", ""He contends this idea doesn't conflict with experiments on which the principle of conservation of matter and energy is based because some slight error must be assumed in such experiments ."", ""He contends this idea doesn't conflict with experiments on which the principle of conservation of matter and energy is based because some slight error must be assumed in such experiments ."", ""Well , don't worry .""]]","[[-0.1804494857788086, -0.1804494857788086, -0.17777562141418457, -0.17657455801963806], [-0.10401780903339386, -0.1038999855518341, -0.10373949259519577, -0.10373949259519577], [-0.0006931163370609283, -0.0006744693964719772, -0.0006723497062921524, -0.0006505018100142479], [0.098281130194664, 0.09828420728445053, 0.09847772866487503, 0.09848865866661072], [0.15805654227733612, 0.15844056010246277, 0.15852995216846466, 0.15939152240753174], [0.16989557445049286, 0.17090249061584473, 0.17090249061584473, 0.1720997542142868]]",116.23680114746094,101.2197494506836,"[231.56198120117188, 122.4208984375, 246.79010009765625, 146.43272399902344, 109.82003784179688, 276.29022216796875]"
366,"Congratulations, Tess.","[['The most common are the twist drill , the solid center shaft with interchangeable cutting blades , the double spur bit , and the power wood bit .', 'The Twenty-second Soviet Communist Party Congress opens in Moscow today in a situation contrasting sharply with the script prepared many months ago when this meeting was first announced .', 'Sample units ( villages in rural areas , houses in cities ) were drawn systematically within these strata .', 'And his performances attracted much attention , as the frequency of his surviving pieces in any calendar that may be set up for his undergraduate activities testifies .'], ['After all , the money dispensed by State goes not to the farmer , the laborer , or the businessman , but to foreigners .', 'In that beautiful place , among all those companionable and attractive people , he sat and smiled .', 'The fumes of progress are in his nose and the bright steel of industry towers before his eyes , but his heart is away in Yoknapatawpha County with razorback hogs and night riders .', 'Twelve projects proposed by private groups are at the contract-negotiation stage , Gordon Boyce , director of relations with the voluntary agencies , said in a Washington interview .'], ['He straightened up , alert now as the buffalo hunter came closer .', 'We straightened Pops up and I made sure there was no trace of a heartbeat .', 'With the source of light behind the copy , there is no loss of lumen output , as with conventional boards illuminated by means of reflected light .', 'With the source of light behind the copy , there is no loss of lumen output , as with conventional boards illuminated by means of reflected light .'], [""Now , Mis-ter McBride '' , said Lord , and he laid a firmly restraining hand on the field boss's arm ."", ""Helva's class was doing Fine Arts , a selective subject in her crowded program ."", ""Helva's class was doing Fine Arts , a selective subject in her crowded program ."", ""Wasn't the owl her symbol '' ? ?""], ['The era , however , is Janus-faced .', 'Further , the gland is able to re-use a larger fraction of the thyroid hormone de-iodinated peripherally .', 'And the league takes a stand , with great regularity , on the side of right .', 'Turning to the reporters , she asked , `` Did you hear her ? ?'], [""`` We aim t' be see-lective , y'know ? ?"", ""`` I don't know , Tom ."", ""`` I don't know , Tom ."", ""`` She flew beautifully '' , said Fiedler .""]]","[[-0.2203996479511261, -0.21055284142494202, -0.2103540599346161, -0.20910799503326416], [-0.10331679880619049, -0.10329104959964752, -0.1032446026802063, -0.10315465182065964], [-0.0010102740488946438, -0.0010070065036416054, -0.000992320477962494, -0.000992320477962494], [0.09851126372814178, 0.09853008389472961, 0.09853008389472961, 0.09860804677009583], [0.1929960995912552, 0.193070650100708, 0.1933014988899231, 0.19335272908210754], [0.24775925278663635, 0.24803103506565094, 0.24803103506565094, 0.24828791618347168]]",213.35113525390625,176.88088989257812,"[229.16920471191406, 208.00241088867188, 383.1396789550781, 106.44320678710938, 70.29232788085938, 72.82547760009766]"
